bakwjh,https://www.reddit.com/r/opiates/comments/bakwjh/fever_nausea_and_sicknesshelp/,10,https://redd.it/bakwjh,JimBurlin,"Fever, Nausea and sickness.(Help)","I am not a regular opiate user. I typically take half of a 30mg oxy when my back pain is unmanageable. I do on the other hand take xanax to help me sleep at night. I took 15mg of oxy at about 8pm,ate, went to bed at 12PM and woke up at 2AM with intense night sweats/fever and extreme nausea/puking/stomach pains until about 9AM. I was sick the rest of the day. This exact issue happened once before about 4 months prior. Is this from eating too much? the mixture of the xanax and oxy? Has anyone experienced this before? I have simply puked before in the past from taking it on an empty stomach but felt 100% immediately after, NOTHING like this. Any advice/info would be beyond appreciated.",1554669893.0
bakq5q,https://www.reddit.com/r/opiates/comments/bakq5q/pills_for_planes_need_helpadvice/,13,https://redd.it/bakq5q,b1922,Pills for Planes- NEED HELP/ADVICE!,"So I'm going on vacation for 3 weeks and staying with some friends. I want to bring 75-100 oxycodone 30mgs for us. I have a carry-on only and I plan on putting them in a prescription pill bottle that has my name on it and putting them with the rest of my packed toiletries. Will that be okay? The two pill bottles have my name on them, but they are for different medications. 

Do you think it's a non-issue? What do you recommend?..I can try and find a large OTC generic pill bottle or sorts at Walgreens, but feel the pill bottle with my name should be okay.

THANK YOU FOR SHARING YOUR INPUT!",1554668909.0
bakpxf,https://www.reddit.com/r/opiates/comments/bakpxf/zantac_shooting_dope/,3,https://redd.it/bakpxf,china4whore,Zantac + shooting dope?,Does this really work or would I just be wasting money that could be going to fuel the beast in my veins??,1554668874.0
bakn9u,https://www.reddit.com/r/opiates/comments/bakn9u/using_ds_on_top_of_suboxone/,2,https://redd.it/bakn9u,mrpaul1111,Using Ds on top of Suboxone,"I’ve been using like 24MG per hang on top of like 4-8MG suboxone and it has been working. Not the same rush but still makes me nod and feel hella good. 

Why doesn’t suboxone block for some of us?

I used to do ECP and sub never blocked it or kept me from being sick. With pills Subs def work to stop WDs. ",1554668466.0
bakn4q,https://www.reddit.com/r/opiates/comments/bakn4q/one_more_day_until_i_receive_a_7500_cheque_in_the/,60,https://redd.it/bakn4q,zionjohnston,One more day until I receive a 7500$ cheque in the mail. And of course I’m broke and sick til tmrw,My dad died a few years back and I put some cash into an investment portfolio. Tomorrow I am receiving 7500$ from the investment. I’ve got a few plans for the cash but I know a lot of it wil go to drugs. Mostly heroin and probably some crack. The shitty part is I’m in withdrawal waiting for the mailman to show up with the cheque tomorrow lol. As much as it sucks it will be such a great feeling of relief when it finally arrivez. Can’t wait to call the plug up and order a 1000$ sac. Cheers and happy nods,1554668445.0
bakg8e,https://www.reddit.com/r/opiates/comments/bakg8e/whats_a_good_metal_tooter/,8,https://redd.it/bakg8e,lt420lt,What's a good metal tooter?,"I've been using straws but I sometimes burn a little because i touch the foil with the straw when I'm fucked up. It's definitely not healthy 

I need suggestions for metal tooters please ",1554667400.0
bakeqn,https://www.reddit.com/r/opiates/comments/bakeqn/whats_a_good_dosage_for_tramadol/,4,https://redd.it/bakeqn,Maorikur,What's a good dosage for tramadol?,"I'm planning to take some but I'm not sure if 200mg is enough to feel much, given that I barely felt 150mg the last time I tried them",1554667184.0
bais94,https://i.redd.it/mfkt2hqkovq21.jpg,11,https://redd.it/bais94,Foppqueen2030,Happy Sunday folks,,1554658563.0
bak5cg,https://www.reddit.com/r/opiates/comments/bak5cg/false_positives_on_at_home_drug_test/,10,https://redd.it/bak5cg,nychockeyplaya,False positives on at home drug test,"Did cocaine recently and bought a 12 panel test for like $50 at Duane reade to prove to my gf that I haven’t used any opiates.  Well the fuckity mother fucking test popped for coke and OXY. What the flying fuck.  

I haven’t used oxy in over six months and I am on vivitrol.  The only explanation I can think of is my dealer cut his coke w Oxy? Nfcih. 

Anyone else experience false positives from these shit tests?  ",1554665792.0
bak056,https://www.reddit.com/r/opiates/comments/bak056/anyone_else_shoot_coke_to_help_ease_wd_symptoms/,14,https://redd.it/bak056,darkside0fthesp00n,Anyone else shoot coke to help ease WD symptoms?,I only do tiny shots but it really seems to help when I run out of boy. ,1554664991.0
bajpu9,https://www.reddit.com/r/opiates/comments/bajpu9/are_tramadols_even_worth_it_or_should_i_go_with/,12,https://redd.it/bajpu9,truthandhonesty1,Are tramadols even worth it? Or should I go with something else?,I’ve taken some before and it was a nice high when I had no opiate tolerance and I’ve not done any opiates in about 4 weeks so maybe that lowered my tolerance a bit. Not sure. I’m just wondering if it’s even worth it to buy these (I’m asking because I can get them cheaper then what else I can get and also a larger amount) or just get dope or some hydro or oxys instead. ,1554663443.0
bajfe1,https://i.redd.it/m6x78hjjyvq21.jpg,38,https://redd.it/bajfe1,youngflexateli-,Some of the best presses I’ve seen around. Damn these lil fuckers smack thoo!,,1554661926.0
baiym6,https://www.reddit.com/r/opiates/comments/baiym6/questions_for_those_put_there_dabbing_their_tar/,5,https://redd.it/baiym6,Bucks_trickland,Questions for those put there dabbing their tar,What kind of setup do you use? Titanium nail? Glass nail? Any tips or tricks you care to share?,1554659521.0
bais6n,https://www.reddit.com/r/opiates/comments/bais6n/that_moment_when/,31,https://redd.it/bais6n,Herpderp688,That moment when...,You’re 48hours into withdrawals searching for something you know isn’t there because you would have found it the last 20 times looking lol and come across a long forgotten 100mcg fentanyl patch and a 50mcg patch thank god no more sickness for the next little bit lol happy nods opifam hope you all have a wonderful day😁,1554658553.0
baiqc7,https://www.reddit.com/r/opiates/comments/baiqc7/heroin_and_food/,14,https://redd.it/baiqc7,voitchita,Heroin and food,"Just curious, I usually shoot my heroin on a mostly empty stomach. I usually eat 2 or three hours after, if not longer. Do you do the same thing? Or do some people like to have something to eat before they use? I always thought that the high was better on an empty stomach but that might not be true. ",1554658267.0
baijfh,https://www.reddit.com/r/opiates/comments/baijfh/has_anyone_else_seen_crystalline_heroin/,15,https://redd.it/baijfh,4LG4MBL3,Has anyone else seen Crystalline Heroin,"I've been getting my gear from a new plug. I'm a tad suspicious though, the price I'm getting .5 for £20. But the main suspicion is the gear itself, it's comes as rocks, crystalline rocks (Looks like brown the brown mdma/mda that you get). It does run  a gorgeous golden color on foil, but doesn't seem that strong. It tastes of gear definitely too. I'm just wondering if maybe I've been getting an RC version of gear, whence the price. I've seen rocky gear before but never crystals? Has anyone  else came across this form or know anymore about what it could be if not gear? ",1554657260.0
bahuc8,https://www.reddit.com/r/opiates/comments/bahuc8/methadone_and_oxy_question/,12,https://redd.it/bahuc8,gabby0517,Methadone and oxy question!,"Have any of you ever used low dose  methadone if you happen to run out of your pain script early or can’t pick up from the plug? This happened to me this week, there was a 5 day gap from once I ran out of my 4 10mg oxy/daily. I had on hand from a friend 1.5 10mg tablets. Since Wednesday night when I ran out I’ve been taking 2.5 about every 24 hours. Will my withdrawal come back? I get my refil on Tuesday. Just wondering if any of you had ever swapped out the methadone and if so did it also seem to kee your tolorance high? Thanks in advance I’m new to methadone and just started the oxy less than a year ago. ",1554653462.0
baicw5,https://www.reddit.com/r/opiates/comments/baicw5/high_fat_foods_potentiation_question/,9,https://redd.it/baicw5,TotalBath,High fat foods potentiation question?,Do you eat before or after and how long before or after. I’d be eating something small but high in fat like some spoonfuls of peanut butter or something. This is for oral oxycodone.,1554656335.0
baduo7,https://www.reddit.com/r/opiates/comments/baduo7/got_wisdom_teeth_pulled_2_other_teeth/,11,https://redd.it/baduo7,crazyeyeszz,Got wisdom teeth pulled + 2 other teeth,"I need to Fucking know what was in that anesthesia. Right went they filled.my veins with that shit I felt like I was in fucking space and immediately started nodding off. My parents won't show me the bill because thier afraid I'm going to go and buy it on the street as I've struggled with ice before and they don't want me getting hooked on something again. Obviously I'm going to try to find out what it was and do it, and u guys are the only ones that understand what that feels like. I've done some research and I think it was  fentanyl and ketamine but I'm not 100% sure and I wanna buy the right dope. It's a very common corporate dentist so what they used for the standard procedure should be know but I cant find what is was exactly Anybody know what it might be they gave me? it had to be stronger then morphine I almost know that for a fact.",1554620880.0
bads2i,https://www.reddit.com/r/opiates/comments/bads2i/what_was_your_best_worst_experience_with_otc/,3,https://redd.it/bads2i,Kinghead,What was your best & worst experience with OTC medications ?,DXM etc ,1554620124.0
bai6v3,https://www.reddit.com/r/opiates/comments/bai6v3/sick_sunday/,11,https://redd.it/bai6v3,dillydillythrowaway2,Sick Sunday...💊,"Well fellow opiate enthusiasts, it's the time of the week where I seem to run out/be unfathomably sick.. Fuck dilaudid and it's crackiness.

I think Sunday is always my sick day because my dealer is my doctor, and motherfucker don't work on weekends. Walk in clinics (urgent cares) in Canada aren't allowed to prescribe narcotics, which is reasonable, and the hospital is a 12 hour+ wait to see a doctor on the weekends cause people are looking for doctors notes to get out of work Monday.

taking some shitty OTC codeine, go Canada. it's staving off the real W/D until Monday when I can call my doctors' office again, or go to the hospital for a little 5 pill script. If I wasn't so broke, I would be copping something from the street right now, but alas I'm disabled and way too tired/sick to be hustling.


This is the life, every Sunday. Cheers + I hope everyone is nodding, if not at least well. ❤️💉",1554655395.0
bai4ph,https://i.redd.it/w8esxe77evq21.jpg,46,https://redd.it/bai4ph,mirandafsu,I missed badddd. Now its super hot to the touch. Hospital or wait it out? The pains unbearable. Do i tell the doctor i missed 60 units of fire heroin?,,1554655078.0
bahyff,https://www.reddit.com/r/opiates/comments/bahyff/methadone_and_oxy_qs/,4,https://redd.it/bahyff,Staceyrummel,Methadone and oxy Qs!,Have any of you guys ever had to use methadone if you say ran out of your script or couldn’t get anything from plug? My friend gave me 15ng methadone. I’ve been out since Wednesday night and taking 2.5 about every 24 hours. Will my withdrawals  come back? Or is the low dose methadone gradually working them away? How does this work? Will I be able to go back to my usual 40mg oxy per day on Tuesday.? Thanks ,1554654086.0
bahvbo,https://www.reddit.com/r/opiates/comments/bahvbo/cimetidine_vs_ranitidine/,11,https://redd.it/bahvbo,TotalBath,Cimetidine vs ranitidine,In Canada we have no cimetidine antacid only ranitidine antacid. I was wondering if this will still work as a potentiator. I searched this sub and found nothing. I searched online and found they both work equally as well as an antacid but ranitidine being three times more potent. Can anyone help?,1554653614.0
bahu1z,https://www.reddit.com/r/opiates/comments/bahu1z/trying_this_again/,9,https://redd.it/bahu1z,shatteredmorals,Trying this again,"So again I'm trying to go to the detox facility here in my town.

Going to be there for about 7 days I think or at least that's what I was told. First 36 hours is spent in this recliner chair in a big room with a grip of other people. So yay to that. 

I'm not looking forward to this because I know what's ahead of me and I'm kind of scared honestly of going through it cuz it hurts so much physically and mentally.

But I need to do this. I know I do. 

Anyone have any tips on how to endure this? How did you succeed at this? 

I hope this works. ",1554653422.0
bahg0t,https://www.reddit.com/r/opiates/comments/bahg0t/closed_eye_visuals/,11,https://redd.it/bahg0t,Mordecai2891,Closed Eye Visuals,"Hey so been getting some wonderful raw  ecp lately. I’ve nodded hard on all sorts of different opi’s in the past but this stuff is super sedative and blasts me into an almost DMT dreamland with super vivid visuals while I’m hunched over drooling on my shoes. Then I always get a jolt of energy that lines up with the visuals of the trip and I snap out of it. It lasts like 20 minutes, It’s bananas and I love it.  

Just curious if this is a common theme with good uncut ecp. Anybody experience this before? ",1554651268.0
bah19s,https://www.reddit.com/r/opiates/comments/bah19s/any_fent_users_notice_the_weak_ass_dope_since/,20,https://redd.it/bah19s,2ndwaveobserver,Any fent users notice the weak ass dope since China banned it?,"I had been getting really fucking pissed for about two weeks and then started seeing the articles. Losing hundreds of dollars because I kept having to buy more and try other dudes but none of it is good. I’d love H if I could find it but my city is riddled with fent and now it’s all bunk. I don’t get China’s angle right now. They’ve been pumping the world with fent for years and all of a sudden they ban it? Is trump really scaring them that bad? Lol 

Well shit maybe we need to get back to Afghanistan for some of that real dope. I guess we’ll see. ",1554648942.0
bah0go,https://www.reddit.com/r/opiates/comments/bah0go/someone_knock_me_out_till_i_get_paid_tomorrow/,55,https://redd.it/bah0go,badnewsnewjers,Someone knock me out till I get paid tomorrow,Seriously tho I hate being dopesick can I just sleep till tomorrow pleaseeeee,1554648808.0
bagrrw,https://i.redd.it/j89jh1x5ruq21.jpg,23,https://redd.it/bagrrw,DillyMonDaze,Sunday vibes,,1554647325.0
bag3z0,https://www.reddit.com/r/opiates/comments/bag3z0/any_love_for_tramadol/,6,https://redd.it/bag3z0,Deedot30,Any love for Tramadol?,"I love how long it lasts, not a massive punch to t though",1554642858.0
bafxtu,https://i.redd.it/wyiqcyg3auq21.jpg,3,https://redd.it/bafxtu,ivxxoriginal,"Yopiates hope everyone enjoys their Sundaze, these were supposed to last until today woke up with none... hopefully today will provide the same variety. Happy nods!!",,1554641589.0
bafupx,https://www.reddit.com/r/opiates/comments/bafupx/picked_up_a_gram_of_raw_last_night/,18,https://redd.it/bafupx,LostAesop,Picked up a gram of “raw” last night....,"So last night my girl and I took a trip up to the city (ya know the one with the bird football and baseball team.) Our usual plug has been MIA for a week now so we got the block and found a runner. Everything was good, he tells me it’s 80 a gram. I’m like okay cool same price as our old plug. So we get it and I bust out a line, it smells like dope and tastes like it for the most part. I’m waiting and not feeling much other than being well. Same with my girl. So we wind up doing a few more decent lines and now we feel like  we’re just completely barred out. Like I haven’t taken Xanax in 2 years or so but that’s exactly what it feels like. It was a white rock with very little powder in the bag. I got home and I don’t remember a thing after that, neither does she. I’m fully convinced this shit was alprazolam powder, I’ve just never see it rocked up this way. Also I’ve always been under the impression that snorting xans won’t get you high. 

Has anyone else ever experienced ANYTHING like this before???",1554640923.0
bafseb,https://www.reddit.com/r/opiates/comments/bafseb/which_opioid_is_better_for_beginners/,18,https://redd.it/bafseb,sometimesguru,Which opioid is better for beginners?,Want to try them. Do you think its better to statt with something called meowmeow or so got it from a friend i think its mephedrone or should i start with ritalin. I think they are more pushing opioids ,1554640378.0
bafmxz,https://www.reddit.com/r/opiates/comments/bafmxz/what_is_df118_forte_40mg_dhc/,5,https://redd.it/bafmxz,Trapzor,What is DF118 Forte 40mg DHC?,"Info leaflet: [https://www.drugs.com/uk/df-118-forte-40mg-leaflet.html](https://www.drugs.com/uk/df-118-forte-40mg-leaflet.html)

My legit UK online pharmacy has just started offering this? Is this purely a tradename containing 40mg of DHC rather than the generic 30mg, or is it a variant of the delayed release DHC Continuous? DHC Continuous in the UK comes as 60mg tabs which slowly release the DHC over 8-10 hours. Whereas I just crush them down to a fine powder and swallow to get an instant hit - this is the only way DHC ever gets me anything at all. Standard 30mg DHC tabs? Do fuck all for me.

Crush up 60mg continuous and I get an Oramorph level nod.",1554639100.0
baf3kh,https://i.redd.it/yxexb0l8otq21.jpg,16,https://redd.it/baf3kh,drugzpix,OX40 Oxycodone 40mg,,1554634240.0
baezqe,https://www.reddit.com/r/opiates/comments/baezqe/krater_suboxone/,5,https://redd.it/baezqe,Move_Forward_Daily,krater & suboxone,"I made a post last week about having issues transitioning to suboxone from what I thought was heroin use but apparently is fentdope and taking longer than expected to get out of my system, making it hard for me to get onto suboxone. 

&#x200B;

My question is can I take kratom to help ease the withdrawal wait of about 36 hours ill probably need to wait to take suboxone or does taking kratom when I start to feel uncomfortable just bring me back to square one?",1554633135.0
baeogx,https://www.reddit.com/r/opiates/comments/baeogx/sore_arm_normal/,7,https://redd.it/baeogx,serotoninpenguin,"sore arm, normal?","slammed a shot about 40 min ago, got it in a nice vein no issues, registered, got me high but arm is a little sore now. is this normal? will it subside, if so how long? 

its not swollen or red/inflamed or anything",1554630088.0
baenr7,https://www.reddit.com/r/opiates/comments/baenr7/still_in_rehab/,10,https://redd.it/baenr7,adderseverywhere3,Still in rehab,"Hi all, doubt you will remember my last post on here but just wanted to say I have now been in rehab for just over 3 weeks and have 9ish weeks to go and am 23/24 days clean and honestly feeling great. If there’s any true addicts that want to get clean but can’t I would recommend rehab especially one that goes by the 12 step program or trying the 12 step program your self. It’s hard work and still will be for probably the rest off my life but I know I was in such a state and depressed that it was ether this or kill my self which I nearly did by shooting up a fuck load of fent but thankfully I’m lucky and still have the love from my family so don’t want to hurt them any more then I have and my dog whose my best/only friend was watching me get everything ready and I was about to inject the fent when i looked at him and thought I couldn’t let him watch me die then be by him self until I would off been found dead probably days if not weeks later. 
Might not be back to this sub for a while as it’s still a big trigger to make me want to use but hopefully if this is helpful to at least one person, to show there is another way if you want it and are ready. ",1554629885.0
baeh0h,https://i.redd.it/cpm2v92j5tq21.jpg,11,https://redd.it/baeh0h,ivxxoriginal,Excellent choices a51s alg265s e8s and soft serve pistachio ice kreen,,1554627943.0
baedaj,https://www.reddit.com/r/opiates/comments/baedaj/what_does_xanax_feels_like/,10,https://redd.it/baedaj,steadydodgin,What Does Xanax Feels Like,I'm jus curious I know it makes you sleep n calm n shit but one thing i struggle with is ion want it to make me feel like i'm dreaming kuz weed does that to me n i freak out super bad so can anyone let me know if it does make you feel like your dreaming for a first timer.,1554626806.0
bae85u,https://www.reddit.com/r/opiates/comments/bae85u/morphine_sleep/,11,https://redd.it/bae85u,PringleWallet,Morphine & Sleep,"I must admit I love morphine, I love oxy more but its much more expensive and harder to acquire for me, I can pretty much get a 300ml bottle of Oramorph when i want for free (not to boast, I just know a few girls who’s moms have back pain  and don’t use it so they have bottles stockpiled!).

Anyway morphine’s my most communally used opiate and I like it, However my only gripe with it is that I never get a good sleep from it! I’m not privy to the science but I think it blocks REM sleep or something, either way if I take it before bed i’m in that perpetual state between asleep and awake which, don’t gee me wrong, feels lovely. But when it comes to functioning the next day, is very hard. I feel as though I’ve had no sleep at all... means I avoid it on weekday evening which is when i’d like it the most! 

Oh well, another opiate rant.",1554625000.0
bae1di,https://www.reddit.com/r/opiates/comments/bae1di/talking_about_80s/,18,https://redd.it/bae1di,,Talking about 80s?,"“Shoutout to hades, I was out in Greece smoking eighties
Peel the brown pack, all this oc 30 lately”

Shakewell lyrics lol, do you think he was talking about 80 mg oxys? He says oc 30 right after but idk

*Edited for spelling errors",1554622944.0
bae0lr,https://youtu.be/8FqQnXt5N1o,5,https://redd.it/bae0lr,OfficialDrakoak,Sad boi hours,,1554622638.0
badtyx,https://www.reddit.com/r/opiates/comments/badtyx/help_for_a_beginner/,3,https://redd.it/badtyx,jayhawker15,Help for a beginner,I’m new to opioids and only have a very limited amount of 5 mg hydrocodone capsules. I want a nice high for a night (above recommended dosage) but obviously don’t want to overdose. Any help on how many I can/should take? ,1554620686.0
badnzj,https://www.reddit.com/r/opiates/comments/badnzj/still_not_nodding_took_40mg_oxy/,13,https://redd.it/badnzj,FukkkUp7,Still not nodding took 40mg oxy,"I took 40mg oxy 15iv 20mg orally and smoked
 5mg 
Took 25mg promethazine 
Drank a whole bottle of grapefruit juice


Why don't I nod on oxy 
I'm used to nodding on H 
Is that it? 
It's just a different kind of high or 'nod'",1554619000.0
badnja,https://i.redd.it/sfxc292jesq21.jpg,26,https://redd.it/badnja,k_baudelaire,Why nobody invites me to go camping... It may be the reason! ;),,1554618880.0
badhlj,https://www.reddit.com/r/opiates/comments/badhlj/20mg_of_methadone/,11,https://redd.it/badhlj,JakobRigsby,20mg of Methadone,"How would 20mg of Methadone compare to 50mg of Hydrocodone? Just sorta curious and worried because of all the bad stories about methadone, just can’t get some hydros currently. ",1554617316.0
baddvu,https://i.redd.it/4xyr0vo37sq21.jpg,20,https://redd.it/baddvu,shivasutra,Cold Cop in the NW. comments? It’s a half for $40,,1554616366.0
baddpt,https://www.reddit.com/r/opiates/comments/baddpt/getting_wisdom_teeth_removed_what_will_i_get/,30,https://redd.it/baddpt,,Getting wisdom teeth removed what will I get?,"Just wondering, when I had my tonsils out I got oxycodone, is that likely ",1554616317.0
bad813,https://i.redd.it/8sisoebn2sq21.jpg,8,https://redd.it/bad813,DopeSmoke510,🤯🤓,,1554614878.0
bad7jq,https://www.reddit.com/r/opiates/comments/bad7jq/oxymorphone_advice/,10,https://redd.it/bad7jq,Uncle_Screw_Tape,Oxymorphone Advice,"I’ve been a heavy opiate user for somewhere around 5-6 years. Up until 2 years ago I maintained roughly a gram a day heroin habit for a year or two. I got “clean”ish for about 6 months and have only been doing oxycodone since. I have a 150-240mg a day oxycodone habit. I’m trying to see if it would be worth the extra price per pill to switch to the G74 Oxymorphone. Could someone give me an idea of a dosage equivalent when snorted and/or IV’d?  Ex: How many Mg of Oxymorphone is equivalent to 30mg oxycodone when snorted. Same question but when IV’d. I’m also wondering the same about Hydromorphone (Dilaudid).  Those with experience with both, if I were to make a purchase and had the choice or Oxymorphone and Hydromorphone, which should I go with if I were going to primarily snort most of them? Also... with the G74 or other “G” brand Oxymorphone, can they just be simply crushed or does a coating have to be peeled off of them? Thanks in advance for the replies. ",1554614753.0
bad5yw,https://i.redd.it/e4u3l8x31sq21.jpg,8,https://redd.it/bad5yw,socal710,a nice lil mix🤤,,1554614352.0
