8cjjk1,https://www.reddit.com/r/opiates/comments/8cjjk1/have_a_dr_appt_in_a_few_days_and_would_like_some/,4,https://redd.it/8cjjk1,2PACofSOA,Have a Dr. appt in a few days and would like some input for medication..,"So Unfortunately I have Kaiser, which basically means they have a central database of all your records and of course my rehab I did.

Ill try making this short. A while ago I (like an idiot) agreed to do this swab test/DNA test to basically get results that would determine based upon my genes, what medications work and don't work.......SUPPOSEDLY) At the time I agreed, I was/still am really depressed all the time. So my thinking at the time was hopefully I can just get the right medication the first time around, as to rather than testing several and seeing which is best) - ***(Worst mistake was taking that swab test***)

FAST FORWARD TO NOW:
I recently seen a spine specialist whom seemed okay at first. (Im 28 and have 2 protruding disc and a narrow spinal canal, on top of that my SI and L5 **(S1 is the Sacrum and the L5 is the lowest vertebrae in our spine)** is sacralized **(fused bones together)**  - Congenital, was probable cause.

So this Dr, he ended up having me do an updated MRI (which sucks fucking assss I hate that machine) and we ended up also getting some new X-Rays on my lumbar. Before any meds, he made me do an epidural in my spine and yes I was asleep! LOL i was not ready for that. Few days later i told him it made it worse (truth), and so long story short he prescribed me x120 10mg Oxy-Hcl because I told him Ive had flare ups in the past and that was my typical prescription from the past- which was completely true.

Week or so later I get the results and went over it with the Psychiatrist - Turns out it says in some for or another for pain pills and medications I has been using for years now, including benzodiazepines, list them as ""Serum level may be decreased, an increased dose would be required) - **In other words theyre saying dont prescribe them this.** BUT anything in the ""stimulant section"" all had green marks, WHICH PISSED ME OFF, I WAS LIKE WOW WORLD I DONT DO STIMS AND THIS IS WHAT YOU DO TO ME?! (Sarcastically yelling lol)

I go in for my follow up appt with my spine doc and what not, and by then he got the test results of course. We do a few routine things and when we get to medications he says he wont prescribe me the same script, BUT he said he'd be willing to give me the same dose in HYDROCODONE (GENERIC OF COURSE). I tried to keep my cool because it made completely no sense. 

His excuse was ""well hydro usually last a bit longer in your system than oxy does"" and I say back something on the llines of ""whats the point of it lasting longer if it's a less efficient pain med and I would end up having to suffice by taking more since it would be less effective"" 

He wouldnt budge, I tried telling him in some form or another that he's incorrect by switching me to hydros but he didn't budge at all. I explicitly told him that I did NOT want OXY as my long term pain management, JUST ONLY for this new disc that is pushing against my nerve canal and is causing sciatica pain and overall discomfort.

I said fuck it, trying to not argue with him so I wouldn't portray addict-like behavior and got the script upstairs at their pharmacy. OBVIOUSLY AS EXPECTED IT WAS SHIT good for pain which caused me to use more way more. (AND I TOLD HIM THIS WOULD HAPPEN SINCE THEY'RE LESS EFFECTIVE......!) I got the Mallincrodt M367 10/325.

I ended up calling him a few weeks later and told him my rant and how they're not effective and its causing problems at work and so on. He said if they werent working than my other options ""per my results"" said I can do either surgery or fentenyl. I couldn't believe he was going to offer me fent, but not oxy... even worse suggesting me to do back surgery. Ive seen so many specialist over the years and they ALL said to NOT do surgery unless i absolutely needed to because of my young age. We argued and went back and fourth so much I had to hang up on him before I snapped on him.

* I'm scheduled for a second opinion Wednesday morning, and since I've scheduled it I'm getting nervous she'll tell me the same thing since the last doctor I seen was the head off the pain management section. I dont know how else to express to them that the oxycodone is so much better for my pain than hydrocodone is, without making it sound like you're a pill seeker. I even have like 30-20 Norcos left and its been way over a month now, that's how much they don't work.

**ANY ADVICE ON HOW TO APPROACH NEW DOC TO GET MY USUAL SCRIPT AGAIN??**

tl;dr - Getting second opinion for my back problems but the ""old"" doctor is the head of the pain mngnmt section. They want to give me hydros rather than oxy",1523838231.0
8cjfyc,https://www.reddit.com/r/opiates/comments/8cjfyc/how_long_after_snorting_heroin_do_you_know_youre/,9,https://redd.it/8cjfyc,AllAboutTheWarmth,How long after snorting heroin do you know you’re safe from OD,Sorry just worried never had this much before,1523837326.0
8cjdlr,https://www.reddit.com/r/opiates/comments/8cjdlr/does_anyone_out_there_actually_manage_to_use_once/,6,https://redd.it/8cjdlr,jamesgala223,Does anyone out there actually manage to use once a week?,"I only use weaker opioids and benzos like codeine, tramadol and Valium. I go through stages of thinking I can stick to once a week, but the temptation is always too strong.

Does anyone actually stick to a once per week or similar routine?",1523836693.0
8cjc7p,https://www.reddit.com/r/opiates/comments/8cjc7p/the_joy_of_a_new_plug/,8,https://redd.it/8cjc7p,grotesquerealism,The Joy of a New Plug,"My main two plugs have been slipping: one, who charges 100/g for what is usually the best doap I can get, stopped getting good doap but won't go down on the price. He's been slipping, and is damn near just a middle man now. Fucking cocaine. 

The other, a gorgeous, thicc black chick who digs my sense of humor, has started to unreliable, and only available at weird times. She has decent stuff for 60/g. But only if you catch her during her weird hours.

Today, hitting my spent foils to keep the vomit down, I found my old black book of numbers I didn't want to lose. Among the entries in that hallowed text, I found one that i remembered being good.

I make contact, place my order, and head to the spot. Dude is late, of course. But he is remorseful, legitimately. He threw in an extra dub and bought me taco bell cause he was late. If I wasn't sober and sick, I would've chalked it up to doap brain.

In short, got a new plug that is around 24/7 who is cool AF. Just jumped to the top of the list. Buying your first time custie taco bell will do that, plus throwing in that extra dub, which he insisted on showing me on the scale.

Today didn't suck. I hope my comrades are having good Sundays too.",1523836319.0
8cjc7n,https://www.reddit.com/r/opiates/comments/8cjc7n/does_dosing_during_wd_restart_the_cycle/,13,https://redd.it/8cjc7n,halpme_dopi_wan,Does dosing during WD restart the cycle?,Is the general consensus that dosing again during withdrawal restarts the cycle? Or do you feel there is value to trying to decrease dosage spread out over time if possible?,1523836319.0
8cjabe,https://i.redd.it/pz5553tns5s01.jpg,7,https://redd.it/8cjabe,AllAboutTheWarmth,Take me to a place where the angels touch your opiate receptors!,,1523835795.0
8cjaae,https://i.imgur.com/zwNriNV.jpg,3,https://redd.it/8cjaae,Xxnoah69xx,Prepping this weeks snacks,,1523835787.0
8cj6px,https://www.reddit.com/r/opiates/comments/8cj6px/day_1/,7,https://redd.it/8cj6px,nycjh66,Day 1,"It’s been 24 hrs since my last shot of dope. Took 4 mgs subs a few hours ago and I’m feeling alright. RLS and some cold sweats and freezing are still there. The only other things I have, well the person who I’m with has is trazadone, dicyclomine, and Advil. Should I bother with any of those? Don’t even have weed which is a huge mistake and it’s raining so no one is out delivering. ",1523834836.0
8cj5sk,https://i.redd.it/wr317hv2p5s01.jpg,30,https://redd.it/8cj5sk,dyingsober,Last pickup before detox. Got an intake tomorrow morning! I want to be clean.,,1523834589.0
8cj1ik,https://www.reddit.com/r/opiates/comments/8cj1ik/lidocaine_cut_ecp/,7,https://redd.it/8cj1ik,lurkndturf,Lidocaine cut ECP,"Just curious all, whether you’re a snooter, tooter, or shooter - what are the dangers of lidocaine entering your bloodstream?

Google and bluelight doesn’t seem to have many answers besides the obvious fact that it doesn’t have any recreational value on its own. Thanks all. ",1523833467.0
8cj0qf,https://i.redd.it/yfud9w57l5s01.jpg,4,https://redd.it/8cj0qf,Alaskaman89,Any one ever see like sparkles in there dope before ? Last few times i got this stamp I’ve noticed it shines,,1523833283.0
8cj0k8,https://www.reddit.com/r/opiates/comments/8cj0k8/does_anyone_think_the_life_is_actually_kinda_fun/,22,https://redd.it/8cj0k8,hailsatanordie666,Does anyone think the life is actually kinda fun?,"I know this is going to sound strange (yes I have been dopesick and gone through WDs myself many times), but hear me out. In some ways the act of being all stealthy in order to get high, particularly with IV usage almost kind of a rush in of itself? 

Just that you know you’re doing something “naughty”, and then getting away with it, and then the physical rush of the actual opiate upon injection. That psychological thrill I get when I have my dope & needle, got it all mixed up in a syringe that’s in a vein, followed by the (second, obviously) BEST part of the process, registering the needle by pulling back on the plunger. As soon as that lovely warm, red blood floods into the syringe I know all that’s left to connect the current psychological high to one of the most satisfactory physical feelings in the world is the simplest action ever, pushing the plunger down. 

I know a lot of people (especially when dopesick) say they wish they could and would if they could, take everything involving heroin or other opiates back. Sometimes when I’m sick too I might slightly agree, but I tend to brush that aside, sorta like how people say they “Will NEVER drink AGAIN!” while hungover as hell, but then inevitably do (usually). I have always enjoyed myself when using and would never personally take any of it back. ",1523833244.0
8ciyu7,https://www.reddit.com/r/opiates/comments/8ciyu7/just_a_lil_something_to_relax_with_today/,7,https://redd.it/8ciyu7,06audis4,Just a lil something to relax with today,https://imgur.com/a/wXWXl,1523832813.0
8ciuyy,https://www.reddit.com/r/Drugs/comments/8cfa8f/my_struggling_marriage/,0,https://redd.it/8ciuyy,Drowningdesperation,My struggling marriage,,1523831811.0
8civ6x,https://www.reddit.com/r/opiates/comments/8civ6x/help_homeless_guy_outside_sounds_like_he_is_going/,12,https://redd.it/8civ6x,heroinhero96,HELP: Homeless guy outside sounds like he is going to die. Should I buy him some loperamide hydrochloride?,"So there's this homeless guy out back of my place. He sounds like he is going to die. I went outside to see what was up and he was borderline convulsing. 

I asked him if he needed help, he said no. I asked him if he wanted me to call an ambulance, he also declined. So I asked him if he was having withdrawals. He said no, but he was also scratching at his arm and looked like he was going through some shit.

I know people come to our building to shoot heroin because I find the needles by my car. This guy is in rough shape. Should I get him some lope from the store? How much? Is there some way I can help him?

edit: remove location

Edit 2: I went and checked on him, brought him some water, gave him a sweater per his request. He looks better than he did previously. I'm not going to call an ambulance as he specifically asked me not to. I think he'll be OK. I hope he gets the long term support he needs",1523831871.0
8cirwm,https://www.reddit.com/r/opiates/comments/8cirwm/oxy_ruined_other_drugs_for_me/,24,https://redd.it/8cirwm,throwaway666718,Oxy ruined other drugs for me,"Ever since taking oxy, no drug compares. I used to love smoking weed and taking xanax, and although they're still fun, I don't really care for them anymore. All I want now is oxy. Simply put, it is the fucking best. I crave it all the time, but I have so little of it.

I got about 25 10mg oxys from a girl who had an injury and I've went through all of them in a few weeks. All I have left now is 40mg. I can't get anymore. This fucking sucks. My usual dose is 30mg and 0.5mg xanax and I feel great. I'm saving this 40mg for a special day, but I really really want to do it now. I'm just bored with every other drug.

Shit post I guess, just wanted to vent. Thanks for reading",1523831036.0
8circ1,https://www.reddit.com/r/opiates/comments/8circ1/my_new_plan/,5,https://redd.it/8circ1,Ol_DirtyDan,My New Plan,"Sup everybody, hope you all had a good weekend. So after almost two years clean I fell back down the rabbit hole ~2-3 months ago. I've worked myself up to a bun a day (didn't go back to banging) and have burnt more than a majority of the money I had saved up in that time  (been unemployed for bout a month).


That being said, it's time to call it quits again. In the past I've relied on detox facilities but due to insufficiant funds I'm doing this shit on my lonesome. I've got a strip and a half of 8mg sub, a bit of kratom, and some good ol xans. 


This is where your opinions come in. I was planning on using kratom tomorrow (day 1) to just kinda get through the day. Day 2 is normally where my junkie brain tells me to go cop so eat the half/piece of the sub to block then use the other sub to try and get me through day 3 and hopefully 4 at which point I'll go back to the kratom. The xans will get used periodically, most likely for sleep. IMO it makes sense, but what do yous think?",1523830893.0
8cipmw,https://www.reddit.com/r/opiates/comments/8cipmw/strange_reaction_after_injecting_cant_figure_out/,8,https://redd.it/8cipmw,imgaybuttman,Strange reaction after injecting-- Can't figure out please help,"Hey guys, I have a problem after shooting heroin that I can't seem to find anything about after using google and the search feature here.

I have shot up hundreds and hundreds if times with no problem. But that last 5 or 6 times I keep having the same reaction that I can't explain. After pushing the plunger in, I feel the regular rush creeping up. After about 5 or 6 seconds of feeling good, shit hits the fan. I feel a tickle deep in my lungs that I cannot ignore. I begin coughing violently. Deep, hacking coughs. My heart starts beating extremely fast, my skin turns beet red and I develop a severe headache. My entire body feels like it hurts. My blood feels like it's vibrating. Not a good feeling. I feel like my heart is straining to pump blood, like something's pressing on my chest.

And then, after about a minute, it vanishes as fast as it arrived. The pain stops.

This reaction has happened with two different kinds of dope and different needles and cottons. I don't think it's cotton fever or sepsis because it happens immediately. Anyone got any clues?",1523830458.0
8cioa9,https://i.redd.it/9nlp6bytb5s01.jpg,31,https://redd.it/8cioa9,b00fthatshit,Successful cold cop - whisper - 8mg dilly,,1523830138.0
8cin0r,https://www.reddit.com/r/opiates/comments/8cin0r/you_ever_put_dope_hard_down_on_foil_together/,11,https://redd.it/8cin0r,5y64r1t3,You ever put dope + hard down on foil together?,I do this with shit sometimes too. I like to put a Little Rock/shard on top of some tar so it’s like it’s riding a little horse 🐎 ,1523829832.0
8cimtt,https://www.reddit.com/r/opiates/comments/8cimtt/second_time_with_percocet/,1,https://redd.it/8cimtt,d4oor,Second time with Percocet,So about an hour ago I took 4 5/325 percocets and smoked like 6 bowls with my friend needless to say I’m feeling pretty good except for the fact that i just threw up,1523829787.0
8cidvy,https://i.redd.it/9r4nss2c45s01.jpg,12,https://redd.it/8cidvy,op80morphHead,Heres a pic of my 1 pill stash that everybody hates seeing /u/cali_throwaway,,1523827612.0
8ciaqk,https://www.reddit.com/r/opiates/comments/8ciaqk/hows_your_day_going/,30,https://redd.it/8ciaqk,mumertro,How’s your day going??,,1523826846.0
8cic4h,https://www.reddit.com/r/opiates/comments/8cic4h/opies_benzos/,28,https://redd.it/8cic4h,L00EY,Opies > Benzos,"Just venting but why on earth is the benzo culture as big as it is. When i feel down, my ksalols come in handy but as a drug i just see no point in going with xanax (or MOST) other benzos over MOST opiates...",1523827176.0
8ci9vj,https://brassballs.blog/home/fda-approves-nasal-spray-so-kids-can-revive-parents-who-overdose,6,https://redd.it/8ci9vj,thaaak,FDA approves nasal spray so kids can revive parents who overdose,,1523826642.0
8ci6dw,https://www.reddit.com/r/opiates/comments/8ci6dw/best_test_kit_for_verifying_oxy/,5,https://redd.it/8ci6dw,Fenttestquestion,Best test kit for verifying oxy,"Title says it all. Bought some m box pills that I usually try and avoid due to all the fakes. What's the best test kits out there to verify what I am getting is really oxy and not sent? Thanks in advance. Just trying to be really careful. Also, if you ingest fent, how long before and overdose may occur? ",1523825828.0
8ci60s,https://www.reddit.com/r/opiates/comments/8ci60s/which_fentanyl_urine_test_should_i_buy_online/,1,https://redd.it/8ci60s,fuckspersquareinch,Which Fentanyl Urine Test should I buy Online?,Anyone got any recommendations? I got a big test coming up and need to make sure its not in my system.,1523825732.0
8ci4qi,https://www.reddit.com/r/opiates/comments/8ci4qi/are_you_on_a_nametoname_basis_with_your/,20,https://redd.it/8ci4qi,reggayman,are you on a name-to-name basis with your convenience store guy?,,1523825424.0
8chy6c,https://www.reddit.com/r/opiates/comments/8chy6c/anyone_on_200_ug_of_fentanyl/,3,https://redd.it/8chy6c,Monday_123,Anyone on 200 Ug of Fentanyl,Hi I have chronic pain and I'm on 200 ug of fentanyl patches for it. I wanted to know if anyone else was in a similar situation where they are on a similar amount daily and how you get on with it.,1523823890.0
8chwys,https://www.reddit.com/r/opiates/comments/8chwys/how_many_of_you_are_schizophrenic/,14,https://redd.it/8chwys,HisDelvistSelf,How many of you are schizophrenic?,"I've been noticing some changes in myself, and my wife has noticed the same. In reading about my symptoms, schizophrenia comes up a lot, as well as its ties to substance abuse.

Have any of you been diagnosed? What were the early symptoms?",1523823603.0
8chpop,https://imgur.com/uAbiG1A,15,https://redd.it/8chpop,EitherBicycle,Last Oxy before i go to pick up Suboxone from the doctors tomorrow.,,1523821943.0
8chovo,https://www.reddit.com/r/opiates/comments/8chovo/how_long_for_a_tolerance_break/,6,https://redd.it/8chovo,pretendaddict,How long for a tolerance break?,"I'm just wondering, has anyone else done tolerance breaks or anything to try to see if those good feelings they use to get come back? I mean obviously not the butterflies and happy warm feeling you first could get just from a fucking hydrocodone but I mean does it get better lets say if you don't take for a couple months and you were popping every single day?",1523821751.0
8chlx3,https://www.reddit.com/r/opiates/comments/8chlx3/so_i_wanna_try_the_needle_once_in_my_life/,24,https://redd.it/8chlx3,youmeanwhatnow,So I wanna try the needle once in my life,"I’m fucking terrified of the things. Like I don’t look and tell every nurse/doc who’s ever had to use a needle on me that I’m pretty phobic. 

Now I guess I’ve felt what that Rush is all about when I had my kidney stones and got morphine injected. Level 10 pain to 0 in an instant. Lots of warmth. 

Thing is I feel like I wouldn’t know if my life was in danger and feel much better having that kind of high near medical professionals. I’d be too worried about dying. 

So I know I shouldn’t use the needle but it interests me. I wanna see how heroin would compare to the morphine. 

My main roa is nasally and my sinus are fucked on a good day. Feel like I’m ruining them further with nasal spray. Not a great excuse to try the needle but it’s not even that excuse, honestly I wanna feel it once before I die... and have that not be my cause of death!",1523821061.0
8chkdm,https://www.reddit.com/r/opiates/comments/8chkdm/prepping_hydromorphone_er_beads_for_iv/,17,https://redd.it/8chkdm,NoHealth,Prepping hydromorphone ER beads for IV,"I can't seem to break these beads down enough to get a shootable solution and its more than a little frustrating .
(Pic here if you never seen them https://m.imgur.com/a/uBuEB)

If you have a tried & true method that actually works (ie positive its not placebo), plz share. I've been trying all week with no luck.

What I've tried so far:

-Plastic drugstore pill crusher (screw round piece into dish). Doesn't work ... beads too small and hard.

-Mortar & pestle. Beads just squash into gummy flat things with no powder (that's if they don't go bouncing off into the abyss).

-After crushing, soaking with vit C and some heat etc. Doesn't dissolve. And when I do shoot the mix (filtered to clear) I get no high.

End up having to dump the mix in my mouth. They work fine orally even after trying to soak out the drug, which suggests that none of the drug is dissolving in the water mix.

Thx. Sry for length

",1523820711.0
8chdf7,https://i.redd.it/3fumuuhve4s01.jpg,55,https://redd.it/8chdf7,YuriMakerOfTheForge,When you realize your stuff was cut with fent but you're too high to care,,1523819085.0
8chc40,https://www.reddit.com/r/opiates/comments/8chc40/fent_warning_for_grand_rapids_mi/,1,https://redd.it/8chc40,Somethings___Fucky,"Fent Warning for Grand Rapids, MI",A couple friends of mine overdosed last night. Both survived. Powder is white/cream color. ,1523818798.0
8ch8lt,https://www.reddit.com/r/opiates/comments/8ch8lt/484610_area_fent_warning/,1,https://redd.it/8ch8lt,benzthrowa3,484/610 Area Fent Warning,Be weary... fent in red bags out here. Stay safe yall.,1523818031.0
8ch6mv,https://www.reddit.com/r/opiates/comments/8ch6mv/successful_cold_cop_again/,31,https://redd.it/8ch6mv,NoSelfHelpBarb,Successful cold cop again!,"So yesterday, the day after my much loved cold cop...I went back to scramble city, the most livable city in america as they benches around town say. But after like an hour of not finding shit but cops everywhere and people who tried to snag my money...i finalllllly had some dude hollar at me...asked waht i needed and i told him raw or scramble, dont care at this point. So he says he got raw, i tell him 2 dubs worth...and he said he'll be right back and has to go it from his car. he says dont fuck with anyone else, he'll be right back. well he comes back with someone other guy. main dude walks into the mini mart to bag it up for me, and the dude he was walkin with comes up and gives me one cap for 20, what a waste when scramble isnt that much. then the main dude walks out with a half g that was for $40...i hand him 20 he says wtf is this...and i tell him his boy just gave me the cap and said it'll all good...the dude gives me the half g anyway. he went back and fought the dude who gave me the cap and told me just keep the 40 it's not my fault....so i ended up with some FIIIRE gray dope for $20) then a pretty large cap of scramble for $20 which was actually really damn good. Too bad i live 1.5 hours from that city and its hard to get up there.  
Now im all out of dope, i have like 10 20mg OP's left and 1x 1mg ativan with a bunch of 0.5mg clonopin. I ate 3mg clonopin this AM and i guess its keeping me nerves in check....but i want more of that gray!!!  
Thanks for letting me rant!  
https://imgur.com/a/T2wQK",1523817597.0
8ch4r6,https://www.reddit.com/r/opiates/comments/8ch4r6/another_cold_cop_success/,10,https://redd.it/8ch4r6,NoSelfHelpBarb,Another cold cop success,"So i went to the scramble capital...ended up finding a lookout that directed me to ""the hole"" and finally got some raw and hard. Pretty stoked but it was bit shady since im not from this coast of the country.  Anyway, 3 bags of raw and one vial of hard...I was stoked to get teh vial...i feel like that's how they do it up in NY and how Biggie did it back in his days lollll...anyway..here ya go  
https://imgur.com/a/ASdqL",1523817177.0
8ch4qz,https://www.reddit.com/r/opiates/comments/8ch4qz/why_in_breaking_bad_does_jesse_add_cotton_to_the/,23,https://redd.it/8ch4qz,TypicalCanadianMoose,Why In Breaking Bad does Jesse add cotton to the heroin?,"I have never used drugs but I’ve always been curious how to inject heroin 

Edit:

Thanks for all the responses, once again I’m a middle age teen and am in no way looking to try opiates, just been watching breaking bad and opiates is intriguing, in a scholastic way not a way that would involve trying it. No matter how good it makes you feel, I’ve heard that feeling is never the same as the first, and ur just left “chasing the dragon”. So it’s not even close to being worth it. Thanks for all the great replies, and hope everyone recovers well.",1523817176.0
