ax9qbd,https://i.redd.it/sftren8805k21.jpg,1,https://redd.it/ax9qbd,ubercharlesinit,Just a lil something nice,,1551720507.0
ax9kcv,https://i.redd.it/wb86cbqtx4k21.jpg,0,https://redd.it/ax9kcv,StoneyGwynn,Foolish human,,1551719697.0
ax90wr,https://www.reddit.com/r/opiates/comments/ax90wr/how_often_can_you_use_opiates_without_it/,4,https://redd.it/ax90wr,RITarded,How often can you use opiates without it affecting your mood?,"So I quit an opiate habit of using every day and now only use once a week (it'd off - for some reason I'm able to chip like this even *after* being an addict), but I still feel slightly off on the 6/7 days of the week I don't use anything. I am thinking of using once every 2 weeks now. I definitely don't have WD symptoms - or at least not physical ones like RLS and fatigue (I'm very familiar with WDs), but I'd like to dabble in opiates once in a while without it affecting my off-days. Is once every 2 weeks sparse enough?",1551717026.0
ax8yl2,https://i.redd.it/drbt8slvo4k21.jpg,7,https://redd.it/ax8yl2,panda_nips,Oxymorphone aka 🐼 WOOOOO,,1551716690.0
ax8y9k,https://www.reddit.com/r/opiates/comments/ax8y9k/20_years_of_research/,11,https://redd.it/ax8y9k,PeekAtChuNaked,20+ Years of Research,"When I was 12 years old, I found out that I can escape this reality with the use of substances. I am almost 33. I have a great job, a gorgeous girlfriend of 13+ years, and we have 2 amazing children together. We bought our first house and I was promoted to the lead position at my company. Life sounds great on paper. I am also heavily addicted to meth and even more so to black tar heroin. Every problem in my life stems from my psychological need to keep myself high. Behind the scenes, my life is falling apart at a rapid pace. Out patient treatment didn’t work. I can’t do it on my own. So today, I walked into work and told them that I am entering a residential treatment facility, even if it means I lose my job. That used to be my biggest fear, but I can get a new job. I don’t want a new family and I don’t want my girlfriend or kids to wake up and discover my lifeless corpse because i have a horrible habit of slamming when I will be alone for hours. I’m closing my eyes and taking a leap of faith. Faith in myself. And faith in God to help me find my way through the darkness. I love this sub and I hope everyone is where they want to be in life. And I hope you feel happiness.",1551716641.0
ax8y7y,https://i.redd.it/trncmqvpo4k21.jpg,1,https://redd.it/ax8y7y,Kush-kid,"Me, trying to make light of feeling the addiction coming back on.",,1551716635.0
ax8qtr,https://i.redd.it/0nflgujml4k21.jpg,0,https://redd.it/ax8qtr,jlogic420,Cotton candy lines Ft. pressed blues (strong as FUCK). My girl said future gender reveal lmfao,,1551715597.0
ax89t6,https://i.redd.it/fg31682xd4k21.jpg,13,https://redd.it/ax89t6,JaxStillHere,Look like your average M30s? ;),,1551713019.0
ax88nt,https://i.redd.it/8mt6t1hfd4k21.jpg,18,https://redd.it/ax88nt,XanFamMan,Took a sub already this morning cause the dopeman wasnt supposed to be around today... Well he ended up pulling thru and now i have 2gs of 🔥BTH tempting the fuck out of me. 😫,,1551712839.0
ax822w,https://i.redd.it/9tgfrdcda4k21.jpg,11,https://redd.it/ax822w,aciddhead,just got opium paste half gram how would I go about ingesting it orally or smoking it? Can anyone help,,1551711810.0
ax81ex,https://www.reddit.com/r/opiates/comments/ax81ex/anyone_have_any_experience_putting_a_gps_tracker/,8,https://redd.it/ax81ex,teknojunki,Anyone have any experience putting a gps tracker on a mail truck for deliveries?,"Although tracking #'s help, I can see how someome may want to do this. Probably not legal though. Hm, wonder how one may go through with doing this. (I am refering to the daily neighborhood postal worker's truck) ",1551711704.0
ax7x5h,https://i.redd.it/tuwszbqy74k21.jpg,6,https://redd.it/ax7x5h,csaf57,Not sure if this has been posted but my sober living mate just shared this on facebook,,1551711000.0
ax7w35,https://i.redd.it/j0jgfm7f74k21.jpg,0,https://redd.it/ax7w35,SirJ0el,Look at these beautiful shards,,1551710819.0
ax7gdo,https://i.redd.it/ajo66udlz3k21.jpg,15,https://redd.it/ax7gdo,XanFamMan,Perfect start to a perfect day!😎 Hows everyone doing today opi fam?❤,,1551708187.0
ax7bfo,https://i.redd.it/2bw56uoyw3k21.png,9,https://redd.it/ax7bfo,AcidHead710,It's me again,,1551707300.0
ax70ae,https://i.redd.it/sf3n8chxq3k21.jpg,33,https://redd.it/ax70ae,dog-food-,"early bird gets the worm! let’s get this money and let’s enjoy some nice opiates, and whatever your hustle is, please be safe. i love these early morning phone calls i’m about to go flip these lil $20 bags and get right before i head out",,1551705313.0
ax6zmz,https://i.redd.it/p84w1e9pq3k21.jpg,19,https://redd.it/ax6zmz,oLSDMTHCBDo,"Leeeaaan onnn meee....lol bout to dive into this lovely combo. .2 shot and gonna pour 2oz. Too bad lean where I'm from is way over priced imo, 25$ an oz....",,1551705196.0
ax6y09,https://i.redd.it/210qvmjrp3k21.jpg,3,https://redd.it/ax6y09,jlogic420,Not too bad of some boy could be stronger but not fent heavy,,1551704889.0
ax6xam,https://i.redd.it/shw7rtjdp3k21.jpg,1,https://redd.it/ax6xam,Atomicfrylock,Monday morning b4 work pick up. They are sand color. 25 dollars .32. Its hard as concrete. Love oicking up when my dude id half asleep. Always get hooked up,,1551704751.0
ax6khb,https://www.reddit.com/r/opiates/comments/ax6khb/kratom_for_sub_withdrawal/,1,https://redd.it/ax6khb,proxycodone,Kratom for sub withdrawal,"Ok before you all call me a fucking turd for bitching about kratom withdrawal I just went through a sub withdrawal which i was at anywhere from 8-16 mg for a decade. I did a rapid detox over a month from 12 mg to .5 and stopped on January 3rd of this year. I made it about two weeks and the insomnia and lethargy just were killing me so I got some kratom and that shit made me a new man(no shit, right?). Well I was a little worried about replacing one for another but I though wtf kratom can’t be worse physically than what I just went through. Now 2 months later I’m down to a really low dose I think, about 2.5 g 4X a day and the physical WD’s are cake compared to subs no doubt..like not even comparable BUUUUUUTTTTT the only thing that’s killing me is the lack of any motherfucking energy when I skip doses. I’m weaning down but I’m thinking there’s no way to beat the low energy. Like I said the other physical WD’s are extremely minor but I just need some recommendations for supplements or something and yes I know exercise is great but c’mon y’all know how motherfucking hard it is to even take my kids to school or do ANYTHING when it’s like this and anyway I work a full day at a somewhat physical job(maintenance at a high school) so I’m moving but only because of the kratom. Sorry about the long post but I’m at my wits end here, it’s becoming really fucking depressing. And yeah I’ve chipped away and had a couple OC’s and I came across some dilly’s but that was weeks ago and I’m done(fingers crossed) because I just can’t withdrawal again. ",1551702332.0
ax6h1c,https://www.reddit.com/r/opiates/comments/ax6h1c/is_being_a_little_bit_addicted_like_being_a/,12,https://redd.it/ax6h1c,realcat67,Is being a little bit addicted like being a little bit pregnant? And other important questions.,"I had to put that thing about addiction in the title, because originally, the super sophisticated automod software removed this post. It was, apparently, off topic if you can believe that.

Automod uses, sigh, scripts to automate common tasks. Scripts are like the idiot brother of actual code. Hire some real programmers, reddit! Maybe they could make a decent mobile app while they are at it.

So I have revised this post to include opiate related keywords like addiction., which hopefully will keep this post from being removed.

Here are some other, serious questions you should consider this morning.

When will George Martin stop playing the game of groupies and finish the series? Will it be before or after he dies?

Is it true that mods sell their souls to the devil?

Will the mods ever develop a sense of humor? Or will brain surgery be required?

How do people believe that green superfoods taste good? Waffles taste good. I am not sure that even rabbits would eat superfoods and I sure as hell don't know how ya'll got talked into it.

Will heroin even be a thing by 2025? Or will fentanyl be the one opiate to find them and in the darkness bind them?

Are they ever going to stop writing books about Keto?

If I come talkin' that trash, will they really pull my card?

How much longer do I have to pretend that Demi Lovato actually knows how to rock?

Exactly how many zombies will Michone have to kill before Judith is safe? I figure 6.8 billion.

Is Paul Mccartney truly immortal or is that just a rumor?",1551701666.0
ax6eia,https://www.reddit.com/r/opiates/comments/ax6eia/getting_a_new_benzo_soon_brotizolam_just_worried/,8,https://redd.it/ax6eia,Debbiedowner750,Getting a new benzo soon (Brotizolam).. just worried because of the potency.,"I'm going to acquire some brotizolam tablets (0,25mg's), and some other fun pharma's (librium 10mg & 25mg, nitrazepam 5's, flurazepam 15's.-> these are pretty weak and never caused me troubles)

Even though I am excited about trying new pharmaceuticals, to be added to my list; I am kinda worried about the synergy of brotizolam and opioids. I am prescribed 30mg ms-contin (morphine sulfate extended release) for pains daily, and added clonazepam(0,5-1mg if needed) or bromazepam (3-6mg if needed) (prescribed too) for extra sedation (to go sleep, or to relieve stress.)

Should i be worried about combining the brotizolam with my daily prescribed morphine? I am not the type to overdo things, so if I get my hands on the brotizolam tablets, i'm not gonna do more than 1 per night. I would also choose to use 15mg of morphine instead of 30mg. From what I've read is that brotizolam 0,25mg is close to a 1mg rohypnol tablet etc.

I never do experience bad breathing or respiratory depression, so should I be worried? I'm getting a tripsitter during the tryout of brotizolam.

TLDR: I am going to try out brotizolam soon, but am prescribed 30mg morphine extended. Would this cause a huge problem?",1551701163.0
ax68sr,https://www.reddit.com/r/opiates/comments/ax68sr/think_my_dope_is_cut_with_benzes/,6,https://redd.it/ax68sr,blood4bllood12,Think my dope is cut with Benzes,"been Coppin new dope for cheap from a new guy. ive been in the game for years and know quality. I started getting this new stuff and it leaves a lot of cut left behind when cooking,like white sand granular things. It has a nice rush to it and im pretty sure its fent which I accept at this point. but the thing is 1) I also speedball daily and since using this shit I just can't get a rush from the coke AT ALL and it doesn't matter whose coke I use. This has happened to me before when ive used Benzos the night before (which I haven't in this case). 2) I keep getting accesses from this guys stuff. I had 3 in the past month when I never had them before and right now I have one brewing and I used clean work, clean cooker and water. so im pretty sure this stuff is dont being mixed sanitarily.

&#x200B;

any idea what else could be causing this white granular sand like cut to be left over?",1551700051.0
ax5zr4,https://youtu.be/TZdwM4sAfCk,3,https://redd.it/ax5zr4,frezzhberry,"Not entirely opiates related but it's a documentary on the history of medicines including ones containing morphine and cocaine. I figured some of y'all would find this fascinating like me. If you're into history documentaries definitely check out more of his videos, I'm hooked myself!",,1551698023.0
ax5x7n,https://www.reddit.com/r/opiates/comments/ax5x7n/subway_and_package_thieves_are_the_worst/,2,https://redd.it/ax5x7n,HeroInDisguiseGetit,Subway and package thieves are the worst,"The only thing worse than coming home to a package missing (drugs  or otherwise, but given the subreddit....) Is have a snatch and run as doors close or worse yet. The pickpocket we while awake or asleep. That's the worst because the minutes or longer patting yourself like a handsy frantic cop knowing it's not there but your fingers tricking you that MAYBE just maybe the faint feeling of a warm Starburst is actually the corner on a brand new iPhone.... Which happened to me today... I've been relatively good, trying like crazy which is all I can do really which makes it that much worse.... I finally after not having a phone or a smartphone for nearly two years after working my ass off f
And betting really well having multiple really weeks I sprung and got a phone
I needed it really because I'm A) floating homeless, get air BnB when possible, sleazy hour rooms, and a storage unit I have when feasible (it's upstate and between train, time, etc unless I'm there 2-3 days straight. 

Anyway last night I was on the train after a less than stellar weeks tips and post child support check didn't allow for  a room. I could have sworn I had the phone not only on the inside pocket but the inside pocket inside a sweater under my jacket

And this dirtbag got in somehow, got it and left... Now here's the kicker... I thought I felt something so I get up I start asking the Mexican lady next to me if she Saw anything and she basically said she's not getting involved the other person I asked of icpjls use their phone to call it (I've had someone's steal some shit on the Subway and stay in the same car, unfortunately for him I woke up to him looking  me clutching me stolen item. 

They Also say no... The gut punch was right around the time this was unfolding our dimwitted thief calls my ex through a text she had sent the phone earlier posing as a cop asking for the passcode (idiot I know) she was half asleep so not so much played along but took a sec to register... finally she said why would you need the code? I can give you his work number now doesn't that make sense? He responded by yelling are you going to tell me the code or na?!? 


God guys IDK how much more I can take, I know it's just a phone but it what it represents, I was in the hospital for the majority of the year with a legitimately broken back, during that time the woman I was with for nearly 7 years cheated on me before my 30th bday but my first I'd have the privilege of being in a wheelchair for. During this time of had no relationship with my daughter who I raised with said now (she's not kid mom, kid calls her her REAL mom) and I was high more than sober. 


The phone was me using money for other things than drugs, it was job interviews, applying and looking at apartments, as shallow as it sounds be held accountable for not looking like a junkie for social media (well aware it can be hidden but I can go dark fast) also it was great to have Internet for needed things and not be alone all the hours I'm off alone. 

Fuck you thief you possibly triggered a heavy relapse",1551697458.0
ax5nk0,https://www.reddit.com/r/opiates/comments/ax5nk0/heroin_and_phenibut/,5,https://redd.it/ax5nk0,Bobandgene27,Heroin and phenibut,"So the other night I mixed a little dope (first gram ever), phenibut, and kratom. O was nodding so hard and I puked on myself. aanybody ever mix them is it dangrous? 

Also I was sweating bad and had a really red face at work the next day on just some H. Is that a common H response? (First time user of H)",1551695118.0
ax5m5r,https://www.reddit.com/r/opiates/comments/ax5m5r/beware_of_antipsychotics/,3,https://redd.it/ax5m5r,HoldingOnToTheEdge,Beware of antipsychotics,"So this is an update to my previous post a couple days ago (can be found here https://www.reddit.com/r/opiates/comments/awmiwo/holy_shit)

Basically I got some ""fresh"" stuff, my guy was told it was uncut fent, but it turns out he was mistaken. It was actually cut with antipsychotics, or it was all an antipsychotic. I'm not convinced it even had fent or other opiates in it at all. 

I shared some with a much more experienced friend who confirmed my suspicions that it wasn't right.

But guys, i did one tiny shot the day i got it, and sniffed a tiny bit yesterday morning, but my body is still shaking uncontrollably and I've had a killer headache. 

I'll be getting some regular stuff today if all goes well, but i just wanted to give an update and warning to you all about these crazy side effects. I'm really hoping the trembling goes away soon. Does anyone know how long antipsychotics can last for?",1551694780.0
ax57xu,https://i.redd.it/n140o8sol2k21.jpg,3,https://redd.it/ax57xu,newlifesweezy,"Late night trade for a fent 30 a real 30 some Pinks some tiny oxy 5's im 7 days outta detox. Progress not perfection , back to methadone after tmrw will I ever clean up ? Probably not . Life is too good with opiates. The anguish that dissipates after that first hit is godlike",,1551691421.0
ax555h,https://www.reddit.com/r/opiates/comments/ax555h/what_are_some_medications_not_suboxone_that_help/,14,https://redd.it/ax555h,papappie,What are some medications (not Suboxone) that help with withdrawal from opiates?,"Looking to quit cold turkey and need to know the best meds to combat withdrawal.  I thought I'd previously read that Clonidine and Neuroton (sp?) are 2, but I'm not sure what symptoms they help with.  Is there anything else crucial to enduring the process?  Not really looking forward to night sweats or stomach issues.  

&#x200B;

I've been thinking about quitting for a while now, but a recent development has kind of forced my hand.  I'm in pain management for legit back issues and have been prescribed oxycodone in various doses for about 15 years.  The highest dose was around 205mg per day.  I was on that for 10 years, but with all the new FDA rules and such, I have been drastically cut to around 75mg per day for the last year or so; which sucks but I've adjusted as best as I can.  I just considered myself lucky to still have a doctor willing to prescribe opiates for pain. 

&#x200B;

 All that changed a couple of days after my last appointment when the DEA raided her office.  According to her, they're investigating whether she's assisting patients with 'diverting' pain pills to the streets, which is ludicrous.  This woman is the strictest, most by the book doctor I've ever been to.  She performs random drug tests, and not just urinalysis. She's also conducted blood draws, hair follicle, and saliva tests in case patients are some how circumventing the piss tests and she's immediately discharged those that have street drugs in their system or those with none of the prescribed meds.  She also calls people in for pill counts, which I've never had to do with any doc before, and she's cut down patients (like me) with what the FDA now considers high doses.

&#x200B;

Bottom line is, she knows her shit and she complies with all federal regulations and guidelines.  According to her, she was not arrested and the DEA did not suspend/revoke her license to prescribe, but they did ask her to not to write any more until their investigation concludes.  That was nearly a month ago.  It seems to me like they've already investigated her and couldn't find anything on her, so this is the tactic they use to either intimidate legit doctors or force them to close, since technically, they can keep an investigation open for years.  

&#x200B;

As such, its probably better if I just quit and suffer rather than trying to find another doctor since they're almost extinct anyway.  I don't want to trade one dependency for another, so Suboxone is out and I can't really afford to be away from work and family to go to rehab, so I'll just try to quit cold turkey.  I know there are medical concerns with this method and it's easier said than done, but I'm going to try it.  So I appreciate any suggestions on any meds to help ease the issues I'll go through when I withdrawal.  Thanks in advance.

 tl:dr - pain management doctor is no longer prescribing and I'd like suggestions on meds to help with opiate withdrawal",1551690774.0
ax5345,https://www.reddit.com/r/opiates/comments/ax5345/why_doesnt_australia_get_hydrocodone/,6,https://redd.it/ax5345,OxyNormal5,Why doesn’t Australia get hydrocodone?,"I know we get Dilaudid (hydromorphone), but hydrocodone doesn’t exist here. I’d love to test 10mg of hydrocodone and compare it to 10mg of oxycodone. I reckon it’d make a better comparison, than codeine. Which we prescribe heavily, despite it doing jack to 10% of the population, due to genetics. You’d be better off prescribing morphine. ",1551690325.0
ax4zba,https://i.redd.it/3fvhmbprf2k21.jpg,10,https://redd.it/ax4zba,OxyNormal5,"Doing my first line of oxy. Only 5mg. Might make this my preferred ROA, if it’s more effective.",,1551689420.0
ax4z28,https://www.reddit.com/r/opiates/comments/ax4z28/how_long_will_this_withdrawal_last/,4,https://redd.it/ax4z28,lilpeepHD,How long will this withdrawal last?,"On and off CWE codeine user for a year, small amounts couple days a week.

5 days ago I ended a 2ish week long binge of dihydrocodeine, daily dose of 300-450mg. Not addicted, can really take it or leave it.

No real physical withdrawal symptoms but severe anxiety and depression. It's now day 5. Surely these symptoms should have subsided by now? Driving myself nuts I feel terrible, better than the last few days but far from OK.

I've also been on 100mg of zoloft per day for 8 years.

PLEASE someone tell me this hell will end soon???  ",1551689359.0
ax4xn3,https://i.redd.it/vd81bszie2k21.jpg,4,https://redd.it/ax4xn3,opiatetrippin,Hey just wondering if these RO 20’s can be snorted or what would be best ROA,,1551688995.0
ax4kpm,https://i.redd.it/j7ubioc452k21.jpg,10,https://redd.it/ax4kpm,jvsonnnnnnn,"Nice little night for me everything pharma as it should be! Hydrocodone, Alprazolam, Sweet sweet oxy happy nods! Who else likes mixing a small dose of Xanax w opiates ?",,1551685830.0
ax44o4,https://i.redd.it/x63gcnxju1k21.jpg,8,https://redd.it/ax44o4,Thenewbiekratom,"Shot and missed 6 hours ago.. new to IV. Arm hurts like a bitch. Can barely stretch my arm out. Tiny bump, red, and warm to the touch. First abscess? Or just a painful miss? P.s any signs or symptoms I should be aware of?",,1551682278.0
ax3wwy,https://www.reddit.com/r/opiates/comments/ax3wwy/chipping_subs/,6,https://redd.it/ax3wwy,hydromack,Chipping subs,So I’ve been cutting little slides off the 8mg sub film. Literally one film last me a little over a week and I only dose once a day before work I’m vary past withdrawals but the mental part stay with you for a very long time the loss of interest and the lack of willingness to do anything has be killing me so the subs been helping.. but I’m wondering what is life after you drop subs do you feel normal again overtime does the anxiety leave ? Does that “I need to be high”feeling goes away?,1551680658.0
ax3uwc,https://i.redd.it/3hxsf5pdo1k21.jpg,12,https://redd.it/ax3uwc,idgafsolid,"1, ... 2, ... 3! Here I cooommeee!",,1551680241.0
ax3t11,https://www.reddit.com/r/opiates/comments/ax3t11/help_probation/,10,https://redd.it/ax3t11,Dijdjdhhs,HELP PROBATION,I got put on papers and have a drug test soon. I am a chipper and the last time I used I shot up 120mg of oxy on weds and i shot up another 120 on thursday. My last hit was at like 6pm on thursday. I have a test tomorrow in 10 hours. I have 2 friends on probation who use synthetic urine so i got some but i am really nervous about using it since if you get caught with it you go to jail. I got a drug test from the local headshop that is supposed to be the same kind they use at court it is a 10panel cup. I used it tonight and came back positive for oxy but negative for opiates. There was a faint faint super faint line on the oxy strip but pretty much a positive. Its been about 72-80 hours since i did any do you guys think if i chug a bunch of water before i go in i will be good? Should i just risk using the synthetic urine? What should I do?,1551679847.0
ax3rys,https://i.redd.it/8dchr0rnm1k21.jpg,9,https://redd.it/ax3rys,UnitGod,Thoughts on this pickup today?,,1551679633.0
ax3pz5,https://www.reddit.com/r/opiates/comments/ax3pz5/could_i_get_the_same_feeling_i_get_when_im_high/,11,https://redd.it/ax3pz5,fooxpeep,"Could I get the same feeling I get when I'm high, if I was just happy when I'm sober?","Would I be this way sober if I was just happy? The biggest thing about this to me is how much easier it makes it to socialize with people, especially if I don't know them too well. I don't know if this is a stupid question or not, but I don't know the answer. I never do anything too strong, just enough. Things feel more simple. sorry",1551679237.0
ax3l8i,https://www.reddit.com/r/opiates/comments/ax3l8i/iving_coke_is_so_beautiful/,7,https://redd.it/ax3l8i,escuuusepls,IVing Coke is so Beautiful,"Since it mixes up clear, when you register, the plume of blood shoots through and dances in the barrel of the syringe ever so beautifully, letting you know you are cleared for take off.

The blood going through clear solution just looks so nice. Also anyone notice when they mix up a speedball the resulting solution is like a translucent brown and more clear than if it was just dope? How does the coke make the heroin solution less murky?",1551678301.0
