a1se9j,https://www.reddit.com/r/opiates/comments/a1se9j/uv_light_for_sterilizing_shots/,0,https://redd.it/a1se9j,OxyCaughtIn,UV light for sterilizing shots?,"I was at work last night and ended up flipping through a magazine someone had left in my area. It had a water bottle that used UV light to sterilize the water and bottle.

Now, I had heard of this tech before but it got me thinking, I wonder how effective using one of those relatively cheap UV light sanitizing wands to sterilize shots of dope or whatever would be?

Anyway, just something I was wondering while waiting for this girl to wake up so I can go buy some dope. I honestly probably wouldn't bother myself, but if there is anyone out there who is very worried about bacteria, maybe this is a good idea?",1543584288.0
a1s5qg,https://i.redd.it/1cx1njs6tg121.jpg,1,https://redd.it/a1s5qg,shygrinch197,Lol,,1543582316.0
a1s3lq,https://i.redd.it/mvlg8l7org121.jpg,5,https://redd.it/a1s3lq,JawnJawnington,Had to rp,,1543581807.0
a1rrbw,https://i.redd.it/iony1ed3ig121.jpg,10,https://redd.it/a1rrbw,adderseverywhere3,My fath in cold calling has been slightly made better. Thanks to my new homeless fiend who sorted me out just for a bar and got a contact too to get more :),,1543578577.0
a1rl0c,https://www.reddit.com/r/opiates/comments/a1rl0c/70_water_30_urine/,13,https://redd.it/a1rl0c,580980,70% water 30% urine,"So I have a drugtest coming up so before consuming anything I peed a little in a baggy.

Now after there are some drugs in my system I figured it was too little so I filled the baggy with water, the amounts are around around 70% water and 30% urine... Is it still usable?",1543576728.0
a1r9o3,https://www.reddit.com/r/opiates/comments/a1r9o3/surprised_about_open_air_markets/,2,https://redd.it/a1r9o3,FuckFaceFrankie,Surprised about open air markets,"I was just thinking about it and am mildly surprised that between trumps admin, and more especially Jeff sessions, as him wanting to bad to convict trump I think shows that aside from being the drug wars biggest cunt in a while (since Nancy regan?), he really does ""believe in"" what he's doing and thinks he's going after justice himself

That being said, im really surprised they haven't brought in military/cops nationwide to go into the country's biggest open air drug markets and start obligerating everyone.  Locking up every single user injecting on the street (in places where that's common)... all the d-boys, all the buyers unlucky enough to be in line for them. Hell during this blitzkrieg of an attack even people who look fucked up getting shook down

I mean I'm only mildly surprised because the drug war really works for them so well because there's a constant flow of new... revenue earners for the state/prison/cops... and really locking shit down in these extreme of a way I think would hurt their eaasy $ when people are more careful in the future

I dunno, just thinking out loud but does anyone agree?  Never in history would this surprise me before,  and Def not even with trump alone because despite what he talks, that's all he does,  he talked about disguist with the drug war & legalizing drugs being the best option before he decided the rifht+far right were the dummies he could best manipulate and impersonate... man what a fucking joke. Thinking about it all makes me even **more** depressed lol. The world is a piece of shit and people are shit incarnate. ",1543573326.0
a1r8us,https://imgur.com/NyQ1t2U,3,https://redd.it/a1r8us,peterberg242,Back at it just for the night..3 buns ECP for a decent price,,1543573065.0
a1r6fd,https://www.reddit.com/r/opiates/comments/a1r6fd/avoiding_temptation/,3,https://redd.it/a1r6fd,mousebank,Avoiding temptation,"I ran out of Norco a couple months ago and it just barely stopped me from going completely off the rails. I missed it a lot during that time, but I didn’t go back to it. I stuck to weed and it was good enough.
Now, I’ve come across a whole bottle of pills. I’m going to sell them so I can pay rent, and you know, not get hooked again. But until then, they’re taunting me. It’d break my roommates and my girlfriends heart if I took any
I’m just struggling so hard, until I can get them out of my house.
I’ve been considering investing in a vape or something to keep myself from getting sucked back into my old, far more dangerous habits. Thoughts?",1543572372.0
a1r5v4,https://youtu.be/PsqvliyTQwY,3,https://redd.it/a1r5v4,The_Supreme_Leader,How addicts are lured into sex trafficking,,1543572195.0
a1r5jy,https://www.reddit.com/r/opiates/comments/a1r5jy/i_feel_stupid_when/,9,https://redd.it/a1r5jy,extremelystupid77,I feel stupid when,"I nod out w my phone in my hand and and wind up w my homescreen icons in ""folders"" and idk how to get them out. Fucking Android. It ain't right, making a smarter phone than user.",1543572107.0
a1r28k,https://www.reddit.com/r/opiates/comments/a1r28k/newbie_to_opiates/,3,https://redd.it/a1r28k,justanotherdude444,Newbie to opiates,"So I'm pretty new to opiates I've taken alot of other stuff but always stayed clear of opiates cuz my mate was a heroin addict so we stayed clear. My mate moved over to Germany with his fiancé and since then I've been mostly clean of everything, even joined the railway for a bit so had to be clean for that.

Anyway, I've started experimenting with oxy a little my girlfriend got given a load of longtec ages ago. The first time I took I had no idea what it was and stupidly took 40mg (unknowingly) for a migraine cuz I thaught it was codine, man I felt rough as fuck she was not happy with me on that one, got rid of the migraine though haha. It was her own fault she cuts up the blister packs so you can't see what it is or the dosage. 

More recently though I started to take them for the fun of it but don't really know what I'm doing. What sort of feeling should I get from them? How much of a dose should I be taking (20mg tablets)? And aside from that what can I do to stop the queezy feeling I have seemed to get on other times I have dropped?

Any advice will be much appreciated also I'm 6ft 75kgish dont know if that helps
",1543571078.0
a1r2g6,https://www.reddit.com/r/opiates/comments/a1r2g6/tryna_do_a_quick_sub_taper_for_like_the_tenth/,1,https://redd.it/a1r2g6,goyange,"Tryna do a quick sub taper, for like the tenth time...just a quick question","So I’m planning on doing a rapid sub taper that’ll last me from 4-5 days (at best). I’m just wondering after I stop taking the subs, will I go through any type of WDs? Whether it be from the subs or the h I don’t fucking know. Just been bugging me because every time I did a sub taper or try to quit I can never get past the next day of being completely clean and just end up copping. But this time I really want this to end, or at least, for another good year or two before I magnificently fuck it up or something, but that’s just me being pessimistic. 


I apologize if this question’s been asked a lot before, I looked into other people’s topics about their sub tapers here and haven’t really found an answer to it yet. I’d also welcome any tips while I’m doing this taper; would taking gabapentin + Xanax help? I definitely need to take something for sleep, and I have trazadone or Ambien* I can take but they never really helped me sleep, just made me very uncomfortable. /: 


So here’s the stuff I have to help me go through the WDs: gabapentin, 2 8mg sub strips, 2 Actavis 153(? Tf is this?) pills, trazadone (meh), Ambien*, a wonderful boyfriend who puts up with all my bullshit, and possibly some Xanax if I’m lucky. ",1543571152.0
a1r0ri,https://www.reddit.com/r/opiates/comments/a1r0ri/high_and_feeling_deep_af/,7,https://redd.it/a1r0ri,odigf420,High and feeling deep af.,"So this past year I have been technically dead twice. Both times there was nothing. Just an endless black void. I was never raised super religious, even though many of my family members are very active in worship. I’m not sharing this to offend anyone or their beliefs, but I’ve always labeled myself as Catholic and believe there is a god out there somewhere. After these two experiences, it’s made me think a lot of my purpose and what comes after this life. I still don’t have the answer to either of those and I probably never will. And that’s okay. One thing I do know is, I do not fear death anymore. I’d love to hear if anyone else has had a different experience/outlook.",1543570626.0
a1qprr,https://www.reddit.com/r/opiates/comments/a1qprr/dilly_dilly_make_me_silly/,1,https://redd.it/a1qprr,functioningjunkie,Dilly dilly make me silly.,"Banged 4mg for the first time. How pleasant. I don't itch nearly as much as I do when on boy which is nice. What's everyones opinion on IV hydromorphone?

Edit: got me feeling a bit nauseous. ",1543567220.0
a1qnfj,https://www.reddit.com/r/opiates/comments/a1qnfj/a_line_or_two_before_bedhorrible_idea/,6,https://redd.it/a1qnfj,enzoastoria,A line or two before bed.....horrible idea,"So I don’t usually do any H when it’s getting close to beddy-bye time. Tonight I was laying in bed watching Game Of Thrones YouTube, when suddenly I heard my bags start calling my name. Very soft spokenly I hear ‘Enzooooo...... Enzoooooo...Enzoooooo’ So I did a few lines, and bam. I can’t tell if I’m really high, or really tired l. Last night I slept from 1:07 am, woke up at 3:49, and since I had to be up at 5:15 anyway, I didn’t even bother trying to go back to sleep. Worked all day, typed up the reports, watched the Cowboys beat the Aints, and got into bed. That’s when I heard the bags calling my name, so I did those lines. Now I’m high, but really sleepy. I’m nodding in and out, and can’t keep my eyes open. I went to go smoke a stogue, and seriously fell dead asleep for 10?seconds. Typing this post is taking close to 35 minutes now. Should I just fall asleep and risk not waking up ever, or should I walk up to 7-11 and get the French Vanilla cappuccino to keep me awake for like the next 11 hours?

Btw.....I know this post is like all over the place....but have mercy, fam.......I’m either high as fuck, or sleepy like bastard ",1543566508.0
a1qnby,https://www.reddit.com/r/opiates/comments/a1qnby/sleeping_while_stopping_opiates/,10,https://redd.it/a1qnby,borderlinelove,Sleeping while stopping opiates,"I've dipped in an out of opiates for a couple of years. Mostly just norco or oxy. I've had a bad shoulder injury for years now and was taking 10-40mg oxy a day for about 8 months now. I had surgery 2 weeks ago and my pain is much better. I am running out and dr will not prescribe more. I am having a hell of a time sleeping. I sleep for about 2-4 hours at a time and then wake up wide awake. I am also cranky as hell, which I am contributing to the sleep disturbances. 

I do have a couple things I can try but was wondering what everyone's experiences have been.

I have about 15 5mg oxys left. I also can take benedryl and have a prescription for 0.5mg ativan.

I am on a mood stabilizer/sleep med which is 50mg seroquel, so I can't take other sleep meds.

&#x200B;

Anyone have any ideas to help?",1543566478.0
a1q7bq,https://i.redd.it/8yr79z2p3f121.jpg,0,https://redd.it/a1q7bq,johnnyrizzo1,Plug hooked it up with a couple free pins for dragging👍(only made me wait an extra 10 mins),,1543561645.0
a1q1x6,https://www.reddit.com/r/opiates/comments/a1q1x6/im_about_to_drop_my_dboy_over_a_minor_issue_just/,12,https://redd.it/a1q1x6,FitThought,"I'm about to drop my dboy over a ""minor"" issue, just want to know if my feelings are understood by anyone else or not.","I'll keep this short and sweet:

I tried out the NA thing a couple times(Just wanted to see whats up, I wasn't trying to quit) and on my last meeting I saw my dboy there. I was wondering ""wtf is he doing here for, I didn't know he used"" and after the meeting we talked and I just asked how he was doing and if he was done selling. He told me no and he just comes to NA meetings to find clients. That kind of struck a chord with me but I let him talk about it for a bit, asking him why here. He said it was an easy client pick-up spot. He'd throw a free point with his phone number and leave it at that.

Does anyone else think this is shitty? Yeah, I don't like NA very much but these are people trying to get clean and you're intentionally trying to get these people back on the needle. That seems fucked up and I don't know if I can keep going to someone who has so little care about another human-beings well being. 

I'm sure if there was a dude who had a gun to his head or a $10 but the dude pulled the trigger...he'd take the $10 and walk away smiling.

Any advice?",1543560161.0
a1pyf6,https://www.reddit.com/r/opiates/comments/a1pyf6/should_i_tell_me_doctor_im_already_taking_suboxone/,4,https://redd.it/a1pyf6,neinhacker,Should I tell me doctor I'm already taking Suboxone?,"I've been a heavy heroin user (1-3 grams daily), and I finally managed to quit when I found someone who would sell me their Suboxone. I started at 16mg daily and tapered down to just 8. I finally have insurance and would like to go the legal route and get myself a prescription.

Should I tell my doc I've already been taken subs and the dosage I've been on?",1543559230.0
a1pwgo,https://www.reddit.com/r/opiates/comments/a1pwgo/hed_be_28/,4,https://redd.it/a1pwgo,dori_88,He'd be 28...,"Hey r/opiates ... 8 years ago today my brother died of a heroin overdose. He was 20 years old. His shit was mixed with fentanyl and it killed him. Not to mention he OD'd and was narcan'd 2 nights before his death. I miss him terribly. It's really hard for me without him. We were just growing out of that ""teenage I hate you"" phase and into respectable adults. His death rocked my world and still does. Anyway, yeah I wanted to share.",1543558717.0
a1pwax,https://i.redd.it/yz7ovkswue121.jpg,3,https://redd.it/a1pwax,rodgermodnight,The best of the best,,1543558675.0
a1pvwp,https://i.redd.it/9cwy4g3mue121.jpg,12,https://redd.it/a1pvwp,quietmoney513,500 pack of mints! 🤪😉,,1543558574.0
a1popm,https://www.reddit.com/r/opiates/comments/a1popm/arm_hurts_like_hell_after_missed_shot/,2,https://redd.it/a1popm,Thenewbiekratom,Arm hurts like hell after (missed) shot,"I did a shot a couple hours ago and It didn’t sting very much when I shot it but afterwards It started to hurt like a bitch. Tender to the touch, It’s warm, but I can’t tell if there’s any swelling yet. I’m worried does anyone know if this goes away??",1543556840.0
a1pltj,https://www.reddit.com/r/opiates/comments/a1pltj/snorting_suboxone_strip_experience/,3,https://redd.it/a1pltj,raviopi,Snorting Suboxone Strip Experience,"What's up, everybody? I'm doing something very fiendish, immature, and desperate tonight for the curiosity of myself and others. I am snorting an 8 mg/2mg Suboxone strip.

Let's get right to the point. To prepare, I cut the strip in two pieces, rolled both pieces up, and inserted them into my nose before sniffing them in a little to get them nice and in there. 

It felt slightly uncomfortable, but was certainly bearable. It is about 10 minutes later now and I have already begun to feel the effect of the strips. I am sweating slightly, which i didn't quite notice until a moment ago. One thing I didn't expect much is that the drip came pretty quick. I am aware that suboxone doesn't work very well swallowed, so I'm simply not swallowing and I am swishing the drip. Like I said, fiendish immature behavior tonight. 

I will keep you guys updated on how this stupid experience goes shortly. Sorry for my shitty sentence structure, flow, and structure. I just got on Suboxone, and ever since I've gotten off the real deal my mind races and i feel incapable of doing anything with much coherence. But that's for another post.",1543556165.0
a1phiv,https://www.reddit.com/r/opiates/comments/a1phiv/buprenorphine_and_wet_dreams/,2,https://redd.it/a1phiv,OxyNormal5,Buprenorphine and Wet Dreams,"So last week I was put on a buprenorphine patch, and I started having wet dreams every night. I’d also wake up nauseous and want to puke (hence why I stopped it). 

I know opioids kill your sex drive. I can’t cum and struggle to get an erection, while on oxycodone. But why would buprenorphine reverse it? 

Was the buprenorphine pulling the oxycodone off of the receptors, and thus giving me my sex drive back? ",1543555120.0
a1pg0m,https://i.redd.it/jrym2ffbje121.jpg,0,https://redd.it/a1pg0m,xpinsandneedlesx,Some HQ pieces of fire H🔥,,1543554789.0
a1pco4,https://i.redd.it/clbcfsz6he121.jpg,1,https://redd.it/a1pco4,OxyNormal5,Oxycodone. Oh how I love thee...,,1543554064.0
a1ozmt,https://i.redd.it/wyldd5g58e121.jpg,6,https://redd.it/a1ozmt,leftcoastenvy121,"Obligatory not opiates, but...",,1543551051.0
a1ox0l,https://www.reddit.com/r/opiates/comments/a1ox0l/i_just_boiled_down_the_lining_of_my_works_bag_to/,7,https://redd.it/a1ox0l,evergreenBoys,I just boiled down the lining of my works bag to get a cotton shot.,"I ran out of cottons so thought I'd rip the lining out of my pencil case that I've been using to carry my points, cooker/spoons, hairron accessories ect..

It worked and I'm high but I'm just waiting for that cotton fever to set in haha. **I don't recommend this as it's definitely a junkie thing to do.**

[Materials](https://i.imgur.com/YShMSX3.jpg)

If anyone cares to know my process let me know in the comments. Aiiieeee.",1543550496.0
a1ou95,https://www.reddit.com/r/opiates/comments/a1ou95/quality_of_dope_in_the_south_what_is_cheese_and/,11,https://redd.it/a1ou95,starlitobaby615,Quality of dope in the south? What is cheese and gunpowder?,"Hello 

I know I am not allowed to say specific places so I will just say “ the top of the south” like major cities in KY, TN (Country music..) etc..

Is all the dope down here filled with fent? I just started to try dope this past august after a decade of using 30s n pandas.. I sniff it a week or so out of each month when no pills are around.. so far with my dope connects I have two.. one is cheaper but he says it’s very fent based and it is a grey powder that has no smell and taste awful.. the higher quality stuff the dealer claims has no “barely to no fent” is a light brown almost white tan powder that has small rocks that crush up in the powder and smells very strongly of vinegar.. what are the chances that this really is dope without fent or much fent? Does that even exist down south? I know nothing of the dope scene here.. 
    For reference, the dude with better stuff says this is “gunpowder”.. it’s a light tan powder that has small chunks you crush up? And the fent guy claims his stuff is ECP or “cheese” from Baltimore? 

What is cheese? What is gunpowder?
And what is the quality I’m looking for? I perfer the more heroin based stuff as it takes 24hrs to have sickness come on and takes less for me.. I can do .3 a day and feel SO euphoric, as opposed to my normal 0.5-0.8 use if it’s the fenty powder. And I rarely have to redose with the real heroin. It’s iust way better than fent, fuck fent.

Lastly- what are normal prices?
I’ve been paying 80 a half, 155 a g for the “real heroin” and 65 a half and 120 a g for the “fent bs”. Does that sound normal for the south? 

Thanks for any advice I apologize if it’s a boneheaded question. Please excuse any typos. Trying to gather some information. Hope all of you catch a nice high and good sleep tonight. May JJ bless y’all haha",1543549886.0
a1orx1,https://www.reddit.com/r/opiates/comments/a1orx1/my_story_of_todays_pickup_posted_picture_earlier/,9,https://redd.it/a1orx1,TheDopeScoobySnack,My story of today’s pickup (posted picture earlier today),"So today I caved after being 7 months clean, now I knew this was coming and i have no choice but to chip occasionally because I’m on probation lol but this day has been planned for about a month. So here it goes.

Today i had the day off work cause I had a couple of appointments and errands to run. I woke up around 7 and got ready and headed to my dentist app. Took about an hour and got out and ran over to a store to get some khakis for my work’s Christmas party this Saturday.  Got those and swung by the bank. (I got triple time for working on thanksgiving and Black Friday) so my check was roughly $1000 before taxes. Anyways withdrew $300 and tried getting a hold of both my d-boys. No answer from either, well whatever I started to drive to the city and worse case scenario I’ll cold cop. Kept calling and still no answer. Now the corner I usually hit up was lit up by cops so I took a breath and ran a couple blocks over and I got flagged down. I sampled a 20 of hard and 3 stamps for 20 also. Said I would come back if it was fire, well it was so i grabbed 2.7 more buns making it 3 total, I also grabbed a half gram of hard, and a gram of soft. Smoked some rock and went on my merry way.

Well I was on my way home but had to swing by a neighboring town to get a haircut and swing by auto zone (muffler has a nice hole). Well I’m about 8 minutes from town and I’m on speakerphone with my mom and I notice a cop behind me. Mind you I’m on probation and out of county. Well I pull into a gas station and get the lights thrown on behind me! Fuck I’m going to jail, 3 different drugs on me, and talking on my phone, he’s gonna pull me out and search my car. Well some how I got lucky, maybe JJ was looking after me today because he didn’t search me, asked if I was on probation I said yes, was polite and he was nice asking me how everything’s going (I have 2 misdemeanor drug possession charges on my record). Well he cut me a break on the cellphone and gave me a ticket for the inadequate muffler! Holy fuck was I shitting my pants. Thankfully I just got really lucky!

Well now I have a question that hopefully you guys can answer. Should I report this ticket to my PO or just get my muffler fixed (was in the process anyways) and head to court and they’ll just dismiss it for having it fixed? Will this show up in a search by my PO or no? I would mention it but like I said I was out of the county without permission and that’s grounds for a VoP.

Anyways stay safe everyone and happy nods to all! Thanks for reading!",1543549345.0
a1oopo,https://www.reddit.com/r/opiates/comments/a1oopo/looking_for_the_ralph_wiggums_meme/,3,https://redd.it/a1oopo,ThrowawayEVE_,Looking for the Ralph wiggums meme,The meme of Ralph in the school bus saying “I’m in danger” that one anyone got that one. I can’t find it ,1543548633.0
a1ojzt,https://www.reddit.com/r/opiates/comments/a1ojzt/oxy_panic_attack/,11,https://redd.it/a1ojzt,anon4200000,Oxy panic attack,"Anyone ever had a panic attack from oxy?

I have no tolerance really. Just copped oxy for the first time last Friday and have only taken 2.5 since then (30mg oxycodone).

I usually take a half and smoke some weed and chill at home playing xbox. This time I took a half and decided to go have some lunch with friends. I was in the car with my buddy, and his brother died a couple years back from heroin OD. 

I started to think about fentanyl, and then my pills, and then my thoughts just spiraled out of control and before I knew it I felt cold chills running up my legs and into my whole chest. My stomach was in a knot. I couldn’t even hear what he was saying to me. My friends don’t know I’ve bought these opiates so that worsened the anxiety.

Being that I have no tolerance, I honestly considered if I was overdosing but I had taken these same pills the days prior and knew they weren’t fent.

The only thing I can think is the weed, but I smoke weed daily and have done so for 5-6 years. I do have some anxiety problems, but never so intense.

Sorry for the wall of text, but am curious to hear back from this community.",1543547572.0
a1oifh,https://www.reddit.com/r/opiates/comments/a1oifh/passing_the_ua/,8,https://redd.it/a1oifh,Clitoral_Cunt,Passing the UA.,I just did my last shot of neigh neigh and am looking at a cold turkey kick. I have one 8mg suboxone strip but am worried about it showing up on my UA for probation on 12/13. Would it be a bad idea to use the suboxone to help with the kick or should I stay safe and kick cold turkey so I piss clean for sure?,1543547242.0
a1oien,https://www.reddit.com/r/opiates/comments/a1oien/my_dealer_got_locked_up/,6,https://redd.it/a1oien,CaliforniaDreamWalk,My dealer got locked up.,"Main, solid dealer got popped. He's a good dude too, 70 year old guy. Forgave debts and always fronted even if I owed him. Got charged with selling cocaine and another one involving a vehicle and dealing. Dude just had brain surgery a few months ago. I hope they go easy on him, It'd suck if he gets a big sentence and dies in jail, he can't have too much longer.

Woke up this AM early to go cop and his phone went straight to voicemail. Hit my buddy up and asked if he heard from him. Told me to check the county docket for recent arrests and boom. Got hit late last night.

Anyways I've been on dope for the past 3 months. 5 days clean, then relapsed at month one. 3 days clean a couple weeks ago, relapsed. When I got out of detox like 4 months ago I deleted all my other plugs numbers and havent been able to get them back. 

I'm taking this as my time to tough it out and get clean again. I haven't used since 10am and only have kratom and about .5 of a xan left and 1 ambien. Trying to find a plug for benzos and trying not to cave and buy subutex from my friend so this shit passes quicker. I feel like shit and I know the insomnia is gonna hit me. I just started a coding bootcamp and was too sick to attend my night class tonight and it's the second class so far. 

Fuck. Not tryna cold cop and be stuck on this shit.",1543547237.0
