4orqa3,https://www.reddit.com/r/opiates/comments/4orqa3/its_just_not_fair/,11,https://redd.it/4orqa3,HANDSOMEPETE777,It's just not fair,"For the second time, I have found Floor Heroin. I haven't used in like 2 months, and while sitting.on the toilet I spotted a rock. At first I figured it was probably plaster or something (I've crushed up and snorted drywall accidentally a couple times...not.my proudest moments). But no, I put it on the counter and press it with a coin and bam, I have a nice pile of beige powder probably weighing a quarter gram. I am elatef, stuff like this NEVER happens to me, I was so happy, I figured with my tolerance all the way down I could easily stretch it into 3 shots.

But then it sets in. The guilt. The apprehension. The motherfucking consideration of the long-term consequences of my motherfucking actions  I haven't been high in an eternity, I deserve to be able to have one night of fun.

But deep down, I knew it wouldn't just be one night. It is NEVER ""just one night."" If it had been, I wouldn't have becone a  dopefiend in the first place. So I threw it in the toilet before I could change my mind and do something stupid. I smoked a blunt and beat off, but I still feel like garbage, mentallly and physically. It's like being close to dope suddenly like that caused a psychosomatic reaction and I'm in withdrawals again, because I'm sweating like a pig and my body is all tingly. 

I'm writing this partly because I want to whine and bitch about how life isn't fair and other assorted spoiled-little-brat, wah-wah-wah shit. But I also want to demonstrate that this sobriety bullshit IS possible. I detoxed totally cold turkey with nothing but vitamins, exercise, the Good Lord's love and guidance, and a shitton of weed. I have ALWAYS had incredibly poor impulse control as a result of having ADHD, I have an obsessivr/addictive personality, and I first developed a physical dependence on opiates at age 17 completely by accident because I was in the hospital for 2 months after 4 of my vertebrae were crushed in an accident. I have several screws in ny spine and I'm in mild-to-moderate pain every second of the day. I'm not supposed to lift anything over 50 pounds, but I lift 5-6 times a week, which definitely exacerbates things. I'm telling you all this because, if I can string together a couple months of clean time and turn down free dope, I have supreme confidence that any one of you can do the same. I have zero self-control and I am a massive baby. If I can do this, literally anyone can. So if any of you are struggling or on the fence, I urge you to take the plunge. Give it a couple months, the dope isn't going anywhere, and I guarantee you won't be laying on your death bed saying ""I can't believe I wasted those months giving sobriety a try!"" And for those of you with no desire to quit, I hope that you're all having good weekends, you've got fire shit, and you're relaxing. I hope that you've managed to find a level of balance in your life while using, I certainly couldn't, and I applaud any and all of you who can. So wherever you are and whether you're clean, high, or god forbid withdrawing, I hope you're happy, and you're safe, and you're at peace

Tl;dr found floor dope, flushed it, currently whining and bitching like a little girl

**Edit to add a tl;dr after I saw what a wall of text I just shat out**",1466307220.0
4orpms,https://www.reddit.com/r/opiates/comments/4orpms/can_i_spread_cellulitis_i_obtained_from_my_own/,7,https://redd.it/4orpms,barewithmehere,Can I spread cellulitis I obtained from my own re-used rig to my partner?,"So I'm usually good about rig cleanliness and only using one then exchanging it, but I missed the exchange the past couple weeks for whatever reason so I'm being forced to re-use my own.

If I know I'm gonna have to re-use my rigs, I immediately thoroughly rinse them out, use rubbing alcohol/bleach if I have it, let it sit for a moment, rinse again with water, then set all the separate parts air dry until I cycle it back into use. Rinse and repeat until the exchange is open. Round here there's a 6 hour period once a week where you can swap out your gear. So like two weeks of this with 20 rigs. Sorry I'm rambling, unimportant details and debate-ably bad grammar/spelling. . On xanax and IV'd cocaine right now.

Anyway. I realized something was wrong (I'll occasionally have to re-use rigs every once in awhile but it's always been completely fine, this was obvious something was wrong). I went to the ER, they gave me some antibiotics, and told me it was mild cellulitis of my vein. They gave me 2 different antibiotics and one of them is actually a combo antibiotic, so like 3. That was yesterday. I'm already feeling a lot better, just a little fatigued. The swelling has gone down tremendously and it's not bright red anymore, just looks a little bruised.

My partner knows about my IV use, and is understanding. However we're worried it'll spread to him if we get it on (oooh yeah). The ONLY penetration would be me penetrating him with a condom. Is that safe for him? What about just hand or mouth stuff, would that be safe (what is this, high school?)?

Would we have to swap blood for him to get it, or could he get it from what I just wrote? Couldn't really find anything decisive on the internet. 

Thanks fellas, help me out here, I wanna hear some good news.",1466306908.0
4orl7w,https://www.reddit.com/r/opiates/comments/4orl7w/plugging_heroin_3_two_short_questions/,10,https://redd.it/4orl7w,plugawayaccount,Plugging Heroin #3 - two short questions,"Hey guys, after reading much about plugging I finally want to try it but have too questions:

1) I only get #3, is it necessary to dissolve it with citric acid? It should work without it, but I guess the absorption would be better?

2) I only got 1ml syringes at the moment. I always read about 3-5 ml of water. Would 1ml be sufficient or does less water affect the absorption rate that much? Or can I just load 3-5 1ml syringes and plug them all one by one?

Regards and thanks in advance!",1466304696.0
4orgam,https://www.reddit.com/r/opiates/comments/4orgam/fentanyl_vs_oxycodone/,3,https://redd.it/4orgam,232throwaway232,fentanyl vs oxycodone?,"just curious,  is there any way a pretty experienced oxy user with no fent experience could tell if he got fentanyl blues after snorting them? i just snorted half a blue and it hit me much faster and stronger than i expected, maybe because its been over a week. they look and crush like legit ones so im not too worried but there have been a lot of fake blues going around my state so some knowledgemay prove useful. let me know theennnnnkks",1466302343.0
4orfe4,https://www.reddit.com/r/opiates/comments/4orfe4/dealing_with_plugs_charlie_brown/,11,https://redd.it/4orfe4,vengeanceofrain,Dealing with plugs = Charlie Brown,"Every. Fucking. Day.  Okay not everyday i don't use that much but every fucking time. I'll be sitting here chillin doing my thing.  My plug already knows i'm pissed off cause he took half a day last time to get to me, and this is every time lol.  So I'm hibitlally pissed lol


Every fucking time.  He makes up some excuse to make it sound like he's right around the corner and a fix is less than 5 mins away.  I'm like well i wasn't planning oin doing any thing but if you 5 mins away fuck it swing by 

Now it's on my mind lol. And of course, every fucking time, the little cartoon bitch keeps moving the football. This motherfucker is 3 towns over lol.  not streets. not miles. TOWNS. 


So now, i'm sitting here waiting on some shit, i didn't even want until you called me and told me you were 5 mins away like some fucking fiend lol.


Why Mr. Plug? Why must you lie to me lol?  Is it really so hard to say ""look i am 3 towns over and i got to do some shopping and do my taxes I'll be there in a few hours"". Now my entire day is unproductive because i can't go anywhere in case you come and i'm not here. ",1466301877.0
4orch2,https://www.reddit.com/r/opiates/comments/4orch2/things_other_users_do_that_annoy_you/,25,https://redd.it/4orch2,Birdman5StarStunna,Things other users do that annoy you ?,"Anybody have certain annoyances they cannot stand when hanging around other people who use? Even my good friends I can't stand some of their shit at times. For example one of my friends always makes a point to like, lick the blood off his arm and while doing so he makes a smacking sound like kissing. You know that high pitched smooching noise? Every time. Licking and smooching his fucking arm it's disgusting to me personally. I use alcohol prep pads and generally keep quiet.",1466300437.0
4or8r8,http://imgur.com/q2dZWMm,18,https://redd.it/4or8r8,Birdman5StarStunna,PSA: IF YOU USE RIGS YOU NEED TO BE CLEAN Here's why. (Cellulitis / Abscess Porn) NSFL,,1466298644.0
4or7ll,https://www.reddit.com/r/opiates/comments/4or7ll/just_finished_a_fuf_binge_god_save_me_please_give/,45,https://redd.it/4or7ll,Methamphetamouse,"Just finished a Fu-F binge, GOD SAVE ME! please give the retard of the year some advice.","Hi, official darwin award recepient here....

just finished off about 2.5 grams of Fu-F over 6-7 days via IV. 

Leaving the remainder of the fent bags (have som 4-fibf I only tried 2-3 times and an extra fu-f bag from a different source) with my significant other tonight and embarking on the journey of each level of hell.

i have pretty much everything except for gabapentin and pregablin available to me..

i've never sucesfully used immodium, but i've only tried it once in the past. when i tried it, i didnt take a huge dose, it mgiht of been the pills with more then just loperamide, and I got super bloated and began puking a foul taste I'll never forget.

Also, I know about torsade de pointes/ sudden death and prolonged qt-interval because of methadone and other pharmaceuticals. As loperamide ultra high dose is cardiotoxic, I'm a bit anxious riden.

Kinda hoping someone can lay out some sort of dosing schedule and all....

My tolerance is literally 25-30mg IV fu-f 20-30 times a day. 

Last year I managed to raise my ace fent tolerance to 60mg, and then quit via methadone, something I am not willing to do again.

As this was only 5-6 days though I am noticing my withdrawal symptons arent as severe.

PS, dealing with some pains on my frnt left and front right going to the back, hopefully my organs are all fine. I was concerned about rhabdomyolysis but I've been drinking plenty peeing clear.

I have unlimited clonidine too. And some onandesteron. 

In my memory onanadesteron + gravol always helped alleviate the stomach a bit. But I remember clonidien seeming like a bunk ass sugar pill (even tastes like nothing) until one withdrawal I mega dosed. Literally took like 7-8 0.1mg pills at once. Got quite low BP, and wasn't really able to stand for long or get up quickly without orthostatic hypotension laying my ass back down. But I did effectively feel fatigued enough to sleep my brains off

Is it safe / legit of me to dose clonidine high again? I am thinking clondiine + benzos + some immodium + onanadesteron and marijuana would be an easy and readily available stack?

If I don't want to be crazy with the immodium and face potential cardiotoxciity, what's a dose that would be effective to some extent, but not be a full blown recerational opiod dose? I know this is very hard for anyone to answer as it is technically / does not (fuck I am not loperamide Ph.D lol)  cross the blood brain barrier.

worst case, I have a handful of 100mg morphines, and like 100 30mg morphines,

any idea redditors what type of dosing for these drugs would be sufficient to get me through the 47-96 hours of hell?

i know my gaba receptors are nice and fresh, I wa susing a valium every 48-72 hoiurs (just 10mg) prior to this week long binge, so at this point I am in some mild benzo withdrawal and know my next dose will hit very nice. benzos available are  alprazolam, clonazepam, diazepam",1466298075.0
4or795,https://www.reddit.com/r/opiates/comments/4or795/so/,2,https://redd.it/4or795,WorkYouFuck,So...,"Finally came up with a play (fireworks rule), and I'm FINALLY gonna get enough good stuff to get me nicely toasted. Can. Not. Wait.",1466297916.0
4or73w,https://www.reddit.com/r/opiates/comments/4or73w/what_are_the_numbers_used_to_describe_h/,8,https://redd.it/4or73w,gayguy612,What are the numbers used to describe H?,"I use pills. Oxy 15IR to be exact, I don't have any experience with H. Not interested in trying it, just curious as to what each number means. Since joining Reddit I've seen people saying number 3 or 4 in reference to types of heroin. I thought heroin came in two forms, the white powder or the black tar. Are there more varieties than this?",1466297838.0
4or2sc,http://thepeoplespostmodernist.blogspot.com/2016/06/normal-0-false-false-false-en-us-x-none_18.html,0,https://redd.it/4or2sc,Peoplespostmodernist,St. Michaelâ€™s Lost Freestyle Verse,,1466295848.0
4or0ns,https://www.reddit.com/r/opiates/comments/4or0ns/took_4_5mg_oxycodones_today_would_5_lorazepam_be/,4,https://redd.it/4or0ns,xandyman_,"took 4 5mg oxycodones today, would .5 lorazepam be a bad idea?","got my wisdom teeth out yesterday, bored as hell so i took 1 5mg oxycodone - acetaminophen 5-325 at like 1 and then another 3 about an hour ago. really not feeling much for some reason and im worried to take another cus of the acetaminophen, could i take a .5 lorazepam and be good to chill on? i weigh 200 lbs ",1466294909.0
4oqt8m,https://www.reddit.com/r/opiates/comments/4oqt8m/update_experienced_my_first_od/,10,https://redd.it/4oqt8m,petboy455,Update: Experienced my first OD,"Hey bropiates, figure I would do a quick check in on my situation just for a place to vent.. I never mentioned I live with my mother and she was there to help with the OD situation. She did her research on a lot of stuff and found my reddit account, she never knew I shot up (just started pretty recently) only knew I smoked. She read all the comments on the last post I made, as well as most alllllllllll of my post history. So yesterday she said she was going to kick me out, but we talked a little bit and I was able to sleep at home one more night. She thought over that night and gave me the ultimatum: I can leave to where I was originally planning to go (My Grandmother's in Oregon) without my car, or go to an inpatient rehab. I chose the latter because I am honestly ready to get clean after the whole situation with my love of my life. She let me get another 20 sack today, she was reluctant but the inpatient I am going to admissions' person said to do it, which is weird I think but I digress. I got 3 points and am ready for this to be my last sack and move on to a sober life. I figure I would share with my bropiates since I probably won't be around/posting much. Thank you for all the support over the couple years I have been here (even though I lurked most of it) and all the emotional support you guys gave when I went through the original situation. I wish you all the best. 

Happy nods..",1466291682.0
4oqpml,https://www.reddit.com/r/opiates/comments/4oqpml/the_time_has_come/,21,https://redd.it/4oqpml,killincookin,The time has come...,"Having a beer before I drive myself to the detox facility that is expecting me. After spending about 200 a day on his and crack, it's time to stop. I've lied and stolen enough from close ones, dug my debt about 15k deeper and didn't see the end without this. 
Girlfriend is supportive, but never knew the full extent. 
Last time I was at this place I was clean for multiple years before slowing sliding down. I feel I can take it and do better this time around. I need to. I have to. It's that, jail or death.
I wish the strength to anyone and everyone that wants to quit. I want nothing more than to smoke some shit and not care....
Take care, All!",1466290162.0
4oqov7,https://www.reddit.com/r/opiates/comments/4oqov7/favorite_dinner_mom_use_to_make_at_home_while/,37,https://redd.it/4oqov7,chrome015,Favorite dinner mom use to make at home while blasted on opiates...,When I was growing up railing oxy like a champ at home my mom use to make a homemade chicken noodle soup using left over rotisserie chicken she would boil the chicken carcass and make the stock homemade...those winter days after scoring out in the cold I would come home run upstairs and rail two 15's IR and hot soup was waiting :) the good days.,1466289855.0
4oqgnc,http://imgur.com/a/Csbej,42,https://redd.it/4oqgnc,IloveteaNfrenchtoast,Home grown opium,,1466286349.0
4oqcc2,http://i.imgur.com/9lvbRVm.jpg,19,https://redd.it/4oqcc2,PM_ME_UR_LUUDES,Didn't think these bad boys were gonna show up today! Sorry my camera is dirty and so are my intentions! Slide baby slide!,,1466284499.0
4oq7j2,https://www.reddit.com/r/opiates/comments/4oq7j2/seen_a_kid_snort_2_unstamped_bags_and_od/,19,https://redd.it/4oq7j2,its4thecatlol,Seen a kid snort 2 unstamped bags and OD," My boy has a tolerance too. I seen him kill a book of some good and be fine. These bags were obviously cut with fent, very white and fine-powdered. 

It took 2 shots of naloxone to bring him back and he was still pretty high. I think maybe what saved me was some yeyo. Blow's brought me back from some near-od's. Would not recommend this.

You don't have to IV to OD.",1466282462.0
4oq5ar,https://www.reddit.com/r/opiates/comments/4oq5ar/where_is_all_this_fent_coming_from/,17,https://redd.it/4oq5ar,chrome015,Where is all this Fent coming from?,"Everyone is talking about H being cut with Fent. My question is were are these top dealers getting Fent from so openly and easly, is there a underground market for buying pure Fent HCL? My mind is blown how popular Fent has become in 4 years",1466281539.0
4oq5aa,https://www.reddit.com/r/opiates/comments/4oq5aa/those_with_vivitrol_experience/,7,https://redd.it/4oq5aa,TakinLosses1,Those with vivitrol experience,"Say I've been using and my last use was 86 hours prior to the shot I think I'll be straight. I'm talking 2 weeks straight of use but can barely feel it. 

If I were to use by 7 today I'd have 64 hours before the shot. 

Precipitated withdrawals for sure?",1466281534.0
4oq1wm,https://www.reddit.com/r/opiates/comments/4oq1wm/problems_sleeping_from_h/,11,https://redd.it/4oq1wm,jadefaux,Problems Sleeping from H,"I am posting this because I'm very curious if anyone else has had this problem. In active addiction I did not have any trouble sleeping when I used bth...but I found that when I use after a considerable amount of clean time I can't for the life of me fall asleep. I lay there high as fuck and nodding but my body won't actually fall asleep. I lay down for hours but my mind still feels like it's running at full speed. I might doze off for an hour but when I awake it feels as if I didn't sleep at all. Does anyone have an explanation for this? I've asked other users and none identify with this problem. Like I said when I was using bth for 2-3 years straight I didn't have this problem but when I use after being sober for months it happens every time. It's to the point where I have no interest in using because I feel like complete shit the next day and redoseing only makes me nauseous! Please explain this dilemma if you can much appreciated !





",1466280128.0
4oq0pa,http://m.imgur.com/omL52PZ,54,https://redd.it/4oq0pa,FashionablyFake,Sweet dreams are made of this...who am I to disagree?,,1466279604.0
4oprug,https://i.reddituploads.com/baf4630d807444bbb2d88978c99e6bdc?fit=max&h=1536&w=1536&s=519a45d23986bed0d9adb0cffafb1a99,4,https://redd.it/4oprug,AccntNmbr4,pin pricks . . . finally,,1466276021.0
4oprsy,https://www.reddit.com/r/opiates/comments/4oprsy/wet_dreams_when_you_stop_using/,11,https://redd.it/4oprsy,severinawaitsyou,Wet dreams when you stop using?,"Hello all, 

Lurker who signed up to inquire about something very specific here. I'm a ""weekend warrior"" h user who sniffs his product, and I've been using for about six months. Previously, it was all prescription pills. 

I never had this issue when I was using roxy or opana, but I've found that in the days between bags, I will very likely have at least one wet dream, even if I masturbate before bed. Also, it seems like whenever I do jerk off sober it takes literally nothing to get me off. I'm not a virgin and enjoy a semi-regular sex life (currently single so time in between varies). 

Is this normal? Have any of you successfully dealt with this issue? I feel like I'm 10 years old again and I hate it. 

Thanks for any advice/tips!",1466276004.0
4opqwg,https://www.reddit.com/r/opiates/comments/4opqwg/the_lifestyle_id_rather_have/,6,https://redd.it/4opqwg,chrome015,The lifestyle I'd rather have.,"This story is pretty old, but I think it would be cool to share due to my experiences. I've been doing opiates for 8+ years, let's time travel back to age 21. Months before I turned 21 I cleaned up was sober from oxy/dope only abused benzos that's about it so I turned 21 and drank everyday for 3 months it was really cool at first then I noticed my body was changing from all the booze. My complexion my skin color my weight color of my nails quality of my hair my sex life was shit my ejaculate was poor. Overall I felt like trash smoking 2 packs a day and boozing. Now when I was getting drunk I was binge drinking every night I was also drinking and driving that was pretty fucking stupid. I was how could I quit drinking? I got back into oxy I lost weight I became healthy again within weeks people asked what I was doing I just told them I quit drinking. Which I did quit drinking. When I was doing dope I cared about my self when I was drinking I felt angry and depressed and was not taking care of my self, but i have a posh home and lifestyle. To be honest I think dope is better than booze, when it comes to me driving I'd rather be on dope. Some people will disagree with this but opiates are were I feel content and healthy, booze is posion.",1466275645.0
4opp87,https://www.reddit.com/r/opiates/comments/4opp87/milky/,3,https://redd.it/4opp87,Lotr5687,Milky ?,"My buddy and I bought off her connect and when I mixed it it was mikky whitish tan. Its clearly not normal. Its cut with something, idk what. If I wasnt an iv person she never would hae.knowm cuz she snorts but im curious what ppl think it might b. Thw last time I did this connectw stuff I thought I was oding. My hands and toes went numb, I had the craziest high. It had fent for sure. I call it poison",1466274988.0
4opest,https://www.reddit.com/r/opiates/comments/4opest/fuck_yeah/,12,https://redd.it/4opest,LoathingInFear,Fuck yeah!,"Got a week clean from opiates and benzos guys. I'm feeling good, without drugs for the first time in a long time. :) Been applying at colleges to try an solidify this change. Does anyone have tips on how to lead a sober life after you know just how wonderful drugs are?",1466270874.0
4opequ,https://www.reddit.com/r/opiates/comments/4opequ/starting_the_day_off_right/,4,https://redd.it/4opequ,opithrowateaway,Starting the day off right!,"So I can't seem to get the imgur website, or reddits image uploading to work to snap a pic, so screw it. Managed to save dope last night to grt me thru most or today!! That literally never happens. So currently I'm enjoying some heroin lines, chocolate chip pancakes and some chocolate milk, laying in bed in bliss ill I leave for work in about 90 minutes. Can't really complain.


What are yall up to?",1466270850.0
4op8in,https://www.reddit.com/r/opiates/comments/4op8in/goooooooodmorning/,4,https://redd.it/4op8in,blknrll77,Goooooooodmorning!,"Had a shitty night with horrible sleep. Maybe about an hour or two of uninterrupted sleep, if that. Woke up nice and early wishing my money would have went through earlier last night so I could have picked up and had some to keep me well enough to sleep. Luckily I hit up my guy a little early this morning and he was able to meet up with me before he normally starts serving. Hell yeah. I don't have to wait for him to reup either. Today is starting out so great. I hope all you guys have a good day and safe nods :)",1466268336.0
4op876,https://www.reddit.com/r/opiates/comments/4op876/tifu_by_sending_screenshots_to_the_wrong_contact/,29,https://redd.it/4op876,AccntNmbr4,TIFU by sending screenshots to the wrong contact,"Sooooo. I was talking to my weed plug about a kratom customer who got on fb and posted a bunch of dumb shit about pills and dope on my page that my family can see (I have a child) while he was drunk.

Turns out instead of the weed plug. I was sending shots and talking about  said customer to said customer.

Sux. He was good for about $400 a month. TIFU.",1466268221.0
4op7wr,https://www.reddit.com/r/opiates/comments/4op7wr/confirmed_fent/,11,https://redd.it/4op7wr,Scratiii,confirmed fent,"The dope that a few of my close friends have been overdosing on has been confirmed as fent. I got a call from the parents of the deceased saying the hospital sent what im guessing was the actual dope to a lab and it was confirmed having fentanyl in it. I didnt bother posting the rest because of how many are happening right now but on top of the two(?) Last week, me and another overdosed this morning and thanks to the lovely /u/Fashionablyfake were able to live. Thank you for sending the rigs and narcan. Had you not, me and a very close friend would no longer be here. You and Tracy are doing wonders to this world and the junkie community of northern Alabama thanks you greatly for the supplies. ",1466268097.0
