7w606f,https://www.reddit.com/r/opiates/comments/7w606f/sudden_onset_anxiety/,3,https://redd.it/7w606f,ga_rb,Sudden onset anxiety,"Been mostly on Roxy for almost two full years at this point and never had this issue. In fact it always took my anxiety away. 



For some reason lately it's been in hyperdrive whether I'm high or not - although often much worse off.


Is this just random or does it have something to do with the evolution of my addiction?",1518107391.0
7w5zfm,https://www.reddit.com/r/opiates/comments/7w5zfm/dropped_my_dope/,26,https://redd.it/7w5zfm,CBR14K,Dropped my dope.,"Dropped my fucking dope in my car last night and can’t find it all because there are rocks all over my day car that looks like it. Actually thought I had found it this morning, was actually a rock. FML. ",1518107236.0
7w5wwf,https://i.redd.it/hvmjw1f1l0f01.jpg,10,https://redd.it/7w5wwf,YungDilaudid,Finally...pinned again,,1518106674.0
7w5tuq,https://i.redd.it/za2d7udzi0f01.jpg,37,https://redd.it/7w5tuq,713slowsmack,The nodz are real.,,1518105986.0
7w5tao,https://www.reddit.com/r/opiates/comments/7w5tao/fucking_fuck_being_fat/,28,https://redd.it/7w5tao,TheFlaberGasted,Fucking fuck being fat,"I have like two veins that I can use because I’m a fucking fatty and can’t find any other veins. Well I pickup this morning, get 2 points, with the last few dollars I had. The two veins I have are so over used I can barely ever hit them. Well I pickup, do a tester because it’s a new batch, and boom register first try no problem. Load the rest up and can’t find shit. I stuck myself at least 40 times and couldn’t find shit. My shit ended up getting clogged and had to throw it out. Fuck. Any fat junkies here? What do you guys do when you can find veins. Also, I’ve been shooting for awhile now and I’m not a newbie at it, but I see all this talk about hitting artery’s and shit. Is that bad? Can I use that big ass vein in the crook of my arm? People tell me it’s bad but I’ve never been educated on why it’s bad. Someone help. 

And don’t tell me to lose weight, I like my fluff. ",1518105870.0
7w5mq5,https://www.youtube.com/watch?v=fv7WmrSDhk8,3,https://redd.it/7w5mq5,Mista_Madridista,Really good Documentary about DJ AM that documents his struggles with drug addiction and eventual relapse.,,1518104442.0
7w5j8z,https://www.reddit.com/r/opiates/comments/7w5j8z/can_you_not_just_post_a_pic_anymore/,2,https://redd.it/7w5j8z,opiatessavedmylife,Can you not just post a pic anymore?,My options are only a link or text no picture option?,1518103615.0
7w5iyv,https://www.reddit.com/r/opiates/comments/7w5iyv/sandoz_40mg_oxy_er_question/,1,https://redd.it/7w5iyv,oxenzo,Sandoz 40mg oxy er question,Anyone know if these have the shitty time release mechanism through them or can they be crushed like the old OCs? ,1518103539.0
7w5g2c,https://www.reddit.com/r/opiates/comments/7w5g2c/when_the_tax_return_hits/,28,https://redd.it/7w5g2c,BraveHash,When the tax return hits,Saw it was in my account and automatically hit up the plug on the 30s i get and got told to come through. I swear it only took me like 10 mins to go to the atm and get to her house. Fastest i've ever got to her house ever lol,1518102846.0
7w5fqw,https://www.reddit.com/r/opiates/comments/7w5fqw/thinking_of_going_on_suboxone_long_term/,13,https://redd.it/7w5fqw,igottheblues1,thinking of going on suboxone long term,"what can you expect at 1st appt? what do they make you do weekly or monthly? pee tests? how much do they give you at once? a days worth, weeks worth, months worth? do they make you do therapy with them? 

Any answers are helpful",1518102769.0
7w5fip,https://www.reddit.com/r/opiates/comments/7w5fip/relapse_day/,23,https://redd.it/7w5fip,OpiumSmoker666,Relapse day,State refund just dropped. I been clean over 3 months or so. Hit up my dboy and just ordered $600 worth of dope. Really wish I had some narcan just in case but Ima try and take it easy. If y'all don't hear from me again u know what happened. Peace.,1518102712.0
7w59xv,https://www.reddit.com/r/opiates/comments/7w59xv/looking_for_some_information_on_suboxone_and_best/,12,https://redd.it/7w59xv,BxTownsxFinest,Looking for some information on Suboxone and best way to use it.,"I just picked some up (12 8mg/2mg) and I've read to put the whole strip under tongue and it's good for 24 hours.... But I've also heard you can cut them into pieces and use the pieces to last longer. So looking for some information how the best possible way to use them and looking for any help you guys can give. Also wondering if it fully helps with all withdrawal symptoms like the trouble sleeping, body aches, sweats, and all that stuff. And how many strips I am to use? I was only using Roxys 30 m box pills no H or anything. But I was snorting about 5 to 7 a day for the last year about so I don't feel like I'm deep has some people ( not trying to brag or anything just trying to give information to get the proper answers). So ant information would be awesome. Thank you",1518101388.0
7w5395,https://www.reddit.com/r/opiates/comments/7w5395/god_damn_benzos_wd_question/,14,https://redd.it/7w5395,Numba2Acct,God damn benzos - wd question,"Take Xanax for withdrawal. So 10 days every month at night. A few months in a row. Never an issue til now. Took last one Sunday, and Monday I took half a kpin.

At my pain doc today, blood pressure is high and I've had trouble catching my breath the last few days. Jittery as fuck, high heart rate.

I'm thinking it's the benzos finally catching up. Since I've only taken them part time for 3-4 months I'm also thinking I can ride this out.

Also just filled my pain script. Thoughts on this?

",1518099703.0
7w52jg,https://i.redd.it/zq89sypszze01.jpg,40,https://redd.it/7w52jg,dilljed,i buy pills from this crazy black lady.. she always text me little things like this,,1518099526.0
7w4xba,https://www.reddit.com/r/opiates/comments/7w4xba/gabapentin_street_price/,4,https://redd.it/7w4xba,flatline904,Gabapentin street price?,What is the average price gabapentin goes for on the street? Or is it not even worth anything at all?,1518098127.0
7w4w21,https://www.reddit.com/r/opiates/comments/7w4w21/tilidin_retard_50_mg_vs_oc_oxy_20_mg/,6,https://redd.it/7w4w21,anontellsastory,Tilidin Retard 50 mg vs OC Oxy 20 mg,"What would the main differences be? What dosage of Tilidin should someone use switching from 40 mg of OxyContin? 

Is the high as nice and warm? 

PS: Btw, the Tildin is mixed with Naloxone to lower the abuse liability.",1518097794.0
7w4vqy,https://www.reddit.com/r/opiates/comments/7w4vqy/have_to_take_a_piss_test_looking_for_suggestions/,9,https://redd.it/7w4vqy,supremefiend91,Have to take a piss test looking for suggestions.,"Alright, I've been in a sub maintenance program for about 4 weeks now. Unfortunately I have still been fucking around here and there... so I have to take a piss test first thing as soon as I walk into my weekly meeting. You have to have buprenorphine in your system or they kick you out. But obviously you can't have any other opiates in your system. I have someone who's going to give me their pee who is on Suboxone and nothing else.

Long story short, what is the best method of keeping urine at body temperature until you have to take the piss test? Any and all suggestions would be greatly appreciated!",1518097711.0
7w4q57,https://i.redd.it/x5b0mgylpze01.jpg,22,https://redd.it/7w4q57,dancelot805,supper from last night :) today is 7 days clean!!,,1518096102.0
7w47tq,https://www.reddit.com/r/opiates/comments/7w47tq/how_to_smoke_off_foil/,9,https://redd.it/7w47tq,tracy_fleeb,How to smoke off foil?,"I just tried but my hand is super shaky and it's too hard to catch all the smoke with a straw. Should I like, rig up the foil bewteen some books or something, and then use a toilet paper roll to catch the smoke?",1518090083.0
7w47e8,https://www.reddit.com/r/opiates/comments/7w47e8/id_just_like_to_thank_this_sub_for_recommending/,2,https://redd.it/7w47e8,DONTFUNKWITHMYHEART,I’d just like to thank this sub for recommending this audiobook,"A few days ago ppl were discussing books to read while on the nod or just about dope in general, well this one book ‘Dreamland: The True Tale of America’s opiate Epidemic’ is fucking FANTASTIC!
Even if you’re just interested in opiates and you’re not an avid consumer, I HIGHLY recommend this book. 
This audiobook has taught me so much and enthralled me the entire way. 

- Godbless guys and safe travels xx",1518089932.0
7w45c9,https://www.reddit.com/r/opiates/comments/7w45c9/plan_to_take_40mg_oxys_for_the_2nd_time/,11,https://redd.it/7w45c9,trippy999,Plan to take 40mg Oxys for the 2nd time,"I smoke weed everyday and have an issue with alcohol (cant stop when i start)

Last weekend for the first time I did 40mg Oxy at first and then another 40mg about 8 hours later. I felt good, warm and itchy and sleepy for two days afterwards.

Ive just picked up another 80mg to do this weekend as I dont want to drink.

Is this a bad path to go down. Are oxys as bad as everyone says it is.

How many percentage of users end up on heroin after oxys? (will never touch heroin or meth).

Have a good job, nice house and car, gym daily and beside weed dont touch anything else throughout the week.

Is this okay? Am I going down a bad road?

Is 80mg safe for my body?

Heard a few horror stories and dont want to become a statistic",1518089085.0
7w43g3,https://www.reddit.com/r/opiates/comments/7w43g3/has_anyone_heard_from_ueverything_is_still/,10,https://redd.it/7w43g3,schizoidparanoid,Has anyone heard from u/everything_is_still ?,"He hasn’t posted or commented in almost a month, hasn’t replied to my messages on Reddit or been on his opiates EzcapeChat or TinyCbat during that time.
I’m worried. Does anyone talk to him off Reddit? Is he okay? 

Paging u/everything_is_still - you alright, man...? :( ",1518088329.0
7w3ym1,https://i.redd.it/6xvenworwye01.jpg,49,https://redd.it/7w3ym1,apotheoz,"Something i drew in rehab few months ago, while going through full WDs. Hope you like it",,1518086402.0
7w3xnk,https://www.reddit.com/r/opiates/comments/7w3xnk/will_letting_urine_stand_increase_the_amount_of/,9,https://redd.it/7w3xnk,MultiPackInk,Will letting urine stand increase the amount of opiates in it?,"I don’t really know how it would, I’m imagining something to do with how H turns to morphine if you leave it in water. I’m thinking more of it would convert while it’s standing..?

Sick as fuck but have to piss clean in ~8 hours, I was thinking I’d just save some piss before shooting up but I don’t want anything to duck up this test. ",1518085992.0
7w3wzn,https://www.reddit.com/r/opiates/comments/7w3wzn/how_to_prep_g74_opana_for_plugging/,0,https://redd.it/7w3wzn,WeirdGuy100,How to prep G74 opana for plugging?,"Hi, i know this will get me some shit. My nose is broken and I can't snort things for a couple months..

How do I prep an Opana g74 (the orange 40mg pill) for plugging?   Edit: Will mixing it with water just turn it too goo? Ive never plugged a panda, only roxy.

I sincerely appreciate any help with this!!
",1518085741.0
7w3vqd,https://www.reddit.com/r/opiates/comments/7w3vqd/random_question_for_those_with_bank_of_america/,10,https://redd.it/7w3vqd,Tarshot,"Random question for those with Bank of America Online banking. (Sorry not opi related, but serious question but shitpost) (Will include short opiate story at the end though of an experience trying to buy dope abroad)","EDIT: OMG, i wrote this last night after snorting half a Ambien. I meant to go to bed but I was browsing Reddit again and I guess this story came out. Usually I have shit grammar and will not make sense when on Ambien but I think because it was only half of pill, I was between sober and an Ambien Zombie. 

First off, sorry it's not opi-related, I asked this elsewhere with 0 replies so far, but since this is the main sub i 
browse morning and night, I will ask here if possible. 


Hi all, had a few questions to anyone who has BOC online. Basically, just set up a checkings today with BOC and just set up an online account too. I know with Chase bank, there is a lot of fraud prevention steps to logging on online. For example, a new computer needs verification by email or text. Also, for example if I use my debit card to make a purchase over $XXX Amount, it will send an email over, etc, stuff like that.

The lady today helping me set up the account told me I need a smart phone to use BOC online but can use it at the computer so I was wondering how similar it was to Chase online banking. Is BOC linked to the email address like if its my first time logging on at a location, will I need to verify with code? Can I set up text alerts without a smart phone? (Like placing a number on the account for protection, like BOC will send a text with a code to me if any log in problems), or anything like that? Or is it simply, use your email and password at any desktop/location and you can log in to view your banking information? 


Thank you anyone who took their time to read and/or respond. Have a good day!!!
   
=============================================================

=================== Random Opiate story that was promised.======================

===================================================

(First time buying crap Heroin when studying abroad)


I use to study abroad in China (Guangdong Province) a few years back. I was sent there originally to teach English but the program I signed up for didn't provide me with the ESL classes/certificates when I got there so didn't end up teaching. I had an addiction (heroin, but loved blues and opanas) problem back in the US, and Overdosed twice in the 2 months prior to going so my parents/aunt put money together and signed me up for a semester to learn Chinese to give myself time to get back to normal. They thought the strict laws there would deter people from selling and especially me from using. But during the first semester, I somehow managed to get myself into a bunch of shit and addicted to H again. What fucking shit.

About a month into the semester, I was with my friend Tack who was a skinny Indonesian kid with a bunch of tattoos and a funny looking face, he told me he met some new friends who were going to the club and asked me to go. A club was popular place to go among the foreigners. It was around 7pm and we went first to meet up with his new friends he met. So we got to their apartment, and what do you know, 2 Frenchman. They were 2 brothers, Tom and Arthur. Their apartment was very very nice and expensive, even for regular foreigners it was pricey. I say this because 1 USD = 6.1 RMB the time I was there and the USD just went farther making it seem like you are richer, but this apartment was nice is all I am saying. Anyways, both of them spoke English well, and Tom actually went to Cambridge University in England. Tom was also studying at the same school me and Indo Tack studied at but he was also there working in Finance in one of the big companies there (hence the expensive aprtment). His brother Arthur was in town visiting because it was his birthday. 

So we are pregaming at their place since they bought some Chinese beer (Tsingtao) and had a bottle of some liquor i never seen before. I'm not a drinker so i got buzzed pretty quickly. I pulled Tom aside and asked him how long he was there for and if he liked to party a lot. He told me he'll smoke weed every once in a while and even found people with weed in China. I was trying to slowly push his buttons to see if he fucked with opiates, but he told me back in England he did Coke a lot. Anyways, I was thinking to myself I would be fine with Coke. I've only done it a handful of times but I wanted to feel good that night and weed doesn't do it for me. So I asked him straight up if he had any contacts that could hook me up with something.


So he said yeah he has a connect there and gave me his guys number and told me to call him. I called him up and the guy has an accent made it more difficult to understand, I don't want to steriolize  but it was an African dude. It took a few tries but i asked him if he had Heroin after trying to beat around the bush, and he said yea he does and its $600RMB for a bag. I asked him if that was a gram or what? But he didn't understand me and I still to this day don't know how they measured out the bags. The 600 came out to around $95 or round up to $100 USD so I was expecting something good. He told me he'd be over there in 20-30 minutes. 


So i didn't exactly tell Tom what I was buying, I think he thought it was weed, and for sure, Tom's brother and my friend Indo Tack had no clue and they were waiting to leave to go to the club but I was waiting on the dealer so i kept saying just wait a little longer wait a little longer. I'm not sure how long it took but he finally came thru and by this time it was maybe 8 or 9pm and was pitch black outside. We just met on the street because there was no where private we could go, and i asked him let me see it first and he said okay. I pull out the bag and opened it up and dipped my finger in for a taste, and although it was dark out, he's like man becareful here. And to this day I have no clue what I got, I don't know if it was heroin or what. I didn't know about Reddit then or thought I would be buying more, so I never thought to take a picture and save for later. But the supposely heroin was kind of small chunks of soft clay like texture kind of in the letter C. It wasn't powder by any means, but it had that vinegarish smell and in a way tasted a little bit like H or what i can remember it tasted when I was back in the US. I asked him 3 times, what is this shit, and he kept saying yes man it's heroin, it's heroin. Because of the taste and just wanting to feel something, i bought it anyways. 


By now, Indo Tack, Tom and Arthur are outside and say cmon let's go to the club. So while we wait for a taxi, i tell them hold on and run to a public bathroom toilet quick to try and snort some of what i thought was heroin. Of course, there were no American style toilets in the bathroom, you have to squat to shit, So i had nothing to place my Dope on where i can crush it up and make lines etc. so i close the whole door on the bathroom and just use the sink and hope no one comes in. Anyways, so like i said before, the dope wasn't powder, it was this strange substance, I still don't know how to describe. Only if I saw it again I would be able to know. But I dump out a little bit and use my card to try and crush it up and cut out a line. The dope didn't really crush, like it was clay like and just got smooshed when i tried pushing it down. But the taste and the smell was just too similar to what I remember of H, so i kept trying at it. Eventually, shit breaks alittle bit but not into fine powder. It's kind of like bigger chunks but it's the best i could do with the time so I snorted it and went back out to catch the taxi with my friends. 

5 or 10 minutes pass and there was definitely something in that shit i bought. The feeling came on strong, a little euphoric, but not that much, but I was feeling something. I don't know if it was a placebo effect, but I swore I felt a small head rush like when you do a line, and then in a good mood after that. Since it did the job, i never questioned it and did hit up the dude a few times after that. (He came with powder after that which more resembled H then that first time shit). So we went to the club and got mad drunk and i told Tom and Arthur what i got and they asked for a line lol. I told them exactly what i told you guys, it wasn't like normal dope and it has a strange texture and they didn't care. They snorted some and said they felt good too and we hopped clubs a few times and ended up going back at 7am. 


Anyways, sorry for the long rant, this was just the first time i picked up in a foreign county. Later on, i met a different dealer with 100 times better shit like AMAZING shit, and other things that happened to me, spent 2 weeks at a detox hospital (I was only foreigner in there), and it was mad strange there!, also saw a regular doctor who prescribed medicine for withdrawals, getting hooked onto sleeping medicine and not remembering a lot of stuff (Zopiclone/Ambien drugs), got into a street fight while waiting for my dealer, and had to do some grimy shit to get some money there, which i can tell these stories/or answer questions if anyone is interested.. only because this was mad long and kind of shitpost/rant, so i don't know if anyone actually read this. If you did, thank you!


Thank you for reading if you got through all of it.


Have a great night!",1518085235.0
7w3t91,https://www.reddit.com/r/opiates/comments/7w3t91/brother_in_rehab_what_to_expect/,14,https://redd.it/7w3t91,PM_ME_UR_LOGIN,"Brother in rehab, what to expect?","On a recent visit home i was blindsided on the last day of my visit to find out my brother (who i have been extremely close to my entire life) has been shooting up fentanyl at Work and was going to rehab.

He has never been to any drugs before besides marijuana and never taken opiates. He has definitely battled bad depression and also alcoholism (he was prob a “functioning” alcoholic) this year. 

According to him he has only been on fentanyl for 3 months and was only shooting up at work (he works 3 days a week) and the most he did was 500 micrograms in one shift. I did catch him with a fentanyl in his pocket about a month ago which he said he returned to hospital (he now admits he actually used it) and also he admitted to injecting over Xmas when he was off work (so these kinda go against him saying he only used at work). Also besides fentanyl he said he just took 1 morphine XR one time and no pills besides that.  Like i said some of this doesn’t add up but he really has no reason to lie about it now. 

My question is do you think it is possible for this one 30 day stay in rehab to be enough to help him get sober? I have heard so many horror stories about multiple stays At rehabs not working. However, 3 months doesn’t seem that long, will that help? He definitely wants to get sober. ",1518084264.0
7w3t4z,https://www.reddit.com/r/opiates/comments/7w3t4z/relapsed_at_4_and_a_half_days_in_desperate_need/,14,https://redd.it/7w3t4z,sssddddddeeee,"Relapsed at 4 and a half days, in desperate need of advice","like the complete moron that i am , i relapsed at 4 and a half day. am i doomed to restart withdrawals? basically what happened was i took too much xanax to try and pass out, and lost control of my will power and copped. however, on the ""bright side"" i was only able to do a tiny bit of my dose before passing out. i now just woke  4 hours later, and it looks like i have done less then .05gs (my regular dose is 1.5). 

is there any hope that i can stop here, and prevent withdraws from starting over? i used such a minuscule amount of dope compared to my regular dose, that im hoping i continue foward without having lost all my progress. 

i cant remember the last time i felt this devastated in my life. i carved out a rare window of time from my job/ other obligations to get this behind me and i still manged to fuck it up. 

and an honest word of warning: as helpful as benzos can be, i can assure you that my resolve in the withdrawal process was as strong as its ever been, but it call came crumbling down after one two many xanax. 

anyways, sorry to ramble. is there any chance that my withdrawal will not start from the beginning? any response will be greatly appreciated                                                                                                                                                                                                                                                                                                                                                                                                                                                                                                                                         ",1518084219.0
7w3oew,http://thumbs1.ebaystatic.com/d/l225/m/mO-D0NiVXxwhD1lQPRWORMg.jpg,3,https://redd.it/7w3oew,Nvrlss,are these legit looking for an ethereal journey,,1518082228.0
7w3min,https://www.reddit.com/r/opiates/comments/7w3min/is_there_a_proper_way_to_convert_a_2mg_dilaudid/,5,https://redd.it/7w3min,jb34304,Is there a proper way to convert a 2mg dilaudid pill to a rectal suppository?,"Welcome everybody!

The story here is I used to be on 16 mg of Dilaudid daily (4mg x4 orally) for about 5 years due to a botched shoulder replacement, and a terrible car accident caused by my epilepsy. Last year I went cold turkey for about 6 months, but went from 8 hour work days to 1.5-5 hour days... :(

I would like to try the rectal route for Dilaudid, as I have heard it is a more potent level of delivery of oral, nasal, and subcutaneously. A 2 mg dose really is nothing...

Thanks for your time reading my story everyone.

-JB",1518081447.0
7w3lyx,https://www.reddit.com/r/opiates/comments/7w3lyx/is_it_just_me_or/,12,https://redd.it/7w3lyx,BLUE-THIRTIES,Is it just me or.....,"Is it so much nicer and much more satisfying having the bills paid up, gas in your car, fridge stocked with food in a nice clean house or apt trumps any high possible, anyone agree with me? I mean lol of course it would be nice to have both luxuries of having both bills paid for and have a nice brick on deck but it’s rare to have both so which would you prefer to have if it came down to it????",1518081226.0
7w3i0p,https://www.reddit.com/r/opiates/comments/7w3i0p/pray_to_junkie_jesus_for_me/,14,https://redd.it/7w3i0p,tracy_fleeb,Pray to junkie Jesus for me,I'v been trying to chase a half g since 7 this morning - it's 745pm now. My boy says it 'should be fine' soon. I hope.,1518079544.0
