agkvlj,https://i.redd.it/6kjubqcw8sa21.jpg,44,https://redd.it/agkvlj,wizardtoo,First time IVing this turkish dope. And it won't dissolve very well. What do I need to do? Is the lemon juice right or wrong? I just fucking shot some up anyways even tho it wasn't dissolving very well and Omfgggg. I miss this rush so muchhh. But plz help me learn to do it right.,,1547643409.0
agktku,https://www.reddit.com/r/opiates/comments/agktku/scrum_gets_30_years_for_dumping_overdosed_customer/,11,https://redd.it/agktku,Loaded292,Scrum gets 30 years for dumping overdosed customer,"https://www.justice.gov/usao-mdfl/pr/two-jacksonville-men-sentenced-their-roles-overdose-death-22-year-old-jacksonville
        
      This comes out of Florida...should be no surprise. Anywho this reads like any other junkie day, two women of the night go over to the dealers house for a night of nods and crack rocks. One goes to sleep and doesn't wake up. The dealer and other hoe freak out and fucking wrap up her body drive it to a golf course and dump it to try to make it look like she od'd there and not back at his house. These people are why opiates will never be socially accepted.",1547642975.0
agkshk,https://i.redd.it/yc3d7rlx6sa21.jpg,13,https://redd.it/agkshk,life_wasted_again,Some breakfast 🤤 (Ft either the best pressies I've ever seen or the even bigger unicorn: REAL XANAX BARS!),,1547642741.0
agkof7,https://i.redd.it/v6s1yjrb4sa21.jpg,24,https://redd.it/agkof7,active_14,Another score,,1547641862.0
agkhzj,https://www.reddit.com/r/opiates/comments/agkhzj/two_overdose_experiences_from_early_2016/,12,https://redd.it/agkhzj,cannabis-saves-lives,Two overdose experiences from early 2016,"Sitting in a Walmart parking lot around noon on a March day, 2016. Temperature probably in the low 60s. A “drug friend” gets back into my car and hands me a bag with 100mg of street heroin. I took a conservative test shot and was overwhelmed immediately with the rush. Feeling nauseas, I exited the car with my drug-addled acquaintance to get food inside the Subway sandwich store in an attempt to help my stomach. While realizing I’m extremely high but not fully grasping the gravity of the situation, I gave my drug friend permission to call the ambulance if I started nodding out too hard because I felt it coming on. 
I went outside, unable to eat. My drug friend followed me. I didn’t make it very far before I made a decision which I vaguely remember. 
I remember taking my hoodie off and putting it  on the asphalt. I laid down on my jacket, planning to take a nap because I felt tired. Next thing I knew I was being greeted by paramedics and police officers. I had overdosed and they injected me with whatever they use before they go on to Narcan. I didn’t even need the Narcan, which would have made me go into immediate and terrible withdrawals. I was high as could be and went to the hospital and sat in the hall for an hour and puked my brains out and left. Fucked up part is I called another friend and told him that I would give him my dope if he picked me up from the hospital and then I lied to him and said I couldn’t find the dope. Went and shot up right after. 

Another crazy one

About a month after that previous incident, I did a fat shot of some heroin and realized that I had a strong batch so I immediately started putting together a homemade Narcan shot out of suboxone and water. I realized I would pass out before I could get it ready so I ate a strip of suboxone, hoping it might save me in time (it contains naloxone). I don’t remember passing out, I just remember coming back to awareness very slowly and realizing that I couldn’t move my arms or legs because the circulation was cut off and they were numbed fully. I then slowly started moving around and was able to stand up and prepare a shot of suboxone while nodding in and out. I thought I would die at any moment. I finally got the shot in my vein and puked my guts out. 

Clean now, last shot of heroin was February 2017. Fucking miracle. ",1547640393.0
agk70i,https://i.redd.it/90bagh2trra21.jpg,29,https://redd.it/agk70i,mqit,Got my hands on these. Zero opiate tolerance right now. Are they useful?,,1547637680.0
agk5tq,https://www.reddit.com/r/opiates/comments/agk5tq/addicts_die/,175,https://redd.it/agk5tq,sambularasa,Addicts die.,"Have any of the longtime lurkers ever scrolled through /r/opiatesmemorial and seen all the familiar names? 

Just really hit me, a lot of this sub is dead.

I live in a halfway house and the woman's house lost a girl yesterday. Dead in a Wendy's bathroom after a relapse. My friend from rehab died last week. 

So many of my friends are dead or insane. Homeless. Incarcerated. 

And I'm barely scraping by sober struggling with seizures and possible heart disease. 

There's no point to this post. I wouldn't even tell anyone to be careful or get help. I wish using was still an option for myself, why would I say that to you? This is the life we live. This is how it is. We die. I just wish it was easier to be an addict in this world. 

Enjoy your moment my friends.",1547637371.0
agk5qd,https://www.reddit.com/r/opiates/comments/agk5qd/oxy_to_h_conversion/,12,https://redd.it/agk5qd,krazikat,oxy to H conversion,"I know it's not apples to apples, but for those with experience, what is let's say one 30 mg blue equal to in the H world?  ",1547637349.0
agjh7l,https://i.redd.it/96butbem7ra21.jpg,37,https://redd.it/agjh7l,breezyjanem,WELP. I go into Detox tomorrow.Had been on a waitlist.They require you call every night at midnight to maintain your position on the waitlist....This is where I had failed before.Smoking the rest of this then packing and making sure my kitties are set up for the next 5-7 days. 😻👋 Fuego and Diego.,,1547630864.0
agjd7e,https://www.reddit.com/r/opiates/comments/agjd7e/urgent_narcan_question/,11,https://redd.it/agjd7e,KurdtCobain,URGENT Narcan question?!,"Hello, friens drank just a little bit of 9% beer on top of benzo. They wanna take more benzos. If they OD would Narcan work for them in this censario?",1547629733.0
agjbps,https://www.reddit.com/r/opiates/comments/agjbps/ibogaine/,22,https://redd.it/agjbps,pillsarebad,Ibogaine,Ordering from South Africa. We’ll see how this shit goes. I’ll keep ya’ll posted!,1547629325.0
agj6sp,https://www.reddit.com/r/opiates/comments/agj6sp/tool_to_much_tramadol/,12,https://redd.it/agj6sp,Topnotch66193,Tool to much tramadol,"People made these out to be weak they got me messed up right now. 50Mg trams I took 5 at once because before these prescriptions I bought 2 50mg from a drug dealer and felt nothing. My mom said they aren't even worth askin the doc for she had 325mg that did nothing. I took 5 50mgs for good measure at 7pm and it's now 3:30am. 

I cant sleep. I'm too high. I'm surprised because this felt stronger and lasted longer than 2 5mg oxycodone tabs",1547627883.0
agj4ei,https://www.reddit.com/r/opiates/comments/agj4ei/for_the_first_time_im_clean_and_sober_and_have/,7,https://redd.it/agj4ei,girlwithtracktattoos,"For the first time, I’m clean AND sober, and have been for 5 months. All of my loved ones have gone out. Sobriety doesn’t feel worth it to me anymore.","Hey all,

First of all, I promise I’m a better writer than this and what I’ve shown in the past. When I type on my phone it all sounds like shit because my brain thinks faster than my fingers can type on a shitty phone keyboard. I’m not as dumb as I sound, for whatever that’s worth.

I apologize for the rant. It’s been an impossibly difficult few days and I’m running on empty and just want so badly to be heard, so please bear with me. <3

In the past I’ve gotten off heroin, but I’ve never tried complete abstinence from all mind altering substances before now. I’ve managed to get five months so far. 

I just moved to a new state to start fresh and get clean/sober from all mind altering substances. I’ve been using for thirteen years, so it’s essentially all I know. Sobriety is new to me and it’s been great at times, albeit a little underwhelming.

Through treatment and because the area I’ve moved to is VERY recovery oriented, I’ve met some amazing people in this journey. The problem is that they’ve all fucking relapsed. Even one of the treatment staff at my sober living went out and overdosed (she survived, thank god) and she had years of sobriety.

The pain I’m feeling for all of the friends I’ve made feels like it’s too much to bear. I’m tired of feeling feelings. I’m bored, restless, anxious, and just want to get out of my own head. I’m angry at my best friend for getting high. I’m resentful that she doesn’t seem to care about her sobriety, and I’m resentful for selfish reasons. It feels like I NEED her to care about her sobriety so that I can stay sober myself. I love her and it’s fucked up because it feels like my sobriety is so heavily revolved around her. (I’m a straight female, I just really adore this girl). I know I’ve got codependency issues. Working on it all.

I attend meetings frequently and work with my sponsor but I just feel fed up. It doesn’t feel like any progress has been made, and I feel like I’m wasting my life away when I just want to get fucking high. 

Sober living is fucking with me. I keep getting roommates that are horrific and I’m trying to have compassion & understand that they’re having a hard time, too, but the snoring/messes they leave interfere with my sleep and peace of mind. 

Someone stole my medication last week, which is also interfering with my ability to think rationally and feel calm. 

Fuck, I’m sorry that I’m all over the place. I’m staying in a hotel tonight because I have a new roommate that I absolutely cannot tolerate, and I know that I’m not going to use tonight, but FUCK. Is sobriety really worth all of these crazy feelings?",1547627152.0
agj3tl,https://www.reddit.com/r/opiates/comments/agj3tl/dboy_is_the_man/,16,https://redd.it/agj3tl,GhostOfTimmy,Dboy is the man!,"I’ve been fuckin with this dude for a few years now. He’d let me get fronts, be straight up with me if what he has is good or not. Get to pull up right into driveway so no sketchy side roads in the hood. He delivers to me a good 20 miles away, maybe a bit more (usually past 10pm, tonight he pulled up at 1am ish) also will bring it in the morning if he’s up. First time I tried to have him deliver in the morning it was 830ish and he pulled up at 9 exactly. Don’t need to pay him gas money.....well I haven’t met up with him for a few weeks. I hit him up for 80 boy 40 hard. G’s use to go for 150ish from him. He dropped them bad boys down to $100 ($10 per .1). He pulled up not long ago. I weighed the B and it was .98 with no plastic on. Didn’t check the girly girl cuz I dove right into it lol. Also, he thanks me for my business. Idk just thought I’d share. I appreciate the hell out of him. That’s all y’all, happy and safe nods!",1547626979.0
agj2qv,https://www.reddit.com/r/opiates/comments/agj2qv/needle_carrying_case/,2,https://redd.it/agj2qv,ytgf87876,Needle carrying case?,"So I'm on the move a lot with my dope and im currently out on bail. I have a tackle box at my house filled with micron filters, syringes of all different sizes, alcohol pads, dope, vials, my dab rig, my scale, pill cutter, etc, etc, etc. I hate travelling with this thing, because if I get pulled over not only can I not get rid of it by swallowing it or chucking it out the window, but I will get charged with intent to distribute, and getting charged with intent to distribute heroin wher I live is a fucking death penalty first offense. Your looking at 20 to life with no chance of parole. A friend of mine got locked up for 15 years in federal prison, and serfved ALL his time for having 7 grams of meth in his car, and he refused to flip on anybody. It truly was personal use too he just had a high tolerance. I want some kind of needle carrying case something really bad ass. Something like this https://i.redd.it/yepo8k6p6lm11.jpg

or for anybody who has seen pulp fiction something like john travoltas needle case in that movie. Can anybody recomend where i could find something like this? ",1547626670.0
agj2oh,https://www.reddit.com/r/opiates/comments/agj2oh/i_had_2_dirty_drug_tests_on_probation_did_it_get/,17,https://redd.it/agj2oh,xanaxbars9900,"i had 2 dirty drug tests, on probation, did it get extended?","i had a dirty drug test on sept and one in nov last year. PO never said anything bout being extended. i didnt go to jail either. i tested positive for THC. im NOT gonna ask my PO if it got extended, as i am gonna ask for early term in july. anybody have a dirty drop and didnt get extended or jail?",1547626649.0
agj1ec,https://www.reddit.com/r/opiates/comments/agj1ec/is_pressed_opanaoxymorphine_a_thing_has_anyone/,4,https://redd.it/agj1ec,subohmvapes,Is Pressed Opana/Oxymorphine a thing? Has anyone every ran into a pressed Opana/Oxymorphone pill?,"So recently the only way I could opana would be if I was willing to pay 3$/MG, however as of lately i noticed many legit people with Cheaper price on Oxymorphone/Opana, are there fakes out there of Opana? Would you think the Opana ER G series be more subject to presses or the different print 10mg Opana IR ones? 

&#x200B;",1547626285.0
agirt7,https://www.reddit.com/r/opiates/comments/agirt7/iv_er_morphine/,0,https://redd.it/agirt7,ytgf87876,IV ER Morphine.,"I am a pretty experienced IV user Lots of BTH, ECP, Roxys, Dilaudids, and opanas, but in my entire IV career i've never done the OG original morphine. I found a good connect for some 100MG morphine pills, but they are ER. I'm wondering if they are injectable the plug doesn't know. I have micron filters if that helps. Would they crush down or would they just gel up? Whats the prep/recipe for ER morphine

Edit: What about the SR's can they be shot too? How are they different from the ER's never heard of ""Sustained release"" whatever that means. And while we're at it how can the 40mg opanas be IV'd. Will a micron filter work? I've heard of a weird blood disease that can happen when slamming them will a micron filter take care of that?",1547623650.0
agim1f,https://www.reddit.com/r/opiates/comments/agim1f/oxynorm_10_or_20mg_first_time_zero_tolerance/,7,https://redd.it/agim1f,omgtehvampire,Oxynorm 10 or 20mg first time ? Zero tolerance,"I’ve never done opiates before.
I have the opportunity to try some oxynorm pills.

But should I only swallow a 10mg or 20mg pill?

Never done opiates before so I have no tolerane.
This won’t be a regular thing.",1547622200.0
agicxw,https://www.reddit.com/r/opiates/comments/agicxw/opiates_ranked/,29,https://redd.it/agicxw,DextroversePrincess,"Opiates, Ranked","In your opinion, how would you rank opiates by their enjoyability? Anyone can find charts that show how powerful each one is, but you can't really find too many lists about the most fun ones.

So how would you rank them?

All the times I've tried hydrocodone, I felt basically nothing, although they were only 10mg on each occasion. As for oxycodone 10mg has me feeling cozy and pretty damn happy. Tramadol is pretty nice, but it was only worth taking with gabapentin. 

So here's my ranking so far:

1. Oxycontin 
2. Tramadol 
3. Hydrocodone

(Before people yell at me for suggesting tramadol even holds a candle to any opiate, this is just my ranking from my experiences, I always mixed tramadol with gabapentin, so it's sorta biased)",1547619927.0
agibim,https://v.redd.it/2aexil51aqa21,4,https://redd.it/agibim,peanutbutterpigeon,💙💙💙,,1547619598.0
aghurh,https://i.redd.it/7z75d7jtypa21.jpg,0,https://redd.it/aghurh,Codeinebabyk,"Percs, Valium & half kpin happy pillz",,1547615796.0
aghwm4,https://www.reddit.com/r/opiates/comments/aghwm4/best_argument_for_stronger_opiates/,32,https://redd.it/aghwm4,sentimentalskeptic1,best argument for stronger opiates,"been seeing my doctor (primary) for back pain/fibro and he’s only giving me a months worth of tylenol 3s. it’s not even touching the pain and i’m getting no nods (which i am constantly chasing) as my tolerance is pretty damn high. what’s the best wording to use at my next apt to get dosage increase without sounding desperate? if that doesn’t work, what type of specialist would be best to be referred to in order to get stronger meds?",1547616201.0
aghvxv,https://www.reddit.com/r/opiates/comments/aghvxv/heroin_in_eyeball/,10,https://redd.it/aghvxv,ytgf87876,Heroin in eyeball?,"So im sure its nothing, but im pretty paranoid I was just fixing a shot of black tar and its some really good black tar its not sticky or gooey its crunchy. When I was crunching it down with teh plunger some of the water shot off the spoon and a few drops got in my eye. It burned like hell and my eye is all red now. I sprayed some water in my eye with the bath faucet but  it still looks bad but it doesnt hurt. Should i be worried about this could it cause eye damage?",1547616060.0
aghvf7,https://www.reddit.com/r/opiates/comments/aghvf7/advice_for_opiate_induced_nauseathrowing_up/,7,https://redd.it/aghvf7,ubercharlesinit,Advice for opiate induced nausea/throwing up,"So as the title states. I am looking for advice on the nausea that comes with opiate use. Not looking for ""it goes away with time, blah blah"" I am aware of this. I have been using heroin for going on 3 years (2 intravenously). I do not use daily, at max I use like 3 or 4 times a week. Currently I've used for the first time in a week and a half yesterday evening and just a bit ago now. I've used methods in the past like taking Benadryl (diphenhydramine) or Dramamine before use. And this usually helps IMMENSELY. But, sometimes I don't have the opportunity to dose these meds for whatever reason and I'm left with nausea and vomitting that makes the high almost un pleasant. Are there any other methods to avoid the nausea? And are there any ways to reduce it once you have dosed? Thank you opi fam and happy nods!!",1547615947.0
aghnfg,https://www.reddit.com/r/opiates/comments/aghnfg/curious/,10,https://redd.it/aghnfg,maxmillliz,curious,i have an older guy ive known for years just bumped into him the other day we have made a deal that he will trade me his prescriptions for lung cancer he says he has been prescribed both oxy and bydromorph at the same time is that even possible or is he just telling me fairy tales?,1547614227.0
aghjvy,https://imgur.com/DDnDteH.jpg,22,https://redd.it/aghjvy,ForeverStoned420,Yayyy re up day,,1547613488.0
aghj9x,https://www.reddit.com/r/opiates/comments/aghj9x/need_help_took_hydrocodone_for_pain_but_i_also/,7,https://redd.it/aghj9x,humbugbaby,Need help- took hydrocodone for pain but I also drink a lot..,"I’ve got this bitch of a tendinitis problem in my arm so I took a 325mg hydrocodone pill. I don’t take it regularly. Problem is I’ve been looking forward to getting trashed in a few hours and I’m not trying to like, sedate myself to death. How long should I wait before I drink again? Will I be good in a few hours? ",1547613350.0
aghesl,https://www.reddit.com/r/opiates/comments/aghesl/quick_question_yallreassure_me_im_ok/,10,https://redd.it/aghesl,ICantSpellMyName000,Quick question y’all...reassure me I’m ok,I just railed 4 REAL 5 mg Oxy Mboxes....it was a shit ton of powder...you can snort them bitches right?? Bottle said Oxy Hcl??....,1547612411.0
agh4te,https://www.reddit.com/r/opiates/comments/agh4te/wondering_if_anyone_has_this_issue_of_getting/,13,https://redd.it/agh4te,L1M1ke,Wondering if anyone has this issue of getting high more than once a day.,"warning, this is a bit of a read but I make a valid case that I’m sure a lot of you experience. But I think I edited it to be much more readable! (I hope, because I’m very curious if I’m alone here) 

So I go back and fourth between oxy/dope and kratom or subs (lately subs) now I just started dope like a week ago and I know they say there’s prob fent in all ECP dope, but my oxy tolerance was 90-120mg pharma IRroxys 30s (so I’ve never tried fent always had from pharma from a buddy) and When I tried dope I ended up sniffing .1 lines all night with a buddy and was fine. I feel like if that had fent I’d be nodded out for days. I didn’t nod at all and no euphoria but I had oxy in system from that morning and my body can’t produce enough of whatever it takes for that euphoria more than once a day. 

I had enough dope to last a week, from when I first tried it. So I binged on it, Everyday no euphoria, using like .5 grams/day doing roughly 6-10 lines a day.  

I made that post about it being underwhelming. So I took a break of 3 days I used just the smallest amount of subs to keep me not sick which was like 1-1.5mg/day. But my last line of D was 2am sat night, I was at a casino hotel lol then didn’t need a suboxone till I was back home and I took 1mg Sunday night like 2am when I woke up sweating and felt like shit and Monday about 1.5 mg at 4pm 

Today I got dope at around 5pm I used at like 6 and finally I got that euphoric feeling again!!! But it took two bags (idk what they weigh but should be .1 I doubt it some are bigger/smaller) I than did another bag with .5 Xanax and nothing more. Again my body can only get that euphoria once a day. So I’m hoping in the am it works ok. 

My buddy has some oxy for me in the am he’s giving me for a ride to court, so I’m gonna mix some w the dope. I sniff and never IVed dope but my ROA of oxy was oral. I’d take Cemetidine than chew it up, Idk if anyone else experiences this where they simply cannot get that high they desire more than once a day.   And  if you use everyday,  you eventually don’t get the euphoria at all the next morn if your last dose at night is too close to your dose in the am. 

Fuck my body really sucks I don’t get. For someone with no H tolerance I was able to go through 1.5 grams  in like 3-4 hours with a buddy so .75 each, He was mangled, I was totally fine no nods at all. 

I could go on and on about how these drugs effect me so different than anyone I know but I won’t bore you. I’m just curious if anyone has the same effects. And I’ll let you know how it goes tm. I bought 7 bags tonight I was planning on doing 3.5 but, the last one ripped open so I did 4. 

I Started with 2, after a test bump, and felt really good for like an hour then I ate dinner kinda sobered up, I took about .5-1mg Xanax and sniffed another 2 bags and feel fine now, never regained that euphoria just very relaxed and afterglow of opiate feeling. 

Tm morn I have 3 bags left ima sniff one bag with the 30mg oxy hopefully that’s enough. And then just maintain w the other 2 since I won’t be able to take subs until the next day most likely anyways.  

So just wondering if anyone here experience the same thing or, is it just my body it’s shitty natural tolerance to most drugs? Thanks for putting up with the novel! ",1547610409.0
agh294,https://www.reddit.com/r/opiates/comments/agh294/favourite_things_to_do_on_opiates/,35,https://redd.it/agh294,GabeShreds420,Favourite things to do on opiates???,,1547609894.0
agh1yk,https://i.redd.it/27ce0lg3hpa21.jpg,1,https://redd.it/agh1yk,xpinsandneedlesx,For the girls that love their roxycodone,,1547609838.0
aggwja,https://www.reddit.com/r/opiates/comments/aggwja/broke_as_a_joke/,42,https://redd.it/aggwja,landon-herrin,Broke as a joke.,"Well tomorrow I’ll be withdrawing 😩 it Sucks , I have high anxiety about withdrawing.  Ugh, I hate this life style I live. 🤦🏼‍♂️",1547608774.0
aggrud,https://www.reddit.com/r/opiates/comments/aggrud/tramadol_just_hit_me_like_a_goddamn_train/,7,https://redd.it/aggrud,opi_throwaway901,Tramadol just hit me like a goddamn train,"I have an almost non-existent tolerance to opiates. I have some limited experience with codeine, DHC, and ethylmorphine but that's it. Got some trams for legit pain reasons, and I thought I'd see if I could get a nice buzz going.

I took 100mg and got just that, but then I decided to be a stupid mothefurfucker and I redosed 150 about 2 hours later. That was now more than 12 hours ago, I'm still a bit dizzy, pretty itchy, and the only way I can sleep is for an hour or two at a time in this weird semi-sleeping blacked-out state (I could be nodding out, but it sure ain't pleasant), despite being extremely tired.

Before that I had taken up to 200mg of DHC and it never felt that intense/lasted that long. It started off as really euphoric and but goddamn I won't be touching tramadol anytime soon, and when/if I do I'll stick to 100-150mg. Or maybe I'll just act like an adult and take it therapeutically as prescribed.

Here's hoping my dumb ass won't have a seizure.",1547607892.0
aggqd0,https://www.reddit.com/r/opiates/comments/aggqd0/fuckin_goodbye/,27,https://redd.it/aggqd0,DragonChaser760,fuckin goodbye :(,"so I got the job I wanted and am subject to random drug tests every month, I hate it but love it and am so torn I cant even smoke weed any more...I should be happy but all I am thinking about is getting high ""one last time"" I'm still in training so I may have a chance but fuck this job has everything! 401k, health/dental ins, annual raises and all that good shit...im just so torn living the sober life is so boring but I haven't had shit ina awhile and this is the break that I need! It sucks saying goodbye but I fucking have too...Im going to miss the game and all the bullshit, my life has been based around H for the last 6/7 years I owe this to myself! I love you all and will fucking miss you guys! ",1547607624.0
