2566c7,https://www.reddit.com/r/opiates/comments/2566c7/opiate_testing_as_part_of_job_employment_drug_test/,8,https://redd.it/2566c7,imd14u,Opiate testing as part of job employment drug test,"First of all, does anyone know if Oxycodone is one of the drugs that is tested for when providing urine for a job employment drug test? I have a prescription for it, but I don't take it as prescribed so are they able to determine how much is in your system (to look for abuse verses as prescribed)?

Also, how long does Oxy stay in your system? My drug test isn't until Wednesday of next week, am I able to flush my system some or is it to late for that given I'm about a 100mg a day user and have been for months?

Appreciate anyone's advice! Thanks",1399679970.0
2566a7,https://www.reddit.com/r/opiates/comments/2566a7/shady_shit_going_on/,26,https://redd.it/2566a7,LsWee_D,Shady shit going on...,"So ive been selling weed mainly around my neighborhood hardly ever out of the house.  but today i had 2 close friends roll up 2 seperate times to buy some now they are always over at my house which is why i didnt even second guess it.  but now maybe 2 hours after the deals went down there is what looks like a undercover sitting up on the road that leads into my couldasac.  Mere coincidence or should i be worried?  i dont sell much maybe a qp every couple of days no longer then a week i sit on it though.  im really freaked out right now.. mainly i just want someone to talk me out of being worried.  but i need honesty 

EDIT: i should explain i normaly do not ever sell out of my house it is very rare that i do and it was only because it was kids i hang out with every single day.  so they could easily just be getting a phone charger or something.",1399679931.0
2565sx,http://i.imgur.com/UMW0xWU.jpg,14,https://redd.it/2565sx,Sober_junkies,Another stupid pinned eye.,,1399679558.0
2563z9,https://www.reddit.com/r/opiates/comments/2563z9/i_needs_dat_ginseng_in_muh_life_dope_porn/,9,https://redd.it/2563z9,RalphUpAndAway,I Needs Dat Ginseng In Muh Life! [Dope Porn],"Picked up 35 of these beauties today.


Quality - 7.5/10 Ive been getting this same stamp since January. Its gone through several different batches. It started off kinda weak in Jan, Feb and March it was the strongest dope ive ever had, just a half a bag would get me nice and high. Now its somewhere in between.


Quantity - 10/10 Some of these things have atleast .15 in them. A lot of them go up past the first fold.


Rush - N/A, I havent banged in over 2 years, but even just sniffing these things, i do get a nice feeling in my back and down my legs of that almost wonderful muscle ache/warm water feeling. I would imagine they have a nice rush since i dont normally feel that off other dope when i sniff it.


Legs - 11/10 Holy fuck do these things last long. All the different batches of these things last crazy long and they keep me well for over 24 hours. I suspect there is some other type of long acting opiate in these. Someone I know also said they tested positive for methadone from these bags. Im not sure if i believe him because im not sure if its possible/economic to cut dope with methadone and have it be effective but who knows. Either way these things last forever.

Price - 7/10 These things are $10 all the way up because they come from out of state(Im in the south and these come from Jersey), but the consistent quality/quantity of them makes it well worth it compared to smaller local bags with hit or miss quality. These bags probably weigh out to about 4.5 grams and i got that at $350 and the shit is fire. To get 4.5 grams of my local shit,which sometimes is just as good quality wise and sometimes not so great, I would have had to pay $600-700. So this is def worth the money from where Im at.

Overall - 9/10 These things are fucking great, a little pricey, but i dont mind paying a little extra since the quality/quantity is always there.

http://i.imgur.com/zrcJFPh.jpg - 35 of these wonderful Ginsengs

http://i.imgur.com/uiKHTHl.jpg - 1 Bag lined up

http://i.imgur.com/59RL21R.jpg - Another 1 bag ready for the feeding",1399678263.0
25608q,https://www.reddit.com/r/opiates/comments/25608q/court_ordered_rehab_how_to_pay_experiences/,9,https://redd.it/25608q,grby1900,"Court ordered rehab: how to pay, experiences?","Posted on here last week: my bf was arrested in NYC, Brooklyn specifically, with 45 bags of H. Got sent to drug treatment court where they postponed his plea hearing to evaluate his addiction. Since last week he has been going thru confusing hell trying to apply for treatment. The case worker wants him to show he's serious on getting a jump on detox and inpatient rehab. He's without insurance and makes low income trying to get medicaid so he can enter rehab. They even told him to be ready with a bag for inpatient just to be turned away BC finances weren't ready. Soooo now he's trying  to get approved for medicaid so he can finally get started. So frustrating, anyone have any insight? Could he just go to prison if he can't pay for treatment??",1399675674.0
25604i,https://www.reddit.com/r/opiates/comments/25604i/smoking_ecp_4/,23,https://redd.it/25604i,hbabby,Smoking ECP? (#4),"Just copped 1.5g of some good gear. I'm really only used to tar which I smoke, and I've heard snorting isn't as near as intense.
Did a couple bumps though and I'm feeling damn good, just wish I could smoke it instead.

So my question is, is there a way to smoke ECP? If so, how? 
I've heard using caffeine works but I only have 200mg caffeine pills which probably have a lot of fillers.

Thanks for any help!",1399675580.0
255xfy,http://imgur.com/s0ikFBS,21,https://redd.it/255xfy,GreenUmbrellaShooter,Anyone got a pick-axe for this boulder?,,1399673693.0
255woh,http://i.imgur.com/NuMhuFU.jpg,11,https://redd.it/255woh,robertpooner,"5 minute drawing, 3.5 gramme and the start of my nod session being smoked. HAPPY FRIDAY!",,1399673197.0
255uhj,https://www.reddit.com/r/opiates/comments/255uhj/havent_slept_in_2_days/,24,https://redd.it/255uhj,JuicyJay,Havent slept in 2 days.,"Like the title says I havent slept in 2 days due to the last lingering effects of withdrawal. Finally someone came through with some xanax and muscle relaxers and I got more melatonin. Needless to say, I will be sleeping tonight finally. Just got to make it 5 more hours of work. Ugh fuck this shit. At least I don't physically feel bad, excluding the lack of sleep. I'm almost done with the ass effects of acute withdrawal. Even considering not sleeping, I still am so happy and grateful I have been able to make it this far. I guess we all know it's not gonna be easy to finally kick everything. I just wish I could have slept for a little while last night. I feel like I'm back in my crack head tweaker days. It's going to be worth all the suffering though, just need a few more days, hopefully.",1399671708.0
255p1h,http://i.imgur.com/FZzbx9s.jpg,8,https://redd.it/255p1h,BigSilly91,Pill pr0nz,,1399668198.0
2554ij,https://www.reddit.com/r/opiates/comments/2554ij/i_cant_take_this_anymore/,32,https://redd.it/2554ij,Sixfeetunderthesky,I can't take this anymore,"Everyday, I sit down after class and try to let all the stress of my day go.
        
It hurts so good....
      
But I know I can't keep doing this to myself
        
I envision how my life would be like without drugs as I wait
          
Then it comes...
         
My screams fall on deaf ears, for I am alone in my castle of misery
^^^^^^^^^^^.
       
^^^^^^^^^^^^^.
          
^^^^^^^^^^^^.
          
Guys, I literally just broke my toilet. It's not just clogged this time. Any advice?",1399655505.0
2550us,https://www.reddit.com/r/opiates/comments/2550us/friend_odd_last_night/,14,https://redd.it/2550us,ByaCocky,Friend OD'd last night,"So a buddy I haven't seen for a while has been wanting to chill for a while now and he's been doing dope again and I talked to him a few days before and he sounded fucked up each time.  So I finally agreed to chill and he came over yesterday around 7.  So we had a deal going that I would toss him a bag for a xanax bar and 5 bucks.  I only have these fat dubs so I gave him litteraly no more than a third of one of my dubs, which was about the size of skimpy normal ten bag.  So anyway he comes over and we made plans on walking around town and checking out some stores and maybe buy a few steaks to grill.  He wanted to do his bag before we left so I gave him the bag and he gave me the bar and 5 bucks.  I just did a shot so I just popped the bar and he snorted his bag and we went on our way.  As we are walking around he is getting more and more fucked up, he was walking slow as fuck and then whenever we stopped he was doing the dope fein lean.  He is an adderal fein so he popped one of his adds in order to ""sober up"" as he put it..I know not the best idea.  Well anyway, he is all fucked up, but he's coherent and not THAT fucked up looking.  I was surprised how snorting a third of a dub could fuck him up that bad, but he was still not totally out of it.  So after walking around for a while checking out some stores, we decided that we would not go back to my house and he would just hop on the train because it was right there, and my house is like a 20 minute walk back from the train anyway.  So were  are text in back and forth and he still seemed fine.  So late last night at around midnight, he texts me that he OD'd and was in the hospital.  I was shocked and asks did anymore dope or popped anymore bars and he said he didn't, and I believe him.  He said that he got back to his place and his roommates found him curled up under his desk unresponsive and he said they couldn't wake him up so they called an ambulance.  I was in shock because I would have never expected that to happen from how little he did.  He said he didn't take any xanax that day at all, he usually only sells them to get dope and more adderal.  He's prescribed the bars and adderal, but always runs out of his adderal script and buys more from from other people.  I can't believe that shit happened.  I feel he must have a naturally super low tolerance to dope because even my first time doing dope I used about the same amount he did, sure I was puking and nodding but no where OD status.  It's also confusing how it happened so long after I saw him, he wasn't in perfect shape when I was with him, but no where near curling up under a desk and ODing.  I was with him for at least a few hours after he dosed and it had to take him another hour and a half to commute back to his place.  Thankfully, he must be ok since he texted me from the hospital after this happened.  Does anybody know of something similar happening to someone(snorting about .1 of dope and ODing 3.5-4 hours later)?",1399653192.0
254zp2,https://www.reddit.com/r/opiates/comments/254zp2/run_it_like_a_business_not_a_courtesy/,10,https://redd.it/254zp2,mistressmoxie,"Run it like a business, not a courtesy",I hate the way my city operates. Where I used to live everyone was up and in place by 8am. Make a call and go pick up. Here sometimes I can get a boy at 8 but today they all seem to have slept in. It's after 11 and still no one is picking up. Come on guys. It's a business. Run that shit like one. ,1399652433.0
25a53e,http://imgur.com/HRkMPgd,7,https://redd.it/25a53e,someone-who-is-me,It's a beautiful Sunday morning.,,1399819028.0
25a3bn,https://www.reddit.com/r/opiates/comments/25a3bn/finally_got_some_good_sleep/,20,https://redd.it/25a3bn,JuicyJay,Finally got some good sleep,"I actually slept through the night last night, something that hasn't happened for over a week. Holy shit did I miss sleeping. Turns out, all I needed was to get really stoned.  Idk why I didn't put more effort into finding some sooner.",1399817395.0
259xxb,https://www.reddit.com/r/opiates/comments/259xxb/happy_mothers_day/,14,https://redd.it/259xxb,SmoothLovin,Happy Mother's Day!,"Spoiler Alert.....one post that's not about dope or pillz.

Happy Mother's Day to all you mom's out there.  This is the one day a year that's all about you....hope you have a good one ladies!",1399811527.0
259sd1,https://www.reddit.com/r/opiates/comments/259sd1/blue_h/,9,https://redd.it/259sd1,RunFlynnRun,Blue H!,"last week i got some stuff from my usual source.. when i actually checked it out in the light. i noticed it was a blu-ish gray color.   like.. you kno those dogs ppl will call blue.  that color.   it seemed a little bit stronger than usual. and had a stronger smell.  i woulda posted a pic. but.. its all gone now haha.  
 

has anyone else ever seen shit that color ?",1399802887.0
259qz8,https://www.reddit.com/r/opiates/comments/259qz8/pills_and_emotions/,23,https://redd.it/259qz8,green-bean-fiend,Pills and emotions.,"So i've been on a nice little bender for the last 4 days, gone through almost 800 mgs of IR oxycodone (oxynorm).

Got some lovely withdrawals yesterday and a few today, but most of all i've been a giant emotional sack of shit today, been crying constantly, and just generally not on my A game, even had mum find my goddamn butterfly infusion kit this morning...what a lovely mothers day gift...to find out your sons a damn needle user.

Guess what i'm wondering is if anyone else gets these real lows after a bit of a binge, i got clean for quite a while and thought a binge would be fine but now i'm getting this fucking emo it makes me wonder if it's kind of normal to have a low after being so high. I do have some emotional shit in life i really need to deal with but up until today i've felt fine.

Don't really know what i'm asking, guess i'm just feeling like a whingey cunt today and this is the only place i can be completely honest about everything.

Take it sleezy.",1399800341.0
259owu,http://redd.it/25176f,0,https://redd.it/259owu,clarkthenarc,"Writing about opiates minus the cheesiness. Funny review: ""Briglia writes, 'Cheesiness combined with confidence often creates an air of authority.' Despite that heroin is likely a key to these doors of perception—the doors are truly open here, and one becomes wiser for having read Good Lust Charm.""",,1399796904.0
259o0x,https://www.reddit.com/r/opiates/comments/259o0x/mylan_fent_patch_questions_sublingual/,8,https://redd.it/259o0x,Halsfield,Mylan fent patch questions (sublingual),"Hi, I've been a steady opiate user for about a decade and I have pretty serious tolerance that leads to me getting no relief from say...multiple 2-4mg dilaudid shots in the ER during a life-threatening stomach infection episode.  I've dealt with fentanyl for a long time, but mainly with the gel patches or IV.  Now I've got these stupid mylan patches (the kind that is just a clear piece of plastic basically) and I have some questions for those that use more often.

1) **Technique** - Any tips on technique? I usually cut a patch into quarters and stick it down against my gums or along the inside of my cheek. The problem being that I sometimes step up from a quarter, to half, to a whole patch and feel nothing.  Sometimes I only use half and it works fine.  

Chewing? Avoid swallowing? Adding bases/acids to gum area before usage to boost absorption?  Anything like that would be helpful.

2) **Rampant Misinformation** - Some claim there is some or all of the opiate in the sticky ""glue"" residue on the skin-side-down part of the patch? I've actually read the mylan .pdf that has a diagram of the patch and the different layers and it still wasn't 100% clear.  It doesn't help that there are tons of forum posts claiming only the residue is viable when others are saying only the plastic patch is active.

3) **Activation/RoA** - How long should a sublingual patch take to work? I thought sublingual methods usually worked pretty quickly but sometimes I don't start feeling it for quite a while (1+ hours).  

Is sublingual the best RoA? It seemed the easiest compared to extraction for buccal use.  It may sound weird but is rectal an option? I couldn't care less what method as long as it works better than what is going on now.

**TL, DR** How do you best go about using these? Is my tolerance just too high for the amount in them or is my technique poor?

Edit: Also, if I have a few and I'm a daily user am I better off just using these as skin patches the ""correct"" way?",1399795550.0
259kje,http://www.hightimes.com/read/controversial-heroin-pill-hits-market-month,107,https://redd.it/259kje,GettinDrunkWithJesus,"The people at High Times are, unsurprisingly, fucking terrible journalists.",,1399790599.0
259hbl,http://imgur.com/p3IDmJ2,7,https://redd.it/259hbl,bigblue2013,okay,,1399786819.0
259gny,https://www.reddit.com/r/opiates/comments/259gny/turning_codeine_into_heroin_anyone_got_a_good_how/,30,https://redd.it/259gny,Agalol,Turning Codeine into Heroin: anyone got a good how to?,"So I learned in canada that you can buy codeine over the counter, I live close to the border, and I am wanting to try and purchase codeine up there and turn it into heroin. Anyone know of a good guide? I know its adding something and mixing from what I understand.",1399786168.0
259g0c,https://www.reddit.com/r/opiates/comments/259g0c/fuck_people/,23,https://redd.it/259g0c,Whatamidoinghurr,Fuck people,My wallet got jacked and i was thrown from a car. I fucking hate everyone.,1399785539.0
259cei,https://www.reddit.com/r/opiates/comments/259cei/i_feel_like_poop_goddamn_this_cold_and_update_on/,14,https://redd.it/259cei,meowforme90,i feel like poop. goddamn this cold. and update on the whole me trying to quit thing,"hey guys. I've disappeared these last few days. so last week on friday i went down on my methadone from 110 to 100mg. i was feeling totally fine with the change up until this wednesday when i woke up with a bit of a cold. it also happened to be my first day of work. i went in anyway, i need the money. wake up thursday and I'm losing my voice. i go into work and i go see my psychologist. i tell her i feel fine on my new dose. the weirdness I'm feeling is probably related to my cold and not the new dose. i tell her i want to go down to 90. they write me a new script starting this week on weds. (so almost two weeks between going down from the last time). wake up  on friday i feel even worse but i tough it out at work. i feel like maybe I'm getting dope sick a bit earlier in the day but its hard to tell with this goddamn cold. today i had a day off and slept in all day. woke up at 4pm and hadn't done a hit in 24 hours. woke up completely drenched with really bad dreams. run to bathroom, poop, do a hit. feel better. right now I'm feeling okay except the weird sweatiness but i did two hits today and my eyes are pinned so i blame it on the cold.

now I'm scared what if I'm still sick come wednesday. maybe i should have waited longer to go down again but i honestly felt completely fine until i caught this cold. plus my final exams start next week so id like to feel better like I'm not dying. I've been all sweaty and nasty since my cold got worse. i can't tell if this is because of the cold or from going down on my meth.

EDIT: realized i forgot to take my methadone today. took it after posting. I'm no longer sweating and I'm feeling a lot better but my head and throat still hurt.",1399782104.0
2598xr,https://www.reddit.com/r/opiates/comments/2598xr/waxy_dope/,11,https://redd.it/2598xr,Mileyisfugly,Waxy dope?,"So the guy I can occasionally get ecp from came through tonight but it was very different from the hard chunks or powder that I'm used to...for one it had a waxy consistency and was very hard to get to dissolve, I had to really work at it....it looked normal once dissolved but was a thicker solution...the cotton was the same color it always is and it did the trick I guess I'm just worried about what I just put into my arm....


So did I just take 10 years off my life or what? Anyone ever came across stuff like this before?",1399779098.0
2595jo,http://imgur.com/Vqtmzv2,52,https://redd.it/2595jo,nodout94,Green dope porn? Help me identify?,,1399776188.0
25938h,https://www.reddit.com/r/opiates/comments/25938h/i_dont_know_what_to_think_about_opiates/,41,https://redd.it/25938h,aAscii,I don't know what to think about opiates,"Hi there junkies :p

Over the course of the past two years I've tried pot, stimulants, and psychedelics, and I love them. Pretty miss Lucy keeps me alive and shows me the brighter side of life. I handle every substance I take tremendously and have had a completely positive drug experience so far.

However, I love new highs. The first time is always so great! I've been researching opiates and they seem like a great ride to go on but shit, of all the drugs, these are the ones that fuck you over. Putting a hole into your arm? Selling important possessions for a rush? I'm honestly scared. I want to be able to listen to Nirvana the way it was supposed to fucking be but I don't want my life to be destroyed.

I personally think I'm mature enough to moderate and be safe while using, but I need expert opinions.

Thank you for listening, and feel free to tell me a good substance to start with. :)",1399774257.0
258wsd,https://www.reddit.com/r/opiates/comments/258wsd/does_anybody_get_aggressivemoody_on_oxycodone/,25,https://redd.it/258wsd,Gardnerl92,Does anybody get aggressive/moody on Oxycodone?,"I find that when I take high-ish amounts of Oxycodone 30+ mg IR at once, I sometimes will become aggressive. Not physically, but verbally. I feel good inside (like euphoric sometimes), but I find I snap a lot more easily on oxy. I'm more on edge with my nerves. Sometimes I'll get moody, upset and overly aggressive like I mentioned. Maybe it's more when the nice effects start to fade away. 
Anyone else like this or am I the only one? :/",1399769180.0
258smz,http://imgur.com/oFbgLvF,27,https://redd.it/258smz,mouthEXPLOS1ON,Now this my opiants is a SPEEDBALL,,1399765960.0
258i5e,https://www.reddit.com/r/opiates/comments/258i5e/cold_copping_where_openair_is_almost_nonexistent/,20,https://redd.it/258i5e,opithrowaway666,Cold copping where open-air is almost nonexistent?,"Guys...I just moved to this small city in TX and although it's a college town I have no idea where to attempt to find a connect. I don't know if these threads are allowed but i'm simply looking for advice. How the fuck do I cold cop when the open-air market doesn't exist? I mean, I heard that I can find crack pretty easily but I don't want crack, I want dope. :-(",1399758212.0
2588co,https://www.reddit.com/r/opiates/comments/2588co/help_getting_off_subs/,27,https://redd.it/2588co,thoffmeyer,Help getting off subs..,"Hey guys and gals, I need some techniques or advice on kicking subs, I've been on them a few months, I have a good surplus.. I need advice on how to get off these with lessening the horrid fucking withdrawls.. I do have a huge bottle of lope and I'm trying to ween down, I've noticed it takes about 3 days without anything for the wds to start kicking my ass.. I need help on a taper plan or advice to someone who has done this before. 

Some information.. I'm at 4 to 6mg a day. Today I just started to lower my dose I'm trying to just do 2mg a day. What's a good plan to taper off. Like I said I have 60+ so I don't need a quick taper but the sooner the better. 

Thanks you all in advance. 

Btw, I have neuropathy in my legs and feet, so I know the rls will kill me, I also have a decent amount of benzos. ",1399751087.0
2587il,https://www.reddit.com/r/opiates/comments/2587il/tramadol_actually_gave_me_a_buzz/,9,https://redd.it/2587il,Notaddictedguy,Tramadol actually gave me a buzz?!?,"I take tramadol for minor pain all the time and it works great. But after reading somebody on here say that it potentiates itself I tried it. It's a different buzz but its kinda nice. Very mellow and kinda makes my breathing shallow.  I take 2 50mg wait 90 minutes, Take 3 50mg wait 60 minutes, and 2 more 50mg. This gives me the best buzz. I have played with doses multiple times and I find that dosing 3 times is my favorite. I have taken tram for years and never got high on it. But this definitely does the trick for me.
This is a throwaway by the way. If someone knew I was getting high on trams I would be in deep shit lol.


Tl:dr tramadol really does potentiate itself very well.",1399750489.0
2586nv,http://traceyh415.blogspot.com/2014/05/mothers-day.html,30,https://redd.it/2586nv,traceyh415,Mother's Day,,1399749913.0
2583mv,https://www.reddit.com/r/opiates/comments/2583mv/need_a_little_reassurance_got_a_piss_test_coming/,11,https://redd.it/2583mv,burghJunkie,Need a little reassurance got a piss test coming up,"Hey yall. Got a drug test coming up and have some questions. Stopped using Tuesday at about 4pm but was high till about 9pm Tuesday. I had a 4 month habit of about 5 stamps a day. How long till I piss clean ? I'm 170lbs 6 ft male. Urine screen is on the 14th, Wednesday for pre_employment. Also what do they test for its at labcorp.



Edit: also after this I would like to start being a chipper. Any advice on how to avoid withdrawals and get high every once and a while ?",1399747741.0
2583aw,https://www.reddit.com/r/opiates/comments/2583aw/question_about_vicoprofen/,13,https://redd.it/2583aw,stevepref,Question about Vicoprofen.,"Anyone have any info about these, got four of them.",1399747522.0
2580zb,http://i.imgur.com/bGQ1jNe.jpg,6,https://redd.it/2580zb,day_drifter,Saturday afternoon snack,,1399745907.0
