4oe0cn,https://www.reddit.com/r/opiates/comments/4oe0cn/too_much_pst/,10,https://redd.it/4oe0cn,The_Dawkness,Too much PST?!?!?!?,"Ok, so, one day about 6 months ago I was on like this binge of poppy seed bagels. I mean, they were good. This local deli I live near does these bagels that are like, 90% poppy seeds 10% Jewish Flour or whatever they're made of, and I started getting this real buzz after eating like 4 of them. So, smash cut to a month later, and I'm out back of the deli every few days buying bags of their poppy seeds for 20 bucks a point and making that shit into a fire ass tea, just like the guys in this thread say to do. Needless to say, for only like 100 bucks I was FAAAAAAAKED up most of the time. I would put the half gram of poppy seeds into a blender, then pour what came out in a coffee cup and put in some Dr. P***er (didn't want to put the full name as it might be sourcing) and like, 10 minutes later get SOOOOO high up. I would like, listen to music or maybe work out or whatever. It had been a good run, but as I am only a lowly high school counselor I didn't make enough money to keep that habit going as long as I stayed around at my job talking to these drug addict pieces of crap that I have to talk to on a daily basis. Well, after 6 months of my habit I started going broke. 

Yesterday I decided to take action. I have a history of being able to handle myself in tense situations. One time at the high school I work at these two kids were talking crap to each other and I heard it from my office. Me being the responsible adult I am I ran to the scene of the fracas and put myself in between these two guys with a circle of ranting children around them and said, ""Hey kids, shows's over, everybody go to your classes!"" Which was by far the coolest thing I've ever done and definitely shows that I am the man you want in your corner in a sticky situation. 

So, to make a short story long, I walked in to the local Bank of America in my area and pulled out a pellet gun I had confiscated from one of the students at Timothy Leary Memorial High School and put that badboy to the neck of the security guard standing right inside the doors. I said, ""Listen, little man, I'm here to rob this here bank, and there's nothing you or the fuzz can do about it, so walk up to the tellers and tell them to put all the money in this bag!"" Then, I handed him my favorite North Face bag and he proceeded to get the money. All the employees dropped to the floor and the customers ran out so fast they could have won the blue ribbon in our annual TLMHS 100 meter dash. Anyways, the guard had the audacity to say that my gun wasn't real so I shot him 11 times in the throat and face with my .17 caliber pellets and he went down. Then I reloaded and threatened two of the bank's employees who were refusing to put any monies in the bag, but they didn't listen, So I had to shoot them around 18 times each, with 3 reloads, and they finally went down. 

So now I've been standing inside the bank with around 4 thousand dollars in cold hard cash, ready to exchange for nearly a whole ounce of those sweet poppy seeds that have been getting me so high, but I've been on the phone on and off for the last 8 hours with the cops outside, and they don't sound happy. I've only killed like 1 and a half people and I've got this money but I've got to get out of the bank before I go into WD's.

Any tips?",1466092267.0
4odzkn,https://i.reddituploads.com/552940685c6047beae3f6d57a5340ed8?fit=max&h=1536&w=1536&s=71e321f2f486cc1942321a03b2c9d49b,19,https://redd.it/4odzkn,hello-titties,"IR morph 15mg . Not too fond of these , pointers on best ROA ?",,1466092028.0
4odyzh,https://www.reddit.com/r/opiates/comments/4odyzh/just_a_dumb_idea_for_the_sub_therapy_thursdays/,44,https://redd.it/4odyzh,gotta_jibboo,"Just a dumb idea for the sub.. ""Therapy Thursdays""","Opiates. Some use to try and heal grief. Some use leads to grief. The life of users, addicts, and former addicts isnt easy, and many of us don't really have outlets in real life to work our feelings out. 


So, i thought maybe we could do a weekly thread type of deal where people can bring there hardships and feelings and lay it all out there. The rest of the group can respond how ever they feel fit. Offer advice, encouragement, or just let them know they are listening. The things don't necessarily have to be opiate related, recent or anything specific what so ever, just anything you wanna get off your chest.

Edit: ok wonderful. Thanks for feedback. The inaugural thread will be posted at 6 eastern tonight. Thanks guess

If the community or mods think this is a good or bad idea, then let me know.",1466091834.0
4ody8k,http://imgur.com/OFOeqt7,11,https://redd.it/4ody8k,ThatYoungBro,Oxy pills.,,1466091594.0
4odv08,https://www.reddit.com/r/opiates/comments/4odv08/safe_to_take_30500_cocodamol/,1,https://redd.it/4odv08,backside_94,Safe to take 30/500 Cocodamol?,Is it safe to take 3 30/500ml codeine about 2 hours after you took 3 more? In ridiculous pain and need help. Please reply anyone that can advice me this wont seriously hurt me.,1466090558.0
4odq7x,https://www.reddit.com/r/opiates/comments/4odq7x/got_off_suboxone_four_months_ago_was_prescribed/,7,https://redd.it/4odq7x,sassytunacorn,"Got off suboxone four months ago, was prescribed Percocet...:","I of course took four at a time, to feel a great buzz. Only had 16 total (5/350acetomenophen.) but Jesus Christ did it make me sad to be clean. I'm curious to know if that small valid relapse is going to make my cravings worse? Looking at all these roxys on this sub makes me want to cry. I'm not in w/d's anymore ever but Jebus do I want to use! How should I overcome this feeling? Drink booze? Smoke? Haha die? Ugh",1466089083.0
4odllg,https://www.reddit.com/r/opiates/comments/4odllg/fiending_through_the_work_like/,4,https://redd.it/4odllg,anon602,Fiending through the work like...,"https://www.youtube.com/watch?v=XK6xrG7q6tk

Me when I don't have tits... ",1466087492.0
4odk8n,https://www.reddit.com/r/opiates/comments/4odk8n/what_yall_getting_into_today/,77,https://redd.it/4odk8n,AccntNmbr4,what y'all getting into today,I'm without one of those job things. And bored as hell. Let me live vicariously through you. All I've got is ultram and kratom. What kinda goodies is everyone scoring?,1466087050.0
4odc7d,https://www.reddit.com/r/opiates/comments/4odc7d/all_apologies/,7,https://redd.it/4odc7d,AccntNmbr4,all apologies,"So. I'm new to reddit. Over the last week I think I've accidentally broken every rule for a couple of really cool subs. Like y'all. 

I've spoken with mods and now I know where the rules are. And what I can and can't do.

But yeah. I'm sorry. I wasn't trying to be an asshole. I was just new and high and stupid.

If there's any advice for a noob so I don't piss anyone else off, that'd be awesome. I don't wanna piss anyone else off. Was never my intention. ",1466084137.0
4oda0x,https://www.reddit.com/r/opiates/comments/4oda0x/need_your_help_is_there_a_slang_term_for_this/,16,https://redd.it/4oda0x,PayEmmy,"Need your help - is there a ""slang"" term for this?","When a patient who is not in pain goes to a doctor to get pain meds then sells them to someone else, is there a specific slang or street term for this? Someone told me it's called ""scabbing,"" but I've never heard that term before. ",1466083288.0
4od9n7,https://www.reddit.com/r/opiates/comments/4od9n7/anyone_else_acquired_a_taste_for_the_drip/,35,https://redd.it/4od9n7,low_me_steelers,Anyone else acquired a taste for the drip?,"I snort dillys and when I first started, the worst parts by far were the taste of the drip and the itch. Now that I'm addicted, the itch is almost non existent, and I actually like the taste of the drip. Nothing like waking up after a fitful night of ""sleep"" and in a cold sweat than getting the taste in my mouth",1466083151.0
4od54o,https://www.reddit.com/r/opiates/comments/4od54o/kratom_strain/,7,https://redd.it/4od54o,Trowwaybcynot,Kratom Strain,"I know this question could go to r/kratom, but I feel you guys would have a better answer. I'm new to kratom - which strain is most similar to oxy? Im looking for the classic opiate buzz - euphoria, sedation - not interested in any uppers. ",1466081337.0
4od54b,http://i.imgur.com/6hGfJSt.jpg,19,https://redd.it/4od54b,KewJillah,10+ years deep. Never seen these,,1466081332.0
4od28x,https://www.reddit.com/r/opiates/comments/4od28x/dboys_shitpost/,10,https://redd.it/4od28x,WorkYouFuck,Dboys (shitpost),"Anyone else have dboys slow as a sloth? 

(My fiancÃ© didn't believe me when I said there was a sloth fact bot, so I figured I'd kill two birds with one stone here. Thanks for putting up with me.)",1466080119.0
4od1s3,https://www.reddit.com/r/opiates/comments/4od1s3/weird_way_i_do_my_sub_induction_does_anyone_else/,4,https://redd.it/4od1s3,Suckmyflats,Weird Way I Do My Sub Induction (Does Anyone Else Do This??),"I dunno aboug anyone else, but sometimes I can't wait 24 hours...so what I do when I can is I save 1-2 bags. When I start to feel a little off, I take 1 mg of sub and a few minutes later, I shoot the bags. 

It fends off the PWD pretty successfully. Anybody else do this?",1466079918.0
4ocr0d,https://i.reddituploads.com/16ecb63c35274af1bc68337ea53c589d?fit=max&h=1536&w=1536&s=65d48062756b4a669824ef80d27b5924,10,https://redd.it/4ocr0d,dopey1003,early morning pill porn,,1466074610.0
4ocqgj,https://www.reddit.com/r/opiates/comments/4ocqgj/is_oral_oxy_as_dangerous_as_the_media_makes_out/,13,https://redd.it/4ocqgj,rainbowforever,Is oral oxy as dangerous as the media makes out?,"Forgive me if this is a dumb question - I'm new to oxy.

I came across this thread from bluelight where most of the posters seemed to think it's not as easy to OD from oxycodone as the media makes out, so I'm confused about how risky oral oxy is:

http://www.bluelight.org/vb/threads/609106-Oxycodone-overdose-That-easy

Are all these stories of opiate overdoses in the news and on social media and Reddit more likely to be heroin, fenatyl and morphine than oxycodone?",1466074300.0
4oco1i,https://www.reddit.com/r/opiates/comments/4oco1i/some_important_questions/,12,https://redd.it/4oco1i,johnytrash,Some important questions,"Hi, I know that you'll hate me once again but I have this crucial question - were you depressed prior to using opiates? I ask this because I am and am afraid that it gonna lead to a destruction. I already wasted money on dope that I don't know what to do with now after reading many stories about how opiate induced endorphins hijack your brain and self-control...

If not then why did you chose to do opiates? Just out of curiosity or some superiority complex? Sorry.

Yeah and I would like to apologize for trolling this subbredit. Some days I feel like a jerk - it's a coping mechanism for me.",1466072914.0
4oco0p,https://www.reddit.com/r/opiates/comments/4oco0p/strange_smoking_observation/,1,https://redd.it/4oco0p,punkchic87,Strange smoking observation,"I only smoke heroin as all we get here is the #3 powdered type and I haven't gotten into injecting.  I alternate between smoking in a ""meth"" pipe at a very low heat, or smoking of foil with a glass tooter. 

I put metal gauze filters in to try and make it  slightly easier on my lungs (I'm dumb, I know!), but i've noticed that when I run out of powder, if I smoke the residue from the metal gauze, the thick smoke gets me so much higher ALOT quicker.   It was like winning the lottery when I discovered it! :D  

Totally random observation, but thought i'd share :)",1466072894.0
4ocm9l,https://www.reddit.com/r/opiates/comments/4ocm9l/switching_to_heroin/,14,https://redd.it/4ocm9l,Carterwasneverhere,Switching to heroin,"I've been using pills for a few years, would it be better to switch to h to save money? I use roughly 120mgs of oxy a day.",1466071867.0
4ociwe,https://www.reddit.com/r/opiates/comments/4ociwe/narcan/,4,https://redd.it/4ociwe,Herb_Everstank,Narcan,"Anyone know where I can get Narcan? How much it cost, or is it available free from somewhere? Thanks ",1466069916.0
4och9p,https://www.reddit.com/r/opiates/comments/4och9p/fentanyl_pills/,13,https://redd.it/4och9p,Alt1856,Fentanyl pills?,"Sup y'all. So there's a fella I know with sublingual fentanyl tablets. They're prescribed, not presses. 100mcg. I can't find shit about them. Can you snort a sublingual pill? Is fentanyl's BA better that way? What do you think they'd be worth? They're Abstral brand I believe. I'm not opiate naive. He's had them a while, but I usually just buy dope instead. I'm just curious if they're recreational.",1466068964.0
4ocex4,https://www.reddit.com/r/opiates/comments/4ocex4/oxymorphone_opana_er_ir_vs_hydromorphone_exalgo/,12,https://redd.it/4ocex4,htbdt,Oxymorphone (Opana ER +IR) vs Hydromorphone (Exalgo + IR) for neuropathic pain?,"Assuming equivalent dosing, is one better than the other for neuropathic pain for any reason? I have a damaged intercostal nerve from a botched chest tube, and it has been causing me untold amounts of pain. Currently I am on 20mg Opana ER twice a day with 2x10mg Opana IR per day. I find that I can barely feel the ERs, but the IRs make all the difference. 

I want to try out Exalgo (the ER version of hydromorphone), probably around the 36mg + probably 2 4mg dilaudids per day (at first, then up to 8mg twice a day).

Does anyone have any experience between the two? I know that the new Opana ERs are complete shit, so does anyone know if the Exalgo is the same or better? 

Also, as for ROA: the Opana IRs nasal BA is 43%, where the Dilaudids are 52-58%. Given that Opana oral BA is 10%, the hydromorphone is 30-35%. 

mg/mg conversion factor is 0.6mg hydromorphone/1mg oxymorphone

So: I'm interested in thoughts on both neuropathic pain between the two as well as just comparatively in treating pain as well as other subjective effects between the two.",1466067502.0
4ocayg,https://www.reddit.com/r/opiates/comments/4ocayg/whats_in_your_right_kit/,11,https://redd.it/4ocayg,UsamaBinNoddin,What's in your Right Kit?,"As the title indicates, what's in your junkie kit?

I have a dripper bottle of clean water, a teaspoon to cook in, a baggie that holds my rinses, a rig, a lighter all held in a black drawstring bag. 

https://imgur.com/UKTiObs",1466065068.0
4oc6iv,https://www.reddit.com/r/opiates/comments/4oc6iv/how_would_you_take_this_guy/,8,https://redd.it/4oc6iv,OpiatedMinds,How would you take this guy?,"https://www.youtube.com/watch?v=2bTeJ6JcEmc

I find him a bit douchey, and don't think I would respond to him well....what y'all think ?",1466062477.0
4oc6c9,https://imgur.com/FMJzfM5,4,https://redd.it/4oc6c9,UsamaBinNoddin,Bottoms up,,1466062359.0
4oc4nm,https://www.reddit.com/r/opiates/comments/4oc4nm/would_anyone_like_to_chat/,4,https://redd.it/4oc4nm,opithrowateaway,Would anyone like to chat?,"Well I waaaas gonna go to bed, but doing another line and eating candy sounded better! Who's up and whatcha doin'?!?!",1466061373.0
4oc2lq,https://www.youtube.com/watch?v=vuyEgvCVYd8,49,https://redd.it/4oc2lq,LilWayne007,"Only Once the Drugs are Done, I feel like Dying.",,1466060235.0
4oc1vw,https://www.reddit.com/r/opiates/comments/4oc1vw/morphine/,12,https://redd.it/4oc1vw,Ifuckedjarredfogle,Morphine,"So I just shot morphine for the first time(90mg). It's pretty nice, you could say. How big of a difference between heroin and morph is there when iv'd",1466059842.0
4oc06n,https://www.reddit.com/r/opiates/comments/4oc06n/redosing_question/,1,https://redd.it/4oc06n,thebluebuddha420,Redosing Question,"So yesterday was my first time using opiates in quite a while. I took about 25mg hydrocodone and felt pretty good. I wanted to take more tonight so I started with 35mg about 2 hours ago. I'm feeling good, but I wanted to get really high on opiates tonight as I use them very infrequently. I just took 22.5mg about 5 minutes ago. I was curious if you all think this is enough to get where I want (very high) or if I should quickly take more?(I heard redosing isn't very effective)
By the way, I used CWE for all doses tonight",1466058908.0
4obypu,https://www.reddit.com/r/opiates/comments/4obypu/one_uppin_all_yall/,12,https://redd.it/4obypu,Krewtan,One uppin all yall,"Closeup of my pussy. Be nice, it hasn't been shaved for a while.

Http://imgur.com/Qq9D1DK",1466058047.0
4obw8m,https://www.reddit.com/r/opiates/comments/4obw8m/dboy_moving_on_with_me/,11,https://redd.it/4obw8m,Pmaczilla,DBoy moving on with me?,"Long time lurker, first post, so if I break any rules, I promise it's not intentional 
So, title is self explanatory.  My current non user oom mates are moving out next week, nd my dboy is moving ing he spare room. 
On one hand, He's a solid guy and all, asks how my day is going, offered advice and shit with the recent passing of my brother. He's a few years older, makes good money ,so I know rent and bills will be prompt.Not to mention he hooks me up stupid fat and fronts me. 
On the other, he is a drug dealer. And I'm afraid if move him in, it'll effectively be sealing my fate, so to speak.
Can anyone weigh in on this, or offer some advice,  or share similar experiences?",1466056740.0
4obte4,https://www.reddit.com/r/opiates/comments/4obte4/the_story_of_witty_draws_behind_the_addiction/,10,https://redd.it/4obte4,Wittydraws,The Story of Witty Draws: Behind the Addiction,"It was a clear black night, a clear white moon  
Witty Draws was on the streets, trying to consume  
some H for the eve, so I won't be sick  
just walking down the street, chillin all alone  
  
Just hit the Eastside of the *NYC*  
on a mission trying to find some good Opie's  
Seen a corner full of thugs ain't no need to think  
all you addicts know what's up with 212  
  
So I hooks a left at Two One and fifth,  
some brothas shootin up so I said ""Let's do this.""  
I pulled out the gear, and said ""What's up?""  
the brothas had no rigs so I said ""I'm fucked.""  
  
Since these brothas out of needles I'm gonna bleach the tip,        
these niggas noddin hard they straight bent that shit,    
Won'tcha think of better things than being sick,  
I see my homey right before I sniff my shit,  
  
I'm gettin jacked, I'm breakin my vein,  
I can't believe that Witty's not in pain,  
I pawned rings, I pawned my rolex,  
I looked at the homey and said ""Damn, what's next?""  
  
Since I got a 18 bags, I'm gonna need a couple points,  
ain't none of them seeing me if they go point for point,  
I gotta shoot up quick before I start to get sick,  
I best pull out my rig and do another point 6.  
  
I got the needle in my arm,  
I think I'm going down,  
I can't believe I'm overdosing now,  

If I had narcan I would be fine,  
let me contemplate,  
I glanced in the cut and I see my homey Kate  
  
Point 4 in the rig and 8 in in my soul,  
Kate Dog isn't about to let my body turn cold,  
now I'm droppin and blueing,  
it's almost a tad bit late,
Kate Dog saved Witty D with that Narcan shit,  
  
She laid that buster down, my ass is about to explode,  
now I'm switching back into sick mode,  
if you're an addict sit back and observe,  
I almost OD'd over there on the curb

Now Kate is the best,  
and that's a known fact,  
before I OD'd, I was on the same track,    
plunger up back up cause it's on,  
Tan E C P and me,  
the Witty to the D,  

Just like I thought,  
they were in the same spot,  
prescribing for my current needs,  
the Kate Dog and the D-child,  
were seriously in need,  
one of them bags was heavy as fuck,  
I said ""ooo I like your size.""  
  
  
Pills  
Powder  
It brings  
Happiness    
H-Funk  
where dope is life  
and life is dope  

If you know like I know  
you don't wanna FUCK with this  
It's the H-Funk era  
and I'm addicted like a BITCH  
  
if you thought like I thought  
then you know you headed this way  
and if you think that you're not    
WittyDraws and others will still speculate    ",1466055220.0
4obt5c,https://www.reddit.com/r/opiates/comments/4obt5c/heroin_hangover/,6,https://redd.it/4obt5c,hhheron,Heroin hangover,"Tried H first time last night. Opiate naive. I am naseuaus, it's been 10hrs single ingestion. I snorted around 50mg split into couple of lines.
I threw up a few times already, have a major headache and feel generally fucked up.

What can I do to make this better? Especially the throwing up part, I want to eat!

Thanks",1466055101.0
4obqyg,https://www.reddit.com/r/opiates/comments/4obqyg/best_part_about_wd/,3,https://redd.it/4obqyg,thrawaway6969420,Best part about wd,Sneezing haha,1466053946.0
4obpo9,https://www.reddit.com/r/opiates/comments/4obpo9/suboxone_experiences_cocaine_psychosis/,5,https://redd.it/4obpo9,xanax_pineapple,Suboxone experiences? Cocaine psychosis,"I started on subs. Great. Very little craving for h. Cool. But coke. God. Can't do coke. Without h it makes me in fucking sane. 

So, anyone have experience with starting subs then having trouble with crack? Just feel alone and hopeless can't talk to my sober friends (don't wanna trigger) and I only
Use alone so no junkie friends irl. ",1466053260.0
4obl6u,http://thepeoplespostmodernist.blogspot.com/2016/06/kicking-and-just-right-amount-of.html?m=1,2,https://redd.it/4obl6u,Peoplespostmodernist,Kicking,,1466051084.0
4obl1i,https://www.reddit.com/r/opiates/comments/4obl1i/i_have_5_10_mg_methadone_pills/,7,https://redd.it/4obl1i,chase17,I have 5 10 mg methadone pills..,I'm use to taking 90 mg of oxys how many of these should I take to b ok? And are they snortable?,1466051009.0
4obkny,https://www.reddit.com/r/opiates/comments/4obkny/probation/,3,https://redd.it/4obkny,shitbagshawty,probation,"so the inevitable happened and i have to piss in a cup once a week. but of course you know i still want to use opiates so i'm thinking of choosing between
    u47700, fentanyl, or one of the fentanyl analogs(isn't the justice system just great)
Am i wrong for thinking these don't show up on tests(it's a 5 panel test)? do i have any other options? what would you guys suggest? My experience with opioids is just the classics like heron and oxy so also if anybody could help direct me to a volumetric dosing guide it would be cool. thanks guys  ",1466050826.0
4ob9uo,https://www.reddit.com/r/opiates/comments/4ob9uo/im_sick/,1,https://redd.it/4ob9uo,dopiedude,I'm sick,"Except I have an actual cold.

Can't ever win lol",1466046172.0
4ob8mo,https://www.reddit.com/r/opiates/comments/4ob8mo/tinychat_homies/,4,https://redd.it/4ob8mo,Philly19111,Tinychat homies.,"http://tinychat.com/ropiatesubchat

Hit it up friends",1466045663.0
4ob6br,https://www.reddit.com/r/opiates/comments/4ob6br/is_anyone_else_here_waiting_until_they_can_piss/,22,https://redd.it/4ob6br,UnicornMilk710,Is anyone else here waiting until they can piss to redose more opiates?,"Because that's exactly what I'm doing. I have a chunk left I would like to smoke the rest of, but I've been drinking water all day and cannot empty my bladder as is. I know if I smoke this it would just prolong my inability to piss even more.

Seriously though, shit like this (and compulsive scratching, financials and WD) are some of the main reasons I've never bothered to start doing opiates every day. They can be such a bitch some times!",1466044700.0
4ob626,https://www.reddit.com/r/opiates/comments/4ob626/fuck_im_so_lonely/,4,https://redd.it/4ob626,inthea215,Fuck im so lonely,"I've been staying clean I quit dope 6 months ago and have been totally clean for about 2-3. Im still so depressed and im so alone. Idk what to do. I miss college. I realize I was also so co dependant. Heroin was the only thing that made me okay with being alone. I remember in college I had a thing going of always having at least 3 fwb always going at a time. That way I could always have someone to just sleep with every weekend but not get too attached or show them how crazy I was. Whenever I tried to have just one girl I became obsessed with them to the point they needed space. 

I had an amazing relationship with a girl so far out of my league while I was on pills and she was happy and I was high all the time and in love. But after 4 months I confess I was an addict then only to Oxy so it was easy to hide. She helped me get clean thinking it would be good for us. After that she became my drug. Sex became my drug and so I tried to use her to fill a hole inside me that drugs have filled. I know I need to work on my issues but im losing it. I NEED to find some girl and fuck. 

Since quiting dope I feel like a 15 year old it driving me wild. Idk how to handle this sex drive. While high I could get laid so easy. 1 I was in college and it's easy and 2 I didn't care about sex so I was cool and confident. I would talk to girls to just talk and end up finding them hitting on me and me playing it off pushing them away made them want me more in a way. 

Now that I'm going around the bar trying to fuck anytging I fail terribly and its ruining my confidence and just makes me want to numb my feels and go back to drug where I didn't care about sex or how I looked or cared about anything but getting high. 

Idk what im looking for maybe just people that can relate and have been there before. Im sorry for this shit post and im sorry if I come off like a shity person. I think I am a pretty shity person sober. I feel like I was much more caring and compassionate using drugs now I tell myself im clean so I think im better when I go around being selfish as fuck. 

Ugghg I just want to feel normal again.",1466044601.0
