bckzoo,https://www.reddit.com/r/opiates/comments/bckzoo/stadol_vs_tramadol_vs_norco/,3,https://redd.it/bckzoo,Megandapanda,Stadol vs Tramadol vs Norco,"Hey y'all, I'm looking to gain some insight here.

My boyfriend had a severe headache this morning and they gave him a 2mg shot of Stadol. It knocked his ass right on out. He has taken both Tramadol and Norco in the past...what's the strength differences in these three medicines? He said that it didn't help his pain, but that it made him sleepy and relaxed ""like a Xanax, almost"" (he occasionally takes Xanax for panic attacks.)

I've been trying to Google it, but not finding really any helpful results...",1555115930.0
bckz6x,https://i.redd.it/xlqcd7wagxr21.jpg,7,https://redd.it/bckz6x,Solidifieddd,On r/lean 😂😂😂😂,,1555115841.0
bcjolo,https://www.reddit.com/r/opiates/comments/bcjolo/imagine_finally_finding_someone_you_wanna_get/,8,https://redd.it/bcjolo,DamselWithTheDrugs,"‪Imagine finally finding someone you wanna get high with forever, only to find out they only like uppers.😭",,1555107887.0
bcj0ds,https://www.reddit.com/r/opiates/comments/bcj0ds/whats_the_longest_time_youve_nodded_without/,7,https://redd.it/bcj0ds,MeMeLoRDexe,Whats the longest time you've nodded without knowing?,,1555104125.0
bckxu5,https://i.redd.it/qdxop8gjfxr21.jpg,2,https://redd.it/bckxu5,NeedForPositivity,Tar,,1555115589.0
bckvs1,https://www.reddit.com/r/opiates/comments/bckvs1/my_dboy_just_got_arrested/,10,https://redd.it/bckvs1,funnybunny211,My Dboy just got arrested.,Possession of a controlled substance and intent to distribute. Probably had a solid 10-15 buns. How much time is he looking at?,1555115205.0
bchbpq,https://www.reddit.com/r/opiates/comments/bchbpq/anyone_ever_get_a_sweet_taste_from_snorting_a/,11,https://redd.it/bchbpq,prometheus34,Anyone ever get a “sweet” taste from snorting a blue 30mg? It’s usually bitter so I’m curious if these are potentially pressed,,1555095211.0
bcekud,https://www.reddit.com/r/opiates/comments/bcekud/what_is_the_strangest_or_off_the_wall_item_your_d/,24,https://redd.it/bcekud,BenJaquenhoft,What is the strangest or off the wall item your d boy has taken for trade?,,1555081390.0
bckrdk,https://www.reddit.com/r/opiates/comments/bckrdk/advice_on_shooting_up/,5,https://redd.it/bckrdk,brians1012,Advice on shooting up,Is it against the rules for me to ask for a step by step guide on shooting? I FINALLY just aquired an insulin syringe. It says BD U-100. I am getting such good dope that's off white chunk and I am wasting it all as I am not feeling shit anymore from sniffing.. can someone help me out here,1555114420.0
bckn7a,https://i.redd.it/zebjpnt0axr21.jpg,1,https://redd.it/bckn7a,PercSet,Quite,,1555113730.0
bcklfv,https://i.redd.it/i8i6b0429xr21.jpg,3,https://redd.it/bcklfv,blueberry-muffinz,Glad I was able to get the last of the Ks today 🔌 ‘D in ! Hope you all are having a fantastic Friday Bropiates ! 🔥,,1555113406.0
bcklas,https://www.reddit.com/r/opiates/comments/bcklas/cant_pee/,15,https://redd.it/bcklas,CoolInformation,Can’t pee,"I hate that when I take opioids it becomes so difficult to pee! Any tips on hw to make it easier?

Edit: Should have mentioned I’m female. Some of the suggestions would be very difficult due to my plumbing. 😂",1555113380.0
bckjku,https://www.reddit.com/r/opiates/comments/bckjku/can_you_od_from_40mg_of_percocet_at_once/,5,https://redd.it/bckjku,Joker12347,Can you od from 40mg of Percocet at once,I just took 4  10/325 pills and I usually can handle that in a day but recently just took a few days off and I can tell it was too much. Should I be worried or just drink some water and relax?,1555113059.0
bckigf,https://i.redd.it/edqi41me7xr21.jpg,4,https://redd.it/bckigf,fentfiends,21 savage,,1555112857.0
bckifp,https://i.redd.it/xmshlixe7xr21.jpg,17,https://redd.it/bckifp,alnbkr,Moving out of my grandparents house finally and found the tooter I made for the drugs I snorted over here. Finally glad to say I am sober and not disappointing everyone in my life. You can get sober if you want to stay safe <3,,1555112854.0
bckhf3,https://imgur.com/29GrwIr,20,https://redd.it/bckhf3,christoppa,"My truck got stolen last night, but hey at least it's payday",,1555112670.0
bckfk1,https://i.redd.it/a039pplu5xr21.jpg,2,https://redd.it/bckfk1,pres10alk,FINALLLYYYY,,1555112327.0
bckdtf,https://www.reddit.com/r/opiates/comments/bckdtf/what_can_i_dohelp_missed_shot_help/,1,https://redd.it/bckdtf,opismoke,What can I do...help! missed shot! Help!,"What’s up ppl so I missed a shot smh it was my last bit of coke and I missed the fucking shot!! Ah man pissed. Anyways I missed and it’s like a bulge that formed where I missed. I seen blood come in the syringe how did it miss I seen blood come in like everytime I don’t miss and it fucking didn’t go in? Why ?? Anyway what can I do so it doesn’t get worse the area of the shot? Do you think I would have to go to the doctors? It’s coke and heroin. I feel the bump and if I stretch my arm all the way out I feel slight pain  or if I like bend my arm inward it hurts where I missed like pressure is there. What can I do so it doesn’t get worse? Any help is appreciated. I have cream from the doctor from a while ago and I put it on just trying to help it out. Thanks in advance.  Y’all be easy 

Btw the spot I always use easy to get to the vein i feel the vein but it doesn’t hit anymore... did I use that vein out? Or what happening if someone can explain. It’s my first time this happens that’s why im asking. Thanks!",1555112022.0
bckdnb,https://i.redd.it/hxu0gpzu4xr21.jpg,0,https://redd.it/bckdnb,morganevans73,What I find in the public bathrooms lol smh,,1555111993.0
bckbef,https://i.redd.it/vmg3zl9p3xr21.jpg,1,https://redd.it/bckbef,EricG2354,I can taste the devils brown blood ! It runs through my veins !,,1555111605.0
bckayn,https://i.redd.it/8yt1qebh3xr21.jpg,4,https://redd.it/bckayn,Kieolian,"Can anyone tell me what these little black bits might be, they are dispersed through the rock. Thanks from an H noob",,1555111531.0
bckap0,https://i.redd.it/r5qtlp8c3xr21.jpg,12,https://redd.it/bckap0,Au79ine,Ima pop these percs 4-U even tho u don’t rly want me to !,,1555111489.0
bcka8k,https://i.redd.it/pwxb6t443xr21.jpg,1,https://redd.it/bcka8k,Au79ine,:),,1555111406.0
bck6e4,https://www.reddit.com/r/opiates/comments/bck6e4/new_law_in_effect_ny/,3,https://redd.it/bck6e4,Ughinfinity,New law in effect? (NY),"Is there some new law that is effecting the amount a person can get per month, if at all? I've heard this from one person but cannot seem to find any reputable news source on it.",1555110763.0
bck4o2,https://www.reddit.com/r/opiates/comments/bck4o2/took_some_morphine_ive_got_a_pretty_low_tolerance/,2,https://redd.it/bck4o2,ShitTalkinAlt,Took some morphine (I’ve got a pretty low tolerance) and I’m feelin good! Thank you guys!,"Just wanted to thank all the posters in this sub for giving out tips and tricks and stuff to keep all the newer people safe. 

I’m fairly low on the tolerance scale. 5-10mg of oxy or norco every 3-5 days or whatever keeps me sane. Yeah I probably need therapy for my issues but this is cheaper haha. Got my hands on some morphine pills and I’m feeling good man. Just wanted tell you guys happy Friday and happy nods. Thanks for keeping everyone informed. ❤️",1555110482.0
bck4nr,https://i.redd.it/ai7jvw6d0xr21.jpg,13,https://redd.it/bck4nr,Au79ine,It really be like that,,1555110481.0
bck1xj,https://i.redd.it/bnrjh2v0zwr21.jpg,6,https://redd.it/bck1xj,Jangles710,"Love when they dboy sends his girl with your nightly meds, and 2 freebies, 2 gs raw d, 4 gs fent mix, 1.2 soft, .7 nug for free cause he says u always gotta smoke to stay centered<3",,1555110040.0
bck1xi,https://youtu.be/O7oRENsWKeU,1,https://redd.it/bck1xi,owwstin,Are there Buprenorphine side effects?,,1555110040.0
bck1g7,https://www.reddit.com/r/opiates/comments/bck1g7/are_there_such_thing_as_pressed_oxy_10s/,3,https://redd.it/bck1g7,spoonfedchemicals,are there such thing as pressed oxy 10s?,"i picked up an oxy RP 10 325 and there was a lot of markings on edges of the pill and it just looks a little beat up i could just be paranoid cause it looks pretty legit at same time. i was just curious if there was any pressed RPs or if there is even such thing as fent pressed 10s.

thank you",1555109965.0
bck1bl,https://i.redd.it/5o7avllrywr21.jpg,5,https://redd.it/bck1bl,grimmykickz,the perfect mix of down for ritalin crash ☺️🥴,,1555109945.0
bcjzqx,https://i.redd.it/kohq03hzxwr21.jpg,7,https://redd.it/bcjzqx,ghstgrl93,Today’s cop x60☺️ Happy Friday🙌,,1555109681.0
bcjvpd,http://imgur.com/a/JaCjHPh,0,https://redd.it/bcjvpd,Key_Grand,this is our truth,,1555109014.0
bcjv7r,https://www.reddit.com/r/opiates/comments/bcjv7r/7_days_clean_followed_by/,5,https://redd.it/bcjv7r,irdeoliv,7 days clean followed by...,"So I was clean for 7 days followed by two days of a couple blues. 

Do you think I will go thru WDs again? 

What is the best practice when it comes to using recreationally and avoiding WDs?",1555108936.0
bcjuog,https://www.reddit.com/r/opiates/comments/bcjuog/staying_clean/,7,https://redd.it/bcjuog,CARLOUD,Staying Clean,"So I've been clean 100% from fentanyl since Monday. Had some subs but they didn't seem to touch the sickness. I still feel off, but I feel about 100x better than I did on day one. I just got paid today and the temptation is strong. I wasn't broke before, and I purposely went through withdrawal, but for some reason having even more money makes me want to go get high. 

Now that I think about it, I got off the shit to save money. I just have to keep that in mind. Ironically, I think that I may have to spend some money on myself today to keep myself aware of the perks of not doing dope. 

What do you guys who have successfully gotten off opioids do when you feel like getting high?",1555108848.0
bcjoxi,https://i.redd.it/z28op1bsswr21.jpg,6,https://redd.it/bcjoxi,perpetuallynodding,Payday pick up.,,1555107936.0
bcjon8,https://imgur.com/a/CJbF1ob,2,https://redd.it/bcjon8,dvdzkk,Uncut raw 🔥,,1555107894.0
bcjnzr,https://i.redd.it/8z7xfoadswr21.jpg,4,https://redd.it/bcjnzr,justdoit901,New to the sub #alwaysstartsmall,,1555107793.0
bcjmvs,https://i.redd.it/w2cybzrtrwr21.jpg,0,https://redd.it/bcjmvs,lilbearandyoungtwink,Yeah boi,,1555107609.0
bcjelk,https://i.redd.it/nic8dh90owr21.jpg,10,https://redd.it/bcjelk,rampanting,What is this? I was told it was oxy... don’t think so. I looked on pill identifiers websites and found nothing.,,1555106327.0
bcj4q7,https://www.reddit.com/r/opiates/comments/bcj4q7/my_god_i_fuckin_love_gear_hows_your_day/,14,https://redd.it/bcj4q7,Locovist,My God I fuckin love gear. Hows your day,"Yknow when you're 3 days onsto wds because you went oh away for a few days and was too chicken shit take a load turoughtbcusofls. Tue worst part was all because plè3²³³4 becaikaebwbn 
Ñññfio. Fair play to Tue lad. Now vwgŕ I amoskmkkŕŕř. Anyways I loaded up th my pin with pim and got the lovely lovely rush and everythin, good ol Velvet Underground plating In the background, demand èberttŕr


But yeah I have no idea why I made this post I. Gues I had to just let it out, so if you're still reading i thanks I guess you a G, and I'm just some moron chatting shit that has nothing better to do so yeah om actually gonna shut up idk . How has your day or week been",1555104786.0
bcj275,https://www.reddit.com/r/opiates/comments/bcj275/clonidine/,12,https://redd.it/bcj275,Mimikoxy,Clonidine,"Will this help with WD symptoms? I'm fucking miserable and I'll only be able to snag 4 15mg oxys tomorrow bc I refuse to spend anymore fucking money until I get my script on the 25th, I've been trying to keep my insanely old script (like 2014 old... found em in an old purse thank goodness I cried real tears when I happened upon them) of hyrdos going with only taking 10mg a day but now I have 3 left (they are 5s fuck..) so I took one 5 mg and that's a fucking joke. I've been a walking zombie this whole fucking week and took yesterday and today off sick af from my new job so I prob won't have that much longer and I cannot afford to not work bc I make seriously good money and I've found myself more broke than when I worked a shit job. Fucking addiction fucking sucks. 


Anyway.    My friend's mom gave me some Clonidine saying it would ease wd symptoms. I took one and I'm waiting to see but I also figured I'd ask if anyone here has had any luck with them?!?!?!!",1555104399.0
bcj04d,https://i.redd.it/gh1xzd8chwr21.jpg,0,https://redd.it/bcj04d,askmeaboutOLASJC,Fent?,,1555104083.0
bciyfj,https://youtu.be/ErDviAtNHIE,3,https://redd.it/bciyfj,leavemealoneplssir,"Have any of you watched 6 feet under? Even if you havent, the detox scenes from this ep are so funny",,1555103822.0
bciy3g,https://i.redd.it/8klrn82fgwr21.jpg,31,https://redd.it/bciy3g,vibrantax,Anybody wanna chat?,,1555103772.0
bcixua,https://i.redd.it/opxr8ijagwr21.jpg,10,https://redd.it/bcixua,Dilly-dallier,breakfast of champions !! 🐶😂,,1555103734.0
bciukz,https://www.reddit.com/r/opiates/comments/bciukz/here_we_go/,26,https://redd.it/bciukz,SereneLloydBraun,Here We Go...,"I love heroin. I love drugs in general. But I’m sick of being broke and I feel like I’m missing out on a lot of things. Last night, I came clean to my folks about my addiction. I’m moving in with them for a few months to try and get clean. I have five days of subs to get me through some of the initial part. This is going to suck. But I make good money at a great job. There’s no reason I should be this broke all the time. I have a four year old son that I need to be there for. Just wanted to post this because, well, I don’t know. Maybe I’ll fail. But I’m going to try. Telling my folks and asking for help has been the hardest thing I’ve ever had to do. I feel so ashamed and embarrassed. I’m 30 fucking years old, still needing to be helped. But I don’t know what else to do. Sorry, Reddit. This is a pointless post. Anyway, love you guys!",1555103234.0
bciten,https://i.redd.it/9od8eyfaewr21.jpg,5,https://redd.it/bciten,Itsxxxxxxtc,my lil pharmacy:),,1555103058.0
bcis62,https://i.redd.it/1pa7onzpdwr21.jpg,4,https://redd.it/bcis62,503finest-opiates,You can see myself in the reflection of the tar😎,,1555102870.0
bciomm,https://www.reddit.com/r/opiates/comments/bciomm/love_this_sub/,2,https://redd.it/bciomm,Reddi5or,Love this Sub,"Oh, you guys thought I was talking about you? Lolno. I mean I love this sub I have in my hand right now.",1555102341.0
bcik2o,https://www.reddit.com/r/opiates/comments/bcik2o/at_home_drug_test/,13,https://redd.it/bcik2o,igottheblues1,at home drug test,are there any 10 panel at home drug tests to take prior to having a real drug test for a job?,1555101663.0
bcij19,https://www.reddit.com/r/opiates/comments/bcij19/im_a_fucking_dumbass/,4,https://redd.it/bcij19,Bobandgene27,Im a fucking dumbass,So I finally got my pack after I few days of feeling like shit. My dumbass spilt like a quarter to a half gram in my car I cant get back :(  I want to fucking slam my head on the wall.,1555101507.0
bcicat,https://i.redd.it/7dtuyf6p6wr21.jpg,7,https://redd.it/bcicat,OutThereDoingPushUps,Set for the next week.,,1555100505.0
bci6lb,https://i.redd.it/0o19pxs44wr21.jpg,13,https://redd.it/bci6lb,06audis4,One of my last picks up starting monday im really gonna try n get clean finally,,1555099672.0
bci60i,https://i.redd.it/marwdfny3wr21.jpg,9,https://redd.it/bci60i,opismoke,"What y’all think about this? I took the shot and it got all red,hives, numb and hurt when I bent my arm you think I’ll be fine? Did I miss slightly? Because it was big shot and felt it heavy phew... lmk thanks in advance!",,1555099589.0
bci06h,https://www.reddit.com/r/opiates/comments/bci06h/anyone_else_ever_dreamed_of_pills_and_found_them/,8,https://redd.it/bci06h,Johndough1066,Anyone else ever dreamed of pills and found them?,"This is weird.  This has happened a few times.  I have been totally out of pills and dreamed of finding them in certain places. 

And then I looked. 

And found pills. Just a few, but I will take what I can get

Now I am not organized. So I assume my unconscious mind somehow remembers I dropped pills in that drawer or left some in my wallet or whatever when my conscious mind totally forgot. I mean I literally had no idea and was just dealing with my oxy-less reality and then -- bam. It comes in a dream.

And these are different dreams from those where you're about to get high. These are really specific and have specific places. 

Has this ever happened to anyone else?",1555098750.0
bchx5g,https://www.reddit.com/r/opiates/comments/bchx5g/mixing_kratom_and_phenibut/,6,https://redd.it/bchx5g,parad0x0r,Mixing Kratom and Phenibut,"Hello all, 

I purchased phenibut for anxiety because im so tired of it! I take 2 teaspoons of kratom every two hours. However I want to try the phenibut tonight because I have anxiety bad from little sleep last night. I only plan on taking like 200mg, however I also vape and it's salt nic, I know it sounds silly but since the nicotine is an upper and the phenibut is a downer, along with the kratom. If I dose only once 200mg of the phenibut, how unsafe is this?",1555098307.0
bchtoe,https://www.reddit.com/r/opiates/comments/bchtoe/navigating_the_edges_of_addiction_3_yrs_of/,1,https://redd.it/bchtoe,mystic_district,Navigating the edges of addiction - 3 yrs of weekend mdone use - withdrawals?,"Folks I have been using methadone about 2 to 3 times a week on weekends (Fri, Sat and Sun). About 5 to 10mg each time I dose. I have been under this weekend recreational routine for about 3 years now. 

At first I felt like I wasn’t physically dependent on it but now I’m not so sure. I feel light withdrawal symptoms during the week with the worst of it on Thursdays. But I still continue to take a dose on Friday and continue through the weekend. I use it over the weekends to stay productive and get a lot of shit done. Also I have a very active life style and play sports, do yoga etc. 

Problem is that I know deep inside that I have a light physical dependence and definitely a mental dependence but based on the withdrawal symptoms I get during the week it feels like I can manage to quit without too much nasty side effects when I decide to do it.

My questions below and I would love to get your advice and experience:

Assuming I can continue the discipline of limiting my use only to Fri-Sun and don’t increase the dose will my withdrawal symptoms get worse overtime and therefore harder to stop later on or would they stay the same?

I also worry that I may have skipped the worst of withdrawals as I take a break from Mondays to Thursdays. I take my last dose on Sunday morning and next does Friday noon / afternoon. Could it be that I have never felt the worst of the withdrawals yet?

Curious to see if there are others using methadone recreationally over weekends for a long time and if they have been able to continue the discipline? What doses and what are your experiences?

Thanks",1555097799.0
bchtan,https://www.reddit.com/r/opiates/comments/bchtan/whats_the_difference_between_codeine_and/,2,https://redd.it/bchtan,stubrador,Whats the difference between codeine and dihydrocodeine?,"I've been taking 30/500mg cocodamol for a few years, a bit more often over the last 12 months or so, and never had a problem.

However, I now have 30/500mg remedeine (dihydrocodeine tartrate and paracetamol) and it doesn't seem to agree with me at all.

When I've tried to search online about the differences I've only found that dihydrocodeine is semi-synthetic and is more potent than codeine?

I've been really struggling with low mood and anxiety since having dihydrocodeine instead of codeine (it's only been 2 days!) and I'm not sure if it's because of the dihydrocodeine or other factors.

If anyone has any advice or knowledge at all I would really appreciate it as it's really bothering me.

Thanks a lot.",1555097737.0
bcht12,https://www.reddit.com/r/opiates/comments/bcht12/okay_so_dope_is_fire_obviously/,16,https://redd.it/bcht12,TizzleDirt,Okay so dope is fire obviously,"Now which 3 other drugs could represent the 4 elements from the Avatar the last Airbender universe best?


I was thinking maybe liquor for water.

Crack seems easiest for rock too.

Air though. What's air?

Other combos are welcome too and let's not forget the Avatars energy bending.",1555097701.0
bchjs5,https://www.reddit.com/r/opiates/comments/bchjs5/thoughts_on_switching_from_one_thing_to_another/,16,https://redd.it/bchjs5,erischilde,"Thoughts on switching from one thing to another, then tapering?","Hey, I've just found this sub. I feel like I'm posting a lot, it's just something else to be able to to talk openly with folks who *get* it.

My buddy has been on suboxone for over a year and a half, maybe even two. He's up at about 18mg. He's always hated the side effects, struggles with appointments and working and feeling like shit.

He's about as ""sober"" as he's going to be. He'll skip a day and use, here or there. Kind of knows what he can get away with. He's not really feeling that it cuts his 'wanting' and he puts it off so it's a couple times a year.

He's scared shitless of the wd. He's tired of it, done it before. Fast. Slow. It all sucks and he's so, so tired of it.

He's sometimes, with mixed results, switching to a short active opiate and then quitting that. Kind if lowering the half life, and then being able to control that taper easier. Either another opiate, or like benzos. 

Is that crazy? Or is tapering off the subox better? He can't trust his doctor anymore, it's a new one. Has seen ""medically assisted detox"" in places, does that mean they'll use medication or just lock you in and force you into meetings while you're in the shit?

Just wanna bounce ideas. Got nobody else. Thanks.",1555096346.0
bchg20,https://i.redd.it/k6p7mr0rsvr21.jpg,2,https://redd.it/bchg20,cokedoutboohbah,junkie shoot up 101,,1555095816.0
bch85g,https://www.reddit.com/r/opiates/comments/bch85g/if_anyone_is_struggling_with_opioid_addiction_or/,8,https://redd.it/bch85g,atwoodfoundation,"If anyone is struggling with opioid addiction or knows anyone that is struggling, a Virginia non-profit offers to ship you a Narcan/ Naloxone opioid overdose reversal kit for FREE. NO QUESTIONS ASKED. SAVE A LIFE! (VA only)","In 2016, there were 1,130 opioid-related overdose deaths­­ in Virginia—a rate of 13.5 deaths per 100,000 persons.

We offer FREE OPIOID overdose reversal medication/ supplies/ training. There is no stigma. It will be mailed to you for FREE. We are willing to ship the supplies to anywhere in VIRGINIA. Please, pass this message along to anyone you know that may be struggling or anyone that knows someone that may be struggling with opioid addiction. Save a life. Thanks! We have over 268 reported reversals so far with the Narcan/ naloxone that we have supplied. 

&#x200B;

Just fill out the short confidential form below:

&#x200B;

[https://docs.google.com/forms/d/e/1FAIpQLSeeTshqBpUOhd4EEivs783QsEtLfMMulc5BGdkAtsBcgiurQA/viewform](https://docs.google.com/forms/d/e/1FAIpQLSeeTshqBpUOhd4EEivs783QsEtLfMMulc5BGdkAtsBcgiurQA/viewform)",1555094711.0
bch2jw,https://imgur.com/fY4tTb0,13,https://redd.it/bch2jw,kittenbutt5,Yum! 🐼,,1555093974.0
bch1d0,https://i.redd.it/88varm0tmvr21.jpg,32,https://redd.it/bch1d0,slick718,This might be a sign to start my acting career?,,1555093814.0
bcgzmp,https://i.redd.it/kkk30ge4mvr21.jpg,2,https://redd.it/bcgzmp,bellatrix1976,Happy Friday Everyone,,1555093586.0
bcgwk2,https://www.reddit.com/r/opiates/comments/bcgwk2/hair_test_at_pain_doc/,3,https://redd.it/bcgwk2,ipudrugs,Hair test at pain doc,"Have any of you or do you know anyone who has been hair tested at their pain clinic? Or blood tested? It seems like all they do is urine testing, anybody have any anecdotal stories of otherwise?",1555093178.0
bcgvuo,https://www.reddit.com/r/opiates/comments/bcgvuo/know_it_all/,3,https://redd.it/bcgvuo,back_to_basicx,Know it all,Is it just me or does anyone else get annoyed by these assumptions and “knowledge” of where someone’s dope is just by looking at a picture and guessing by consistency if it’s from the onions or what ever fucking coast.,1555093091.0
bcglan,https://i.redd.it/mxv1saidgvr21.jpg,68,https://redd.it/bcglan,CarefulLawyer14,A whole mood,,1555091651.0
bcgjcp,https://www.reddit.com/r/opiates/comments/bcgjcp/thought_i_had_it_on_lock_with_whisper/,12,https://redd.it/bcgjcp,bbslidedown,Thought I had it on lock with whisper,"After wading through gift card scams I stumbled upon an offer that seemed legit. Got a number and a picture and everything...We were going to meet tomorrow but it just seems waaaay too good to be true man. I'd prefer not to get arrested tomorrow or robbed so I guess I'll be hitting the streets and hanging around methadone clinics or whatever. This shit suck when you literally don't know anyone lol 
/rant",1555091371.0
