bdbsp1,https://www.reddit.com/r/opiates/comments/bdbsp1/e8_brand_blues/,1,https://redd.it/bdbsp1,Oxybrodone1337,E8 Brand Blues,"Long term blues user,

My plug has M Box 9/10 times, and that other 1/10 times will be split with A215, A51, K9, ALG, or Vs. But still have never seen an E8. 

How are they? Anything unique to them? Powder amount? Taste? Are they rare? 

I ask because lately I’ve been seeing people in the comments section of blues posts saying E8s are their favorites. 

Thanks for any info",1555301322.0
bdbs30,https://www.reddit.com/r/opiates/comments/bdbs30/hoping_for_tipsadvice_on_beating_the_worst_ever/,0,https://redd.it/bdbs30,TrunkWeed,"Hoping for tips/advice on beating the WORST EVER W/Ds ever experienced - from unknown, modern fent/carfent/other etc. ""scramble"" long-term use","Hi  everyone, i'm new here and tried posting this but it was deleted; however, I believe i fixed up the possible reasons why it was deleted. So here goes....  


I have  struggled on and off with opiates/addiction for about 8 years. Previous ""heroin phases"" for me have lasted months and, at most, up to about a year of heavy daily use. I've successfully gotten clean in the past; however, this time, with this certain, peculiar ""dope"" has proven to be absolutely so much more insanely painful and difficult to w/d from than EVER before - and I had previously gotten through the sickness, following a 10 month phase of literally the purest, strongest raw i'd ever discovered, simply with 5-7 days of methadone...... so, i need your help gang.   


for the last  year now,  i've been exposed to the bodymore, murderland ""caps"", which are clear little gelatin capsules of ""scramble"" (known to east-coasters, particularly those familiar with edgar allen poe)  that are the standard ""6ixes"" in the land of black and orange, as well as black and purple, athletic birds. So, after getting familiar with these caps, and many of them, increasingly, daily for about a year now; about 4 months ago, I tried to quit by going on a  methadone program, which, as said above, has very successfully helped me to clean myself of real dope in the past. My urine returned some funny results....

&#x200B;

After my  intake, the drug test came up positive for: methadone,  suboxone, barbituates, benzos, and ""other opiates"", which I was told at  the clinic is usually the results they see here - with ""other  opiates"" being stuff like fent, carfent, other analogues what have you. I was perplexed as to why, only playing with these newly familiar caps, and some xanax here and there, why there's methadone and  suboxone, barbs, and the ""other"" in my system.... I guess that's just 'scramble'.

&#x200B;

So,  I tried to break up with the scram kaps ..... **WORST WITHDRAWL I HAVE EVER  EXPERIENCED IN MY LIFE.** Even with 50-100mg of methadone, heavy-duty prescription (like 800mg) tylenol, muscle relaxers,  ***nothing*** made  this crazy sickness much better. it went on for like almost a week before  I, of course, and unfortunately, gave back in and decided to just keep getting curing with caps.

&#x200B;

For a while now, really my whole life, all I've wanted is to be **done**. And it's time that I do it for real.   
I've accumulated a decent arsenal for beating the sickness,  consisting of: some morphine 30s, some percs, tons of Kratom, Iodium,  clonodine, xanax, high strength tylenol, muscle relaxers, suboxone,  about 500mg of methadone (saved up from the clinic), you name it. Plus, of course, I have access to whatever else I might need - maybe you all could make some recommendations for me? idk.  I  truly, truly, truly, deeply, so badly want to beat it, more than anything.  


So, I guess, I'm here asking for your advice, your suggestions, your tips and techniques, any experience  getting off of fent/fent analogues, subs, whatever else is cocktailed in/any sort of similar types of ""dope"" that you've maybe dealt with before.  (would be great if anyone on here happens to be familiar, in any way or form, with any of this sort of new age, nasty, awful fucking shit.)

&#x200B;

Another side note, I thought recently that maybe I could experiment with some straight up raw to ween off of this stuff, as I've read some people on here have had  success with in the past. I discovered some pretttyyyyy nice stuff;  however, I could taste like basically the whole g and still feel sick without the caps. This is so fucked up, seriously.

&#x200B;

&#x200B;

So, yeah, I don't  know who else to turn to for this because it's such a weird, specific,  today's day in age issue that most traditional W/D methods don't even  apply to considering the insane strength, power, and hold that these new  synthetic opiate analogues can have over us. Any sort of advice or any tips, recommendations, or ideas, etc. of what has helped or worked for others in a similar or even somewhat similar situation, in any way possible, would be life-saving, seriously.  


&#x200B;

Thank you in advance for any help or insights you can bless me with whatsoever. I'll be forever grateful.  
Thanks for your time and your considerations.",1555301196.0
bdbqn9,https://i.redd.it/jqbqm5vmqcs21.jpg,0,https://redd.it/bdbqn9,navcocet,love when it’s that time of the month,,1555300920.0
bdbnxm,https://i.redd.it/76tlb692pcs21.jpg,4,https://redd.it/bdbnxm,DreamyLilac,A little humor I saw today,,1555300390.0
bdbmq6,https://i.redd.it/1m1gllxcocs21.jpg,1,https://redd.it/bdbmq6,uglymane24,"fuck it, throw it on the foil",,1555300154.0
bdbmn4,https://www.reddit.com/r/opiates/comments/bdbmn4/anybody_else_have_trouble_with_friends/,2,https://redd.it/bdbmn4,slick718,Anybody else have trouble with friends?,"It’s weird because throughout all my life I’ve chilled with many diff kinds of people, gang members all the way to nerds looking for where I exactly fit in, and I can be cool with anyone until a certain point but they won’t quite let me in. Even on reddit I get booted off or downvoted for something I said. And then I realized, I’m a junky. That is my niche and where I am at home. Not sure if u get it I’m stupid high.",1555300134.0
bdbjfg,https://www.reddit.com/r/opiates/comments/bdbjfg/fent_30s_peace_of_mind_question/,3,https://redd.it/bdbjfg,k1ngduck,Fent 30s peace of mind question,"Buying some 30s here in like 20 minutes , and there’s a well possibility they will be pressed. I bought 30 presseds from this guy and I was fine but albeit a while ago. I don’t do opiates everyday, as I tapered off that w Kratom but still like to have rec use with them. Anyways, if my body is used to taking around 15-20mg of pharma oxycodone and (still getting a high) but very easily tolerable, what are the chances of something disastrous happening if I just take say a half or even a quarter of one of these rn? I know no one could actually know , just looking for discussion about it I guess",1555299483.0
bdbf0u,https://i.redd.it/0krv5n8qjcs21.jpg,2,https://redd.it/bdbf0u,rikkomanny,Yes hunny now I can relax!,,1555298598.0
bdber1,https://www.reddit.com/r/opiates/comments/bdber1/10_mg_oxycodone_hydrochloride_question/,2,https://redd.it/bdber1,AshDub_86,10 MG Oxycodone Hydrochloride question,"I get the pink 10 mg IR oxy pills and was wondering if you can inject those safely since they don't contain Tylenol.  I know this question prob sounds like it would come from someone who is opiate naieve, but I am not.  Only naieve to injecting.  I have a pretty large tolerance.  Have been RXed opiates for the last 15 years.  Was RXed 75 mcg fent patches for a year, then Opana 40 mg we for a year, then 60mg morphine sulphate ER for about 6 months, and have been tapered down to these 10 mg IR oxy's and only 3 x a day.  When I was 12 years old I was prescribed liquid demerol.  So my tolerance is pretty up there, but I've never done H before.  Just curious if they can be injected and if it is worth it or a waste compared to just taking orally.
Thanks for any advice!",1555298550.0
bdbe5w,https://i.redd.it/hh8dawo9jcs21.jpg,2,https://redd.it/bdbe5w,JerseyStrong123,eBay is a funny place,,1555298441.0
bdbcwx,https://www.reddit.com/r/opiates/comments/bdbcwx/im_and_subscutaneous_hydromorphone/,4,https://redd.it/bdbcwx,DrOllebmaz,IM and subscutaneous Hydromorphone?,"Just wondering, how would IM or subcutaneous compare to IV or plugging? I had a very hard time finding info in it and would like to know what you guys think.",1555298212.0
bdbave,https://i.redd.it/6q3tcyighcs21.jpg,0,https://redd.it/bdbave,Hightopic666,yeah lets cook up 20 grams of pure Afghan powder lol,,1555297835.0
bdbajy,https://www.reddit.com/r/opiates/comments/bdbajy/how_long_after_taking_2_maybe_3_mg_max_of/,3,https://redd.it/bdbajy,onlonelyisland,"How long after taking 2, maybe 3 mg max of suboxone can I get high?",I have a fent pressed blue I want to do. I took the small piece of sub around 1pm today and was thinking of taking the blue and a half an rx bar around 12pm tomorrow.  Would 23 hrs be a long enough wait to feel it after the 2mg ish of sub?,1555297777.0
bdbaig,https://www.reddit.com/r/opiates/comments/bdbaig/starting_sobriety/,6,https://redd.it/bdbaig,poundurbutthole,Starting Sobriety,Does anyone have any useful tips on how to go about getting sober? I’ve been a struggling heroin addict for quite some time now and it’s destroying my life. I’ve only ever been able to go 24 hours without dope and then my resolve crumbles. And I’m absolutely terrified of withdrawals. As soon as I start getting dopesick I frantically search for H and it’s like I have no control over myself. I have no clue how to get through this. It’s destroying my relationships with all family and friends at this point and I’m tired of living this way. Any help and advice is greatly appreciated.,1555297770.0
bdb9yl,https://www.reddit.com/r/opiates/comments/bdb9yl/the_anticipation/,11,https://redd.it/bdb9yl,serotoninpenguin,The anticipation,"Its a sunday night, you just picked up some of that precious h and its been too long since your last fix. You rush home, grab a rig and start prepping. Your body is aching, runny nose, stomach cramps and you think to yourself, “but how can this shot make me feel better...?” You have everything ready to go... You begin to draw up that magical golden juice... Your hands are shaking and what seems to have been hours getting this shot prepped, turns out to only have been a few minutes. Reaching for your tourniquet, you tie your arm off and find that bouncy vein that is bulging from your skin... The needle enters your skin, you register and see the blood enter the rig.... “THIS IS IT!” you shout in your head. Pushing down the plunger and you can feel that whole body sensation slowly creeping up on you, re-registering before slamming the rest and you’re still golden. You pull the needle out and let out a sigh of pure bliss. There’s no better feeling than this. 🤤",1555297667.0
bdb4cp,https://www.reddit.com/r/opiates/comments/bdb4cp/question_about_hydrocodone_withdrawal/,10,https://redd.it/bdb4cp,daciana_lyall,Question about hydrocodone withdrawal,"I ran out of pills, and the plug fell through. He was supposed to get some DAYS ago, but it’s been radio silence since he told me he’d have something. Oh well. I’m in withdrawal right now. It’s been about 19 or 20 hours since my last dose. I’m on 350mg of soma and 300mg of gabapentin, so I’m not feeling too shabby but I know it’s only going to get worse. 

Honestly this addiction has ruined my fucking life. I only take 40mg a day (sometimes 30 and 20mg when I’m running low) but it’s still total shit. I really want to get off this shit before I’m stuck in this game forever. I guess my question is: how bad are the withdrawals going to be from 1 year of 40mg of hydro a day? I’m an emetophobe, basically meaning I’m deathly terrified of throwing up. That’s the main reason why I haven’t made it past day 2 of withdrawals. I can deal with all of the other withdrawal symptoms, but if I’m going to be vomiting from it then I have to find something to stave it off. 

So, can I get clean and get rid of this habit without having to throw up during WDs? I’m really worried about day 3, as it’s highly regarded as the worst day of opioid withdrawals. If I can make it there without having any episodes of emesis, then I might actually be able to live a clean life. I guess I don’t really have a choice in getting clean, considering how dry everything is in my area. 

P.S. I know I seem insane, but when you have a phobia this type of insanity seems justified.",1555296673.0
bdb0cj,https://i.redd.it/gxgura35ccs21.jpg,4,https://redd.it/bdb0cj,Hugheydee,🤷🏽‍♂️,,1555296045.0
bdausf,https://www.reddit.com/r/opiates/comments/bdausf/first_time_posting_in_this_sub_wondering_if/,7,https://redd.it/bdausf,madisonddivide,"first time posting in this sub, wondering if anyone could answer a couple questions?","I hope this is the right place to ask this, I apologize if it’s not. the only pills I’ve ever dabbled with are Percocets. my boyfriend and I will go on these couple day binges every once in a while where we snort blues before bed and just chill and enjoy the warm and fuzzies. The next day, however, I just want to sleep the whole day, and when I do sleep, I completely knock out. Is this normal? Also, I lose my appetite for the day or two after and experience a slight kind of underlying nausea. I guess I should add I’m pretty tiny, I’m 4’11 and 95; I’m usually snorting about 75% of a blue, so maybe about 20 mg or a little more? Just wondering if these are other things people experience as well, because my boyfriend always says he feels completely fine the next day.

edit: I also just discovered from reading this sub that there’s no such thing as a perc 30 so sorry if I sound like a fool! what the hell am I snorting then? I hate being so uneducated",1555295226.0
bdajeo,https://www.reddit.com/r/opiates/comments/bdajeo/question_about_pill_color_need_some_input/,2,https://redd.it/bdajeo,DizzneyChick,Question about pill color... need some input!,"Hi! I was wondering what you guys think about this... my friend has some Morphine Sulfate Contin 15mg that when she cut in half it was a light tan-ish color inside. I have been prescribed these in the past and know that mine were white inside. Maybe not a perfect white, but pretty damn close. Hers have a dark blue coating... any chance they could be fake or old or? Never heard of these being pressed? She said they have ABG on one side (if I remember correctly) and 15 on the other. Any insight would be greatly appreciated. Thank you! ❤️",1555293343.0
bdaiq4,https://i.redd.it/xgy1k8pr3cs21.jpg,3,https://redd.it/bdaiq4,puppytaco,Saw this on the front page a few weeks ago and couldn't stop laughing at the top comment. I'm sorry but this is fucking horrifying. I'm just imagining the bloody elevator scene from The Shining any time someone shoots up. I can't believe people actually upvoted this.,,1555293229.0
bdaet3,https://www.reddit.com/r/opiates/comments/bdaet3/i_know_it_depends_on_how_much_fent_or_how_big_the/,6,https://redd.it/bdaet3,prometheus34,"I know it depends on how much fent or how big the dose is . But how long does it take from taken the drug to overdosing? Does it happen immediately after using , in my case snorting , or does it happen in 10,15, or 20 minutes after using ?",,1555292557.0
bdaexx,https://www.reddit.com/r/opiates/comments/bdaexx/what_is_your_opinion_on_kratom/,14,https://redd.it/bdaexx,DHarnish704,What is your opinion on kratom?,"I enjoy it for recreational use because I don’t have an opiate tolerance, but what is your opinion?",1555292581.0
bdac31,https://i.redd.it/odswf6sc0cs21.jpg,1,https://redd.it/bdac31,Code-Chronic,"Today’s little pick up some 15’s, 10’s, a 30 and some fives",,1555292086.0
bdaap4,https://v.redd.it/qsntfgvlzbs21,4,https://redd.it/bdaap4,dvdzkk,Uncut raw and some blows,,1555291870.0
bda6yv,https://www.reddit.com/r/opiates/comments/bda6yv/hydro_10mg_question/,10,https://redd.it/bda6yv,passtheyak,Hydro 10mg question,I’m used to paying $7 a pop for each but this guy wants 10. Over priced or still worth getting?,1555291223.0
bda1ke,https://www.reddit.com/r/opiates/comments/bda1ke/oxycodone_m_30/,7,https://redd.it/bda1ke,LilEx_410,Oxycodone M 30,"Not a crazy or important post. Has anyone ever gotten some real M box 30s that were soft (easier to crush) because usually when I come across them they’re harder to break than most oxycodone, but the ones I got today are pretty soft. 🤔 Maybe I’m just crazy and the quality checks have gotten sloppier over the years",1555290250.0
bd9trk,https://www.reddit.com/r/opiates/comments/bd9trk/no_one_to_talk_to/,8,https://redd.it/bd9trk,Oxynod,No one to talk to,"Hey everyone. Being an addict is so lonely. Being in recovery, I think, can be even lonelier. I’m sitting on the edge of one year sober and I’m such a mess. I’m not any happier being sober. In fact I’m more anxious. I hate life. I don’t remember the last time I didn’t cry myself to sleep.









I’m not really sure what my point is. I just don’t have anyone to talk to. I feel so alone. I have been praying for the strength to kill myself lately but I find myself too scared to actually do it. I try to tell myself that the fear of the thing is always worse than the actual thing. Dying might hurt for for a few minutes but then it’s all over.



Anyway, sorry to be a Debbie downer. I wish I felt life was worth living sober.",1555288902.0
bd9stl,https://i.redd.it/axhi1cqeqbs21.jpg,10,https://redd.it/bd9stl,Ajm6753,Todays pickup.. hate the u24’s. Whats your favorite?,,1555288737.0
bd9oq0,https://imgur.com/kUdzRq6,4,https://redd.it/bd9oq0,DegenerateDrugUse,Never enough,,1555288030.0
bd9m15,https://www.reddit.com/r/opiates/comments/bd9m15/time_for_wds/,3,https://redd.it/bd9m15,eaglesgata12,Time for WDs,"So im starting a new job and need to get myself cleaned up, aka need to come off oxy and h. Ive been taking about 180mg of oxy per day. Ive got some 50mg trams and some kratom extract. Am i okay to take those together to help my withdrawal symptoms?. Need help, i want to make sure that I am okay tomorrow for work. Any help is appreciated.",1555287547.0
bd9j7o,https://www.reddit.com/r/opiates/comments/bd9j7o/im_two_weeks_into_a_relapse_black_tar_after_2/,12,https://redd.it/bd9j7o,PhilosophyBlue,I'm two weeks into a relapse (black tar) after 2 months clean. I was addicted for about a year prior to those two months (smoking 2-3 points a day). I'm starting to get sick when I don't use again. I'm deeply disappointed in myself and am having very little luck exercising self control.,"I feel like I can't make myself stop. I'm hoping to get some Benzos soon and just try to keep away from the dope for as long as I can.

Edit: In response to the several ""you did it before, do it again"" comments:

Last time I had to get a lot of help. I basically stayed with a friend for 4 days while he fed me Benzos and brought me water. One of my partners stayed with me the whole time, giving me messages and turing the heat on and off for me as I sweat and cried and tried to stretch out all my muscles to no avail. 

I can't ask for that help again. I really pulled out all the stops worth everyone who loves me in order to detox.

------------------------------------------

Edit 2: Optional additional cobtext

I'm 18 years old and I don't want this to be what my life is like. But the choices I've made have already pretty much guaranteed that, to some degree, I will always struggle with thus addiction. I have some notable chronic pain in both my back and my legs, and have always had trouble sleeping. So heroin has essentially been a mericle drug for me. I feel like there is no going back once you've had the cure. 

I hear a lot of recovering addicts talk about their drug if choice like it's this awful thing that wont leave me alone. Though I want to quit, I don't feel that way about heroin. Those two months, feeling my body, just left me crying every day. The thought of never feeling like I was able to run around or focus enough for schoolwork loomed over me every second of it until I gave in. 

I feel guilty  but using has me exercising and keeping up with school again. I wish it made me feel like garbage.",1555287074.0
bd9fu3,https://www.reddit.com/r/opiates/comments/bd9fu3/new_city_cold_copping_game/,7,https://redd.it/bd9fu3,Eyedeafan88,New city cold copping game,"Not my favorite game that is for sure. I went out looking Friday afternoon but it started to sleet so I called it off pretty quick. Yesterday I spent 2 hours wandering around a place a read about in the newspaper having a bunch of drug and prostitute problems. I didn't see anyone I thought was worth asking. This city is different then where I'm from. In the south things are very segregated so when your in a certain area you stand out and attract attention. It's not like that here from what I've seen. I'm going to have to adjust my tactics.

So tommorow I'm hitting up the needle exchange. I've found three so far so I'll spend time at each. I'm fairly confident this will work but if it doesn't I don't know what I'll do. I think hitting up methadone clinic parking lots and NA meetings is a really shit thing to do. But if it comes down to it morals will not stop me.

Share some of your stories and tactics.",1555286505.0
bd97zg,https://i.redd.it/t6u1ocssfbs21.jpg,4,https://redd.it/bd97zg,Traphousetraplay,About .4 left outta todays .5 but on a more serious note. I was wondering I have the next two weeks off work and would like to ween myself off in that time does anyone have any tips on how they quit or cut back by weaning themselves off h?,,1555285171.0
bd976c,https://www.reddit.com/r/opiates/comments/bd976c/drug_test_for_methadone/,5,https://redd.it/bd976c,pythagoras_gonzalez,Drug test for methadone,"Gotta take a urine test for work I’m 2 weeks. Does anyone know how long it takes to get out the system? Thx y’all. 

Stay leaning.",1555285034.0
bd96eo,https://www.reddit.com/r/opiates/comments/bd96eo/i_shot_up_4mg_dilau_can_i_still_take_kratom/,3,https://redd.it/bd96eo,COB98,"I shot up 4mg Dilau, can I still take Kratom ?",I’m going through bad WDs of Benzos and I gotta wait till wednesday but anyways I got Olanzapine but I hate Antipsychotics and I have spasms and shit .. the Dilau helped a little bit but almost did nothing so I was wondering if I could take some Kratom too .. Took some this morning but an hour after the Dilaudid I don’t know if I should .. anyways thanks !!,1555284901.0
bd91cz,https://i.redd.it/f222wejdcbs21.jpg,7,https://redd.it/bd91cz,bathcigbomb,The irony,,1555284021.0
bcxk61,https://www.reddit.com/r/opiates/comments/bcxk61/few_questions_tried_searching_and_googling_but/,2,https://redd.it/bcxk61,QsImSureWereAnswered,Few questions. Tried searching and googling but haven’t had much luck.,"So my question:

How can I get better at registering and staying in a vein? My veins don’t really bulge out much. I’ve looked at veins maps online but most of them are just drawings and I can’t match my vines up with them.

Also, what sort of aftercare should I be looking into to treat all my failed attempts at shooting? Mostly my arms just feel bruised not too swollen or anything. Is it just  matter of the needle punctures to heal?


Some back story:

So I just starting IV’ing, I used to exclusively snort. My current cycle is to binge for a week, use Kratom to get through the WD’s and then go 10 days clean before getting the vivitrol shot for at least 3/4 months before I rinse and repeat.

Anyway, since I’m new to IV’ing I’ve been taking it slow - always doing tiny shots first to test the strength, always using clean rigs for each new shot, sterile cotton and water and I always sanitize the area before and after I shoot.

My problem is, I’m having a huge problem registering the vein, and when I do eventually get it, I stay in for only half the shot really before it try to register again and it’s come out of the vein and I can’t get it back in. It makes it hard to keep trying because after a few partial registers that don’t take, the shot is filled with blood and it’s hard to see if I’m registering anymore after that.

I’ve missed a few shots already and after so many attempts of trying to find a vein and register for the whole shot to go in; I’m left with mad needle marks and sore arms.

I think I should be okay with not getting an abscess (I was very particular with sterilization and I don’t see any signs of the areas I used deteriorating, but it I’ll keep and eye on it.

Thanks!",1555203910.0
bcymzd,https://www.reddit.com/r/opiates/comments/bcymzd/any_major_damage_done_from_my_first_attempt_iving/,1,https://redd.it/bcymzd,Brentonianai,Any major damage done from my first attempt IV’ing?,"So I tried IV’s dope yesterday and today. Unfortunately I don’t have the best skills and missed a few shots (not to the point where I have crazy inflammation or anything, the skin underneath where I shot up looks bruised and is a bit sore.
Any suggestions or hitting veins that are not bulging up enough from me to easily hit and register them?

Will I have done any damage to cause something bad like a blood infection or an abscess? I always used new needles for every shot and always sterilized the site of the shot before and after.

Thanks!",1555211585.0
