7w9vn6,https://www.reddit.com/r/opiates/comments/7w9vn6/suboxone_generic_pills_vs_namebrand_strips/,14,https://redd.it/7w9vn6,iregisteredtosayFU,Suboxone generic (pills) vs. namebrand (strips),"Long time lurker, first time poster. I'm in a suboxone maintenance program and have been fighting with my doctor to get me on the generics. I'm basically stuck with them now since they're a lot cheaper and I literally had to argue with the doc every appointment for a year to get a generic scrip... that said, I have heard some horror stories about the tablets just not working as well as the strips. 

That brings me to my question: What's everyone's experience with the name-brand strips vs. the generic pills? Is there anything I can do to ensure the absorption is as good with the pills besides not talking and making sure I don't have a ton of spit buildup in my mouth? I've heard of people bumping them but don't see how that absorption would work any better, since most of it would end up in your throat. 

Thanks for your time and any info you can provide. This forum has been an awesome lurking resource and I appreciate you all sharing what you know. 

",1518139184.0
7w9tj0,https://www.reddit.com/r/opiates/comments/7w9tj0/whatevers/,7,https://redd.it/7w9tj0,Youngnietzche,Whatevers,"https://ibb.co/ks3UWH
Definitely can tell two different kinds. $220 for 9 of em🤔😥😱😡😳",1518138608.0
7w9tg0,https://www.reddit.com/r/opiates/comments/7w9tg0/ba_boofing_of_4/,4,https://redd.it/7w9tg0,thelmothelizard,BA Boofing of #4,From researching I’ve heard anything from 50-85% bioavailability. Other times I’ve read it’s not worth boofing at all. From the few times I’ve done it I’ve always had stronger effects from just snorting. Anyone care to share some insight? (Not shooting btw),1518138585.0
7w9rgc,https://i.redd.it/k4tjf8ad63f01.jpg,2,https://redd.it/7w9rgc,cazzyxo,Pain pain go away. The thanks yet no thanks feeling of being in a bad car accident. Least this will help for a few hours....hah,,1518138062.0
7w9pqs,https://i.redd.it/y6rsou0153f01.jpg,16,https://redd.it/7w9pqs,Loudog12,Nice little care package I got for $15 👌🏼,,1518137613.0
7w9fsy,https://www.reddit.com/r/opiates/comments/7w9fsy/iv_tramadol/,13,https://redd.it/7w9fsy,MrMcFuckFace--,IV tramadol?,"I'm dope sick as fuck and can't afford any dope rn. But I've  been scouring the house and long story short I found a few 100mg trams I never took. I don't feel like chewing them so if I filter it real good, you think a few IV trams would do me good? Is the high pretty similar to other opis? I've heard there's no nod or nothing (why I never took em) but that doesn't seem right to me.",1518135048.0
7w9f0x,https://www.reddit.com/r/opiates/comments/7w9f0x/wd_all_day_and_about_to_be_well/,3,https://redd.it/7w9f0x,PillGuyTillIDie,W/D all day and about to be well!,"Dealer said he'd be here in 5 minutes, I'm even more grateful I didn't have to take 2 hour bus ride like normal and getting delivery.
And my other homie is on the way and I'm middle Manning some perc 10s for him so that'll be nice.
(They'll keep the W/D away so I'm not complaining)
Hope y'all have scored today stay safe",1518134878.0
7w9es9,https://www.reddit.com/r/opiates/comments/7w9es9/why_was_i_so_scared_to_mix_these_two_opiates_shit/,16,https://redd.it/7w9es9,Dysphoria_III,Why was I so scared to mix these two opiates? (Shit Post),"So I’ve been getting oxycodone and hydrocodone at the same time a lot lately and several times I took small amounts of both and was so scared that I was basically just wasting it and not getting high. I have a decent tolerance (compared to others around me at least I know for some of you on heroin this is nothing. It was nothing to me at one point as well) and was trying to take like 15mg oxy and 7.5mg of hydro and was getting weak or no results.

Today I finally just said fuck it and had a friend come over to make sure I’m okay just in case and took 20 mg of oxy and 15 mg of hydro and I’m on cloud 9. Higher than I’ve been since I was doing 30’s last week. I was treating the two opiates like I was mixing an opiate and a benzo or something. 

I’m high as a kite and basically just wanted to let you guys know I was being a pussy and not getting satisfied, then I stopped being a pussy and am well satisfied. Moral of the story.... don’t be a pussy kids! Lol",1518134807.0
7w9bwg,https://www.reddit.com/r/opiates/comments/7w9bwg/would_most_of_you_guys/,9,https://redd.it/7w9bwg,roxykidd20,Would most of you guys,take oxy/oxymorphone over h if supply and price wasn't a factor,1518134052.0
7w8yxl,https://i.redd.it/k5nh0stpk2f01.jpg,16,https://redd.it/7w8yxl,oxynormal,Do y’all think these are real?,,1518130784.0
7w8yqx,https://i.redd.it/hpyctnnlk2f01.jpg,83,https://redd.it/7w8yqx,DeeboComin,Just found a forgotten stash of Methadone pills,,1518130739.0
7w8w37,https://www.reddit.com/r/opiates/comments/7w8w37/first_time_doing_heroin_some_questions/,15,https://redd.it/7w8w37,throwaway11189111,"First time doing heroin, some questions?","The strongest opiate I've ever done is dihydrocodeine. Whenever I do it which is between a week and a month apart, I take about 1-2 grams. As you can imagine it's pretty expensive(about £40 if I CWE them, about the same if I have pure tablets).

Anyway, heroin seems to be cheaper and better in general so I want to try it and see how it is. I just have a few questions first:

* What is nodding off like? When I do the DHC my eyes will close on their own and I will drift in and out of consciousness but at any time I can wake myself up and have enough energy to go out or the likes. Is it like this for heroin?

* How much should I take first time? I don't want to risk anything so how much would a completely opiate naive person take first time to snort/smoke

* what type should I get? I've heard theres different types, what type should I get for snorting/smoking.

* whats the difference between snorting and smoking? 

* And how do you smoke it? I tried looking it up but the descriptions are very vague.

(Sorry if this violates rule 7, I'm not sure if my questions are too direct or not)",1518130097.0
7w8vbm,https://i.redd.it/1xixlhv0i2f01.jpg,57,https://redd.it/7w8vbm,clerror,Picked up some Morphine 30’s. Have a good day everyone. Happy nods.,,1518129909.0
7w8kx5,https://www.reddit.com/r/opiates/comments/7w8kx5/numbness_after_im_injections/,3,https://redd.it/7w8kx5,TrappeddownSouth,Numbness after IM Injections,I IM my tar shots (not good I know but...). I have been doing this for about 2-3 years. I mainly do it in my thigh and hip. This area is know about 75% numb. I get an itch and scratch it and feel nothing. Ideas? Is this permanent? Ways to make it better?,1518127492.0
7w8jmj,https://www.reddit.com/r/opiates/comments/7w8jmj/storytime_super_high_waiting_on_my_clothes_to_dry/,33,https://redd.it/7w8jmj,TexasPeteHawtSauce,"[Storytime] Super High, Waiting on my clothes to dry. So let me get a #shitpost in real quick.","The god damn people you run into in the drug game... smh. Sorry 4 the shit post. 

I live in either a large small town or a small city (big University w/ a Medical School and law school, college football n basketball teams, huge hospital all that shit etc..) 

Well, the mayor of my city, who has been kinda hinting at a State Representative run follows me on Twitter for some reason- he only follows like 400 ppl and has 11k followers.. I guess my tweets are fire or he just likes to have 1 sexy ass half black dude to keep him in the loop or wants me to fuck his wife or something, who knows... 

Anyway, I'm in the truck with my redneck drug dealer and we pull off to the side of the street and this sick ass brand new Range Rover pulls up right beside us taking up the whole fucking street and i'll be goddamned if it wasn't the fucking mayor. Hands my dboy $800 like it aint shit. ( #Opana Prices smh) I've never met this mayor dude in person, but we've interacted on twitter several times over the course of 3-4 years. but I knew it was him right away. That JFK swish haircut gives up politicians a mile away. 

Anyway, I'm super embarrassed cause no one knows I get down like I get down, and I'd like to keep it that way. Especially to the fucking Mayor. So im like god damn gooo white boy, drive, with my head down and shit, playing with my phone, but he just keeps talking and talking like they are fucking brothers or something, but at the same time im like fuck it, the Mayors here for the same reason I am, but it's still very awkward to me cause I'm like a fake role model in the city or something.

We'll anyway we finally roll out and I'm like yo was that the fucking mayor dude? He's like ""Oh yeah that's my ""brother""..def not his bio-brother. He's *cool ya kno*. word. 

So yeah, that was a kinda pleasant surprise to cop alongside the Mayor. I fuck with it as long as he's not dipping too deep into the cities funds to get it right. Hell, that would be a dope ass job. Opana'd out Mayor. #goals  

So, who's the craziest, and most unexpected person you've ran into while copping? 

tl;dr shitpost dont reed",1518127218.0
7w8eai,https://www.reddit.com/r/opiates/comments/7w8eai/anybody_else_come_to_prefer_fent_now/,24,https://redd.it/7w8eai,AWastedMindd,Anybody else come to prefer fent now?,"Everyone will probably think I'm crazy for this but the fent high although short lived is just better imo. I still love heroin, But with all the fent in my area real heroin is hard to find and when you do find it it normally can't really do too much due to the fent tolerance. So I just intentionally seek out fent or ""white shit"", The dope boy knows you love it too. Just thought I'd ask because I was curious, and due to fentanyl prevalence a lot more people probably come in contact with it. And it is cheaper I can grab a G of fent for 70$ when a G of actual heroin would run me like 110.",1518126022.0
7w8cxn,https://www.reddit.com/r/opiates/comments/7w8cxn/dboy/,21,https://redd.it/7w8cxn,Oldman6868,Dboy????,Can someone please explain why you guys call your dealers dboys? Is it dope boys or something else? ,1518125728.0
7w88j5,https://www.reddit.com/r/opiates/comments/7w88j5/second_time_with_suboxone_pills_need_help/,9,https://redd.it/7w88j5,VelaBlue_,Second time with suboxone pills. Need help?,"Ive come across an 8mg sub pill that I quickly broke down , and snorted the entire thing of course. This was about 45 minutes ago, and Im not sure if Im doing this correctly? 

Ive heard of plenty of people snorting subs and getting high, but at the moment, Im just...here. Should i be high? Should I wait a little longer? Can you actually even /get/ a buzz from snorting subs?

Im not new to opiates at all. Ive been in the game coming up on 10 years now, but this is only my 2nd time with sub pills, so i AM new to this.

I just dont know what to expect. Any informed insight is much appreciated.  Thanks guys and gals.",1518124760.0
7w86qa,https://www.reddit.com/r/opiates/comments/7w86qa/dont_you_love_it_when_your_doc_prescribes_you/,2,https://redd.it/7w86qa,1UpTahpAhk,"Don’t you love it when your doc prescribes you everything you’re intending to get prescribed, AND SOME!","Went to get every prescription of Suboxone and left with a higher dose pf it (went from 2 - 8mg films per day to 2.5 per day) 
PLUS a script for 1mg Kpins to take 4x daily. Ahhhhhhh I love you doc, you the real MVP. 

Nothing beats getting it all for free, at that!!!!! #Medi-Cal",1518124352.0
7w84wp,https://i.redd.it/ayxf40gf02f01.jpg,125,https://redd.it/7w84wp,bee_m0,My friends arm after abcessing from IV heroin use. Always use new gear and keep everything you use clean and sterile!,,1518123953.0
7w83rt,https://www.reddit.com/r/opiates/comments/7w83rt/a_bit_of_a_rant_about_the_clusterfuck_between/,18,https://redd.it/7w83rt,tydalt,A bit of a rant about the clusterfuck between states and the feds regarding laws.,"I was just at the VA talking to my psych doc and was curious about looking into marijuana and CBD to try to treat my depression, PTSD and anxiety.

He shut me down immediately and said they cannot even talk about it. I asked if he could just inform me about any contraindications and he said no. Even totally off the record? No. How about a hypothetical issue where some imagined patient wanted to make sure weed wont fuck with the seven different psych meds I (oops, imagined patient) is taking? I SAID NO!

The reason I bring this up is I am on a pain contract with the VA and am on moderate dose opiates (120 5mg percs a month, 4 per day). I have a long and detailed history of heroin addiction (caused by over prescription of opiates by the VA) and it has taken me a LONG time to earn the trust of my doctors and get put back on opiates.

I am terrified of popping hot for TCH and being totally fucked and in a world of hurt.

It is so frustrating that the Feds have cracked down so hard on federal level providers and they cannot even mention stuff like weed.

AAARRRGGGHHH!!!!",1518123705.0
7w83it,https://www.reddit.com/r/opiates/comments/7w83it/have_5_hydrocodone_5325_and_no_tolerance_how_much/,5,https://redd.it/7w83it,skinnymemedude22,Have 5 hydrocodone 5/325 and no tolerance. How much should I take to have a good time?,,1518123653.0
7w80qe,https://www.reddit.com/r/opiates/comments/7w80qe/new_opiate_user_dosage_question/,6,https://redd.it/7w80qe,PercocetPanther,New opiate user Dosage question,I’m a new opiate user I first experimented with hydrocodone about 3 years ago  and then “cheese” a snortable form of heroin as of last year I began lipping fentanyl patches now I’ve began taking percs I’m taking about 100mg of oxycodone a day taking 10 x 10 mg Percs a day and feel like this may be too much any input from some experienced opiate users to give me a idea of what kind of habit I have,1518123042.0
7w7z4o,https://www.reddit.com/r/opiates/comments/7w7z4o/stupid_or_junky_logic/,7,https://redd.it/7w7z4o,opiatesaregood4you,Stupid or junky logic?,"7th day detox no withdrawls anymore really, would smoking one hit of like .3 in one night affect the cycle?

As if would it bring it back to day 1 withdrawls or would it be ok?

I am craving so mad and am 45 mins away from a homeless middle man who makes £20 off me but gives me ok ish stuff from some house we go.

Ahhhhhhh this opiate trigger is hell, hope everyone is ok",1518122715.0
7w7y2z,https://www.reddit.com/r/opiates/comments/7w7y2z/refill_day_tomorrow/,10,https://redd.it/7w7y2z,o-p-yum,Refill day tomorrow.,You've got to be fucking kidding me. This is for the birds. Im sneezing like 1000 times an hour. I woke up at 2 am kicking like crazy sweating like a fucking race horse. Husband can see my heartbeat in my neck. I'm shitting like a seagull. My nose. Oh God my nose it's running like a hotel toilet. Fuck me. Fuck me!!!!!!,1518122480.0
7w7x0p,https://www.reddit.com/r/opiates/comments/7w7x0p/airport_scoring_stories/,10,https://redd.it/7w7x0p,818L88,Airport scoring stories?,Waiting for a flight sick as shit. Where’s the grannies giving away blues when you need them?,1518122238.0
7w7mif,https://i.redd.it/6zy7i88go1f01.jpg,33,https://redd.it/7w7mif,bigerock,After 3 rough weeks finally a great day. Got my$3000 dollar lottery check!!!🔥🚒👩‍🚒🔥,,1518119929.0
7w7gim,https://www.reddit.com/r/opiates/comments/7w7gim/is_methadone_withdrawal_worse_than_fentanyl/,23,https://redd.it/7w7gim,Fentgang780,Is methadone withdrawal worse than fentanyl withdrawal? And how long is methadone wd im on 110mg,,1518118593.0
7w7fsu,https://www.reddit.com/r/opiates/comments/7w7fsu/black_tar_and_pea/,1,https://redd.it/7w7fsu,misunderstoodScorpio,Black tar and PEA???,Has anyone ever used phenylethylamine hcl to potentiate opiate euphoria? ,1518118433.0
7w7dqw,https://www.reddit.com/r/opiates/comments/7w7dqw/kratom_commentquestion/,15,https://redd.it/7w7dqw,HappyThrillmore87,Kratom comment/question,"I know there's a lot of info on Kratom online, but wanted to ask ya'll since I trust your experience.  First, I have mild withdrawals and tried Kratom for the first time (red bali).  Holy shit it works wonders!  Cuts wd so much.  Questions - how long do you guys use it for when going brought wd?  Just a few days or longer?   Are there any side effects you have experienced?   Lastly, and most importantly, does if fuck up your dope receptors?  Like if I used kratom this afternoon can I shoot up tonight and get high or are the receptors somehow blocked?  Thanks for any info you have. ",1518118015.0
7w7ar7,https://imgur.com/RK3eHQ6,27,https://redd.it/7w7ar7,Asdfghjkl199,"Is this m box fake? The darker part is from me licking it, it didn't taste bitter.",,1518117365.0
7w700p,https://www.reddit.com/r/opiates/comments/7w700p/boofing_oxy_how_can_i_be_sure_my_poop_wont_absorb/,29,https://redd.it/7w700p,HalfHeartedBootyCall,Boofing oxy. How can I be sure my poop won't absorb it?,So it's my first time trying to plug anything.... And I'm all set but I just wanna make sure I don't lose it to my poop. How do you know if a bowel movement is enough or if there's still more up there? Is it just a feeling of emptiness? I'm not constipated at all but I just wanna be sure....,1518115056.0
7w6vrn,https://m.imgur.com/KB0osST,25,https://redd.it/7w6vrn,Opiates_Ocean,USPS da real mvp.,,1518114146.0
7w6sg9,https://www.reddit.com/r/opiates/comments/7w6sg9/medical_marijuana_no_tolerance_vs_oxycodone/,3,https://redd.it/7w6sg9,Numba2Acct,Medical Marijuana (no tolerance) vs Oxycodone,"Talking to the doc today, I'll have the option in May to wean off opiates and switch to marijuana as it has already been approved and will be available then (PA)

I know marijuana isn't the same, but I've never really done marijuana. My state will be all tinctures, edibles, and vape. No smoking.

So I guess my question is....how much recreational value does medical marijuana have? The reason for my thinking for the switch is my health. I've been looking for an out, and I think may be it. 

My abuse of oxycodone is a stress/anxiety relief function. And help with sleep. So will marijuana do the same for relaxing and sleep and pain relief

Never did heroin. 200mg a day oxy for 2 weeks, then benzos/Kratom for 2 weeks in a cycle.

Thanks guys. I release pretty stupid question, but I'm such a marijuana noob cause I could never smoke it 
",1518113420.0
7w6qe6,https://i.redd.it/3iphhbsr31f01.jpg,6,https://redd.it/7w6qe6,skyfullofsand,Sweet Relief,,1518113004.0
7w6q0i,https://www.reddit.com/r/opiates/comments/7w6q0i/alright_guys_since_no_one_read_my_story_about/,12,https://redd.it/7w6q0i,AbanoR,"Alright guys, since no one read my story about getting robbed, and therefore no one read the poem I wrote that I included at the end, I decided to post it on its own. I’m just looking for honest feedback, mind you, I wrote it while high on hydrocodone and IV benadryl.","It was the most profound opiate experience I have had yet and so it just came to me and I thought I would share it. It’s probably pretty melodramatic and a little in consistent but again, I was high lol. 

The tin man was a fool:
From before the fall, it is that holy feeling we all search for; the orgasm in slow motion, the sunrise that brings light to the dark places and sends the shadows into retreat. Reminiscent of that moment before dawn, when everything was new. It is fragrant with memories of that last picnic, when you, your mother, and your father were together as one for the last time, when you needn’t ask, nor be told, you simply knew; you were loved. It is the word that has a name but that for the life of you, you cannot remember. It takes you back to when you did, and you almost recall, but then you forget you ever cared. It is a pensive bliss, a forlorn glee. It is the tides’ gentle lapping at your toes, lazily kissing more and more of you until your every fiber is graced by its warmth and your entirety is submerged in a sea of sedation. It is a tranquilizing nostalgia, a paralyzing peace; a perfect calm and quiet rest, such that you dare not move, lest you disturb the stillness, the innocence. But you haven’t any cause to move, for everything is as it should be; as though the caretaker of your heart has flipped the breaker to every frayed and sparking nerve keeping you awake to the pain of this world, closed the blinds, and turned out the lights that you may sleep now for the first time in years. It is as though a divine hand has clasped hold of the soul you let slip from your grasp so it may be spared the harshness below. You may rest without worry, for you have no need of love. Neither to or to be. Without risk there is no reward and you will take the participation ribbon for no reward is worth the risk. The tin man was a fool. Isolated and immune, you are Only; this flower coated armor your best and only friend. Empty; you will outgrow it. What then? In the interim, sleep long and breath easy; you are loved, though you do not care to know it. 
",1518112921.0
7w6nct,https://youtu.be/v97UzMMloxg,16,https://redd.it/7w6nct,cessoanhelo,Heroin or Fast Food - what can we get faster?,,1518112355.0
7w6klp,https://i.redd.it/rsg3dk6801f01.jpg,8,https://redd.it/7w6klp,Lightlytoasted420,Just spiked my vein for the first time in almost 3 months 🙃,,1518111787.0
7w6k8m,https://www.reddit.com/r/opiates/comments/7w6k8m/can_someone_list_the_order_of_bioavailability_of/,17,https://redd.it/7w6k8m,SylviaNorth,Can someone list the order of bioavailability of different ROAs for dope?,"I currently make money water and snort that but my tolerance is getting out of hand and I'm having to use half a G of tar over an evening to be as high as I want to be. I'm thinking of switching to the needle, but I've tried it before and couldn't hit a vein at all. Tried like twelve times and missed about 10 of them. I have dark skin and small veins, I typically get turned away from plasma donation because once the tech hits me my veins can't support the large needless.

Anyhow, aside from shooting into a vein, does muscling have a higher availability than snorting? What about skin popping? Planning on quitting soon for a T break but I wanna be efficient with what I have left before then. ",1518111706.0
7w6hh6,https://i.redd.it/hi1duxy9y0f01.jpg,24,https://redd.it/7w6hh6,JonnyAppleseedz,Enjoy your weekends everyone!,,1518111125.0
7w6cft,https://www.reddit.com/r/opiates/comments/7w6cft/first_na_meeting_tonight/,17,https://redd.it/7w6cft,tweacker11,First NA meeting tonight,"Yesterday I was finally accepted into 18 months of drug court after 8 long months of court dragging on. As part of the contract I signed I am required to attend 12 hours of NA per week and that starts tonight. Has anybody here had any good experiences with NA on helping them stay clean? I’m trying to go in there with an open mind an maybe get something out of it, instead of having a shitty attitude about being forced to go. I’ve been addicted to heroin and oxy for about 3 years now but been clean off the H ever since I Overdosed last summer and ended up regaining consciousness just to find myself handcuffed and surrounded by a room full of cops in the hospital. Ironically enough my probation office uses a 5 panel urine testing kit and I’ve found that I can do as much oxy as I want because it will not give a positive result for opiates. Therefore I’m not that stressed about drug court at the moment haha. Happy nods my friends :)",1518110030.0
7w6688,https://www.reddit.com/r/opiates/comments/7w6688/will_relapse_in_a_few_days/,40,https://redd.it/7w6688,myfaceinthesink,Will relapse in a few days,"Hey,

I am kind of mad at myself right now. I just ordered heroin again after three months clean. I was doing well. But life is just too shitty currently to not do heroin.

It will take a few days to get here. In that time I will have time to hate me even more for my decision, but I know I won't be able to stop myself.

Sorry mum, I tried.",1518108714.0
7w664n,https://www.reddit.com/r/opiates/comments/7w664n/opiates_vs_stimulants_which_is_more_euphoric_for/,45,https://redd.it/7w664n,MagnaMagicBtu,"Opiates vs Stimulants, which is more euphoric for you?","Say for example, Meth vs Heroin. Which is more euphoric? Obviously both together is the most euphoric but which one used alone is more euphoric? which would you use for social anxiety like public speaking?

Which one is a better anti-depressant and Anti Anxiety? 

Personally I think Opiates are more euphoric. They have a smoother euphoria, opiates make me feel good about doing nothing, stimulants make me feel good about doing things. To me, Meth doesn't feel euphoric on its own, it only makes doing things much more fun. It increases the reward of things like playing video games or cleaning the house. Heroin you can just sit there in a chair and feel good but doing things also feels good. Heroin you can relax or do things. Meth will make you do something. Same with Dextroamphetamine. Opiates are my favorite drug in the world. What is your favorite drug aside from Opiates?",1518108687.0
7w60i3,https://www.reddit.com/r/opiates/comments/7w60i3/i_passed_my_drug_test/,18,https://redd.it/7w60i3,MultiPackInk,I passed my drug test!!!,"Thank god, I just pissed clean!!  
Like a fucking idiot I couldn’t wait a few hours to get well, so I scored, pissed into a bag then fixed the shot I’ve been waiting for all week. It hit like a god damn train haha.  
Got to my appointment and I was physically shaking I was so nervous, if I’d been dirty I’d have lost my license for at least a year, which would mean I’d also lose my job as well as so many other areas of my life getting exponentially harder. 
Ahh man this is great, I won’t have to do this again for a good 3 months at LEAST!

Hope everyone else is having a great day too, I’m gonna go score some more gear and maybe even grab a pizza on the way back!",1518107461.0
