77u3ji,https://www.reddit.com/r/opiates/comments/77u3ji/first_time_obtaining_heroinfor_free/,53,https://redd.it/77u3ji,jlg823,First time obtaining heroin...for free.,"So, I’ve never touched H, never really wanted to at all. I’m more of a Oxy guy since I have a prescription due to nerve pain and chronic back pain. Anyways I was at a Walmart and before I went in, there was a girl who ran up to everyone and said she’s going to call the police because there was a guy behind the store with a needle in his arm and she was scared he was going to come and kill her since she saw him. She seemed super paranoid. I don’t know this guy, for all I know he was a bad person but since we all here do opiates, I could sympathize with him. So I sprinted to the back of the store, saw him just then standing up and told him “Hey dude you need to get out of here, some girl saw you and said she’s calling the police and going to get Walmart security on you, don’t shoot up in public” and after that he asked if I did anything and I told him only Oxy. He threw me a very small dime bag and said “This is thanks dude, have some happy nods tonight” and then he ran into his car and went off. Only bad thing was when I was about to go back into the store the girl from earlier was like “You helped him didn’t you? Why the fuck would you help a shitty person like him. You know all addicts are shitty people and shouldn’t be alive”. I seriously wanted to punch her but all I did was tell her to go fuck herself and try getting into his shoes, go shoot some H or even take 10mg of Oxy and we’ll see how you feel about addicts once you’re hooked. But anyways, went to the Walmart bathroom, hid the H in my shoes just incase and now I’m home and I’m not sure if I even want to snort it. I just feel like I’m going to jump even further down the rabbit hole. ",1508600704.0
77tzym,https://www.reddit.com/r/opiates/comments/77tzym/flying_with_opiates/,40,https://redd.it/77tzym,nutz656,Flying with opiates,First time poster. I'm flying back home for a few days  next week and I can't be sick when I'm with family. Need to bring a few days worth supply of bags with me. What's the best way to bring them on the plane? I'm thinking just putting them in a bigger bag and shoving it into my wallet and keeping it on me the whole time.. or should I put it in my carry on?? What y'all think is the safest way to bring on a plane?,1508599637.0
77tztf,https://www.reddit.com/r/opiates/comments/77tztf/when_youve_been_up_all_night/,2,https://redd.it/77tztf,SmokingRickyWilliams,When you've been up all night...,And the plug just happens to wake up early for once.....ahhh,1508599591.0
77tzqp,https://www.reddit.com/r/opiates/comments/77tzqp/op20/,1,https://redd.it/77tzqp,CarnivOre93,Op20,"I got some of this shit and my brother said if I chew it up it will fuck me up.

I don’t believe it. Trying to find info, do I have to do coke method for this shit?",1508599567.0
77tzfk,https://www.reddit.com/r/opiates/comments/77tzfk/i_cant_chip_too_well/,8,https://redd.it/77tzfk,BwanaOpana,I can't chip too well,"Seriously guys

Never have I ever purchased h and skipped a day while I had it, not even once. Even though I would try to.

Chippers that are experienced, how d'you do it?",1508599479.0
77tzbw,https://imgur.com/ZSfvPG2,20,https://redd.it/77tzbw,UhhImJef,Great googly moogly!,,1508599453.0
77twcs,https://www.reddit.com/r/opiates/comments/77twcs/how_has_the_southwest_bth_scene_changed_since/,11,https://redd.it/77twcs,ItsTime______,How has the southwest BTH scene changed since 2013-2014? Is tar cut with fentanyl even a thing?,"Thoughts? Experiences?  Please share.

Thanks.",1508598609.0
77toai,https://www.reddit.com/r/opiates/comments/77toai/the_final_kick_need_some_advice/,28,https://redd.it/77toai,on_a_plain11,The final kick-- need some advice,"after about 10 failed cold turkeys, ive decided a slow taper with multiple smaller kicks is my answer.

1 week ago I stepped down from heroin to kratom, using gabapentin (for 3 days) and xanax (tapered till day 5).

Im now at a point where im getting chills and mild w/d symptoms when i wake up before i take my kratom dose (9-12g a day minimum).

I want off this opiate train, so my question is-- am i good to use gabapentin and xanax as i go off the kratom when ive only had 1 week off them (i would rather be addicted to opiates than either gabapentin or xanax tbh)

and should i throw loperamide in the mix-- or does this only delay some of w/ds similarly to kratom (in that there is still a base level of opiod dependence)

I will also have dextroamphetamine to combat the mental side effects of quitting-- however the physical symptoms have always been my greatest obstacle, especially the chills and restlessness

thank you for your help guys",1508596253.0
77to31,https://www.reddit.com/r/opiates/comments/77to31/fucking_wet_dreams_during_wd/,20,https://redd.it/77to31,Thekushym0nster,Fucking wet dreams during w/d,Ugghh gotta be one of my least favorite side effects during w/d. I also haven't been laid in a few months so that's also to blame but this happens every time I'm sick without fail. Anyone else? I woke up with 2 separate ones last night and im only borderline sick. ,1508596200.0
77tmum,https://www.reddit.com/r/opiates/comments/77tmum/need_a_quick_life_hack_on_how_to_reduce_my_pupils/,40,https://redd.it/77tmum,DreamOfTomorrow,Need a quick life hack on how to reduce my pupils from getting extremely pinned,Like my pupils are pinned as soon as it goes up my nose haha it makes it so obvious..,1508595810.0
77tgvg,https://www.reddit.com/r/opiates/comments/77tgvg/when_youre_not_in_wd_but_have_no_energy_to_hustle/,5,https://redd.it/77tgvg,Genoramix,When you’re not in WD but have no energy to hustle whatsoever,"I’ve just managed to get a bag for my last 10$ hoping the dope is good enough. Shit is I host a friend who is really generous with his stuff so my tolerance has gone up again, but he got robbed yesterday so no gifts for me and I helped people with my medication (xr morphine) yesterday and of course nothing has come back today. So basically from heaven I went straight to hell(actually real hell is in a few hours) and for the fucking first time in my life karma doesn’t pay back. I suck at asking money don’t want to do “too illegal “ stuff fam has someone a bright idea to make money? Thx guys 

Oh btw the bag was actually good dope so I feel more energized than before, feeling good but tick tock time...",1508593916.0
77tbvg,https://www.reddit.com/r/opiates/comments/77tbvg/bored_here_need_some_friends_to_help_me_thru_this/,4,https://redd.it/77tbvg,IVMorphiend,"Bored here, need some friends to help me thru this!","Hey gaiz. I already explained once, but I will *again*, just incase you need it, here goes. 

I fucked up, was getting high again on fentanyl or carfentanil, it's hard saying what it was. My dboy got hit w/ a carfentanil case-so... Anyway, I violated my probation and they sent me to a CBCF program. I can explain more about that later on if you decide to be my homie.

So I'm here, on this weird journey of forced sobriety and pondering recovery whole heartedly. I could use some people just to talk to and kill some time, nothing really heavy. Just some homies. Ladies to the front doe. Lmao. Jk. 

Message me brothers/sistas in scarred arms. :)",1508592168.0
77t6bc,https://i.redd.it/thtizq2sj6tz.jpg,15,https://redd.it/77t6bc,panda_nips,Saturday Morning Pandamonium,,1508590234.0
77t4ns,https://www.reddit.com/r/opiates/comments/77t4ns/anyone_watch_the_tv_show_mr_robot/,17,https://redd.it/77t4ns,DreamOfTomorrow,Anyone watch the TV show Mr. Robot?,"Young, anti-social computer programmer Elliot works as a cybersecurity engineer during the day, but at night he is a vigilante hacker. He is recruited by Mr. Robot, the mysterious leader of an underground group of hackers to join their organization. 

Elliot suffers from clinical depression and has an addiction to the drug morphine, which, he is frequently seen snorting in almost every episode. 

Elliot's task? 

Help bring down corporate America, including the company he is paid to protect, which presents him with a moral dilemma. Although he works for a corporation, his personal beliefs make it hard to resist the urge to take down the heads of multinational companies that he believes are running -- and ruining -- the world.",1508589565.0
77t1pc,https://www.reddit.com/r/opiates/comments/77t1pc/lady_luck_update/,8,https://redd.it/77t1pc,ZachGreeen,Lady Luck UPDATE,"UPDATE

everything worked out for the most part. Haha. Car started up for my wife so she got home safe, it's still acting fucky.. sending more RPMs then it should after you hit forty, the D on the PRNDL is flashing which is really weird, but I'm going to get it checked out here in a couple hours. It ran well enough to make it to pick up and get back home so that's a win in my book. Anyway thanks everyone for the concern! I really appreciate it :)",1508588367.0
77siey,https://www.reddit.com/r/opiates/comments/77siey/tilidin_retard_extended_release_vs_non_retard/,7,https://redd.it/77siey,DieHoe,Tilidin retard (Extended release) vs. non retard (dosage).,"Is it better to crush a 50mg retard (extended release) pill, or take 100mg uncrushed? ",1508579172.0
77sdzh,https://www.reddit.com/r/opiates/comments/77sdzh/question_about_fentanyl/,8,https://redd.it/77sdzh,forgivemesenpai,Question about Fentanyl,"I understand the danger of having Fent mixed with whatever your buying because you don’t know what the dosages could be thus leading to an OD, but my question is why are dealers using Fent to cut with? Isn’t it expensive itself? Where do they get it? I don’t understand the usage of using one drug to cut another. I’m honestly a noobie, but I’ve read quite a bit about people warning others about it. Don’t people actually use Fent?? Is that not something that’s sought after?

Thanks in advance for the clarity!",1508576845.0
77sbwg,http://i68.tinypic.com/ac3f2e.jpg,37,https://redd.it/77sbwg,MissMariJane,Never thought I'd spend money on anything but dope. Adding to my collection of pneumatic tools. I'm using these to do some body work on my husband's car.,,1508575702.0
77s6dy,https://www.reddit.com/r/opiates/comments/77s6dy/does_the_marquis_reagent_really_catch_fent/,3,https://redd.it/77s6dy,Percoprincess,Does the Marquis Reagent Really Catch Fent?,"I always test my pills with the Marquis reagent and by now I’m familiar with the Oxycodone reaction for legit pills (it turns a little yellow for a while then eventually shifts to a dirty purplish brown). The Bunk Police video shows that fent would test orange, but I’m wondering now what would happen if it had both oxy and fent in it? Does anyone know if the fent reaction would overpower the oxy reaction and turn the test orange?

I once tested an oxy/aspirin pill and it turned red for the aspirin, so I’m thinking the test will show whatever the brighter color is in a compound, which would be orange if you have a fent/oxy mix. I don’t know though so I’d appreciate input from anyone who has experience with this.

Has anyone tested a heroin/fent mix with the Mrquis before and if so, did you get purple or orange?

Link to Bunk Police fent video: https://www.youtube.com/watch?v=ETKQdRt4Vjw  
",1508572702.0
77rs7a,https://i.redd.it/lwcq2ef6i4tz.jpg,27,https://redd.it/77rs7a,GreenTeemer,My biggest pickup in a while 💯✔✅👌✌🤘🤙👍👏,,1508565699.0
77rprz,https://www.reddit.com/r/opiates/comments/77rprz/if_there_were_no_such_thing_as_withdrawals_or/,8,https://redd.it/77rprz,PatsyClinesDaughter,"If there were no such thing as withdrawals or withdrawal symptoms, do you think more people would stay on dope or would more people get off",(And stay off successfully) ?????,1508564664.0
77rnkn,https://www.reddit.com/r/opiates/comments/77rnkn/hiccups/,18,https://redd.it/77rnkn,BagOfStaleChips,Hiccups...,How come when I blast some hank I always end up with hiccups ,1508563650.0
77rgah,https://www.reddit.com/r/opiates/comments/77rgah/its_been_a_week_since_ive_last_been_high/,2,https://redd.it/77rgah,lemme_get_uhh,It’s been a week since I’ve last been high,And yes god damn it I miss every minute of it! I wish I can dose where I’m at but I gotta wait two more weeks till I’m home,1508560623.0
77rezj,https://www.reddit.com/r/opiates/comments/77rezj/im_writing_a_fiction_story_that_involves_heroin/,40,https://redd.it/77rezj,oh2184,"I'm writing a fiction story that involves heroin. Being inexperienced, what are some things I should know?","I am writing a fictional drama story about a group of teenagers and young adults who do heroin, but it is a challenge. I like to think I know everything about drugs, but I really don't, and I don't want all these google or site searches in my history. 

What are some things I should know? Could somebody here give me a synopsis on meth and some addiction information that will help me correctly portray my characters, such as how said drugs are done and their effects on the body and risk factors and how they are usually retrieved - in baggies? In what amounts? etc. 

And what are some misconceptions or myths or stereotypes I should avoid?

Anything else I did not ask about that may be necessary? I really appreciate the help, any help!!!!",1508560092.0
77rdcp,https://www.reddit.com/r/opiates/comments/77rdcp/scored_20_rigs_from_targetcvs_with_no_script/,14,https://redd.it/77rdcp,pyr088,Scored 20 rigs from Target/CVS with no script... Here's how...,"Rather a narrative to how I acquired 2x 10 ct. Packages of rigs from Target/CVS pharmacy.

Went to a Walgreens to see how the pharmacy situation lookes in the back...  Spoke with the pharmacy tech, instantly knew nothing would amount from our engagement.. Kind of asked on how to take care of an insulin patient..  Who would soon be labeled 'Grampy' as I developed a story in my head and talked to the second pharmacy tech, summoned by the first, who put the nail in the coffin for me on scoring any rigs there. (He was the pharmacy tech/doc who teaches medicine administration.)  Just gave me the run around.

""Get in contact with you grandpa's personal physician to get help.""

Damn.

The next closest pharmacy is a CVS located in Target.

Lets do this.

I walk towards the pharmacy side of the store... I begin walking in and out of the isles several times to appear as if I can not find what I'm looking for..  Setting it up..

I step to the plate. (Counter)

There were 3 pharmacist working the area.  I spot the one I chose to engage with.  The target, must fit the description of a sweet, apathetic, smiling, person preferably female who would seem understanding to situations.  

All of the pharmacist's were females, win.

The role to play is that of someone expressing frustration, flustered, and even slightly confused, with an overall persona of courtesy and manners (smile's, please and thank you's).

My story:  I flew in from Colorado to tend to my grandpa for a few weeks while sister goes on vacation (the OG caretaker).  Good 'ol grampy is a... You guessed it.. Diabetic!

I told this lady that grampy sent me to get a few monitoring items for his disease.  Asking about testing strips, monitor, and of course the syringes.

In order to address these items nonchalant I asked about pricing's how he (grampy) would use it, brands, I would looked shocked at times due to some of the items pricing.. they legitimately are expensive..!  Even brought up how, and if, insurance could help cover the pricing on these item's..  Wound up setting up the ploy by purchasing the monitor and strips to cover needing the syringes, ultimately. The monitor was $17 and some change... The strips were $16 and some change, the rigs 2x $2.50 10 ct... I paid cash so I will most definitely be returning the monitor and strips tomorrow.

Goin' to go score a 30.

and I'm set for tomorrow when I return the monitor and strips. ;)

Thanks for the read y'all.  Maybe this could help some of y'all in a time of need.


P.S.  Of course dont attempt any of this while looking like a junkie...  Your odds will drastically decrease.  When I did bring up the syringes I did notice the nurse briefly looked at my arms.",1508559422.0
77rcsu,https://www.reddit.com/r/opiates/comments/77rcsu/high_for_24_hours/,2,https://redd.it/77rcsu,RoccBois,High for 24 Hours,"So uh guys, I haven't taken any opiates for around 2 months. Yesterday I had 100mg of tramadol and only 30 mg of codeine. 24 hour euphoria/drowsiness and nodding? What the fuck? ",1508559221.0
77rcic,https://www.reddit.com/r/opiates/comments/77rcic/shit_want_to_smoke_but_i_have_two_holes_in_my/,11,https://redd.it/77rcic,Kinda1OfAKind,Shit... want to smoke but I have two holes in my mouth...,"I told myself I was going to chill out and not smoke for a while while these holes in my mouth heal (got 2 wisdom teeth out).





However... fuck.... these pills kinda suck and I am just hankering for a smoke. Any ideas? I was thinking about covering the holes somehow but, I am not sure how that would work.




The thing is I can't get an infection or anything cuz I have another tooth that needs to get a crown and they won't fix it until my holes heal.



So come at me with your best dope smoking ideas with holes in my mouth.",1508559119.0
77r80n,https://www.reddit.com/r/opiates/comments/77r80n/is_there_a_type_of_heroin_that_can_be_snorted_and/,36,https://redd.it/77r80n,notlea,Is there a type of heroin that can be snorted and smoked?,Or should I just risk it and go with fent?,1508557468.0
77r7so,https://www.reddit.com/r/opiates/comments/77r7so/trying_to_cop_with_no_car/,12,https://redd.it/77r7so,SeednAnWeedn,Trying to cop with no car.,"Anybody else without a ride and live in a city with no public transport?  Used to have my license where I could borrow somebody's car, but everyone knows I lost it so that's out. Luckily I got a dude that will deliver from the big city I live near, but he bitches about it everytime even though I through him extra. How do you guys go about picking up with no ride?


Edit: Praise JJ!  He ended up dropping it off. Ive only had cheaper Grey dope, but he only had some tan this time that was a little more expensive but some fire at least",1508557390.0
77r2fj,https://www.reddit.com/r/opiates/comments/77r2fj/oxy_xanax/,7,https://redd.it/77r2fj,DizDiq,Oxy + Xanax,Any ways of potentiating? Which one should be taken first? Whats a good amount for a good nod? Got my hands on a few mboxes and half roll of 1mg fb xans. And im.tryna get lit the right.way :),1508555395.0
77r1g3,https://www.reddit.com/r/opiates/comments/77r1g3/best_way_to_test_your_h_to_see_if_its_good/,16,https://redd.it/77r1g3,DreamOfTomorrow,Best way to test your H to see if it's good. Besides a test kit,,1508555031.0
77r1c8,https://www.reddit.com/r/opiates/comments/77r1c8/4_percs_10s_tomorrow_its_been_a_couple_months_as/,13,https://redd.it/77r1c8,BongChong420,"4 percs 10’s tomorrow. It’s been a couple months. As usual. Has anyone experienced a high with only 5mg when you had no opiate tolerance? Because if so, I might chip with these pills for a while. And yes, I know chipping is bad and can lead to addiction, I know the risk, but I continue to proceed...",..with caution :3,1508554988.0
77qz99,https://www.reddit.com/r/opiates/comments/77qz99/lady_luck_is_one_cruel_fickle_mistress/,14,https://redd.it/77qz99,ZachGreeen,Lady Luck is one cruel fickle mistress,"It's been a few weeks of forced tapering just enough to get by. Couple points here, couple points there. Finally the big money comes in and I've got to wait for my partner in crime to get off of work before we can pick up. That's fine, I can wait, it's only fair, right. Then on her way to work the car breaks down? For real? Man oh man, what to do now? Here's to hoping I can get her home, here's to praying we can get a delivery that late. I'll keep you guys updated. ",1508554222.0
77qz2s,https://www.reddit.com/r/opiates/comments/77qz2s/just_saw_my_life_flash_brothers/,50,https://redd.it/77qz2s,meth-n-dildos,Just saw my life flash brothers,Brother I just got out of country and was almost on my way right back tonite. Was in a car making a run with some friends and got stopped and searched. Had the ice in one of those fake hollow coke cans..   brothers three officers picked that can up and moved it and I almost ran...    Got lucky and they did not think to try and open it... Talk about lucky..   probably would have done 10 years on that shit. Be safe brothers and carefull who u ride with. God was with us tonight and let rookie cops stop us instead of experienced dope hunters ,1508554153.0
77qygy,https://www.reddit.com/r/opiates/comments/77qygy/junkie_jesus_is_real_yall/,4,https://redd.it/77qygy,hitmansgirl,Junkie Jesus is real y'all.,That's it. ,1508553953.0
77qt2j,https://i.redd.it/ram8c5j9e3tz.jpg,87,https://redd.it/77qt2j,SmokedOutLocedOut_,When being miserable finally comes to an end 😋😍🔥 [BTH PORN],,1508552057.0
77qsv4,https://i.redd.it/clw2nzq1e3tz.jpg,5,https://redd.it/77qsv4,Gelowkzz,Finally!!!,,1508551985.0
77qq1o,https://redd.it/77pgvk,0,https://redd.it/77qq1o,viledenial,"Weekly Friday Playlist - 10/20/17[ohyeshedid] r/WNOD (Idndntdoit) (it was u/waiting_with_lou *sad boy*) but its lit and full of <gang shit> so come over when youre sober, or not",,1508551035.0
77qq12,https://www.reddit.com/r/opiates/comments/77qq12/most_recent_overdose_my_lifesaver_passed_today/,43,https://redd.it/77qq12,rosary_noose,"Most recent overdose, my lifesaver passed today.","3/14/16. Pi day. Math nerds rejoiced, as I'm in a coma in ICU in a New Hampshire town I hadn't lived in for over a year. 

A few days earlier I had had enough. I was coming up on 7 months sober. 7 months of feeling every feeling and hyperfocusing on every thought. 

I sat on my sloppily made bed in a halfway house. The nicest halfway house in the city many said, as if I gave a shit then. When I showed up at the house my first day I thought this was it. I was going to finally give sobriery an honest attempt. 

I get a text, my friend wants to borrow 100 dollars. I know it's for dope. She lives in Dover, NH and took me in a couple years before in the middle of winter when I was sleeping in my car. I told her I would Western Union it in a little bit. Something about knowing the money was going to dope though switched a switch in my brain. Next thing I know, I'm on a train with everything I could pack in my bag. 7 months clean and today I will finally get some relief. 

I get picked up by her in Lawrence and we go cop. I get my 2 grams and we make the hour drive back to New Hampshire. I hadn't even asked her if I could stay there again. I guess I just assumed she would let me, and she did. I fucked up, but there's no turning back now. I lost my bed in the halfway, nowhere else to live, and a few grand in my bank. Might as well ride this out. 

I made it through the first 2 days, being responsible with tester shots. Then comes the third day. Im out of dope, as are my friends. So they arrange a ride to go score and are en route. So I'm back at the house with her boyfriend so we decide to kill some time. Go get a 12 pack and check out the record store for some cheap vhs tape to watch. Fugazi live tape, 50 cents, sounds good. 

Time flies, and next thing you know the tape is over, beer is gone, and dope is in hand. It must have been the alcohol which lead to my next poor decision to do a much bigger shot than normal. I do the shot. Then decide to go upstairs and lay down which was normal. I fell asleep, and for some reason this Ryan decides to check on me. He goes upstairs and I'm doing the death gargle. Panic ensues. They give me 4 hits or narcan to no avail. I now have two dudes and a girl dragging me down the stairs to the car. Accidentally dropped me and gashed my head, the doctors thought I had a broken neck. They drop me off at the hospital and I don't wake up til 5 days later with my parents in front of me in shock. They were told I had a 50/50 chance of having any functionality when I woke. I woke up totally normal. 

I barely knew the kid who decided to check on me. But if all this happened even 5 minutes later I wouldn't be here today. I just learned that he overdosed and passed away last night. I wish I could have been there to check on him. Just makes me wonder what I did to be lucky enough and why me and not him. 

Stay safe my friends. Don't use alone. 

Don't know why I wrote this all. I'm a terrible writer sorry. 
",1508551027.0
77qpl1,https://i.redd.it/0g9jw37pa3tz.jpg,7,https://redd.it/77qpl1,SmallDickLongBars,"Oxy, dab, xans I'm Gucci",,1508550858.0
77qm5p,https://imgur.com/a/IaSky,12,https://redd.it/77qm5p,PharmsPlug,Wut R these?,,1508549728.0
77qlto,https://imgur.com/SEBISNn,14,https://redd.it/77qlto,hatrix216,Some opium my friend picked up,,1508549615.0
77ql26,https://www.reddit.com/r/opiates/comments/77ql26/remembered_my_password/,26,https://redd.it/77ql26,IVMorphiend,REMEMBERED MY PASSWORD!,"I'm in a lockdown rehab facility, guys- and I'm BORED. I want some people to get at me. You know what it's like. So hollaaaaaa",1508549374.0
