8ombgo,https://www.reddit.com/r/opiates/comments/8ombgo/question_about_shooting/,5,https://redd.it/8ombgo,Cremedelapeng,Question about shooting,"TLDR is shooting up the beetle from smoking heroin as safe as just the powder even tho it's dark and cloudy?

So most of the time I smoke my gear (#3 powder as i live in the UK) and when I get to the end of my stash I like to break off bits of the beetle and shoot them. The end result in the pin is really dark and cloudy (no bits floating in it) and I was wondering if this is still as safe as just dissolving the powder and shooting that?

I still get a buzz off it and theres no problem when I actually shoot it but I just wanna have as much knowledge as possible. 

Also I do the same thing with my tooter; I gather up all the residue in it by smoking it all into one lump then break it off the foil and chuck it in my veins. Is this safe?

Cheers.",1528157579.0
8omayg,https://i.imgur.com/ae9USwS.jpg,17,https://redd.it/8omayg,TheRapturee,"Pay $40 for this half g, looks small tho, what y'all think",,1528157469.0
8omaxi,https://i.redd.it/3vk7xnpxq2211.jpg,16,https://redd.it/8omaxi,Darthigiveup,Sober 2 months. This now gets me high.,,1528157465.0
8om8ud,https://www.reddit.com/r/opiates/comments/8om8ud/finally_tracked_down_some_xanax_bars/,6,https://redd.it/8om8ud,Carlos_Danger11,Finally tracked down some Xanax bars,And I’m sitting pretty! Now I can finally do some of my 125 roxi 15’s I’ve had laying around,1528156935.0
8om70n,https://www.reddit.com/r/opiates/comments/8om70n/the_fucking_itch/,10,https://redd.it/8om70n,loleif,The fucking Itch,"I've been on and off opiates for about a year now, recently did dope for the first time. I have to say I feel like other opioids I've done were way more recreational, but H is the only thing I can get my hands on rn.

Anyways I get a lot itchier on dope than on other opioids and I don't really mind the itch itself, but all the scratching really fucks my skin up.

Do you know anything besides DPH to combat the itch?",1528156470.0
8om6ip,https://www.reddit.com/r/opiates/comments/8om6ip/at_what_temperature_does_morphine_begin_to_break/,6,https://redd.it/8om6ip,MorphiniusMaximus,At what temperature does morphine begin to break down?,Does anybody know what temperature morphine can be heated up to without damaging it/reducing potency? Thank you.,1528156350.0
8om4hz,https://i.redd.it/tuz3goqem2211.jpg,25,https://redd.it/8om4hz,dopevshope,When all the good things come to an end :(,,1528155872.0
8om09b,https://i.redd.it/hid17v7fj2211.jpg,23,https://redd.it/8om09b,doobiousdoob,I thought I found a hell of a come up....but it was empty. I would have sold it,,1528154880.0
8olwmw,https://www.reddit.com/r/opiates/comments/8olwmw/how_long_should_i_be_sick_for/,12,https://redd.it/8olwmw,pr3sidentDump,how long should i be sick for :(,snorted about 3mg suboxone last night.. a dose ive had twice before with 0 issues whatsoever .. and ive been puking ever since.. full 24 hours now cant hold down anything. i cant tell if im sick from this shit or if i have the flu lol any tips,1528154056.0
8olucc,https://i.redd.it/6fqkhofif2211.jpg,15,https://redd.it/8olucc,antron1313,Sad sight,,1528153532.0
8olrzm,https://i.redd.it/n291fovsd2211.jpg,16,https://redd.it/8olrzm,Pandamania07,Little mix for some pill porn,,1528152985.0
8olp7u,https://i.redd.it/joy8p05wb2211.jpg,39,https://redd.it/8olp7u,PandaBroads,:-),,1528152319.0
8olowb,https://www.reddit.com/r/opiates/comments/8olowb/need_a_remedy_for_vomitting_while_dope_sick/,5,https://redd.it/8olowb,goldieloczz9,need a remedy for vomitting while dope sick, so fam basically i tried to quit heroin and i failed traumatically; i basically went like 28 hours without it without sleeping either took a little bit of kratom and took about 1 mg of suboxone bro i failed miserably around like an hor ago i relapsed i started puking shit out it's funny cuz there was nothing in my stomach but shit jus kept coming out like literally i took 6 shits in less than 3 hours. i mean i could handle the shits but pooking is a big no no for me; i cant believe this shit like another cycle of lying and cheating and procrastination. someone please help me how do i stop puking when im withdrawing ,1528152238.0
8olelq,https://www.reddit.com/r/opiates/comments/8olelq/snakes/,27,https://redd.it/8olelq,iced_teainmysyringe,snakes,"WHY? Opiates don't release you from responsibilities! You CAN'T SAY THE PAST DIDN'T HAPPEN TO SLITHER OUT OF DEBTS. I did another user multiple ""get well"" favors last  week. Now I also have been forced into arguing- explaining why he needs to get me back. Today, I'm being shit on by him and pulled into further BS for helping this selfish prick out. I now have to fight this POS over 80 bucks. Is it wrong for me to beat his ass if he's physically bigger? Dumbass has bursitis in his hip and can't hit with his dominate hand  from another injury. I tried everything to be reasonable. He could pay me back right now if he wanted to. If you're like this kid and think people are around you for the sole purpose of squeezing shit out of them, please change. I've let this guy slide too many times. If someone helps you out, you are obligated to return the favor gratefully. Heroin addiction doesn't excuse human decency. Excuse me though, I'm going to put this kid(29) in his place. Reluctantly I'll add, but the satisfaction upon fist to face impact is a primal thrill I am not above savoring. Update tonight - He also told my plugs I was arrested and acting shady to make them not answer so he could middle for a mutual acquaintance that always calls me first over him. I only middle if People call when I'm going for myself and they are on the way. He is everybody's last resort because he is always shorted, droping some or accidentally making mistakes verbally. Obviously the kid is being a snake so nobody calls him. I could go on, but right before I was last with him, he bragged about burning this girl  to me. Found out the blame landed on a super nice guy who was the ride. This will be revenge for every friend who looks out for the people close. Revenge for every shit talking spoiled wannabe thug. If I'm the ass, it's worth it. Last resort folks, never fight if there's another way. It's time.",1528149903.0
8olbvn,https://www.reddit.com/r/opiates/comments/8olbvn/deciding_to_quit_with_legit_pain/,7,https://redd.it/8olbvn,redditoilpenhead710,deciding to quit with legit pain?,"so i got some legit pain had a semi successful surgery still got nerve pain and damage tho. anyway he’s weeningg me down which is good for my neck to recover etc but he wants me all the way off no matter what and said i gotta see another doc to continue. i guess that makes sense but I just want to have the convo with him like yeah he’s pushing me to quit bc the epidemic but is it in my best interests? I could be pain free and have a good life with opiates but i’m really not sure what to do. I want to trust this doc but he doesn’t seem to think anyone should be on opiates haha, he isn’t really a pain doc just the my main doc that temp took over pain mgmt when i switched. so i get it but shit i may go back to pain management for quality of life just want to give this healing shit a shot. 

what you guys think he’s a good doc i dunno if it’s really in my best interest or not since the surgery wasn’t 100% successful and i got pain and nerve issues and shit idk

also they started me at age 20 so pretty sure my brains fucked. how fucked is the question 

I want to be clean but I want to have good quality of life more",1528149317.0
8olach,https://i.redd.it/y26ip9ot12211.jpg,23,https://redd.it/8olach,itshairybaby,what are these i know the Oxys obvi but the other crap lmk worth even having? Drop some feed back fammm,,1528148986.0
8ol1xg,https://i.redd.it/ilv640yow1211.jpg,14,https://redd.it/8ol1xg,OxyTheOxen,Finally!! Waiting Since Friday...(50) K57•20mg OXY & (2) OP 80s!! Already Ate 5 & Sniffed 5 To Get Straight...Happy Nods Kiddies!!,,1528147202.0
8okz47,https://www.reddit.com/r/opiates/comments/8okz47/i_think_i_did_it_i_think_i_am_done_abusing_opiates/,14,https://redd.it/8okz47,avon__nova,I think I did it. I think I am done abusing opiates.,"I started seeing a pain management doctor in October of 2016. I have a deformed vertebrae that has caused a lot of intense lower back pain, bulging discs in my neck from being rear-ended a few years ago, and chronic kidney stones. I walked out of my first appointment with a script for percocet that changed my life. Suddenly I was able to get about eight hours a day pain free, and that drastically improved my quality of life! I was happy, carefree, my anxiety was lowered, and life felt good. Coupled with epidural injections, trigger point injections, lidocaine patches, and special compound cream, my pain was managed and for the first time since I was about 15 I felt *good*. 

The first few months were easy. I would have to ration the last few days of pills, but in general did okay staying on my prescribed schedule. Unfortunately, last summer I found out my husband was cheating on me, left him, and quickly slid into a dark place. I didn't work for a few months. I started redosing more often, just trying to escape from my misery and feel a little warmth. My scripts were only lasting half the month. I started looking in to alternate sources for meds, and started supplementing my script with any tramadol, codeine, or DHC I could get my hands on. This worked well enough.

Then around the new year, the scripts started lasting ten days... so I went to the onions to score some more of my DoC, oxy. My dose never ballooned too high-- I don't think I ever took more than 30-40mg of oxy a day, which I know most people here would consider relatively low. I've seen two of my siblings battle with IV heroin addiction and I know how much harder it could be.

I ran out of my May script in 8 days. I knew this would be a miserable, miserable experience, so I decided to order a single Sub strip and use that to get off. I was able to cut the 8mg strip into increasingly smaller slivers and had a very comfortable nine days tapering down from that. I took my last dose at 7am yesterday morning. I know it has a long half life, but I'm pretty achey today. Luckily, I had today off (and planned this so I'd be off today in case things were really bad). I have benzos for anxiety, but never found myself abusing them. I'm going to be really mindful about how I take them over the next few weeks to make sure I'm not swapping one thing for another. I'm also prescribed a low dose of adderall for treatment-resistant depression, but again, haven't ever desired to take a higher dose. 

I'm due for a refill of ""the good stuff"" next week and I'm not going to ask my doc for it. I wish I could trust myself to keep it around and use it ""as needed"", but I know myself and I'm not at that point (and not sure I ever will be). I kept my prescription on the DL from friends and family (because of my siblings' larger-scale issues with opiates, I didn't want them to worry) and don't have anyone I could trust to hold them for me for times of legitimate need. 

I'm hoping, hoping with all my heart this ends my time abusing opiates. Opiates saw me through tons of pain, an unhappy marriage and divorce, two rounds of sepsis, and a lot of heartache. But I don't want this to be my life anymore. I'm young (mid-twenties). I have a decent job and it's looking like I'll be promoted to manager within the next few months. I'm sick of my bank account being under $20. I want to get my own place, a car made in this century, and maybe put a dent in my student loans?? I want to be able to buy my pets as many treats and toys as they deserve after seeing me through all this pain and loving me unconditionally. 

I was never an active poster here, but I came here a lot to read what other people have been through and I'm grateful for you lovely souls. I'm not sure I could do this without reading the testaments from people who have successfully made it off. Thanks.",1528146611.0
8ol627,https://www.reddit.com/r/opiates/comments/8ol627/birthday_dope_sickness/,14,https://redd.it/8ol627,liquidassassin1,Birthday... dope sickness,"It’s my birthday today and we are having a huge family thing for me, only problem is I’ve been without for about 2 days, have bronchitis, and I’m withdrawling... fuck my fucking life. Someone be my junkie Jesus....",1528148075.0
8okxc7,https://i.redd.it/zbjukokut1211.jpg,3,https://redd.it/8okxc7,phil_summers,ALV196 oxy porn- my favorite brand Alvogen,,1528146255.0
8okten,https://www.reddit.com/r/opiates/comments/8okten/safe_ways_to_transport_after_copping/,44,https://redd.it/8okten,i-am-not-your-foot,Safe ways to transport after copping?,"Hey guys, I wanted to get the community's input on safe ways to conceal things in the car in the event that one were to be pulled over after copping. Hoping to get some feedback on my latest idea as well. 

I'd love to be able to simply swallow what I have but I would rather not put my life in danger by swallowing \~1.5\+ grams of heroin that could reasonably be adulterated with fentanyl etc.

Recently I've requested that my dealer not put it in a bag, which always works fine since it's rocked up, and my plan in case I were to be pulled over would be to discard the rock\(s\) in a soda cup and allow them to dissolve. That way I could allow the officer to search my car, and I doubt anyone would look to a McDonald's cup for drugs. Am I correct in assuming that or is that more common than I think? I read in another thread from a few months ago about someone who was caught after discarding that way, and they were charged for the weight of the water bottle. I replied asking for more information and I'm hoping to hear back about how the event went down. 

A funny and probably good suggestion I also read was to have a bag or container of some sort with sex toys in it, and to hide it in there. The idea being that the officer likely wouldn't want to go through another person's sex toys as that usually embarrasses people.",1528145483.0
8okreq,https://www.reddit.com/r/opiates/comments/8okreq/anyone_had_increased_appetite_weight_gain_on/,16,https://redd.it/8okreq,whatself,Anyone had increased appetite / weight gain on buprenorphine?,"Starting buprenorphine soon (subutex not suboxone, the one without naloxone), I refused methadone cause I've heard it makes you fat and I'm terrified of weight gain, I'd rather stay a junkie and die than gain weight (edit: I've just re-read that and it sounds really neurotic oops, probably should have phrased that more subtly)

But I'm really worried subutex will increase my appetite like methadone apparently does? I had to come off seroquel even though it really helped my mental health cause it was making me binge eat like crazy, the thought of going on another med that gives me such a huge appetite makes me wanna throw up so can someone tell me if it's likely to happen with subutex?",1528145101.0
8okq89,https://www.reddit.com/r/opiates/comments/8okq89/empty_stomach_question/,17,https://redd.it/8okq89,RuffSamurai,Empty stomach question.,"Aye what’s gud fam it’s yo boi Yung Lil Penis back again spitting some mad fire questions.

If I ate one and half a soft pork tacos and some chips and queso at 1pm and I want to dose some pills at 6pm would my stomach be empty enough to get the most out my pills?

Thanks again yungins. ",1528144875.0
8okq7c,https://www.reddit.com/r/opiates/comments/8okq7c/first_coke_shot_in_a_year/,7,https://redd.it/8okq7c,His_Dudeness_94,First coke shot in a year,"I used to go hard with Cocaine three or two years ago. Then I had a bad experience; I semi-OD'd and thought I was gonna have a stroke, my entire arm was numb and tingling and I puked so hard while my heart beat its way out out of my body.


So I was ""sober"" as far as Cocaine is concerned, horrible cravings though. Today, I copped some pharms. Out of the blue, connect asked me if I fuck with Cocaine. Umm yes?! So we go to his house and just plop a huge pile of coke on the table.


So the first hit....it was fucking heavenly. Does anyone else just completely after freeze slamming coke? There was just utter silence. I know the cliche is the slow ""powder gets you hyper"" but on IV coke that's not the case. So it seems you hear better on coke?! 

After be while we dare speak. We haven't had conversations these personal ever, but in-between poking every inch of your we were pretty talkative. The vein search was fucking terrible. Desperately you try to get the hit in before the blood congealed


This is a Lyrica-fueled shitlost, but maybe some IV coke heads an relate. Especially the calamity that beset me today: my last hit hongealed. I opened the syringe (and the other ones where congealed too) and ended up shooting blood with at best achieving a placebo with. I'm disgusted with myself",1528144872.0
8ok9jd,https://www.reddit.com/r/opiates/comments/8ok9jd/valium_prices_or_trades/,8,https://redd.it/8ok9jd,flsflipit,Valium prices or trades,Is valium \(2.5mg diazepam\) a commonly traded thing for dope? or should I sell the valium and then buy dope? Looking for experiences please,1528141531.0
8oke2p,https://www.reddit.com/r/opiates/comments/8oke2p/fentanyl_25mcg_help/,10,https://redd.it/8oke2p,sedatedxx,Fentanyl 25/mcg help,"Ok so I have a decent tolerance to opiates. I usually do about 2 8mg dilaudid a day bc i have chronic pain and I can't live In pain.

ANYWAY I'm gonna be out of them for a few days and I can't go into WD. My Xanax script isn't gonna be ready for another 3 days so my friend is gonna give me one of those patches.

Will I be ok? I know there is a risk with these but I have a decent tolerance and it says it lasts for 72 hours which is enough time til I re up.

Also I think these are the ones you can't cut up.

Any help would be appreciated 

Thanks!",1528142440.0
8okc6u,https://i.redd.it/l8kgjuldh1211.jpg,23,https://redd.it/8okc6u,lurcocet,Nostril Savers :),,1528142052.0
8oka1o,https://www.reddit.com/r/opiates/comments/8oka1o/a_good_friends_body_was_just_identified/,37,https://redd.it/8oka1o,snail__,A good friends body was just identified.,"At a guys house in my city a few hours ago. Her and two other girls had been kidnapped and killed, then buried at this dudes place. I had driven by a few times the past couple of days and they have like 5 cop cars and two giant ""mobile crime unit"" truck/trailers there. Every time I've seen it I just thought ""wow that's fucked up, I feel bad for whoever they were"". Didn't realize it would be a good friend of mine. And I don't even have a shot to numb the pain. I'm too lost right now. ",1528141633.0
8ok9xh,https://www.reddit.com/r/opiates/comments/8ok9xh/worried_about_addiction/,3,https://redd.it/8ok9xh,hermlet,Worried about addiction.,"Roughly one year ago, I used codeine because paracetamol was ineffective. It felt like a hymn had been sung through my blood. Increasingly, I found more and more excuses to use it. I reached the point where I didn't bother to find excuses and took it because I wanted to. This didn't last long because I was able to step back and realise that it was becoming an issue, so I stopped there and then. Now, I find myself wanting to take it. It's been a while since I've felt this way and I don't know why I want to take it. I know that I shouldn't take it, but the desire is overwhelming. I really don't want to take it, but I want it. I'm worried that this will become an addiction. If you have been in a similar situation, what did you do?",1528141607.0
8ok9p0,https://www.reddit.com/r/opiates/comments/8ok9p0/why_does_heroin_do_nothing_but_make_me_feel_sick/,1,https://redd.it/8ok9p0,InTheLatrine,Why does heroin do nothing but make me feel sick?,"I have a long history of opioid use, though I stopped daily use and strong opiate around 3 years ago. Now I only use Tramadol or Hydrocodone very sporadically to scratch the itch when needed. Something has always bothered me, however. I went through a period of about 1.5 years where I primarily used heroin due to sources of pharmaceuticals being cut off. During that time, I only snorted it, and while I got extremely strong effects, none of them could be considered positive. I got a heavy nod, a feeling of dysphoria \(basically the opposite of euphoria\), sometimes nausea and really very little else. I usually felt like complete shit when I would use it. My opioid of choice before that was oxycodone, which is just the best feeling ever, IMO. I remember oxycodone making me feel excited but relaxed, and full of this amazing energy. Heroin felt like I took a handful of shitty muscle relaxers and sleeping medicine. Keep in mind that this is over the course of more than a year and from several difference sources.

What's going on here? Is this just the way heroin is and I don't like it, or do I have some abnormal brain chemistry that makes me feel it differently from others?",1528141564.0
8ok3ov,https://www.reddit.com/r/opiates/comments/8ok3ov/ive_had_a_mild_stroke_and_didnt_even_know/,16,https://redd.it/8ok3ov,jaxsonwayne4,Ive had a mild stroke and didn't even know!!!,So the other day I fell out mixed tramadol and meth well little did I know I had a mild stroke sometime and didn't even know it wtf,1528140377.0
8ok2j6,https://www.reddit.com/r/opiates/comments/8ok2j6/question_for_darknet_users/,27,https://redd.it/8ok2j6,Staying6under,Question for darknet users.,"So ive made 2 orders from a certain vendor so far. The first one came in 9 days after being shipped, but its been 14 days for this second order and still nothing.

My question is, do any of you dnm users have experience with shipments from europe coming in late? Do you guys think it was intercepted or maybe it's  just being held by customs for a while? Thanks guys.",1528140140.0
8ojshd,https://www.reddit.com/r/opiates/comments/8ojshd/oxynorm_oral_solution_10mg/,6,https://redd.it/8ojshd,Denzel94,Oxynorm Oral Solution 10mg,What's the crack with this lads anyone here tried it got a 250ml bottle of the stuff,1528138068.0
8ojrao,https://www.reddit.com/r/opiates/comments/8ojrao/hard_to_hit_veins/,13,https://redd.it/8ojrao,ddellal,Hard to hit veins,"What to do when your veins are shit to shoot up? I'm new to this so it's not because of using, they just don't appear properly and when I hit some random vein from my arm (which I know it is bc is green) I try to drain a little bit of blood to be sure and I can't, the blood isn't there or some fucked up shit but when I take the needle out it starts to blood up a little bit 
What can I do to hit the vein and be sure? Can I shoot in the muscle too or no?",1528137823.0
8ojp3j,https://www.reddit.com/r/opiates/comments/8ojp3j/high_on_suboxone/,10,https://redd.it/8ojp3j,RightHandLove,High on Suboxone?,I have an 8mg sub pill that I cut into 8ths. How much will get me high?,1528137390.0
8ojnqs,https://i.redd.it/na7iflwn21211.jpg,27,https://redd.it/8ojnqs,cloudninesurfer,[Pill Porn] 180 Oxycodone 5mg,,1528137105.0
8ojdqq,https://www.reddit.com/r/opiates/comments/8ojdqq/reminder_for_those_of_you_getting_routine_std/,1,https://redd.it/8ojdqq,Helperfella6,"Reminder for those of you getting routine STD screens (HIV, hep c)","Ask your doctor to also test for HTLV-1 and 2 antibodies. Recently researchers and doctors have been sounding the issue, and a woefully significant majority of medical professionals ignore or are not even aware of this retrovirus. Blood banks are required to screen for it, but harm reduction literature and guidelines rarely include it in their information to patients and doctors. 

It is important to raise awareness of it and push for widely available testing and knowledge of this virus. In the next few decades medical research will focus more on viruses because we are finding they are associated with a large number of cancers and chronic illnesses. 

It is an interesting area of research for me, and the first thing that I recognized about this particular retrovirus is how inadequately equipped and prepared humanity is for dealing with it. There are a number of reasons due to virology pathology as well as social and political historical reasons it is under recognized, but the important thing is to get people aware so we can start working on more effective treatments. It was the push for awareness with HIV and the devastating effects it had in a relatively short time which led to treatment developments. Because the time between infection and severe illness with HTLV is so long, and because its discovery was overshadowed a short time later with the discovery of HIV, treatment and drug developments have lagged behind where they could and should be.


Really, we could see effective immunizations against most retroviruses become available in our lifetimes, and effective cures available for those already infected. There is exciting research into genetic resistance of these illnesses, and how to transfer them into other humans via gene therapy. My small organization is taking research done by other medical startups and expanding on it, I hope this message serves as a small introduction to these issues and helps you in some way in achieving healthy outcomes in your life regardless of personal lifestyle choices. 
",1528135144.0
8oji98,https://www.reddit.com/r/opiates/comments/8oji98/snorting_vs_smoking/,8,https://redd.it/8oji98,ZeusCarver00,Snorting vs smoking?,"This question has probably being asked a thousand times over but I've been smoking for about 6 months and tolerance has built up big time, not getting that feeling of what I usually get from smoking so just wondering if I was to snort would it make a difference? Or do I just need to smoke more? Anyone know the bioavailbility of smoking and snorting?

Thanks in advance!",1528136016.0
