270uvn,https://www.reddit.com/r/opiates/comments/270uvn/is_it_true_that_the_dea_is_getting_rid_of_all/,7,https://redd.it/270uvn,allallala,Is it true that the DEA is getting rid of all Opanas over 10mg??,"I was just told this by a friend, is this true??  What about the people prescribed 30s and 40s for legitimate pain?  That sucks yo.

Anyone else hear about this?",1401621993.0
270pk9,http://imgur.com/tueKNoc,17,https://redd.it/270pk9,blue_bliss,Been clean for 5 days now but I still hustle..,,1401613698.0
270oi4,https://www.reddit.com/r/opiates/comments/270oi4/taper_off_repost_from_redditsuboxone/,4,https://redd.it/270oi4,klow1356,Taper off . Repost from reddit/suboxone,"Hey guys , So im 9 months sober and am finally tapering off. I was on 16 mg a day and now doing a 90 day taper , 12 mg for 2 weeks then 8 for 2 weeks 6 for 2 weeks 4 for 2 weeks then 2mg for about a month. Im really nervous and will be at 6 next week. For now its fine but im nervous to go to 6. I almost just want to cold turkey and not deal with it for 2 more months. Are there any natural vitamins i can take? Im thankful for my sobriety and i know i will do whatever it takes to be free ya know? Also i was taking the pills and my pharmacy gave me strips for the next 2 months. Is it any different? 

Thanks for listening guys!! xoxo ",1401612207.0
270lr5,https://www.reddit.com/r/opiates/comments/270lr5/the_painful_irony_of_getting_clean_and_then_caught/,16,https://redd.it/270lr5,ImPlayingTheSims,The painful irony of getting clean AND THEN caught.,"I'm renting a room from a cool group of people. I relapsed after years of being off H. I dindt use too much, but it was becoming a problem. I cold turkey'd it and flew outa state for a week.

I came back tonight to find my room cleaned and organized, and my box of rigs n crap exposed.

They were all asleep when I got home.

I dont know what I will say tomorrow.

Cruel, cruel irony/karma sometimes.

Anyone else have experience in dealing with these kinda situations?

I really like these guys and cant lose my room here. I dont know what I'd do without them alone in a big city and recently clean.",1401608075.0
270lp1,https://www.reddit.com/r/opiates/comments/270lp1/question_about_reusing_old_rigs/,7,https://redd.it/270lp1,Rekivk,Question about reusing old rigs,So i had used a rig a few days ago/a week ago. I didn't clean it out after i used it and just left it in my drawer. Fast forward to today where I had no new rigs so I decided to reuse the one from a few days ago. There was dried blood in it so I drew up ethyl alcohol solution a couple times and cleaned it out. Then I drew up water to rinse it out a couple times. Then i drew up the dope and shot myself up with it. I was wondering if what I did was dangerous and if I can catch any sort of disease or bacteria? It was my own dried blood in there but the dried blood was all cleared out after rinsing the rig with the ethyl alcohol solution. Anyone know if i'm good or if I should now go to the doctor. I know what I did was stupid but I was desperate and had no clean  rigs and couldn't afford a new pack since I had just spent all the money i had on dope,1401608011.0
270l42,https://www.reddit.com/r/opiates/comments/270l42/so_my_main/,3,https://redd.it/270l42,Oxyandbars,So my main,"Dealer had to go rehab. 
He started fucking around and gettingfucked up on his own product and fucked his money all up. So his supplier cut him off until he went to rehab. 
Luckily I just started chipping just once or twice every two weeks   
Still pretty shitty though because he was my only connect that is always 100% 
But I guess it will help me to make sure that I stick to just chipping. ",1401607222.0
270jsk,https://www.reddit.com/r/opiates/comments/270jsk/rest_in_peace_pludoh_alias/,19,https://redd.it/270jsk,opanasinmynose,Rest in peace Pludoh (alias).,Died of an overdose this morning. Fuck man. ,1401605447.0
270g98,http://imgur.com/WeBPuhd,26,https://redd.it/270g98,wiggitizer,Some of Seattles Best (D0pe P0rn),,1401601386.0
270eys,https://www.reddit.com/r/opiates/comments/270eys/cotton_fever/,10,https://redd.it/270eys,Heylooktheresastar,Cotton Fever,"My boyfriend got cotton fever, we used clean needle, clean spoon, clean cotton, but the water has been sitting out we used, but I didn't get it. He's shivering, head ache, throwing up a lot, says he feels like he has the flu. It does sound like cotton fever right? He hasn't shot up many times and he's just really freaked out. Just wondering if anyone has any advice or anything?",1401600048.0
270b70,https://www.reddit.com/r/opiates/comments/270b70/can_ants_get_high_off_cocaine/,44,https://redd.it/270b70,myantniggaz,Can ants get high off cocaine?,"Sorry this isnt strictly opiate related (or at all). I like you guys better anyway. The dildos at r/drugs deleted my post. I had a heap of coke lying on my table and an ant rolled up and i smothered him in cocaine. he ran around like a motherfucker. Just tryna get high with my 6 legged friends, ya know?
",1401596516.0
270b62,https://www.reddit.com/r/opiates/comments/270b62/wish_i_bought_drugs_instead_instead_of_spending/,10,https://redd.it/270b62,elstoma,Wish I bought drugs instead... (instead of spending on hobby),"I'm a broke ass punk but Since I ''quit'' drugs, again, I had $2k saved up and burning a hole in my pocket. Don't know why but I was in such a excellent mood and did an impulse buy. A fucking beat up motorcycle. I figure It'll give me something to do.

Now I'm all depressed because I remembered motorcycles are expensive toys. (Oh yeah!, that's why I stopped riding). Now I have to spend more monie$ getting it insured, registered, tax, title and a bunch of little shit to make it decent looking and running.  My drug habit isn't nowhere this expensive.

Fuck me. Fuck Craigslist.  Fuck summertime. I can't even get high to make myself feel better, loll.",1401596482.0
2708tw,https://www.reddit.com/r/opiates/comments/2708tw/bestfunniest_stamp_youve_ever_seen/,33,https://redd.it/2708tw,derkman96,Best/funniest stamp you've ever seen?,Bonus points for pictures :),1401594364.0
2705dz,https://www.reddit.com/r/opiates/comments/2705dz/for_those_who_have_done_both/,24,https://redd.it/2705dz,OxyJay,For those who have done both,Do you prefer the rush from dope or crack?,1401591464.0
2703js,https://www.reddit.com/r/opiates/comments/2703js/virginia_fake_roxy_30s/,19,https://redd.it/2703js,rvafakes,virginia fake roxy 30s,"just a heads up definite fake blue roxy 30s a 215s going around the metro richmond area in virginia.  the logos on them are not engraved well and are a blue white powder mix when crushed.  they burn when snorted.  just be super careful out there.  

edit: picture: http://imgur.com/TykPjLR",1401589835.0
27033v,https://www.reddit.com/r/opiates/comments/27033v/hope_everyone_else_had_as_good_a_day_as_me/,18,https://redd.it/27033v,LsWee_D,Hope everyone else had as good a day as me!!,"So around 2 i went down to Kennsington and copped a bun of some real fire dope and then when i was about 10 minutes from home i get a call from my good friend saying my group of friends was going to a state park in a town about 30 minutes away from our area.  so of course FUCK YEAH im going!!! so we get there and hike up this big ass hill and get a proper ass picture all of us in a picture with a beautiful ass view behind us!  if my friend uploaded it on facebook yet ill put it up here cause god it was soo nice! but yeah i ended up shooting about 6 bags in total while there.  it was such a chill time! 

now im about to go prep up another 3 bagger and get a good nod on before i have to go to bed.  again though i hope you guys had as good a day as i did!  Sooooo what did you guys do on this beautiful Saturday!?",1401589451.0
26zo2x,https://www.reddit.com/r/opiates/comments/26zo2x/subsadderall/,27,https://redd.it/26zo2x,opanapanda,Subs/adderall,Anyone else enjoy this combo?  As of recently it's been one of my favorites.,1401577429.0
26zk63,https://www.reddit.com/r/opiates/comments/26zk63/please_help_my_arm_is_numb_after_a_missed_shot/,4,https://redd.it/26zk63,opthrow11,Please help! My arm is numb after a missed shot.,"I've missed plenty of shots before, but this is weird and I'm scared.  There was no coke or anything besides #4 in the shot and I'm pretty sure I only missed like half the shot. I did the usual procedure for a missed shot: pressure and hot water, but the area around the miss is pretty red and totally numb.  Should I be worried, and is there anything more I should be doing? Thanks for your help",1401574403.0
26zimv,https://www.reddit.com/r/opiates/comments/26zimv/answer_motherfuckers/,17,https://redd.it/26zimv,Calittres,ANSWER MOTHERFUCKERS!,Fuck I hate having money and not being able to get anything...if i had a car id be driving down to the city right now for sure.,1401573250.0
26zg0q,https://www.reddit.com/r/opiates/comments/26zg0q/sub_wdfriend_doesnt_think_itll_happen_to_him/,19,https://redd.it/26zg0q,dizzzzzzzzzz,"Sub WD..Friend doesnt think itll happen to him, whats he in for?","I am on daily maintenance and have been for years and know how to taper and allaround bupe knowhow, but I have a friend who IVs 2-4 mg sub prob 5 days out of the week for at least the past 6 months.  he quit cold turkey yesterday for some reason and doesnt think WDs will hit him becuase he ""hasnt been doing them everyday"". 

after I warned him he needed to taper.  he said he feels fine blah blah and you know the story, I told him wait a week and see how you feel.  i told him its a multi-week process then the mental part starts.

he doesnt know the correct info on subs metabolism and his plan is ""well if i hurt bad cant i just do a D one day and then ill WD 3 days off that instead of a month?""

how much hurt is he in if he actually does this cold turkey?  he really doesnt do them everyday, but id say 5 days a week hes doing them or another opiate IV.",1401571290.0
26zev4,https://www.reddit.com/r/opiates/comments/26zev4/lurker/,9,https://redd.it/26zev4,Followthebleeder,Lurker,"As Dr. Nick would say ""Hiya everybody!""
Been lurking for far too long so I figured I'd finally make my presence known lol. This community is by far the friendliest and most knowledgable group of redditors I've come by. Looking to make some cyber buddies and gain some wisdom in the process. My DOC is dope. Been snorting the shit for almost a year now. Lost a lot of friends over the course of my use. Mostly due to being scummed down quite a bit, but you live and you learn. Well, I'll be sure to post more often and hopefully I can be of some assistance lol. Don't be a stranger and have a great nod!",1401570478.0
26z8za,https://www.reddit.com/r/opiates/comments/26z8za/fentanyl_citrate/,14,https://redd.it/26z8za,Trumpetcase,Fentanyl Citrate,"Hey Reddit, I recently got my hands on some 50mcg/ml - 2ml vials of fentanyl citrate. I use the transdermal type of fentanyl daily, however I am not familiar with the substance in liquid form and I have some questions. Is it possible to smoke the liquid? and if so, how? I have tried smoking it with no luck... It just bubbles and spits. any help would be greatly appreciated. Please skip the whole fentanyl is very dangerous stint because I'm well aware of the dangers.",1401566440.0
26z8wn,https://www.reddit.com/r/opiates/comments/26z8wn/percocet_doesnt_work_for_me/,34,https://redd.it/26z8wn,TacoBellisOpen,Percocet doesn't work for me...,"So I tried taking Percocet for pain today, but honestly it has done NOTHING for my pain and only given me this weird floaty feeling that I'm not a fan of (though I can see the appeal for many).

So I know Percs are opiates + tylenol. If opiates don't work, what are my other options? Is it uncommon for them to not work for pain? Would a stronger opiate, like Vicodin, work better? 

Note, I have a chronic pain condition which might be due to my pain signals being on a hare trigger (in theory, says my doc). So I think that might have something to do with it, because I don't feel like anything ever works for pain management... 

I'm not looking for long-term use at ALL (and don't care about getting high) just something I can take to manage pain for two or three hours when my condition flares up (maybe twice a month). Dr isn't any help so I am doing my own research. 

Thanks in advance!
",1401566397.0
26yykv,https://www.reddit.com/r/opiates/comments/26yykv/dilaudid_after_500_days_dose_prep_and_site/,11,https://redd.it/26yykv,emperorlarsob,"Dilaudid after 500+ days. Dose, prep, and site.","Hey all--

I plan on making a foray back into actual, non-regular opiate again, I think. I'll give you guys a quick breakdown of my history before I ask my questions:

* Former IV heroin user, 4-6 times/week. I've never IV'd a pill before, though I did insulfate oxymorphone a few times a month when I could get my hands on it back then.

* I've been off of heroin for 530 days, as of today

* I haven't used any IV for that time, but I have done some small-time shit like a few oxy 5s, some norcos and vikes, tramadol (sparingly), and a few nights of IR morphine. I've only done those things a handful of times since I got off of dope. I also currently use kratom a few times a week. 

Now, I have been itching for some damn rush recently. I am also subject to Redwood Labs normal 10(?) panel test. I don't think that hydromorphone will show up on a normal opiate screen by RTL, so that's my choice. 

I've some Mallinckrodt 8mg pills coming to me soon. I am excited, but I want to do it right, so I thought I'd come here and ask a few questions to an experienced community that I trust.

* Dose? I'm thinking 4mg (half a pill). [This thread](http://www.reddit.com/r/opiates/comments/26l8kt/dilaudid_no_tolerance/) is what made me decide that. I think that it sounds perfectly reasonable. I want the rush, but I want the high to have some legs. Since I've no tolerance, this should be fine, right? I don't think much higher would be fun.

* I've never prepped a pill for IV use before. That being said, from what I understand, the Mallinckrodt pills are pretty easily cooked, and a cotton filter should deal with most of the shit I don't want in my shot. Is this true? I've googled for a good prep guide, but I can't find one really. If anyone has any tips or tricks here, or if you can point me to a good guide, that'd be great.

* Where should I inject? I feel super comfortable with the crook of my left arm. My veins are in great shape currently, but I have to wear a short sleeve shirt for work. I work with people that'd know what's up the minute they saw any sort of redness, bruising, or irritation in the crook of my arm. I was thinking feet, but I've never done that before. Pretty much anywhere on my arm is out. If anyone has any suggestions there, that'd be great.

* How should I prepare myself for my dose? I know I'm going to get super itchy, so I plan on taking a few Benadryl. Any other suggestions for ways to prepare myself for the dose?

Anyway, I think those are all the questions that I have currently.

Thanks in advance for your help and advice.

",1401559078.0
26yxi8,https://www.reddit.com/r/opiates/comments/26yxi8/travelling_thread/,14,https://redd.it/26yxi8,allallala,Travelling thread!,"With college done and money saved up, I've been travelling with a friend around Europe!  Italy, Holland, now England (currently Chichester).  Its been a helluva ride, gotta say.  First time in Europe and I love it!

So, brothers and sisters, who else is travelling around this time, and where to?",1401558313.0
2748wi,https://www.reddit.com/r/opiates/comments/2748wi/is_heroin_use_increasing_nationwide_or_is_it_just/,30,https://redd.it/2748wi,PercoThrowaway,Is heroin use increasing nationwide or is it just in my area/a couple cities?," I go to school on the west coast but i'm home for the east coast all summer. Where I go to school I know literally nobody but myself that uses opiates and the only opiate news I hear is them cracking down on crooked doctors. When I come home it seems at least once a week a kid is overdosing on H(im sure many many more people in the area OD than that but its only the ones 20 and under they show for the story) and it's some sort of new(as of last year) epidemic in our area. I have one opi addict friend here and thats it, and he only takes roxis/hydros lol. A couple other of my friends have tried hydro/oxy but not more than 2-3 times each over the past couple years. I live in an area north of NYC, not sure if i'm allowed to post exactly where. I know its HUGE in NYC and Philly but thats all I have heard about it. I just find it odd that the news says theirs a ""heroin epidemic"" and yet I know exactly 0 people that buy or sell heroin in this area nor have I heard of anyone I know or even friends of friends using or overdosing. Anyone have any input on what their area is like? ",1401723091.0
2743o9,https://www.reddit.com/r/opiates/comments/2743o9/not_rock_bottom_but_i_had_to_make_a_change/,11,https://redd.it/2743o9,norsenorc,"Not rock bottom, but I had to make a change.","So... I have been doing opiates for recreation over a decade with some major time off from 05 to 08. Then in 09 I trashed a disc in my lower back that sent terrible shooting pains to my left foot. Sometimes I even crawled to the bathroom at night. Sometime in 09 or 10 I finally get a PM Dr. and during this time I get married, have a kid, and buy a house. 

Fast forward 4 years... I'm hooked. The stuff from the Dr. doesn't cut it anymore. I have spent thousands on my habit. I'm not yet in financial ruin, because I found a hustle... but 6 days ago something just snapped inside me. Right after I finished my monthly script in 5 days... I got one sub, 3 bottles of lope, and here I am. I'm 6 days clean. I don't plan on skipping my appointment in a few weeks, but I haven't went this long without since back when I was getting hydro early on. 

I got to stop spending my money on the extra stuff. The extra stuff is what's doing me in. Not to say that my legal doses aren't just as bad... 

Not sure what in getting at.... I guess I'm proud of 6 days.",1401719783.0
2741gm,https://www.reddit.com/r/opiates/comments/2741gm/just_got_poppedfirst_timeout_on_bail_i_have_some/,25,https://redd.it/2741gm,helpslipfrank,"just got popped...first time....out on bail, i have some questions. help please!","morning all.  so yeah, a couple days ago i got hit.  if you wanna know the whole story, i'll make it known, but it's kinda futile now.  caught 2 felony charges possession of h, as well as maintaining and dwelling.  also 2 misdemeanor charges for under 1/2 of green, and a FTA that i thought i had gotten continued properly but i guess not.  so basically, am i like fucked?  probation? drug court?  is there anything i can do to make myself look better before my court date?  any and all info/comments would be gratefully appreciated.  stay safe guys and gals.",1401718304.0
27411e,https://www.reddit.com/r/opiates/comments/27411e/warning_noobish_question_avoid_if_yall_hate_that/,14,https://redd.it/27411e,Mercurycandie,Warning: Noobish question. Avoid if yall hate that.,"For work there's a slight possibility we could be tested (urine) in five days.  Didn't last year, dunno maybe boss has changed.  I want to take 25mg hydro today.  A lot of people saying don't risk it but by all logic I shouldn't be worried this far out especially if I'm exercising/inhalin water.  You guys think that there's any reasonable risk?",1401718008.0
2740sc,http://i.imgur.com/39B4PKQ.jpg,44,https://redd.it/2740sc,JuicyJay,Just over a month of no heroin! And I'm at the beautiful outer banks.,,1401717847.0
