2795er,https://www.reddit.com/r/opiates/comments/2795er/holy_ass_talking_batman/,3,https://redd.it/2795er,LsWee_D,Holy ass talking batman!,"so i get home from work at 5:05pm on the dot and my moms running out the front door the second i pull in the driveway.  ""i need to run some errands in your car ill fill the gas tank up dont worry about that"" i think fucking sweet alright more money for dope later tonight lol.  so i give her the keys and tell her i just need my car back by 6:30 preferably but no later than 7 if she could.  she says okay no problem and heads off.  i go to light a cig and as im smoking i realize i left my phone in my car and the second i get a text shes gonna be alerted its in there and her being the concerned parent she is (god bless her soul for putting up with all the shit ive put her through..) gonna look through my phone.

so about an hour later she pulls in the driveway and slams the door behind her ""get down here Lswee_d we need to have a talk!"" and right away she hits me with left hooks and jabs of questions ""whose this? why are you meeting him? why are you still doing this shit to me? (which really fucking hurt but the junkie in me said ""Fuck it lets lie and go get the drugs asap!)""  as she raises the phone and gives it back to me.

I being by calmly saying ""mom chill please give me a chance to explain.  i owe this dude money from a few months back and now that i finally have it i can go pay him back and dont have to worry about him anymore.  Bags are just simply a gram bag of weed ihe was trying to sell me weed mom...blah...blah...blah...""  so eventually after a bit of talking she finally actually believes me.  (win i suppose?) and off i went to meet him and buy my dope.  

I really dodged a fucking bullet with that one because im so close to getting thrown out of my house.  but for whatever reason that shit doesnt faze me one bit when it comes to me wanting to get high you best believe nothing will stop me from getting high that day lol.  Anyways yeah its a bit long so if your still reading to this point just wanna say hey thanks and you rock!  sorry im really fucking high between snorting 4 bags and parachuting a 30mg adderal xr 

TL;DR: Forgot phone in my car mom borrowed car she went through texts ""found out"" i was still using.  i convinced her otherwise and continued on to go buy my drugs and use them all just like that.",1401844998.0
2791py,https://www.reddit.com/r/opiates/comments/2791py/ive_got_metastatic_cancer_but_want_to_enjoy_what/,18,https://redd.it/2791py,guywithcancernotcool,"I've got metastatic cancer, but want to enjoy what I can, as much as I can. (Wall of text following, sorry)","Alright, I'm 31, diagnosed with stage IV colorectal cancer last year. I'm currently on my second chemo regimen. I'm feeling pretty okay right now, but my tumor markers are starting to trend upwards, meaning I'll probably have to start something new soon. This cycle will probably continue until they run out of things to try. Statistically, people in my situation live about 29 months from diagnosis, 8-10% chance of living five years. I had a real bad time in December when I had a bone met in my sacrum which was just horrible. Fortunately, I had radiation treatment which took care of it, though it flared up for a few days about 2 months ago.

Right now, I'm not feeling any pain, though I'm taking 15 mg of methadone twice daily and about 12 mg hydromorphone daily. I don't get much of a buzz from the hydromorphone anymore, but it does alleviate my anxiety and helps with depression (not what it's for, I know). I get a total of 4 mg of hydromorphone IV when I go to chemo every other week, 2 mg at the start and 2 mg near the end. I do get a bit of a buzz from that, but nowhere near what I used to.

Obviously, since I'm in my situation, I can get whatever I want pretty much from my oncologist.

What I'd like to know is if anyone can give me any advice on enjoying my ability to get opiates relatively freely. Honestly, it's not like addiction can ruin my life, so I figure why not have fun with it? I guess what I want is some advice on how gradual I should step up my hydromorphone use. Like, would I be going too fast if I starting taking 20 mg of hydromorphone a day this month, then 30 in July, then 40 in August? Is that way too much?

I'm worried that if I start increasing, I'm going to eventually start acting spaced out all time. I can't do that to my mom. She's having such a hard time as is that I can't add that to her troubles.

Thanks guys. And sorry about the wall of text.

edit: changed hydrocodone to hydromorphone (I is dumb)",1401842518.0
27900g,https://www.reddit.com/r/opiates/comments/27900g/any_fans/,58,https://redd.it/27900g,Followthebleeder,Any fans,"Of metal on this sub? Being that I've only been here a short while I'd like to see if anyone has any of the same interests music wise. I also like pop-punk, some classic rock and even some old school rap like Biggy Smalls or Big L. Fire away guys I've got hours to kill.",1401841324.0
278vsy,https://www.reddit.com/r/opiates/comments/278vsy/i_love_blues/,12,https://redd.it/278vsy,joebyrd-,i love blues,"i know they are expensive, but for some reason my mind thinks its better than doing heroin.  My mind thinks that people would judge me less if they found out.  
Anyway, going to point pleasant nj this weekend and gonna have some weed, some blues, and a very little amount of alcohol.  I have been doing a lot better as the last time i did them was three weeks ago. The best way to get off these opiates in general without your brain having to restart is to dose down as slowly as possible.  30 mg a day for a week, then 15 mg a day for a week.  Most like doing this at night time so you do not get restless leg syndrome.  I believe I can do this without my family knowing and with very little pain.  Just wanted to rant and since my family and friends dont know this about me I had no one else to talk to.  PS if anyone is by the jersey shore this weekend, pm me and ill get you high :).",1401838531.0
278uwz,http://imgur.com/kwFqVtZ,4,https://redd.it/278uwz,Franzferdinadz,Minor pill porn,,1401837996.0
278u9q,https://www.reddit.com/r/opiates/comments/278u9q/after_months_of_dealing_with_a_guy_who_while/,4,https://redd.it/278u9q,Calittres,"After months of dealing with a guy, who while reliable was a fucking dick and charged out the ass(dope was good though) I just found 3 new connects!","I went from this guy charging me 10 a bag plus buying one for him each time to now charging 2 bags each time and still 10 each.  Like yea the dope is real good but fuck this bullshit and his greedy ass.  Didn't have any options though so i dealt with it.  Well i just found 2 dealers yesterday and about to get another one today, all with good shit for a much cheaper price!  I'm pretty excited.",1401837535.0
278scq,https://www.reddit.com/r/opiates/comments/278scq/my_suboxone_woes_continued/,59,https://redd.it/278scq,popeisdope,My suboxone woes continued.,"You might have read my last thread about my ridiculously hard to handle suboxone doctor. If not the jist of the thread was that its costing me upwards of a grand a month for my fiance and I to continue suboxone maintenance, mostly due to the cost of medication. Our insurances suck.

The last time we were in her office the following happened.

My fiance missed out 8 mgs over a week span. We had to scrounge money up and continue to partially fill the script because we simply could not afford it. The doctor flipped shit and threatened to kick her out of the program for not taking her medication as prescribed. We asked about switching to a generic suboxone. She said no that there are no generics with both bupe and naloxone on the market.

she gave us these choices:

1. Fill the prescription by any means neccesary and take the medication **as prescribed** (no missing doses) or get kicked out of the program.

2. She would prescribe subutex, and in term its generic so that we could afford it. The stipulation here though was that we would have to drive to the pharmacy every day, pick up one days dose, drive to her office, and take it in front of her. Her reasoning behind this was that subutex is more abuse able than suboxone. This also wasn't feasible though.

3. Quit the program.

Tapering is not an option at this time, despite being told from the beginning that we could choose to taper off anytime we would like.

So I took everything she said into consideration and did some research to try to find different options hoping we could continue to afford this.

I foun.  3 Generic suboxones (both bupe and naloxone) printed them out to bring to her office.

I also looked up threads on people IV'ing subs from drugs-forum blue light, and opiophile. This was to show her that the naloxone did not make the suboxone any more tamper resistant than the subutex.

I also found and printed out the binding affinity of bupe and naloxone to further support my last concern.

*This did not go over well.*

First I showed her the generics. She flipped shit. At first she told me these are the exact same thing as suboxone so she couldn't comprehend why I would want them over the name brand suboxone films from RB. I told her my insurance will cover a generic a lot more than the name brand and this could be affordable to me. She then told me that she's the doctor not me and she knows all the medications that could be prescribed and these are not them. Not an option. Period.


I then told her that I would like the subutex but the driving there every day was not affordable or practical. I told her that suboxone is just as abuse able as subutex and showed her the printed threads and binding affinities to back up my claim. She exploded on me. She once again told me that she's the doctor not me and she's aware it can be abused, then proceeded to ask me if I knew the chemistry and everything of these drugs. I told her I did not and I didn't mean to try and come off as if I knew more than she did but I wanted to address her concerns of the subutex so this is what I came up with. She told me I must be so smart, that junkies are so smart and that's why we die of overdoses because we're so smart and know exactly what we're doing. I believe I deserved the first bit of that explosion, but most certainly not the last part.

She told me we're such pains in the ass. Every other patient comes in, takes there medication, and doesn't complain. That I've fought her every step of the way. I tried telling her I appreciated the help but I'm only looking for options to make this affordable, not to make your job hard on purpose. Sorry my poverty level is such a pain in the ass for you.

after all that shit iI told her I'm done and finally convinced her to taper me down.

Next was my fiances appointment. she just wanted to address the same issue. That we cannot afford this and need some help or other options. My fiances insurance is worse than mine so its been incredibly hard to fill her scripts. 

Probably still pissed off me, she ended up taking it all out on my fiance. She told her that she doesn't think she wants recovery because of the issues we given her (we're poor help) and that she should consider breaking up with me until we're both clean because we're just going to drag each other down (...because we can't afford medication....)

I ddon't know what I want from you guys I guess I just needed to vent. I'm so beyond frustrated with this lady and needless to say I'm done with this shit. 
I guess you can only get help if you're rich in good ol' Wyoming. ",1401836306.0
278qht,https://www.reddit.com/r/opiates/comments/278qht/is_my_life_in_danger_from_my_habit/,30,https://redd.it/278qht,Hardcorish,Is my life in danger from my habit?,"I have only a moderate habit of around 200-500mg #4 daily and ever since a few weeks ago, I started noticing I will wake up every single morning with extreme hiccups.  I'm worried I may at some point throw up and choke on it some morning.  Can anything be done to prevent the heroin hiccups from happening, and does anyone else get this?  It just started a few weeks ago out of the blue.  Any advice welcomed.",1401835134.0
278q6s,https://www.reddit.com/r/opiates/comments/278q6s/buprenorphine_binge_what_should_be_the_limit/,9,https://redd.it/278q6s,ananasas,Buprenorphine binge- What should be the limit?,"I am not seasoned in opiates and do not yet have a built tolerance. I have dabbled with codeine and tramadol a few times, but now I find myself on a binge of bupe, with my limited experience.. First ingestion of 1,3 mg left me amazingly nauseous and vomiting for a few hours.. that's not to say I didn't come up on a beautiful, serene high, and it isn't to say this feeling wasn't retained throughout all the sickness.. Today is the sixth time I dose, in so little days, maybe a little more than a week. Is it reasonable for me to continue using a few days? When could physical dependence begin developing? What about tolerance? Any rules of thumb to dependence/tolerance? Thanks for any insights",1401834956.0
278mcz,https://www.reddit.com/r/opiates/comments/278mcz/take_benzo_before_or_after/,3,https://redd.it/278mcz,OxyJay,Take benzo before or after,Opiate of choice? Or does it even matter if they're within close proximity?,1401832641.0
278kd7,https://www.reddit.com/r/opiates/comments/278kd7/just_a_friendly_hello/,1,https://redd.it/278kd7,Skrappy75,Just a friendly hello,I hope everyone is enjoying themselves today with their opiates! Always a pleasant day when your dealer is good after three days of being dry :),1401831462.0
278ife,https://www.reddit.com/r/opiates/comments/278ife/my_first_attempt_at_a_heroine_songpoem/,4,https://redd.it/278ife,Wheat-Bowling,my first attempt at a heroine song/poem,"Floating higher than mountain tops
But laid out lower than the chimneys drop
Spread out, eyes closed
Naked and bare
No feelings of regret
None of despair
Run my hands over your body
And all through your hair
But to touch the point of entry
It's something I wouldn't dare.
Not just yet.....
So guarded by the black and blue
And the red that's always pulled up thru 
the hole
I feel whole

I feel whole and everything is alright
I feel whole if only for tonight 

The beautiful feeling
Serene and surreal 
The rush and the calm
The halt of the wheel
The cycle and the process 
The give and the take 
I give you my life and you take it away
But I feel whole

I feel whole and everything's alright
I feel whole if only for tonight

And then time stops 
Suspended in the wake
But will it start again?
It's a chance I'll take 
because of the choice I make
To fill the hole
I feel whole

I feel whole and everything's alright
I feel whole if only for tonight
I feel whole and everything's alright
I feel whole if only for tonight
If only for tonight

The feeling of a fresh start on a brand new day
Is cut off by a plunge and the skin turning grey
Basking in the warmth that lead me astray
While silent quiet dignity holds me in the fray
To scared to cut and run
So hard to get away
The calling and the yearning are hard to keep at bay
The calling and the yearning 
to fill the hole
I feel whole.

Any thoughts, or constructive criticism? ",1401830315.0
278g66,https://www.reddit.com/r/opiates/comments/278g66/having_problems_keeping_a_weeks_worth_of_drugs/,24,https://redd.it/278g66,iamabill,Having problems keeping a weeks worth of drugs last more than two days? Invest in your very own kitchen safe.,"www.thekitchensafe.com


It finally comes out this month. It works on a time based lock, so unless you feel like busting it to pieces your drugs are going to be out of your reach until for however long you need to wait before you dose again. Perfect for benzos imo. Seems it's almost impossible to not take a ridiculous amount if you have more than one nights worth of em.",1401829019.0
278fhw,https://www.reddit.com/r/opiates/comments/278fhw/dont_upvotei_read_the_faq_is_50_ughour_fentanyl/,16,https://redd.it/278fhw,dontWANAFUQUP,[DONT UPVOTE/I READ THE FAQ] Is 50 ug/hour fentanyl patch safe without any tolerance?,"I weigh ~150lbs, i dont want to overdose on this patch which lasts for 72 hours.",1401828636.0
278efh,https://www.reddit.com/r/opiates/comments/278efh/how_much_grapefruitjuice_do_i_need_to_potentiate/,14,https://redd.it/278efh,Drabbstep21,How much grapefruit/juice do i need to potentiate?,"I had two on hand, i juiced and ate one of them, will that be enough? Also can i eat it too soon? Should i swallow these 10s with the juice or drink the juice before hand?

edit: y'all need to check this fucking song https://soundcloud.com/nickraymondg/skrillex-ease-my-mind-jai-wolf-remix-thissongissick-exclusive-download?in=drabbstep/sets/trapaholics",1401828057.0
278dof,https://www.reddit.com/r/opiates/comments/278dof/does_the_craving_ever_go_away/,10,https://redd.it/278dof,exilica,Does the craving ever go away?,"It's been 6 years now. Sometimes I don't even enjoy it and do it purely out of habit or just to feel normal. Even so, I still go crazy when I can't get any.",1401827631.0
278ct1,https://www.reddit.com/r/opiates/comments/278ct1/damn_i_forgot/,9,https://redd.it/278ct1,Oxyandbars,Damn I forgot....,"Jump to bottom for important part
How strong bupe is,
I did a half a strip (4mg) and 2 X 2mg klonopin
And I'm nodding my balls off. 
This tolerance break is turning out pretty damn enjoyable. 
(I know subs can raise your tolerance, I'm just doing a quick little sub taper)
But my question is, what is your guy's favorite way to enjoy subs when you're not just using them to stay well?",1401827165.0
278a0l,https://www.reddit.com/r/opiates/comments/278a0l/what_are_your_drinks_and_munchies_of_choice_while/,25,https://redd.it/278a0l,SoL_and_Sick,What are your drinks and munchies of choice while high?,"Ah. The choices you get to make after a long day of nodding out. You obviously wait as long as you can to munch because you don't want to kill your buzz in the slightest. 

For me it's pretty strange at times. I love strawberry or strawberry banana nesquik. If I'm not feeling that then I mix coca cola and milk 50/50 with a splash of cream. It's like a melted coke float and I love it. My friends give me a lot of shit for it until they try it. I also do the same with A&W Root Beer. Orrrrr I just make a float with whatever pop I'm feeling at the time. I guess I love dairy based drinks. They almost enhance my high because I'm so used to it as part of my habit and ritual. If I'm not feeling all of the above then I make a nice strong pot of peppermint tea and add some honey and a splash of cream to each cup. 

Munchies come down to three things I've noticed. Sweets usually cookies, candy bars and poptarts. Savory in the form of these vegetable fry shaped chips that come in an assortment of potato, sweet potato, spinach and carrot (hngggg), flamin hot Cheetos and Funyuns, or just basic Lays and ruffles and finally fast food. For some reason after a long day of dopin up I'm craving a juicy fat burger from McDonalds or Sonic (gotta get a shake and onion rings with that!).

My usual before bed junk food platter is a package of strawberry frosted poptarts, an assortment of mint Oreos, peanut butter Oreos, Reese's chips ahoy, store brand molasses cookies, fig newtons, a Milky Way bar, homemade bagel pizza and a coke float. If I'm just snacking it's usually those veggie fries and a huge glass of strawberry banana nesquik. 

I'm really surprised I'm not fat or diabetic. 

What do you guys grab from the fridge and pantry?",1401825610.0
2789yt,https://www.reddit.com/r/opiates/comments/2789yt/best_container_to_sneak_pee_into_a_drug_test/,41,https://redd.it/2789yt,junkiebopeep,Best container to sneak pee into a drug test?,"I have to take a pre-employment drug test tomorrow, and I am sneaking a friend's urine in.

I've heard condoms can break. Any ideas on what kind of container to sneak in with?",1401825572.0
2789ub,https://www.reddit.com/r/opiates/comments/2789ub/shooting_without_water/,36,https://redd.it/2789ub,Addaboyy,Shooting without water,"So ive heard the stories from old school junkies about shooting up with all kinds of liquid(gaterade, dr pepper, beer, liquor).  Anybody have any experience with this? Is it safe? How do these diff liquids change the dope?",1401825506.0
2788kw,https://www.reddit.com/r/opiates/comments/2788kw/day_3_clean_go_me/,12,https://redd.it/2788kw,mouserat31,"Day 3 clean, go me!","Hey all, this is day 3 for me and im doing alright. I have about 3or4 8mg subs so I mentally feel better about that. These things are a god send for me. I was curious if anybody knew when my BM would go back to normal. I have had horrible and constant diarrhea since I quit. Im also afriad when friday comes im gonna destroy everything I worked for and go buy bags. I love my friends and I dont wanna distance myself from them. My gf has no idea ive ever tried H (addict for 6years) but shes aware my friends have. Im sorry to rant but thanks for listening.",1401824812.0
2788fe,https://www.reddit.com/r/opiates/comments/2788fe/11000_subscribers/,3,https://redd.it/2788fe,SheriffOfNoddinGram,"11,000 subscribers!","Keep up the good shit, people. ",1401824739.0
2784h5,https://www.reddit.com/r/opiates/comments/2784h5/bad_batch/,11,https://redd.it/2784h5,MikeTheFeind,Bad Batch,"A couple of my friends have reported that some edibles they or their friends have gotten that were loaded with tons of psychedelics and have caused some seizures, and i am in the Seattle are and have had reports from Bellingham down to olympia. Stay safe you guys, and happy nods",1401822460.0
2781g5,https://www.reddit.com/r/opiates/comments/2781g5/hydrocone_dosage/,8,https://redd.it/2781g5,QuestionAboutHydro,Hydrocone dosage,"I'm fairly new to the world of drugs so bear with me, my terminology won't be too advanced.
I recently acquired some hydrocodone/acetaminophen pills for an injury, and the bottle says 7.5/325.  I took 2 pills last night and got a decent buzz, and I was thinking about taking 3 today and was just wondering about safety issues or whether I could even take more than 3 and still be fine.
6 foot 0, 155 pounds
Much appreciated",1401820737.0
2780xz,http://i.imgur.com/s3q9qQ6.jpg,27,https://redd.it/2780xz,Zikboy99,Today's gonna be a fun day..,,1401820452.0
277xku,https://www.reddit.com/r/opiates/comments/277xku/got_some_leftover_hydrocodone_5500_s/,23,https://redd.it/277xku,opiesquestion,Got some leftover hydrocodone 5|500 s...,"Got about 10 left from a prescription that I didn't need from a broken ankle. I'm Opie naive so assume no tolerance, if I do a cold water extraction on 4 for me and 4 for my buddy think that's a good dose for 0 tolerance to have a good time for a Friday night? I don't wanna take 2 grams of acetaminophen even if it won't kill me thus the cwe.  Would it be fine or have an effect to take the last two (1 for each of us) a couple hours in to extend the duration? Thanks for any advice.

Tl;Dr:  got 10 5|500 vikes, 4 good enough for no tolerance fun high night? Safe to take another to extend 2 hours in?",1401818496.0
277os7,https://www.reddit.com/r/opiates/comments/277os7/confused_about_hydro_to_oxy_dosage_conversion/,17,https://redd.it/277os7,superdog69,Confused about Hydro to Oxy dosage conversion,So saw you are used to taking around 20mg hydrocodone recreationally. What would be the equivalent oxy dose for this? I am talking about the instant release tablets,1401813384.0
277m6x,https://www.reddit.com/r/opiates/comments/277m6x/question_about_moldy_cotton/,20,https://redd.it/277m6x,Rekivk,Question about moldy cotton,Does anyone know what mold looks like on an old cotton that you used for dope? Just so I know what it looks like for the future so that I don't shoot it up.,1401811838.0
27dvu5,https://www.reddit.com/r/opiates/comments/27dvu5/my_life_before_opiates/,20,https://redd.it/27dvu5,Kose2kose,My life before opiates,"Things used to be so fuckin awesome in my life. Smoking L's with my boys and getting drunk was so fun. Then once the opiates got involved, my life turned to shit. Yea in the beginning it was fun. But it wasn't long till i started stealing from my family and shit. I used to go to parties and clubs and dance with girls and have sex regularly. The last time I had sex was March 2013... all because of heroin.

I didn't have to shoot up drugs to enjoy myself. Now, i need to drink methadone or shoot heroin to be able to leave my house to function. My college buddies invited me to the beach for my friend's birthday this friday... of course i have to tell him i can't go. unless of course i get some dope or something. I have certain things against me in my household that enable me to keep using. I won't elaborate but i think you guys get what i mean. I want to stop so bad but if it's in my face everyday there's not much i can do... 

I just get so sad thinking of all the socialization i used to have. Now i don't leave my house for months",1401979595.0
27dn1n,https://www.reddit.com/r/opiates/comments/27dn1n/microgram_newsletter_xpost_from_rdrugs/,10,https://redd.it/27dn1n,street_philatelist,MICROGRAM NEWSLETTER (X-post from r/drugs),"Every since the DEA restricted the MicroGram newsletter to LEOs only I have been really bummed out about it.  It was by far the coolest drug newsletter available.  I thought it would just be a matter of time before someone hacked the DEA website and shared it with the rest of us.  OR maybe  it would end up being available on the Dark Net.  

BUT so far iv been wrong or have I?  I am begging you guys for access to these newsletters.  Does anyone out there have a connection to these newsletters? If you don't want to put jeopardize your connect for these newsletters please PM me.  I would be eternally grateful.   From one drug nerd to another PLEASE PLEASE P L E A S EEEEE. Thanks in advance! 

",1401973328.0
