27fkpt,https://www.reddit.com/r/opiates/comments/27fkpt/wow_so_close_to_being_busted_my_friend/,6,https://redd.it/27fkpt,didthatjusthappentom,Wow so close to being busted (my friend),"so my friend was doing some white stuff in the parking lot of a store. He went into the store to get some stuff. Go out of the store and there are 3 cop cars around his car. Walks to his car (with said stuff in pocket), and police dude says ""this is gonna sound nuts but someone said that you were snorting stuff in the car"", ""can we search your car?""Friend says ""nope I don't do drugs, but I gtg because (xyz excuse), they let him go but got his number and address. My question is: Will they get a warrant to search his house/apartment? Or was that just a quick scare and nothing will come of it? Said friend lives in a smallish town (5K less people) ",1402016433.0
27fkgz,https://www.reddit.com/r/opiates/comments/27fkgz/ground_scores/,30,https://redd.it/27fkgz,classicfrank,Ground scores?,"What kimd of cool stuff have u groundscored? At a fest called bangerfest last year i scored a few unopened beers, which i traded to a dj at like five in the morning for some cigs, a few fat nugs of white ryno in a bang, and an awsome torch lighter covered in mud but still worked",1402016252.0
27fch5,https://www.reddit.com/r/opiates/comments/27fch5/oh_no/,29,https://redd.it/27fch5,mouserat31,Oh no,"So I am 5 days clean off of H and 1 day off of suboxone (spelling? ). I thought I would be feeling better but I still have lower back pains and butt faucet. Wtf!? I thought dope WDs were like a 3day thing. While I am proud of myself for what I have done, I cant brag to much bc its mostly accomplished due to lack of funds. I need to get new brakes for my car and get my tablet outta pawn. That might run me 500/600$. I know I shouldn't even think about H but I cant help myself. How bad is it that im already trying to fit a bundle(150) into my budget. God I cant wait for friday.",1402010676.0
27f81q,https://www.reddit.com/r/opiates/comments/27f81q/trying_to_smoke_h_with_hiccoughs/,42,https://redd.it/27f81q,CodeineMartin,Trying to smoke H with hiccoughs,"this is fucking infuriating


hiccoughs are bad enough as it is, but this has been going on for 8 fucking hours now, every 5 seconds or so


ALL I WANT TO DO IS SMOKE SOME GOD DAMNED MOTHER FUCKING DOPE AND CHILL


this is ridiculous, I keep throwing my foil by accident and nearly swallowing my tube.


God damnit.


Multi question thread.


**PART 1** Cures for Hiccoughs? Pease


**PART 2**  Do you have any stories of similarly daft shit preventing you from getting high?",1402007816.0
27f51d,https://www.reddit.com/r/opiates/comments/27f51d/writings/,8,https://redd.it/27f51d,Trapback404,Writings,"   Sweat was clinging to my skin like an old man hangs on to what's left of his life. His wife long since passed and his children moved on far away leaving the dying father alone, yet he still fights. A crust was forming on my skin beneath my layers of sweaters and shirts. It's only September but, on this day I am cold, God am I cold. 
    
The elderly man in front of me struggles filling his prescription for what seemed like hours. The receptionist, young and beautiful, looked on him with caring eyes as she carefully explained his prescriptions to him. He finishes up and I hurry to approach the counter.
 
   ""Ten day supply of 31 gauge insulin syringes."" I know all the things to say to get my needles without a prescription and more importantly without a hassle. She reaches for beneath the counter and hands me a fresh pack. Her eyes told me she knows the truth, she knows I'm a lying junkie incapable of living without my dope. She says nothing as she rings up the score and I pay the $1.92. 
   
  Her cold stare would make me uncomfortable, hell I should be embarrassed but, how could I feel bad when I knew relief was as close as the nearest bathroom stall. I turn away saying nothing and step off to the restroom, a nervous smile growing on my face. 

      It's 9 am and nothing is going to stop me. 


Critiques? ",1402005894.0
27f4tt,https://www.reddit.com/r/opiates/comments/27f4tt/question_about_speed_balling/,7,https://redd.it/27f4tt,tennis22,Question about speed balling,About to by some blues and some white.  What do you guys recommend I do first to maximize my experience?,1402005788.0
27f47a,https://www.reddit.com/r/opiates/comments/27f47a/finally/,11,https://redd.it/27f47a,HayMoe,Finally!!!!,"I've been waiting for years to get my hand on some pandas. I've tried every other opiate possible, give or take a few. And the day has finally arrived! /u/OldRapGroup and myself are about to go pick up 4 of these beauties. Just wanted to share my excitement with my favorite community. Sadly, we will be snorting them since we don't have the means or a place to make them into an IV-able form (we both live at home with our parents). Regardless, I fucking looooove snorting drugs almost as much as iv'ing so no complaints here. Happy nods my friends, hope you guys have an awesome Thursday! 


Edit: we just did 3 pandas, and I am so completely underwhelmed and disappointed. Definitely sticking to hydromorphone and dope from now on! ",1402005388.0
27f3st,https://www.reddit.com/r/opiates/comments/27f3st/how_does_this_heroin_compare/,12,https://redd.it/27f3st,Nobu7,How does this Heroin compare?,"I bought #4 Heroin off the same guy a couple of times, but some time passed and it's obviously a different batch.

Batch #1:
Brown powder with little rocks, strong vinegar smell, foul taste in back of throat. Onset was gradual and took at least 10 minutes (sniffing). My sinuses closed up immediately after sniffing and took 2 days to recover. Primary effects were strong sense of nausea in abdomen, killed hunger dead. Secondary effects were a warm and comforted feeling, sudden need to vomit 5hrs later (after first use or after a break). Taking double the dose and I couldn't see straight and started to nod. Seems like high purity, uncut Heroin to me.

Batch #2:
Light tan powder with little rocks, strong vinegar smell, foul taste in back of throat. Onset took 2 mins to feel it but then onset slows and nothing much happens (sniffing). My sinuses barely close up at all and recover fast. Primary effects are strong sense of nausea (very unpleasant like being really car sick). Secondary effects are hiccuping, feeling hot unwell, shaking and shivering (e.g. chattering of teeth), mild headache, sudden need to vomit 5hrs later and again 3hrs after that. Taking a big dose (easily the most I ever did) made me sick for over 18hrs, no warmth at all and no nod. Seems strong because a small amount makes me sick.


Batch #1 was great but I'm not even sure what's in batch #2. Does it even sound like Heroin to you? I don't understand why there is no warmth at all. I only sniff it so far. Will it be different if I I/V it or plug it? It came from darknet and the vendor has endless stream of positive reviews so it feels like I am doing something wrong. What do you think?
",1402005148.0
27f2p5,https://www.reddit.com/r/opiates/comments/27f2p5/my_good_karma_paid_off/,4,https://redd.it/27f2p5,OverweightJaguar,My Good Karma paid off.,"SO last month I gave a lot of shit away...did some favors for people, was loose with my things while I had them.  Today is refill day, I have my eye surgery tomorrow, I was pissing and moaning at my doctor about it, and when he handed me my normal prescriptions he also gave me one for 40 8mg dilaudid...Just banged one with my normal shot of BTH, shit is unreal.   Not worth recurring corneal erosion, but still great.   Playing the game clean this month paid off, havent been ripped yet, and when I've shared its come back to me plus some. ",1402004554.0
27ewpz,https://www.reddit.com/r/opiates/comments/27ewpz/desperate_pathetic_dealer/,32,https://redd.it/27ewpz,junkiebopeep,"Desperate, pathetic dealer","I've been copping off this dude for a few weeks now and at first everything was pretty straight, and he was giving me some good deals. 

His quality started getting worse and worse and the bags were getting really light, too. Then, today my friend texted me and said the guy sold him bunk. 

Anyway this dealer texts me every day saying he ""gat good"" so I said, ""I hear you're selling bunk now, no way."" Anyway dudes insisting that his boy sold to my friend, and that his shit is good, and that my friend's meeting him in an hour. Yeah right. I screenshotted the convo to my friend and of course he's not going.

So then he starts saying he'll give me a deal. I told him if it was free I'd buy - ""Nothing's free. I'll give you five bags for twenty."" Nope

So this guy is obviously desperate, and a loser who's going to lose all his customers. Sucks to be him.",1402001081.0
27eudr,https://www.reddit.com/r/opiates/comments/27eudr/so_i_tried_meth_for_the_first_time/,61,https://redd.it/27eudr,LsWee_D,so.. i tried meth for the first time..,"out of nowhere at work this dude goes ""hey man you ever do meth?"" and i kinda just laughed and said ""oh yeah all the time"" but he was super serious about it so we went to his house while we were waiting for the job to come through and we snorted some meth.  i have no idea how much but all i know is i feel like doing stuff

we never mentioned drugs before to each other but we had a long ass talk after we did it haha ",1401999769.0
27encc,http://imgur.com/PrxK4MG,25,https://redd.it/27encc,Dabbersupya,Some wonderful pill pr0n on this fine Thursday,,1401995748.0
27eld8,https://www.reddit.com/r/opiates/comments/27eld8/thank_you/,6,https://redd.it/27eld8,HangerOnTheDoor,Thank You,"I was about to go through withdrawals from taking about 150mg hydrocodone per day (CWE, don't worry, not taking all that tylenol), when I started looking around on this sub and r/opiaterollcall to see if anybody could help me get some subs that I could use to gradually lower myself off of cloud 9, rather than crashing from the freefall.  I hate those frigid fowls we know as cold turkeys.

I found some people near my location that offered to try to help me, and one of them actually came through.  I won't name you here, but if you feel like taking credit for it here, be my guest!

I just wanted to publicly say THANK YOU, THANK YOU, THANK YOU for helping me avoid the nasties, and likely saving me from losing my job (due to working, or not, with w/d).

This community from what I have seen thus far is awesome.  You guys all look out for each other.  Give yourselves a pat on the back (if you're into that kind of thing).  But really - thanks, guys.  Keep not being dicks!",1401994623.0
27jvl5,https://www.reddit.com/r/opiates/comments/27jvl5/goooooood_fucking_morning_my_fellow_low_life/,25,https://redd.it/27jvl5,LsWee_D,GOOOOOOOD FUCKING MORNING MY FELLOW LOW LIFE BITCHES!!!,"Just kiddin i love all you bropiates and girlpiates (yeah i fuckin went there watcha gone dew?!)

okay but seriously this morning has been so awesome.. i picked up 2 buns late last night once my dude re upped and as soon as i had got home from the city my friend hits me up looking for a ounce of bud.  he comes over to my house and we went bong for bong and just hang out for a bit and he did dope for the first time ever.  now idk whether to feel bad or not he kinda just asked to do some cause i just had the bags out on in my room on my little table i keep my scale baggies and bong on.  but yeah so i broke him off a bag and a half to try since he has done 30s a decent amount of times so i figured he could handle it ( he was dipping the fuck out after a few bong packs and those bags haha but he didnt get to sick or anything)  but anyways yeah i was able to wake up this morning and do a 5 bag shot.  mmm it feels good man.  

now im sitting here chilling packing up my bong while munching on a pack of Sour Patch kids and those Air Heads XTREMES the rainbow berry ones! also scooped me some fruit punch.  today i am just chilling the fuck out might have friends over to blaze and have a bbq or something.  im just having such a great morning and a great morning usually leads me to a great day in general! Cheers to my buddies here

So heres the question i pose to you guys:  Should i feel bad/ am i a bad person for letting my friend try dope?  he has done opiates before but isnt full blown addicted hes kinda like a chipper but does 30s a little less then a chipper even.  i told him i didnt want to for fear of him liking it to much but he was begging me to try it.  What do you guys think?  Also how you guys spending this nice ass Saturday?? Cheers BROS oh yeah and GALS SHOW ME YO TITTIES!!!!",1402153887.0
27jj51,https://www.reddit.com/r/opiates/comments/27jj51/finally_hit_a_vein/,18,https://redd.it/27jj51,hammontre,Finally hit a vein,"My veins are shit. Naturally deep, rolling veins, years of drug abuse, and some harsh chemotherapy has made it tough even for the most experienced medics to draw blood or start an IV. And obviously tough for me to shoot dope. Even when I hit, and check multiple times to make sure I'm still in, I haven't been getting the rush. For some reason it always feels like skin popping. And I've shot up enough times over the past 18 years to be confident I know what I'm doing. It's been disappointing, especially as I'm not in love with the shit I've been getting, but I still end up feeling pretty good after 30 minutes or so. 

But not this morning. I hit a good fat vein that I can't see or feel - I just know the general area from watching my frequent blood draws. And the dope hit me right away. It was a decent size shot, and I was overwhelmed with the falling in love feeling I first experienced back in 97, the first time I tried heroin. It's heavenly. Blissful. Amazing. A good way to start the weekend, and a great shot to end my seven-day binge. I feel so fucking good. Only having someone here with me could make this moment more beautiful. ",1402140117.0
27jhg0,http://imgur.com/pchBaFK,20,https://redd.it/27jhg0,DeathTheAdolescent,For those of you who enjoy sandman. I like to do art while I'm fighting off nods. How about y'all? Any other comic nerds in this sub?,,1402137461.0
27jaqe,https://www.reddit.com/r/opiates/comments/27jaqe/hey_fuckers_remember_that_time_we_all_talked/,23,https://redd.it/27jaqe,Orange_Uncle_Monkey,"Hey fuckers! Remember that time we all talked about doing opiates and then some of us did,(do opiates) and then that one guy couldn't ever spell his own name right and there were also boobies?",That was a pretty cool time. ,1402126787.0
27ja9x,http://taimapedia.org/index.php?title=/opi/_Achievements,33,https://redd.it/27ja9x,Someone_Who_Isnt_You,How many opiate achievements have you unlocked?,,1402126136.0
27j8t1,https://www.reddit.com/r/opiates/comments/27j8t1/the_reason_i_wont_go_to_treatment/,43,https://redd.it/27j8t1,kenshinmoe,The reason I won't go to treatment.,"See I really want to quit this opiate hell that I've been stuck in for 8 years. I feel like the only way I can do that is through treatment. I've tried to quit countless times but yea that didn't work out. The problem is that I actually do have serious nerve pain that just makes life unbearable. I've had this pain for almost as long as I've done opiates. I have tried every sort of pill and injection and physical therapy to stop my pain but nothing works, nothing except opiates. I won't go to treatment because if I do, then I'm effectively giving up the only thing that gives me any sort of pain relief, I'm giving up the only thing that gives me any sort of desire to keep living. I'll get listed as a drug abuser and never get the pain relief I need ever again. Can't there be a better system out there for drug addicts with pain? Can there not be a way to continue doing opiates for pain after learning how to control your addiction to them? Why is this type of treatment program not available?",1402124168.0
27j3ja,https://www.reddit.com/r/opiates/comments/27j3ja/fucked_over_by_a_forgotten_bag/,12,https://redd.it/27j3ja,foldedfaces,Fucked over by a forgotten bag,"My boyfriend was arrested today after being pulled over and searched. He was pulled over for not using his turning signal, and searched because he was driving on a suspended licence from the heroin DUI and possession charges he got in January. Hooray for more legal fees. 

It's just so fucking unlucky. That bag had to have been sitting in there for months. It would have been in our arms if we fucking knew it existed. Goddamn it. I'm so pissed that we didn't find it first. I remember dude dropping something and saying fuck it, and then we looked around and didn't fucking find it. We could have prevented this shit.

While he sits in jail, I'm gonna get real stoned and wait for his call; there's really nothing else I can do.

Tonight I will miss him but at least I have my [cat](http://i.imgur.com/BWpjyIJ.jpg).",1402118163.0
27izkn,https://www.reddit.com/r/opiates/comments/27izkn/blue_dope/,8,https://redd.it/27izkn,notmyname3030,Blue Dope,"I know it's not fake, I have been using for a while, but this stuff was blue any body run across this kind of stuff before? Taste like dope, smells like dope, cuts like dope, not grainy like a pill. So question to my fellow opiophiles  have any of you seen this stuff before, it's like a light blue, not gray .",1402114325.0
27iz07,https://www.reddit.com/r/opiates/comments/27iz07/yay_that_fire_green_hath_returned_to_my_hood/,6,https://redd.it/27iz07,DeathTheAdolescent,Yay that fire green hath returned to my hood,"That is all. Just really excited cuz it's been bunk for miles lately where I'm concerned. Now if only I could stay awake long enough to enjoy it. Too much of that ""I'll just sit back chill and watch some silicon valley......aaaaand it's five episodes later."" Or even better,  ""Let me start up a quick SC2 match.... and I lost whilst accomplishing the building of a single barracks and zero units."" Lol. 

Sorry for the pointless post. Thought some people might get a laugh from similar gaming experiences.  
Happy weekend and nods yo.",1402113824.0
27ixol,http://imgur.com/a/uqubd,52,https://redd.it/27ixol,omgshutthefuckup,"Opiates in the Dirty South (ATL) BLues, Boy and Bud",,1402112666.0
27ix06,https://www.reddit.com/r/opiates/comments/27ix06/hydro/,20,https://redd.it/27ix06,BradleytheRage,Hydro,"K, so tonight I am gonna try the hydrocodone I have in my stash. I crushed it into fine powder with a hammer. 20mg,  will be doing in about an hour.",1402112029.0
27ivzc,https://www.reddit.com/r/opiates/comments/27ivzc/really_shouldnt_be_confessing_all_this_but/,25,https://redd.it/27ivzc,throwbrianaway,Really shouldn't be confessing all this but...,"So I have a situation.  A lot of you may not know me but I've struggled with addiction for years now.  I would post dope porn, comment like an asshole when I was sick to piss people off, and also offer support to those in need.  I am at the end of my fucking rope here.  Any input will be appreciated.

I'm sure every junkie or even user out there has had a moment of pure helplessness.  No emotions except defeat.  I've felt this way for close to two weeks.  

I got my second DUI last June, and lost my license in December for two years.  I was homeless for a little bit and eventually found a place.  Got a new job paying pretty well off the bat, and easily had transportation to work.  So the DUI was manageable.  The fines, are not.  I was always fucking up and not paying the court or the surcharges (two separate payments) and copping dope.  They'd add up and I'd get a warrant.  Then pay them off, and be sick for a week or steal or middle or whatever.  Then I started missing days calling out sick.  Didn't have dope or my dboy would be around while I was at work? Call out.  Have dope in the morning and say Fuck work?  Call out.  I got high at work too.  It finally caught up to me when I was fired.  I tried unemployment but I have a phone interview scheduled.  That's not going to go well.  Should I bring up mental issues?  I mean I've been to treatment twice, both dual diagnosis for addiction as well as depression, manic depressive, and bipolar.

I honestly feel like I can never have anything good going for me because I always muck it up and lose it all to start over again.  I need to change the cycle.  I stopped doing opiates over a week ago, I honestly forget the actual date considering I've been out of work going on week 3.  I haven't done Jack shit to look for a job though.  Sit on reddit in my room and watch dvds all day and read.  I haven't left.my.house in a week, my room in about two. I have been thinking about rehab again . the only reason I can't do that is my parents have already been dealing with their other son in and out of treatment for two Years, and frankly idk what would happen if I told them this.  I can't do that.  I have been taking subs though, And feel like at this point I need to find an easy job close by and just work.  


I'm so mad at myself.for losing this job.  I had people vouch for me and shit, and now I have to face them and tell them I fucked up. at least they don't know I was using hopefully. That'd be worse I guess.

My whole reason posting this here is any friend I have who I'd tell this to would offer nothing informative since they haven't been there.  And I'm not looking for solutions.  The answer is to stop using, get a job, stay clean, etc.  I'm just typing.out some anxious thoughts here so I don't explode from keeping them inside.  I have also been smoking a fucking ton of weed since I can make a wuick buck off it.  Its helped me mellow out from my mood last week, which was I WANT TO DIE FUCK THIS I WANT HEROIN FUCK IY FUCK EVERYTHING.  That was fun.  

So yeah, anyone feeling rough lately care to shoot the shit?  I'd rather listen and try to talk to other people than bitch about my problems anyway.  

Side note - Naked Lunch is a pretty good book and talks about some crazy opiates",1402111066.0
27is64,https://www.reddit.com/r/opiates/comments/27is64/dope_ramblings/,12,https://redd.it/27is64,ThrowawayBags,Dope ramblings.,So I just did my dope for the first time today. But I was just thinking how funny it is that in my eyes the 2nd best feeling to actually being high on heroin is feeling that little stack of stamps in your pocket when you have a bundle. Also just wondering does anyone who gets ECP purposely mix in powdered diphenhydramine aka Benadryl or Dormin? I do on occasion if I say only have a bundle to do and what to ensure I get a nod or the most out of my dope.,1402107729.0
27iqrf,https://soundcloud.com/atticus_tutweiler/lady-of-the-north,1,https://redd.it/27iqrf,Atticus_Tutweiler,Music is how I stay mostly clean [OP],,1402106609.0
27iplc,http://traceyh415.blogspot.com/2014/06/occasional-companion.html,8,https://redd.it/27iplc,traceyh415,Drug love story,,1402105681.0
27ilju,http://mic.cm/1gNXPp8,24,https://redd.it/27ilju,ironsoul412,How a Promising Ivy League Student Ended Up a Heroin Addict and Convicted Felon,,1402102375.0
27ijuq,http://imgur.com/lknldOp,11,https://redd.it/27ijuq,peachieekeen,Our Scumbag Suboxone Dr....,,1402101030.0
27ifpy,http://i.imgur.com/eEwSD7d.jpg,10,https://redd.it/27ifpy,bathedingrey,"I didn't get any pizza... still happy though! (1/4th on my skin, 1/4th in my mouth)",,1402097825.0
27ic86,https://www.reddit.com/r/opiates/comments/27ic86/just_ate_a_pod_whole/,18,https://redd.it/27ic86,Skitkorv,Just ate a pod whole,Holy shit that was spicy.,1402095287.0
27i7ti,https://www.reddit.com/r/opiates/comments/27i7ti/went_out_with_a_bang_dopest_dope_i_ever_smoked/,8,https://redd.it/27i7ti,OxyJay,Went out with a bang. Dopest dope I ever smoked,Smoked about a quarter g throughout the course of the day. An amount that'll normally just keep me well and sometimes a little high but today I had to pull over because I was nodding too hard. Nice,1402092255.0
27i51w,https://www.reddit.com/r/opiates/comments/27i51w/experience_growing_beautiful_somniferum_poppies/,10,https://redd.it/27i51w,sluggiest,Experience growing beautiful somniferum poppies?,"I would love to grow some of these, but every time I try they do nothing. I live in texas, so could anyone give me some step to growing these? Do I need unwashed seeds? How I have to bury them or just lay them on soil? How often do they need water? How long to they take to get to pods and die? I'd mainly like to talk to someone experienced with this particular plant. I saw a great morphine extraction tek that looks too easy. I know its not in season but does that matter? Why?",1402090437.0
27i308,https://www.reddit.com/r/opiates/comments/27i308/iv_use_of_zolpidam/,9,https://redd.it/27i308,redtro44,Iv use of zolpidam. ..,"Does any one else do this for strictly a benzos buzz that last intensely for two minutes?
",1402089183.0
27i1eg,https://www.reddit.com/r/opiates/comments/27i1eg/question_about_complications_for_future/,12,https://redd.it/27i1eg,NeedHelp303,Question about complications for future prescriptions by calling my physician,"Hey all, I don't know if this is the right place to post this but I called my physician's office today asking about possibly getting some medication in case I have bad withdrawals. I told them I had been doing opiates for some time now and I wanted to stop. They said I could make an appointment or call a hotline which I replied that I would call them after the weekend if I needed to schedule one. My question is: will just making this call and talking to them about it put me at risk for being denied pain meds in the future if I really need them (surgery, broken body limb, etc.) or am I in the clear? Thanks in advance.",1402088203.0
