7d8sgv,https://www.reddit.com/r/opiates/comments/7d8sgv/whats_the_deal_with_cigarettes_on_opiates/,11,https://redd.it/7d8sgv,DamiensLust,What's the deal with cigarettes on opiates?,"As we all know, cigarettes and opiates go together like bread and butter. I'd vowed to never do one without the other, but I fail that every time I try to quit opiates but that combination is a total match made in heaven. 

What confuses me though is the sheer contrast of it all. For example, I distinctly remember trying, buying and then smoking a new brand of cigarettes (idk if you guys have Winston Blues there)  that seemed really good while I was all fucked up on Oxy, but the next day all out of drugs I had a puff on one of my final Winstons and it was fucking gross. I ended up giving the rest of them away for a single Marlboro, I couldn't bear the taste of them. 

This has been something that's happened to me many times. Don't get me wrong either, I am not at all a picky smoker - I'm not one of these ""I only exclusively smoke Lucky Strike and will go through nicotine withdrawals before taking a puff of anything else"" assholes. On heroin, good cigarettes & tobacco tastes like the pussy of the holy spirit, and even awful tobacco & cigs will taste fine. 

So it's not just the fact that they feel better or that the nicotine buzz is enhanced and has a lovely synergy with opiates - although by god that is all correct - but its honestly as if the actual physical taste of the things change. It's weird because IME for everything else my sense of taste is slightly dulled on opiates, but the taste of cigarettes changes radically for the better.

DAE have this? Can anyone relate? Does anyone else out there feel me? anyone have any idea the cause of this strange phenomenomomon? ",1510794123.0
7d8s00,https://www.reddit.com/r/opiates/comments/7d8s00/we_all_have_our_favorite_pairings/,9,https://redd.it/7d8s00,pyr088,We all have our favorite pairings...,"Some of that good tar with an Al Capone mini cigar or an American Spirit (Yellow pack) with a Big Q Styrofoam cup filled with crushes ice and Pepsi or Dr. Pepper.

Aka Paradise.

What do you guys prefer right after a shot/snort/boof?",1510794009.0
7d8mwb,https://www.reddit.com/r/opiates/comments/7d8mwb/known_fentanyl_pressed_pill/,6,https://redd.it/7d8mwb,stormerloupedx,Known Fentanyl pressed pill?,"I am wondering is their a comprehensive list of some sort listing the common counterfeit pharmaceutical presses? I know of Hydrocodone,Oxycodone, Alprazolam tablets in various varieties have been found with fent. Most specifically I am concerned about the triangular 8 mg Hydromorphone tablets. Has anyone seen fent presses of them?",1510792623.0
7d8hvq,https://www.reddit.com/r/opiates/comments/7d8hvq/test_your_dope_for_fent/,14,https://redd.it/7d8hvq,Rogukast1177,Test your dope for fent?,"I got about a G of some stuff from my dude today, it has a grey/purple tint to it  and tastes fucking weird.  I only sniff it, so I don't really want to waste any by mixing it with water unless it'll help me find out if it's fent or not, I'd rather detox than get hooked on that shit.  I can upload a picture if it helps.  It kinda looks like if you were to crush up the light purple Smarties candy, it came in a solid rock and I crushed it.",1510791344.0
7d8hnn,https://i.redd.it/1cxqtd9nc8yz.jpg,8,https://redd.it/7d8hnn,XanixAttacks,My weekend recreation (20x 5mg IR oxys (Endone)) and 5x 2mL/100mg tramadol ampoules 🤸,,1510791293.0
7d88ln,https://www.reddit.com/r/opiates/comments/7d88ln/dillies_and_suboxone/,8,https://redd.it/7d88ln,heroinAM,Dillies and suboxone,"Would it be safe to take a sub 8-12 hours after a Dilaudid dose due to its short half life??? (Only 1mg too, just to  get well and sleep tonight)",1510788954.0
7d87ni,https://www.reddit.com/r/opiates/comments/7d87ni/what_has_your_experience_with_pain_management/,3,https://redd.it/7d87ni,HoboCodes,What has your experience with Pain Management been like?,"I got into opiates one pill at a time from a friend because i was complaining of back pain at work and a coworker gave me 10’s then 30s, then introductions to these friends’ dealers, and played the game all the way up to heroin. 
Pain Management has always interested me. Do you just walk in for an appointment about pain and get prescribed opiates, do you have to have proof of something like a car accident, are you referred by a doctor only after complaining for a year? 
I’m sick of being a junkie copping a gram of H at a time but one big reason I always go back after getting clean is having a bad day where my back is killing me. (And craving drugs, I’m not gonna kid myself.) But I can get through the cravings. As soon as my back starts acting up it’s the same routine of finding some dope and having 100% of all my problems go away for a while. 
So anyway, how did you get into pain management?",1510788685.0
7d86ou,https://www.reddit.com/r/opiates/comments/7d86ou/not_sure_where_to_ask_this_but_here_goes/,20,https://redd.it/7d86ou,Stormageddon252,Not sure where to ask this but here goes..,"So I've been on the fentanyl patch along with oxy & gabapentin for the last 4 years (all prescribed). I take these along with 11 other meds for a various number of issues. 

Anyway, I'm still having a considerable amount of pain so my dr switched me from fyntanyl to morphine today. My question is...do I need to take the morphine directly after I remove my patch or wait a certain number of hours before taking it? I forgot to ask the dr & am hoping someone here knows. 

Thanks to anyone who's been on both & can help me out :)",1510788425.0
7d81vt,https://i.redd.it/dw2d1oof08yz.jpg,19,https://redd.it/7d81vt,X_Canuck85,"Utah launches new opiate database, goes back to every every script received in last 5 years. Lists drug, prescribing doctor, and pharmacy filled at....",,1510787189.0
7d81ui,https://www.reddit.com/r/Drugs/comments/7d7z0p/morphine_after_bupre/,0,https://redd.it/7d81ui,SnortEmLines,Morphine after Bupre,,1510787178.0
7d7we4,https://i.redd.it/vr6peiq4w7yz.jpg,14,https://redd.it/7d7we4,TARmander1,"Made some moves today. Left is more exposed .3 left of a gram pickup Early this morning because I was well to make moves after my ~3am miracle haha, story is on here.. right is a fresh powdery BTH G",,1510785861.0
7d7sey,https://www.reddit.com/r/opiates/comments/7d7sey/considering_h/,33,https://redd.it/7d7sey,TylenolJonesOfficial,Considering H,"So as the title says I would really like to try heroin. I have an extensive drug use history, it would be easier to list the ones I haven't tried. Save all of the ""don't do it"" responses I have tried several (pharmaceutical) opiates before but would still consider myself ""opiate naive"". As far as becoming addicted goes I don't think it will be an issue for me. I know how dumb this sounds. I say that because in the past when I dabbled with oxy I would purchase 100 at a time and do them daily until they were gone without any desire to purchase more. The only notable WD symptoms I would experience are a couple sleepless nights and some irritability. It has been about a year since Ive have done any opiates and I would like to try something different this time. Any opinions or advice from experienced users would be greatly appreciated.

Edit: My roa will be smoked, snorted or maybe monkey water.",1510784832.0
7d7rtw,http://reason.com/blog/2017/11/09/40-years-ago-a-management-guru-and-a-you,19,https://redd.it/7d7rtw,punkthesystem,We've Known for 40 Years How to Help Heroin Users,,1510784682.0
7d7qgs,https://www.reddit.com/r/opiates/comments/7d7qgs/relapsed_and_im_regretting_it/,15,https://redd.it/7d7qgs,fuckrecovery,Relapsed and I'm regretting it,I thought relapsing would fix my problems. It gave me hope which I appreciated more then the high to be frank. Knowing there was something out there that would make me feel better was important to hold onto. I won't lie I felt better at first but things came crashing down as they always do but faster then usual. My parents found out and cut contact with me. My girlfriend left me. Making rent is harder every month. I know I should get clean again but I don't have that hope in recovery anymore. I was clean for 3 years and I didn't feel better. I'm starting to think neither life will make me happy and I'm tired of all of it. I'm ready to throw in the towel.,1510784343.0
7d7jkk,https://www.reddit.com/r/opiates/comments/7d7jkk/some_musings_on_sobriety/,2,https://redd.it/7d7jkk,His_Dudeness_94,Some musings on sobriety,"So today marks about four and a half months off Heroin and Coke/Crack. It has been gruelling, exhilarating, rewarding, punishing and not as big a deal as people would have you believe. I just need to get some shit off my chest and whose collective shoulder to cry on could be better than my fellow rejects' ? I'm hoping to demystify the billion-dollar industry that is recovery with this post, and who knows some of you might get inspired to turn your lives around or at least try (because Lord do I know that my shit is far from fixed).


First thing I noticed is that the key to sober life is basically dividing your day into little segments, carefully balancing responsibilities and leisure time. It doesn't have to be rocket surgery, you're in recovery so treat yourself to whatever hobbies you'd like to indulge in. Don't overburden yourself with a million goals, like losing weight, getting swole, fixing your legal and financial shit all at the same time. It's paramount to happiness that you set attainable goals (fucking Anthony Robbins over here, I know). I just read a bunch, listen to lots of music and watch lots of TV. I socialize at work, do some online dating and that's that. It's hilariously uncomplicated in comparison to shooting dope and coke daily, but this leads us to the next lesson.


Life is gonna get boring. How could it not be? There simply are no better feelings than shooting hard drugs. So you really need to come to terms with the fact that you'll never get the same peaks of unadulterated euphoria again. This pissed me off to no end at first, but after a while, I settled in. The highs may not be as intense, but they're more sustainable. I love reading, and no it will never get me as happy as a shot of good coke, but it won't break me as a person as much either, not by a long shot. So you need to visualize how a mediocre, content life (by junkie standards of course) can be made appealing to you.


And finally. FUCK COCAINE. If you have a coke habit as well as a heroin habit, I got good and bad news for you. First, you won't crave dope as much as you're afraid you might. However, the coke cravings are *real*. Every now and then, I'm overwhelmed by the immense need for a bellringer. Some trivial things which triggered this feeling:

- the vague smell of fuel
- bouts of nausea
- glass tubes
- any white powder period
- ringing/pressure in my ears

All this shit takes me back to last year: sitting on my bed, geeking so hard I'm unable to move, breathing hard, my heart about to give out, vomiting and loading a new shot of girl every ten minutes. Oh I'm still suffering the consequences: my veins are fucked. I never had a problem finding places to hit until I started fucking with coke.


So yeah, fuck cocaine. It's the real devil to beat, at least for me.",1510782692.0
7d7ivn,https://highlark.com/addiction-epidemic/,5,https://redd.it/7d7ivn,YardsChelsea,"""All The Drugs"" make you stupid, paranoid, and ruthless",,1510782533.0
7d7h6i,https://www.reddit.com/r/opiates/comments/7d7h6i/question_about_pill_testing/,6,https://redd.it/7d7h6i,infr4r3d,Question about pill testing,"Really interested in ordering some oxy or perc but petrified of receiving them with fent.

So I buy the fent test strips but what is the best way to check my pill? Should I break it apart and test some of the middle?

I assume this would be done on each pill you choose to take?",1510782126.0
7d7gmt,https://www.reddit.com/r/opiates/comments/7d7gmt/stupid_question_but_im_trying_to_get_a_friend_to/,16,https://redd.it/7d7gmt,DefnotDEA,Stupid question but I'm trying to get a friend to go to the hospital. Can you get arrested for dope in your system when going to the hospital for an unrelated reason?,,1510781992.0
7d7g1n,https://i.redd.it/qzoermphk7yz.jpg,45,https://redd.it/7d7g1n,BetterDrugTimes,Does this look like H #3 to you guys?,,1510781842.0
7d7eof,https://www.reddit.com/r/opiates/comments/7d7eof/heroin_affecting_thc_high/,11,https://redd.it/7d7eof,angelxrose,Heroin affecting THC high?,"I was told that use of dope really ruin marijuana highs, like you get paranoid and the high is just bad and unpleasant. Is this true at all? Any expierence ?",1510781529.0
7d7co3,https://www.reddit.com/r/opiates/comments/7d7co3/is_a_one_week_break_from_opiates_enough_to_lower/,10,https://redd.it/7d7co3,karna771,Is a one week break from opiates enough to lower my tolerance ?,"i used to take opiates once a week, the effects was amazing every time, but now i take opiates almost everyday since the last few months, my tolerance went up by a lot, if i do like i used to, which is taking opiates only once a week, will i be able to lower my tolerance or now that it went up, it can't go down anymore ? ",1510781044.0
7d7cbs,https://i.redd.it/id135f3yh7yz.jpg,23,https://redd.it/7d7cbs,blake2001xx,Gonna be an amazing couple weeks,,1510780963.0
7d7bfv,https://www.reddit.com/r/opiates/comments/7d7bfv/did_4mg_subs_9_hours_ago_can_i_get_high/,24,https://redd.it/7d7bfv,OpiumSmoker666,Did 4mg subs 9 hours ago can I get high?,On day 2 took maybe 6mg yesterday total. You guys think I should snort a fat line or would it be a waste?,1510780750.0
7d7axm,https://www.reddit.com/r/opiates/comments/7d7axm/how_much_tramadol_is_too_much/,6,https://redd.it/7d7axm,MomSmokesInTheCar,How much Tramadol is too much?,"Serious question. My regular, usually only once a day and only when depressed AF (or if my ""official"" back pain arrives, very occasionally), dose is 0.4g / one tablespoon / 32 pumps. Tomorrow I just want to chill with a friend, watch some sitcom etc... So let's say is it safe to do 400mg repeatedly when I don't feel previous at all? Let's say 1.2-1.6 spread over whole day?
Oh and it'll be on top off some long acting benzos, probably 2-4mg of clonazepam.",1510780629.0
7d7aqv,https://www.reddit.com/r/opiates/comments/7d7aqv/on_the_way_to_cop_wish_me_luck/,10,https://redd.it/7d7aqv,dartweston,on the way to cop! wish me luck,Naw is pretty safe where I live,1510780586.0
7d76jq,https://www.reddit.com/r/opiates/comments/7d76jq/snorting_fentanylheroin_whatever/,1,https://redd.it/7d76jq,Alphabayisgone93,snorting fentanyl/heroin whatever,"Any tips? been doing it for years anyway but i’ve never asked really. 

any tips that will enhance he high or more importantly make sure the product isn’t dissipated hy accident?

1) the only advice i ever received was to avoid the drop (* found that to be bull shit reall*)... 

2) some guys say that to either smother the inside of nostril with water first/after to really get the stuff inside and not slide down throat.

what you reckon? anything to add or maybe something to dispute?",1510779639.0
7d74rz,https://youtu.be/o0Yth4p4Mh4,3,https://redd.it/7d74rz,PoesPoemsPwnPosers,The History of Opium (Documentary),,1510779227.0
7d74qg,https://i.redd.it/ol1f10hoc7yz.jpg,13,https://redd.it/7d74qg,BetterDrugTimes,Is H #3 supposed to burn like this?,,1510779214.0
7d6ull,https://www.reddit.com/r/opiates/comments/7d6ull/boredom_is_what_makes_me_crave_getting_high_more/,30,https://redd.it/7d6ull,asccwe,Boredom is what makes me crave getting high more than anything else,"I swear, I feel bored everyday mostly at the afternoon and night (after work). I'm happy with any high from either speed, xanax, opioids or even alcohol (not mixing them) if I'm really desperate because I don't have anything else to get high... anyone else?",1510776841.0
7d6st4,https://www.reddit.com/r/opiates/comments/7d6st4/today_is_steve_the_crocodile_hunter_irwin_day/,11,https://redd.it/7d6st4,FlipFlopSuicide,"Today is Steve ""The Crocodile Hunter"" Irwin day","Remember, a momentary lapse in judgment and that last poke will get you. Also, all of my posts are to be read in his awesome Aussie accent. That is all.",1510776434.0
7d6rh1,https://www.reddit.com/r/opiates/comments/7d6rh1/fucking_annoyed/,9,https://redd.it/7d6rh1,DragonChaser760,Fucking annoyed,"My dudes slowly getting more and more unreliable used to serve me within an hour and it takes hours just for a fucking response if he can meet or not...over this shit time for a new plug...
Edit:update:I got it I asked him what’s the deal like should I hit them up later and they were sleeping said sometimes they literally are selling 24hr so next time they aren’t ignoring me ",1510776127.0
7d6gou,https://www.youtube.com/watch?v=TSBs-hiapo4,20,https://redd.it/7d6gou,klove99,Wonderful song about addiction. Enjoy!,,1510773600.0
7d6ghh,https://www.reddit.com/r/opiates/comments/7d6ghh/vein_and_muscle_repair/,8,https://redd.it/7d6ghh,klove99,Vein and muscle repair,"Hey guys. So I've been lifting weights and doing excersizes that specifically target my arms, in an effort to speed up recovery of damaged muscle tissue and veins from shooting. I think it works pretty well, although it hurts sometimes depending on where I shot, and the burst of energy and euphoria just from working out is really nice.

My question is, anyone else doing this? Do you have any routines which you consider super effective; what are they?",1510773558.0
7d6e9h,https://www.reddit.com/r/opiates/comments/7d6e9h/warmane_icecrown_ropiates_guild/,7,https://redd.it/7d6e9h,Psychonaut424,Warmane Icecrown r/opiates guild,Warmane is a free wow private sever you download the game from the site make an account and play. I wanna make a guild with some of you all from the sub so we can do dungeons raid and have fun. If enough people want to do it I'll start the formation of the guild. ,1510773041.0
7d6cz9,https://www.reddit.com/r/opiates/comments/7d6cz9/bupe_patches/,0,https://redd.it/7d6cz9,TempUserFFJ,Bupe Patches,"Hey guys, I've been clean of opiates for a while now about a year, and I got my hands on bupe patches.
Transtec 20mg  35u/g an hour.

Well I'm a junkie. If u had one year stop from opiates this bupe should do me well if I IV it.

Can I please ask somebody for instruction what to do to get something out of those? Back i  jail. While I was in USA, we used to cut 8mg suboxone into 12 pieces, then dissolve one in hot water and snort it. And I was flyyyyying. I know it's seems crazy but yeah it works. You snort water with a tiny piece of sub in it. But okay end of the off topic.

Please give me a hand on how to abuse those patches I mean one patch because I basically wasted one now. I prefer iv.

Let me know thanks my druggies <3",1510772734.0
7d6bu9,https://www.reddit.com/r/opiates/comments/7d6bu9/iv_methadone_for_recreational_value/,9,https://redd.it/7d6bu9,distortedisolation,IV methadone for recreational value?,"my dboy is dry,he only has methadone, its worth buying for withdrawals of course,but is there any recreational value??



This is pharmaceutical methadone, straight from an hospital.",1510772514.0
7d68z9,https://www.reddit.com/r/opiates/comments/7d68z9/anyone_able_to_recommend_micron_filters_and_rigs/,5,https://redd.it/7d68z9,Catman12000,Anyone able to recommend micron filters and rigs?,What are the best in terms of price point/quality? Just wanna but a few and give it a go,1510771860.0
7d67kb,https://i.redd.it/noa0eqqlp6yz.jpg,75,https://redd.it/7d67kb,TheOpiumWars,The War on Drugs is never ending. Here is a photo of an officer posing with confiscated opium paraphernalia after the crack down on opium dens in the US.,,1510771546.0
7d653z,https://www.reddit.com/r/opiates/comments/7d653z/to_relapse_or_not_to_relapse_advice_needed/,15,https://redd.it/7d653z,Rva-dopefiend,To relapse or not to relapse: advice needed,"Hey r/opiates, I've been coming here off and on for a while (have had different accounts) and I need some advice. I'm currently almost 6 months sober living in a recovery house. I was using heroin everyday for a few months (sniffed) and got up to about 1-1.5 g's daily because I didn't do anything but use. I didn't work (stole to fund habit) didn't go out just simply sat and used. I have a job right now, 50 hrs week as a cook and about to get a raise so I'd be getting close to 500/week. I'm really bored all the time, I have found some comfort in AA but i feel like it's not enough. Now maybe that's just my brain saying it would like endorphins and that I shouldn't be living a regular life, but i just don't see myself staying clean long term. Not because I can't do it, but because I just don't enjoy it especially once I move out of my recovery house and have a lot more responsibilities and bills.

 I have been talking to my old plug because I really want to use, but I've been torn due to my newfound stability and my family talking to me and stuff is nice. That's really it though. My plan would be to use every once in a while(I don't get drug tested so I'd just have to get high at night when no one would notice in my room) so like once a week or so. I have two back up plans in case I do get caught which would be to go to a detox for 2 days and come back to recovery house (house rules, not an Oxford house) or to move in with my plug who said I can if I have to. The rent at his place would be 350$ a month which is nothing and it would be easy to pick up lol. Anyway that's all the info. What should I do?

Tl:Dr - thinking of relapsing (would only chip) I have two backup plans to go to detox for 2 days and come back to recovery house (house rules) or to move in with plug which he said I could do for 350$/month. What do?

Edit: I also have been on Vivitrol for 5months and it's been 37 days since my last shot. Do you think I'll feel it? I know it's supposed to last only 28 days but I've heard it increases after taken them consecutively.",1510770973.0
7d64on,https://www.reddit.com/r/opiates/comments/7d64on/point_shot_of_tar_with_no_current_tolerance/,6,https://redd.it/7d64on,Hamms_n_eggs,Point shot of tar with no current tolerance?,"Used to be huge into the tar game. Taking shots of .5 up to a gram daily. Cleaned myself up for 45 days and now I've been shooting a 30 mg panda about once every ten days. Haven't had anything for 6 days now. Got a little .1 of some tar. Looks, smells, and feels like some 7-8/10 on the tar scale. I'm 95% sure I'm just gonna go and rip the whole thing in one shot so I can catch that hair on fire, pins n needles, jesus H christ rising again on easter rush, but I figure I'd stop by and get some input from the OpiFam. Also, I will be using alone.

Tldr; Pretty much 0 current tolerance. Have .1 of tar. Do whole thing in 1 shot, or split it into 2?",1510770875.0
7d624p,https://i.redd.it/s8ijibo2m6yz.jpg,13,https://redd.it/7d624p,TheOpiumWars,"Hi, my name is",,1510770270.0
7d5wrz,https://www.reddit.com/r/opiates/comments/7d5wrz/opiate_ps4_clan/,29,https://redd.it/7d5wrz,redditname31,Opiate Ps4 Clan?,We could play online together couple of times a week?,1510769042.0
7d5wea,https://www.reddit.com/r/opiates/comments/7d5wea/recreational_hydrocodone_acetaminophen_75325_t/,18,https://redd.it/7d5wea,unofficialswitchup2,Recreational hydrocodone acetaminophen 7.5-325 t. Dosage?,"I have x3 of these pills. Should I take one, two or three?

EDIT: Popped x2, smoked two bowls, dropped a friend off at work, hit the gas station. Now I'm parked about to walk in and get something to drink. My whole body is numb and I'm high af. Should I take the last x1? Also, I may pop a 1mg xan tonight? Nah.

EDIT EDIT: I got a water at the gas station, hit the homies crib, ripped the juul on a empty stomach, threw up, hit the plugs crib, bought some xans. Popped half of a xan. 1mg. Hit steak and shake. Got a shake. Now I'm back in my apartment in my cozzy bed. Ayee",1510768974.0
7d5trs,https://www.reddit.com/r/opiates/comments/7d5trs/i_found_my_boyfriend_of_2_years_after_he/,24,https://redd.it/7d5trs,hedgebush,I found my boyfriend of 2 years after he accidentally overdosed,I live in Massachusetts and I'm desperately trying to find a support group of people who've been through the same thing. I need to know there's a way to get through this. He was my whole world.,1510768426.0
7d5tpz,https://www.reddit.com/r/opiates/comments/7d5tpz/removing_filler_from_those_1_mg_hydros/,2,https://redd.it/7d5tpz,SJH009,Removing filler from those 1 mg hydros,"I have 60 of these pills but there is way too much filler for me to snort them as is. Anyone know how to extract the hydromorphone so they can be used?

edit: Is it even possible to get high from these? I don't want to put a bunch of filler in my arms. Could plug it but still,  feel like that much filler isn't healthy lol",1510768411.0
7d5oo0,https://i.redd.it/bv5y3zj3d6yz.jpg,44,https://redd.it/7d5oo0,Catman12000,Who’s ready for 🐼!!!! And oxy to boot!!!!,,1510767226.0
7d5m3f,https://www.reddit.com/r/opiates/comments/7d5m3f/does_anybody_else/,4,https://redd.it/7d5m3f,SomeWhiteGirlinVA,Does anybody else,"Ever feel like the people who have passed away are the lucky ones?  Shit is just so hard.  Aside from all of my friends overdosing,  my 34 year old cousin passed away from cancer this morning.  I'm just so tired of being hurt and sad.   Sorry for the boo hoo post. ",1510766650.0
