24q9i8,https://www.reddit.com/r/opiates/comments/24q9i8/why_arent_there_faces_of_heroin/,33,https://redd.it/24q9i8,elstoma,Why aren't there faces of Heroin?,"The images from Google results are the same images from faces of meth.


Is it because heroin users are all beautiful?",1399244632.0
24q4t8,http://www.hightimes.com/read/afghanistan-us-military-cannot-stop-heroin-production,11,https://redd.it/24q4t8,mouthEXPLOS1ON,U.S. Military cannot slow production of heroin in Afghanistan,,1399241467.0
24q4qf,https://www.reddit.com/r/opiates/comments/24q4qf/iving_dillys/,11,https://redd.it/24q4qf,turtlescooter,IVing Dillys,"A little quick background on me: I've been on and off of opiates for about 6 years now. I had a couple years of total sobriety in there, and a couple years of balls to the wall, using every single day in there too. Right now, me and my SO use once or twice a week, but we are going to take a month or so off shortly because I know how insane I can get. Lucky for me, we've already stocked up on subs, gabapentin, clonodine and lope. My thing was always oxy - I started off with the OG OC 80's and when those disappeared, switched to roxys. Then I took my two years off only to return and find that, at least in Florida, even those are hard to come by. Everything is dialudid now, and since I only ever snorted my shit, they are ok but nothing to write home about. 

I knew my SO had IVed a couple time before, but I lost a brother when I was 16 to IVing heroin. I'm also a complete needlephobe, and freak out getting a damn shot at the doctor, so those factors combined led to me being completely against it. My associations with needles are death and terror. 

More and more of my close friends have been doing it though, and then a few months ago, I started reading this sub religiously and realized what a fucking waste it is to snort dillys. Finally, a week ago, I bit the bullet and let my friend and SO hit me. 

HOLY. FUCKING. SHIT. It is like a brand new drug to me. I instantly was pissed at myself for all of the d's I snorted over the last year and basically wasted. Don't get me wrong, I'm still a tremendous needlephobe and I know I couldn't bang shit by myself if I tried (I can't even administer my own epipen out of fear of that damn needle and it's an auto injector... sad but true), but I'm SO LUCKY I only tried this right before a break because I know what a habit this could become provided I had someone around to help. I get more fucked up IVing a half a D than I would from snorting 7 of them, it's absolutely insane. That rush is the most beautiful fucking feeling imaginable. 

So I guess I should say thanks to you guys. I always figured my SO and friends were exaggerating the difference in intensity between snorting and shooting D's just to get me to try it, but then I read and listened to what you all had to say and realized that there just might be something to what they're saying. I even feel like the legs are pretty good, although I chalk that up to not using regularly enough to develop much of a tolerance. Now the only shitty part of dillys is waiting out the necessary 4 hours in between shots so I'm able to fully feel the rush lol. 
",1399241413.0
24q05q,https://www.reddit.com/r/opiates/comments/24q05q/gram_of_fentanyl_hydrochloride/,48,https://redd.it/24q05q,Acetylate,Gram of Fentanyl Hydrochloride,"Hey, bropiates. 

As most of you know, fentanyl is the most potent of the opiods one has any reasonable chance obtaining... Knowing this, I put my friend up to synthesizing fentnayl and although he reported a huge loss in a purification step (60%) the final yield is of sound purity and amazing for any first attempt. 

My long awaited gram of fentanyl is finally on its way. :)

That said, I am a generally opiate-naive person. In fact, I only occasionally dabble in drugs (I find both psychedelics and opiates to be quite interesting) so I know how dangerous this potentially is. Essentially, I am being sent thousands upon thousands of doses of what could be considered a potential chemical weapon..

I must learn how to make a solution. 

Dilution via liquid is quite easy but I would like to know if any of you guys and gals have had success using a powdered mixture without any life-threatening hotspots of potency. 

It should go without saying that gloves, glasses and a mask will be worn at all times while handling this substance. My number one priority (behind doing it...) is safety. 

Thanks for any HR and safety input! 
I love you guys.",1399238339.0
24pzl8,https://www.reddit.com/r/opiates/comments/24pzl8/insufflation_question/,5,https://redd.it/24pzl8,DeceptiveBeast,Insufflation Question,"I have been snorting ECP almost every day for about 1 1/2 years. Before that, I used a variety of different drugs, and if it can be railed, you best believe it went up my nose. Since starting on the dope, I haven't really done anything else besides the occasional blue or some IR Addy that I got a couple weeks back. So my question is about my nasal passage ways. For the past couple weeks, the dope has been giving me a quick burn right after I hit it. It usually burns both nostrils but its more prevalent in the right. At first I figured it was just some cut or some fire since its burned a couple times before. But I've been getting different dope almost every time for the past few weeks and it all burns. I noticed when I blow my nose that there is more blood than usual and a lot of times its fresh and not congealed. I haven't gotten any blood running out of my nose, just when I blow it/pick at it in small amounts. So basically, how fucked up do you guys think my nose is? It has taken a lot of abuse and I want to know if this might be serious or just something I'm gonna have to deal with now. Thank you in advance for your advice! ",1399237980.0
24pzgy,https://www.reddit.com/r/opiates/comments/24pzgy/faded_pill_imprint/,11,https://redd.it/24pzgy,SinningReverend,faded pill imprint,"got some methadone today, the imprint on them is slightly faded/rubbed off

just wondering if theyre fake",1399237895.0
24pyyh,https://www.reddit.com/r/opiates/comments/24pyyh/what_the_hell_do_i_do_now/,9,https://redd.it/24pyyh,IAmVerizonGuy,What the hell do I do now?,"So i just detoxed and I was on the road to quit because I've been in jail. Soon as I got out I noticed a lot more traffic in my apartment building, I was just outside smoking and saw a white guy with track marks coming from right above me, I called him on it. He went back upstairs and down comes his d boy. 

The motherfucker sells blues and dilaudids. Before this would have been a blessing to live right next to. Now its a fucking curse, the temptation is OVERWHELMING. 

How in the hell am I supposed to stay clean like this? Its like waving a full rig in front of me, Jesus.",1399237568.0
24pw6d,https://www.reddit.com/r/opiates/comments/24pw6d/concerned_for_a_friend/,34,https://redd.it/24pw6d,martinb92,Concerned for a friend,"Hi all, my friend smoked opium for his first time yesterday. Today he seems really mentally off and he keeps claiming to have heard voices talking about him. Is he ok? How long will this last? I am scared for him",1399235846.0
24pnhn,https://www.reddit.com/r/opiates/comments/24pnhn/you_may_remember_the_piece_i_wrote_the_other_day/,1,https://redd.it/24pnhn,BabbMrBabb,"You may remember the piece I wrote the other day, ""Way Back When I Was Younger"". This is another one.","I wrote this 4/30/14 but I haven't really been in the mood to post anything lately. I finally decided to quit the other day. Not by myself this time. I can't even count the times I've done that before and relapsed the next morning. I actually reached out and told my mom and I'm going to rehab/suboxone/counselor all that tomorrow. But anyways here's another piece. 



As I lie awake tonight

I feel like I'm goin insane

Like my mind has finally derailed, 
off the tracks like a train.

The mental stress I'm under now is worse than any pain

Maybe it's time you drop them pills,
man you know you're not the same. 

You continue tryin to fool yourself,
like this high will last forever

Quit lyin to yourself man,
this should be your main endeavor 

You're dancin with the devil now,
it's up to you to make it better

Don't you think it's past the point that you should put em down?

You lost your job, then your girl,
plus more friends than you can count

Now obviously what's going next,
is your sanity

Then shortly after that, 
it's gonna be your family

The voices in your head are right

You're finally goin insane

You're 19 years old,
This is too much mental strain

You should be livin life,
Workin on your future

But instead you're in the fast lane
to become the next young shooter 

As I write these lines right now,
I can barely focus

I'm sad for all of us

That will soon be another soul,
lost to dope

But even in the state we're in, 
above all hold on to hope

But then there's the reality,
It may be you, or it may be me

But one of out addictions 
WILL be another junkie casualty 

If you're trying to quit,
Please don't stop

It may be a hard road, 
But stay for the ride

Make yourself reach the top

Don't become another junkie,
Or a ""could have been""

State addiction in the eyes,
and tell him

THIS IS THE END. 

This path will lead you one of three places
Depression, jail, or death

That's reality. 

Face it. 
",1399230169.0
24p9xa,http://www.thedailybeast.com/articles/2014/05/04/saving-grace-a-junkie-s-trip-to-freedom-through-ibogaine.html,5,https://redd.it/24p9xa,StrayDog1488,Hallucinating Away a Heroin Addiction,,1399221170.0
24p8sh,https://www.reddit.com/r/opiates/comments/24p8sh/sick_and_tired_of_pharmacists/,40,https://redd.it/24p8sh,tennis22,Sick and tired of pharmacists,"I have a legit medical condition, I go to a legit doctor, I get a script for opana 5mg and I cannot get it filled.  I'm so tired of these pharmacists refusing to fill my script all because I live in Florida.  They all need to go and suck a dick",1399220329.0
24vcif,https://www.reddit.com/r/opiates/comments/24vcif/kratom_is_underrated/,40,https://redd.it/24vcif,banebridge,Kratom is underrated...,"I didn't wanna post this in r/kratom because it's nothing but a vendor circle jerk, but kratom is the shit. My OC connect moved out of town so after a few days of withdrawal I ordered some Red Vein Borneo and bam, I was extremely surprised. I actually was nodding out a little, nauseous, and extremely euphoric. It actually felt better than OC, just not as powerful. I recommend to anyone who's interested. Just make sure you get from a good source!",1399390552.0
24v531,https://www.reddit.com/r/opiates/comments/24v531/my_psychiatrist_threatened_to_discharge_me_if_i/,12,https://redd.it/24v531,anditwaslove,My psychiatrist threatened to discharge me if I don't kick the codeine. Is he right or should I take action?,"
EDIT: Just want to make it clear that I know he lawfully has the right not to treat me. I didn't word the title very well. I don't mean 'take action' as in legal action. What I'm confused about is whether he's right that no therapy will work whilst I'm using codeine. He was very insistent that it can't help me. 

I hate to be dramatic but I can't do this much longer. The psychiatrist and nurse I have atm (I am diagnosed with Borderline Personality Disorder, severe anxiety and depression, as well as an 8-year codeine addiction) are the first people that I have actually liked thus far. And then I go to my appointment today and my psych basically switches on me. I have been offered psychotherapy in the past on a number of occasions and I have said yes to it. For some reason my psych never referred me, but would bring it up at appointments. Today he tells me that no therapist is going to see me as long as I'm using codeine. He blames pretty much everything on my addiction despite the fact that I am diagnosed with BPD...? I told him that I had to respectfully disagree and feel I deserve a chance at the therapy, to which he replies in the most degrading tone, ""No. Why!?"" Why do I deserve a chance at therapy? Seriously? The entire appointment was him belittling me, which hasn't happened before. I'm just so confused and feel so helpless. Eventually he threatened to discharge me if I don't kick the habit. The thing is that it's not even a huge habit. It's codeine for starters, and I only take about 270mg a day. Like WTF. I KNOW it's a problem, without doubt, but I can't help but feel he's blowing it way out of proportion. 

He said that no therapist will treat me because psychotherapy is ""too deep"" and will make me use more codeine. I reasoned that I feel there's much, much less chance of that happening than of someone getting clean, finding the therapy too overwhelming and relapsing. 

Can anyone shed some light here?
",1399385715.0
24uwwk,https://www.reddit.com/r/opiates/comments/24uwwk/ahhh_lifes_good/,14,https://redd.it/24uwwk,GnarlsNodley,Ahhh life's good :),Going into my fucking amazing job with a nice high on ready to wreak shit. I swear my motivation to be the best when on oxy is crazy I need to carry this attitude over to my sober mind. Just wanted to spread good vibes I hope you guys are doing good. So all the full time workers here do you like your job? And what is it about your job that you love?,1399379161.0
24usql,https://www.reddit.com/r/opiates/comments/24usql/a_question_for_you_tech_savvy_nodders/,20,https://redd.it/24usql,RockinRoxiThrowAway,A question for you tech savvy nodders,"I've been considering taking a swing at the new Silk Road here in a few days once ive got this Bitcoin thing figured out. Has anyone used SR 2.0? How was your experience? Is there another market you would recommend over it?
Im looking for either Oxy or Opana if that helps.

Thanks everybody for your input!",1399374938.0
24uq0s,https://www.reddit.com/r/opiates/comments/24uq0s/sowhy_has_iv_etiz_not_made_the_front_page_with/,34,https://redd.it/24uq0s,dizzzzzzzzzz,So..why has IV Etiz not made the front page with gleaming reviews?,"the rush is the cliche sedative, similar to IV lorazepam or midazolom.  When the dose was doubled and 3 mg of bupe was added for a next shot...good Lord Im surprised stamps arent cut with this.  Felt like a .25 Bmore RAW shot or maybe a bundle of average philly bags.

Not advocating this use, I am just stunned as to why people have not been (or have they) cutting dope with powder tiz.  Dont do this, kids!  too good to be true",1399371623.0
24upki,http://imgur.com/a/dQkQx,66,https://redd.it/24upki,goatsheadsoup22,"my last dope porn, getting clean. [F]",,1399371048.0
24ud0o,https://www.reddit.com/r/opiates/comments/24ud0o/so_i_got_fired_today/,24,https://redd.it/24ud0o,noddyboy,So I got fired today. . .,"And then a few hours later my buddy hit me up offering to train me in a sales position where I'll make minimum twice as much a month. . . And I start tomorrow.    
I guess when life hands you lemons, smoke tar and awesome shit gets handed to you.",1399355433.0
24u9au,https://www.reddit.com/r/opiates/comments/24u9au/cry_baby_post/,25,https://redd.it/24u9au,obiwankenopiate,Cry baby post,"Where the hell to even start. This sub has been my home for so long. Even as a lurker this has always been the place to come read along and find some sort of comfort with others living a life very close to mine. The last 7 years of my life have been a slow build to this epic shit show I call my everyday life nowadays. This addiction has taken everything from me and rewarded my use with  nothing at all. Countless times in the past year I prayed for death when i would close my eyes at night, hoping that this nod would be the last. How would I EVER repair this fucking path of destruction I have left in my wake? My beautiful wife had no clue for so long. I recall our honeymoon, I brought along six 10mg Tabs. They were more than enough for a few days of fun at the time since i had NO tolerance at all. I wish I could go back to those days and beat myself fucking senseless for opening the door to this hell. It is all my fault and I blame no one along the way. I just liked to get high. It helped dull the pain of my childhood. I am not special, I probably had it no worse than the majority of people with fucked up childhoods, but pain is all relative. 
 

I threw away my college time, maxed out credit cards, borrowed, stole, pawned, ripped off, conned, and schemed my way through the last 7 years since getting married. It's probably no coincidence that my use skyrocketed once getting married. I was completely unprepared to take on the responsibilities, but with a little warm blanket wrapped around me I gave it one hell of a go. Its not been all doom and gloom from the time i started. There was a time I maintained a full time job, a band, an LLC and had many friends. Slowly though its all come and gone. I lost my job a few weeks ago when my contract finally ended after many years. All of the sudden my bills, rent and $200 a day habit were in jeopardy. 



After a few days I landed an even BETTER job, things looked ok. Just had to pass this Urine test which i knew i could do. I have active scripts for every opiate under  the sun. On the final call before i took the test the lady said the words that made me turn pale, ""HAIR TEST"".... Long story short i fucking nuked any chance of getting that job right at that moment. I partied with some old music buddies about 2 month prior and enjoyed some coke. Again.... this is all my fault and no one else. In the past week I tried to clean up and folded a few days in. I have been sick the whole time. I had a wonderful offer last night, guy called me out of the blue, he offered to deliver. BINGO. So he rolls through and does a quick hand off out the window about a block from my place. ( I didn't give him MY address) Smooth handoff and he is gone. This is a guy I have dealt with off and on waaaaaay longer than my number 1 guy. I walk home and bust open the bag, nothing but store brand acetaminophen. You gotta be fucking kidding me. I call him and get the old ""oh yeah i will be right back"" bullshit. Of course its bullshit and I know i will never see him again. In 7 years i have been really good about not getting jacked. Like insanely vigilant about it.  


In my withdrawals these past 2 months though it has happened twice, its like im slipping or losing my edge. Both of them have been with me for pretty much the entire 7 years. I am not a shithead to deal with. I spend a ton and even throw in a few extra bucks here and there. ESPECIALLY if its later in the evening or if someone has to drive out of the way for me. I have some user friends who I could usually call up who knew where to get random pills here and there.  i always throw them a handful for facilitating the deal and doing the run. Usually something along the lines of as follows. ( If i pick up say 20 norcos. Then i will buy them 5 on top of that for making the calls and picking it up. Or if buying 30's i will always spend enough to get them 1 or 2. If I had alot of cash at the time I always picked them up more.) I think its  good deal for making the calls. These were always last resort deals because 9/10 times i could find it on my own. 



Here in the last 6 months those guys have quit returning my calls most of the time. Flat out  out telling me that buy out all of their dealers leaving them nothing when they want to go get it. HA, its actually one of the only times I have felt like a dick for buying drugs. All of that said, the shit is definitely getting much harder to find around my way. A couple of other middle men i dealt with along the way got out all together, be it on their own or to other reasons.  H is also semi hard to track down out here and pretty hit or miss in my experience. I used to naively tell myself that when H became my only option it was time to hang it up. That is exactly where things are. Now please don't kill me just yet, I used to tell myself that shit when i was first starting out. At the time i had somehow convinced myself that pills and H were SOOOOOO much different. What a god damn joke. 



Growing up I had reoccurring dreams and fears that I would die at 27.  I am 27 now. This has very easily been the hardest year of my life. Once again..... ALL MY FAULT.  I only have 2 months left before 28 and I really feel like im self fulfilling that morbid prophecy. Tonight i caved in and went to pick up. I managed to not get ripped off and the second i was high, got the most overwhelming sense of guilt. I sit here typing this  out knowing i will be sick again in less than 24 hours and there is nothing to stop it. My bills are still piled up and all i can think about is not getting fucking sick. Like a week of wd's are the worst fucking thing on the planet, compared to losing what little bit i have.  There was no point to this post, other than to actually visualize my thoughts. i got high tonight and sat on the bank of the Mississippi river for two hours fighting the urge to just end this charade. I feel like I have fucked my girl up so bad, i truly hate myself for what my problems have done to her. She is honestly the only thing that kept me from jumping tonight. Not a god damn soul that walked by asked me with the tears rolling down my face tonight if i was ok. no one cared. All i could play through in my head was , "" how will she  handle this ? She is going to have to pack my things. ""  Even in death I couldn't be a god damn burden on the  one who means the most to me. 



I've been told a million times, to quit you have to want it. It has to be for you and no one else. I just don't  see it. I do not value my own life the way i imagine other people value their own. I don't WANT to quit, i just feel like it is TIME to quit. This thing has run its course and I really feel like things are about to get a million times worse if I do not change immediately. Oh how i want to do anything but change :/




 I apologize for subjecting you all to this shit show. I really needed to put these thoughts down to see them. I am sorry if its just ramblings, its not a sympathy plea. Just the writings of a guy who is currently high and wishes he was anywhere but here. 




TL:DR; The incoherent ramblings of a pity pot riding opiate addict. Sorry in advance. REALLY LONG AND POINTLESS",1399352025.0
24u923,https://www.reddit.com/r/opiates/comments/24u923/should_i_go_through_with_this_deal/,13,https://redd.it/24u923,throwawayoxy1,Should I go through with this deal?,"I'm about to run out on my oxycodone supply and I can't find any connects for more. However, something popped up recently that I'm seriously considering. A lot of people in my area are using an app where you can post anonymous pictures and posts and view others' posts in your area (yeah I know, location can be traced, but it's essentially anonymous for the non-tech savvy person who doesn't know how to trace others). I was rolling pretty hard with a couple of friends last weekend and posted something along the lines of that. Someone messaged me through the app and asked to hook him up, and I asked him his name and looked him up on FB. I have a few mutuals with him but I don't talk to them anymore, so it'd be weird to ask them to vouch. I agreed to, and he told me to hit him up for anything else, so I asked if he had oxy. He offered to trade me 5 40mg OC's (30 each) and 50$ in exchange for 10 caps of molly.

Should I go through with this? Would an undercover be likely to bust me for selling to him (well, as a middle-man) by exchanging oxy? I honestly really prefer to not deal with someone I don't know but I'm getting desperate. I can't find any in my area right now and this is probably my only shot for a pretty long time. Thanks for helping guys",1399351811.0
24u73o,https://www.reddit.com/r/opiates/comments/24u73o/15mg_morphine_questions/,4,https://redd.it/24u73o,MonsterStretch,15mg morphine questions..,Are 15mg morphine pills good to IV? I am looking for something to replace the 8mg dilaudid I usually do while my guy is out!! Are these comparable? Can anyone help?,1399350116.0
24u6ol,https://www.reddit.com/r/opiates/comments/24u6ol/question_about_iv_and_air_in_syringe/,4,https://redd.it/24u6ol,opydopy,Question about IV and air in syringe?,"So I'm new to IVing. I read the safe injection guide and have tried to read up what I find on here. So far, I have no problem getting in a vein. As I pull back to try and register, my inexperience causes me to slightly come out of the vein and I accidentally introduce some air into the syringe. I get back in the vein and all is all is good. Pull back to register and I see blood so I'm ready to press on. What about the air bubble that is now in the syringe?

Do I have to pull out and transfer the solution to a new rig? Something tells me that I shouldn't inject the small amount of air in my vein. What do I do?",1399349753.0
24u4pw,http://i.imgur.com/0TbAVbE.jpg,1,https://redd.it/24u4pw,Shoot-to-hit,Last of the 8ball I bought 2 days ago [BTH porn],,1399348275.0
24u200,https://www.reddit.com/r/opiates/comments/24u200/just_feels_nice/,6,https://redd.it/24u200,opibro,just feels nice...,https://www.youtube.com/watch?v=-9huWlXFA1s,1399346272.0
24tzwv,http://i.imgur.com/1BSw7IG.jpg,10,https://redd.it/24tzwv,Towboater1984,Long time lurker first post. Pill porn!,,1399344796.0
24txef,https://www.reddit.com/r/opiates/comments/24txef/hep_c/,10,https://redd.it/24txef,livinalie1,Hep c,"Im a bit curious, what exactly is hepatitis C? I tried reading the wiki page but got confused as hell, and was wondering if anyone could explain what the symptoms and overall effects on your health are.",1399343111.0
