4p6sg4,https://www.reddit.com/r/opiates/comments/4p6sg4/ever_come_across_m357s_anymore_all_the_crazy_fent/,10,https://redd.it/4p6sg4,Opilyfe44,Ever come across M357's anymore? + all the crazy fent press horror stories,"So came across some m357s recently (the hydro 5/500's that they stopped making a couple years ago when they made the switch to 325 for everything).  They looked perfectly legit but does anyone ever come across these anymore?  

With the crazy shit coming out of California (among other places) of Fent not only in heroin but pressed into some normal looking norco 10's which killed or hospitalized a number of people - do you think theres reason to worry about something like this?  

My friend and I were debating it the other day lol.  How widespread to y'all think the problem is?  Also - do you think anyone would use hydro 5's to sneak fent in? (Not to mention the fact that they're not made anymore with that 'm357').  It seems like the handful of cases that this has happened (with pressed pills) they've either been Oxy (in various doses) or this string of Norco 10's in California a couple months ago.  

Im not sure if they ended up buying them or not but ill try finding out and reporting back but would love to hear what you guys think.",1466541202.0
4p6r4f,https://www.reddit.com/r/opiates/comments/4p6r4f/its_been_2_years_since_uvelvella_passed_away/,11,https://redd.it/4p6r4f,residude,Its been 2 years since /u/velvella passed away.,Test your shots! ,1466540773.0
4p6nqz,https://www.youtube.com/watch?v=3Q9rewnLFYw,3,https://redd.it/4p6nqz,UsamaBinNoddin,I Can't Stop,,1466539693.0
4p6nna,https://www.reddit.com/r/opiates/comments/4p6nna/left_everything_behind_to_live_on_the_road_its/,31,https://redd.it/4p6nna,somepplcalImemaurice,Left everything behind to live on the road. It's great except,"Copping when you're in a new town every couple days is damn near impossible. My last shot was over a week ago, and I'm about to implode. I've got rigs, money, transportation, but no dope. Withdrawing when you're living in a tent is not fun. 10/10 would not recommend. Guess this is mostly a rant/shitpost/suggestions welcome/trying to keep my mind off it. Hah",1466539654.0
4p6njm,https://www.reddit.com/r/opiates/comments/4p6njm/pst_in_europe/,4,https://redd.it/4p6njm,blacktarbunny,pst in europe,"anybody from europe use pst? im stuck in the homeland and im sick of getting drunk everyday. 

the problem is theres no label on the seeds saying if there washed or unwashed. does anyone know what the norm is over here? i realize every country is different but id still take some opinions.....

ive also never used pst before(just h) so some general tips would be appreciated",1466539625.0
4p6ajg,https://reddit-uploaded-media.s3-accelerate.amazonaws.com/images%2Ft2_yuwtr%2F9j3h89exwo4x,5,https://redd.it/4p6ajg,davidnutter,UK brown,,1466535484.0
4p5w7i,https://www.reddit.com/r/opiates/comments/4p5w7i/best_way_to_kick_start_your_sex_drive_after/,23,https://redd.it/4p5w7i,zjciprazz,Best way to kick start your sex drive after coming off a run that completely decimated it?,"I had been using for the past few months, and my libido and sex drive pretty much disappeared completely. If it wasn't for the fact that i came clean to my girlfriend about the fact drugs were involved, she would surely have thought i was cheating on her by now. 


I managed to stop with the H, and switch over to suboxone, which i plan on tapering off of shortly, and i want to do whatever i can to bring my sex drive back. Can anyone share what has worked for them, other than just waiting it out? I know there are tons of supplements and products targeted towards increasing libido and sex drive, as well as increasing testosterone for the purpose of working out, but because there is such a big market for that, i know there's also a big market for rip off supplements as well. 


",1466531077.0
4p5skh,https://www.reddit.com/r/opiates/comments/4p5skh/itching_on_the_comedown_only_why_is_this_and_how/,10,https://redd.it/4p5skh,p_hinman3rd,"Itching on the comedown only, why is this and how do I stop it?","Ok, so the itching comes from the histamines right? But when my opiate (tramadol) wears off I start to feel itchy, and this can prevent me from sleeping. I read somewhere that the itchiness is also caused by your skin's nerves returning to normal, so they become like hyper sensetive after being suppressed by painkilling effects. I feel a little itchy when the tramadol is still very active, but nothing that bothers me at all. So i was thinking maybe I can take some kratom at night for the itching to stop, since the itching is at its worst when I'm coming down. What are you guys' thoughts?

Unrelated : I love tramadol, it makes me able to force myself to work all fucking day by only taking like 200mg, and no depressive comedown like stims. I only use it for work (creative purposes) and never outside of this. And I use it around 4 times a week when I have it. What are you guys' thoughts on this in terms of addiction? I'm not looking for a rush, but just enough to work. I do this with stims aswell, I used to be somewhat addicted to stim rushes (cocaine, EPH, A-php) but now I only use racemic amphetamine powder. 

#TL;DR : 

* Do you itch more during or after the opiate high?
* Do your itches during, and after the opiate high vary? (For example I have more itchiness on my nose and face during the high, and after the high I have itchiness all over my beautiful athletic low bodyfat god send body)",1466529954.0
4p5ksh,https://i.imgur.com/6nodoet.jpg,7,https://redd.it/4p5ksh,justinsideyo,My man is finally back in town. Happy Tuesday.,,1466527666.0
4phbeo,https://www.reddit.com/r/opiates/comments/4phbeo/anyone_brave_enough_too/,25,https://redd.it/4phbeo,druggie_throw_away,Anyone brave enough too,"post their main account? I know I can't be the only one using an alt on this sub? 

I guess I'll go first... saturn1ascends 

not going to link it for obvious reasons. ",1466696039.0
4ph98x,https://www.reddit.com/r/opiates/comments/4ph98x/reup/,9,https://redd.it/4ph98x,Youngstacker135,Re-up,I'm getting another 100 hydro 10s for the month tomorrow. I finally feel like I have 1 solid connection now. I pay $7 for 1 10mg pill and I get 100. I know I'm paying a lot but it's difficult for me to get anywhere else. What do you guys think?,1466695335.0
4pgw1s,https://www.reddit.com/r/opiates/comments/4pgw1s/norco_and_coke/,10,https://redd.it/4pgw1s,button_warrior,Norco and Coke?,"How soon after doing Coke could I take some norco? Wasn't a lot of Coke, and o my 10mg of Norco. Normally I'd avoid the combo altogether, but in small amounts it can't be that dangerous, right?",1466690686.0
4pgvzf,https://www.reddit.com/r/opiates/comments/4pgvzf/purple_dope/,10,https://redd.it/4pgvzf,bingequeen,Purple dope?,"So lately my girl has gotten a new batch of stuff. Her previous dope was always fire, no problems. Well she has this new stuff that looks normal and smells like straight vinegar, but when you add water and go to draw it up, it's purple. It also has no legs, like a 3 minute rush and then you get really hot and sweaty and then nothing.

What could they be cutting it with to turn it purple?",1466690670.0
4pgtpc,https://www.reddit.com/r/opiates/comments/4pgtpc/early_morning_dboys/,26,https://redd.it/4pgtpc,401firreee,Early morning dboys,"So happy I finally got a connect that wakes up early! I get my money at like 6am deposited, usually have to wait until atleast 10 for anyone to answer their phone. New plug answers right away, after a short walk I get my shit by like 7,. Actually had to wait on the dam pharmacy to open so I could grab rigs lol. Just wondering if anyone's dboy or d girl is an early riser ",1466689777.0
4pgaoy,https://www.reddit.com/r/opiates/comments/4pgaoy/drugs_are_not_worth_dying_for/,13,https://redd.it/4pgaoy,StartingDosage99,Drugs are not worth dying for.,"Guys, opiates lead to death.
If you are not ready to die prematurely at some point please stop it. 

I quit H almost 10 years ago and I am the only one from my entourage to quit. The rest are on methadone ""treatment"", some of them died, some in jail.. all good kids, with good families and with good intentions -> it all went to shit.

Please be MEN and take it like fucking MEN (even if some of you are females)

The one thing that kept me going through the withdrawal (did self medicate only the first night with methadone) was thinking that it will pass at some point. And it did, today I almost don't remember the taste of smack.",1466682077.0
4pfxdi,http://i.imgur.com/KwdrZKY.jpg,9,https://redd.it/4pfxdi,BOXFROCKS,My PCP hooked me up with a week supply till I can start a new physical medicine doctor.,,1466674981.0
4pfw24,http://imgur.com/OUT1ibV,1,https://redd.it/4pfw24,DrDependence,"Set for a few days. Some OP 40s, OP 10s and a few IR 10mg oxynorms. Getting that ""you after any""? text is the best thing ever. After Krispy Kremes.",,1466674230.0
4pfv72,https://www.reddit.com/r/opiates/comments/4pfv72/i_suck_at_junkieing/,11,https://redd.it/4pfv72,Butcher_of_Blavikenn,i suck at junkieing,"So apparently someone stole one of my check books a couple months ago. Every payday this person had been writing checks for small amounts like $50 at the most. I wouldn't have noticed if they hadn't used one to write a check for $600 on a week I'd only be making $400. Now I'm fucked for a few weeks which sucks but OT will fix that, but how the hell have I not noticed $50 a week missing for the last two months?!?!  

Fuck you to the guy that stole my checks, and fuck you to the shady check chasing place that let him cash them, and fuck me for being so fucking stupid.... ",1466673747.0
4pflxd,https://www.reddit.com/r/opiates/comments/4pflxd/good_guy_dboy/,4,https://redd.it/4pflxd,reverick,Good Guy Dboy,"My dboy has always been my favorite drug dealer I've ever had. Better than any pot or coke or pill dealer I've had the displeasure of dealing with. Today cemented my love for him.

The wifey and I  hit him up late afternoon for a brick and he said he only had one bun left but was do for a re-up if I wanted to wait. So I scored a little something something from my neighbor since I was sweating buckets from the oncoming withdrawal. Of course he texted me as soon as the money changed hands and said to arrive promptly at 7:30. So the missus and I saddle up and arrive at 7:31, but he isn't answering. Despite how common this is in our walk of life this is rather uncharacteristic of him. And my phone is dying. After 15 minutes of panicking I get a text on my broken ass phone saying come by in ten minutes and my phone promtly dies before I can even finish reading it. We get some coffee and arrive unannounced (which he hates). Not even mad he invites me inside and tells me to get my girl from out the car since his dude said ""he's just around the corner."" It was kind of comforting to know he has to deal with that sort of shit to. He pops on some Eastbound and Down and we shoot the shit a little. This is where my respect and love for him started to blossom. 

After like half an hour he apologizes for the wait and gives me a .3 of some molly he has for the inconvenience. Fuck yeah. He gave me a sample of some a few months back and it was damn good, not to mention its my wifes favorite drug and our E/molly dealer just moved. Watch more TV and an hour and a half has passed and now his dealers phone is off after saying he was ten minutes away, 90 minutes ago. We panic, get mad, and debate whether he got arrested or not. 

At the two hour mark my girl asks if we should just split and do what we got earlier and come by tomorrow. And voila, his dude says he is right around the corner. But! He actually is. I give him my cash and let it walk and boom, less than five minutes later he hands me my brick. With an extra 5 stamps for the wait.
 
But wait! There's more! He saw how broken down my phone was (cracked/shattered screen I can barely read)and gave me an old droid of his he hasn't used to activate and replace my busted one. My man! 

In all seriousness despite all the freebies he is a really good guy. Prompt, friendly, and all about business. It probably helps that my wife and I don't act like fiends with him, respect his time, and are good loyal customers. And shit, I'd hang around an extra two hours watching TV every single time if it meant some free molly, extra bags, and a free phone upgrade.

Despite the anxiety and stress I originally felt with my phone dying and waiting it turned out to be a damn good day. I hope the rest of you had at least a decent day full of happy nods. 

TL;DR - My dboy's dboy was 2 hours later then he said he would be, so my dboy gave me some free molly, an extra half a bun, and a free phone to replace my busted one for the inconvenience.",1466668330.0
4pfkki,https://i.reddituploads.com/03bab67f3a1544f28400805ea8c8ff4e?fit=max&h=1536&w=1536&s=54c4b925f5b8ce47bf7c6db437ccb7a3,10,https://redd.it/4pfkki,PuckingFunks12,It's getting better out here!!!,,1466667554.0
4pfew9,https://www.reddit.com/r/opiates/comments/4pfew9/you_catch_this/,5,https://redd.it/4pfew9,ZachGreeen,You catch this?,"Anyone else seen X-Men: Days of Future Past? Xavier was straight dope fiend status in that movie. Sick as fuck on screen and everything. Painful to watch, really. Hahaha. ",1466664514.0
4pfedd,http://i.imgur.com/gRTPIt2.gifv,17,https://redd.it/4pfedd,JIVEprinting,U,,1466664255.0
4pfdiv,http://imgur.com/ACnw6wl,7,https://redd.it/4pfdiv,astrotest,Danger Will Robison! Danger? ( .05 BTH + .05 Kpins) ( I dint die),,1466663834.0
4pf393,http://imgur.com/an6LHoZ,27,https://redd.it/4pf393,Princess_Poppy,I love cereal,,1466658652.0
4pewiq,https://www.reddit.com/r/opiates/comments/4pewiq/is_it_true_that_if_i_smoke_enough_opium_i_will/,8,https://redd.it/4pewiq,KingShindo,Is it true that if I smoke enough Opium I will become Chinese?,Seems like a desired side-effect to me ,1466655370.0
4per7k,https://www.reddit.com/r/opiates/comments/4per7k/runners/,4,https://redd.it/4per7k,hayzz71829,Runners....,"So my dboy was out of town today and set me up with a runner. Now my dboy is always legit, his times are always on etc which is usually rare. I go to meet his little runner girl and she takes forever acts really stupid about the transaction. Is super obvious about it and then I check the supply and she shorts me. I go to do the stuff and it is nothing compared to what I get off my dboy. His stuff is always quality. She really made me angry and I almost felt bad for my dboy for a second like she was hurting his business. Anyone else have bad experiences with a dboy's runner?",1466652982.0
4per77,https://i.reddituploads.com/6bf019e37e304a62bfec34ca962fb913?fit=max&h=1536&w=1536&s=4fb6091cba1e8e0742f5bfc7ff74af7a,15,https://redd.it/4per77,april5262,are these poppy seeds? or anything from the opium poppy plant?,,1466652979.0
4peplx,https://www.reddit.com/r/opiates/comments/4peplx/tried_to_off_myself_tonight/,17,https://redd.it/4peplx,bricksrus412,tried to off myself tonight,Dis two 10bag shots when my dog knew something so went and got my parents in the other room I can't blame him he loves me I wish he would have let me go. I usually sniff ,1466652304.0
4penz3,https://www.reddit.com/r/opiates/comments/4penz3/quit_my_job_today/,13,https://redd.it/4penz3,FALLloutFREAK,Quit my job today,"Quit my job today, the owners wife accused me of stealing from the register, which I fucking didn't, the customer left a two dollar tip and I had it in my hand when I opened the register and I closed it before it even finished opening. His wife said I stole $11, a ten and two ones and that I put it in the tip jar, and when he checked he found a ten and there's always ones in there so to him that's all the proof he needs (as if no one has ever tipped $10 before) and because I stormed out he thinks that he was right. I only have 20 100mg trams left and I can't spend anymore money on pills cause I need to save all I have until I get a new job. I wish a car would fucking hit me or maybe I'll take all the trams I have to od and drift off or some shit.",1466651604.0
4pelyx,http://gawker.com/fuckman-ass-judge-and-donkey-dicked-murder-suspect-1782465086?utm_campaign=socialflow_gawker_twitter&utm_source=gawker_twitter&utm_medium=socialflow,24,https://redd.it/4pelyx,LawyeredOp,Feel Legal Advice: don't do the following...,,1466650768.0
4pei3m,http://i.imgur.com/gQQ6cl3.jpg,4,https://redd.it/4pei3m,107kgka,Oxycodone,,1466649232.0
4pegsj,http://www.wesjones.com/pollan1.htm,8,https://redd.it/4pegsj,Marb100,Opium Made Easy â€“ One gardener's encounter with the war on drugs,,1466648738.0
4peemr,https://www.reddit.com/r/opiates/comments/4peemr/pretty_impressed_with_suboxone/,27,https://redd.it/4peemr,chrome015,Pretty impressed with Suboxone,"Today I had my induction at a very amazing office of a doctor who has been treating wealthy locals here in the city for many years. Overall this lady is down to earth and understands my needs, and I can confirm this doctor has the skills to help me get clean I have 2 months of treatment on subs then group therapy sessions my outlook is positive. I got to her office at 3pm after she had me go to the pharmacy and pick up my Suboxone. She took my vitals asked how I was feeling. Then she went and got her Bluetooth Bose system and turned on Pink Floyd and instructed me how to open the Suboxone package and where to place under my tounge...I've been 54 hours with out any opiates sick as fuck and I put this 8mg sub under my tounge for 10mins and after 30mins I felt the weight just come off. She took my vitals every 30 mins we proceeded to chat about whatever...I'm the guy who does not look like a junkie I'm well off with a bad habit she says.  Anyway her practice is small  and maybe 20 other clients nice office she even has a office dog. Anyway 30 mins and she tells me to open another Sub I'm like yeah sure so I have another. And that's when it hit me I confirm I was buzzed. We hung out chatting and listening to classic rock classical rock for another hour, then she says don't worry about dropping with weed in your system I immediately laugh she the says ""I don't find weed a dangerous drug as long as your not driving"" I told her I did not smoke. This lady is 55 years old 110 pounds grey hair Gucci handbag nice dress. SHE gave me a hug, never been hugged by a doctor lol and I left then she texted my phone and asked how I was feeling and I said better. Anyway this doctor is like a angel who heals blue-collar people, I really feel like going forward with treatment and never touch dope again. And to you guys also thanks for the support and I wanted to share my experience so far.",1466647879.0
4pedk4,https://www.reddit.com/r/opiates/comments/4pedk4/whats_the_app_ive_seen_mentioned_here_for_selling/,10,https://redd.it/4pedk4,OAS33,What's the app I've seen mentioned here for selling items?,Or what do you guys recommend?,1466647439.0
4peb0l,https://www.reddit.com/r/opiates/comments/4peb0l/overdose_help_in_the_uk/,7,https://redd.it/4peb0l,londonjunkthrowaway,Overdose Help in the UK,"I'm a high-functioning addict in the UK (opiates+benzoes+booze at night/weekends and then modafinil in day to allow me to work in the office). Recently things have been getting worse and I've been using a largish stash of Fentanyl powder I have.


One or two times I've felt scared by taking more fent than I meant to or after letting my tolerance lower through partial withdrawl. My addiction and the profession I'm in means I can't get help from the usual services in the UK (they don't seem to be aimed at least part-functioning addicts anyway).


Can anyone recommend how to get hold of Naloxone, ideally the Narcan nasal spray? I know it's available through the various treatment programs we have in the UK (which do seem good) but just by entering one of these I would lose my job and destroy my career I've spent my whole life working for. I live with a close friend who I think I can trust to check on me and administer should my fears come true.


I know I am privileged and my fears must sound petty compared to many of you in this forum but I'm really scared and I don't know what else to do. It's nearly 3am here (I stay up late so I have longer to get high before work in the morning) so I may not be able to answer any questions for a day or so.


Any and all questions, advice and suggestions are welcome. From the little I've seen of this forum you are good people. Please help me I'm really really scared.


Note to mods: I don't believe this counts as sourcing as drug abusers are allowed to possess Naloxone in the UK due to a change in the law in 2015 (see http://www.naloxone.org.uk/index.php/lawpolicy/law/uklaw1)

&nbsp;

Edit: I've stayed up doing some more research and [this site](http://www.naloxone-hydrochloride.com/) seems to have exactly what I was asking for. Does anyone have any have any experience with them? I wonder if they would ship to the UK or I'd get busted whene they discovered it at customs. They're based in New York so not the sketchiest location for a parcel to come from. Again, anyone with even the vaguest idea would be much appreicated. Thanks to everyone, not long until I have to leave for work now :(

&nbsp;

Edit 2: Just saw the sidebar link for ""Find Narcan and Needle Exchanges""... but it's for North America only :( If I ever do work out how to get Narcan in London (or UK generally) I'll let the mods know so they can update :)

Edit 3: Found a load more information in the government website on a page called [Widening the availability of naloxone](https://www.gov.uk/government/publications/widening-the-availability-of-naloxone/widening-the-availability-of-naloxone). I'm digging through it now but feeling so wrecked the words are swimming. Might be time for a little doseee of modafinil to get the day going. 6:20am here we go!!!",1466646426.0
4pe6gw,https://www.reddit.com/r/opiates/comments/4pe6gw/things_we_can_all_relate_to/,6,https://redd.it/4pe6gw,DoubleDopeDose,Things we can all relate to.,"One of the things I think all opi users can relate to is, how we deal with the wait and the mutual understanding of the process.

For instance, a friend of mine from out of town cops in my city since, my town is essentially where you go to cop. My town is the shitty taint of the county and it's just an accepted fact by the locals; everyone comes here to get their shit.

So we meet up, and we talk aboutbullshit to pass the time, or should I say, Dealer Time, 'cause 20 minutes turned into an hour, and you know how it goes. So we're used to it and it's no biggie. This is part of my point though. 
We were able to chill and talk about whatever, we both just knew it would be a lot longer than ""20 min fam"". And we chilled and talked.
And as soon as we copped, literally the very moment we both got what we needed, we shared a brief hug and our goodbyes in less than 30 seconds. All towards the ultimate goal to fill our veins with this heavenly mud

We both understood that ""20 min"" could easily turn into an hour or longer, so by chilling we made it go by a bit faster, and we both acknowledged our mutual desire to get the narcotics into our veins as soon as humanly possible and made our good-byes extremely brief. Even though I, a young mid-20's male, and she a 40's-50's suburban mother and wife with an office job, come from two entirely different walks of life, we were brought together and we understand eachother's addiction, the culture, and the processes you have to work through in order to finally get to that sweet release. 

The whole mingling of people vastly different walks of life connected by the stigmatized sub-culture of drug use and illegal activity, and the fact that we're both on the same exact page when it comes to drugs, it's all really complex with it's intricacies and peculiarities and it's remarkable to realize the depth of both contrasts and where we're the same. 

I don't know exactly where I was going with this, but I do find it entertaining to write about and I felt like, beyond lurking, I haven't contributed to, and have been neglecting, /r/opiates for a while.",1466644707.0
4pe5ek,https://www.reddit.com/r/opiates/comments/4pe5ek/my_friend_overdosed_last_week/,17,https://redd.it/4pe5ek,alwaysgottawait,my friend overdosed last week,"it's been a...shock to say the least. I can't believe I almost lost him. kid's been doing drugs since he was 13, so it's been a long time coming, he says his parents said. he doesn't want to quit, which ISN'T a shock. I'm thinking of you, S. I'm so glad you lived and I'm still pissed the hospital didn't let me visit you.

he's been texting me before and after shots now so I know he's safe, but that's only because the scare is fresh in his mind. I guess I'm enabling, because who ever heard of a dirty sponsor/support system. He told me they made him an emergency therapy appointment (because the system is fucked and it would take him months to see his regular psychiatrist) and he's worried they'll make him piss. could they make him do that? he doesn't have clean piss and he's super worried about rehab. never made a Reddit account so I said I'd ask for him.

sigh. stay safe ladies and gents",1466644297.0
