24g9b6,https://www.reddit.com/r/opiates/comments/24g9b6/sandoz_oxycontin/,0,https://redd.it/24g9b6,lufc1992uk,Sandoz Oxycontin,"these are bloody good compared to the napp and mundipharma brand oxycontin! massive rush, i'm in europe for all the people wondering what the hell im talkin about.",1398948380.0
24fust,https://www.reddit.com/r/opiates/comments/24fust/how_to_smoke_tube_full_of_bth_residue/,26,https://redd.it/24fust,balfazahr,How to smoke tube full of BTH residue?,"I've been using the same rolled up piece of paper to smoke black tar for a month or so now. It has built up a considerable amount of residue and I've heard that can he smoked - I'm just wondering how. I'm sure I dont't light it up like a joint, it burns to easily for that. Do I cut it up and put it on foil? Anybody with experience have any tips?",1398929645.0
24fsvg,https://www.reddit.com/r/opiates/comments/24fsvg/the_more_i_watch_drugs_inc_the_more_i_think_its/,11,https://redd.it/24fsvg,Drabbstep21,The more I watch Drugs Inc. the more I think it's only on TV for propaganda.,"Just the way they dumb it down, and how fake everyone fucking seems. It would be insanely easy to use actors for all the interviews and make up all these stories. 

I just watched them raid a house in Phoenix with no one in it, and they found 51 pounds of meth. It was the Largest seizure ever. Who leaves 51 pounds of meth unguarded? Or why wouldn't the fucking cops wait to raid that place until people were inside it? They obviously knew that it was a fucking safe house.",1398927260.0
24fo2i,http://www.smh.com.au/lifestyle/celebrity/peaches-geldof-died-from-heroin-overdose-reports-20140501-37iqq.html,8,https://redd.it/24fo2i,green-bean-fiend,Seems the peach doesn't fall far from the tree...,,1398922142.0
24fkxu,https://www.reddit.com/r/opiates/comments/24fkxu/finally_some_relief/,7,https://redd.it/24fkxu,golfsweg,finally some relief,"I've struggled with chronic back pain for years, but recently it has gotten worse and has gotten in the way of work as well as playing golf, which I do competitively.  In the past I had tried muscle relaxants, NSAIDS, gabapentin, tramadol, etc. with no luck.  But I finally found some relief after getting prescribed hydrocodone 5/325s.  I've already been able to function much better around the pain (and obviously the buzz is a nice bonus.) Next week I start physical therapy and I'm hoping that'll help even more. Just felt this would be the right place to share my positive experience :-)",1398919503.0
24fehm,https://www.reddit.com/r/opiates/comments/24fehm/helping_a_friend_get_clean_what_to_expect/,27,https://redd.it/24fehm,bootsieq,helping a friend get clean. what to expect?,"not sure if this is allowed, since i didn't see it in the FAQ or the sidebar rules.

i have a friend who has been on and off heroin for at least a decade. he knows what's going to happen to him when he stops, but as someone who has never even tried it and has mostly shunned opiate-based painkillers (including after childbirth and other serious bodily harm) i feel i have very little clue as to what he's going through. my addictions are limited to occasional booze binges, cigarettes and my adderall prescriptions. obviously, i have more of a penchant for uppers. 

anywho, this friend has burned all his bridges in the few places he could go, and is stuck in another state, living in a dope house, where he's sure to keep using. he's managed to save enough money to get in his car and make the 5-7 hour trip to my home, where I have a couple of supportive folks who like this guy enough (despite his past transgressions) to support my wanting to help him. he wants to be back where i live now anyway to try to rebuild things between his ex and her child that he loves like his own. i know these are things that commonly occur in addicts and that they often relapse, but i'm going to give it a chance for myself and try to be the supportive person he doesn't seem to have had, ever. 

he will be here by friday, and has already warned me he'll be sick for at least a few days. i asked him if there's anything i can get for him to help, and he suggested ice cream and nausea meds. i can handle that. what i'm not sure he'll tell me is the gory details, or the stupid shit he might want/try to do. 

that's where y'all come in. i need to know the brutal, dirty, awful details, both of what he'll be going through and what i'm likely to encounter. i'm not squeamish, and i prefer to know the worst ahead of time. if he's going to puke on me, okay. if i'm going to need to prepare to incapacitate him, i'd like to know that, as i'm an average-sized female. i am no stranger to taking someone down, but i prefer not to have to do so. just want to not be toooooo surprised. 

anyway, thanks in advance for any help, and i'm not here to judge. i firmly believe that if a person is happy doing whatever they're doing, then it's not my place to tell them they're wrong. if they're unhappy and they want help, all i can do is try to help. i don't know what else to say without being all naive and optimistic. i just want to help my friend make the effort he wants to make. 

EDIT: thanks again to all of you for all of the advice, but it's a moot point now. he went radio silent yesterday so i decided to check the local jails where he lives and found out he was arrested for possession yesterday afternoon. $100k bond, 3rd degree felony. he has some priors, so it's likely to be more prison time. nothing i can do about that. i find it awfully coincidental that he got arrested less than 24 hours after being offered a way out of that mess. 

EDIT 2: he ended up getting out, as it turns out he wasn't even in possession of anything when he was arrested (though a companion was). i went to pick him up and brought him back with me. he's doing really remarkably well compared to what i had been expecting. he does best during the day and evening, when he's feeling social and wanting to see people. he's eating food (quite a lot, actually) and doing a great job handling what he's going through. he hasn't balked at any of my ""rules"" and so far, we're good. i took him to see his best friends/""brothers"" (one of them is dating my sister and the other is their roommate) which seemed to make a huge improvement in his mood. then we went to a biker event with my parents last night and he had 2 beers (he cut himself off) and played some pool with me and my cousin. he hasn't had the vomiting, but he does get the shakes really badly when he tries to go to bed at night. i lay with him and try to hold him when this happens, or let him cuddle up to me when he starts freezing. he says he's surprised it's not much worse this time, either. he last used 4 days ago, and so far, his worst day was the day before yesterday. he got to talk to the girl he's in love with and they made plans for her to come see him early next week, so he's in great spirits. i really really hope this is the last time he ever has to go through this, and i try to assure him that it will be. thanks again to all of you for all of your help. i now feel like i was over-prepared for his withdrawal, and i'm glad for that as it has helped me remain strong for him when he's shaking and miserable and i want to cry, too. if any of you have the desire to clean up and get back on track, i genuinely hope that you have someone supportive and strong enough to help you do that, because i don't think he could do it alone and i can't imagine anyone else could, either. you all have been great. i'll try to update periodically to let everyone know how this is going at different intervals and if he stays clean. ",1398914595.0
24fdxb,https://www.reddit.com/r/opiates/comments/24fdxb/feels_like_waiting_for_christmas_but_unlike/,4,https://redd.it/24fdxb,ecplove,"Feels like waiting for Christmas. But unlike Chrimbus, not a sure thing...","Well payday tomorrow, and that means re up day. If the dboy comes through. He has 95% of the time, but you never know. 


Who else can't sleep when they're waiting for their weekend to begin and just get the drugs they so desire? 



I hate posts like this but I'm pretty ""barred"" on etizolam so please let's all send each other good vibes on our potential pick ups!",1398914187.0
24f9b4,https://www.reddit.com/r/opiates/comments/24f9b4/so_if_i_do_the_coke_method_with_these_ops_whats/,11,https://redd.it/24f9b4,Drabbstep21,"So if I do the coke method with these OP's, what's the least amount of time for it to work?","Also is there another method to speed it up, or something else i can do? There's no way in hell I'm going to be able to wait.",1398911109.0
24f7zm,https://www.reddit.com/r/opiates/comments/24f7zm/i_fucking_love_this_sub/,41,https://redd.it/24f7zm,N-N-DMT,I fucking love this sub,"It's like being a fly on the wall, in a crack house.",1398910200.0
24f6wf,https://www.reddit.com/r/opiates/comments/24f6wf/recreational_users/,8,https://redd.it/24f6wf,VeselyTheCunt,Recreational users,"Sort of a spinoff of the 'Functional Users' thread.

Anyone here who can 'take or leave' opiates? Like, find them fun to do - great to do, even - but just CHOOSE not to take them all the time?

I have an essentially unlimited supply. I'm sitting on about 4,000mg of Oxy in my house right now, yet I just haven't chosen to use any in the past couple of weeks because I've been busy with other things or just not in the mood. I just bought a PS4 and I've been playing it a lot after work instead.

I love opiates. I took my first one 8 years ago, I've had a regular supply for 3 years. I just don't feel that I could ever get addicted to them. For me it's just another hobby. Sometimes I'll choose to take them, but other times I prefer to go to the gym or go out for a nice dinner or play some video games.

Anyone else like that or I am I complete weirdo?",1398909487.0
24eznt,https://www.reddit.com/r/opiates/comments/24eznt/brainbody_zap_jolts/,14,https://redd.it/24eznt,phillybrett,"Brain/body ""zap"" ""jolts""....","Hey guys, had back surgery years back, unfortunately been hooked on opiates since then. I take around 100/mg day. I'm considering moving to suboxone shortly. Regardless, I've had an issue going on for at least a year now, just trying to figure out if anyone else gets these...

I've always had sleep issues, from anxiety, sleep paralysis, but this is something totally different.

What is very odd about this it seems to happen 1000x more when I take naps during the day. While I'm close to falling asleep I get pretty bad body jolts. Almost like I'm having a mini seizure. The brain ones feel so strange. It almost feels like there is a shortage going in and out in my brain. I've also noticed there are times when I'm near the brink of falling asleep and my body will wake up gasping for air quickly almost like I wasn't breathing. I've read that there is a split second where the body stops breathing before the crossover into sleep, but this seems more severe. 

I'm only posting it in this sub-forum because I think it is somehow related to opiate use. 

Obviously I know seeing the doctor is the only real way of figuring out what is wrong with me, but I'm just curious if anyone else in this sub-forum has experienced similar symptoms with/without opiate use. ",1398904735.0
24ex95,http://traceyh415.blogspot.com/2014/04/just-friends.html,15,https://redd.it/24ex95,traceyh415,Just friends,,1398903146.0
24eww9,https://www.reddit.com/r/opiates/comments/24eww9/spinal_fusionsss/,8,https://redd.it/24eww9,bigblue2013,spinal fusionsss,"I would not wish this pain on my worst enemy.  Tried posting a pic last night lol but forgot how... to those of you who were ripping on me for it... I think i did it right here this time... Happy travels, one love stay safe",1398902887.0
24eur1,https://www.reddit.com/r/opiates/comments/24eur1/round_two_ask_a_clinical_pharmacist/,41,https://redd.it/24eur1,Torbear90,Round Two: Ask a Clinical Pharmacist,"I'm back, friends. Once again, ask me any questions you wish you could ask a health professional with no fear of judgment or retaliation. Stay safe, friends.",1398901459.0
24er9h,https://www.reddit.com/r/opiates/comments/24er9h/ello_everybody_anybody_got_any_stories_theyd_like/,19,https://redd.it/24er9h,windigoishlee,"'Ello Everybody, Anybody got any stories they'd like to share of anything like Animals,Insects getting into there drugs (Of Any Sort) before¿. Or even any stories of pets you chill with while getting high¿."," **(Disclaimer)** No stories of *forcibly* getting any living beings high pleases and thank you folks. Even if you'd like to share a story just about your awesome pets (cats,dogs,birds,reptiles) who chill with you while getting buzzed, just a little conversation starter for the Opiates subreddit tonight eh people lol",1398899228.0
24eqyc,http://lancasteronline.com/news/local/supreme-court-pennsylvania-cops-no-longer-need-a-warrant-to/article_6a407fc6-d077-11e3-8025-0017a43b2370.html,5,https://redd.it/24eqyc,kraken650,Supreme Court: Pennsylvania cops no longer need a warrant to search citizens’ vehicles. Stay vigilant in the Keystone State guys!,,1398899042.0
24en6p,https://www.reddit.com/r/opiates/comments/24en6p/suboxone_questionmetabolism/,18,https://redd.it/24en6p,dirty30blue,suboxone question/metabolism,"for awhile now, I have noticed when I take a dose of a sub it leaves my system within 5 or 5 hours, and I have to keep re-dosing through out the day. What is up with that? I thought subs were supposed to last a whole complete day. Although, I only take around 1.5 to 2mgs a day in all. I just tear off a tiny peace in the morning and it kicks in good, and by 12 (lunch time) I can feel my body slowing and starting to get cold. You know, getting that familiar feeling. I definitely don't want to take a higher dose because once i get to the 4mg and up mark of bupe it starts giving me that dirty groggy shit buzz that i fucking hate. Whats your opinion? also I'm really thinking about switching to a low dose of methadone instead and weening down off of that. I know its addictive as hell but I have always just liked it more.",1398896635.0
24ehyk,https://www.reddit.com/r/opiates/comments/24ehyk/holy_fucking_shit/,84,https://redd.it/24ehyk,JuicyJay,Holy fucking shit.,"Oh my god the most horrible thing in the world ALMOST just happened. Me and my sister, who is my best friend in the entire world, went and copped a half g of some absolute fire after I drove her to a job interview. She paid for it so she wanted me to shoot her up first, which I gladly did. She dumped out a pretty large amount into the spoon (even though she didn't seem to think it was that much).  I shot her up since she cant do it herself, then she dumped some out for me (probably about 2/3 of what she did. I shot myself up and as I was enjoying the rush I notice her nod out and slump down, head between her legs (we were sitting in my car). I yell her name, no response. I shake her, no response. At this point I start absolutely freaking out. I picked her head up and noticed her lips turning blue. At this point I am in full blown adrenaline fueled panic mode. I shook her pretty hard and continued yelling her name. I slap her in her face and start doing chest compressions while still shaking her, trying to get her to wake up. Thankfully, she gasps for air and slowly comes to with no idea what the hell was going on. I then proceed to give her the biggest tightest hug ever while bawling my eyes out. She still doesn't really know what was going on. She thought she had s seizure, and described the confusion she felt as how it feels to come out of a seizure.  Oh my god my entire body was shaking and I was crying uncontrollably. I thought I was going to lose my best friend. I'm not even super religious but I thanked god many many times. This was by far the most terrifying moment of my life. I don't even want to think about what would have happen had I not been there, fuck. 

The TL;DR is please please please be careful everyone. This was the most horrible moment of my life and I am so grateful that it ended up alright. Please stay safe everyone. I am still shaking with fear and anxiety from it.",1398893492.0
24egqj,https://www.reddit.com/r/opiates/comments/24egqj/flying_high/,10,https://redd.it/24egqj,Curtaincall215,Flying high,"I'll be traveling by plane to visit a relative in the next month or so. Is there any possible way to get dope on the plane unnoticed. I really don't want to be sick on my so called vacation. Any advice or tips would b so helpful. Happy nods! Btw, I'm not opposed to extremes as long as I can get away with it lol. Thanks a bundle!",1398892806.0
24ebna,https://www.reddit.com/r/opiates/comments/24ebna/shot_sub_film_and_it_was_fucking_horrible/,27,https://redd.it/24ebna,FEED_ME_SARA,Shot sub film and it was fucking horrible,"Well..yea. So I have shot subutex pills in the past with no issue so I figured it would be all good to go ahead and shoot 2mg of my suboxone film. I read up on opiophile how to prepare it and all that jazz and went ahead and did the 2mg.  I immediately got an overwhelming rush that made me dizzy and start sweating and I couldn't breathe. I then began to vomit uncontrollably for the next few minutes. Managed to crawl back into my bed and curl into a ball and all of that bad stuff subsided within 15 minutes and then I felt completely fine. 

I was sure when all of that was happening that I must have given myself precipitated withdrawls because I only waited like 13 hours after shooting dope to shoot the sub but since it went away so fast I guess it wasn't that. I'm guessing it was just some kind of bad reaction to the nalaxone? Because as I said, I have shot 2mg subutex in pill form before and I was fine. 

All I know is I'm never doing that shit again. I'll stick to taking it under my tongue. ",1398889851.0
24e1g2,http://www.youtube.com/watch?v=zJU0I1xmvVo,26,https://redd.it/24e1g2,craig666md,shit baltimore drug addicts say,,1398883935.0
24e0k9,https://www.reddit.com/r/opiates/comments/24e0k9/sleeping_bag/,5,https://redd.it/24e0k9,Powercocaine,Sleeping bag,"
This may be weird but it has helped me through withdrawals the past few days. When I can sleep, I tend to become drenched in sweat and it makes me sheets, pillows, and entire bed just smell...bad. 

For some reason I feel like sweating from cold/hot switches is not the same as sweat from working out.

My simple solution has been to sleep in a sleeping bag on top of my covers. While the sleeping bag causes me to sweat even more, it's at least contained. I can wake up and take a shower and not be repulsed by a completely wet bed. I have roommates that do not, as far as I know, know about my opiate use - and washing my sheets daily, with no girls coming over, was just a bit sketchy. I believe i'm at the tail end of the physical withdrawals - and now begins the mental part. And getting back to life. I hope this helped someone. And I hope this is my last time going through this shit for a while. ",1398883449.0
24dxui,http://imgur.com/cMnnLjF,25,https://redd.it/24dxui,someone-who-is-me,1600mg Gabapentin+Poppy Tea+a few vodka shots and my living room looks like a scene from Law and Order,,1398881886.0
24dw6h,https://www.reddit.com/r/opiates/comments/24dw6h/kind_of_a_stupid_question_i_just_hope_i_didnt/,6,https://redd.it/24dw6h,timboXslice,Kind of a stupid question. I just hope I didn't waste em.,"Okay so I have a terrible gag reflex when i hawk loogies. I broke two tabs in half,  popped em then chugged my Arizona green tea. Literally a minute later I hawked a looge outside,  it got caught in my throat and i projectile vomited in my backyard. Now i was like you gotta be fucking kidding me and i looked through my puke.  Didnt seem to be any pills in there but my burger from an hour ago was all over the place.  Did they already fuckin disintegrate?  Or would i have been able to see the 4 halves in my puke. .. this sucks.",1398880933.0
24drv2,https://www.reddit.com/r/opiates/comments/24drv2/can_i_take_codeineapap_pills_and_cwe_codeine_on/,5,https://redd.it/24drv2,herointhrowaway23,Can I take Codeine/APAP pills and CWE Codeine on the same day?,"Basically I took 4 pills (500mg para, 8mg Codeine) today, didn't feel much, so I did a CWE extraction with 12 pills so about 100mg of Codeine. Can I drink that today or should I wait? Also, what are the dangers of CWE, if any?

Thanks",1398878467.0
24dnmc,https://www.reddit.com/r/opiates/comments/24dnmc/finally_landed_an_awesome_job_annnnnnd_boom/,15,https://redd.it/24dnmc,obiwankenopiate,Finally landed an awesome job annnnnnd boom,"First phone call.... You need a hair follicle drug test. Ive got scripts for all the pills in the world, but nothing to explain that wild week of coke 2 months ago.  Fuck me I want to leap off a bridge. ",1398875927.0
24jhj6,https://www.reddit.com/r/opiates/comments/24jhj6/anyone_tried_low_dose_naltrexone_ldn/,2,https://redd.it/24jhj6,anticipated,Anyone tried Low dose naltrexone? (LDN),"Was just wondering if anyone has used low dose naltrexone (LDN), It makes opiates not work on you for about four hours per day. (usually at night you take it at bed), then you get a rebound in the receptors which increases natural endorphins.

 I know its not going to get me high or anything but i was wondering if anyone who isnt addicted has used LDN for a period of time, and can give me any input into how it affects opiate usage.

I'm hoping it might reduce my opiate tolerance while at the same time increasing endorphins(making me feel a tiny bit better) from the rebound i get when i wake up from the downregulation from the naltrexone.

My point for taking it, however, is related to an auto-immune disease and my immune system. LDN has been making great strides in treating auto-immune disorders.

thanks for taking the time to read
",1399038570.0
24jgr2,https://www.reddit.com/r/opiates/comments/24jgr2/passing_along_an_interview_request/,6,https://redd.it/24jgr2,traceyh415,Passing along an interview request,"A journalist from a UK magazine is looking to interview a mother with children who also has experienced opiate addiction. It is a paid interview so I wanted to give people an opportunity if one of you are interested. 

I am not endorsing the idea, just passing it on.  I know she is looking for two people and one can be anonymous. Edit- I believe she is looking for people not currently using but a history of use. 


Contact ktburnetts@gmail.com",1399037975.0
24jcy8,http://i.imgur.com/TZXT7J2.jpg,11,https://redd.it/24jcy8,blazehaze,Just gonna leave this here,,1399034778.0
24j4lx,https://www.reddit.com/r/opiates/comments/24j4lx/thoughts_on_the_vivitrol_shot_for_a_frequent/,3,https://redd.it/24j4lx,eyes_up_here,Thoughts on the vivitrol shot for a frequent relapser? Also how does the shot impact your ability to use other drugs recreationally?,"I have been trying to get clean but I keep fucking up after a week or 2. I'm considering getting the 30 days shot to force myself to stop using opiates. I think if I know for a fact that I can't use getting some distance from opiates will give me such a better life i'm just wary of side effects. Doesn't it mess with your natural endorphins and aren't there some other stuff that could be mildly disconcerting about it?
",1399024871.0
24iwfu,https://www.reddit.com/r/opiates/comments/24iwfu/dont_upvote_2_quick_questions_throwaway_account/,20,https://redd.it/24iwfu,perc30throwaway,Don't upvote! 2 quick questions (throwaway account),"Hey dudes first I'll start by saying I've been lurking here for a while however I only come to this subreddit when I'm holding because it's too hard to look at all the pill porn without being able to take some after. I'll usually browse a bunch until I can't wait anymore then do my 30. Anyway had two questions for you guys hoping you can help. First is, is it safe for me to ""snort"" water after railing a 30? A friend of mine taught me this trick and was lying in bed tonight wondering if any of that water is going into my lungs? If so that can't be good for me right? Another question I had is it safe to mix two different percs. I have a half of a ""u24"" and a half an 
""M box"" and wanted to know if its safe to rail both of them together? Thanks in advance if anyone has these answers. ",1399013798.0
