8x1jl5,https://www.reddit.com/r/opiates/comments/8x1jl5/solpadeine_on_ebay/,0,https://redd.it/8x1jl5,maso999,SOLPADEINE ON EBAY?,"I'm not sourcing or linking, but asking isn't this a scam? and if it wasn't isn't it illegal and how did he get onto ebay listing?

This guy is selling SOLPADEINE which has codeine in it, It says i can buy it right now, but isn't this a scam?",1531057818.0
8x1ipe,https://www.reddit.com/r/opiates/comments/8x1ipe/mallinckrodt_headache/,0,https://redd.it/8x1ipe,Sigma2RD,Mallinckrodt headache.,"I have a script for 5MG Oxy IR and ive found that if the pharmacy has Mallinckrodt brand they give me an insane fucking headache. They seem to also be about the same size as the pink 10 mg k56's. Which means they are full of filler. The k56's dont give me the same headache the M's do. I mean, it makes my head throb so bad I often times consider not taking them and im dependent af.  


I wonder if im having an allergy to the filler, or if its all in my head, or if there is something more sinister going on. Because the M's didnt always do this to me.. only in the last say.. idk 3 months have i noticed the distinct difference.",1531057470.0
8x1cqh,https://www.reddit.com/r/opiates/comments/8x1cqh/what_is_it_called/,2,https://redd.it/8x1cqh,OldSyej1,What is it called?,"Need to get a test kit for some new percs I got. I went on Amazon and looked for a test kit but all ot keeps showing are urine drug testing kits. 

What should I type up for a test kit that can tell me if this is really oxycodone? What exact key words?",1531055694.0
8x1a8d,https://i.imgur.com/RnaWTGo.jpg,1,https://redd.it/8x1a8d,ThatYoungBro,We'll get tore up from the floor up first and go eat second.,,1531054933.0
8x1a22,https://youtu.be/udPT51ZSvBg,0,https://redd.it/8x1a22,Puzzleheaded_Mind,How I Stopped Wasting My Time,,1531054884.0
8x0voe,https://www.reddit.com/r/opiates/comments/8x0voe/pink_heroin/,7,https://redd.it/8x0voe,Kaymoar,Pink Heroin?,"There has been a ton of pink heroin going around in my area (East Coast). It smells like heroin (vinegar smell), and it isn't bad stuff. I don't have anything to test it with so I'm not 100% sure it's heroin, but it feels the same as any heroin I've done before. I only snort so I have no comment on what it looks like cooked up. Anyone else have this stuff in their area or know what it is?",1531049793.0
8x0tcl,https://imgur.com/a/OzRL4Dx,2,https://redd.it/8x0tcl,MercedesBenzoAMG,Just some fresh blister packed OC40's,,1531048898.0
8x0s2v,https://www.reddit.com/r/opiates/comments/8x0s2v/the_longest_post_ever_it_really_highlights_the/,1,https://redd.it/8x0s2v,HayMoe,"The longest post ever, it really highlights the demise of my sanity","Ok I quit coming around for the most part up until a little bit recently again but I seriously need to vent before I lose my shit so prepare for a wall of text. 

Ok so the last post I made was about the closest person in the world to me dying. And me and my other best friend are prettyyyyy sure for alot of reasons that he didn't accidently overdose, he did it on purpose and it was spelled out for all of us we were all just I guess too busy with our own shit to notice until it was too late. So yeah, I've been having a pretty difficult time with the grieving process you could say. When he died, I had already been using again really heavily for about 5 months and it was bad, like really bad, but it got so much worse after he died. At least a dozen fent pressed roxis a day, which is a shit load of fent where I'm from. I got arrested for the first time and all my family and friends wouldn't get me out because they were scared I was gonna die. Fast forward a month of being in jail where it was easier to get high than on the streets, and I get bonded out out of nowhere by a person the bondslady said wishes to be anonymous. Ok cool. I thought things MIGHT get better bc jail really sucked and I never want to go back buuuttt that was kinda a pipe dream. 

I get real fucked up for a day, buy a shit load of pills, and go back to rehab the day after I got out of jail and brought enough pills to ""taper off"" and clearly that didn't work. I leave after a month bc I was still getting high everyday anyways and move in with this girl I'm friends with, whose also in love with me, who also does pills. I get super fucking bad off again and really strung out with these awful looking track marks, I'm still not even properly greiving, I hardly ever even know which way is up I'm so high all the time, and i decide I need to make a change because I was going to end up dying. Really. So I make arrangements to move back to my home town an hour away i haven't lived in in 3 years with a friend I've had for over a decade. I basically cold turkeyd off pills and I've been off them for a few weeks now. I don't even have anything to say about detoxing anymore really. It's the same everytime and it sucks but it passes. 

Now here come the real reasons why I'm so bitter now and I'm really gonna bitch.

A My family and I are on extremely rocky terms at least, well everyone except me and my mom. She's great and I love her so much but she really has no clue the shit show that my life has really become. Granted, she hasn't seen me except for a couple times this entire year so that helps. My family still lives here so it's complicated for me to move back here. My dad is basically the biggest asshole you could ever imagine, and I haven't spoken to him since shortly after Nick died and my father said that he got what he deserved, and I'd be the next. Thanks, dad. I hate to admit it but i'm a very very emotional and needy person so being at odds with my family has always really fucked with me. 

My friend that i moved in with has always been one of the chillest and most understanding people I've ever met, even though he's not an addict. The mother of his 2 year old son overdosed and died at the beginning of the year on heroin 3 days after she got out of rehab...so he knows grief too. Well he has decided he is in love with me after we legitimately had a big conversation about that never becoming a problem if i moved in with him before I came. I'd pay rent and be an awesome roommate and we'd continue being friends like we always have been. He was ALL FOR IT. Now he's gone and made shit all awkward for me as I have to continuously make it clear that while I appreciate his help and friendship more than I could ever say, I'm not trying to be anything more than friends with anyone anytime soon. I just can't right now y'all like I'm hanging on by a thread here as is, I haven't been clean that long, and I'm half crazy still from all the shit I've been through. Honestly tho how fucked up in the head is he to want to be with someone whose obviously not current dating material like me? It's just so frustrating. 

So me and my best friend of well over a decade, J, who was also Nick's best friend start hanging out regularly again since I've moved back. He's not an addict but he's still handing Nick's death as badly as me and I truly believe that there is no one that this is harder for than me except for maybe him. We were Nick's real family. We were each other's family. The three of us have been through more together the last 12 years than anyone could ever imagine. J is the only person in my life and in Nick's life who can say they stuck around from the very beginning of our addictions, until the very end in Nick's case. He witnessed the chaos that was our relationship when in active addiction and listened to all the bullshit every single time either of us ever called him. During the periods that Nick and I would break up and not see each other for awhile, J never once took sides and always loved us both equally. We both have lived with him at some point, both together and individually. He bailed Nick out of jail both times he was arrested for drugs and let him move in with him for as long as he wanted. J has fought fiercely for his friendship with us for as long as we've known him just as we have for him. Nick's mother, who is literally the most horrible woman I've ever known, made it very clear that she never wanted him and sent him to live with his grandmother at a young age and his millionaire dad left while his mother was still pregnant and was never in the picture until much later. I've been at odds with at least my father for the better part of my adult life, sometimes my mom too, and have never felt like a part of my family. So ultimately I think me and Nick always looked to J for guidance because we didn't really have anyone else. But since Nick died, it's all J can do to fend for himself and I get it because I feel the same way. It is so hard though to see him like this though and not being able rely on him for a solution on how to just feel better. Or even just feel okay, I'd even be thrilled with that. He's always been able to help me fix things but he can't fix this. We're basically just clinging to each other for whatever small amount of comfort or support we can get and basically holding on for dear life. It's just like why can't I just stop thinking about how sad I am or what I could have done differently or what Nick's voice sounds like or about that one time we got lost and stuck in the mountains for 6 hours because we were drifting like dumbasses or about how his little brother is doing? Like seriously people die all the time and I don't really see other people greiving at the level that I still am 3 months after their loved one dies. I mean really, i haven't really ever seen anyone ever openly struggle with a death as badly as I have so that means one of two things. Either they're just really good at hiding it and I'm not or (and I think this is the more likely of the choices) I've finally hit my breaking point and I've just lost all ability to properly deal with anything and everything life throws at me, dooming me to this severe depression and anxiety for the rest of my life. Probably mostly due to severe drug addiction and trauma lol. 

Guys I just feel like I'm never gonna be ok. These are just the major things driving me crazy right this second, but there's so much more little shit going on too and I just can't handle all this bullshit at once. No one that I talk to or try to talk to really get it's except J, and i can't burden him with my shit too. So, I usually hold everything in for as long as possible and frequently have a range of minor to major meltdowns because of it. Not even trying to be funny, but I've seriously questioned my sanity more in the last two weeks alone than I have the rest of my life put together. Maybe I've finally cracked man, idk. Fear is a constant companion of mine now... I'm scared the majority of my time now. Of everything. 

If you've made it this far congratulations, you're almost done lol. This is the last bit of my rant is the real root of how godawful I'm feeling these last couple of days and it's just because I royally fucked up like i always do and why I'm really so mad and sad and broken and betrayed feeling nonstop these last few days. 

J and I ran into Nick's grandmother, the one that raised him I guess 3 days ago now. She'd done so much for all 3 of us over the years that J and I decide to buy her a few bottles of nice wine to drink with us (she drinks a bottle a night at least and has for as long as I remember) and go check on her. WORST idea we have ever had to date i think. It was probably necessary for us to finally get all this pain out in the open like we did but we should not have done it there. We tortured ourselves, going to where Nick lived for years growing up and even randomly throughout adulthood and where we had so many memories with him everywhere we looked. But we felt obligated to Nick to check on his oma because she had to be hurting too. We ended up drinking 4 bottles of wine together and talked about Nick for the better part of 5 hours. Alot came out that Nick had lied about and some of it really broke my heart even more knowing he lied to even me. We also pretty much verified that yes she also knew Nick had done this on purpose. 

So we leave and I'm drunk as shit and all fucked up in the head and I'm going to hang out with an old hookup buddy I used to have that I used to get high with because I'm not going home to deal with the bitch ass there. We go get some dope, I do 3 key bumps of it to try it and that's the last thing I remember (around 10pm) until I guess you can say i finally came to at 530am. I od'd so bad that my dude I was with that I mentioned, who I've always stayed super tight with, said he looked over at me in the passenger seat of his truck after I'd been out there waiting for him to come back out so we could go home and do more dope for about 10 minutes and I was dead. He narcan me 3 times and does CPR and brings me back. He doesn't wanna bring me back to his place super fucked up and anyone see me and start some shit so he just drives around with me I guess sleeping in his passenger seat if that's what you call it?? I don't fucking know. But he said he had to make sure I kept breathing because he had to stop 7 or 8 more times to do cpr again. Coming to was the most bizzare experiences of my life. I've never been so close to death and while nothing has actually changed everything felt different. That fear I've always carried with me multipled.

As if that of isn't bad enough in itself, i somehow threw my back out. I'm 26 years old and I literally can't even walk hardly because I actually threw my back out. It seems as though everything bad happens to me. On top of the constant debilitating pain that's the worst I've ever experienced everytime I move, I have been unable to sleep a wink since the od, 72 hours ago. I've dozed off a couple times for probably 2 of those hours max. I am so fucking uncomfortable I want to scream and I officially have developed the worst attitude I've ever had just because I'm now not only am I emotionally destroyed but I'm in the worst physical pain I've ever been in too and can't even manage to sleep through it. I literally don't want anyone even coming anywhere near me, touch me, or even really talk to me except for a select few people. I'm being such a bitch to everyone because the pot is finally boiling over--I'm so fucking mad at everyone for every stupid reason you could possibly imagine; my family for not being there for me, Nick for leaving me, my roommate for falling for me, J for not fixing the way I'm feeling, and as if that's not enough, that I threw my fucking back out!! I'm so fucking sad too though; that I lost Nick, that J is hurting, that i feel do doomed, that everything in my life has changed so much. Life just sucks so bad right now and I can no longer see the light at the end of the tunnel... I didn't quit drugs to be miserable still and have my life be even more chaotic than before. 


Ok I'm finally done I got it all out....I think. I'm cringing at how long it is lol but I had to get it out or spontaneously combust. I'm gonna smoke another blunt and try to fall asleep again since I can't move from my bed anyways. Fml. If literally even one person read it all the way through, thank you so much for giving a shit enough to care for a couple minutes while reading what I had to get out. if not, at least I got it all off my chest for my own wellbeing. Love each and every single one of y'all and you're all good people no matter what you're going through. I just keep hearing this rehab/aa quote in my head on repeat ""it's ok not to be ok, but it's not ok to stay that way."" 😏 ",1531048385.0
8x0km4,https://www.reddit.com/r/opiates/comments/8x0km4/dumb_question_probably_but_what_is_a_jj_moment/,3,https://redd.it/8x0km4,helixman21,Dumb question probably. But what is a “JJ moment”,I always see that here? What does it mean ,1531045285.0
8x0ksi,https://www.reddit.com/r/opiates/comments/8x0ksi/has_anyone_experienced/,4,https://redd.it/8x0ksi,CoachHouseStudio,Has anyone experienced...,"...situation dependant reactions?
&nbsp;
So, apparently it's a documented fact that people can overdose from their usual amount by being in places that are unfamiliar to them . As if the brain prepares the user with some tolerance as it knows what is coming in familiar scenarios. 

&nbsp;
To me, this sounds absurd. The only mechanism behind the pgenomenon I can think of is adrenaline.

I am British and I smoked some weed once in America when I was 16 when I met this girl on vacation and I was TRASHED. Way beyond anything I have ever experienced. I was a heavy smoker with some tolerance under my belt before I went. This was like going back to the first time. I had munchies so badly I was getting potatoes out the trash and eating them in front of her mother who was trying to ask me what England was like and I COULD barely strong a sentence together 

It could have just been very love t weed, but I've still never experienced anything like that and I came across some very strong bud in the years following that encounter.

So, it could be true. I've never experienced it since and I don't know whether that counts. But I felt completely lost while I was there. I ditched my family to hang out with a girl and got to see the every day non tourist side of Arizona.

Personally, I don't see how this could happen to me with heroin as I'm almost always outside, in weird places, scoring down unfamiliar roads, using odd public toilets, meeting strange people. The whole thing is unique despite being in Groundhog day, getting up and trying to stay well. But, being abroad is about as unfamiliar as you can get. I had a friend come stay with me from Florida a couple years back and we both shot the same amount of the same batch. It didn't affect me at all, I thought it was garbage, no rush, no euphoria, barely got me well. But it knocked him unconscious for 45 minutes. I thought he had died when he fell off my bed sitting up with it still in his arm so, maybe it happened to him.

Anyway, I just wondered if anyone else has experienced this phenomenon or has any ideas about it. ",1531045359.0
8x0frv,https://www.reddit.com/r/opiates/comments/8x0frv/dopesick_until_the_end_of_the_week/,5,https://redd.it/8x0frv,kuwomi,dopesick until the end of the week,"i just used my last bit of tar, and i wont be able to get any more until the end of the week...pray 4 me yall
texas junkies wya",1531043264.0
8x0fkb,https://www.reddit.com/r/opiates/comments/8x0fkb/so_us_aussies_already_know_how_expensive_drugs/,6,https://redd.it/8x0fkb,goodatbaddecisions,"So us Aussies already know how expensive drugs are, but am I the only one with this issue?","We all know 500-550 AUD a gram is fucking ridiculous. (That’s about 400 ish US for those who can’t be bothered to google the conversion) 

I cannot find pills on the street to save my god damn life. And I mean I have tried *everything*. Even god damn Valium I can’t find, and when I have it’s been a rip off. It’s the only thing I can get off a doc. It’s not the kind of country where you just walk into a doctors office and come out with roxies. I actually got excited because an American airline pilot who was stopping over in Sydney had brought me ONE 30 mg Roxy. 

Or is it just me? 

",1531043180.0
8x0a1b,https://www.reddit.com/r/opiates/comments/8x0a1b/heroin_oral_bioavailability/,5,https://redd.it/8x0a1b,OutdoorwiththeIndoor,heroin oral bioavailability,"I have googled this quite a bit and have gotten a few different answers so I figured I would go straight to the professionals. 

Is anyone experienced with dosing heroin orally?

What are the positives? What are the negatives?

If money wasn’t an issue and you had 50kg of pure heroin and oral dosing was your only option, would it be possible to use enough to get really high without any other dangers?",1531040825.0
8x072a,https://www.reddit.com/r/opiates/comments/8x072a/it_was_nice_knowing_yall_crazy_fuckers/,2,https://redd.it/8x072a,goyange,It was nice knowing y’all crazy fuckers,"...It’s crazy how just a few years ago when I was homeless and all I really cherished the most was getting my drugs and getting my next fix so I won’t be dopesick...it’s been three fucking years since then. Three. It may not be long for some, but to me, I’ve just had this epiphany tonight at 1AM, in the midst of WDing, that I’m not letting this ‘disease’ or whatever the fuck others may call it fuck with me; I consider it a bad choice I made at the time, but I’m done with all the bullshit.


I’ve slowly built back the trust with my mom who I’ve always had a shitty relationship with before even all the drugs came into the picture. I’m finally reconnecting with her and the rest of my family. The other day as I came home after copping a couple bars to stave off withdrawals, she came home soon after and told me how I’ve been such a good daughter to her (not knowing that I’ve relapsed on heroin months prior). This made me think about it constantly of all the shit I’ve done and said to her and everyone dear to me. So now, I’ve decided this will be it. 

Journey’s gonna be rough, but at least I’m not alone anymore. I also have a boyfriend who’s been very understanding of my situation (we’ve been on and off for almost 6 years now) who doesn’t fuck with that shit, and I won’t drag the people I care about or anyone else down with me any longer. That is all.


I wish you motherfuckers all the best, and it’s been a long and bumpy ride for me. I’m sure I’ll have lapses in judgment in sobriety here and there since I ain’t perfect, but I really hope to Satan that if I ever go to hell, he’ll at least give me props for not causing anymore grief to the fam and my loved ones. Cheers.


PS Any recommendations to stave of the mental cravings will be a huge help for me. I’m a huge anime/JRPG junkie so yeah lol. Or maybe something a bit more productive and outside my ‘comfort’ zone (mostly sedentary lifestyle) is appreciated as well...or idk go out for a change and do something 


EDIT2: I don’t even remember posting that whole fuckery from last night man I must’ve blacked out typing that weird. Not this one, my previous post haha fuck",1531039474.0
8x054t,https://www.reddit.com/r/opiates/comments/8x054t/vicious_cycle_of_heroin/,1,https://redd.it/8x054t,seanpaulsteak,Vicious cycle of Heroin.,"I've been using for about 2 and a half years.  Through all of it I've gotten extremely lucky; didn't lose everything, still have a clean criminal record.  I have although gone through a bunch of jobs the past couple years, all due to the emotional instability of being an opiate user.   I've gotten clean, although for brief periods of time, and I feel like I'm on top of the world.   ""I FINALLY BEAT HEROIN! MY LIFE IS GETTING SO MUVH BETTER!"". You know, that honeymoon phase of getting clean.  Of course I've always relapsed.  Enter the heroin honeymoon phase of "" oh this is great again, I'll quit soon, I can handle it."". Before I know it I'm back where I was, emotionally unstable, depressed, and not hopeful about my future. It's like this whole cycle repeats itself over and over again every time I make an attempt to quit. I end up using because I'm depressed that I'm using and have no real chance of a successful future, so I use more and more to hide behind the fact that I have no future using heroin.  It's the stupidest fucking evil drug.  The same cycle of insanity over and over again.  Thanks for reading my rant.  ",1531038637.0
8x04z3,https://i.redd.it/q9a6bsv7qo811.jpg,0,https://redd.it/8x04z3,FrmBURGHinCHI,Just sayin tho...,,1531038571.0
8wzzzn,https://www.reddit.com/r/opiates/comments/8wzzzn/recovery_boys/,0,https://redd.it/8wzzzn,Chan70,Recovery boys,Watching the net flicks doc called recovery boys. So so good I wish my son could get this kind of treatment . I wish we could all get it .,1531035781.0
8wzxwe,https://youtu.be/ndsB37KUAso,0,https://redd.it/8wzxwe,Oxiconone,This may be helpful to some. Not about opiates but certainly linked to it IMO. An excellent talk. Apologies to those who find it uninteresting,,1531034846.0
8wzvd4,https://i.redd.it/viza2lw6co811.jpg,27,https://redd.it/8wzvd4,redditinfo94,"Does TARGIN Oxycodone have any recreational value? If yes, please explain how...",,1531033858.0
8wzrmb,https://www.reddit.com/r/opiates/comments/8wzrmb/vivitrol_i_tried_to_post_this_earlier_but_im_not/,4,https://redd.it/8wzrmb,Richyboy43,Vivitrol.. I tried to post this earlier but I’m not sure with at happened. Sorry if it posts twice.,Last vivitrol shot was 53 days ago. I did 12 shots total. Didn’t feel anything tonight. Anything with experience know how much longer this can possible go on? Wears off in 30 days my ass...,1531032404.0
8wzq30,https://www.reddit.com/r/opiates/comments/8wzq30/my_face_gets_red_and_dry_when_on_h/,7,https://redd.it/8wzq30,red_hi_tec,My face gets red and dry when on H,"This never used to happen. But ive done dope about 4 times in the last 2 years and every time it doesnt feel like how it used to and it makes my face break out in red spots. Expecially on and around my nose. 

Now i think this is from rubbing/scratching my face but I pourposly tried not to itch at all today. I did a tiny bit of itching but nothing more than if i didnt use. And my face got all red and dry once again.

This didnt use to happen but now it does. Does this happen to anyone else? Why does this happen of i am not itching my face more than normal?

(Checking in from my previous post. Its been about 37 hours since last sub dose. Just tried another bag. Very slight feeling like all day today. I will go to sleep and im gona try again in the morning) ",1531031797.0
