8tfpen,https://www.reddit.com/r/opiates/comments/8tfpen/how_much_oxy_for_first_time/,1,https://redd.it/8tfpen,cooperortman,How much oxy for first time?,"Would 10 mg effect me for a first time doing oxy, I’ve done 20mg of hydrocodons before and I didn’t really like the effects, didn’t feel euphoric at all, just kinda made me feel drowsy, how would oxy effects me",1529817242.0
8tfoov,https://v.redd.it/z66xh5eqtv511,4,https://redd.it/8tfoov,bongtheripper666,My sharps bin,,1529817013.0
8tfle4,https://i.redd.it/py0er9ffqv511.jpg,4,https://redd.it/8tfle4,cypher1169,What are these?,,1529815847.0
8tfk9o,https://www.reddit.com/r/opiates/comments/8tfk9o/tricks_for_reducing_or_preventing_nausea/,2,https://redd.it/8tfk9o,SugarMagnolia96,Tricks for reducing or preventing nausea?,I’m sorry I’m sure this has been asked before but  I’m too high and nauseous to track down the info :/. I used to have some prescription strength stuff but all out now so if you guys have tips for over the counter or just stuff lying around the house I’d be super grateful. ,1529815462.0
8tfjcg,https://www.reddit.com/r/opiates/comments/8tfjcg/opinions/,2,https://redd.it/8tfjcg,hbarnes55,Opinions,"What is everyones favorite opiates? Favorite way to take them? 
My favorites are kind of tie between h, yellow bananas (hydrocodone), or oxy 30's 😊 ",1529815169.0
8tfhde,https://www.reddit.com/r/opiates/comments/8tfhde/first_time_snorting_5_heroin/,10,https://redd.it/8tfhde,theonlyragemaster,First time snorting .5 heroin,How high would I get. My motive is to try every drug at least once. Check cocaine off the list. Not doing that again. Next up is heroin. ,1529814534.0
8tffzm,https://www.reddit.com/r/opiates/comments/8tffzm/_/,1,https://redd.it/8tffzm,E40DrDREmel,🐼🐼🐼🐼,Has anyone seen the E40’s lately or just the G74’s???,1529814122.0
8tfczk,https://www.reddit.com/r/opiates/comments/8tfczk/found_this_scrolling_on_fb/,0,https://redd.it/8tfczk,pandamania777,Found this scrolling on FB,"As I’m scrolling I come across this and people I know debating and talking and I’m assuming more then half have no actual idea WTF they were even talking about, regardless still an interesting read:

https://www.pbinstitute.com/blog/drugs-with-the-worst-detox/",1529813232.0
8tfbk2,https://www.nytimes.com/2016/06/05/opinion/sunday/are-opioids-the-next-antidepressant.html,2,https://redd.it/8tfbk2,TheOpiumWars,Interesting article on how opiates act as an anti-depressant when other medications have failed.,,1529812826.0
8tf9r6,https://www.reddit.com/r/opiates/comments/8tf9r6/got_my_heartbroken_so_now_im_fuckin_up/,13,https://redd.it/8tf9r6,Tee416,"Got my heartbroken, so now I'm fuckin up","Have 129 days clean from H, but I really just want to nunb that fucking hollow feeling that heartbreak leaves. So I called my dude, and I'm about to go fully relapse. I'm usually not such a girl about shit, but fuck....Hearts really will never be practical until they can be made unbreakable..",1529812253.0
8tf5lw,https://i.redd.it/gf3o3ah0cv511.jpg,5,https://redd.it/8tf5lw,Throwaway44839848408,"Came up on some gabbys, only thing I can do in rehab and on vivitrol. Gonna be a fun night.",,1529810998.0
8tf5fu,https://i.redd.it/n583013ubv511.jpg,3,https://redd.it/8tf5fu,madisonwm,Obvi not all opis. But this is the one community that appreciates good shizzzz...,,1529810939.0
8tezuy,https://www.reddit.com/r/opiates/comments/8tezuy/dry_as_a_bone_so_is_everyone_elsestarting_to/,50,https://redd.it/8tezuy,RuffSamurai,Dry as a bone. So is everyone else.Starting to panic. Desperately need to get fucked up.,"I know my ex who cheated on me last week is out doing freaky shit. Alone in this empty house panicking cause I can’t get High. Can’t even find fucking Xanax. Realizing this is my life, no friends, no social skills, not much of anything. 20 years old in my “prime”. 

I hate my life so fucking much. Junkie Jesus please help me. 

Might make “the switch” tonight. Fuck it. 

",1529809249.0
8tezah,https://www.reddit.com/r/opiates/comments/8tezah/question/,8,https://redd.it/8tezah,landoftaurus,QUESTION!!!!,"Does your state or any other state that you are aware of have “Casey’s Law”? My state adopted it, and it’s definitely left me feeling torn on which way to support. If your state had adopted Casey’s Law, how do you feel about it?



A little information: Parents, relatives, or friends of an addicted person can lawfully intervene and request involuntary, court-ordered addiction treatment for their addicted loved one through Casey’s Law. The person who petitions the court is responsible for costs. The addicted person must complete two assessments to determine which option is necessary. Then the judge will decide if treatment is necessary, and BAM they get a bed. 
If the addicted person does not complete treatment that was ordered, they may be found in contempt of court. ",1529809090.0
8tez78,https://www.reddit.com/r/opiates/comments/8tez78/unaffiliated_tc_room_open_again_tonight_will/,7,https://redd.it/8tez78,everything_is_still,"unaffiliated tc room open again tonight, will probably be nightly. come by. remember, new link. check the post.","we were stripped from having mod privileges for violating terms of service or something so i have to use my private room apparently? it's the same except it has the youtube player and actual moderation. repeat, new room link, same old chat.   

for those who are unaware tc is a video chat platform that while not perfect, seems to work well for phones and browsers alike. this room is for hanging out, listening to music, and specifically harm reduction so no one has to use alone. it is unaffiliated with r/opiates and its moderators and has its own rules and etiquette. here are the revised and updated rules:  

1) don't do any sort of -isms, it's just not cool and i run a leftist room. your opinions are welcome but no personal attacks or nasty stuff about groups of people. if you want to be rude, get personal, there's plenty of stuff to say about people without going for low-hanging fruit.  

2) don't make obnoxious noises over the mic, or play music over the chat. the bitrate for the sound channel is like 4, everything sounds like crap unless it's played through the built-in youtube player.  

3) don't dox anyone or take pictures or record the chat, this is a place people come to feel comfortable doing various things and anything that violates privacy results in an instant ban.  

4) that's basically it, just don't be a douche.  

the room is at https://tinychat.com/room/everythingisstil  
anyone is welcome regardless of beef and personal history so long as you keep it off the table.  

tagging some people below who wanted to know  

apatheticmuse, im not mad at you. i just got drunk as fuck and blcked out and did a drunken exit :)",1529809062.0
8tewf4,https://i.redd.it/eyv2t8wi3v511.jpg,5,https://redd.it/8tewf4,traceyh415,Putting the Grim Reaper on pause with Narcan,,1529808186.0
8tetwe,https://www.reddit.com/r/opiates/comments/8tetwe/pwd/,11,https://redd.it/8tetwe,sohrd2stp,Pwd,....i tapered down to about 2 40 bags of fent a day... Got some subutex the other day. Sent myself into pwd like an idiot after 12 hours since last dose. Then this am took a full 8mg around 10. Still made it worse. Then scored a gram of H.  Around 2. Didnt touch it. Got another 40 of fent this evening at 7. Feeling a little better.  Obv i have to wait wayyy longer b4 taking subutex again. Like 24 or 36 hours i guess. My question is how long b4 the bupe is outta my system enough to use the last bit of fent??? Thx so much for any advise,1529807395.0
8teuuz,https://www.reddit.com/r/opiates/comments/8teuuz/need_some_opinions/,5,https://redd.it/8teuuz,BLUE-THIRTIES,Need some opinions,"Let’s say I only do 2-3 bags a day of not even fire shit (just decent, does the job), am I in the clear as far as withdrawals are concerned bc I only do so little? And basically I only do it bc of the mental part not so much he physical part at all. What do you guys think?

Be safe and happy nods my fellow nod squad !",1529807690.0
8teogd,https://www.reddit.com/r/opiates/comments/8teogd/could_oxys_be_causing_a_bad_cough/,2,https://redd.it/8teogd,snailsandpigs,could oxys be causing a bad cough?,"so i was recently prescribed some oxys for sinus pain. i've been taking a fair bit before going to sleep but not too much, no nodding and i'm not opioid naive at all. For some reason the last two nights i've been woken up or kept awake by a severe chesty cough when the oxys wear off, kinda coinciding with the 'itchy' phase. I haven't been taking any antihistamines so is it possible that its something to do with that? Growing up I had reeaally mild asthma that would only occur very rarely if my hayfever was too bad, so is it possible that the histamine release could be causing it? 

Either way its kinda worrying as I don't wanna be taking benadryl every day. I will try a 3rd gen antihistamine and see if that does the trick.

if anyone has any answers hmu",1529805690.0
8tetkb,https://www.reddit.com/r/opiates/comments/8tetkb/iv_question/,6,https://redd.it/8tetkb,king-of-elves,IV Question,"My usual ROA is sniffing but I will occasionally shoot.  I know the strength of my gear very well and expect a shot to ""hit"" harder/faster than it feels when doing a line.  Well it seems 1/3 off-the time I get what I expect, but the rest of the time it seems like the shot does nothing at all.  I register, never have any burning or any lumps indicating misses.  I will occasionally bruise excessively when using my forearm but I am confident I'm not missing these shots.   Wife uses the same (we go line for line, shot for shot) and she pretty much always gets that ""fuck me that's tasty"" sensation when IVing while, like I said, I'm lucky to even feel a shot one in three times.  Anyone have any ideas why this might be?  I make the shots so no, wifeys not pinching my dose, lol.  ",1529807282.0
8tetcz,https://www.reddit.com/r/opiates/comments/8tetcz/nearly_a_month_clean/,2,https://redd.it/8tetcz,DopeGuy1234,Nearly a month clean,Hi my second Family. I am at day 29 of my clean time. Nearly a month now. I never thought that I would make it so long. I never thought that I would be a week long clean in the last 1 and half year. I consumed 3-5g a day on the street level dope here in Germany. In my area dope got a purity of 30 percent. I got dope directly from the big man so my dope hada purity of 90 percent. Mostly I got it directly from the kg brick. They cut my 6g off of the brick I used every week. I got myself into a German detox facility with rehab times sometimes. I used to get 120mg diazepam plus doxepin 150mg a day.I still get the 150mg Doxepin a day now. I am 2 weeks out now and I nust used benzos and opis directly after I got out. I had tilidin and clonazepam with me when I got out. I drove with the bus home and took 3x2mg and 700mg of tilidin in the bus. I even didnt get high but I will get high in the next days when I get dope. So you guys know how I can use a Paysafecard without the registring shit? I just want to use the code but thats Impossible without login? I hate that shit! Happy nods fam and to everyone trying to get sober. You can do this dude and duderinos. love ya. ,1529807213.0
8teoef,https://i.redd.it/lgszb056wu511.jpg,5,https://redd.it/8teoef,junkhead1996,Happy saturday ladies and gents and yes.. happy nods ;),,1529805678.0
8teni1,https://i.redd.it/s9qorh7fvu511.jpg,18,https://redd.it/8teni1,offthedone,I have found the allusive panda!! First time I’ve come across them!!,,1529805423.0
8tehnh,https://tonic.vice.com/en_us/article/wjxd9b/ketamine-nasal-spray-will-totally-change-the-market-for-antidepressant-drugs,5,https://redd.it/8tehnh,spinderella69,"I found this really interesting, thought others might too!",,1529803623.0
8tegqh,https://www.reddit.com/r/opiates/comments/8tegqh/why_do_you_need_more_opiates_to_get_high_if_you/,7,https://redd.it/8tegqh,young_boss,Why do you need more opiates to get high if you weigh more and does this only apply if you ingest orally?,,1529803340.0
8teghs,https://i.redd.it/wlkeiotzou511.jpg,8,https://redd.it/8teghs,acm001010,can someone identity these? they look like oxys idk,,1529803258.0
8tegbn,https://www.reddit.com/r/opiates/comments/8tegbn/having_trouble_with_getting_my_bth_out_of_the/,3,https://redd.it/8tegbn,imafathobbit,Having trouble with getting my bth out of the baggie? Any suggestions welcome.,"Like the title says, I'm struggling. Lol. I got a couple .5 bags of tar from my dude. I've only messed with bth a few times now. Don't shoot, either make gunpowder/cheese, or monkey water. I've tried smoking it a few times, but it's just not for me. 

Anyway, the stuff is in little corners of sandwich bags and tied off, you know how they do it. So last night I was having a lot of trouble getting it out. So much was stuck to the bag itself. I was literally ripping off peices of the plastic accidentally while trying to get it out. I got what I could out of it, but I felt like probably a third of it was just stuck on the plastic. I ended up just having to put the tar baggie in a little bit of water and mixing it around till it all came off and then using that as my monkey water. 

I'd much rather get most, if not all of it off, so I can make gunpowder with it. What kind of tips do you guys have for getting the tar out if the baggie? I know freezing it will help, I'm just hoping I can get some more suggestions. Thanks in advance for any help.",1529803207.0
8tecfd,https://i.redd.it/00h6dw0clu511.jpg,19,https://redd.it/8tecfd,canadadogcatcher,Are these real they said 35 each or 30 if u buy 10+ (canada),,1529802025.0
8tec5w,https://www.reddit.com/r/opiates/comments/8tec5w/happy_nods_to_everyone/,8,https://redd.it/8tec5w,btcmillenial,Happy nods to everyone,"Finally copped after 24 hours, I feel great! I love all of you, I hope everyone has recently copped and is feeling good with me, I'm loving life",1529801939.0
8tec06,https://www.reddit.com/r/opiates/comments/8tec06/the_week_i_lived/,76,https://redd.it/8tec06,youmeand5bucks,"The week I ""lived""...","I have cancer. I've recently found out that none of the treatment I've gone through has worked, and I'm now Stage 3. I've spent 44 (almost 45) years never having even tried most street drugs. I don't even drink alcohol. I'm prescribed oxy but don't even take the amount I'm supposed to. I've used Marijuana and that's about it. Something about facing my own mortality made me want to just do some crazy shit. Soooo...I spent the week with my two friends who are heavy iv drug users. I watched them panhandle and trick for money. I almost went to jail when one of them got into a full on fist fight in a gas station parking lot over a stolen vehicle. I shot up heroin, dilaudid, and oxy when I've never shot up in my life. I cheated on my bf. I just did whatever I felt like doing in the moment for an entire week. Now I'm back to my quiet, mostly boring life where I'm a gf and a mother (one child lives in another state at college and the other I share joint custody of with his father so neither child was neglected during my week of fun). I have no desire to ever stick a needle in my arm again, no desire to do heroin again, no desire to cheat again, and no desire to do dilaudid again even though I get that in the hospital quite often. I had one week where I lived a life I've only heard about or seen other people living. I have no regrets about anything I did. I'm going to die from the cancer probably. While I have done some other crazy things in my life (ran from 2 states worth of police once in a high speed chase and got away), now I feel like I've ""lived"". I know some will think I was wrong to do some or all of these things, but those people probably aren't dying. It makes you face life in a way you never have. So I'm glad I lived this past week doing whatever I wanted to do, and lived in the moment. I wouldn't trade it for anything. ",1529801893.0
8te9v7,https://www.reddit.com/r/opiates/comments/8te9v7/buprenorphine_54_411/,3,https://redd.it/8te9v7,magicccmark,buprenorphine 54 411,What’s the hype about for the bupe Roxane brand 54 411. I’ve been taking the teva brand for a while now. Should I be worried bout wd if I change over?,1529801242.0
8te42n,https://www.reddit.com/r/opiates/comments/8te42n/can_i_use_a_vaporizer_pax3_to_vape_black_tar/,6,https://redd.it/8te42n,princesspandaaa,Can i use a vaporizer (pax3) to vape Black Tar?,"hope everyone is having a good day! so i have a pax 3 weed vaporizer and they have this concentrate add on (for wax). i've been putting a small amount of black tar H in it and vaping it on the highest setting.

does anybody know if this is a legitimate way to smoke bt? i do get a taste but barely any smoke. i dont feel like its realy getting me high either. thanks in advance !
",1529799524.0
8te7jz,https://i.imgur.com/TF2y9R3.jpg?1,6,https://redd.it/8te7jz,dori_88,Sorry for the Poor Quality. On Day 13 at the 5th Meeting There was the 1st NA Meeting.,,1529800558.0
8te6ye,https://i.redd.it/7z187c6egu511.jpg,14,https://redd.it/8te6ye,c0ba1n1ac,"I was doing no more than 4-6 of these bags daily for five years, up until the last 2 weeks. Now I’m doing anywhere from 7-11. I need to detox ASAP. How bad will it be with the amount I’m using? What’s the most painless way to get through it? Should I do it at home or a facility?",,1529800372.0
8te1qc,https://www.reddit.com/r/opiates/comments/8te1qc/scramble_speedballs/,8,https://redd.it/8te1qc,Lillizsomd,Scramble speedballs,"So, I've recently fallen in love with speedballs, and I live in the only area in the US that gets scramble caps. For anyone who doesn't know, scramble is dope/fent mixed with...something...and put into gel caps for either 6 or 10 bucks. Two 6 caps or one 10 cap is a single serving. 

Well, the scramble is all I can reliably find in the area. And on the upper side of the binto an irritating issue trying to mix them in the syringe. No matter what I do, when I put the two together, they solidify somewhat! I've tried heat, no heat, mixing them in the same spoon, in separate spoons, pulling up the dope first, and pulling up the crack first. I don't know what else to try at this point.

So what I'm wondering, science people of r/o, is what ingredient in these two conglomerations is causing this (I assume) chemical reaction? I'm kinda guessing it's the baking soda in the crack reacting with whatever the inactive ingredient in the scramble is, which I don't know what it is. It apparently used to be quinine back in the day, but I doubt it's that any more. Also-I'm using grape kool-aid powder to break down the crack. 

It's still somewhat injectable even when it clumps up, I did and it went in fine and just left the solids at the bottom of the syringe after I shot the rest. Still, I can't imagine it's overly great to be shooting something with particulates like that in it. So, if anyone knows why it's doing that, I would also greatly appreciate if someone could help me fix that issue. 

Damn this got long, can y'all tell I'm speedballin'?? 

Tl:Dr- Love speedballs. Can only get scramble and crack. Mixing them makes it semi-solidify in the syringe or on the spoon. Why and how do I fix it?",1529798873.0
8te1jc,https://www.reddit.com/r/opiates/comments/8te1jc/speedballin/,10,https://redd.it/8te1jc,CranjusMcBasketball2,Speedballin,"Hey guys.  I have a question. 

I'm about to score some coke with my dope. However, I've only done coke twice, and not injected. The hubs and i wanna try a speedball but i don't know how much coke to add. We typically do approx 1/4 gram of dope per shot. I know you can't tell me exactly how much coke to add, but maybe give me a ballpark? I'm only getting a gram of soft and like, 12 grams of d food. 

Any advice for a first time speedballer?

TIA",1529798805.0
8te02l,https://www.reddit.com/r/opiates/comments/8te02l/how_can_aana_work_for_an_atheist/,24,https://redd.it/8te02l,OpiCyde,How can AA/NA work for an atheist?,"My psych is really pushing me to go to meetings. I fucking hate the idea and he knows it. I am an adamant atheist. He asked me to read “the big book” for AA and I’m finding it incredibly hard to get through. All I see over and over is “surrender to God and he’ll take care of it”. Well what the fuck am I supposed to do if I think God is a fairy tale?











Totally serious I’m trying to keep an open mind about AA/NA and I’m reading the book, taking my subs, trying new psych meds - but this is a bridge too far. How do I use AA if I don’t even believe in God?!",1529798377.0
8tdz44,https://www.reddit.com/r/opiates/comments/8tdz44/how_much_of_h_smoked_do_you_guys_need_to_catch_a/,1,https://redd.it/8tdz44,Ar0war,How much of H smoked do you guys need to catch a nodd? Just curious,"And also to confirm I am using it wrong and my chasing skills arent good at al. Have 0 toleranze and cant catch one for shit. 

The quality isnt the problem, its from the dnm and I know how to buy there. 

Stay safe out there :)",1529798091.0
8tdxys,https://youtu.be/QhxwhpYvUKg,1,https://redd.it/8tdxys,joebyrd0,Hilarious part in Iron Man 3 when the mandarin clearly nods off opiates at 2:38.,,1529797755.0
8tdu0w,https://i.redd.it/y6f2d0s75u511.jpg,10,https://redd.it/8tdu0w,PandaBroads,Shoulda told the pharmacist to fuck off. These NP’s just don’t cut it for ya boi who feels me,,1529796608.0
8tdt0s,https://www.reddit.com/r/opiates/comments/8tdt0s/your_experience_with_vivitrol/,3,https://redd.it/8tdt0s,somerural,Your experience with Vivitrol,"Just what the title says. I'm looking to seriously stay clean from opiates (currently on day 2 of no H) and am curious as to how successful people have found Vivitrol to be. I would prefer not to take methadone if possible, and am still considering the option of Suboxone if all else fails.

Thanks in advance guys and girls :)",1529796318.0
8tdnd1,https://i.redd.it/6a6jg56kzt511.jpg,1,https://redd.it/8tdnd1,HighFi208,Sedated Saturday sliding some super 🔥,,1529794709.0
8tdkas,https://i.redd.it/bvrxeol2xt511.jpg,5,https://redd.it/8tdkas,bongtheripper666,Fuck everything imma take a nap 😴 💉,,1529793867.0
8tdkag,https://www.reddit.com/r/opiates/comments/8tdkag/annoyed_as_hell/,17,https://redd.it/8tdkag,northlondongunner,Annoyed as hell!!!,I sometimes score from this lady who needs huge amounts to get her high. Must’ve a really high tolerance. I scored her 3 k9 oxy 30s saw them come right out of the script and everything they’re 100 percent real. She then calls me back an hour later and claims there fake. Demanding her money and saying she wants the guys name. First off i did you a favor get the fuck outta here with that bullshit. Rant over ,1529793866.0
8tdjqk,https://www.reddit.com/r/opiates/comments/8tdjqk/why_does_suboxone_taste_so_foul/,22,https://redd.it/8tdjqk,MetroMaker,Why Does Suboxone Taste So Foul?,Anyone know why suboxone tastes so awful? One would think that big pharma could make it taste better. I would like grape. ,1529793722.0
8tdhyz,https://www.reddit.com/r/opiates/comments/8tdhyz/so_i_took_1600mg_of_codeine_to_test_the_ceilling/,16,https://redd.it/8tdhyz,RazorsharpLTU,"So i took 1600mg of codeine to test the ""Ceilling dose"" hypothesis","I had an argument on here about the ceiling dose, i usually do 1200mg, and people kept saying i was wasting codeine by taking that much, and they said just try taking more to see if you have an increased effect.

And holy shit, am i thankful i did.

So it was a unique day for me, since we were recording our debut EP, so i  decided i should do codeine a bit earlier than scheduled because i was  in the studio recording shit and i couldn't concentrate to save my life.  I was planning to leave the codeine for a party i was having later that  evening, but since we were way off schedule i decided to skip it and  just take the codeine to make the most left of my recording session. I  filtered out about 1600mg of codeine (had some old leftover residue i  refiltered + 1500mg of regular pharm grade codeine w/APAP) downed 20mg  of citerizine and drank the codeine.

And holy shit

The  trip was intense, not as intense as the one i had from H, but needless to say - i was swaying left, right and could barely keep my  balance for a few minutes. I felt a bit of itchiness from the histamine  release, but nothing else much noteworthy - just an intense, euphoric,  pleasurable high which left me zoned out into music for a good 3 hours.

Even  my band member asked if i didn't get bored recording the same riff over  for 3 hours to get the ""perfect take"". Hah, got close. Was one of the  most productive studio sessions in my life.

And  before you mention placebo - i didn't expect anything, i was kinda  expecting it to be less intense than it was. Words cannot describe how  that 300mg improved my high. Maybe it's because of the dexamethasone i  took 2 days ago? But it couldn't have been that, since i took codeine  the day before this trip (first day of recording and setting up amps) so  my tolerance was pretty high, although i only took about 900mg and it  left me cranky and unproductive afterwards.

TL;DR the trip was way more intense than the usual codeine 1200mg i was doing. So, yeah. I disspelled the myth for myself and i will now be upping my dose of codeine to 1500mg. The high was so intense - i want to break my schedule of once a week and do it again soon, and that fucking scares me.",1529793229.0
8tdf8x,https://i.redd.it/0958f8cwst511.jpg,7,https://redd.it/8tdf8x,oEXTRaCTs,Definitely feeling this dry spell,,1529792470.0
8tdet4,https://i.redd.it/ju72jomkst511.jpg,3,https://redd.it/8tdet4,shakedown757,Roxys for my friend a shot of black for me,,1529792354.0
