7d5m09,https://www.reddit.com/r/opiates/comments/7d5m09/breaking_thru_subutexbupe_with_fentanyl/,5,https://redd.it/7d5m09,doobiesnackz,Breaking thru Subutex/bupe with fentanyl,"I've seen some anecdotal reports of people using fentanyl and its analogues while on low dose Subutex/buperenorphine & actually getting high.

I'm on low daily doses of Subutex, around 1mg to 3mg daily, usually no more than 2 but over the course of yesterday I IVd around 4 - 5mg just cause I was having an anxious day, and sadly the pseudo feeling from banging my sub kept me relaxed. 

Well my long awaited package from a faraway land arrived today, 2g of 2-ME-MAF / 2-methyl-maf and 1g of 2f-DCK. Praise JJ

Well I'm curious if the 2-ME-MAF will be able to break through the Subutex, its been ~14hrs since my last dose (1.5mg or so IV) but did doses like that roughly every 6 - 7hrs yesterday. 

Anyone had luck with fentanyl breaking through bupe's stranglehold on their opi receptors? I plan on vaping it on foil or in my vaping mod + RDA/RTA/or sub ohm tank & making a nasal spray since I'm a bit concerned trying to IV could be disastrous with the potent fentalog.

You can bet your ass I'm doing some 2f-DCK IM/IV much later tonight 👌 👌 👌 

I'm aware that respiratory depression can affect me more/quicker than any euphoria or sedation will, I'm just curious and thought I'd ask before diving in",1510766629.0
7d5j7o,https://www.reddit.com/r/opiates/comments/7d5j7o/im_not_getting_this_warm_feeling_from_opiates/,30,https://redd.it/7d5j7o,LiveLoveAsap1,I'm not getting this warm feeling from opiates anymore,"First time i took morphine it felt so good, the effects was so intense and relaxing i was almost crying of joy, but now it's kinda meh... i mean i still get a warm sensation in my body but it's not like extremly relaxing like it used to... What should i do ? take higher dose  ? I only take morphine once a week so normally my tolerance shouldn't be very high but recently i've been taking tramadol almost every day, do you guys think it's tramadol that raise up my tolerance ? ",1510765990.0
7d5der,https://www.reddit.com/r/opiates/comments/7d5der/puked_right_after_my_morning_blues/,18,https://redd.it/7d5der,jive_a215,Puked right after my morning blues,"Just snorted two blues and directly after projectile vomited bile all over my dorm room so that's how my mornings going 🤘 on a plus side I still got high. But that's the weird part, it wasn't the drip or anything that made me sick I just immediately ralphed. Lol",1510764627.0
7d5c8m,https://undark.org/article/pregnant-women-opioids-supervised-injection/,5,https://redd.it/7d5c8m,oneultralamewhiteboy,Should Pregnant Women Have Access to Supervised Injection Sites?,,1510764350.0
7d5a9k,https://www.reddit.com/r/opiates/comments/7d5a9k/less_then_1mg_sub_and_smokin/,4,https://redd.it/7d5a9k,DragonChaser760,Less then 1mg sub and smokin,I’m having a hard time fighting the urge I took about 1/6 of a 2mg  sub this morning if I grab dope will I be fucked or just pick up and wait a day? ,1510763863.0
7d549z,https://www.reddit.com/r/opiates/comments/7d549z/whos_ready_for_pandas_and_a_froggy/,2,https://redd.it/7d549z,Catman12000,Who’s ready for pandas and a froggy?,Just waiting at the pharmacy for them to fill them. Woot woot!!!!,1510762385.0
7d547d,https://www.reddit.com/r/opiates/comments/7d547d/a_new_beginning/,12,https://redd.it/7d547d,BoogahSugah94,A new beginning,"So for the past year and a half I've been banging dope daily. It started as a recreational fling with 30's, then these awesome fentanyl laced 30's came into town, only had to snort a quarter to be lit. Kept doing those until my buddy said ""hey you should try this one time."" I said fuck it, so we loaded up a rig with about a 3rd of a dirty 30, let him hit me with it, then BAM! Holy shit I felt like I was in heaven. Then 30 seconds later ran to the toilet to puke. Fast forward a couple weeks of only doing that a couple more times but still snorting daily, those start to disappear, and dope comes into the picture. Started banging that daily. Fast forward to a few weeks ago, no money, working every day, skinniest I've ever been in my life, selling whatever I can to get money. I finally break down, call my grandparents, tell them I've been on drugs, (my mother is in a nursing home and they can see her bank account which I had been using to get dope funded by the state, fuck). A week or so goes by, and I break down again. A change has to be made. I call my dad, who was been a marine officer his whole life, and tell him what's up. Tell him I need help and ask him to come get me. Sunday comes and he's here, helping me pack and throw away all my stuff. We head back to his house Monday morning. The past few days haven't been completely horrible. No sleep Monday night with restless legs and pools of sweat. But last night, I actually got some sleep. Last night I didn't wake up drenched in sweat. I got up at 7:30 as I could fall back asleep. Came downstairs and talked with my step mom. Told her how I slept, and that I am feeling better physically and already a little mentally. Yesterday I was depressed and didn't see a possibility of my life being successful. Today, as I was sitting outside smoking a cig, breathing the chilly air, the sun in full brightness, I felt good. I felt positive. I felt like I'm overcoming this disease and that there is hope for my life to be something again. I still have a lot of work to do, and a whole lot of debt to pay off, but I have a new outlook and positivity that I haven't felt in a very long time. Today, I feel good. Today, I feel positive. Today, I feel confident that I can conquer this recovery.  Today, I have hope.",1510762366.0
7d5425,https://www.reddit.com/r/opiates/comments/7d5425/newbie_question_best_roa_for_using_3_heroin/,15,https://redd.it/7d5425,Axxel_Mulatto,Newbie question: best ROA for using #3 Heroin (Freebase) without IV'ing?,,1510762337.0
7d50pf,https://www.reddit.com/r/opiates/comments/7d50pf/quick_question_fellas_about_a_ua/,4,https://redd.it/7d50pf,scrotalfrontier,Quick question fellas about a ua.,"I rarely ever use opiates. Maybe two years ago. But, 3 weeks ago I treated myself to 40-50 mgs of oxycodone. I’m 6,2 220 lbs. I’m having a drug screen tomorrow for a new job. It’s a UA and gets sent to a lab. Last 2 weeks I’ve been drinking a shit ton of water. Should I be fine?

Thanks guys!",1510761544.0
7d4kao,https://i.redd.it/ej2h7fmvj5yz.jpg,20,https://redd.it/7d4kao,polytoxicwaste,"Got prescribed that after hand surgery, ridiculous",,1510757413.0
7d4hje,https://www.reddit.com/r/opiates/comments/7d4hje/can_i_kick_it/,10,https://redd.it/7d4hje,EthelWinters,Can I kick it?,I think I can.   I got a zip of some fire Buddha and an ounce of kratom. I kept fucking up my taper aka just kept getting high so let's fucking do it all natural wish me luck fam ,1510756676.0
7d4ec0,https://www.reddit.com/r/opiates/comments/7d4ec0/finally_started_mmt_but_got_hep_c/,9,https://redd.it/7d4ec0,mansetta,Finally started MMT. But got Hep C,"In Finland it is difficult to get into maintenance therapy. I've tried to apply for over a year, and they required me to try rehab first anf fail it.

After that they finally started the evaluation for MMT. It took 3 months, drug screens and meetings with doctors. 

But finally I was allowed to start! They will titrate the dose during a 2 week stay in rehab, got only 10mg today. 

This was supposed to be the happiest day in a while but unfortunately they told me I have Hep C now. Just hope my SO hasn't got it from sex, but that is unlikely.

Stay safe everyone and good luck!
",1510755809.0
7d4bhz,https://www.cnbc.com/2017/11/15/herbal-anti-opioid-supplement-kratom-could-fuel-new-addiction-fda.html,15,https://redd.it/7d4bhz,BerkeleyLovelaceJr,"Herbal anti-opioid supplement kratom could 'fuel new addiction,' FDA warns",,1510755039.0
7d46be,https://www.reddit.com/r/opiates/comments/7d46be/did_i_make_myself_sick/,9,https://redd.it/7d46be,angelxrose,Did I make myself sick?,"I snorted five bags over the course of 2 hours last night.... two bags at a time, then three. I've never done so much. I woke up with a fever and throwing up and dry heaving from straight nausea.... is this just a coincidence or did I push myself too far?
Maybe a dumb question, but will my thc dab pen help the nausea ? I'm kind of suffering rip",1510753557.0
7d43fp,https://i.redd.it/0bbmmn5t55yz.jpg,49,https://redd.it/7d43fp,NoseCandiez,Who the fuck thought it was a good idea to put this out in the cafeteria? Triggered AS FUCK.,,1510752668.0
7d40dy,https://www.reddit.com/r/opiates/comments/7d40dy/favorite_cigarettes_to_smoke_while_high/,25,https://redd.it/7d40dy,wakeofyourlife,Favorite cigarettes to smoke while high?,"I was all about Marlboro Blacks (full flavor, can't stand menthol) for a long time, with some Southern Cuts every now and then. Right before I quit smoking though, I had switched to Camel 99s. 

I have many fond memories of Roxies and Blacks. I've also noticed that many of my addict friends smoked blacks, too. 

How about you guys? ",1510751796.0
7d409f,https://gfycat.com/GloriousLinearAbyssiniangroundhornbill,46,https://redd.it/7d409f,TexasPeteHawtSauce,Getting through those 8 a.m. lectures,,1510751755.0
7d3wyo,https://www.reddit.com/r/opiates/comments/7d3wyo/wish_me_luck/,18,https://redd.it/7d3wyo,Catman12000,Wish me luck,"Goin to pm doc in an hour, gettin the panda and oxy scripts. Wish me luck, pray, send vibes etc... thanks!",1510750729.0
7d3t9c,https://www.reddit.com/r/opiates/comments/7d3t9c/finally_got_clean/,30,https://redd.it/7d3t9c,OpiumSmoker666,Finally got clean,"Took a shower this morning, now if I could just get off the dope. ",1510749475.0
7d3t0p,https://www.reddit.com/r/opiates/comments/7d3t0p/pinned_eyes/,28,https://redd.it/7d3t0p,DopedRenaissance,Pinned eyes,Is there anyway to dilate your pupils when you are high? Or does anyone have any tricks on how to atleast make your eyes look a little better? Trying to see if I can get my pupils to not look like a pencil point while high.... ,1510749391.0
7d3oa7,https://www.reddit.com/r/opiates/comments/7d3oa7/i_need_some_information_on_detoxing/,10,https://redd.it/7d3oa7,myfaceinthesink,I need some information on detoxing,"I have been heavily addiced to fentanyl before. Because of that, every time I do opioids, I will withdrawal.

Today I got one gram of heroin in and will get 16 mg buprenorphine in a bit.

I think I will use around 100 mg a day (smoked) until I run out, so around ten days.

I never used buprenorphine. Please give me some advise about how to withdrawal as lightly as possible when I run out.

Thanks a lot, people!",1510747731.0
7d3jzi,https://www.reddit.com/r/opiates/comments/7d3jzi/pro_tip_on_how_to_befriend_the_future_you/,10,https://redd.it/7d3jzi,the_evil_me,pro tip on how to befriend the future you,"Background: I've been around and something that haunts me (and all of us) are WD (duh..) And that's where I so something silly, check it out. 

So I tend to get dope in larger quantities (7-14g max or something like 50 Oxies) and WD in between with hopes of never getting back and crying in loneliness - aka ""the usual"". It's important to get it in large quantities much less frequently.

Now, when the shit comes, what I do, is I create few emergency portions and hide them well. From the perspective of me getting new shit, I don't care. I have more than enough for now, and I won't be running out anytime soon so it doesn't phase me at all. By the time I run out I don't even remember where and if I put aside anything at all.

Eventually when the inevitable comes knocking on your door to collect the happiness tax, you'll be damn guaranteed® to start searching in panic for any bit of dope left. That's when you find your little gift from yourself in the past. You can't help but to love that dude (and since you're withdrawing, you probably already did and it took much less time than you expected - that sexitivity  skyrockets).",1510746174.0
7d3jej,https://www.reddit.com/r/opiates/comments/7d3jej/introduction_nearly_10_years_working_in_harm/,31,https://redd.it/7d3jej,macknero,Introduction: Nearly 10 years working in harm reduction,"Hello,

I’ve spent the last 8 years working in harm reduction from street outreach, to working at the second largest needle exchange program (millions of syringes a year!), to managing my own exchange site, working as a peer counselor, running harm reduction book club, phlebotomist at nx site, and finally HIV test counselor.

I’m not an active drug user (besides nicotine and occasional caffeine). 

I’d be happy to explain or answer any questions about how needle exchange programs work from funding, working with local government, managing and recruiting volunteers, HIV/Hep C testing, buying nx supplies at an institutional level, writing and distributing harm reduction literature, other HR interventions, how to do outreach, how to teach new outreach workers, wound care/providing medical treatment to underserved populations, Narcan distribution/programs, HR research/stats, ethics in HR, community organizations and public health policy and pretty much anything else HR related.

My friend said this subreddit might be interested, and I’m happy to help.

TL;DR: needle exchange program admin, phlebotomist, HIV test counselor and harm reducer here AMA",1510745942.0
7d3i2e,https://i.imgur.com/QZEUGAg.jpg,14,https://redd.it/7d3i2e,myfaceinthesink,A gram of some H,,1510745426.0
7d3hed,https://www.reddit.com/r/opiates/comments/7d3hed/oh_my_fucking_god_hahah_funny_story_that_happened/,19,https://redd.it/7d3hed,TARmander1,"Oh my fucking God, hahah. *Funny story that happened just now..","Soo, I was getting ready for bed and chillin watchin Netflix. I posted recently about how I always save at least a shot for the morning because I hate the feeling of having to wake up sick or getting there and having to scramble and call my guy in the morning and wait at all. And I get paid tomorrow night  so I dont gave any immediate cash, so I'd have to pull some quick strings which aren't garunteed lucrative. Anyway, k pick up and look the piece I saved. A nice little chunker of bth for a pretty solid wake up shot, and your boy, Mr. fuckin bitch ass fuck head boner (me haha) drops the shit on my desk and it bounces and I hear one click from an undisclosed location on my floor/maybe office chair and that's it. Done this a couple times, so im like shit, but no big deal I'll find it in a few seconds. Anyway not in immediate view and I scramble and scramble and no luck as the impending FUCKING DOOM creeps into the forefront of my mind minute after minute after second after fucking minute until I'm tearing apart my organized, clean ass baller lounge of a room I cleaned, remodelled, and organized last night, as hilarity would have it. No luck after 45 minutes and I'm SUPER FUCKING PISSED CUSSING myself out, etc. Finally, I get a smidge of an idea. Hey maybe it didn't hit the floor at all. Checked everywhere else and even though I ran my fingers where I could in the nooks of my office chair, it was to no avail. So, in last, desperate hope my junkie ass takes apart the center mechanics of the chair.. did that and shook the seat and what clanged out and hit my floor WAS MY SOLID MORNING CHUNK!!!! the heavens then descended and my morning is saved.
",1510745176.0
7d3drl,https://i.redd.it/rosvik8af4yz.jpg,49,https://redd.it/7d3drl,Opiophille,This is what I did before I sold my studio for opiates 3 years ago. Slowly saving back up to rebuild it now that I'm sober.,,1510743792.0
7d2ysz,https://i.redd.it/evxyz88cx3yz.jpg,9,https://redd.it/7d2ysz,boyblue666,What are your current favourite things to eat/drink while high? Or what are you munging out on tonight?,,1510737733.0
7d2t9v,https://www.reddit.com/r/opiates/comments/7d2t9v/need_advice_bad/,28,https://redd.it/7d2t9v,johnnyhorror,Need advice BAD!!!,"First off sorry for flooding this community but I've recently just discovered reddit and don't have many ppl in my life to talk about this shit to... Ive been on for  4 or 5 years..i told the love of my life about my problem about 4 months ago(but not the heroin part ) cause i couldn't stand lying to her anymore. .i thought she was gonna leave me but to my surprise she was very supportive. .and  naturally i relapsed not long after and i kept it from her for about 2 months and then broke down and told her again, but this time she cried her eyes out for 2 hours and wouldn't speak to me but again to my surprise she was very supportive. ....so here we are again, I've relapsed shortly after telling her for the second time but this time i don't think i should tell her but all she wants is honesty from me...should i tell her again? ? Get clean first and then tell her? ?? I dont fucking know what to do anymore cause i love opiates and its the only thing that gets me through my day. .ugghhhhhhh fuck !!!!",1510735364.0
7d2gzn,https://i.redd.it/i49c25w1b3yz.jpg,8,https://redd.it/7d2gzn,clerror,Pick up day. Here’s some pill porn for everyone.,,1510730246.0
7d2gzc,https://www.reddit.com/r/opiates/comments/7d2gzc/oliceridinetrv130_a_journey_to_mu_agonist/,12,https://redd.it/7d2gzc,CaptainFentanyl,Oliceridine/TRV130 - A Journey to Mu Agonist Optimisation,"Oliceridine or TRV130 is a phase III investigational mu agonist opioid compound which I have this week been able to get my hands on for the first time. 

Many of the negative effects, especially those we experience as dependent individuals occurs due to tolerance, dose escalation and downregulation of the endogenous opioid system (fewer, less sensitive MOPs) and an increase in the level of signalling from other excitatory neurochemical pathways. 
Acute withdrawal is often the result of an upregulated overactive noradrenergic system combined with increased glutamatergic neurotransmission. These develop rapidly and are lost rapidly (although when withdrawing a week of the brain downregulating these upregulated systems in response to acute opioid withdrawal seems anything but rapid). 

It has been shown that many of the downstream compensatory pathways that are activated in response to chronic opioid use are triggered by opioid receptor internalisation.  Morphine, Heroin, Fentanyl all bind to the MOP causing its phosphorylation and eventual internalisation (as well as releasing a G-Protein from the complex leading to the positive subjective opioid effects. 

TRV130 is an opioid optimised for maximum G-Protein signalling (pain relief, sedation, euphoria) and minimal beta-arrestin2 signalling (internalisation, tolerance and physical dependence). 

It doesn’t feel like morphine to take, nor does it sedate as much as Fentanyl. I have used it to replace my entire Fentanyl and morphine usage for the last 2 days and have not suffered any WD or ill effects. Nor have I had to escalate the dose. 
I plan to continue the experiment for the rest of the week. 

Please take some time to read the [link](http://www.trevena.com/pdf/ChenetalJMedChem2013_TRV130leadop.pdf) to see how this opioid with unique and possibly very positive features for those dependent, in pain requiring excessive opioid doses due to tolerance and for those new opioid users in acute leading to chronic pain that may avoid rapid dose escalation and tachyphylaxis with this interesting almost licenced chemically unique opioid drug. 
There is also a Wikipedia article for TRV130 which contains less information but may be more accessible to everyone. 

(When licensed, if not before, this drug is bound for schedule 2, so any others interested in synthesis out there, the enclosed paper will also sure give you some ideas on how to modify TRV130, once scheduled, to produce legal analogs (until those get scheduled also), as it did for myself)

",1510730244.0
7d2d9w,https://www.reddit.com/r/opiates/comments/7d2d9w/how_much_do_blue_dealers_get_em_for/,11,https://redd.it/7d2d9w,aidanent,How much do Blue Dealers get em for?,"I have a oxy guy, he runs his business like a small time operation but the volume is huge. Probably collects 1500 on a bad day, 3000 or more on a good one. All blues at 25 each. Even though he mostly does retail (he would meet me for 1) I have no doubt that I can call him for 500 and that he would have them on hand right now. How much do you guys think he gets his for and what should I ask to pay if I want to get a 100 or 200 to flip on my own?",1510728847.0
7d2bji,https://www.reddit.com/r/opiates/comments/7d2bji/fent_alert_should_be_changed_to_real_heroin/,3,https://redd.it/7d2bji,Shaou_Lin,FENT ALERT should be changed to REAL HEROIN,"But then there would be no alerts, Yeah man fent is everywhere ",1510728207.0
7d281v,https://www.reddit.com/r/opiates/comments/7d281v/did_i_miss/,3,https://redd.it/7d281v,NeaOnnimNoSuaAOhu,Did I miss?,"Recently it's been hard for me to shoot up. I lost the crooks of my arms, and I have a really hard time hitting other veins for no particular reason (I have really good veins too). I live in NJ so my dope is ECP (powder) and the veins in my forearm have a lot of scar tissue so they're pretty hardened and sore.

I couldn't hit any other vein so I went to my left forearm which I've left alone for a few days (really didn't want to use it but I'm desperate). I drew a tiny bit of blood, tried to dig around for some more blood and got some more to the point where I felt comfortable. I injected just a little bit - it didn't burn at all (it usually would, and I've missed a tiny drop with this same dope and it'll burn if I missed), so I kept going little by little until it was all gone. In the back of my mind I don't feel like I registered well enough, but it didn't burn at all, everything was fine after, and all was well. I didn't really feel the rush I usually feel, but I had also done a lot an hour prior to this one, and was just doing these 2 bags to get  as much of a nod as I could.

If I press to where the vein is, right before the scar tissue that I'm trying to avoid is, there is the tiniest of tiny bumps (where I IV'd). You have to press to feel it and it's barely noticeable. Doesn't hurt, isn't warm, isnt swollen, isn't red at all: nothing. But for some reason I still have some gut feeling that I missed.

So, the reason for this post is - can I still have missed even though I didn't experience any of the burning/symptoms of a miss? Does it always go the same way? Or did I just get lucky and I was registered enough to get it all in there without a problem?


TLDR ---- feel like I missed a shot but there wasn't any pain/burning, no symptoms, no redness, no swelling, no lumps/bumps, no nothing - I did register SOMEWHAT but I just kind of pulled the trigger on a whim because I was frustrated. Can you still miss without experiencing any symptoms? Would be the first shot I ever fully missed.",1510726917.0
7d27ma,https://www.reddit.com/r/opiates/comments/7d27ma/thought_id_stop_by/,7,https://redd.it/7d27ma,skipper489,Thought I'd stop by,"Haven't visited this subreddit in 6 months since I got clean. Pretty emotional to read some of the posts that bring back some gut wrenching feels.

It's crazy to think of how far I've come. Moved over 1000 miles away from my home state to a warmer land, winter has never been better. I weighed 130 pounds in May at my worst as a daily IV heroin/meth addict (6 foot 2 inch tall male) and I have gained 60 pounds !  I also have maintained the same job for 6 months and recently purchased a car registered and insured in my name. I'm registered for college in January and of course getting high still has it's appeal. But after going to an NA meeting tonight it just doesn't feel like an option.

Know that you can quit, it takes some courage and pain getting through the withdrawals, but in the end if you are REALLY sick and tired of being sick and tired, there are so many good rehabs in US, Canada, Europe, etc if that is an option. It worked wonders for me.

Not sure if I can do this but if anyone is in the American South West, there's a drug/alcohol treatment program I live at that is phenomenal. It's a ranch outside of town with animals and around 30-35 dudes at any given time that CARE a lot about their sobriety. The awesome thing is that it's a mere $700 a month which includes food and rent and treatment. Thats a steal compared to other programs charging thousands.

Seriously! DM me if you want to get clean and I'll get you in the program. Life is good and I gotta try to reach out. 

Peace and Love, stay safe",1510726754.0
7d26ds,https://www.reddit.com/r/opiates/comments/7d26ds/nondarknet_heroin/,10,https://redd.it/7d26ds,NoireArendt,Non-darknet heroin,"So, I've been an addict for around a year now, and up until recently I managed to avoid buying in person. I finally caved after several vendors were shut down, on top of various markets collapsing, and I'm stunned at both how weak the stuff is and how much seemingly everyone attempts to charge locally. I'm curious about others' experiences in small-medium sized cities.",1510726329.0
7d21jx,https://www.reddit.com/r/opiates/comments/7d21jx/questions_on_withdrawal_symptoms_bile/,10,https://redd.it/7d21jx,FreeEggsToastTeaOnMe,Questions on withdrawal symptoms. Bile?,"What's your withdrawal or kick like? Seems to be a cske walk for me after the day 3 or 4. Back pains, rls, fatigue, weakness, etc etc. But lately I tend to just stay in bed. But I have been relapsing at like day 2-3 and when I go to cop I puke up bile like a cups worth. Why? Only when I am going to pick up. Is it dehydration? Is it from staying in bed too long. Is it just part of wd sickness. ? Trying to figure out why this is happening or if it happens to anyone else. ",1510724687.0
