958z1b,https://www.reddit.com/r/opiates/comments/958z1b/hydromorphone_iv_dose_equivalent_to_insufflated/,0,https://redd.it/958z1b,amnesicaqueous,Hydromorphone IV dose equivalent to insufflated Oxycodone 80mg,"I've tried Googling it but to no avail. How much IV Dilaudid will it take for me to feel the same as insufflating 80mg of Oxy? I'm getting 18 4mg tablets this Wednesday and I hear the rush is insane when injected so I'm going to try it out. I've injected Oxy and Tramadol as well as Heroin before, so I'm not necessarily new to the needle but I usually don't like to use IV administration.",1533620720.0
958y2a,https://www.reddit.com/r/opiates/comments/958y2a/are_small_veins_bad_to_shoot_in/,2,https://redd.it/958y2a,hollywoodisdead,Are small veins bad to shoot in?,"Hi, I’m a new IV user and wondering if you should try hitting bigger veins instead of the easy to find small ones. Also, what’s the best way to find good veins to shoot in?",1533620430.0
958vvx,https://i.redd.it/d4fxc5khxle11.jpg,1,https://redd.it/958vvx,RoxyPoppin,"Long time no post!! A lil blue, green, and pink action!!",,1533619785.0
958u9k,https://www.reddit.com/r/opiates/comments/958u9k/why_couldnt_you_just_tell_me/,2,https://redd.it/958u9k,Tonysox12,Why couldn't you just tell me??,"To whom it may concern. At first I was actually pretty pissed that you would take the pics I posted here in this community, where a lot of us just come to pass time and talk amongst ourselves without being judged, and forward them via Twitter to my girlfriend and Daughter..You definitely have some ball's!!.and at this point I could care less..Guess you had to do what you felt you had to do..but why?..I knew right away from my girlfriend,  and from the way it sounds , you knew that would be the case..You know a lot about me don't you?
My personal affairs,  my family,  so on..I do wish my girlfriend wasn't so rude to you tho,  that might have made things worse,  lol..who knows?.But if what you say is true, I'm confused..I should know ""Your brother,""..and according to you, I spend thousands of dollars on drugs and he is getting his as a direct result of me, that's not possible..the drugs iv gotten ""recently""are far from anything of that nature , these are people in the inner city, and there not your tone, if ya get my drift..and there's only one person I can think you may be, if your in Oregon I know..And I'll tell you this sista, your brother has WAY more problems then me..One is right under your nose..and if that's not you, listen up..if you want help for your brother,  he needs to seek it, you running around throwing others under the bus sure in fuck isnt going to do it..It will actually push him further away, trust me..Why not tell me?.Why not tell me what's happening with him?.You think I wouldn't care?..You seem to know a lot about me, if you do, you know that's not me..So I have to wonder your true intentions?.are they what you say?
Or do you have some sort of other agenda?.well..I hope you decide to be real and contact me, maybe I can actually help..and I promise,  I'd never lie to you when it comes to this fucked up disease of addiction, yea, I know that sounds very untrue coming from an addict,  but I'm not as far gone as you think, I still have morals and dignity,  and I'd NEVER turn someone on to this shit that hasn't already done so..period..I've been on both sides, soberity and active addiction, and I've seen more then you know, so..the choices are yours,  maybe we'll meet. Until then,  good luck with your Brother,  I mean that..",1533619317.0
958t9z,https://i.redd.it/1qdta0u7vle11.jpg,2,https://redd.it/958t9z,Unknowntoruser0,Oxycodone K57 20mg My Favorite! 🤤🤤,,1533619030.0
958nwe,https://www.reddit.com/r/opiates/comments/958nwe/how_is_the_heroin_high/,6,https://redd.it/958nwe,Unknowntoruser0,How is the Heroin High?,So I was wanting to ask you guys how is Heroin and how does the high make you feel that goes for when you first tried it and when you continued using did it still feel the same? Also what way do you take Heroin and is it better then any Opiate? Just want your guys opinions about it.... ,1533617571.0
958hoz,https://www.reddit.com/r/opiates/comments/958hoz/boxy_birdies_shitpost/,3,https://redd.it/958hoz,IRCM,Boxy birdies shitpost,"Any one have goofy names for their DOC? Me and a buddy call ours thangs, jawns, boxys/birties.",1533615939.0
958fo4,https://i.redd.it/nn3fwmaukle11.jpg,6,https://redd.it/958fo4,blackTaks,"First Post, 2nd try. Messed up okn my location but best west coast black tar I've found, my dboy always on point. Anybody else prefer powder over a ball of tar? Newbie figured I'd fit in with the nod family what's up y'all?",,1533615554.0
958cw9,https://i.redd.it/0f92z11uile11.jpg,10,https://redd.it/958cw9,invinciblecb41,Got these little shits to help me get over a 2 week .5/G day bth habit..,,1533614859.0
958bf0,https://www.reddit.com/r/opiates/comments/958bf0/k_and_small_dose_of_oxy_and_benzos/,3,https://redd.it/958bf0,jlogic420,K and small dose of oxy and benzos,I have an 80mg oxy tolly did 3 Perc 7.5s bc that's all I could. And 5mg Valium with 1mg xan. Headed to getike half a g of ketamine. Will I be fine trying it tonight I probably won't khole. ,1533614490.0
958bb9,https://www.reddit.com/r/opiates/comments/958bb9/have_my_first_opportunity/,9,https://redd.it/958bb9,memothecat,Have my first opportunity...,"Picked up some pills and my dude gave me a bag of his H, with a small line left in it. I don’t have any tolerance what should I do 
",1533614469.0
958azq,https://www.reddit.com/r/opiates/comments/958azq/withdrawal/,19,https://redd.it/958azq,JustASmackaholic,Withdrawal?,"Heroin addict. Been clean for quite awhile. Also been on Vivitrol while clean. Started shooting again on day 28 of vivitrol. Been 4 days, stopping today. Should I expect any truly severe PHYSICAL withdrawal after 4 days of use? I understand psychologically it'll be a little rough with cravings and what not. Just looking for what I should expect in the physical realm if much at all. (I'm very aware of what withdrawal is like, I've just never used for such a short time and stopped so looking for experiences). THANK YOU :)

EDIT: having been on Vivitrol for awhile I've been using from day 28 since my last shot through day 32, so 5 days actually. However I've felt next to nothing for the 5 days, meaning most of my receptors are still blocked with more than lingering amounts of Vivitrol apparently. Not sure if that would play a role in the physical dependency or not because withdrawal occurs as the remaining opiates in your body are leaving the receptors so it sounds like that might factor in.",1533614389.0
958aur,https://i.redd.it/lg2mker8hle11.jpg,1,https://redd.it/958aur,lostsouloutwest,"Hospital, 2mg dilaudid q2 hrs 6mg morphine q4hrs the craziest ride I’ve ever been on while admitted.",,1533614349.0
9588hf,https://www.reddit.com/r/opiates/comments/9588hf/temazepam_vs_hydrocodone/,5,https://redd.it/9588hf,SIKIC__,Temazepam vs Hydrocodone,I am hoping to find people on this sub who have experience with both drugs. Which one has better physical euphoria? ,1533613718.0
95853v,https://www.reddit.com/r/opiates/comments/95853v/most_memorable_dealer_stories/,11,https://redd.it/95853v,dekagramm,Most Memorable Dealer Stories?,"Would love to hear some stories on you're most memorable dealer could be cause he was super stupid, shady, super smart and professional just a funny character overall whatever. Just the dealer that you remember the most and stood out as being different.",1533612832.0
9584p4,https://www.reddit.com/r/opiates/comments/9584p4/finally_going_to_bupe/,2,https://redd.it/9584p4,caco2521,Finally going to bupe,"hey guys, how are u? I was going from psychiatrist from psychiatrist trying a bupe prescription, I passed in 5 psychis.

Today I went to a neurologist, talked with him, and for the first time he doesnt judge me, and he knew a lot bout opiates. I told of my huge habit 500mg/day of morphine IV, told that I wanted a bupe/methadone taper, and finally got it.

But I got a few questions, he didnt know about precipitated wds, for example. He prescribed my a 20mg patch, without naloxone, just bupe (transdermal system, only avaiable here, we dont have in pills form). The patch is supposed to least a week, with peak in 3 days. 

His plan is to taper me on bupe, then put me on fentanyl patches (we have fentanyl transdermal patches) that patch should least 3 days, and then methadone, and then off, I didnt understand that, it should be from methadone to bupe, right? and the fentanyl too wtf

I took 80mg today of methadone (where I get my morph, when the pharm doesnt have morph, I buy dones), and tomorrow I will pick up my morphine (already paid before that), so I dont gonna go to bupe before I end this 60 pills of 30mg morph. 

I was thinking in staying in morph for 7 days, got methadone off my system, and then wait 24h after my last morphine dose. I think its gonna be a little smoother, can someone give me an advice? 

Thanks",1533612729.0
957xlt,https://i.redd.it/qrgn9o1n7le11.jpg,22,https://redd.it/957xlt,DazeakaEzad,Funny,,1533611091.0
957vio,https://www.reddit.com/r/opiates/comments/957vio/homeless_clean_needle_exchange_help/,1,https://redd.it/957vio,Slagworks,Homeless clean needle exchange help,"Hi,
I am trying to provide a homelessness outreach for my local area and could use some advice. I want to offer clean needles and rig stuff as well as food and assistance. Anyone who is already doing this please let me know how to go about doing this and any lessons learned. Thank you.",1533610591.0
957tlr,https://i.redd.it/feshc07p4le11.jpg,4,https://redd.it/957tlr,awer0515,Todays pickup 🙏,,1533610106.0
957r8o,https://www.reddit.com/r/opiates/comments/957r8o/im_an_alcoholic_whats_it_like_to_take_pain_pills/,5,https://redd.it/957r8o,mitchyy,"I'm an alcoholic, what's it like to take pain pills and what's the daily hustle for you guys?","Not that I ever EVER want to go down that path. I have never in my life touched an opiate, however I struggle with the nectar. The doctors tried to give me pain medication for all sorts of situations and I told them no thank you, ibuprofen works just fine. 

So is it like being wrapped in the world's warmest and most comfortable blanket with a bear skin fur lining? 

I'm a functional alcoholic who holds a 50 hour a week job and no one suspects a single thing about my lifestyle, how does that work for you guys considering I know there's nod's and this and that associated with opiate use, fill me in. Thanks",1533609542.0
957q2b,https://i.redd.it/sap4k4ym1le11.jpg,2,https://redd.it/957q2b,friendforyou83,"These are the Sterifilt filters I ordered. Has anyone used these? I'm going to order 0.22 micron filters instead, just worried the wheel filter will soak up the most of the drug even with prior saturation, what do you guys think?",,1533609256.0
957o4h,https://www.reddit.com/r/opiates/comments/957o4h/a_rant/,17,https://redd.it/957o4h,c3r3al_kill3r_,A rant...,"Of course our dude isn't answering. He occasionally drinks, then won't answer, because he a) is to drunk to drive or b) is sobering up, but to tired to go anywhere. FML I have to work tomorrow......",1533608791.0
957nvi,https://www.reddit.com/r/opiates/comments/957nvi/a_love_story/,2,https://redd.it/957nvi,yabadabadobadthingz,A Love Story,"I saw him today, in the city. He looked different as he had in the past. We made contact and the way those eyes penetrated my soul, it made my heart skipped a beat, which made it beat faster. My forehead heated up, remembering the passion flowing through me, while flirting with him. 
I remembered the hold he had on me, the one where I would run away screaming, only to come back when I thought I couldn’t live without him. 
I decided to walk up to my old lover to see if he recognized how far I have gotten, without him in my life.
I remembered why I loved him so much, while he touched my lips and was so gentle. I felt my face blush, yet didn’t want him to stop. My breath drew quickly, from his touch. 
So many thoughts running through my head as he kissed me, so passionately. I immediately wondered if I could go all the way and not get sucked in, as I did before. I wondered if I could let go, once the passion turned toxic. I thought of the previous time, the hurt and pain it caused. Getting over it I thought I was going to die, to wake up and feel like I haven’t sleep, eyes constantly tearing up, thoughts of suicide and a depressive state occupied my head for months. I grappled with what to do, as I slipped back into familiar territory. I knew I would allow that lust to come back into my life again ...
And again ...
I kiss back, praying inside and telling myself I can handle it this time. It was more of an attempt of convincing myself that I would not let the love overpower me once again. Yet I fell, I allowed myself to fall in love/lust once again. 

When will I abandon this love I have?  I can drop a destructive boyfriend in a minute but this destructive love I can’t let go of. 

",1533608725.0
957n9w,https://i.imgur.com/cJmUHzB.jpg,7,https://redd.it/957n9w,ThatYoungBro,Happy af because of these beauties. 💊,,1533608582.0
957jqm,https://www.reddit.com/r/opiates/comments/957jqm/anahydrous_morphine_solubility/,2,https://redd.it/957jqm,Izers437,Anahydrous morphine solubility,"Im looking to extract the morphine from a cough syrup I have and not ingest all the  other crap, It says it has this and I cant find anything online, is this a specific kind of morphine salt? And is it water soluble?",1533607739.0
957iba,https://www.reddit.com/r/opiates/comments/957iba/people_who_judge/,15,https://redd.it/957iba,MetroMaker,People Who Judge,"How do you feel about people who judge us? People who don't know the pain of sexual abuse by your boy scout leader or emotional and  physical abuse from you father?  People that don't understand that we just want the pain to stop, if only for a little while. 

I caught myself judging when reading r/sex. A woman was excited about her upcoming party with nine men and her husband watching and acting like the trip-sitter.  I don't know anything about her. I don't know what she's been through.  I had no right to judge her. If this party releases her from pain, then who am I to judge? ",1533607415.0
957h0w,https://www.reddit.com/r/opiates/comments/957h0w/i_am_on_3_12_perk_10s_and_2_dilly_4mgs/,7,https://redd.it/957h0w,OG-Instinct,I am on 3 1/2 perk 10’s and 2 dilly 4mg’s...,and a brother feels amazing watching this show on Netflix called the sinner. Literally only 8 episodes I been stuck here watching it since episode 1. I’m on episode 6 now 😂 one perk 10 left. Might just rail(snort) it lol what y’all doing my NEW FAVORITE people? ,1533607121.0
957a72,https://www.reddit.com/r/opiates/comments/957a72/been_awhile/,3,https://redd.it/957a72,Jobincatnesss,Been awhile,"I'm curious on whats a good dose of hydrocodone for a pretty decent high, not my first time, just been about a year. ",1533605535.0
9578k1,https://www.reddit.com/r/opiates/comments/9578k1/lsd_and_dope/,3,https://redd.it/9578k1,Gudfeels31,LSD and Dope,What a marvelous combo. Comfortably numb on the Ps4. Find me on there @Rajatharasta . I haven't been on Reddit in months. I'm too high to read any posts. Good bye,1533605166.0
95783b,https://www.reddit.com/r/opiates/comments/95783b/help_advice/,5,https://redd.it/95783b,boardguy30,Help Advice,"So I’ve been in a bad opiate habit the past few years (mainly oxycodone and hydrocodone) and when I couldn’t get any of those I would do Kratom and that helped a lot (sometimes better feeling than oxy or hydro)...trying to get clean from opiates so I was wondering if weed would help or make withdrawls worst (speedy heart,etc.)? I’ve been a weed smoker for my whole life I just got into a bad opiate habit a few years. I got a bottle of 175mg cbd to help also? Much insight appreciated",1533605067.0
95760q,https://i.redd.it/0zly30q7oke11.jpg,1,https://redd.it/95760q,PM_ME_PCP,It be like that sometimes 🤔,,1533604579.0
956zo3,https://www.reddit.com/r/opiates/comments/956zo3/so_i_did_something_shitty_and_dont_know_how_to/,17,https://redd.it/956zo3,evolutionarycum,So I did something shitty and don’t know how to fix it,"I stole some percs from my MIL, who I live with. It’s been a week and she hasn’t confronted me about it yet but I wrote her a cute little card with little pills with wings that says “I’m sorry that I stole your drugs “ and I wanna explain my actions inside the card - how I was honestly just snooping around and I found them and couldn’t help myself and I know it was wrong and if she can please hide things like that besides her obvious medicine box to help me in my recovery - but all I can think is a couple years ago before my addiction when she was talking about how addiction is a choice and all that bull shit yada yada. I really want to confront her before she notices the missing pills but I just don’t know how to do that effectively ",1533603096.0
956v18,https://www.reddit.com/r/opiates/comments/956v18/bth_question/,9,https://redd.it/956v18,saxgod420,Bth question,Sorry if this is a dumb question but I legitimately don’t know if it works or not. Can bth be smoked in a blunt? Or do they not burn at the same temp?,1533602015.0
956rui,https://i.redd.it/bvn0j09leke11.jpg,6,https://redd.it/956rui,RoxysNotDope,M Boxes,,1533601322.0
956ogf,https://www.reddit.com/r/opiates/comments/956ogf/whats_crazier_my_mom_hiding_her_pills_in_my/,16,https://redd.it/956ogf,Chan70,"What’s crazier my mom hiding her pills in my brothers ashes or me finding them ,FML",,1533600572.0
956mlu,https://www.reddit.com/r/opiates/comments/956mlu/they_say_you_die_twice/,36,https://redd.it/956mlu,fentanylinthefamily,They say you die twice,".. Once when you actually die. And then again the last time your name is spoken. 

This year has been especially tragic with the amount of overdoses. Many wonderful people have succumbed to addiction. I would like to invite you to please share their names on this post so we can all pay our respects and allow their names to be known. 

For myself, rest in eternal peace to Ken, Matty, Lou, Ryan, Kevin, and Nicole. 
",1533600141.0
956mg4,https://www.reddit.com/r/opiates/comments/956mg4/can_a_girl_yell_at_you_before_you_are_intimate/,32,https://redd.it/956mg4,MetroMaker,Can a Girl Yell at You Before You are Intimate?,"I know that this is not about opiates, but I thought it might be fun.

Q: Can a girl yell at you BEFORE you have been intimate? I say NO. Any other opinions? ",1533600102.0
956lel,https://www.reddit.com/r/opiates/comments/956lel/getting_rid_of_the_opiate_headache/,3,https://redd.it/956lel,BLUE-THIRTIES,Getting rid of the opiate headache......,"Does anyone else take a benzo of any sort to get rid of the opiate overload headache??? I can’t be the only one who gets a bangin headache after dragon chasing for hours upon hours upon hours!! Let me know guys ! And of course, be safe out there!!!!",1533599872.0
956kgy,https://www.reddit.com/r/opiates/comments/956kgy/one_off_heroin_dose/,4,https://redd.it/956kgy,Specifiedsurround,One off heroin dose?,"Is it possible to take heroin as a one off, and how much should be taken? Any tips?",1533599666.0
956hvo,https://www.reddit.com/r/opiates/comments/956hvo/adderall_and_hydrocodone/,11,https://redd.it/956hvo,tyawesomejohnson,Adderall and Hydrocodone?,"So I have a massive hydro and oxy script and I also have a script for adderall. 
I’ve never mixed the two but I’m curious about how well they would go together. 
My standard dose of hydrocodone is about 20 mg to get me to where I want to be and the same goes for adderall.

Anyone here have experience combining the two and could give me an idea about what it’s like? Is it a good combo and if so how much of each should I take together? 
Are there any interactions I need to be concerned about? ",1533599094.0
956emw,https://www.reddit.com/r/opiates/comments/956emw/has_anyone_ever_seen_these_tiny_ox_15s/,26,https://redd.it/956emw,Moneywalks13,"Has anyone ever seen these, tiny Ox 15s?","I've been getting these Yellow 189s with a score in the middle, I mean really tiny like half the size of a blue. Obviously no APAP, they're definitely legit, straight out the script bottle. Crush perfect no binders or crush proof or anything, I got them from 2 different people with 2 different legit scripts. Taste good a little different than blues but a familiar taste no the less. I can get a pic if needed. I just can't get over how small they are!",1533598353.0
9567y1,https://www.reddit.com/r/opiates/comments/9567y1/dry_as_hell_should_i_cop_some_k/,24,https://redd.it/9567y1,jlogic420,Dry as hell. Should I cop some K?,My dude apparently can get some kitty.(ketamine). Wanted to try for a long while now go for it? ,1533596945.0
95645x,https://www.reddit.com/r/opiates/comments/95645x/bth_gets_gooey/,6,https://redd.it/95645x,excelsior37773,Bth gets gooey?,"When I get it its all taped up and super airtight and a solid dense chunk of tar.  You can crush it into nearly a powder.  However, within a couple days of getting it, it will turn into a sloppy gooey substance.  I know its just extra moisture from the humidity but it makes it harder to handle and to smoke.  What do you guys do to keep it in that dense brittle form?",1533596152.0
9561be,https://i.imgur.com/yt5ZP87.jpg,4,https://redd.it/9561be,Oxiconone,Should do me for tonight. ONR's + Breaking Bad season 1 (5th viewing). Makes for a very relaxing few hours 😊❤️🇬🇧,,1533595557.0
955zn6,https://www.reddit.com/r/opiates/comments/955zn6/safe_detox/,8,https://redd.it/955zn6,tinklepot78,Safe detox?,"Hey guys, i need some advice on detox..
.. Im currently taking 3 to 4 Percocet 10s a day.. 150 lbs, 27 yr old female, been using the tabs/percs for 3 years-ish daily and 2 years before i got back on the tabs/percs, i kicked my 1.5 year opana addiction on my own, only to end up working opiates back into my life slowly but surley a couple years later. So you can say on and off for 7 or 8 years.. 

 For a year I have been doing weekly mental health therapy sessions to help with my c-ptsd, anxiety, depression and panic attacks- basically trying to treat my mental health issues and develop new coping mechanisms to make my risk of relapse lower.. I feel like i finally have faith in myself in getting sober and i feel like i am in a much better place mentally than i have ever been. Also have been doing physical therapy to help with my pain so i dont have as big of an excuse to reach for pain pills/to rationalize my usage. 

Now, i have been weening down to only 5mg at a time some times and trying to stretch my dose out to every 5 or 6 hours instead of taking 10mg every 4 hours. Its kind of torture as im very moody and that weird tingle feeling of my bones jumping out of my skin is the worst.. But none the less im trying to make it easier for when my quit day comes.. Which im hoping will be in 2 weeks.

Here is my actual question:
I know you likely arent doctors but in your experience and opinion, is detoxing alone safe for someone of my dosage? Im kind of wanting to rent a cheap cabin in the woods for 5 or 6 days and just bite the bullet- away from my bf who i dont want to lash out at due to my pain and anger and anxiety that rushes to the surface, away from everyone and everything that could be a trigger. I have valium to use to ease the withdrawl and im not wanting to use suboxone. I am not the kind of addict that goes balls to the walls with any old substance- i dont like anxiety meds enough for the valium to be a problem and will take them safely- opaites is my weakness, not anxiety meds and i know how to ration and control myself with those valiums so i dont think that part will be an issue. 

Have any of you detoxed off this amount? Did you do it alone? What do you think about this plan? I Just want to make sure im not going to have some physical reaction that could cause me to die or something.. I have heard opaite withdrawal cannot kill you unlike alcohol withdrawal. Any insight would be appreciated.

Thanks for reading. ",1533595221.0
955wwg,https://www.reddit.com/r/opiates/comments/955wwg/methadone_help/,6,https://redd.it/955wwg,alamomattie,Methadone help?,Long story short my buddy gave me a capful of methadone. It's the cap from a methadone dose bottle. This guy is pretty goofy at best most of the time and I just wanted to make sure I'm not gonna OD. My usual oxy dose is approx 50mg to 70 mg a day.  ,1533594635.0
955w42,https://www.reddit.com/r/opiates/comments/955w42/i_messed_up_with_church_girl/,44,https://redd.it/955w42,MetroMaker,I Messed Up With Church Girl,"So church girl picks me up for church and she starts yelling at me as soon as I get in her car because she was waiting five minutes for me. She said ""if you make me late, then I will not pick you up! blah blah blah"" I thought you had to at least get to third base before a girl could yell at you. But that's not the bad part.

After church, she is dropping me off and she asks me to go to her neighborhood pool with her. Now I was worried about missing dBoy and having to call in sick on Monday, which is never good. So I tell her no. She says ""what else are you going to do? Sit in your room and Netflix?"" I tell her maybe later (after I get well). She skakes her head like ""what's wrong with this boy? Do I have to put the puss right in his face?""  Worse dBoy didn't come until 7:00 pm, so I could've gone to her pool. I'm really messing up guys. Say a prayer to the Saint of stupid guys. ",1533594474.0
955uq4,https://i.redd.it/a7p77jhetje11.jpg,23,https://redd.it/955uq4,DillyMonDaze,Today’s scoopage: 45 - 8mg Dilaudid and 1 gram of 100% Peruvian Cocaine 🔥🔥,,1533594196.0
