7wrqbi,https://www.reddit.com/r/opiates/comments/7wrqbi/permanent_slurredslow_speech_from_opioid_abuse/,33,https://redd.it/7wrqbi,imahugefaggot69,Permanent slurred/slow speech from opioid abuse,I've noticed that some addicts still have slurred/slow speech after years of sobriety. Is this just a coincidence? ,1518337760.0
7wrpj5,http://www.nj.com/news/index.ssf/2018/02/another_lethal_batch_of_heroin_circulating_cops_wa.html,2,https://redd.it/7wrpj5,mockassin,"'Lethal' batch of heroin circulating in South Jersey, cops warn",,1518337351.0
7wrp3h,https://www.reddit.com/r/opiates/comments/7wrp3h/tylenol_3/,3,https://redd.it/7wrp3h,Itsmagiik,Tylenol 3,I'm kinda new to this but does anyone else get a very delayed high from these? I take only 90mg of codeine worth and get a slight buzz and than an hour or two later it hits and I'm wrecked.,1518337117.0
7wrl83,https://www.reddit.com/r/opiates/comments/7wrl83/god_bless_seeing_your_blood_flood_the_rig_is_such/,13,https://redd.it/7wrl83,AwwmanitsRalph,"God bless, seeing your blood flood the rig is such an amazing feeling.",Such a great feeling seeing the blood flood the rig. Absolutely love it. Then slamming away.,1518335344.0
7wrkj2,https://www.reddit.com/r/opiates/comments/7wrkj2/i_miss_this_time_in_my_life_shitpost/,2,https://redd.it/7wrkj2,Fabio_McGee,I miss this time in my life (shitpost),"Back in sophomore year of highschool i rarely went to classes and had a pretty decent oxy habit...i would roam my schools hallways immensely fucked up but nobody suspected me because i just looked like a babyfaced nerd. I would just listen to music and talk with friends if they were with me. Even though it was really counter productive and kind of stupid to be that high at school, it was still some of the best memories and the time in my life i can always think back on and smile. 

Anyways hope everyone is enjoying their weekend how they want to. I know i am, stay safe everybody, happy nods.",1518335037.0
7wrhvh,https://www.reddit.com/r/opiates/comments/7wrhvh/anyone_else_extensively_track_their_usage/,9,https://redd.it/7wrhvh,Exa8yte,Anyone else extensively track their usage?,"I've been keeping track of my heroin usage since nearly day one. Every single dose throughout the day along with the total at the end in MG. Every single day. I keep it in my notes on my phone. Pic down below but I reached the max scrolling screenshot size so it's missing about a third of the log. I've been using for a year+ now but have managed to keep my daily usage pretty much the same. About 200mg per day. All insuffulated. It's the most under control I could imagine heroin addiction being. But it's still a bit fucked to look at.. 

[Daily Dosage Log](https://i.imgur.com/SMSvI1z.jpg)",1518333816.0
7wrg2m,https://www.reddit.com/r/opiates/comments/7wrg2m/found_a_whole_bottle_of_oxycodone_5mg_oral/,21,https://redd.it/7wrg2m,dope4life1980,Found a whole bottle of oxycodone 5mg oral solution,What's the difference to the pills?  I have a pretty high tolerance how my ml is a good start to feel good?  Not a noob by all means just never had the liquid. ,1518333023.0
7wrck0,https://v.redd.it/rvv2celr4jf01,9,https://redd.it/7wrck0,JonnyAppleseedz,"After lots of talking about how it works, I decided to show the video itself, as some were curious / skeptical about it. This is the “fizzing” that occurs with real M brand oxys when you put them in a carbonated drink ( this is blackberry ginger ale). It works with the 5,15,30mg M brand.",,1518331563.0
7wr8p6,https://www.reddit.com/r/opiates/comments/7wr8p6/heroin_overdosage/,15,https://redd.it/7wr8p6,Alchemysttry,"Heroin ""Overdosage"" ?","Hello,
this story has just arrived. My friend took a shot of very good heroin, he was already stone and did not have a great tolerance, but he made a shot like me (I have 10 years of dependence behind me) luckily I had made a little one I think he wanted to do like me. It's been a week since I told him to take less but he does not listen to me
The material is much better than what he usually took, I warned him several times but he does not really understand.
So he took two shots at maybe 30 min interval (maximum), the first was ok for his tolerance, but the second was too big, I think.
I see him immediately nodding with the syringe in his hand (removed from the arm) so I took it and put it in a trash and I realized that it was too much for him (before that I had not seen how much he put in his shot he told me later). 1-2 min later, he goes to my couch, goes to bed, I watch him and suddenly he makes a strange noise as if he wants to inspire but can not then I shook him and slapped him, at first, he does not react eventually he woke up relatively quickly 15-30sec I think maybe more difficult to say in this condition. After that, he kept nodding and I looked at him insistently, asking him to breathe deeply and to occupy him to prevent him from nodding again. After taking a small line of coke (on my advice) to wake him up. But he was still stone,
T + 1h30 He wants to go home, I have withheld 1 hour but finally he goes away. In my opinion it's ok but I'm still worried, so I told him to put his phone on the max volume and I told him I'll call you in 15-30-60min and if he does not answer I'll come with naloxone.
Do you think there is still a risk for him to stop breathing? I think it was just the peak of the shot that suddenly stops his breath but after 2 hours I think it's ok ..
if you have constructive advice and opinions, ",1518329914.0
7wr7wp,https://www.reddit.com/r/opiates/comments/7wr7wp/fent_warning_buffalo_nyniagara_falls_nygreater/,0,https://redd.it/7wr7wp,OpiatesNoderator,FENT WARNING - Buffalo NY/Niagara Falls NY/greater Buffalo area,> I don't want to post a fent warning under my user ID due to not wanting to be doxx'd but my friend just got out of detox at the county hospital in buffalo ny and they drug tested him he had zero heroin in him (he went in for heroin detox) and they said he tested positive for pure fent and that's all. He's from buffalo but purchased his shit in the buffalo ny Niagara falls NY areas (they are about 30 minutes away from one another) ,1518329616.0
7wr7bo,https://www.reddit.com/r/opiates/comments/7wr7bo/lenient_states/,11,https://redd.it/7wr7bo,pillsonpillsonpills,Lenient states,So back in the day it was Florida that prescribed I think 80% of the pain killers prescribed to America bc of the Florida pain clinics that were very easy to get a script. Are any of your states considered lenient with opiate scripts?  ,1518329407.0
7wr2vu,https://i.redd.it/oe4mdc48uif01.jpg,15,https://redd.it/7wr2vu,PurpleStrap0n,Hope everyone is enjoying their weekend.,,1518327689.0
7wr19h,https://i.redd.it/kotznyogsif01.jpg,30,https://redd.it/7wr19h,dyingsober,"I had lost this pouch with ~20 bags in it in a store somewhere. Called everywhere. Never found it. Unable to cope with change I searched the internet for the same exact pouch, which was harder than it seems. Anyone remember my OG username? lol",,1518327092.0
7wr110,https://www.reddit.com/r/opiates/comments/7wr110/clean/,4,https://redd.it/7wr110,Creepybeats,Clean,Been clean for 3 months anybody else over the cycle? ,1518327011.0
7wr0wq,https://imgur.com/gallery/sFmDi,7,https://redd.it/7wr0wq,Keke8866,First score from a new plug,,1518326967.0
7wqunw,https://www.reddit.com/r/opiates/comments/7wqunw/the_struggle/,2,https://redd.it/7wqunw,BraveHash,The struggle,"So like i had posted before about getting super hungry after doing a blue, i live in a small town and hardly have any places that stay open all night to get food. The wife kept bringing up all the places we could go eat in towns surrounding us, which is about a 30 min drive either way, and i am tempted to just make the drive so i can stuff my face and enjoy some food lol",1518324788.0
7wqulp,https://i.redd.it/t6ugs2wjlif01.jpg,7,https://redd.it/7wqulp,wereallblackfriends,Today was a good day. Panda 🐼/ Xanny 💊🎉,,1518324770.0
7wqts0,https://i.redd.it/rxhodddnkif01.jpg,53,https://redd.it/7wqts0,zerebest,"Saw this and was immediately skeptical, what does everyone think. Not opiate related but I don’t fuck with r/stims",,1518324464.0
7wqske,https://www.reddit.com/r/opiates/comments/7wqske/abscess_question/,6,https://redd.it/7wqske,TrappeddownSouth,Abscess Question,"I have, unfortunately, had my fair share of abscesses during my using career. What I always wonder is what makes them hurt so incredibly bad. I have literally had abscesses on my legs that have prevented me from walking. Yet the second they open up, the pain is completely gone. So is it just the pressure that builds up that causes the pain? Or is there something else to it as well?",1518324021.0
7wqs6n,https://www.reddit.com/r/opiates/comments/7wqs6n/terrible_headaches_from_your_normal_dose_of/,10,https://redd.it/7wqs6n,trynakick,Terrible headaches from your normal dose of opiates,"Here is the story. I'm on a LONG sub taper. At this point 1/2 milligram every morning when I wake up between 7 and 9. Most of the time, I'm fine. But once or twice a month, I get a vicious headache. This used to happen when I was using other opiates too. With heroin I just assumed it was a cut or I took too much, and with pills I assumed it was dosage related, but with the subs, I cut my strips into 16 equal pieces with an exacto, so it shouldn't be happening. I've thought of everything, what and when I eat, cigarette and coffee consumption before during and after dosing. Nothing seems to clearly be the problem.






I've heard that the bupe could be unevenly laid across the strips, so if I had access to 2mg strips maybe that would help, but if they were so uneven as to give me headaches like I've taken too much, it seems like sometimes I'd get them unevenly doses in the opposite direction and they wouldn't totally stave off withdrawal.




Does this happen to anyone else? Any ideas on what causes this?",1518323872.0
7wqqnm,https://i.redd.it/khrzbjo9hif01.jpg,13,https://redd.it/7wqqnm,defZeppelin69,About 1.25g of the strongest stuff I’ve ever had mixed in with some decent stuff I get on the reg. I’m sure there’s fent in there somewhere,,1518323330.0
7wqi1z,https://www.reddit.com/r/opiates/comments/7wqi1z/4_months_since_uoh_no_five_oh_surfaced_hope_hes/,4,https://redd.it/7wqi1z,FizzyJews,4 months since /u/oh_no_five_oh surfaced. Hope he's okay!,,1518320399.0
7wqhzq,https://i.redd.it/tknm15th8if01.jpg,6,https://redd.it/7wqhzq,sugarhillsix,COUPLE OF QUESTIONS FOR MY FELLOW OPIATE IV USERS,,1518320377.0
7wqhqk,https://i.redd.it/5sobz9k48if01.jpg,12,https://redd.it/7wqhqk,clerror,Late night Oxy 15’s. Be safe everyone.,,1518320298.0
7wqhde,https://www.reddit.com/r/opiates/comments/7wqhde/lacking_friends_who_do_opiates_shit_post/,20,https://redd.it/7wqhde,MountainLookouT,Lacking friends who do opiates (shit post),"Probably a good thing cuz i used to do perks with my best friend a few years ago and we reeeally enabled each other in deep. But now, after a two year break I like D and NOONE knows I relapsed. I just miss and wish I had someone to get down with. Because of the stigma none of my other ""hipster"" friends would ever endulge and im not really the typical junkie type. Just venting. Its like a fun secret I have. Anyone else lay low with their usage and dont have anyone else to party with?",1518320171.0
7wqhc6,https://www.reddit.com/r/opiates/comments/7wqhc6/boring_night/,19,https://redd.it/7wqhc6,MissNoddss14,Boring night.,"Just want some drugs, weather is shitty, S/O is asleep. Someone talk to me! ",1518320158.0
7wqe32,https://www.reddit.com/r/opiates/comments/7wqe32/permanent_brain_damage_after_overdose/,18,https://redd.it/7wqe32,myfaceinthesink,Permanent brain damage after overdose,"Hello,

I overdosed on a mixture of furanylfentanyl, alprazolam and heroin last Christmas. I have no idea how I am still alive to be honest, because I used alone and luckily I woke up.

When I woke up, I noticed my fingers and lips were blue. I had puked in my bed, I could barely take two steps because my coordination was extremly bad, my chest hurt very bad, my eyes kept drifting to one side, I heard a beeping in my ears and couldn't concentrate on anything. The severe symptoms lasted a few hours and the other things went away over the course of the week.

However, I still notice that I overdosed one year later. My long- and short-term memory is fucked, I can't concentrate on much, I feel ""stupid"", like I lost some IQ points. Also, I am uncomfortable very often, it is hard to explain. My movement feels a bit ""laggy"", it isn't smooth anymore, I am often short of breath and I have restless legs now.

My question is if anyone here has experienced something similar. I have never talked to a doctor or anyone in real life about this, I am too ashamed. My mum would probably cry so much. She was downstairs when I overdosed, sitting alone next to the Christmas tree, sad that I wasn't coming down, because I would rather nod... I am ashamed of myself, to be honest, but that's not the topic.

Would be nice to hear similar stories. I am honestly just glad I am alive. At the same time I feel like I should have died right there and then, though. I don't know. I feel dead sometimes and it's really weird.

Thanks for reading. <3",1518319118.0
7wqdr5,https://www.reddit.com/r/opiates/comments/7wqdr5/have_you_guys_ever_purposefully_broken_a_bone_or/,7,https://redd.it/7wqdr5,MatiaIdea,Have you guys ever purposefully broken a bone (or anything similar) for a script?,"I've heard of people doing this, but don't know if it's actually true. Maybe a very small percentage. I've never done it. I feel like if someone were to do that, it would seem pretty obvious what they're looking for, but I don't know. Thoughts?",1518319018.0
7wqcfo,https://www.reddit.com/r/opiates/comments/7wqcfo/fent_analog/,6,https://redd.it/7wqcfo,pulsating-onion,Fent analog,"I don't know if this technically belongs here.  I was using bu-f to breakthrough on my methadone treatment. Once that was banned I switch to fu-f, then recently MAF. My question is since MAF was banned what analog is still legal in the United States? I know because of the analogues act none of them are technically legal I'm talkin gray area here folks.",1518318605.0
7wq8ce,https://imgur.com/xAIH08X,14,https://redd.it/7wq8ce,OPyumm,Hmmm.. What to have for dessert?,,1518317341.0
7wq6ln,https://i.redd.it/y1oyq7dtxhf01.jpg,10,https://redd.it/7wq6ln,KickerS12X,"If you're gonna relapse, at least do it right!",,1518316804.0
7wq5hy,https://www.reddit.com/r/opiates/comments/7wq5hy/i_am_a_writer_looking_for_readerssomeone/,3,https://redd.it/7wq5hy,davidisnotreal,I am a writer looking for readers/someone interested in an interview,"This is not my territory; I am aware of this. I've been clean for two years, and I am currently writing a thesis for my Masters in creative writing. 

There are some words I've written/want to write, which I need to be validated through eyes other than my own. Through the eyes of people who know. 

Cousin OD'd in August, followed by a friend, and a couple of others from my town. There are nights my stories become paralyzing to tell, and I need answers to some of my questions, but I just can't bring myself to ask the people I love who are still hurting from loss. 

Anyone out there willing to read/talk? Comment here, or email me @ cjp4430@gmail.com",1518316449.0
7wq41m,https://imgur.com/a/YCBqY,27,https://redd.it/7wq41m,arrowstotheknee,Are these supposed to burn when snorting them? They burned me and now I am afraid they are not real. 30MG roxis Do they look fake?,,1518315998.0
7wq3ki,https://imgur.com/E27uP2p,9,https://redd.it/7wq3ki,PulseR76Multikill,1 Month Soberish,,1518315839.0
7wq240,https://i.redd.it/1kjvzf4othf01.jpg,6,https://redd.it/7wq240,Braddd7315,Anybody seen these new suboxone packs? It's for the 8mg tablets made by actavis.. I've never seen these just thought it was pretty cool,,1518315390.0
7wq1gb,https://i.redd.it/zogqtnh2thf01.jpg,9,https://redd.it/7wq1gb,MOST_mdmAMAZiNG_1,Can u snort these?,,1518315188.0
7wpzee,https://i.redd.it/j9md8cq6rhf01.jpg,2,https://redd.it/7wpzee,Manik209,Small pickup of bth,,1518314556.0
7wpyci,https://www.reddit.com/r/opiates/comments/7wpyci/naive_heroin_questions/,20,https://redd.it/7wpyci,Dicisinya,Naive Heroin Questions,"I never tried heroin. Here my question(s). 
First: instead of snorting, shooting, or smoking, can Heroin be chewed, or eaten, and you'd still get high?
Second: is heroin the same high as an Oxycodone high, or another RX drug. 
Sorry about the stupid? I'm just curious for a reason. ",1518314236.0
7wpwlm,https://i.redd.it/yce2kp2oohf01.jpg,42,https://redd.it/7wpwlm,ThatsJustTheTip_,20mg Oxycodone —- Cancer Helpers,,1518313710.0
7wpvuh,https://www.reddit.com/r/opiates/comments/7wpvuh/anyone_else_always_shoot_up_in_the_bathroom/,10,https://redd.it/7wpvuh,OpiateThrowawayAgain,Anyone else always shoot up in the bathroom?,"I just realized that my practice of always going to the bathroom to shoot up makes very little sense. I mean yeah, when I lived with my mom, obviously it was a smart move, but I'm currently living in a condo with a roommate, and rather than shooting up in my room, I will ALWAYS go into the bathroom when I'm shooting up. I've spent literally entire nights nodding/sleeping on the toilet when I'm going super hard, and it just occurred to me today how much smarter it would be to just do it in bed. 

That said, I'm on the toilet right now. So does anyone else do this? Or have a specific spot that they shoot up that so technically less convenient?",1518313481.0
7wpve9,https://i.redd.it/gu90io9lnhf01.jpg,58,https://redd.it/7wpve9,1UpTahpAhk,Po’ up ni99a!,,1518313346.0
7wps9s,https://i.redd.it/34wlzjtokhf01.jpg,43,https://redd.it/7wps9s,dyingsober,First time I’m feeling guilt and shame over this..,,1518312370.0
7wpr3o,https://www.reddit.com/r/opiates/comments/7wpr3o/opinions_on_redosing_dhc/,5,https://redd.it/7wpr3o,ABrokenBeing,Opinions on re-dosing DHC?,"Took 90mg 3 hours ago and I have a mild itch and warmth, having a wonderful lay in bed listening to the rain on the window slowly sipping on my weed vape.

Worth taking any more or save it?

I do not have much experience redosing with opiates

",1518312000.0
7wpoj7,https://www.reddit.com/r/opiates/comments/7wpoj7/difference_between_coke_and_opiates/,7,https://redd.it/7wpoj7,Heisenbergermen,Difference between coke and opiates,"Hello everyone! I've been lurking on this sub for some time and as someone who regurly uses coke, I'm wondering what's it like to use something like H or Oxy or something like that. Not to be disrespectful, but I'm really curious about the difference.",1518311255.0
7wpj2j,https://www.reddit.com/r/opiates/comments/7wpj2j/pressed_pills/,10,https://redd.it/7wpj2j,Dysphoria_III,Pressed Pills,How common are pill pressed with fent in the south west. I’m just wondering as I haven’t seen any here and I usually just hear about it on the east coast but I’m sure it has to be everywhere right? I’m always worried I won’t be able to tell if the pill is pressed or not.,1518309671.0
7wpehu,https://i.redd.it/jfxejzyy8hf01.jpg,30,https://redd.it/7wpehu,1UpTahpAhk,REAL SCORE KING 👑,,1518308429.0
7wpdvd,https://www.reddit.com/r/opiates/comments/7wpdvd/how_shall_i_split/,6,https://redd.it/7wpdvd,CBR14K,How shall I split?,"Finally came across some good dope(my first), but he didn’t have much. Did a tester and it’s solid. Usually I bang dilly’s but my boy is out so I went searching for dope. On to my question, two “get well” shots or one solid get really high shot? 

Usually I’m all about saving some for tomorrow, but I won’t be getting some more for a while (got money to spare but can’t spend it), so I’m leaning towards one good shot since all I will be doing is prolonging the inevitable if I go for two. That’s a problem for future me. ",1518308248.0
7wpcnh,https://www.reddit.com/r/opiates/comments/7wpcnh/any_experience_with_microdosing_ibogaibogaine/,20,https://redd.it/7wpcnh,lurkndturf,Any experience with microdosing Iboga/Ibogaine?,"Heard it does wonders for withdrawals & overall well-being, read some reports of addicts fully recovering by taking around 10mg of Iboga a day.

For those that don’t know, it’s a root of a psychoactive plant that’s been used for hundreds of years, is used in Mexican recovery centers, and has documented use for helping addicts since the 60’s.

Thoughts & Experiences?",1518307909.0
7wpc1d,https://www.reddit.com/r/opiates/comments/7wpc1d/what_is_the_best_way_to_describe_the_feeling/,23,https://redd.it/7wpc1d,brokenhalfjap,What is the best way to describe the feeling opiates give you to a non user?,"So I’m trying to explain to my boyfriend, who is not an addict not even recreationally, why I love opiates so much. I can’t seem to find the words though. If you guys had to explain it to a non user, what would you say to them? Would you maybe compare it to another feeling? Because tbqh I don’t know any other thing on earth that can give me the feeling that opiates do. Thanks friends!",1518307757.0
7wpaxn,https://www.reddit.com/r/opiates/comments/7wpaxn/quick_question_oxycokesubsxanaxtrees/,2,https://redd.it/7wpaxn,bullshittobinary,Quick question - oxy/coke/subs/xanax/trees,"Been on subs since September 2017, occasional slip up where I rail oxy (even if on subs I just miss the feeling), smoke trees, occasional addy at work or Xanax for sleeping. The Xanax and addy are not even close to daily or weekly, the Xanax mainly for when I fly overseas. Anyways, I recently came across some REALLY good white girl. And by really good, I mean within 2-3 ppl of the brick. I normally don’t partake, but fuck it. I tried. A few rails with some Xanax (orally) and it was amazing. Nothing I wanna do everyday, but not bad. Today I picked up some of the girl for a friend (yes a friend), and my plug tossed me a free oxy 20mg IR. Now, it’s been roughly 24- 30 hours since last 8mg sub dose, that same dose I’ve taken almost every day since late September 2017. I know that 20mg ain’t gonna fuck me up or even get me close to any type of high. Here is my question: Do I need to worry bout dying/anything serious? My heart rate spiked pretty high according to my heart rate tracker (from the yay).Ima avoid my sub dose until Tmrw to avoid any possible PWD’s cause fuck that. I also have Xanax ready for later tonight when the coke high goes away. I do plan on doing 2 more lines tonight since I don’t have to go in for work early tmrw.  Any other comments or info is appreciated! Please don’t assume I’m young and dumb, or just calling me irresponsible/ whatever else. Thanks in advance! 

Edit: 
Update! I’m good. Puked my lunch up but I’m aight. ",1518307431.0
7wp8mn,https://www.reddit.com/r/opiates/comments/7wp8mn/chipping_is_really_digging_instead_of_falling/,4,https://redd.it/7wp8mn,TirelessGuerilla,Chipping is really digging instead of falling,You end up at rock bottom either way. I'm about to relapse Monday. I got my state tax refund. My dumb ass puts it in the atm so I can't access the money until monday. I literally live life in minor withdrawal I use two three days then go 4-7 without then do it again.  I hate myself guys I don't even need it to function but I can't stop digging so I'm always going through withdrawal every week. Eventually shit will hit the fan it's just one bad day away then theirs no jumping off without rehab and the works.,1518306792.0
7wp60l,https://www.reddit.com/r/opiates/comments/7wp60l/whats_been_your_worst_encounter_with_police/,66,https://redd.it/7wp60l,suredudeee,Whats been your worst encounter with police involving drugs?,"Im talking like the times when cops absolutely disrespected you, did some illegal shit, beat you over a dime, etc.

i would say having cops break down my door after i had a seizure because my girl called 911.  they broke it down with guns pointed at me in the middle of the night.  i think it made me seize again.  they ended up finding a bit of wax outside and then got PC to search my house after i denied them permission. 

 i sat with a sergeant for 6 hours while they got a warrant and K9.  all in all i got a possession charge for hash upstairs they found but never admitted it was mine.  ended up dropped after my lawyer ate them alive.

all that shit just because my gf was trying to call 911 to help me after i concussed myself falling from a seizure.  god that shit still pisses me off to this day",1518306059.0
7wp3xt,https://m.imgur.com/44upXjM,21,https://redd.it/7wp3xt,BambiLocs,"Hey junkies of Noddit, I am back, after 0 hours of sleep a six hour work day and another some odd four hours of yard work and still lit AF. Let's talk fenny, cocaine, and alcohol.",,1518305493.0
7wp2lw,https://www.reddit.com/r/opiates/comments/7wp2lw/oxy_dose/,11,https://redd.it/7wp2lw,XansNPsyches,Oxy dose,"O apparently I can get oxy 80s, what is a good dose for someone with no tolerance and is it possiblen to nod first time or wpuld a nod dose make me sick?

Thanks",1518305106.0
