bbqyf3,https://www.reddit.com/r/opiates/comments/bbqyf3/how_long_does_iv_buprenorphine_take_to_kick_in/,28,https://redd.it/bbqyf3,EnduringInsanity,How long does IV buprenorphine take to kick in?,"I usually snort my subs,  but decided to to try iv. I did 9mg (15mg snorted is my usual dose) its been about 20 minutes and im barely feeling anything. I read somewhere even IVed it can take up to an hour to kick in. So did I just fuck up my shot or is it gonna kick in a bit. Ill find out soon.

But my real question is if it does take an hour to kick in why is that, isnt iv supposed kick in within a few seconds for any drug?

Edit  

T+1h: For anyone who wants to know its been an hour and im nodding out, but I got a killer headache.

T+1:30 : Effects have gotten way stronger since the hour mark, I think I've reached the peak or an pretty close. I don't know why it took so long it hits  me faster when I snort it. Maybe there is some truth to the whole naloxone thing? My current theory is the bupe had to wait for all the naloxone to decouple then come in and do its thing? But I still dont believe naloxone could outbind bupe.",1554928204.0
bbqxez,https://www.reddit.com/r/opiates/comments/bbqxez/oxycodone_residue/,10,https://redd.it/bbqxez,outofboof,oxycodone residue??,"i have 40 mg IR oxy

when i crush it up very finely and mix it in syrup i am still left with powder residue sinking to the bottom of the syrup

is the oxycodone in the syrup? is the residue the binders or do i also need the residue to get high?

if i don’t need the residue i can use a filter and clean it out but i’m worried the powder is what gets you high.

the syrup ingredients:
Cherry Syrup™ recommended use with ionic and hydrophilic actives.  Sucrose 82% w/v, purified water, artificial cherry flavors, citric acid, FDC Red #40, sodium benzoate as a preservative, inert ingredients and natural preservatives.",1554928054.0
bbqvyr,https://i.redd.it/duj5zwg9xhr21.jpg,10,https://redd.it/bbqvyr,happycat01,"i need alcohol and weed, then I'll shake this monkey",,1554927837.0
bbqnls,https://i.redd.it/mxspmqy5thr21.jpg,17,https://redd.it/bbqnls,20DoughnutsOnMyDick,"From Afghan to Peru, in every line that I've been through, my heart pumping like fuck",,1554926644.0
bbqn8b,https://www.reddit.com/r/opiates/comments/bbqn8b/tiz/,3,https://redd.it/bbqn8b,bpmom2,Tiz,Anyone use tizanidine? I apologize if it’s not appropriate here because it’s not an opiate but it’s a muscle relaxer. I love it. I can take ½ of one and be so relaxed. A whole one knocks me out cold. And it gives me the best dreams. Very vivid.,1554926597.0
bbqcym,https://i.redd.it/typrc26aphr21.jpg,12,https://redd.it/bbqcym,Slidesy,Sorry if it was posted already but LOL,,1554925150.0
bbo1dp,https://www.reddit.com/r/opiates/comments/bbo1dp/which_is_more_sedating_alcohol_or_opioids/,14,https://redd.it/bbo1dp,UpperRemote,Which is more sedating: alcohol or opioids?,"Any other class of drugs? Benzodiazepines (e.g., clonazepam/Klonopin), nonbenzodiazepines/""Z-drugs"" (e.g., zolpidem/Ambien), antihistamines/anticholinergics (e.g., diphenhydramine/Benadryl), certain antidepressants (e.g., mirtazapine/Rameron), antipsychotics/antidopaminergics, beta blockers, alpha agonists, orexin antagonists, GHB, maybe some special cannabinoids?",1554913667.0
bbq0do,https://youtu.be/XybgDaPFnBc,16,https://redd.it/bbq0do,owwstin,What do you think about Buprenorphine?,,1554923379.0
bbpy9d,https://www.reddit.com/r/opiates/comments/bbpy9d/a_question_for_those_whove_been_there/,26,https://redd.it/bbpy9d,awaywiththrowing,A question for those who’ve been there,"I’m sure this isn’t the best question to be asking nor would knowing the answer probably help in anyway because it’s probably too late anyways, but .....

How long after dosing does an OD take place ? (Snort and IV)

In other words, if someone was to take more than their average dose, how long after taking that does could they be considered “in the clear” or past the point of OD’ing

Thanks y’all",1554923083.0
bbpmgc,https://www.reddit.com/r/opiates/comments/bbpmgc/question_for_anyone_whos_prescribed_oxymorphone/,23,https://redd.it/bbpmgc,throwaway666718,Question for anyone who's prescribed Oxymorphone,"I'm currently on 10/325 Oxycodone twice a day. I wanna get my doctor to give me Oxymorphone instead since its much stronger and better for snorting. 

To those of you who have it prescribed, how did you get your prescription? How long did it take to get it? (did your doctor put you straight on oxymorphone, or did you slowly work up from another drug)

I want to convince her to give me 10mg Oxymorphone twice a day instead. Do you think that's reasonable? Do you guys get it for only once a day?",1554921464.0
bbphf9,https://i.redd.it/j9l59lz9chr21.jpg,6,https://redd.it/bbphf9,Mario724,Love a good variety pack..,,1554920781.0
bbpfc3,https://i.redd.it/efwb1pgebhr21.jpg,39,https://redd.it/bbpfc3,lostvoicescallingout,me when i see some good opium,,1554920489.0
bbpepx,https://i.redd.it/nreftdm3bhr21.jpg,25,https://redd.it/bbpepx,bannedforsayingKYS,can i use this for the citric acid for iv crack,,1554920395.0
bbojov,https://www.reddit.com/r/opiates/comments/bbojov/question/,13,https://redd.it/bbojov,JaxThrax,Question,"I recently moved from the deep South to the West Coast. Not far enough West to where we have In and Out but far enough where Marijuana is absolutely legal. In the south I got #4. Nice soft, fluffy powder. High quality, hit it with cold water and pull up and BAaMZ. Well after about a month in my new spot i find a good plug, but to my dismay everything here is tar. (Getting to my question) The tar is good I like the pins and needles like I'm shooting morphine I get I never got with #4. ;))))
Now the question, why am I puking so much? Is it just BTH period? Never had this issue with my habit before. It's really provoked after I smoke a cigarette or do any labor related movements and I mean grotesque, projectile vomiting. Is there anything I can do??",1554916213.0
bbogxv,https://www.reddit.com/r/opiates/comments/bbogxv/pressed_30s/,24,https://redd.it/bbogxv,Suicide_Christ59,Pressed 30s,"Hey friends, picked up some fent pressed oxy 30s the other day and was wondering the best ROA to use em?

I've been snorting a bit but it can be a bit uncomfortable at times. Would orally be a better option for taking them? 

My plug told me snorting would be the best method and it helps me to gauge my high and make sure I don't overdue it but am looking for your opinion. Thanks!",1554915845.0
bbnwf2,https://i.redd.it/ppqdogh1pgr21.jpg,17,https://redd.it/bbnwf2,ewan128,"Will 300mg get me well, I’ve a large tolerance.",,1554912964.0
bbnf8s,https://i.redd.it/mzjf3zqshgr21.jpg,7,https://redd.it/bbnf8s,DillyMonDaze,Fentanyl at work 🤷‍♂️,,1554910527.0
bbmyh6,https://i.redd.it/37ocz7qeagr21.jpg,24,https://redd.it/bbmyh6,GrilledCheese1010,"A little #4, my last of this batch",,1554908071.0
bbmxvk,https://i.redd.it/4n5m1tc8agr21.jpg,12,https://redd.it/bbmxvk,EskomojoE,The best way for us non shooters to wake up. A1 Peruvian and new TriColor raw both straight off the brick. My JJ bless you all.,,1554907984.0
bbmxpl,https://www.reddit.com/r/opiates/comments/bbmxpl/products_that_may_help_ease_nodding/,20,https://redd.it/bbmxpl,fineapple808,Products that may help ease nodding,I recently started doing h from pills because the money. I love it don’t get me wrong but it’s really hard to work while I am almost nodding. It’s like I have energy but I can’t keep my eyes open. Is there anything I could buy at the store that can help me stay awake while I’m at work? I’m not looking for meth or coke or anything like that just like energy stuff from the store or something or over the counter. Any advice helps thanks,1554907956.0
bbms2t,https://i.redd.it/29dpdjgj7gr21.jpg,5,https://redd.it/bbms2t,GrilledCheese1010,really nice gear to top off a really shitty day.,,1554907114.0
bbmrl9,https://www.reddit.com/r/opiates/comments/bbmrl9/looking_for_new_spots_to_iv/,11,https://redd.it/bbmrl9,Mytzlplk,Looking for new spots to IV,"I use Subutex and occasionally ECP. I have been lucky enough to be able to rely exclusively on my ""old faithfuls"" (the big fat veins dead center in the crook of the elbow) and the adjacent one that runs over the funny bone. However, i am starting to get a fair amount of scar tissue. I feel its time to branch out 


I would say i have very good veins, and fairly good/above average technique (ie stable hands, good angle, etc)


I know a few other users who seem to have good luck with the big veins on top of their wrist, but i find that spot to be a complete no-go, despite having very fat, visibly prominent veins there

Any suggestions from other experienced users are welxome. I would like to stick to my arms for the time being, as my DOC is subutex which is fairly volatile in cases of missed shots",1554907040.0
bbmnfu,https://i.redd.it/nw647vsf5gr21.jpg,20,https://redd.it/bbmnfu,ewan128,What on earth is the large capsule? And does anybody know what haha the blue pill is. It said 30 and had a score line on one side.,,1554906376.0
bbme7h,https://www.reddit.com/r/opiates/comments/bbme7h/reals_or_fakes/,10,https://redd.it/bbme7h,success_1,Reals or Fakes??,"So i just scored some M30 - blue from a new plug. He says it's from my ""mom's script - it's legit."" How do I know that this isn't fent? can someone provide a few pics of reals vs. fakes. I've had the reals and these look legit - but how do we know? any help on this? i have to assume they are fakes. what about consistency? color? easy to break in half? stuff like that...

let me know peeps...i gotta get this right...thx and be safe!",1554905007.0
bbmbpg,https://www.reddit.com/r/opiates/comments/bbmbpg/spots_for_stashingstoring_your_dope/,13,https://redd.it/bbmbpg,AngryChair007,Spots for stashing/storing your dope,Do you guys have any interesting spots that you stash  your dope? Interested in hearing where people keep their shit,1554904625.0
bblu64,https://www.reddit.com/r/opiates/comments/bblu64/quickestbest_way_to_get_oxycodone_out_of_your/,6,https://redd.it/bblu64,DLK1984,Quickest/best way to get oxycodone out of your system,"I know there are other posts out there but I can’t find a straight answer. How long is oxycodone in your system and what’s the best way to flush it out, thanks for the replies.",1554901893.0
bblje0,https://www.reddit.com/r/opiates/comments/bblje0/i_went_to_a_na_meeting_yesterday/,41,https://redd.it/bblje0,sleepynodss,I went to a NA meeting yesterday,"i couldn’t really connect to anyone. everyone was talking about their clean time as i was coming off a high. 

they talked about how there life was so much better and they would of died without getting clean.  
i guess where i miss the connection is i don’t care if i die. 

i know what i’m doing, i’m ruining my life but i don’t care. i plan on killing myself eventually anyway i just wanna see what i can grab out of life before i do it.",1554900043.0
bblc35,https://i.redd.it/yhyeudvrifr21.jpg,19,https://redd.it/bblc35,benzoluverGG249,Hey where’s my Dope!!!,,1554898748.0
bbksfv,https://i.redd.it/n2tcrp6h7fr21.jpg,59,https://redd.it/bbksfv,MorphineMonkey,Just Another 19 Y/O College Kid Shooting Dope In Their Dorm Bathroom :),,1554895031.0
bbjg6t,https://i.redd.it/7ikviri1aer21.jpg,30,https://redd.it/bbjg6t,somethingherion,"Dollar tree gave me my secret stash spot. Who the fuck would ever look inside a fake plant? Also, usually not into benzos that much but these are feeling really good right now in WD.",,1554883707.0
bbj7fo,https://www.reddit.com/r/opiates/comments/bbj7fo/looking_for_a_post/,5,https://redd.it/bbj7fo,chasing-dragons,Looking for a post,I’m looking for a post where the person posted a photo and a video of a smoking device they made. It was like a glass stem with a little spoon shape at the bottom which they torched and then dropped the dope onto it. Does anybody know what I’m talking about or the user that posted it? I’ve typed whatever I could think of into the search bar but can’t seem to find it. It wasn’t very long ago.,1554881470.0
bbj602,https://www.reddit.com/r/opiates/comments/bbj602/advice_for_progress/,3,https://redd.it/bbj602,jakers360,Advice for progress,"I recently had an OD from a fent pill that I thought was roxy 30 but I knew it was fent so I ate half and felt fine then snorted a quarter of it and died. Luckily my best friend was there to get medical help and they brought me back to life. Today I’m fine and kicking. 
But I have minor anxiety thinking I’m not the same but I feel like it’s stupid because I am the same. I try to tell my self it’s a learning lesson and all I can do is be better from now on. 
Any tips on how to strengthen heart health and to conquering the anxiety. Im a healthy athletic 22 year old 6 foot 200lb Leo savage. I still train. 
Just move on right?",1554881112.0
bbj2iw,https://www.reddit.com/r/opiates/comments/bbj2iw/i_dont_understand_dealers_sometimes/,2,https://redd.it/bbj2iw,DRayTheDon,I don't understand dealers sometimes...,"So I hit my guy up yesterday,  and ask him if he would break me off a half of ice as long as I bought a half of H. See, Gs of ice go for $30, so basically it's not worth his time to sell halves and I respect that. However, in this situation I was going to be spending another 50 to make it worth his trouble. He told me no, it's not worth his time. Okay then.

I hit another guy up, but sadly it fell thru. so I went ahead and called the first guy and decided to buy a half of H plus $30 worth of crack. He ended up giving me that, PLUS damn near an entire gram of ice for fucking free! I am not complaining, but. I really do not understand his logic sometimes...",1554880271.0
bbitix,https://i.redd.it/7ocl85uotdr21.jpg,3,https://redd.it/bbitix,Adroxisud,"A pic of the first presses I had ever gotten. I know they’re not pressed good, but my first trial with em’ had me in a daze and gave me instant nauseous feelings which eventually subsided.",,1554878265.0
bbio7t,https://www.reddit.com/r/opiates/comments/bbio7t/is_opium_even_a_thing_anymore/,19,https://redd.it/bbio7t,DrWinstonOBoogie1980,Is opium even a thing anymore?,"This is not a sourcing question. I just want to know if it's out there at all in any appreciable way, and if anyone still does it. 

I'm talking about the smokable black raw(ish?) product, the pasty stuff. I haven't personally seen it since like 2001, and even then only once—some friends were later ripped off and sold incense, but. 

So, like I say, is it still a thing?",1554877054.0
bbil46,https://www.reddit.com/r/opiates/comments/bbil46/time_to_say_goodbye/,15,https://redd.it/bbil46,hydromack,Time to say goodbye," Tltr: I’m trying to get clean again. There’s no end to this game there no winning at all and I’m see that and want to get out of it for my daughter and myself . 




I think my time here is coming to a end I really want to get clean and I keep telling my self that I got this habit under control but honestly I don’t when my body don’t have what it needs it’s bugs me and make me sick until I get what I need to feel better even if that’s the last of my check that I just got 3 days ago and have no idea how I’m gonna eat and put gas in my car . I’m only 20 and I feel like staying in this game is gonna get worse there’s no learning how to control or limit yourself on how much you want at the end of the day your body’s gonna tell you how much to take and when to take it . I don’t wanna ever make the which from pills to H so I’m gonna go hard and do my best for ah  couple of days to gain as much information so I can fight these withdrawals . I know these next couple of weeks are gonna be hell but I want to be able to live and care for my 6 month old I wanna be the best for her I don’t wanna be high all the time or not being able to come up on money to buy her things. And I know being on this sub is going to temp me into wanting to be high with all the scores and blessing from JJ so I’m gonna just take some time away from the sub and hopefully I can come back with a positive story to till you guys. So it’s been good man honestly and I hope for the best of each and every person on this sub even the Down voters.",1554876358.0
bbikpc,https://i.redd.it/1zmrr4ksndr21.jpg,1,https://redd.it/bbikpc,Adroxisud,A score from the past- Didn’t give a nod but lasted much of the day and very euphoric. How often do you guys find stuff that isn’t Fentadope but hits really hard?,,1554876272.0
bbikdo,https://i.redd.it/lxqeae0qndr21.jpg,4,https://redd.it/bbikdo,perpetuallynodding,Just under a G of some super fire BTH.,,1554876199.0
bbide4,https://www.reddit.com/r/opiates/comments/bbide4/oxy_ruined_something_great/,22,https://redd.it/bbide4,JustForFunCat,Oxy ruined something great,"Oxycodone made me lose my closest friend. I had a friend that I’ve had since December and we hung out almost everyday. Everyday was so great with her and she put a smile on my face, there was never a dull moment. One day we went to a city a hour away and watched a movie but she got sick during it so we had to leave. At the time I was on oxycontin and I drove back and I wasn’t driving so great and I didn’t tell her. Fast forward 2 weeks later she told me she didn’t like me and saw me as a friend, I cried a little but care to a realization that being friends would be just fine. I told her I’m sorry I lied to her and said I was on oxy when I drove back and she got really mad. I apologized to her so many times but she said she doesn’t think we can be friends anymore.  I know so much about her it’s crazy and I’d do anything to keep her safe. I can’t imagine not having her as a friend and she said we’d prolly never be friends again. I’m so hurt and lost I have no clue what to do with my life. She was my best friend and now she’s gone forever.. This hurts so bad i feel like my life’s upside down and idk what to do with life.",1554874665.0
bbi8je,https://i.redd.it/dm6fson0gdr21.jpg,23,https://redd.it/bbi8je,Dil4Me,Silly Dilly Time!,,1554873622.0
bbi40o,https://i.redd.it/34ajpng7ddr21.jpg,2,https://redd.it/bbi40o,ToValhalla410,"Last shot of the “snot” dope I got, like I said $5 lasted me 12 HOURZ .",,1554872663.0
bbi2c8,https://i.redd.it/2pzxy8o0cdr21.jpg,48,https://redd.it/bbi2c8,HEXDES,"M30, is it suppose to be brown inside?",,1554872338.0
bbi10p,https://www.reddit.com/r/opiates/comments/bbi10p/ive_used_everyday_almost_every_hour_for_almost_3/,6,https://redd.it/bbi10p,jdoginsane,I've used everyday almost every hour for almost 3 months straight,"I'm starting to feel pretty bad and I'm curious if there is anything I can take to help. Like I'm not sure what damage I've done but there like twitches in my head and different places and it's like really sensitive body and skin. Idk, it feels like wear and tear but on a more fundamental level like nerves and blood and shit. Is there anything I can take to heal whatever is happening so I can enjoy my high again. Plus the I've only got one H connect and the BTH I'm getting is garbage and part of the problem considering I iv. Any information at all will help. Stay nodding! Thnks!",1554872043.0
bbg2l5,https://www.reddit.com/r/opiates/comments/bbg2l5/who_else_likes_mixing_oxy_and_coke_i_sometimes/,10,https://redd.it/bbg2l5,NuckaCorgi,"Who else likes mixing oxy and coke? I sometimes put them both in the same line, I call em Chris Farley's...",https://imgur.com/a/OlOayun,1554859071.0
bbhvht,https://www.reddit.com/r/opiates/comments/bbhvht/questions_from_a_rookie/,17,https://redd.it/bbhvht,urinefairy,Questions from a rookie,"So I started smoking tar when I moved in with my BF about 5/6 months ago after I moved back down to Cali from Seattle. I did it a couple times when I was super trashed and then just started shot gunning his hits once and a while. He was hesitant about letting me smoke but eventually I got my own tooter and he started giving me some while he went to work. Forward 6 months I’m doing it regularly and am so fucking pissed at myself. I really didn’t understand the extent of what withdrawals were until about three months ago. We’re struggling with money a little and it’s making us stressed and causing fights. We’re doing almost three grams a day which is about 90 fucking dollars a day. I just wanna know any advice for making the stress easier. I don’t know shit about other kinds of heroin and/or opioid pills. I just wanna know if there’s anything that is cheaper and easier to get in times where we’re really broke and just scrambling to figure out a way to not withdrawal. Also I wanna know ways to make withdrawals easier to deal with and get past. I would really like to just quit this shit before it gets worse, but I’m scared of withdrawing and I get super pissy when I haven’t smoked in 7-9 hours.",1554870878.0
bbho1z,https://www.reddit.com/r/opiates/comments/bbho1z/cant_get_high_on_methadone/,12,https://redd.it/bbho1z,216junkhead,Cant get high on methadone,"And I'm fucking miserable.  I'm on 100mg. I cant feel barely anything 
 I am gonna stop dosing. But stuck between a hard place and once I stop showing up to the clinic this relapse will hit me for real... hating myself
To clarify I am on 100mg methadone been since October and I cant feel any dope.",1554869373.0
bbhkpb,https://i.redd.it/kum3gluh1dr21.jpg,14,https://redd.it/bbhkpb,jackofalltrades421,Midnight snack😍,,1554868723.0
bbhgyx,https://i.redd.it/1v9sri8czcr21.jpg,1,https://redd.it/bbhgyx,sicksixsicks,da da dahdah,,1554867998.0
bbhc5u,https://www.reddit.com/r/opiates/comments/bbhc5u/just_found_out_my_doctor_did_a_1_year_trial_run/,28,https://redd.it/bbhc5u,Wide_Application,Just found out my Doctor did a 1 year trial run of Pharma Grade Heroin Maintenance without telling me...,"The pilot program in my area for prescription Heroin was not advertised whatsoever and I only found out about it after googling my Dr's name recently.  I have been on methadone on and off for about 5 years now.  I was on as much as 280mg a day, but am now at 105.  I have never had more than a week without using while on methadone, and I was pretty much a perfect patient for the study as I have never had success with either Meth or Bupe in terms of cessation of using additional opiates.  

&#x200B;

When I asked my Dr about why I was not told about the program, he said it was mainly because the study criteria seemed to favor patients that were typically jobless/homeless, on welfare, had convictions for drug crimes, multiple overdoses, etc.  They wanted people that were seen as irredeemable drug addicts/ nuisances to society.  Even though I had an enormous habit and no luck staying clean on methadone or bupe, I was essentially seen as not degenerate enough even while at points IVing over a gram of pure fentanyl daily, 900mgs of hydromorphone at once or 45x80 OCs in day.  In hindsight, I have spent six figures on this addiction since that program started and was suicidal at times.  It would have saved me a tonne of money thats for sure.  I am still using a few times a week but I am doing better now, working full time, eating well and exercising.  I hope that Heroin, Morphine or Hydromorphine maintenance therapy will come back to my area.  There are programs available in other parts of my country (Canada) but my province has a more conservative policy.

&#x200B;

I am sure agonist maintenance programs other than methadone will be widely available here in the next few years, however I would rather get my life on track than wait a few years in limbo to be able to shoot pure heroin or morphine daily for cheap.",1554867053.0
bbhah7,https://i.redd.it/3bu1lrbkvcr21.jpg,1,https://redd.it/bbhah7,Aj102498,M 💙 K,,1554866733.0
bbh1xc,https://www.reddit.com/r/opiates/comments/bbh1xc/kratom_high/,27,https://redd.it/bbh1xc,FryrieIrving,Kratom high?,"If I take Kratom what’s likelihood of me getting High and for how long, I haven’t had a opiate more than once a month in like a year or more and if I did it was just a 30 or 2.",1554865184.0
bbh07v,https://i.redd.it/pspwhk20qcr21.jpg,5,https://redd.it/bbh07v,LethaLAnathemA,Size matters.,,1554864858.0
bbgwkh,https://i.redd.it/ro0q6ld1ocr21.jpg,8,https://redd.it/bbgwkh,mirandafsu,BLAST OFF!!! Goodnight my loves.,,1554864200.0
bbgoun,https://www.reddit.com/r/opiates/comments/bbgoun/how_do_i_inject_white_heroin_i_know_i_need_to_put/,12,https://redd.it/bbgoun,lsdteven,How do I inject white heroin? I know I need to put it in a spoon with water. But do I need to apply heat or can I just fill the syringe without heating up the spoon?,,1554862822.0
