8ro508,https://www.reddit.com/r/opiates/comments/8ro508/meeting_cinderella/,23,https://redd.it/8ro508,rachelmadcow1,Meeting Cinderella,"The time I met Cinderella. 

When I was 13 I wandered into what I thought was an abandoned trailer. 

To my surprised Cinderella was inside. 

Standing behind her was Steve Harvey. 

But between them was a read headed step child probably 12. In the child's hand was a bottle of robitussin. Name was Geebie. 

The kid took a swig as Cinderella did a line of blow and took a shot of whiskey. Jack Daniels. 

Steve Harvey looked at me. ""Welcome to my trailer bitch"". He snarled. 

Confused I pulled out my meth pipe. 
""Y'all ever heard of the 4 stroke gang?"" 

Steve took the pipe from me. Took a long hit. 
Blew it out. His penis became so sensitive he started splooging everywhere.

He then beat the red headed step child. Spanked Cinderella and then stared deep into my soul. ""Your next white boy"". 

I ran. Faster than I ever could. He chased me. Fully erect. The meth made him fast. But my 13 year old legs were stronger. 

I escaped. Thankfully. That was the night I met Cinderella.",1529202538.0
8ro2ts,https://www.reddit.com/r/opiates/comments/8ro2ts/how_did_you_feel/,9,https://redd.it/8ro2ts,Iamfriendly4488,How did you feel,The first and second day switching to Suboxone? I'm just trying to amp myself up to detox tomorrow. I really miss the old me :/ smoking black has taken away my spark. I want to be the cool dude I used to be again. ,1529201846.0
8rnujb,https://www.reddit.com/r/opiates/comments/8rnujb/middles_how_does_your_middle_benefit_from_getting/,7,https://redd.it/8rnujb,TheLemurMaster,"Middles, how does your middle benefit from getting your stuff for you?","I broke a two year sub assisted sobriety in April. Before I got onto subs my drug of choice were pills, mostly oxycodone. They were so freakin expensive so usually I could only afford to take 60-100mg a day. I started on 6mg sub, tapered to 4mg then broke my arm. When I broke my arm badly the doctor upped my dosage to 24mg a day hoping to help me avoid going onto full agonist pain killers. My arm healed but I did not taper and I began to take way more than prescribed. I'd always end up short at the end of the month and would buy some subs at super high prices from a few people I knew. 

In April I ran out two weeks early. No one I knew had enough to sell. I tried to cut my dose down but I would always take more than I rationed figuring I would ""start tomorrow, just 4mg tomorrow for a few days then 2mg and I'll make it to my refill date"".

I didn't have any way to get oxy. I was so out of the game. Finding a hook up was a miracle. I didn't cold cop. I cant say exactly how I found a new middle, but I did.

After a week or two of messaging back and forth we finally made the meet up. He told me $100/g and I told him I'd like a gram and that I would give him $100 for helping. I still had money to spare, so that wasn't a problem. The whole thing went down smoothly. I got home, weighed the bag and it was only .7g. I decided not to say anything because I thought maybe that is how it goes. Usually coke is sold in $50s around here and its .7g despite the dealer calling it a g. 

I had taken my last 6mg of sub 12 hours before and I started my journey into fent dope with the tiniest bump worried that I could possibly OD immediately from this super powerful substance. Nothing much happened. Naturally I still had plenty of buprenorphine holding tight onto my receptors. After a few hours I did reach a state of well being. The stress of mild sub withdrawal was lifted. It was nice. I saved the rest for work the next day and on the way home asked my middle if I could get a $150. No problem he said, it was like he was just waiting for me and was ready. Another smooth transaction. I get home and weigh it, this time it was 1.4g, close enough to 1.5g. It also had what appeared to be and tasted like crushed up Xanax. There were these soft bluish bits, one was quite large. This dope also appeared to be much stronger. It really hit me, wonderful euphoria. That was it, the hooks were in me, my relapse was complete.

As time went on the quality of the dope went up and down. Also the weight of the bags went wild. I am not sure exactly what my middle does in order to benefit from getting me dope. Sometimes the bags would be HUGE but the quality was shit. Like one time he gave me 6g for $200 and it was absolute garbage. 

Early in our relation while I was in the worst withdrawal I had ever experienced he gave me something totally bunk. I thought that was it, he decided to burn me and burn the bridge. I texted him just to say it isn't doing anything. I expected no response. To my surprise he was also in the same boat. I turned around and within an hour he got me a new bag of some real fire. It got me high as a kite and bolstered my faith in him as a trustworthy middle.

For a few weeks everytime I bought a ""gram""  or ""2 grams"" the bag(s) would actually be 2-2.5g and most of the time very high quality. I wasn't understanding how he was benefiting from me. Sometimes though the bag would be soooo much and the powder of a more granular consistency and a much lower potency. I wondered if he was scooping some out and putting regular sugar in it.

More recently though the bags have now returned to be just one gram. The quality is immensely better but it's very rare for it be much over. I guess I can't complain. I got used to taking higher doses because my gram bags were two grams. Now I am doing 2-4 grams a day if I can afford it. It's a very tough day if I have to make it through on just a gram. Fentanyl has no legs at all.

I am very nice and itchy and noddy right now though, and that's why I wanted to right the story. Just a few days ago he was giving me deals like 2g for $130 so I got all these deals and did 2-3 grams a day. Then yesterday I go and spend $200 and the bag is only 1.8g. It was the strongest I have had yet but fuck. I let him know and today gave him $160 and he gave me 2g. That bag weight is all over the map. He must be scooping some out and yesterday scooped too much. So I imagine he benefifs from either grabbing a few points or charging a little more than his guy charges. He also middles for a few other people so maybe his guy hooks him up due to him bringing so much business. Sometimes I give him some extra money, give him a bunch of cigarettes or let him use my credit card to get gas or food.

At the end of the day he's a great middle and performs me a good service. I really really need to stop though. I went back on my suboxone for 3 days last week, I thought I would make it. Now I'm high as hell on fentdope. I am such a world of shit financially, such huuuuge problems. I have to face the music tomorrow when I run out of dope and have no money for anything. wish me luck guys",1529199315.0
8rnqdv,https://www.reddit.com/r/opiates/comments/8rnqdv/if_heroin_is_safer_when_smoked_than_snorted_why/,3,https://redd.it/8rnqdv,jrocnk,"If heroin is safer when smoked than snorted, why is cocaine freebase more dangerous than snorting coke?",,1529197995.0
8rnqpi,https://www.reddit.com/r/opiates/comments/8rnqpi/whisper_fucks/,26,https://redd.it/8rnqpi,Smokemctoke420,Whisper fucks,"Trying to sell cigarettes on whisper for $4 a pack to get some D and this dude hits me for cigs and then asked if I was male or female. I tell him male and all he says is “to bad” like mother fucker I’m selling cigs not ass. I told him I’m not here to fuck I’m here to make $$ and blocked him. Fuck whisper. Bunch of flukes, man.",1529198100.0
8rnqgx,https://www.reddit.com/r/opiates/comments/8rnqgx/junkie_shit_purell_my_back_first_aid/,36,https://redd.it/8rnqgx,iced_teainmysyringe,"junkie shit, purell my back, first aid","my veins are flatter than gwyneth paltrow. This includes the feet but it's the best chance. Entering the fastfood chain today I was chuckling. remembering the post a few days back about the guy who didn't lock the bathroom door and the old man fainted. I was thinking of that walking towards my sweet relief. so when I couldn't wait for the occupied mens room, again my thoughts were distracted, now on making sure nobody saw my phallic maleness go in the ladies room. I prep and hit a foot vein. super excited, one poke, success. As usual I lay on my back to raise the foot for the rush. 15 seconds of  fuckin glorious greasy urine covered bathroom tile rush bliss fantasticness. That's when the lady burst in. she was digging for a tampon in her purse. Just enough time to keeanu reeves myself  to my feet. bloody and barefoot. I don't know if she even noticed. shreeeeeeik! you're not supposed to be in here!. ""sorry miss I cut my foot and just now could clean up on lunch."" ""oh yeah you poor thing I see the blood!"". she then doesn't leave so I pulled my socks and shoes on while she hopped about indicating she had to pee. i missed the sign saying ladies door lock is broken and the manual way to lock it. she didn't give me dirty looks and I don't think she thought anything shady was going on. too worried about peeing herself or oblivious, it's a good idea for everyone to wait to get home. Putting everything away as soon as finished saved me fr sure. Also if the highlight of your day is actually hitting a vein it's time for a change!",1529198026.0
8rnpy0,https://www.reddit.com/r/opiates/comments/8rnpy0/brothers_i_fucked_up_big_this_time/,67,https://redd.it/8rnpy0,meth-n-dildos,Brothers I fucked up big this time,Made a mistake and now just waiting on knock at the door. Love u all and just want to talk until I have to deal with it brothers ,1529197861.0
8rnlrs,https://www.reddit.com/r/opiates/comments/8rnlrs/pain_management/,8,https://redd.it/8rnlrs,wizwitout15,Pain management,"Question about pain management centers and getting scripts through them . I had surgery about a year and a half ago and had a screw put into my wrist to repair broken bones, after surgery had a script through my surgeon but he stopped filling even tho I was still in pain even after completing physical therapy. The surgeon says I shouldn’t be in pain but i am, I work a manual labor job where I lift heavy objects, equipment and use my hands every day, consequently every day I am in as much pain as when my wrist was broken, My question is how does pm work and would it be possible to go to a pain management and get a prescription again? If anyone has any input from experience I would greatly appreciate it. Thanks.  

Not sure if this is a rule breaking question I hope not I am a big fan of this sub and am new to posting. I don’t want break the rules so sorry if it is. Thanks again! ",1529196614.0
8rnkq2,https://www.reddit.com/r/opiates/comments/8rnkq2/today_i_got_to_be_jj/,36,https://redd.it/8rnkq2,AgingHippieLiberal,Today I got to be JJ,"Awhile back I made a post about how we got robbed cold copping but a guy on CL saved our asses and gave us a .30 because we were struggling. That same night this girl (who we'll call L) emailed us saying she could get us a hookup. Because we were broke we couldn't do it but we stayed in contact just in case. As a thank you for offering to help I told L if she needed a favor she could ask us and we'd see what we could do. 

Last night she asked if we could help her because she was out, broke, and sick. Unfortunately we were in the same boat, but I said I'd see what I could do. Later that night I found a MS Contin 30 but by the time I tried to call she was asleep (we were still sick but because we don't shoot it wouldnt even get us well). 

This morning our dealer called and said he needed a favor (because he doesn't have a car and he knows we've been struggling financially we have an arrangement where we'll give him a ride, deliver dope, drop off his dry cleaning, etc, and he'll throw us a .50 and some gas money). 

So we do the favor, get our bag, and I just started feeling really terrible that this girl, who I've never met, never even seen her face, was suffering through withdrawals. I put aside about .2 and told her I could help. She doesn't have a car so she said I'd have to meet her. I'm low on gas, have no cash, but the thought of this girl suffering, or going out and blowing some guy to get cash wouldn't leave my mind. 

I drove down there, waited for 25 minutes because her ride was late, and gave her the dope and the morphine. She was so happy she broke into tears. I'm not making this post to be all ""check me out I'm a generous saint"", just trying to remind you guys that we're all in this together. Sure, a lot of people are dicks who will take advantage of as many people as possible, but the vast majority of us are just struggling to get by. It doesn't take giving someone a gram for free to help them, even something small can help.

Edit: While everything in the post is written in the first person my SO was in this with me the whole way. She feels the exaxt same way I do about the situation. 

Edit 2: Whether you do or do not believe in Karma, something interesting happened today. I just lost my job so I've been looking for odd jobs anywhere I think I'll find one. I made posts on Facebook, Craigslist, Next Door, etc, explaining my story and offering to do jobs for people. I get a few replies with the usual stuff (landscaping, general labor, minor construction) which I'm more than happy to do and it seemed my luck was slightly turning around. Just slightly. 

About 20 minutes after I got home from meeting L I get a response that's just this gentleman's name and phone number. On the phone he tells me he's essentially a professional handyman and that the amount of business is growing faster then his current group can handle. He said he'd love to meet me, and if he likes the first impression I have a job. Basically we're going to meet and talk a little, then I start working almost immediately to see if I'm fit for the work. He asked what my ""current asking rate is"" and I told him at my old job I was making $11.40/hr and I'd like to be making a little bit more than that. He counter offered with $15/hr, 50 hrs/week, paid daily. ",1529196306.0
8rnjcj,https://www.reddit.com/r/opiates/comments/8rnjcj/rehab_monday/,12,https://redd.it/8rnjcj,billsmafia09,Rehab Monday,So I'm being forced to go to rehab Monday. Never been to any in patient before. I know it's prob not a great idea but jw if anyone has any experience bringing shit in with them. I get Ecp which is pretty easy to conceal anywhere. I've gotten bundles through TSA and shit like that so I figure rehab wouldn't even be as difficult as that. Thanks for the input!,1529195877.0
8rnhu9,https://youtu.be/vtP-SGN6VcE,0,https://redd.it/8rnhu9,someguy89704,"Slow train, won’t you numb my pain, swim through my veins...",,1529195414.0
8rnhk2,https://www.reddit.com/r/opiates/comments/8rnhk2/shooting_for_the_first_time/,22,https://redd.it/8rnhk2,Kylerdub,Shooting for the first time.,"Debating shooting up for the first time in my life. Usually take oxy orally. Came across some 30mg oxy that i removed the coating on and have a sealed syringe sitting there.   


Is it worth it?",1529195330.0
8rncmp,https://www.reddit.com/r/opiates/comments/8rncmp/immune_to_withdraw/,15,https://redd.it/8rncmp,KPROTON,Immune to Withdraw,"My mother never gets withdraw when we do opiates together. We’ve done 30s, 40mg oxymorphone, and while I only get minor withdraw bc I don’t really do to much, she doesn’t experience ANY.

How’s this possible? Anyone else like this? Fucking jealous lmao.",1529193876.0
8rn9hs,https://i.redd.it/qsjdw2i3ag411.jpg,15,https://redd.it/8rn9hs,Turtle_Shell_Hotel,"Got some great off-white dope, and found a regular pill supplier while in the area~!!! But I hate this little beads~!!! First time shooting a dilly was also a let down.",,1529192969.0
8rn944,https://i.redd.it/yt39e2gy9g411.jpg,10,https://redd.it/8rn944,wishyouhadit,Dboy blessed me with a .4 after testing a potential new batch. Str8 diesel!! Doubt much fent or any at all since he’s very against fent.. current stash minus my klons which are in my desk drawer at work. Sadly- grateful..,,1529192859.0
8rn70q,https://i.redd.it/iei0frz28g411.png,1,https://redd.it/8rn70q,DaddyD503,"Taken from the book of face, and made my own. I thought this may belong here. ❤️",,1529192228.0
8rn5ld,http://imgur.com/pY7zHiu,51,https://redd.it/8rn5ld,dickseverywhere444,Fresh grab,,1529191789.0
8rn200,https://www.reddit.com/r/opiates/comments/8rn200/speedball/,20,https://redd.it/8rn200,yayallday,speedball,"currently have primo girl, along with some primo boy. Anyone know a good ratio of boy to girl to make a nice speedball? I should point out that I don't mess with needles, so only up my nose.",1529190692.0
8rmzp0,https://www.reddit.com/r/opiates/comments/8rmzp0/anyone_ever_hear_of_this_supposed_to_be_as_strong/,13,https://redd.it/8rmzp0,Pandamania07,Anyone ever hear of this? Supposed to be as strong as Morphine and grown in your backyard?,"Check it out, curious if anyone has ever heard of this plant:

http://www.askaprepper.com/similar-morphine-best-natural-painkiller-grows-backyard/",1529190078.0
8rmzng,https://i.redd.it/57gl9gmm1g411.jpg,4,https://redd.it/8rmzng,chemist-us,"Pain? Im sorry, what’s that? 😲😲😲",,1529190067.0
8rmyce,https://i.imgur.com/5XjB0vP.jpg,1,https://redd.it/8rmyce,Zyloh420,The opiate part not what this was meant for but hey it’s inconspicuous for on the go,,1529189695.0
8rmxzg,https://i.imgur.com/LbMdokx.jpg,6,https://redd.it/8rmxzg,Zyloh420,Earlier today was hot but great day snort dope and drink daiquiris. Will post follow up so it will be “opiate related”,,1529189597.0
8rmri7,https://www.reddit.com/r/opiates/comments/8rmri7/free_naloxone/,7,https://redd.it/8rmri7,Phaedrug,Free Naloxone,"I have 2 Naloxone kits that I got from the local HR place that each have 2x4mg Naloxone IM injectables (so 16mg total in 4 vials, with 4 syringes). They have an expire date of Dec 2018.

I'm not going to use them before they expire, and I can get more, so I'd like to send them to someone who can't access narcan if that's allowed. ",1529187782.0
8rmoi5,https://www.reddit.com/r/opiates/comments/8rmoi5/oxycodone/,21,https://redd.it/8rmoi5,FBGMerk4,Oxycodone,"Hello everyone first actual post on r/opiates i believe :)

I typically use heroin but my girl just recently picked up oxycodone and im not really getting anything out of it... she got 20mg lil blue(grey) ones i think they said k 57 on them, the first day i snorted 15mg and got a nice little itch and felt pretty good at first then fell asleep and woke up to try the same thing and literally felt nothing. I snorted another 10mg and still felt nothing.

I gave up and snorted some boy and barely even felt that too!

Im confused because I know my tolerance for boy is manageable and I don't really ever have to increase my dosages by much if any and I try my best to keep it low as possible but now my tolerance or something got all fucked up maybe my nose just wont absorb it anymore or something idk.

I guess my point to this is is there anything I can do to increase the bioavailiability? i know snorting isnt the best but i figure ill atleast get high from the drip and a little bit of rush cause i love the drip and act of crushing/snorting...
And does tolerance rapidly increase with oxies versus heroin? 

edit: i must be colorblind or something but ill add the correction in parathesis ;)",1529186960.0
8rmo37,https://www.reddit.com/r/opiates/comments/8rmo37/iv_question/,4,https://redd.it/8rmo37,DopeDayThrowawayy,IV question,"So this really isn't relevant to opiates at all, but I like you guys way more than the other drug subreddits & I feel like you have way more needle experience than them. I was just wondering if any of you have shot LSD before? I got a tab and being the fiend that I am I thought about shooting it, I've heard a million story's at rehabs and shit about it but I don't really believe anything I hear there.",1529186852.0
8rmhne,https://www.reddit.com/r/opiates/comments/8rmhne/what_to_do_with_a_person_like_me/,17,https://redd.it/8rmhne,Torque74,What to do with a person like me?,"I feel like my only route is to try methadone and maybe go on it for life.

I started opiates at 12 and ended at around 25, started up after 3 years. Those 3 years were basically pure misery, couldn't keep a job. Tried killing myself, went on all sorts of medications(anti depressants etc), therapy i did everything. Even got in very good shape( ripped, shredded with 6 pack abs) but the depression just never got better. took a shit ton of benzos and painkillers and did a half ass attempt at killing myself. i can't keep a job, the second i get money i spend it all on drugs. so those 3 years were me living at my dads.

I don't really chase an extreme high it's mostly i take enough to get a mood lift but that is never sustainable. doing it for so long the mood lifts only last ike two hours. So even though i'll only do like 30 mgs in one shot. if i have them i'll end up doing 200 mg's in one day.

i don't know what to do anymore, i cannot live sober, i did my best and tried very hard. i can't live life on pain killers because i go broke and lose my job to fast. I think about killing myself 24-7.

what the hell should i do? Get on methadone or subs for life? something to just barely tickle my opi receptors long half life where i don't feel like killing myself all day? Right now the only road seems to lead to my death.

what would you guys do in my situation>",1529185175.0
8rlvpe,https://www.reddit.com/r/opiates/comments/8rlvpe/ecp_hellish_nausea/,5,https://redd.it/8rlvpe,zooms400,Ecp hellish nausea,"After not using at all for a few years I got myself 1 bag a couple weeks ago. I did about a quarter of it the day I got I got it and got a little high but mostly just had awful nausea for hours and then eventually threw up. A few days later I do another small amount, probably a little less than the first time. It was even worse, was vaguely high but unbearably nauseous. Obviously the smart thing to do here get rid of the rest and not touch the stuff ever again but I'm not gonna do that so I'm wondering if anyone has a suggestion to make it more pleasant, I'm gonna do the rest of it today. I was gonna take some benadryl with it, should I take 2 pills or what? Anything else possibly helpful?",1529179446.0
8rmaw3,https://www.reddit.com/r/opiates/comments/8rmaw3/how_do_you_guys_feel_about_ibogaine_my_friend/,17,https://redd.it/8rmaw3,addisonxb,How do you guys feel about ibogaine? My friend said if I came up with enough money to get some he could get it for me to help quit.,I've done a good amount of acid and mushrooms but nothing that strong before. He said for $200 I could get some and I really want to quit this habit but going that route sounds like a pretty brave way to go. What do you guys think of it?,1529183393.0
8rm1k3,https://www.reddit.com/r/opiates/comments/8rm1k3/hydromorph_heroin_comparison/,7,https://redd.it/8rm1k3,iberico_ham,Hydromorph heroin comparison,I'm used to shooting .15 g of heroin and I'm not used to pills and am getting a bunch of orange hydromorph contin I need some figuring out the correct dose. Could someone more experienced please help before I fuck up,1529180972.0
8rlskz,https://i.imgur.com/2mYOsWw.mp4,5,https://redd.it/8rlskz,darkgamr,"""No mom, of course I'm not using again, how could you even ask that?""",,1529178661.0
8rljau,https://www.reddit.com/r/opiates/comments/8rljau/tapentadol_the_first_psychedelic_opiod/,16,https://redd.it/8rljau,2F-DCK,Tapentadol- The First Psychedelic Opiod 💊,"Seriously, when you get up to nodding dose and have your eyes closed, elaborate scenes will unfold before your eyes, almost like a random collection of shit you’ve seen throughout the day. Or even weirder, you’ll have your eyes closed nodding and you will still visualize what you think is in front of your closed eyes, clear as day but obviously a bit more hallucinogenic.
I have however noticed there is very little open eyes visuals, however. That’s so weird that there would be such intense CEVs, I highly suspect it’s due to the molecules structural similarity to phenethylamines (like MDMA and 2C-B) as well as it having a 4 hydroxy group attachment much like our friends DMT and Psilocybin.


This drug is seriously underrated! And not only does it give classic opiod euphoria (especially when plugged.. DONT snort! Will burn bad!), but it also has these crazy nodding hallucinations created out of your collective memories of recent. It’s like I’d close my eyes to nod then a minute later I could make out my wall and blanket and be like “wait I thought my eyes were closed” only to open them and find I was right, and most of the time my open eyed visuals (normally, non-hallucinations) were nowhere near where I was convinced they were based on what I saw with eyes closed. But I didn’t just hallucinate stuff that’d been within my sight shortly before nodding, I also witnessed serene landscapes and entities. Like some DMT or high level acid trip shit 😝 it was wild


And yet another unique property of this opiod- it almost even seems to produce GABA or GABA-like activity because it can make me stumble, feel very dreamy and forgetful as well..
And at 0.65¢ For 100 mg doses from india (i only took 125 mg and tripped/nodded sack, this may be the great new opiod.


*protip: This shit still works even if you have that implant or whatever that keeps you from feeling classic opiods like heroin*",1529176224.0
8rlc06,https://i.redd.it/lagavz73re411.jpg,40,https://redd.it/8rlc06,Kneemerz,200 plus 16,,1529174402.0
8rlawk,https://i.redd.it/te47ly66qe411.jpg,25,https://redd.it/8rlawk,grahm56,When dope is lyfe,,1529174102.0
