4pwzr8,https://www.reddit.com/r/opiates/comments/4pwzr8/whats_the_governments_party_line_for_why_drugs/,27,https://redd.it/4pwzr8,rainbowforever,What's the governments' party line for why drugs can't be legalised?,"I was watching a YouTube doc on Fentanyl (I was searching for the VICE one but after seeing it had been taken down I found a different one on YouTube) and it clarified how fentanyl is stronger than heroin (something I didn't know before). How on Earth does the government explain why Fentanyl can be prescribed and not heroin when they perform similar functions AND fenatyl is stronger?

I just can't think of how they get away with excusing this. 

I hated watching the smug people that work at Fenatyl act like they were so noble for saving people from pain when they are nothing more than legal drug dealers. Not that dealing drugs is bad but it's just that these people so obviously see themselves as saviours when they aren't, they're dealers.

The doc showed how the company that produce this fentanyl spray incentivise doctors to prescribe it and how they get around regulations in order to get insurance to pay for it for non-cancer patients even though it's only approved for cancer.

In a way these companies are worse than drug dealers because drug dealers don't tend to tell you you need something when you don't, they don't tend to push drugs on people, at least not to the same agressive extent as these doctors, who tell people they need these drugs (as far as I understand anyway).

They also showed how the makers of oxycontin got it to be used so much, they would run commercials claiming it was not strong or addictive.

These people are allowed to operate in broad daylight! I hate how unfair the world is.

But yeah does anyone know how the government actually explains why a drug like fenatyl can be legalised and not heroin? Why can't heroin be legalised and prescribed for pain? In fact wouldn't it be better to prescribe heroin before fenatyl if fenatyl is the strongest? Not to mention all the other benefits of drug legalisation which come up time and time again: taxable, safe pure products, less money to crime, help for addicts instead of criminalisation of them.

EDIT: apologies for all my misspellings of fentanyl! Can't be arsed to go back and fix them all now. But realized I've spelt it about 5 different ways now. ",1466931727.0
4pwzbj,https://www.reddit.com/r/opiates/comments/4pwzbj/talk_about_a_damn_good_but_seemingly_dangerous/,9,https://redd.it/4pwzbj,Buddy813,"Talk about a damn good, but seemingly dangerous combo","Around 2:20 AM which was an hour and a half ago I took either 20 or 25 MG of Oxycodone. As well as 4 MG of Xanax and 10 MG of Ambien. I am prescribed the Xanax and Ambien both. 

The Xanax and Ambien is for sleep. I have anxiety and depression since 13. So a lot of times it's hard to get a consistent amount of rest. which is why I usually take an extra Xanax. 

I always take 2, 10 MG of Hydrocodone ( Yes I do have plenty of experience with 20 and 30 MG of Hydrocodone). Due to herniated disc in neck and back. Plus full body aches constantly. Doctor still trying to figure out what's wrong and what is causing it.

ANYWAYS, FUCK I am fucking high as fuck. I'm pretty sure I'm having a decent amount of auditory hallucinations only when I am nodding off. It's not like really bad or anything. Nothing scary or anything. I was just wondering if anybody can clarify it that I'm probably okay. I would appreciate it so much!!!

Was wondering If I should even worry at all or it's just probably because I am high? Not sure this matters, but I'm 5'6"" male. I've taken Xanax and Hydrocodone for a long time. So I assume I have good tolerance to them. I was Wondering if you guys believe I should be okay? I feel great, no anxiety, no depression, just happy with a little less pain.

PS I am NOT allergic to any medicine of any kind.",1466931437.0
4pwv83,https://www.reddit.com/r/opiates/comments/4pwv83/what_cuts_are_in_abundance_today/,11,https://redd.it/4pwv83,Methamphetamouse,What cuts are in abundance today?,"Over the years of course geography and who you know are big variables, i am curious if the cuts became different.

More so, most of the dope that is perceived good and probably one of the reasons ive nevrer grabbed white powder dope on the streets that was good, is depending on the randomness and geography and upper dealers to lower as it passes the through the various hands and levels of distribution,  it seeems all the h that i was grabbing and used to five years ago where i livewas  some of thr most incredible and consistently  had the apparence of stones, rocks and different consistencies ranging from play doh to clay to hard to soft etc and shades of brown beige tan etc. 

Well fast forward 2016. Now everything has the vinegar smell that it mesns notning to me, very litrle dope ive seen for afghan leaves the little bit stuck in papers if just left in sweaty hands or a hot area, and appearence means absolutely nothing now it seems, stuff to the eye that seems so similar to what i had years ago is complÃ¨te junk usually.


So what gives? Cocaine and other drugs are usuallly mixed with a cut solvent evaporated and left to make a homogenous looking to the bare eye solid. But the dope im discussing, im not sure thats the case. Also the legs being so short yet urine analysis showing morphine and no fent really makes me curious. Why if I do more of ""cut"" dope do I not get similar highs and rushes? Do the adulterants affect the psychoactivity that much? I thought they would use inon psychoactive stuff unless it was to boost the effect and not just the weight.

If anyone knows any government  reports as of recent on this subject please share.

Also why is there dope that cooks purple and all sorts of colors now? Up until a couple years ago all I['d seen in my entire life  was alwsys yellow amber brown black or clear if pure.",1466928829.0
4pwu7c,https://www.reddit.com/r/opiates/comments/4pwu7c/dry_amps_in_canada/,0,https://redd.it/4pwu7c,JanissareFluxus,Dry Amps in Canada,"Heroin assisted therapy in Canada, coming soon.

http://thefreethoughtproject.com/canada-legalize-pharmaceutical-grade-heroin-science-proves-drug-war-works/",1466928214.0
4pwp6d,https://www.reddit.com/r/opiates/comments/4pwp6d/is_doing_a_lower_dose_opiates_while_on_a_30mg_xr/,3,https://redd.it/4pwp6d,WuTangHobo,Is doing a lower dose opiates while on a 30mg XR addie dangerous?,,1466925192.0
4pwdbp,https://www.reddit.com/r/opiates/comments/4pwdbp/that_moment/,7,https://redd.it/4pwdbp,Mama_triedtotellme,That moment,When you know dudes on his way and you pace back and forth like a dog waiting to go out.,1466918803.0
4pwbdc,https://i.redd.it/dg3p1i9yhk5x.jpg,8,https://redd.it/4pwbdc,Seth_McPresident,"Finished up in a McDonalds bathroom, bought a drink.. They know...",,1466917844.0
4pw8gs,https://www.reddit.com/r/opiates/comments/4pw8gs/butrans/,3,https://redd.it/4pw8gs,xtr2009,Butrans,Anyone have any problem switching from suboxone to Butrans?  Anything I should watch out for?  ,1466916421.0
4pw7vt,https://www.reddit.com/r/opiates/comments/4pw7vt/this_sub_convinced_me_to_never_try_opiatesopiods/,105,https://redd.it/4pw7vt,RedditAccount28,This sub convinced me to never try opiates/opiods,"I'm one of those idiots who thinks I have great self control because up to this point I really have had great control when it comes to drugs, at one point I figured I could control myself with opiates just like I do with benzos and every other drug and decided I wanted to try opiates. Then I discovered this sub and realized that there are a lot of people who started off with my mindset and my attributes and still ended up addicted. I just read a story about a guy losing his legs due to opiates and another thread about opiate users taking asshole ripping shits. So yeah this sub is the reason I will never try opiates, thank you and goodluck",1466916137.0
4pw72m,https://www.reddit.com/r/opiates/comments/4pw72m/whats_the_longest_that_you_have_passed_out_on/,23,https://redd.it/4pw72m,rainbowforever,What's the longest that you have passed out on oxycodone/opiates and woken up unaided (without medical intervention)?,"Is it possible to be unconscious for several days before waking?

and if you've passed out will this be because of respiratory depression or innocent nodding/drowsiness? As in, could you go into respiratory depression related unconsciousness and then wake up on your own once the drug had worn off? Or is the case that as soon as you go unconscious due to respiratory depression/shallow breathing, you won't wake up without medical intervention?

If you could go unconscious due to shallow breathing and then wake up without medical intervention I'm guessing you would wake up with brain damage because of a lack of oxygen to the brain?

Trying to understand the difference between safely passing out on opiates and dangerously passing out I suppose. I'm a bit baffled about whether one can wake up on their own after going through respiratory depression. If one could in theory wake up after a day or two on their own after not breathing properly with brain damage. Sounds horrific. But all the cases of brain damage I've heard of so far seem to be from stories where people have had medical intervention to wake them up. I just wonder, if those people would have likely woke up on their own without help but with more brain damage.

Basically - Is it possible for the breathing to lessen or stop for short bursts such that you don't die but you wake up with brain damage once the drug has gone down in your system? (Without intervention)

",1466915765.0
4pw68j,https://www.reddit.com/r/opiates/comments/4pw68j/quite_a_bit_of_us_on_the_tc_pull_thru/,5,https://redd.it/4pw68j,Philly19111,Quite a bit of us on the TC pull thru,"http://tinychat.com/ropiatesubchat

About 7 or 8 people on the tinychat come through ladys and gents. Fiends and friends <3",1466915402.0
4pw3ak,https://www.reddit.com/r/opiates/comments/4pw3ak/how_do_people_use_oxycodone_for_pain_without/,25,https://redd.it/4pw3ak,rainbowforever,How do people use oxycodone for pain without building a tolerance?,"People who use oxycodone and other opiates for highs say not to use them every day as this will result in a tolerance and the drug will no longer be effective at this level. But I wonder - how do the people who are prescribed oxycodone/other opiates for pain take the drug every day without it losing effectiveness? As I understand people who take it for severe pain often need to take it every day. Or does the pain killing effectiveness stay and it's only the euphoria that drops off quickly?

Like how some people use THC free marjuana for medical problems, I wonder are people able to take opiates at a fixed level every day for quite a long time before they eventually need to increase only because whilst the euphoria goes quickly the pain killing effectiveness stays roughly the same?",1466913968.0
4pw0b1,http://imgur.com/Rh4bRBx,14,https://redd.it/4pw0b1,DOPEDupNCheckedOut,MI dope pron I promised. Bout 40 bucks with right here,,1466912626.0
4pvxtr,https://www.reddit.com/r/opiates/comments/4pvxtr/honesty_backfired_on_me_shit_post/,6,https://redd.it/4pvxtr,bricksrus412,honesty backfired on me. (SHIT POST),(SHIT POST) So I am 25 years old and due to loosing my job I moved back home. My parents have known about my pill/H habit the entire time I've had it(over ten years) my dad thinks I quit but my mom knows because she snorts a bag from time to time. So a few days ago I decided it was time to switch from snorting to shooting. Then last night I nodded in my room only 2 bags my mom needed my dad to break the door down thinking I was overdosing. When they came in the needle was still in my arm so cats out if the bag. And I just realized tonight why I nodded so hard I think it might have something to do with the Klonopin earlier. Oh well you LIVE(lucky to be alive) and you learn.(SHIT POST),1466911574.0
4pvwtj,https://www.reddit.com/r/opiates/comments/4pvwtj/anyone_else_experience_this_dilemma_with_opiates/,5,https://redd.it/4pvwtj,CrabRangooon,Anyone else experience this Dilemma with Opiates?,"So my tolerance is to about 5 - $10 dime bags to get a nice solid buzz, What i dont understand is that as soon as i release that plunger and finish injecting the dose i immediately start judging the high and wishing it was stronger and immediately thinking about when i should shoot up again,

I am on 70 mg of methadone daily and only use on the weekends for a day or two.  i know methadone blocks some of the feeling of the high and makes me need to use more, but what i feel is missing is the euphoria like for those who inject Opana (oxymorphone) that rush u know what i am talking about the magic lasts a good 3 or 4 hours to, with my dope i am lucky to get an hour.",1466911135.0
4pvwfr,https://www.reddit.com/r/opiates/comments/4pvwfr/whats_it_like_to_almost_die_by_opioid_od_be/,22,https://redd.it/4pvwfr,anon602,Whats it like to almost die by Opioid OD? Be descriptive.,Please detail your NDE's from Opioid OD or even benzo OD? Was it quick? Was it painless? Do you remember anything after you were brought back? ,1466910968.0
4pvsa1,https://www.reddit.com/r/opiates/comments/4pvsa1/ama_previous_counselor_at_a_methadone_clinicask/,45,https://redd.it/4pvsa1,xcelllz,AMA previous counselor at a methadone clinic...ask me anything!,"I am a previous counselor at a methadone clinic.  I worked for 2 years providing individual and group counseling.  I worked in NC.  I can't provide proof online for confidentiality reasons but if the mods want some, I will provide to them.  I averaged around 50-55 people on my caseload.  ",1466909127.0
4pvq3c,https://www.reddit.com/r/opiates/comments/4pvq3c/popping_cherriesdo_you_feel_bad/,28,https://redd.it/4pvq3c,OldRapGroup,Popping cherries/Do you feel bad?,"So I'm pretty sure a lot of you on here have started some people out, be it with opiates in general, or with the needle. Do you feel bad about it at all? And do you still talk to them?",1466908206.0
4pvlx4,https://docs.google.com/forms/d/1-F5Pqk1qvoshS90LdRDa2yL_mrswnxbQvbxs5iIjo9o/viewform,12,https://redd.it/4pvlx4,Happytor2,/r/opiates survey! Learn more about the community while helping me with a research project!,,1466906459.0
4pviht,https://www.reddit.com/r/opiates/comments/4pviht/gotta_love_good_dboys/,5,https://redd.it/4pviht,iriemonster,Gotta love good dboys,So I hit my dboy up for a quater oz and he says itll be an hour. 1 hour goes by and i hit him up saying is it ok to head down?. He says yah ill be home in 15 min. I text him to let him know ive arrived and where i parked. He immediately calls me and can tell im sick. He had just reupped and theres a line of ppl waiting  but tells me hes about to pull in and that i should hop in his whip and throws me a g to get well while he goes upstairs to to get everyones  bundles. So no im sitting here happy and well till the rest of my sack gets here. Hope everyones day is going well and your dboys dont lag,1466904987.0
4pv9hj,https://www.reddit.com/r/opiates/comments/4pv9hj/people_are_dropping_like_flies_be_careful_out/,27,https://redd.it/4pv9hj,Palmer1997,People are dropping like flies :( BE CAREFUL OUT THERE. People will miss you. Don't mix opiates or do so cautiously!,"I've been seeing a resent increase in opiate deaths on this sub, and it really hurts to be seeing people in such pain and remorse over good friends or family members dying from an overdose, due to misjudging, laced shit, or mixing with other downers. BE SAFE EVERYONE! Having witnessed an overdose before my eyes it's fucking terrible to even be around. Let alone how it will affect loved ones. 

Please be safe everyone, much love for those who have passed â¤ï¸",1466901269.0
4pv8ie,https://www.reddit.com/r/opiates/comments/4pv8ie/norco_10mg_price/,14,https://redd.it/4pv8ie,14rahowa88,Norco 10mg price,I have the opportunity to get 10 mg Norco's for $4 a piece. Is that a good price? What are the prices in your area and post general location if you are comfortable with that please.,1466900898.0
4pv7ru,https://www.reddit.com/r/opiates/comments/4pv7ru/what_happened_to_vices_dopesick_fentanyl/,7,https://redd.it/4pv7ru,_j_ryan,What happened to Vice's 'Dopesick' Fentanyl documentary?,"Stumbled upon this sub a week ago and have been following it and seeing a lot of the posts, good and bad. I saw Vice was posting their Fent documentary on the 22nd, but it isn't working on their site and I can't find it anywhere. I know it's a long shot, but thought I'd post on /r/opiates and maybe someone has found it. I'd love to learn more about this.",1466900613.0
4pv1fd,https://www.reddit.com/r/opiates/comments/4pv1fd/poppy_seed_tea_bupe/,13,https://redd.it/4pv1fd,randothrowaway10,Poppy Seed Tea & Bupe,"Sup guise, easy question.

Been off/on bupe for like 4 months, buddy had some poppy seed tea, took 4mg bupe, about 4-6 hours later finished my glass of PST. Roughly at midnight last night. Didn't feel much. When do you guys think I can take more bupe?

I've heard 36 hours, which seems kinda overboard. I've taken bupe 7 hours after a massive fent binge (~100mg over 3 days) and been totally kosher, 13-14 hours after two days of moderate-dose morphine (300mg) and codeine (300mg) mixing both and been absolutely fine. What do you guys think would be the minimum length of time to wait? Not in W/Ds, have been on sub long enough that sub W/Ds would be the only W/Ds I'd feel. You think the bupe just made the PST plink of my receptors and I'd be good in 18-24 hours post-dose?

Thanks all.",1466897985.0
4pux8v,https://www.reddit.com/r/opiates/comments/4pux8v/opiates_making_me_fat_help/,23,https://redd.it/4pux8v,So_Edgy_I_Cut_Myself,Opiates Making Me Fat! ðŸ˜¢ Help?,"Yeah, what the title says.  I'm desperate for answers here.

I've gained 30 lbs since resuming my pill habit in 2014.  Weight gain has happened in the past on opiates so I know that's the cause.  Off opiates I'm stick-thin.  I do cardio 5 days a week and strength training 1 day.  I try not to exceed 1,500 calories, though sometimes I fail due to increased sugar intake (opies make me crave sweets).  

No matter how hard I try, I cannot lose even one pound and somehow keep *gaining.*  Before opiates I ate what I wanted, never exercised and weighed 117 lbs; now I'm at a whopping 147 despite my active lifestyle and calorie counting.  I've had blood work and my thyroid levels are fine, so that's not it.  

Anyone else have this problem?  Most junkies I see are emaciated and thin, so I'm really confused.  I know constipation and water retention could be contributing, but surely I'm not THAT constipated (right?).  Do opiates slow your metabolism to a screeching halt or something?  

((Quitting pills is not an option.  I just want to know the science behind the weight gain so I can find a solution.  Any medical studies you could point me to would be greatly appreciated)).",1466896261.0
4putas,https://www.reddit.com/r/opiates/comments/4putas/sunglasses/,6,https://redd.it/4putas,2XwhiskeyDOPEnoICE,Sunglasses,"Sunglasses are great. Ppl can't see how pinned yr pupils are. And if you have a light nod going on its hard for ppl to tell, unless they are really paying attention.",1466894784.0
4pup7x,https://www.reddit.com/r/opiates/comments/4pup7x/30s_rp_30s_shoot_smoke_snort/,5,https://redd.it/4pup7x,Jayelcolombiano,"30s RP 30s?! Shoot, smoke, snort?!",,1466893160.0
4pun9t,https://www.reddit.com/r/opiates/comments/4pun9t/friend_overdosed_on_fentanyl_i_think/,4,https://redd.it/4pun9t,Happyman255,Friend overdosed on fentanyl (I think?),"So my friend there was doing that fentanyl shit last night and I told him not to and he said ok but I guess he was doing it in the bathroom there. I went into his room and he had his face in his cup and seemed completely out of it. So I laid him down and noticed he had a grey tinge to his skin and had blue lips, so I dragged him into the bathroom and splashed him with some cold water and he snapped out of it. He was barely breathing but the cold water snapped him out of it right away, if it wouldn't of worked I would of called 911. He said he had no idea what happened and was still fucked up but he was conscious, did he OD? Is this what a OD looks like? Scary shit man.
",1466892376.0
4pul66,https://www.reddit.com/r/opiates/comments/4pul66/tinychat/,0,https://redd.it/4pul66,Philly19111,Tinychat?!,"Figured I'd throw it out there. Few people on tinychat and more are welcome :D . Pull thru fam be there in 5 bruuuh (....2 hours later) WYA FAM! Oh shit I'm pullin up now 

http://tinychat.com/ropiatesubchat",1466891521.0
4pug6w,http://traceyh415.blogspot.com/2016/06/tore-back.html,10,https://redd.it/4pug6w,traceyh415,traceyh415: Tore Back,,1466889473.0
4pudi6,https://www.reddit.com/r/opiates/comments/4pudi6/lost_my_brother_last_night/,33,https://redd.it/4pudi6,DrDependence,Lost my brother last night,"I woke up this morning to my dad on the phone not even able to speak clearly. My brother (who was hooked on Valium) went out last night and got given a tablet, being told it was temazepam. Now him being a massive benzo fan decided to try it. Turns out the motherfucker gave him a 30mg IR oxycodone tablet. 

I'm so angry at my brother for not knowing better than to take someone elses pills without knowing what they were, but I'm even more furious that his ""mate"" gave him an oxy (knowing full well it was an oxy, he's admitted to it) telling him it was temaz. 

I can't bring my brother back, but this serves as a warning (or a reminder) he had only had 40mg of Valium that day (10mg before he went out) and was dead within two hours of the oxy hit. Please check your pills and don't take shit from anyone unless you know exactly what it is.
RIP bro.",1466888485.0
4pub00,https://www.reddit.com/r/opiates/comments/4pub00/does_anyone_have_any_experience_with_zubsolv/,15,https://redd.it/4pub00,Qball88,Does anyone have any experience with Zubsolv?,Someone I know is trying to sell them to me and from what I have read online it appears to be a suboxone knock off. Has anybody here tried them and if so how did it compare or differ from subs? I'm guessing this one would also require the 24 hour rule right?,1466887508.0
4pu8px,http://imgur.com/hHZvI7N,68,https://redd.it/4pu8px,DOPEDupNCheckedOut,"Since yall liked my last drawing, here's a wallpaper I did on my tablet..",,1466886669.0
4pu6ki,https://www.reddit.com/r/opiates/comments/4pu6ki/so_does_adderall_just_get_cancelled_out_when_you/,7,https://redd.it/4pu6ki,kara_t_chop,So.... Does adderall just get cancelled out when you combine it with dope?,I took 2 15 mg IR adderall and then about 10 min later sniffed my usual 2 bags ....this was like an hour and a half ago and since then I've even taken a nap.... I guess they just totally cancel each other out?,1466885803.0
4pu37k,https://www.reddit.com/r/opiates/comments/4pu37k/i_hair_got_so_lucky/,8,https://redd.it/4pu37k,XxShmidyxX,I hair got so lucky....,I just got 1.3 of the best heroin I ever got in the mail. I decided to take a nice cold bath in almost complete darkness while nodding when suddenly I hear the sound of one of my kittens knocking something off the counter. Okay typical cat knocking stuff over. I look over. My open bag of heroin was right on the toilet seat. After 2 weeks of waiting and 210 dollars almost down the drain literally. ,1466884474.0
4ptr8o,https://www.reddit.com/r/opiates/comments/4ptr8o/poppy_day/,19,https://redd.it/4ptr8o,CoachHouseStudio,Poppy Day!,"The UKs purple opium poppies are ripe for the picking today, so I'll be heading out at midnight on a spree! I've clocked all the locations around town, time for the yearly Purple Poppy Poacher to return! Yaaaaay. Mega amounts of free opiates. My fave day of the year.",1466879789.0
4ptp71,https://i.reddituploads.com/45608d3ab8ff423ea3e1547757038657?fit=max&h=1536&w=1536&s=29fcaafaf40d371d2b04d225f39e910d,10,https://redd.it/4ptp71,PandaBroads,What I don't understand is why the haters get so mad?? It's because they don't have any pills and they're browsing r/opiates! Challenge that LOL,,1466879032.0
4pt6m1,https://www.reddit.com/r/opiates/comments/4pt6m1/my_favorite_rigs/,4,https://redd.it/4pt6m1,Methamphetamouse,My favorite rigs,"After years of trial and error with many syringe brands and types ive found my favorite to be these bd precision glides with 30 gauge yellow luer lok tips. Makes not repoking with a needle if you dont get a vein first try a breeze and once your used to working with the luer lok and seeing blood flow into it your gold.
The plunger is lubricated far better then the regular insulin syringes for some reason if you take a regular orange cap any brand and push the plungers from the top to 0 as quick and hard as you can these always win, lol.
https://imgur.com/a/CKE9r",1466871959.0
