7d1xrl,https://i.redd.it/3nojd8qsq2yz.jpg,0,https://redd.it/7d1xrl,bangbang54,"This is my favorite...menacing guitar played, EXTREME, plus #@$%1 Aside. Lol",,1510723409.0
7d1wyh,https://i.redd.it/g3sotch0q2yz.jpg,4,https://redd.it/7d1wyh,bangbang54,"VERY BAD KIDS lol. Abroad in a French land...no dope unfortunately, but my wife cops these everywhere always...I’ll post my favorite packaging in a second.",,1510723151.0
7d1u0e,https://www.reddit.com/r/opiates/comments/7d1u0e/abscess_in_leg_srs/,4,https://redd.it/7d1u0e,d_func,Abscess in leg (srs),"Everyone pray for me. 

Been in the hospital for 4 days already had 2 surgery's and need 2 more. I had 2 abscesses deep in my leg muscle .


 HARM REDUCTION, PLZ BE CAREFUL",1510722219.0
7d1rmi,https://www.reddit.com/r/opiates/comments/7d1rmi/quick_codeine_fent_question/,1,https://redd.it/7d1rmi,hotcoffeetime15,Quick Codeine + Fent Question,"Heyo,

So I have a ton of codeine but it is mixed with tylenol and caffine, anyone tried to do a standard CWE then create a paste with 50 ML of water and squeeze it through an oral syringe? 

What's the saturation point of the codeine? Can I do 400 mg in 50 ml of water or is 200mg the max? (Almost every board calls for using 200 mg worth of codeine which is fine for a first timer but I like getting proper fucked and with the long ass drying time (wish i had a dehumndifyer) I could do two doses. 

Fent patch I have is 25mcg/h, high any good? It's the only opiate I have not tried and I don't want to smoke it or chop up the patch, apply heat or what have you. 

No tolly but very experienced will dills and oxy being my doc

Keep on keeping on, give Mickey Avalon's first album if you like rap. Guy references opiates like a billion times in it haha.",1510721472.0
7d1qjp,https://www.reddit.com/r/opiates/comments/7d1qjp/smooth_powder_for_the_human_flower/,1,https://redd.it/7d1qjp,Talk_about_things,Smooth powder for the human flower...,"I really appreciate the community of opiate users that exists. If my phone wasn't all the way across the other side of the room I'd share a photo of the lovely junk I have. Goodnight heroin honeys, may the plugs be with you.",1510721145.0
7d1pwz,https://www.reddit.com/r/opiates/comments/7d1pwz/everyone_knows_how_to_detect_fakes_by_now_right/,13,https://redd.it/7d1pwz,AnonymouslyScooby,Everyone knows how to detect fakes by now right? Or at least I thought.. If you dont Im about to really help you out!! Enjoy,"So I just recently saw a post somewhere with a picture of a pill and someone asking if it were fake or not, and I'm not gonna lie this kind of blew my mind.  First that people are still trying to detect if pills are fake or not by looking at it (which I guess can help sometimes but others its impossible and the fakes look better than the real ones) and the fact that by not knowing how to test for this and the current situation of the market these days that its ridiculous and I can only imagine how many times you've been ripped off and will continue to get ripped off, so I thought I'd share this method I learned, and hopefully it will help you guys out in detecting fakes just as much as its helped me.  Enjoy!

When purchasing prescription medication off the street's these days you at constant risk of purchasing fake or imitation shit, claiming to be one medication but in return getting a pill filled with a bunch of fillers and food coloring leaving you on the verge of withdraw and begging for anything just to get well.  So that's why I am going to let you in on a little secret I know, that someone taught me wayyyy back in the day and has been saving my ass ever since.  Because it might not be your dealers intentions to sell you fake shit but you never know when your going to come up on the shit and whether they knew or not you don't want to be the one getting stuck with the shit at the end of the day.  So use these quick couple of steps to test your medications before buying them and hopefully you wont be fucked and posting pictures like the kid mentioned above hoping that you have real shit when you and I both know if hes posting on here asking.. Its most likely fake shit.. 

So lets begin..

How to test if the medication is bunk or not.. 

When purchasing the medication what you want to do is take the pill itself and tap it lightly on your tongue.  I'm not talking slobber all over it, just one simple light tap on the tongue should do and you should be able to tell in a matter of seconds.  Also if done correctly the person your buying them from will have no idea what you even just did nor care because it wont affect the medication what so ever and if you end up not wanting it just hand the shit back and say no its fake and there's nothing they can really do in the first place.  

So don't ask if you can tap it on your tongue just ask to see it and take a few out at random and tap them on your tongue.  If the medication is real when tapping it on your tongue you'll immediately be able to tell.  The pill will have a sour, lemony, prescriptiony pill taste, that can be immediately' noticed and hard to explain but if you a prescription pill of some kind next to you (which I'm sure most of you have ;) ) grab that thing and tap it on your tongue and you will soon see what I am talking about.  Its almost exactly like what a fresh bottle of oxy smells like the second you get them from the pharmacy and open it up for the first time and inhale that beautiful chemical smell into your lungs.  Its that but in taste..


Now if the medication is fake or bunk and the guy is trying to rip you off.  The will will almost have the complete opposite affect once tasting it.  Instead of being pungent and sour and lemony, electric.  It will instead be so bland, chalky, tasteless, and seriously feel like its almost repelling the moisture off of your mouth and will taste like absolutely nothing, except chalk.  



You'd be surprised about how many real looking fakes are out there.  So much so that one time I got sold 1,000 fake pills back in the day and they looked so real that I used to take 2 out of 5 pills and replace them with the fakes and bet people that if they could pick the two fakes out of the group that I would give them the 3 real ones that were in there and let them look at it and examine them in any way possible, yet unfortunately no one knew this technique and no one was ever able to detect the 2 fake ones out of the group, but if they'd of known this method it would of been as easy as 123 and I would of been out of three of my shit.l haha

However, this method hasn't stopped me from buying fake pills since I learned it because honestly most of the time we are getting ripped of the con artist whose doing the deal knows whats going on and will distract you enough to the point where your going to hand the money over before ever being able to get the chance to look at shit.  So you've got to be smart when doing these things, and just remember when its to good to be true, or when you have the feeling you about to get ripped off.. Most of the time you are and you should just get the fuck out no matter how hard that is at times, but just try your best to get out of the situation and definitely don't hand over any money.

Because think, you and I both know that if someone if going to have a problem with you looking at the shit before purchasing it, most of the time its not a good situation.  You don't need to see them all.. Just one will do the trick.  So give it your best shot and just remember this the next time you buying your medication!



Be safe and ENJOY!",1510720956.0
7d1h4d,https://www.reddit.com/r/opiates/comments/7d1h4d/i_fucking_hate_restless_leg_syndromemy_wife_wont/,20,https://redd.it/7d1h4d,bangbang54,I️ fucking hate restless leg syndrome....my wife won’t even sleep in the same bed with me it’s so bad. HELP PLEASEEEE,,1510718305.0
7d1gcs,https://i.redd.it/1imi9xyxa2yz.jpg,9,https://redd.it/7d1gcs,Gelowkzz,Lil homie hook up,,1510718075.0
7d1czv,https://www.youtube.com/watch?v=VyUXhWHAUXU,19,https://redd.it/7d1czv,CounterintuitiveMuir,"Very interesting man; 250 percocets, one day.",,1510717118.0
7d1aiz,https://www.reddit.com/r/opiates/comments/7d1aiz/im_scared/,28,https://redd.it/7d1aiz,PolythenexPam,I'm scared,"I think I have reached my rock bottom, and I'm scared. I've had a habit for about four years, but this past year it has gotten out of control. I have spent $450-$600 on opiates every week, all year long. 7 months  ago my four year relationship ended. He kicked me out, abandoned me, and went to rehab. My parent's are extremely religious, and have made my life a living hell since they found out I didn't hold the same views as them. I have been emotionally abused by them to an extreme extent. If I smoked weed at their house they would kick me out. I have no support from anyone. So, with  no one to turn to, I started shooting five months ago. I have been hustling and doing all kinds of crazy things to support my habit. I do have a job, but I am beyond behind on all of my bills. I'm about to lose everything. Since I live with my parents, they are starting to catch on to my habits. I think they are going to connect the dots sooner rather than later. I've been taking fent pressed pills, so my tolerance is ridiculous. I have tried to go through withdrawal, but I always cave in the first 24-48 hours. I don't know what to do. I am horrified of the repercussions of telling my parents. I am afraid to quit. I don't know where to go for help. Methadone/subs? NA? Any advice would be welcome. Thanks ",1510716426.0
7d190v,https://www.reddit.com/r/opiates/comments/7d190v/hey_hi_hello_this_is_a_question_about_subutex/,6,https://redd.it/7d190v,headintheceilingfann,hey hi hello this is a question about subutex,"alrighty, so I made a new account but I've been on this sub now for about two years. anyways, I bang ecp and usually go through about a half in a day. today, i got my hands on some subutex since dope is impossible to find in my tiny ass NC fuckin' dumb town and i haven't had any the since sunday (fuck me right?) .. I already banged 1 8mg subutex pill and I was wondering if it was worth banging either half or a whole other one. I don't feel as high as I'd like to be but, I don't fuck with subs usually so I don't know if there is a ceiling affect or some other reason why it would not be a good choice if I did another. 

***and yes yes yes, I know how horrible it is to bang pills and I hate doing it but I am taking all the proper precautions while doing it, except for the micron filter. heh, the most important part. anyways, y'all can save the harm reduction stuff OR you can post it for others to be enlightened, but I am aware of the implications that come with IV'ing pills.",1510715994.0
7d18k1,http://traceyh415.blogspot.com/2017/11/the-day-i-tried-to-kill-myself.html,22,https://redd.it/7d18k1,traceyh415,The Day I tried to Kill Myself-,,1510715861.0
7d17jp,https://www.reddit.com/r/opiates/comments/7d17jp/boofing/,13,https://redd.it/7d17jp,heroinsmarionette,Boofing?,So I have some powdered h I had a bun and now I only have two left I'm not nearly as high as I want to be and I'm pretty sure it's because I took a sub yesterday I don't want to IV and I don't even have any rigs. I've been snorting it but I'm wondering would I be better off boofing or some other way and any tips on actually doing so?,1510715584.0
7d17b5,https://www.reddit.com/r/opiates/comments/7d17b5/need_help_cleaning_up_my_act/,2,https://redd.it/7d17b5,AllUpInYaAllDay,Need help cleaning up my act.,"So in case you've all forgotten 3 weeks ago the love of my life had a meth induced heart attack... I was on here reaping and weeping but this has been the hardest week BC im completely out of.money from having to take 8 days off for funeral and my own sanity.

  So I've been in this really dark place fantasizing suicide and planning how to do it. Luckily I've already pawned all my guns or that would've happened already so it's slamming my car into a wall at 9o or taking a nosedive off my apartment building... I don't know if I can wait long enough to get my next check on Monday to just od and go be with my baby.... 

Im just lost man. Im sick of this rollercoaster of wheeling and dealing... I haven't slept for more than 20 min at a time for the past three days and needless to say I've already taken advantage of my family one to many times for them to give me cash... So im stuck in a constant state of hell... 

What is the process to getting Suboxone? 

How much does it usually cost? 

Please don't give an outpouring of ""hang in there man's"" BC that's not what im looking for. I just need help cleaning up my act so I can live for the both of us. 

We both lurk on this sub everyday and love the community.... But yeah what will I expect going to dr",1510715523.0
7d10a0,https://i.redd.it/r9bgjk1tx1yz.jpg,63,https://redd.it/7d10a0,johnnyhorror,"Raw dope?ive never done it before and hes a trustworthy dude..and he said ""bro be careful""...whst the Fuck do i do",,1510713656.0
7d0ybh,https://www.reddit.com/r/opiates/comments/7d0ybh/100_days_free_from_heroinall_opiates_and_pharmacy/,4,https://redd.it/7d0ybh,AwwmanitsRalph,100 days free from Heroin(all opiates) and pharmacy story,"100 fucking days off the needle. Major shoutouts to Suboxone, this sub, my dog, and a great support group. I recently got a dog which has helped tremendously by keeping me busy and someone to love on. It feels good to have a companion like that, I’ve been missing out for a while on someone to feel like this with and my dog was the answer. If anyone feels the same a dog may help some. Here’s a pic of my baby girl: https://ibb.co/du7fsm
I was picking up my subs today and this lady in front of me picked up her meds, walked out then came back in about 2 mins later and claims that she has tramadol missing. The pharmacist in charge of working the pharmacy came up and told her he just filled her script and that there’s no way he shorted her. She kept bitching saying “you’re seriously going to let me go home in pain because you miscounted my pills?” the pharmacist responds with “don’t come into my pharmacy with that. If you want to tell this story of yours, here’s a card to corporate.”. The lady was speechless and walked out.",1510713108.0
7d0x5p,https://i.redd.it/e1zdgbd8v1yz.jpg,2,https://redd.it/7d0x5p,heroinhelga,"Oh, my sweet mistress... how I’ve missed your warm cuddles.",,1510712789.0
7d0ui1,https://www.reddit.com/r/opiates/comments/7d0ui1/emotional_roller_coaster/,10,https://redd.it/7d0ui1,barondicklo,Emotional roller coaster.,"Shit so my main guy of damn near 5 years is taking his shit to the south to slang. My other main said he wont have any for a while cause his plug is selling bullshit. So i hit up a dude i was super close to when i was 19 (am 24) so i hit him up the other day he served me some absolute fire, so I hit him uo today and he pulls up to my house and serves me. I get inside crack open the folded lottery ticket and its empty, I text him and tell him whatsup. He tells me to let him call his guy real quick and im thinking i just got ducked and im SOL. 15 minutes later he tells me to come outside. Dude made it right!!!!!!!!!!


Idk if he did it because he needed the cash to go cop my shit or what but either way what a fucking trip mannnnn. Hows eveeyone elses tuesday going? Omfg i really rhought i got duckes over",1510712021.0
7d0mv1,https://www.reddit.com/r/opiates/comments/7d0mv1/its_good_to_be_back_in_a_way/,5,https://redd.it/7d0mv1,binge_chipper,"Its good to be back, in a way..",Oh man ive missed nodding. I can barelt type and have been on the toilet for 15 minutes trying to piss.nm no luck. However I am just barely consciously so I cant complian.how are you guys doing tonight?,1510709969.0
7d0lrk,https://www.reddit.com/r/opiates/comments/7d0lrk/fucked_up_big_time_got_arrested_car_got_towed/,33,https://redd.it/7d0lrk,OlDirtyBurton,Fucked up big time. Got arrested. Car got towed.,"Girls pissed.... Got pulled over cause I had to run back down to work to get my phone charger and my car is loud as fuck. Aggravated dwi (.18 or higher) Open container (Empty bottles of vodka count as open containers i guess), and a muffler ticket...

I had an old (olllllddddd) back pack in the car and they found old rigs in one of thepockets I dont use.... but didnt write me a ticket for that thank god.

I already know my girl thinks im the biggest fucking retard on the planet so let's hear it.

Tl;Dr ODB said fuck that police and they didnt listen",1510709660.0
7d0lr5,https://www.reddit.com/r/opiates/comments/7d0lr5/hi_i_am_not_an_opiate_user_but_i_have_a_question/,17,https://redd.it/7d0lr5,NewChristianThrwwy,Hi I am not an opiate user but I have a question only you guys can answer. I have a feeding tube and sometimes I have to take supplements or medicine through it. What are the best ways to liquify pills? Pill crushing isn't really that effective. Causes clogs. Thoughts?,,1510709657.0
7d0l87,https://www.reddit.com/r/opiates/comments/7d0l87/fuck_my_life_got_robbed_and_ran_over/,48,https://redd.it/7d0l87,Blazing_blue_burrito,"Fuck my life, got robbed and ran over","People are shit heads. A family member got their script of blues today and gave me 45 to sell. I had the deal set up a week in advance, through who I thought was my friend as his weed dealer wanted them. I had them meet me at a library to try to reduce any potential chaos. Deal was he'd give me 900 and some weed. Dude pulls up in the parking lot, I go to get in the back seat, but of course they have a bunch of shit in the back seat so there's no room. So I go to the passenger side window, he hands me an envelope that was supposed so have money with it and was about to hand me the weed when I open the envelope to make sure it's all there and it's just paper. The guy grabs the pills out of my hand and the driver hits the gas, I jump in through the window with half my body hanging out trying to grab them back, dude punches me in the face and is trying to push me out when I punch him in the face, I lose my grip and he gives me a good shove and I fall out, the back tire runs over my right hand and foot, and I split open my skull on the pavement. Such bullshit. I've never ripped off anyone and yet this shit happens to me. I should have been smarter than i was though. I went to the er which was luckily right next to the library and got 6 staples in my head and my foot patched up, it wasn't broken but had a bunch of scrapes and somehow a hole like a half inch deep. Surprisingly they gave me a Norco and a script for twelve which ain't really shit when you're used to banging heroin but it's at least something to save for an emergency. I just hate that people have to be so shitty. I would have just traded for weed but nope these guys had to be assholes. I at least know too where my ""friend"" lives and he's gonna be getting something way worse back. Bunch of cock suckers.",1510709518.0
7d0k6d,https://www.reddit.com/r/opiates/comments/7d0k6d/shitposr_drunk_and_scared/,16,https://redd.it/7d0k6d,Ms_takes,Shitposr drunk and scared.,Today I found out that I have to have a hysterectomy. I have two beautiful children but still this is difficult news. I found out that I have to have intense foot surgery and the hysterectomy all in one day. So now I am drunk and feeling sorry for myself.,1510709229.0
7d0jmw,https://i.imgur.com/AAapq3g.jpg,14,https://redd.it/7d0jmw,slimeslug97,Exploderz vs xtremes bites... which do u prefer,,1510709082.0
7d0iuw,https://www.reddit.com/r/opiates/comments/7d0iuw/how_would_you_combat_the_opiate_epidemic/,7,https://redd.it/7d0iuw,Yoyoyoyoyoy7,How would you combat the opiate epidemic?,"The U.S. has an ""opioid crisis"" what would you do to combat the issue? I'm clean now and was thinking what would've stopped me from using? Honestly I'm not sure anything would have I was curious as fuck. That's not to say that there aren't case's that could've been prevented. I wanna hear about what you think would have prevented those cases.

I have a couple ideas that would change perception at a young age maybe help in the future that I'll post soon.",1510708857.0
7d0i7c,https://www.reddit.com/r/opiates/comments/7d0i7c/was_talking_to_one_of_my_friends/,8,https://redd.it/7d0i7c,bagzplz,Was talking to one of my friends,"He's a bit naive to drugs and he mentioned that a friend of his was saying that they should boof! Ya know? Boofing? Where you blow cocaine into a girl's butthole with a straw?

Where the hell are these kids learning this shit? The misinformation is so rampant. Gave me a good chuckle though before I explained what people usually mean by ""boofing"".

So who wants to volunteer for some good ol fashion white girl booty tootin?",1510708685.0
7d0dl7,https://www.reddit.com/r/opiates/comments/7d0dl7/heads_up_michiganders_roadside_drug_testing/,18,https://redd.it/7d0dl7,ThrowOp1,HEADS UP MICHIGANDERS: Roadside Drug Testing Begins In 5 Counties,"They are doing a test run of this new Roadside Mouth Swab practice in a few counties. They have 90 days to compile a report and send it to Michigan State legislature. They will then decide if they want to expand to a few more counties, the entire state, or shut it down.

If the officer suspects a person is under the influence of drugs they will ask if you want to submit to a mouth swab. You can say No. If you say no then they will give you a civil infraction (Better than jail).

The 5 test counties are: Berrien, Delta, Kent, St. Clair, and Washtenaw counties 

http://www.freep.com/story/news/local/michigan/2017/11/08/michigan-pilot-evaluate-roadside-drug-testing/843871001/

IMO this practice is beyond fucked up because drugs stay in your system for a while and just because you are positive doesn't mean you are impaired. Seems like this is just another money grab that will ruin peoples lives",1510707457.0
7d0b7n,https://www.reddit.com/r/opiates/comments/7d0b7n/feeling_like_spongebob_shit/,3,https://redd.it/7d0b7n,throwawaymybho,Feeling like Spongebob (SHIT),"Tryna tell myself ""I don't need it... I don't need it.""

But I aint lying when I tell ya that I'm doing every goddamn thing in my power to not unblock my plug and ask for a 20. I had a dream about dope last night and it was a big trigger and I've been trying to distract myself all day but my mood has hit a low point. Think I might try to go to a meeting tonight but I always feel kinda weird at NA because there are so many career junkies (not trying to be an asshole just being real) who have stories that make mine sound like campfire tales. IDK what this post is for other than to vent, don't really have anyone else to talk to about this kind of thing with so I usually just come here.

Hope everyone is well (figuratively and literally) today. Happy nods and please be safe, yall! ",1510706820.0
7d0a9w,https://www.reddit.com/r/opiates/comments/7d0a9w/anybody_else_feeling_the_effects_of_the/,67,https://redd.it/7d0a9w,ThrowOp1,Anybody Else Feeling The Effects Of The Nationwide Crackdown On Prescription Pills?,"DEA has investigated basically every doctor in my city. Doctors have Cut EVERYBODIES scripts in half, and then in half again. Street value of hydrocodone has gone from like 3-4 bucks to as high as 12 bucks. 

Not really sure this is the best way to go about the War on Opiates. Youd think targeting Heroin first would be the best strategy. Attacking the lower level opiates pills seems like it could force people to go looking for heroin to get their fix if they cant get their pills.

Thoughts? Experiences?",1510706591.0
7d0a16,https://www.reddit.com/r/opiates/comments/7d0a16/shit_post_oxy_is_so_lame/,4,https://redd.it/7d0a16,brnt245,Shit Post :Oxy is so lame,"How can 5 mg Roxy and 2mg Xanax cost the same price ???
I usually just bang heroin when I want a downer but my dealer only had this shit. 2mg Xanax gets me fucked but 20m g Roxy literally makes me feel nothing.  

I just want some dope , tryna get over this crystal withdrawal  FML  

2 more days of drinking and opiates then I'm straight edge vegan again; aka the most fun party guy . Fuck stimulants there the devil to me.  

5 years sober and I ruined it all with a 40 day meth binge.  I'm so fried !",1510706530.0
7d08ay,https://i.redd.it/xbhc7wk5b1yz.jpg,9,https://redd.it/7d08ay,swegmoney69420,Its not much but it’s always nice to go pick up some of these and unwind after a long day at work!,,1510706037.0
