ah5l43,https://www.reddit.com/r/opiates/comments/ah5l43/best_friend_is_going_to_rehab_tomorrow_should_i/,25,https://redd.it/ah5l43,blisscomfort12,Best friend is going to rehab tomorrow. Should I continue to let him get high tonight?,I know it sounds shitty but my best friend is going to rehab tomorrow finally after this five month relapse. He’s obviously getting high as a kite tonight and even using in front of me which he has NEVER done. I’m here for harm reduction and even gave him the unused needles I took from him throughout the months. He’s so out of it it’s making me pissed off and I want to just narcan him. How long after narcan can they get high? Is this me being petty? Honest answers and no judgment please. ,1547777736.0
ah5kqy,https://www.reddit.com/r/opiates/comments/ah5kqy/kratom/,6,https://redd.it/ah5kqy,Shazam1203,Kratom,So I am in pain management and ran out early.. I know .. my fault. I bought some Kratom that comes tomorrow. Would that get me by for a week so I don’t get withdrawals?,1547777667.0
ah5imv,https://i.redd.it/27rjy6wua3b21.jpg,5,https://redd.it/ah5imv,timlox,Should i be worried,,1547777275.0
ah5i7z,https://www.reddit.com/r/opiates/comments/ah5i7z/can_i_fly_into_the_states_with_my_legally/,6,https://redd.it/ah5i7z,SelfAM,Can I fly into the states with my legally prescribed methadone?,"I'm a Canadian looking to fly into California this summer to visit one of my dear friends. However, I'm prescribed daily methadone and am worried I'll get turned away, especially with the presidents stance on Canadians and marijuana. I've tapered my dose down to 13 mg so far, I don't know if the dosage matters much. 

Has anyone else had any experience with this?",1547777197.0
ah5fnv,https://www.reddit.com/r/opiates/comments/ah5fnv/kratom_fucking_blows/,19,https://redd.it/ah5fnv,roygbivA2,Kratom fucking blows,"I ain’t never had much of a habit, just use narcotics “medicinally” but all my cancer patients died and methadone doesn’t really fit my lifestyle.

I’ve been steadily on 1-1.5 grain/day morphine equivalent for like 20 years w very few breaks and... kratom is making me feel like shit.

Like- yea this is cool not being sick but I feel like crap and can’t concentrate on anything.  I feel like I took some low grade psych meds.

This is day 4 of the kratom experiment and... bleh

People like this stuff?

I gotta admit, it does kinda help w the pain in my spine.  Better than ultram or any anti-inflammatory They need to extract whatever these chemicals are and get rid of the shit that’s making me feel like I smoked some Prozac ",1547776725.0
ah5dkc,https://www.reddit.com/r/opiates/comments/ah5dkc/hey_guys_i_need_some_tips_help_advice_anything/,7,https://redd.it/ah5dkc,toomeitlookslikeart,Hey guys I need some tips! Help! Advice! Anything! Please and thank you in advance.,"Sooo, I’m trying to stop doing blues.. (Oxys30s) It’s not my first time stopping but I’ve seen a post awhile while ago where there’s a lot of different stuff different people tried and made the withdrawals more Bearable. If you have anything I’d really appreciate it. Such as food, vitamins, teas, or supplements that will help in anyway? I contemplating whether or not I’m going to take Suboxone and if I do so what I shouldn’t mix with the subs or what’s okay to take with it. I’m definitely going to take some CBD oil which helped me last time. Anyone have any experience with cbd oil and withdrawing? Anyways, I came here because this sub is where I feel more comfortable asking and where ppls response is genuine! Thanks! Stay safe my dudes  💗",1547776347.0
ah5d9v,https://www.reddit.com/r/opiates/comments/ah5d9v/opifam_please_explain_to_me_what_appeal_nodding/,12,https://redd.it/ah5d9v,Percoprincess,"Opifam - Please explain to me what appeal ""nodding"" has to you? Why do you like it?","Oxycodone with APAP is my jam (my username should check out), and part of what I love about it is the energetic but not tweeked-out high. I love that warm, fuzzy, even the most boring activity is just alright feeling. On some occasions when I've only been able to get straight oxys without the APAP though, I've overdone it and ended up nodding. I HATE that! Yeah it felt good during the conscious parts, but the uncontrollable falling out of full consciousness/into a sort of dream state and popping back alert just long enough to take a couple drags of a smoke did nothing for me. I want to be fully conscious to enjoy feeling good. I want regular life enhanced. So I don't get why nodding seems to always be the goal for other opiate fans. Please tell me why you dig it; I really want to understand what the appeal is.",1547776291.0
ah5bj8,https://www.reddit.com/r/opiates/comments/ah5bj8/all_i_want_to_do/,3,https://redd.it/ah5bj8,drespanda,All i want to do,All I want to do is get high but even me getting high don't help n now all I want to do is od n I can't even do that I'm so fucking down it's killing me I don't want to live I'm tried I fucked everything up I lost the only person I really want to be with n I really fucked that up n now the person I'm with I don't even want to be with I want the person I was with back but idk if I'll get him back sucks so much wake up screaming every time I sleep I wake up yelling or crying n I'm just so tired I just want to hold him so bad n today was so hard cuz I got to see him n got do bags with him I didn't want to let him go I fucked up but it was soo fucking nice to hold him n give him a hug I didn't want to end FML now I'm with this person I don't even want he puts me down so much n fucks with my mind idk wtf to do cuz I don't want to be alone tho FML I just want to die n I can't even do that all my friends are dieing too ugh idfk anymore I'm crying it's so said n not fair I'm 28f n if u reading this the one I want to be with I do love u bro n I'm so sorry ,1547775966.0
ah5b7a,https://i.redd.it/my4li0vw63b21.jpg,5,https://redd.it/ah5b7a,CaptainEngage,Happy Refill Day!,,1547775909.0
ah58wx,https://www.reddit.com/r/opiates/comments/ah58wx/my_plug_is_lame/,33,https://redd.it/ah58wx,jbenso30,My plug is lame..,"I started going to this connect in the middle of 2017 daily, and they were the best. It's a husband and wife from Honduras, that's why I say ""they"". I'm going to give you all a little timeline so you can understand my frustration a little more. 

The first 6-8 months they didn't have a vehicle so when I'd call to meet they'd have me go to their apartment building and they'd be out within 5 minutes of me arriving every time, majority of that time they'd be waiting for me outside cause they knew it only took me 8 minutes to drive there. They would give me 2 free b's almost every single day just because I would spend a minimum of $60 a day, a lot of times I was spending over $150 a day because I would get white as well. I would also get a free one every $100 I spent on top of the 2 free ones. It was great. They also would need a ride a couple times a week and it's always be to the same place 15 minutes away, and they would give me 2&2 ($40 worth of shit) for the ride. 

After that 6-8 months they finally got a vehicle. They'd give me a meeting spot and sometimes they would wait for me to arrive or I'd wait for them to arrive, it was never a long wait. They cut back on the free ones they would give me just because. They always would do a free one every $100 spent, but they stopped giving me 2 free ones every day, but would still do it once or twice a week. It was still awesome. I expected no freebies because they would be having more expenses because of their vehicle. This went on until about October of 2018. During that year and a half I probably was fronted $80 worth of shit a couple times a month. I got my first front after going through them for several months and because I always paid them back when I said they did it whenever I needed it. Then in October they said they could only front me 1&1 at a time, even though I never was late on a payment, but I said okay because it was better than nothing on the days I needed the help. They also stopped giving out free ones at that time too, other than the one every $100. I was bummed but it was whatever. Then out of nowhere yesterday I asked them for a 1&1 front for the first time in a month and they said no because they do not trust anyone anymore so no credits.. I was confused cause I always paid when I said I would, so I mentioned that to them and they responded with ""I cannot see you anymore because you ask again when I said no more"" so I said ""I only asked why because I always pay"" and they said ""It does not matter I do not do credit anymore"" so I just spent last night sick, got my paycheck today and hit them up and it rang all the way through and no answer. I wait 15 minutes, because they'd always call me back instantly. So I call them again and it rings once and goes to voicemail, so I assume they screened it because they were busy so I try again 10 minutes later and same thing. At this point I think it's odd so I try 4 more times within 20 minutes and the same thing everytime so I call on my house phone and it rings through with no answer and I know they dont recognize the number so i call right back and she answers and hears it's me and hangs up.. So I call again and it rings once and goes to voicemail, and kept doing that every call. So they blocked my number and were for real when they said they wouldn't see me anymore.. I spent over a grand a week for majority of the 2 years I used them, and minimum $400 a week and yet they block me for asking for a front when they had done it over 40 times for me.. They used to be the best and gradually got worse for some odd reason and then blocked me for the stupidest shit. Fuck em. 

Sorry I wrote this on a phone. 

TLDR: Honduran connect that I've been using for 2 years, and would spend over a grand a week on their stuff, blocked me this morning because I asked for a $20 front, when I've had 40+ fronts in those two years and always paid back on time, every time. Majority of those fronts were $80 fronts at a time too. ",1547775491.0
ah56uw,https://www.reddit.com/r/opiates/comments/ah56uw/first_shit_of_2019/,9,https://redd.it/ah56uw,rich_homie_quiz,First shit of 2019,Lmk if y’all wanna see pics. Probably about a foot long 2 inch diameter. Felt like I got raped. I cried a little. Shooting fetty about it now. Holler ,1547775103.0
ah565f,https://www.reddit.com/r/opiates/comments/ah565f/unused_insulin_syringes/,2,https://redd.it/ah565f,weinerjuice,Unused insulin syringes,"Hey everyone so referring to the title, I have a bunch of unused insulin syringes that my dad used to use but doesn’t and has no need for them. I know the whole op sec thing but couple questions 

Would these for y’all?

How would I get these to people who need them?

Just wanna be helpful if someone can help me help everyone that’d be appreciated",1547774962.0
ah53qa,https://www.reddit.com/r/opiates/comments/ah53qa/3_days_after_reaching_my_90_day_milestone_i/,6,https://redd.it/ah53qa,dori_88,3 Days After Reaching My 90 Day Milestone I Realize How Cunning Addiction Is...,"So..., instead of relapsing, I'm reaching out. After all, I'm the same person who posted this at 84 Days Clean:

[https://www.reddit.com/r/REDDITORSINRECOVERY/comments/adq5h7/im\_starting\_to\_enjoy\_being\_clean\_again/](https://www.reddit.com/r/REDDITORSINRECOVERY/comments/adq5h7/im_starting_to_enjoy_being_clean_again/)

It's amazing how cunning this disease truly is. One moment, you've got it in the bag. Sobriety is easy. It's achievable & 100% possible. Then, the next, the world is coming to an end. You're dying without your drug of choice. You need it to survive, and the reality of that is that it's not necessary.

I don't know, but I heard talking about it all takes the power out of it. So, that's what I'm doing.",1547774513.0
ah4yro,https://imgur.com/BzmxfLO.jpg,0,https://redd.it/ah4yro,ForeverStoned420,More pinks an better Benzos,,1547773601.0
ah4yll,https://i.redd.it/h9g3mgoxz2b21.jpg,5,https://redd.it/ah4yll,keyvan022,Some China white &clonazpam & alprazolam 😁,,1547773572.0
ah4w5t,https://www.reddit.com/r/opiates/comments/ah4w5t/if_you_taste_your_dope_when_snorting_it_are_you/,4,https://redd.it/ah4w5t,leighanne1990,"If you taste your dope when snorting it, are you wasting it? (Cross posted)","I’ve seen people say the most effective way to snort dope is to sniff small bumps every few minutes instead of doing lines. And if you’re tasting your dope then you’ve done too much at once and it’s just going to your stomach (being wasted). 

Is this true? 

I usually do lines and I usually taste the dope. But I know not to sniff really hard where it all goes straight down my throat. Sometimes it takes a few minutes for me to even taste it, sometimes it’s immediate. 

Just curious what everyone’s thoughts are. 

",1547773114.0
ah4vqx,https://www.reddit.com/r/opiates/comments/ah4vqx/which_sugary_treat_do_you_eat_shameful_amounts_of/,30,https://redd.it/ah4vqx,2ndwaveobserver,Which sugary treat do you eat shameful amounts of while high on opiates?,"For me it’s strawberry shortcakes (little Debbie) and vanilla Zingers. I pretty much just went through a box of each and yes I know it’s ridiculous. Haha I just can’t stop myself! 

So many people don’t realize that sugar is one of the most dangerous and possibly the most addictive substance we consume. I read somewhere before that according to brain scans, sugar “lights up the brain like a pinball machine” in comparison to other stuff like cocaine. 

Hell it can make you fat. Your teeth will rot out of your head. Diabeetus. There are real withdrawal symptoms when suddenly stopped. I’m pretty sure there are other diseases related to sugar. 

We just love it so much that we won’t even pretend to act like we care about it’s negative sides. It’s just so good. 

My name is 2ndwaveobserver and I’m addicted to sugar. ",1547773044.0
ah4u5w,https://i.redd.it/8qv4q7kkx2b21.jpg,3,https://redd.it/ah4u5w,northeastBops,It’s from this collection,,1547772769.0
ah4tpt,https://www.reddit.com/r/opiates/comments/ah4tpt/so_far_ive_found_one_thing_that_is_similar_to_how/,8,https://redd.it/ah4tpt,5thmeta_tarsal,"So far, I’ve found one thing that is similar to how I felt after snorting a blue. The moment I come when masturbating while also listening to good ass music.","No, I’m not masturbating to music. But after I come, I get the urge to listen to my favorite music, but I don’t always stop masturbating. I don’t know what to do with this information. Instead of snorting a pill in the bathroom at work, I should rub one out with headphones in to keep going on my shift? Like Wolf of Wall Street? Fuck",1547772685.0
ah4nsc,https://www.reddit.com/r/opiates/comments/ah4nsc/spotting_a_fake_m_box/,14,https://redd.it/ah4nsc,northeastBops,Spotting a fake M box,Hey guys so I have a question for anybody who knows. Is an Mbox automatically fake if the line isn’t perfectly parallel horizontally across the backside?  ,1547771639.0
ah4nko,https://www.reddit.com/r/opiates/comments/ah4nko/stay_safe/,4,https://redd.it/ah4nko,JAdam99,Stay safe!,"Hey guys I’ve just stumbled across this subreddit and I just want to make a quick post just to say I hope you all stay safe out there! I’m not very knowledgable on this shit and I know I have no position to post, but I know a few opiate users and seeing them and some of the posts from people who have passed on this subreddit has really freaked me out. So I hope you guys stay safe, have a great night and a great rest of your year!",1547771602.0
ah4nfx,https://i.redd.it/ruvtyyj1u2b21.jpg,33,https://redd.it/ah4nfx,dw1209,What’s your favorite flavor? Didn’t use to like em much but The A51’s are growing on me they break down into the smoothest powder,,1547771580.0
ah4kfz,https://www.reddit.com/r/opiates/comments/ah4kfz/whats_wrong_with_this_black_tar_heroin/,3,https://redd.it/ah4kfz,lyftdriver99,What’s wrong with this black tar heroin?,My dealer got a new batch recently. It looks the same as his other stuff but it’s not. Usually when I dissolve the tar in water it turns black pretty quickly. This stuff actually turns brown and the water kind of thickens up. It’s the color or mud so instead of black it’s like brown. It’s really hard to suck it up the syringe too. What does this mean? Have y’all ever encountered this with BTH? ,1547771068.0
ah4k2c,https://i.redd.it/lgnhqplbs2b21.jpg,7,https://redd.it/ah4k2c,rikkuuc,How people with low tolerance have fun,,1547771002.0
ah4imh,https://www.reddit.com/r/opiates/comments/ah4imh/80_days_clean/,23,https://redd.it/ah4imh,bluhrred,80 days clean,Literally can’t believe that I’ve made it this far. Past few years haven’t went a few hours without dope... This time I quit without subs or anything. Hard to believe I can feel normal without something in my system. Keep on pushing everyone sobriety is possible!,1547770740.0
ah4dhw,https://i.redd.it/fj0dgon0p2b21.jpg,35,https://redd.it/ah4dhw,BLUE-THIRTIES,Getting the birthday supplies for the weekend ready !,,1547769900.0
ah49j8,https://www.reddit.com/r/opiates/comments/ah49j8/question_about_withdrawals/,13,https://redd.it/ah49j8,gofmanteca,Question about withdrawals,This is gonna sound stupid has anyone gone two days or so without feeling sick ? Reason I ask because I been sniffing dope for about a year almost daily and a few weeks ago I decided to see how long I can go without and I made it two days without getting sick before I got nervous and used again.. is this normal ? Anyone have similar experience ?,1547769194.0
ah3sp5,https://i.redd.it/59cg3zhle2b21.jpg,14,https://redd.it/ah3sp5,3hunnamax,Soldiers in line,,1547766384.0
ah3sgq,https://i.redd.it/a1yu5adhe2b21.jpg,27,https://redd.it/ah3sgq,3hunnamax,Some Krispy Kreme and blues,,1547766346.0
ah3o0m,https://i.redd.it/l0w7fubcc2b21.jpg,35,https://redd.it/ah3o0m,roxxx1234,Clean for 13 days but plug said he had again....couldn’t say no. So begins the cycle again,,1547765628.0
ah3gsh,https://www.reddit.com/r/opiates/comments/ah3gsh/morphine_pills/,7,https://redd.it/ah3gsh,King_Charles_42,Morphine pills,So a homie of mine told me he had morphine pills and asked me if I wanted to take some. We swallowed a pill each I think it was 10 or 15 mg. We waited hours and didn’t feel anything. Was it a dud or is there a better way to take them? Parashooting/snorting? Not down to shoot up.,1547764437.0
ah3goe,https://i.redd.it/i466otsq82b21.jpg,15,https://redd.it/ah3goe,fentfiends,Thank you junkie Jesus,,1547764418.0
ah3fst,https://www.reddit.com/r/opiates/comments/ah3fst/1st_time_overdose/,8,https://redd.it/ah3fst,nousername69,1st time overdose,So as the title mentions tonight I had my first overdose. I have been there and saved several people in the past so I like to think my boy who saved me was there for a reason. Went into his basement and I did 3 bags of the same shit I've been getting for weeks and then next thing I know I'm surrounded by EMTs and a cop all asking questionable. 75% of me wishes he would've just left me but it being his House I understand not wanting someone to die in it. ,1547764283.0
ah3aaw,https://www.reddit.com/r/opiates/comments/ah3aaw/can_i_prep_a_rig_and_leave_it_sit_for_about_3/,6,https://redd.it/ah3aaw,CinemaFlix,Can I prep a rig and leave it sit for about 3 hours in my bag?,,1547763421.0
ah2chh,https://www.reddit.com/r/opiates/comments/ah2chh/are_painkillers_legal_or_otc_in_netherlands/,9,https://redd.it/ah2chh,DocileFit,Are painkillers legal or otc in Netherlands?,"Just as title states, or any EU country",1547758308.0
ah2zxv,https://www.reddit.com/r/opiates/comments/ah2zxv/help/,26,https://redd.it/ah2zxv,tampaveniceodessa,Help!!,"I got pulled over. For not paying attention flew by the cop like a dumb f*** he was stopped at the railroad track that was shut down and I went flying up on him. Anyway long story short he can man in my idea gave it to him he seen the blood still on my f****** arm where I just shot up. M*********** let me go though I have no idea why you let me go and I should have crazy he had me busted red handed. Or red inner elbow should I say.

I swallowed the bag while he was running my ID. How do I get this s*** out fast?",1547761826.0
ah2th2,https://www.reddit.com/r/opiates/comments/ah2th2/methadone_bloody_poop/,12,https://redd.it/ah2th2,slavicturk,Methadone bloody poop,"I’ve been on methadone for about 2 months and every time I go to take a shitter, my poop is very bloody . I’m on 130 mg , is there anyway to make this side effect go away? Also what’s the best potentiator for methadone ? ",1547760825.0
ah2plb,https://i.redd.it/w2ma4mnjw1b21.jpg,76,https://redd.it/ah2plb,Sooooooorganic,A lovely trip back home for the holidays....oh how I’ve missed this,,1547760315.0
ah2nmn,https://i.redd.it/dmeii8vnv1b21.jpg,12,https://redd.it/ah2nmn,Scribes714,Afternoon smoke before eating beef stew with the family. Happy Thursday peeps 🙃,,1547760019.0
ah2kuo,https://i.imgur.com/oJWBrTy.jpg,6,https://redd.it/ah2kuo,Twinkiepocalypse,Came in a vacuum sealed gold package..,,1547759579.0
ah2jxb,https://i.redd.it/vf41ayhxt1b21.jpg,26,https://redd.it/ah2jxb,Euphoriccrush,Produces lots of magical powder,,1547759437.0
ah2gbf,https://www.reddit.com/r/opiates/comments/ah2gbf/heat_sealed_bags/,14,https://redd.it/ah2gbf,Fjdope,HEAT SEALED BAGS?,"Is the anywhere in the US that still has double sealed bags of H? I'm not talking about zip locks but rather heat sealed bags that the north east used to have. Thanks, not trying to be specific as far as location is concerned. Just want to know if they still exist and why they are not around like they used to be. ",1547758891.0
ah2ee3,https://www.reddit.com/r/opiates/comments/ah2ee3/dissolving_oxycodone_in_water/,4,https://redd.it/ah2ee3,wayno1130,Dissolving Oxycodone in water,"I'm tapering off oxycodone and I've gone from 180 mg a day to about 37- 45mg daily. I break a 30 mg into quarters and take 7.5 mg each. I need to take less per dose around 3.75mg,  so I've been told to use liquid titration and dissolve a quarter of a 30mg pill (7.5) in water and and drink half and half later as part as my taper .
My question is do I dissolve it in water  or do I crush first then put in water ? 
Also how much water do I use?
Any help would be greatly appreciated",1547758602.0
