ahtv17,https://www.reddit.com/r/opiates/comments/ahtv17/why_does_h_make_me_dizzy_nauseous_and_drowsy/,16,https://redd.it/ahtv17,spinox,"Why does H make me dizzy, nauseous, and drowsy?","I've been doing H for almost a year now I think. Last year, I had some fire dope that had the best legs and lots of euphoria. The past couple weeks, I've ordered from 3 different vendors on the onion fields. Every batch just makes me feel like absolute shit with no high at all. Is there something wrong with me or am I getting really bad product? Has anyone else experienced this? ",1547955825.0
ahtsy7,https://www.reddit.com/r/opiates/comments/ahtsy7/heroin_first_time_use/,15,https://redd.it/ahtsy7,klc2018,Heroin first time use?,How much would this amount of heroin cost you on average and what type of heroin is it? I have a 100-150mg oxy tolerance. How much would you suggest I snort? Not interested in IV. ,1547955370.0
ahtrfg,https://i.redd.it/siksbz8lzhb21.jpg,5,https://redd.it/ahtrfg,goodbudnroxies,Lil score for the night,,1547955050.0
ahtpka,https://www.reddit.com/r/opiates/comments/ahtpka/i_got_5_8mg_how_should_i_take_them_to_detox/,13,https://redd.it/ahtpka,sniffle_whiffle,I got 5 8mg.. how should I take them to detox?,"Sorry didnt mention in title. 8 mg suboxone. What mg should I take each day 

Day 1 = 8

Day 2 = 6

Day 3 = 6

Day 4 = 4

Day 5 = 4

Day 6 = 2

Day 7 = 2

Day 8 = 1 mg

Day 9 = .5 mg 

Day 10 =.5 mg
",1547954613.0
ahtlem,https://www.reddit.com/r/opiates/comments/ahtlem/i_have_3_main_dealers_all_of_them_are_trying_to/,10,https://redd.it/ahtlem,EskomojoE,I have 3 main dealers all of them are trying to give me free shit right now,Fuck this quitting sucks. I know its temporary and for the best but fuck i wish i could just fast forward time right now,1547953720.0
ahti3v,https://i.redd.it/rh3x2w4nthb21.jpg,6,https://redd.it/ahti3v,Vealosophy,🤣🤣💀☠,,1547953048.0
ahtdg3,https://www.reddit.com/r/opiates/comments/ahtdg3/anyone_in_the_medical_field/,46,https://redd.it/ahtdg3,Rec4fun,Anyone in the medical field?,"Ok so I know it’s taboo or whatever to talk about. But is there anyone here that uses recreational drugs? I enjoy opiates and benzos occasionally, maybe more then once a week. I know it’s frowned upon in this field. And no, I have never diverted drugs or stolen anything. Although I have the opportunity, I know better. Anyone else out there?",1547952084.0
ahtc18,https://www.reddit.com/r/opiates/comments/ahtc18/if_someone_hits_you_with_narcan_can_you_take_a/,7,https://redd.it/ahtc18,bitchsnack,"If someone hits you with narcan, can you take a suboxone immediately?",My friend and I were just talking about this and we aren’t really sure. Would it still send you into PWDs since you go into full blown WD when you’re hit with narcan (assuming you had a habit when you were hit with it)?,1547951803.0
ahtblb,https://www.reddit.com/r/opiates/comments/ahtblb/incognito_paraphernalia/,17,https://redd.it/ahtblb,BLUE-THIRTIES,Incognito paraphernalia.,"Is there any kind of paraphernalia we can use as opiate users to sniff our amazing powder that is incognito to the normal person? Cut up straws get me caught every time by my SO, my mother etc etc. Anyone use something other than a dollar bill that would have a normal non-drug user not think twice that it would be used to sniff anything????",1547951712.0
ahtbh4,https://www.reddit.com/r/opiates/comments/ahtbh4/please_be_safe_out_there_its_getting_cold/,17,https://redd.it/ahtbh4,CYPROXY,Please be safe out there. It's getting cold.,"There's a cold snap coming towards the East coast. If you're living on the street or without heat do what you can to stay warm. I dread winter with a passion and having to choose whether to eat or stay warm sucks. I chose to eat and am paying dearly for that choice as I cannot afford the few gallons of kerosene it would take to keep me warm for a few days. The closest shelter is 30 mins away at that. 

Suffice to say that I'm feeling particularly empathetic with those on the street when it starts to get really cold so please take care of yourselves.
Much love 'yall.
",1547951682.0
aht9d4,https://www.reddit.com/r/opiates/comments/aht9d4/fuuuuuck_i_jist_read_that_glutamine_can_cause/,19,https://redd.it/aht9d4,Inquiringtoinspace,Fuuuuuck. I jist read that glutamine can cause tinnitus. What sleeping pills are safe? Benadryl is anti chollergenic... Benzos dont work. Melatonin not strong enough. Wtf?/mirtazipine no good... What is there left? Pls help.,Don't know what else to say. Oil makes me miss work... What IS there?,1547951245.0
aht9su,https://www.reddit.com/r/opiates/comments/aht9su/anyone_else_experience_burning_when_iving_black/,3,https://redd.it/aht9su,marshagoldbergg,Anyone else experience burning when IV'ing black?,"When I have it in the vein it burns, almost feels like acid going in and no I'm not missing or getting an artery either. Anyone else experience this? I feel it and its good stuff but it just burns really bad going in. Help?",1547951339.0
aht2pb,https://imgur.com/GTo5Qg3,1,https://redd.it/aht2pb,DegenerateDrugUse,Shmoney,,1547949866.0
ahsz00,https://www.reddit.com/r/opiates/comments/ahsz00/in_a_pharmacy_talking_to_owner_who_had_access_to/,4,https://redd.it/ahsz00,Inquiringtoinspace,In a pharmacy talking to owner who had access to all sleeping drugs. Pulled out my midazolam. Owner gives me free glutamine. It is the best sleeping drug on the planet.,"L-glutamine. Melatonin leaves this mid/seroquel addict (former) sleepless. Just took 3gs l-glutamine. It works. It is a miracle. I buy the raw powder for workouts. The person first gave me 30 gs. It is heaven to be able to live without anything but pain meds and an amino acid, glutamine. It works everytime. Why am I the only one who knows this? Even the strongest benzo stops working in 30 days. Seroquel gives me the shakes, like parkinsons. Glutamine, its beautiful.

EDIT/UPDATE: SEE POST BELOW. GLUTAMINE NOT NECESSARILY SAFE!

I DO NOT RECOMMEND",1547949162.0
ahswz1,https://www.reddit.com/r/opiates/comments/ahswz1/not_a_regular_h_user_but_nausea/,8,https://redd.it/ahswz1,YenkoS10,Not a regular H user but nausea?,"Yesterday i did a small amount of H and was nodding good, woke up and had the flu really bad all day vision was hard to see and couldnt hardly stay awake. Its now 7pm and i feel fine but damn that was scary. ",1547948763.0
ahswjv,https://www.reddit.com/r/opiates/comments/ahswjv/blown_vein/,4,https://redd.it/ahswjv,ChandlerCS,Blown Vein,So blown veins heal? Or is it collapsed for good? How quickly do they heal?,1547948688.0
ahsusn,https://www.reddit.com/r/opiates/comments/ahsusn/winter_always_leads_me_to_a_relapse/,3,https://redd.it/ahsusn,fleetfan,Winter Always Leads Me to a Relapse,"It probably has to do with underlying depression, but I'm just so used to covering that shit up. I know what my issues are, but I can't fix them...fuck those two years of therapy. 

The cold nights reach out pull me in to a ""relapse mindset"". At least I'm warm on dope... It's a sad life, but unfortunately lots of us live it day by day. 

Just a bit of a rant, take it as you want.

",1547948355.0
ahstvh,https://www.reddit.com/r/opiates/comments/ahstvh/worst_ways_that_youve_wasted_a_shot/,7,https://redd.it/ahstvh,ubercharlesinit,Worst ways that you've wasted a shot,"So this morning... I awoke after a good night's rest, still kinda high but overall ready to wake up and slam that nice last piece I have saved from the night before. I was going to just do it after my gaming sesh was over at about 3 but I was still pretty high from my last dose so I figured I'd just save the last bit for the AM because I don't know the next time I will be getting high. Payday isn't for another week and idk if I'll be able to afford to even pick up then. So I gathered my tools from the scattered places I left em the night before in my high clumsiness. Went into the bathroom. Got everything ready, took the last bit out. Thought to myself ""yup, nice lil chunk and it's been like 10 ish hours since my last shot, this is gonna feel NICE as FUCK"" threw it in the spoon with about .4ml of water. Heated, mixed, heated, mixed. (It's tar btw, only reason I heat it up is to dissolve it faster) and finally I'm left with my spoon and a nice brown amberish puddle in it. I have a cap to a pill bottle laying next to my spoon with a whole cotton ball siting in it. I pick the cotton ball up to rip a chunk off and as in ripping it off the WHOLE DAMN COTTON BALL just falls into my spoon. ""FUCK"" I yelled so fucking loud and mind you I live with family all of which do not know I use dope. So I think quick right and just take the ball out the spoon and give that bitch a quick glance. ""Yup, this is fucked and now I'm pissed"" There was no water in the spoon, just a cotton ball with one side of it slightly brown. So I tear off the brown parts real quick, there wasn't a whole lot of of surface area thankfully, but still enough to where it was hardly salvageable. Well I took some of my remaining clean rigs, stuffed the brown cotton in each of em with a lil water and just pushed what liquid I could out into the spoon (like you do with old Cotton's) and thankfully I got enough to where I felt the rush a little and got high (I don't really have much tolerance). But still much was wasted..

Anybody got any interesting stories on how they wasted their last bit?",1547948169.0
ahsphq,https://www.reddit.com/r/opiates/comments/ahsphq/remember_when_posting_pics_do_not_post_visible/,9,https://redd.it/ahsphq,Inquiringtoinspace,Remember when posting pics do not post visible fingerprints,"That is not a rule, just a suggestion to be smarter than the rules!",1547947305.0
ahsoa1,https://www.reddit.com/r/opiates/comments/ahsoa1/for_people_wondering_if_its_too_soon_to_take/,18,https://redd.it/ahsoa1,Deadlittlelu,For people wondering if it's too soon to take suboxone.,"percipitated withdrawal is real and yes you should be afraid of it. This might already be on here but anywho, if you're not already familiar with it.... your best bet ALWAYS is to refer to the COWS scale. 

A quit google search will you get you there.
 you want to make sure you're at least reaching a 5 to 6. mild withdrawal. but 1 would always hold out for a 10 just to be extra safe. 

trust me. you do not want to experience pw. it's not a fucking joke. if you think actual withdrawal is bad. HA, SYKE. welcome to your deathbed.

and those who say ""Oh, I can do my last shot before bed and wake up and take a sub."" you sir, are playing with fire. different batches, different formulas. the truth is you never ever know if it's going to happen. better safe then really super duper fucking sorry.

cause once you're in it, you're in it and all you can do is wait it out. there is not fix. 

please be safe yall xoxo",1547947060.0
ahso2b,https://www.reddit.com/r/opiates/comments/ahso2b/prepping_a_shot/,5,https://redd.it/ahso2b,Bvoasis,Prepping a shot,Let's say I prep ma morning shot the night before around 8 or 9 pm. And let it sit in the rig till 10 am the next morning. Will that change the potency of my shot? Will it change anything or cause any harm? Lmk guys . Just curious about this. Would appreciate you guys input . Thanks,1547947021.0
ahsnm3,https://www.reddit.com/r/opiates/comments/ahsnm3/mental_health_facility/,8,https://redd.it/ahsnm3,wayone1,Mental health facility,Almost done with my stay at this mental health facility. I’m going to really try and turn this life around while I still have people who care. Someone do a fat shot for me,1547946925.0
ahsmvv,https://www.reddit.com/r/opiates/comments/ahsmvv/whats_it_like_snorting_h/,6,https://redd.it/ahsmvv,Puremexicanapanties,what’s it like snorting H?,i’ve never done H but i wanna know what it’s like? can you function on it? are you energized or nodding? ,1547946784.0
ahsmaf,https://www.reddit.com/r/opiates/comments/ahsmaf/fentanyl_100mcghr_question/,15,https://redd.it/ahsmaf,anon21233q,Fentanyl 100mcg/hr question,"Just got 2 of these patches. I can usually take about 50mg hydrocodone to make me feel pretty good, but not totally out of my mind.

I have no idea how to go about safely using these patches. I was told to cut a half or a quarter of it off and stick it on my body and I should be ok. I’m scared to death I’m going to accidentally OD. Can anyone give me some insight? If there is no safe way to get a good buzz from these then I’m honestly just going to throw them in the trash, as I’m not willing to risk dying for a good buzz.

For reference, I am female, 5’5” and around 120 lbs.",1547946668.0
ahsbll,https://www.reddit.com/r/opiates/comments/ahsbll/lets_not_forget_what_withdrawal_feels_like/,37,https://redd.it/ahsbll,Deadlittlelu,let's not forget what withdrawal feels like....,"I'm bad with my words. dont judge.

just wrote this while having a craving ro remind myself what I just went through.
I don't want to forget. 

 what withdrawal was like for you.


it all started with a yawn, you're about 8 hours in now you know shit is about to go south. time goes by.... you get home, rest a little. and wait for the inevitable to happen. you get a little sleep... good for you. you're gonna need it. cause you know damn well you ain't sleeping for the next AT LEAST 2 weeks. you wake up..........you just threw up all over yourself.. so with the absolute no energy you have you try to make your way to the bathroom to clean yourself up. you look in the mirror,  your pupils are sickeningly huge. are you tripping on lsd? nah son, just withdrawaling. duh. your eyes are sunken in, watering nonstop.... yawns are non stop too. your skin is clammy and just.... not right looking. You have a fever so high you honestly think you might fucking die. your heart is racing so fast.. again,  you think..... am i gonna fucking die. (funny, you never thought that while you were bangin line after line after line of fent and h.. shit that actually could fucking kill you, dumbass.) there's sweat pouring off your face... gross. you sit on the toilet because your stomach hurts SO BAD. you have nooooooooo energy so you literally just hang your head between your legs, (it's crazy too because how could someone with no energy at the same time be unable to even stand still???? So fucking restless. so restless.) all the while freezing to death, shaking, with all the hairs on your arms sticking STRAIGHT UP. for MINUTES AT A TIME. soooo cold..... legs and arms twitching out of your control is enough to make you consider a life without arms and legs. where's the hacksaw. who needs them right now when they're this big of an annoyance. you make it back to your bed.... (you never actually do get to clean that throwup off you btw, you sleep in that for the next 24 hours, so hot) just to cry, kick your legs and arms, get no sleep. All while the little voice in your head saying ""just go cop and this will all go away."" ",1547944635.0
ahsb49,https://www.reddit.com/r/opiates/comments/ahsb49/best_opiates_for_insomnia/,15,https://redd.it/ahsb49,dankfremont,Best opiates for insomnia?,"I’ve tried four different kinds of opiates for sleep, by far Vicodin has worked the best but it’s too difficult and/or expensive, and I have a slight tolerance to it.  The other 3 weren’t that effective.
",1547944539.0
ahs4xa,https://www.reddit.com/r/opiates/comments/ahs4xa/story_time/,15,https://redd.it/ahs4xa,HarleeeQuin,Story time!,"Would anyone like to share any opiate related stories? Crazy or non crazy whatever you got!

I feel like whenever I’m on the sub all I can see is posts about people asking questions or people’s posting photos. Which is fine - nothing wrong with either! 

I just love hearing about different people’s experiences :)",1547943410.0
ahs3cx,https://www.reddit.com/r/opiates/comments/ahs3cx/taking_second_dose_of_oxy_for_the_day_need_advice/,9,https://redd.it/ahs3cx,dustywalk,"Taking second dose of oxy for the day, need advice",Is it a waste to take a second dose of roxys? I took about 60mg 4 hours ago and am wondering if I take more would it not really work like it does for the first dose of the day? Would it be smarter to save it for another day? Or to potentiate it? Or should I just take a stronger dose? Thanks for the help,1547943121.0
ahrzil,https://www.reddit.com/r/opiates/comments/ahrzil/how_to_smoke_opium/,2,https://redd.it/ahrzil,GW143,How to smoke opium,"So it's been a while since I smoked opium but I am getting some and was hoping I could get some tips.

I can just use tin foil and a straw to smoke it right? 

Also how much should I use? I'm gonna start with a little bit regardless it would be nice to have suggestions. 

Cheers",1547942428.0
ahrvs8,https://www.reddit.com/r/opiates/comments/ahrvs8/year_tin_60_a_month_for_all_the_opium_i_need_but/,6,https://redd.it/ahrvs8,Inquiringtoinspace,Year tin. $60 a month for all the opium I need but not heaven,Deleted,1547941765.0
ahrvi8,https://www.reddit.com/r/opiates/comments/ahrvi8/what_type_of_opiate_is_yr_favorite/,9,https://redd.it/ahrvi8,yungdillyboy,What type of opiate is yr favorite?,Ive tried china white ECP#4 and almost all the pills except for opana and also BTH... in my opionion my favorite is the tar.. it taste the worst out of all the others but its the best bang for my buck,1547941724.0
ahrub1,https://v.redd.it/csa0xv2nugb21,8,https://redd.it/ahrub1,pompousepistemophill,Best torch/jet flame lighter imo (personal opinion not advert!),,1547941576.0
ahru21,https://www.reddit.com/r/opiates/comments/ahru21/well_im_high_again/,9,https://redd.it/ahru21,han2418,Well.... I’m high again,"Guess I’ll quit tomorrow. The elusive “tomorrow” that constantly hangs over my head, knocking at my door, begging to come in. NOT TODAY SATAN. I’ll fuck witcha tomorrow 👅 ",1547941522.0
ahrsbx,https://i.redd.it/obq5lxzlugb21.jpg,19,https://redd.it/ahrsbx,Opiophile420,First shot of the day my mtd holds me til now.,,1547941272.0
ahrqlg,https://i.redd.it/e7ii7ajstgb21.jpg,14,https://redd.it/ahrqlg,MikeWhoo,Today's pickup. A nice 25 pack of some blueberries.,,1547940999.0
ahrlzf,https://i.redd.it/7x10jd8ergb21.jpg,10,https://redd.it/ahrlzf,berrieseveryday,Yesssirr,,1547940193.0
ahrj95,https://www.reddit.com/r/opiates/comments/ahrj95/question_about_pain_medssurgery/,23,https://redd.it/ahrj95,Ajhmxr2,Question about pain meds/surgery,Ok so i am having gallbladder surgery and the surgeon went on about how he doesn't do narcotic pain meds and a study showed tylenol/ibuprofen is sufficient and does the same amount of pain relief. Now I've never had surgery other than dental and an abscess/mrsa both times I needed pain meds. Im in a ton of pain now and am taking norco as needed but damn the idea of having holes in my stomach and only tylenol and ibuprofen freaks me out a bit! I take 800mg motrin 3-4 times a day anyway for my chronic pain and it barely helps that.  Would you try to see a different surgeon or is this one really no big deal? Its laparoscopic as long as no complications. ,1547939730.0
ahrigf,https://www.reddit.com/r/opiates/comments/ahrigf/benzo_questions_for_opiate_ppl/,6,https://redd.it/ahrigf,extremelystupid77,Benzo questions for opiate ppl,"I just never post anywhere else.

If u switch from daily xanax to daily klonopin do you think you'd feel any different? Same low dose of each, .5mg to 1mg daily. I'm in a terrible mood today, idk.",1547939610.0
ahreos,https://i.redd.it/am11q0cqngb21.jpg,4,https://redd.it/ahreos,king-of-elves,"First Line in 5 days - Oh, sweet nectar",,1547938959.0
ahrd50,https://www.reddit.com/r/opiates/comments/ahrd50/does_redosing_oxy_work/,5,https://redd.it/ahrd50,supmaguy,Does redosing oxy work?,"If I redose, will the effects be significantly weaker than if I took a larger dose at once?

Thanks! ",1547938693.0
ahrd1u,https://www.reddit.com/r/opiates/comments/ahrd1u/weed_really_helps/,7,https://redd.it/ahrd1u,R1chPorter,Weed really helps.,"So, I've heard opiates compared to a REALLLY sensitive button in your brain, that once its pressed, you just OBSESS about it being pressed again. I've also heard it compared to color, such as, the world is a boring, mundane, black and white & opiates give the world color. Russell Brand also said not 1 hour of his life goes by without thinking about his addiction.

These are the best examples to encapsulate my feelings, even 5+ months since any physical addiction. 

The only time I don't seem to feel these awful, doom pending, anxious feelings is when I smoke weed, roll weed, trim weed, etc. This is the only thing that really clears my head of this nonsense. I know this sounds super unproductive but I don't have many more tries inside of me. I feel like I am battling for my soul as cliche as that sounds.

Now being in the North East, I can't cultivate a farm of marijuana in my backyard while blasting Jerry and rolling huge doinks of trim; As a matter of fact, I can barely even smoke it as freely as i would like..

I've been considering actually moving out west until i find a trimming job. Has anyone without any connections successfully made this move? I really have a special love for weed and understand what comes with what ive asked. 

&#x200B;

Sometimes i really feel like i need to follow my heart and go for it, instead of wondering what could of would of happened. Any real job i would want to sink my teeth into, would contraindicate weed smoking, which is why im left with this idea, instead of getting a dab pen and sucking it up. (instead of rolling huge backwoods of flower) All I know is that i really do not want a repeat of the last couple years, so i guess it couldnt be much worse. Any opinions?",1547938677.0
ahr7tr,https://i.redd.it/w5svlme8kgb21.jpg,9,https://redd.it/ahr7tr,dniggs19,Does dope normally flake ?,,1547937779.0
ahr3ai,https://www.reddit.com/r/opiates/comments/ahr3ai/best_roa_for_subutex/,7,https://redd.it/ahr3ai,Colaman23,Best ROA for Subutex,"Town is dry af so I’m forced to cop subutex. Tolerance is pretty low, so they’ll fuck me up decently. I usually snort them but I’m wondering if I’m getting the best bang for my buck. Should I just pop them? ",1547936994.0
ahr2k1,https://www.reddit.com/r/opiates/comments/ahr2k1/wtf_my_heroin_has_no_taste/,10,https://redd.it/ahr2k1,beamdreamhuh,wtf my heroin has no taste,i buy from the same guy thiss isblike the tenth time. i bought a gram and snorted .1 at least so far and not getting one bit high usally 30mg does it. im withdrawing so i taste it on my tounge it has no taste kind of taste sugary. i have been waiting for the drip and wonderd why,1547936876.0
ahr0qi,https://www.reddit.com/r/opiates/comments/ahr0qi/what_is_your_first_symptom_letting_you_know_your/,26,https://redd.it/ahr0qi,dniggs19,What is your first symptom letting you know your beginning withdrawl,Always wondered what the first sign of withdrawal is for people. For me I start yawning uncontrollably wanted to see what other people experience ,1547936556.0
ahr0kb,https://www.reddit.com/r/opiates/comments/ahr0kb/opana_10mg_ir_white_vs_pink/,6,https://redd.it/ahr0kb,Camelsmoke,Opana 10MG IR White vs Pink,I have a hookup who gets both white and pink depending on which pharmacy she goes to and I was just wondering if there is any true difference in effects other than just looking different. Also what is the average price for these? I’m copping them for $15 a piece and it seems like a damned good price but I’m wondering what others pay. Stay safe friends ✌🏻,1547936527.0
ahqz88,https://www.reddit.com/r/opiates/comments/ahqz88/gunpowder_h/,4,https://redd.it/ahqz88,daddysenpa1,Gunpowder H?,What exactly is it? I saw a listing with good reviews that had a G of gunpowder for about $80,1547936307.0
ahqw43,https://www.reddit.com/r/opiates/comments/ahqw43/im_backk/,9,https://redd.it/ahqw43,allisonwonderland72,IM BACKK,"at least for the time being. Let me expound. I'm 23 and have been shooting dope since I was 17. In the time since I have officially wrecked my cardiovascular system. Me successfully hitting a vein and managing to get the entire shot involves bringing a shadeless lamp with me to the hot bathtub/shower and sometimes up to two hours. For the past two days, I've been getting it within 5 minutes. I just had to post this here to share the utter joy I'm feeling with people who will understand. I feel like a middle aged man that just scored with a 18 year old, I'M BACKKK BETCHESS!!! LOL",1547935791.0
ahqp6v,https://i.redd.it/0mjg29otagb21.jpg,2,https://redd.it/ahqp6v,Realazer,"Im feeling wavy, baby",,1547934617.0
ahqm2z,https://www.reddit.com/r/opiates/comments/ahqm2z/how_to_get_h_out_of_your_system_fast/,13,https://redd.it/ahqm2z,SPAZMVNE,How to get H out of your system fast.,I might have to drug test at my p.o. Office on Monday. Supervised test one guy in a regular bathroom with urinals with a mirror facing on me. 5’9” 150lbs 18 y/o male. I have less than two days. Help ,1547934098.0
ahqii9,http://imgur.com/a/IX5irme,0,https://redd.it/ahqii9,imapcnoob,A little pick-me-up for today 😍,,1547933497.0
ahqg9k,https://i.redd.it/ejrkryne6gb21.jpg,19,https://redd.it/ahqg9k,theMorfiend,Soft amount lol,,1547933129.0
ahqbvi,https://i.redd.it/dxktmsh44gb21.jpg,2,https://redd.it/ahqbvi,roxxx1234,Cheeky lil cop before the snowstorm hits and I’ll have to go plow.... and have one and a g of bud for after the long night. Hope everyone in the northeast copped before and stays safe in the weather!,,1547932361.0
