8p5z7v,https://www.reddit.com/r/opiates/comments/8p5z7v/what_is_your_favorite_brand_of_15mg_oxycodone/,33,https://redd.it/8p5z7v,GlassHouse8,What is your favorite brand of 15mg oxycodone?,"Hey guys and gals,

I recently switched pharmacies, and they carry a brand of 15mg oxy that I don’t like as much as the greens I was getting from Par pharmaceutical, marked with a V. I told my dr that the new brand (white oblong ones) give me heart burn and he said that at the next refill if I just let him know what brand I want he will write for it.

 I wanted to ask around and see what are some of the favorite brands. The greens I used to get seem the most common, but I heard the ones from mallinckrodt are really good. 

What’s your favorite? 


Edited to ask, do you have a favorite OxyContin 15mg brand too? The extended release.

TIA ",1528332340.0
8p5z1i,https://i.redd.it/d4o3tjt27h211.jpg,17,https://redd.it/8p5z1i,AngryChair007,Another quarter finger of some decent shit. Cheap as hell too!!,,1528332297.0
8p5x8b,https://imgur.com/suaIuCE,2,https://redd.it/8p5x8b,HalfHeartedBootyCall,Anybody seen these Tesla's before? I'm about to try'em,,1528331843.0
8p5x1t,https://www.reddit.com/r/opiates/comments/8p5x1t/most_bang_for_your_buck_snorting_dope/,5,https://redd.it/8p5x1t,AngryChair007,Most bang for your buck? (Snorting dope),"Any precautions to take before sniffing dope to get the most out of it or the most absorption? Snorting a little in each nostrils? Anything? I’d love to know what you guys think works best, so drop a comment! Thank y’all ",1528331795.0
8p5va7,https://www.reddit.com/r/opiates/comments/8p5va7/tramadol_after_aderall/,3,https://redd.it/8p5va7,stressaf1231,Tramadol after aderall?,"Mixed Info online. Took 15 mg IR about 6 and half hours ago, feeling shitty and in lots of pain prescribed tramadol for it. Safe to take my dose now?
Everyone seems to think I’ll get SS or seizures and die. ",1528331350.0
8p5r4w,http://imgur.com/QnePntS,34,https://redd.it/8p5r4w,realpantoponrose,Summertime & the Living is Easy ;),,1528330386.0
8p5qfe,https://www.reddit.com/r/opiates/comments/8p5qfe/do_any_of_you_mix_anything_with_your_dope_smoking/,5,https://redd.it/8p5qfe,IshitonUrdog,Do any of you mix anything with your dope (smoking) to make it taste better?,"I know I've read about mixing coffee grinds with it, that might even be from the sidebar actually, but was wondering if anyone else uses something to help mask the horrible taste when smoking ",1528330233.0
8p5mgb,https://i.redd.it/kgk082rnxg211.jpg,24,https://redd.it/8p5mgb,freebird33,T188 Are they real?,,1528329235.0
8p5e0s,https://i.redd.it/431my390sg211.jpg,5,https://redd.it/8p5e0s,dopefiendlean1234,Ecp or fent please refer my text post to this,,1528327231.0
8p5b5k,https://www.reddit.com/r/opiates/comments/8p5b5k/ecp_or_fent/,3,https://redd.it/8p5b5k,dopefiendlean1234,Ecp or fent??,Hey y’all so quick question what exactly do y’all think this is? I was told it was ecp Im originally from Houston so really only fuck with tar. However the few times I have gotten ecp it was not smokable it would just burn on the foil.?also this shit seems super fucking strong  and all in the initial punch still lasts for 6/7 hours but a good 70/80% of that is all the first hour. Now I also haven’t shot anything in 8 months till I got this and ITs crazy y’all I’m litterAlly  only doing  .025 a qaurter of a pt shots I also did a .025 shot and the. Snorted about .05 and was straight nodded hard for 45 mins. Soooooo now my question is what is this stuff?? I’ve never done fent so I’m not sure i it’s that or what but what I do know is it seems way to strong to be dope and with my experience with ecp it is not smokable. And I do know fent is smokable. Please helppp my people!!! 🤔🤔,1528326573.0
8p57qg,https://i.redd.it/he3j0uclng211.jpg,13,https://redd.it/8p57qg,chem-eu,Mundipharma Oxycontin 80’s. I love how some people don’t know how much drugs are worth :) OxyContin 80mg :) they are abuse proof but oh whale!,,1528325805.0
8p57gl,https://i.redd.it/3vdzcfdkng211.jpg,43,https://redd.it/8p57gl,Gelowkzz,Do these look real or fake?,,1528325737.0
8p55ns,https://www.reddit.com/r/opiates/comments/8p55ns/how_long_until_im_safe/,20,https://redd.it/8p55ns,mothafucka-jones,How long until I’m safe,"Hey guys, long time lurker first time poster. Gotta question for y’all... so I usually mess around with Vicodin that I have semi-easy access to, well today I took my last one from my stash at approximately 9AM today, my buddy just dropped me off some methadone (which I’ve never tried)... question is if I took the Vicodin at 9AM & it is currently 6PM, am I safe to take the Methadone? Or should I wait until tomorrow? I’ve heard that they can react poorly if you mix them... any advice would be appreciated, thanks y’all!",1528325313.0
8p51uj,https://www.reddit.com/r/opiates/comments/8p51uj/still_withdrawing/,43,https://redd.it/8p51uj,kramercosmo69,Still withdrawing ?,"I’m on day 12 totally clean.  Kind of lucky to have time away from work right now so I can be at home through all of this.

I was doing oxy for 6-7 months, working my way up to 180mg a day towards the end.  

Anyways, I have ZERO energy.  Like I wanted to be productive today but I can’t stop laying around.  I feel like I have mono or something.  Never felt this tired and weak before.

I know the first several days of withdrawal are the hardest, but this phase is pretty tough too.  Can anyone else relate? ",1528324465.0
8p51fh,https://i.redd.it/b89owvugjg211.jpg,9,https://redd.it/8p51fh,Pandamania07,Catching da 🐼.... oh how I’ve missed you,,1528324366.0
8p4ymp,https://i.redd.it/8m0u416lhg211.jpg,50,https://redd.it/8p4ymp,Elmburn,Stop hating on me for smoking blues,,1528323728.0
8p4x3c,https://www.reddit.com/r/opiates/comments/8p4x3c/240mg_oxy_or_2_gr_4/,11,https://redd.it/8p4x3c,Vtrial167,240mg oxy or 2 gr #4,"I have no experience with any of them so what would be most enjoyable
I like to snort my drugs
Edit: I tried good #4 and high wasn't as good as oxy
All I want a best option to enjoy the effects
Either of those substances will go to my personal stash and won't be used daily",1528323371.0
8p4x0t,https://www.reddit.com/r/opiates/comments/8p4x0t/wednesday_night_hangout_thread/,33,https://redd.it/8p4x0t,chasingd0pamine,Wednesday night hangout thread,"Sup fam? I'm in a really bad headspace, under medicated and have a toothache that has had me in tears all day, so come hang out with me and chat. 

1- How are you feeling on a scale of 1 to 10 right now? 
2- What are you on today? 
3 - what do you do to distract yourself or feel better when you are feeling really bad mentally?


Answer this, or don't, talk about whatever you feel like. Thanks for those who entertain this post, could really use the distraction...",1528323358.0
8p4wzz,https://i.redd.it/cosy8zsggg211.jpg,20,https://redd.it/8p4wzz,wormjunk,grey dope?,,1528323352.0
8p4u0x,https://www.reddit.com/r/opiates/comments/8p4u0x/first_time_opana_questions/,13,https://redd.it/8p4u0x,rubyoddynuffcherry,First time opana questions,"I have two opana 30s
What dose should I take and what ROA is best
(No tolerance)",1528322700.0
8p4s1d,https://www.reddit.com/r/opiates/comments/8p4s1d/fake_or_real_t188s/,10,https://redd.it/8p4s1d,freebird33,Fake or Real T188's,"They are a little less ""spotty"". Very clean and shiny. The stamps on front/back are not symmetrical. They look slightly brighter than photos online(could be a lighting thing). Anyone heard or seen any fakes of these t188s? Are the front and back stamps supposed to be mirred exactly for each pill?  ..That being said, they taste fine. Definitely have some active agent.   Any help is appreciated greatly:) Gbless",1528322265.0
8p4l35,https://i.redd.it/m9ry780k8g211.jpg,18,https://redd.it/8p4l35,addisonxb,"My detox box, time to get clean. Got gabapentin, clonidine, xanax, and some temazepam.",,1528320741.0
8p4k0p,https://www.reddit.com/r/opiates/comments/8p4k0p/withdrawl/,6,https://redd.it/8p4k0p,icantremember69,Withdrawl?,"How long can wd last ? I'm not sure what exactly he was using, some blue and some white oxy...been sick for a week off and on... What are symptoms of with drawl and can a mostly recreational user suffer with drawl?",1528320504.0
8p4dop,https://www.reddit.com/r/opiates/comments/8p4dop/how_do_people_shoot_in_feet_or_between_toes/,13,https://redd.it/8p4dop,lulz4daze,How do people shoot in feet or between toes?,I took a job that requires me to wear short sleeve shirt every shift but I can't shoot the jug or the fem so I think my only other option is feet. Any tips? I can't even find a descent looking Target other than hands and arms.,1528319122.0
8p40x5,https://www.reddit.com/r/opiates/comments/8p40x5/okso_my_dr_went_full_retard/,18,https://redd.it/8p40x5,iDoDrugzALot,Ok...so my Dr Went Full Retard,"NEVER GO FULL RETARD...

Told me he read online *THA FUCK?!* OPIATE CRISIS AND DR ARE STOPPING TO PRESCRIBE AND SOME WILL BE PENALIZED, i have a herniated disk and problem with my shoulder after some random fight and was being prescribed since 2017 Oxy's patches & other opiates... No he wrote me a script for Prednisone and Ibuprofen......If i were to want Fent patches or anything like that...what do you guys sau different dr or just Deep web this shit?",1528316506.0
8p409j,https://www.reddit.com/r/opiates/comments/8p409j/big_does_anyone_know_anything_about_this_fentanyl/,5,https://redd.it/8p409j,jamdeuce,BIG does anyone know anything about this fentanyl analog,"This is supposed  to b an anilog of methoxyacetyl-f. I really can't afford to buy another crispy anilog that don't give a punch or is inactive I am an addict on a budget so really anilogs is all I can afford and my vendor says they just got this any info on this will really help strength, high any info thank you it's called BMF",1528316370.0
8p3vw7,https://www.reddit.com/r/opiates/comments/8p3vw7/luckiest_day_of_my_life/,252,https://redd.it/8p3vw7,,Luckiest Day of My life,"What you are about to read is the luckiest day of my life. I can pretty much guarantee nothing will ever top this. Ever. This is a long, long story. There will be no TL;DR because the story is too complex.

Let's start with a little back ground info. I have been apart of the /r/opiates community for years on a my throwaway (not this one, for obvious reasons I made a throwaway specifically for this post. It will become more apparent later). 

I have to use a throwaway when I post on this subreddit because I post on other reddits related to my career on my main reddit and the two just cannot be linked. So what is my job? I am an airline pilot. Yes you read that correctly, I am an airline pilot who enjoys the wonderful bliss that is opiates \- more specifically heroin. My method of use is snorting, I have never injected in the \~6 years of heroin use (and another 2\-3 years before that of on and off hydro/oxy but not using as often as I am with boy). The reason I told you all my job (which normally I never mention anytime I talk about opiates) is it an integral part of the ""Luckiest Day of My life"". I have quotations around that for a reason. Not a good reason.

When I am on trips flying I may do some boy and bring it with me, but I am never super high and nodding off. Just a slight buzz, with the majority of my use coming once I am in my hotel room at night while playing video games on my PC or just watching youtube videos.

Now to the story... I packaged my dope to bring thru the airport with me a little different this time. Normally I get stamps, this time it was weight because my plug is transitioning to bagging himself. He didn't bag it this time so he just gave me weight. I put it in a magazine fold, but it isn't super secure so I thought what I could use besides taping it (which would make it annoying to open and close) to keep it secure. My ""genius"" brain thought it would be a good idea to use tin foil. You might be thinking, ""Metal, are you crazy?! The metal detector will go off in the airport!"". Well two things here, 1) We have this special line that both Flight Attendants and Pilots can go thru called KCM (Known Crew Member). It allows us to use this personalized barcode to scan on the TSA computers which will pull up all our info. This in conjunction with our airline ID as well as either your DL or passport, and you don't have to go thru security so that tin foil metal shouldn't be a problem. 2) Although we have this special line that makes it so we don't have to go thru the body scanner/metal detector or get our bags scanned, every 25th and 50th crew member who goes thru KCM will be randomly selected to go thru the TSA PRE line to get their stuff scanned like a regular passenger. But even if this happened to me, I didn't think tin foil would be thick enough metal to even make the detector go off. I was wrong.

Now, I've been randomly selected for this screening before. It was no biggie, I keep the boy on my person and go right thru. I don't have to go thru the body scanner, just the metal detector. Because my stuff is normally in stamp bags, there's nothing to worry about. I've gone thru metal detector before so I know which things on my person and on my uniform that I need to remove because they set off the alarm. I put everything I knew would set it off thru the machine that xrays our luggage. Well when I stepped thru the metal detector, it went off. It was in this moment that I knew I fucked up... This is also where the shit begins to start hitting the fan.

I play dumb at first not knowing what was making the machine go off. Praying it wasn't the tin foil holding my boy, I start removing items hoping that its something random (but knowing full well it is the foil). I take off my shoes, my lanyard, my belt. You name it, I damn near took everything off except my shirt and pants. Eventually there is nothing left to take off. This is where I make my first of very very few mistakes. I ""remembered"" that I had my keys in my pocket, and told the TSA lady (who will end up being a HUGE cunt and thinks shes a police officer) that I just realized I parked my car in the wrong area (random I know, but I was panicking on the inside a little now) and needed to move it ASAP. She could sense I was nervous and started to think something was up. I asked her if I could grab my bag and leave and then come back once I moved my car. She said because my bag had gone thru already, I had to also go thru the metal detector and grab my bag then I could go move my car. But not until the metal detector gave the all clear. Well it kept beeping and I told her I didn't have anything else on me, but I guess she could see the very small bulge from my pocket where the bag was with the boy. She told me to remove what I had in my pocket. I lied and said there was nothing there. She started to get mad and told me to remove it otherwise she was going to call the LEO on duty. I started freaking out more inside now, knowing full well that I've just put myself in a very bad position. I'm in full uniform here, and its starting to escalate to the point where passengers are looking and it's drawing attention. I keep telling her I don't have anything in my pocket (should have just nonchalantly put it in the bowl from the beginning, but this was a mistake I made). She calls the LEO over on her radio, but before he gets there I take the sandwich bag with the tin foil (boy inside) out and into the bowl. She asks why I didn't remove it before, which I responded with saying I didn't realize a thin metal like tin foil would make the detector go off... She's clearly very suspicious of me now, and the LEO is heading over too. I'm. Totally. Fucked. I spent 8 years, and over 100k\+ becoming an airline pilot. I see my life heading for the toilet bowl, felony charges, parents finding out. 

I go thru the metal detector, this time with nothing in my pockets and now its fine. I get to the otherside to retrieve my items, my bag/shoes/wallet/phone etc. have already come out the other end as this was all going on. The bitch TSA lady heads over to where the computers are (that show whats being xrayed) and theres also a small opening where they can grab what comes out of the xray machine before we the passengers can get our items. She of course pulls the bowl with my sandwich baggie of goodies out. She takes a look at the bag and sees the tin foil as well as a straw. Now she's very suspicious, and brings this bowl over to the table where they swab for explosives, along with the LEO. They open it up, see the straw and start to unwrap the the goodies (are your hands sweating yet? Cuz mine are. Imagine being in this situation, I could have thrown up all over them). They open the package and see this powder, and thats when all the questions begin. You might think that I'm done for it here, but I'm actually great under pressure (remember, I'm a trained airline pilot. We are trained to deal with immense amounts of stress while keeping our cool and making correct decisions). This is where I start to save my own ass. They ask (can't remember who, think they're both asking me questions, both the LEO and the TSA coooont) what the powder is, I tell them the name of something I think is a vitamin (think like, DXX (with the XX being a number, because a lot of vitamins are named like that)). They ask why do I have it in powder form, and that it surely isn't being sold like that from wherever I got it. I tell them it came it capsules, but I have trouble swallowing them so I take it out of the capsules to be able to mix into a drink and take them that way. Whats the straw for? Well when you drink the powder sometimes shit gets stuck in your teeth, I don't have toothpicks laying around so I use that to clear my teeth. I tell them, ""remember guys I'm with passengers all day long and it wouldn't look very professional having gunk in my teeth. They ask why I have this in my pocket, that's kind of strange... I explain to them that my luggage goes into a closet on the airplane where we store our crew luggage, and that if I want to be able to take this vitamin during the day while flying I would have to go in and out of the closet which is tedious and could get in the way of passengers as they board and exit. So I keep it on me for ease of use. The TSA lady isn't buying very much, she tells the LEO how nervous and strange I had been acting about taking this out of my pocket. The LEO tells me hes calling a more experienced officer. He does, and I have to explain everything again to the new officer. Whats the straw for, why is it in powder form... I'll spare you. Well this officer in turn calls more officers over. So now we have about 6 total officers all questioning me and asking me the same questions as I explained earlier. Probably so they are filled in, but also to see if my answers remain consistent (thankfully, my wife loves police/detective shows. You'd think it not useful but seriously I've learned so fucking much from those shows that comes in handy in this whole situation). Eventually they inform me they are getting someone to come bring a drug testing kit, because they aren't sure if this drugs or not. But they tell me they don't want to do it out in public (remember, we are still out in public just standing in the area directly after security where everyone puts back on their clothes etc. We start making our way to the back room.

So they told me just prior to coming back here that they were going to be doing a drug testing panel (or whatever its called) on this. I'm thinking I'm 155&#37; fucked. I won't admit to shit tho, because there's absolutely nothing to be gained by giving myself up. I'm just praying to the gods at this point. My wife always wants me to text her after I get thru security if I have anything on me so she knows I made it thru OK. Well she's blowing up my phone worried AF about me. I have my phone on me so I text her back saying I'm totally FUCKED, and that I'm not joking. I also take the time to quickly go thru and delete any and all drug related text messages. So in the backroom is me and about 6 cops, the TSA bitch doesn't come with, because, shes not a cop you know? Nor is it her job to be looking for drugs, just bombs/explosives/weapons etc. But she took it upon herself to do so. So the cops ask for drivers license, flight info, documents etc. They ask to search my bag, I oblige because I have nothing incriminating in it. At this point I ask them if I was free to go. The one most suspicious of me officer told me no, I was being detained. I'm thinking, oh fuck man this is really bad. They re\-ask all the questions over again, which I can only assume is to once again see if my story is remaining the same. Something weird happens in this situation if you are with police getting questioned for over 10\-15 min. You start to calm down after a while. I was doing a pretty good job up until this point giving quick, concise answers without making it seem like I'm having to sit there and think of an answer. But now after its been quite some time since this all started (probably 20\-30 min), I'm pretty calm even tho I know there's a good chance my life may be ruined. I went into this fight/flight response. I was going to fight, and by that I mean I was going to do a great job of lying and making my story seem believable as possible. So once I re answer their questions again I get some new ones. One of the LEOs says ""You do understand why we would find this suspicious right?"" And I'm like, ""No not really man, why?"" and hes says ""This doesn't look like drugs and drug paraphernalia to you?"". This is where all those cop shows really come in handy. Way too often a person in this situation on TV has said ""Why yes it totally does occifer!"" Trying to like meet him halfway or something. I said ""To be honest man, I don't think it looks suspicious but I don't even know what drugs or drug paraphernalia looks like."" Then this guy said the absolute highlight of my very shitty but weirdly good day. He says ""You see, this looks an awful lot like crack."" I had to contain myself boys. Why? Because this boy was a very nice light brown/tan color. I've never fucked with crack, but I do believe crack is like whitish color not light brown/tan... Another officer says ""Okay man, why don't you just go ahead and tell us what this really is"". I repeat myself, telling him its what I have been all along about it being a vitamin supplement. He finds this strange, saying that he's never seen a doctor prescribe someone powder like this before (all while giving me that cop look that says I'm a dumb asshole trying to make him look stupid or something). I, along with another cop in the room, explain that I said before I got it over the counter and it wasn't prescribed. I explain to him that this was recommended to me by the guy at GNC when I told him that it's hard for me to eat healthy while on the road due to the fact that I eat a lot of fast food. This was suppose to be an additional vitamin source to round out my diet. Additionally, I told him before it came in capsules already crushed but I can't swallow them so I open them up and keep them like that. All while this guy is grilling me with his two other buddies, 3 more are in the other room doing what I think is a drug test on the powder.

Eventually the 3 from the other room come in, and to my very very very very surprise, told me I was free to go... I couldn't believe my ears. I got up and asked if I could put my bag back together since they had taken the stuff out of it and was out on the table. They said yes. On the other table was a small circle bin (that used for wallets, phones etc) with my wallet, belt, and my boy package which was sitting open. They said I could take it all, including my vitamins... I couldn't believe my ears. So I wrapped my ""vitamins"" back up, with 4\-5 cops standing around me watching me (couple had left). Just to seal the deal here, I asked the room if I was going to get an apology now? The room was quiet, one of them changed the subject and told me that I Just needed to go back out to TSA so they could screen my bag again. Well I went and did that with an officer, and sucked up to the TSA lady. Apologizing to her for not just complying originally, and I shook her hand. Once my bag came out of the scanner, I was on my way, vitamins in tow and all. I called in sick for my trip, no way I could fly after all of that.

And that ladies and gents, was how I had the luckiest day of my life. I don't think I will have a luckier day than that for the remainder of my days. 

I do apologize for the length, but in order for you all to grasp this story and the emotional roller coaster, I had to be super detailed.",1528315512.0
8p3u6j,https://www.reddit.com/r/opiates/comments/8p3u6j/opioid_nasal_spray_making/,4,https://redd.it/8p3u6j,bmille561,Opioid nasal spray making?,I want to make a fent nasal spray. Should I use water or saline? And does anybody know the math I should use? Like if it’s a 30ml bottle. I was going to way out micro dose and snort it and see what is the lowest dose to get me high and than times that by 30mls ,1528315177.0
