8v7y4g,https://www.reddit.com/r/opiates/comments/8v7y4g/my_dboy/,9,https://redd.it/8v7y4g,iworkthebananastand,My dboy,"I just wanted to say that after 7 years I've finally found the best dboy ever. He's an older cat, probably late 40s early 50s and he is the best. Last week I get close to the spot so I hit him up and let him know. When I get there, he's waiting on me. 2 weeks ago, I pull up to the spot, get my car backed in getting ready to put it in park when I see him roll up to the stoplight . This past Wednesday, he tells me to go to the McDonald's. When I pull in, who do I see? My guy coming across the parking lot so I can follow him out. Just wanted to share my awesome experience with you guys. His stuff isn't the greatest. I'd probably give it a 6, but he's true to his word and punctual. Can't ask for much more than that.",1530424194.0
8v7wri,https://www.reddit.com/r/opiates/comments/8v7wri/input_from_people_that_havehad_clean_time_loved/,8,https://redd.it/8v7wri,nmeyers92,"Input from people that have/had clean time, loved and improved their life, then relapsed a few times and it completely destroyed your mindset, but still want more?","So finally had almost a year clean after about 5 years of using heroin. Never had more then a week clean that whole time. During this past year I didn’t use anything until last month, I have been getting high on h like once every weekend. This year being clean turned my life around so fast its almost insane. Went back to personal training and kickboxing, all friends back, money, lost weight, etc. so why the fuck do I still need that relief? And like for 5 days after I use that one night I have the same mindset I did as a user (I’m a piece of shit, life sucks, don’t wanna be alive, rather be high all the time, don’t wanna see anyone). I am on top of the world when I’m clean. I’m literally a different person. I feel like I have two different brains its so damn frustrating. What the fuck is wrong with me? I HATE HATE heroin and the lifestyle but my mind secretly thrives off of it. I love being clean so much but I clearly love to self destruct and make myself a miserable piece of shit even more. Everything seems so much more real on heroin and I feel worthy to be alive even though I know that thought is complete bullshit and I ACTUALLY love myself when I’m clean. Sneaky drug h is man. Never should have let myself feel that amazing rush again. Idk what I’m really looking for in replies. Just hoping some people feel the same. ",1530423698.0
8v7w8x,https://i.redd.it/5hbgq9pbx9711.jpg,6,https://redd.it/8v7w8x,madisonwm,"Landing gear... not opiates, but this sub truly is the most accepting. ... been on 80mg addy all day... “the hardest job in America is being a drug addict”-blue",,1530423511.0
8v7uwh,https://www.reddit.com/r/opiates/comments/8v7uwh/itll_be_the_last_time_i_swear/,6,https://redd.it/8v7uwh,goyange,"It’ll be the last time, I swear...",...said no one *fucking* ever. I need to stop with this bullshit. Goddamn I hope I can sleep tonight ,1530423042.0
8v7syd,https://i.redd.it/rdbk3hiyt9711.jpg,13,https://redd.it/8v7syd,MrFuckEmUp,Late night clucking.. 😡 get the strap,,1530422377.0
8v7oem,https://www.reddit.com/r/opiates/comments/8v7oem/how_long_does_it_take_you_to_get_clean_from_h/,13,https://redd.it/8v7oem,evilone7,How long does it take YOU to get clean from H?,I have a drug test in 9 or 10 days and was just curious how long it took some of you guys to get clean? Im think 9 or 10 days should be enough to get clean from H but im going to text myself before hand and substitute fake urine if need be since im not observed. I didn't see any rules against drug test questions so if it is I apologize,1530420944.0
8v7nwk,https://i.redd.it/ed7j90c6p9711.jpg,8,https://redd.it/8v7nwk,pixi3dust,"Guess who picked up another 300mg today, THIS GIRL! 😍🤫😋",,1530420779.0
8v7nqk,https://www.reddit.com/r/opiates/comments/8v7nqk/black_shatter_tar_questions/,16,https://redd.it/8v7nqk,Mr_Magoogoo,Black shatter tar questions,"I Have 1 g, Refuse to slam, I’ve looked at the different ROA. my question is if I smoke it how much should I start out with? If I snorted how much would I start out with, if I boof how much would I start out with. ? I am not opiate naïve. Been involved with pain management clinics for years. But they are cutting us down drastically each month the prescriptions are getting less and less. Any advice information would be great thank you in advance.  Also where are the sidebars located that I keep reading about in different posts",1530420725.0
8v7n47,https://i.redd.it/nkhbu0jgo9711.jpg,46,https://redd.it/8v7n47,N1njaj3w,Have a good nights ladies and gents.,,1530420527.0
8v7lvr,https://www.reddit.com/r/opiates/comments/8v7lvr/it_feels_amazing/,9,https://redd.it/8v7lvr,TuneInTurnUpTurnOut,It feels amazing!!,"I had done opiates of all sorts for around 8-9 years, eventually doing speedballs exclusively little over three years ago.  And that’s when my opinion began to form
   And the opinion is tht Coke is both better/more fun than heroin and it’s family, but also much more vicious.  
    In August I started the Vivitrol program(court ordered), so I haven’t been able to do any opiates, or at least the ones I wanna do, cuz I don’t care for subs all tht much.
   Well to fill the void I’m been pleasing my needle fetish with other drugs like 3f-a-pvp, mdma, and ketamine.  But more than any of those, my best friend and enemy, cocaine.
   It’s really starting to take a toll, especially since I hav solid money coming in and no Wd’s to deal with, so I’m not burning thru my bank account.
   Now I kno it doesn’t have physical wd’s, but I personally think it makes up for tht with extreme mental wd’s.  
   Just wanted to say to anyone curious about IV cocaine... ur gonna love it,  but it’s prob gonna fuck u up.  Pretty sure I had a stroke like 2 years ago.  But thts a story for another day.  Be careful y’all !!!

TL;DR:  (cocaine is too fucking good.  And i don’t think I’m responsible enough too experiences it’s  greatness, but will fer sure experience cocaines Mr. Hyde)

Edit: grammar",1530420133.0
8v7lgf,https://i.redd.it/foxfengsm9711.jpg,71,https://redd.it/8v7lgf,shroomboi928,Why all the hate for my girl Morphine? Honestly one of my favorites.,,1530419980.0
8v7j70,https://www.reddit.com/r/opiates/comments/8v7j70/oxycodone_and_tramadol/,7,https://redd.it/8v7j70,yagudaerufi,Oxycodone and Tramadol,"I've had 7.5mg of oxycodone for a little while now and am wondering how best to potentiate it (rather naive with opiates but need more than this to feel the oxy).   


I was considering approx. 60mg of DXM but have now recently come into contact with some tramadol 100mgs. Which is better? I have experience potentiating codeine with dxm and have dosed up to 150mg of tramadol in the past. I can handle moderate combos of downers such as benzos and alcohol, so I will be safe doing this combo, the question is, what will be more economical and euphoric. A dose of tramadol + 7.5mg Oxy ? or DXM to potentiate the oxy. thanks let me know ur expereinces",1530419215.0
8v7h71,https://imgur.com/gallery/ZeFPveo,5,https://redd.it/8v7h71,saintpetejackboy,Which one of you heathens owns this Imgur account?,,1530418591.0
8v7d4d,https://imgur.com/a/GYhh65A,1,https://redd.it/8v7d4d,M0nk3y_Wr3nch,Lmao,,1530417417.0
8v7bcj,https://i.redd.it/v64di43kd9711.jpg,5,https://redd.it/8v7bcj,jlogic420,First time dilaudid. Besides once in ER,,1530416867.0
8v76bi,https://www.reddit.com/r/opiates/comments/8v76bi/extremely_hothumid_day_d_got_all_clumpy/,20,https://redd.it/8v76bi,piercingssaywhattttt,Extremely hot/humid day - D got all clumpy!,"Throwaway cause,... drugs 



Living in New England in the summertime is hell - despite my best efforts to keep my stash cool and dry,  it’s gotten all clumpy and gummy.  It’s turned a darker brown as well.  I have about a gram left - is there any way to make it more powdery so I can keep sniffing it?  I can snort the little balls it’s formed but it’s kind of a pain in the ass and I would really like to get the powder back.  Plz help! 😫",1530415326.0
8v7514,https://i.redd.it/ctocbrmv79711.jpg,4,https://redd.it/8v7514,MrFuckEmUp,Monkey took my last perc 😡 get the strap,,1530414951.0
8v72lz,https://www.reddit.com/r/opiates/comments/8v72lz/i_am_a_nonuser_who_just_had_to_deal_with_an/,41,https://redd.it/8v72lz,GED_recipient,I am a non-user who just had to deal with an overdose. That shit is scary.,"I am service coordinator for our local homeless population. Been around the block many times at the age of 51. Somehow never got into opiates and am very grateful for that. Anyhoo, this chick was obviously high all day. Spent most of her time on the nod, breathing fine and responsive. I didn't want to ruin her high so just kept an eye on her.

Later in the day she must have redosed because instead of nodding she flat out used the table as a pillow. Now, I may know a thing or two, but I've never actually experienced an OD. I have Narcan training which tells you how to use it, but, not when. 

So when I lifted her head off the table she held it up on her own and mumbled some shit, so, alive and breathing, right??? I stupidly let this go on another 1/2 hour. 

Again, I lifted her head, shook her and loudly announced that if she didn't come out of this I was going to ruin her high with Narcan. Only when she didn't respond to the threat of losing her high did I make the decision to use the Narcan.

Administered the Narcan. Called 911. Nothing fucking happens. She didn't magically come to like they said she would in the training. 3 minutes go by. 4, 5, no change. The paramedics arrive and take over. Still no change. I'm panicking, wondering if my inaction killed this girl. Things did not get better when the EMT asked me how long I waited, seeming to insinuate I waited too long . . .

WHAT THE FUCK!! She was breathing. How the fuck am I supposed to know the difference between someone being high as fuck and goddamn respiratory distress!!! 

She was alive when she was taken away and she better be alive tomorrow. This was my first OD. Not truly knowing what to do and when is a terrible feeling. If she lives I will resent her. If she doesn't I will relive my actions for the rest of my life and blame myself for not acting quicker.

The reason I'm posting this here is not to shame or blame any of you for anything, just to offer my perspective. This is one of my favorite subs for a number of reasons. I like to think you guys helped me to understand things better. Nevertheless, as informed as I believed myself to be, regardless of whether this poor girl lives or dies, this EXPERIENCE WAS FUCKING TERRIFYING FOR ME. I read sometimes about users treating their latest OD casually, even laughing them off because they keep Narcan on hand. Well, as I said, I may not be a user but I genuinely believed I'd know what to do and when, but, I didn't and I'm pissed off as hell that this is what it has come to, that some dumb ass like me is the difference between living and dying for some of you. That is not fair at all.

Please, don't put normies in that position. It sucks. It's unfair. It is potentially life destroying, both for the junkie and the normie. 

I asked why the Narcan didn't work and didn't get an actual answer. I don't know if she is still alive or not. I won't know anything until tomorrow at the earliest. Until then I get to spend the night questioning my decisions and wondering . . . 

Again, just wanted some of you to hear the experience of a non-user tasked with attending to an OD with no previous experience. And again, it is terrifying . . . and unfair, both to myself as well as the user. Fuck this goddamn scourge. Thank you for your time and be safe out there. ",1530414192.0
8v6zsv,https://i.redd.it/a4q4bymy29711.jpg,17,https://redd.it/8v6zsv,pyr088,The playground of a sacred ritual. What does your playground look like?,,1530413303.0
8v6xqr,https://www.reddit.com/r/opiates/comments/8v6xqr/just_want_someone_to_talk_about_life_drugs_and/,14,https://redd.it/8v6xqr,Affectionate_Papaya,Just want someone to talk about life drugs and such for a little bit,,1530412672.0
8v6x5q,https://www.reddit.com/r/opiates/comments/8v6x5q/what_to_do_with_stomach/,7,https://redd.it/8v6x5q,Monotub1,What to do with stomach,"Yo so I ripped lines of hydromorphone for 4 days straight and I’ve been nauseous all day, also my shit is straight liquid is this wd? I also took phenibut yesterday so it could be from that",1530412498.0
8v6skw,https://www.reddit.com/r/opiates/comments/8v6skw/does_anyone_else/,26,https://redd.it/8v6skw,TheRapturee,Does Anyone Else...,"Start to get anxious when you're low on dope? 

If I run out and do my last shot I literally can't even enjoy the high because my brain is starting to panic and tells me ""oh fuck here comes the inevitable""

I always treat the dope I have like it's the last dope that I'll ever have because you never know if maybe you won't be able to get money to get off sick the next day. Our maybe my girlfriend will get sick of driving me up and just say no one one day.

Love your dope, cherish your dope. You never know when will be your last Time copping and you have to quit for whatever reason",1530411027.0
8v6qgs,https://www.reddit.com/r/news/comments/8v41wj/fentanyl_shipment_from_china_worth_17_million/?utm_source=reddit-android,14,https://redd.it/8v6qgs,ODB2,110 POUNDS of fent. Goddamn.,,1530410378.0
8v6mho,https://www.reddit.com/r/opiates/comments/8v6mho/does_anyone_on_this_sub_wanna_play_some_pubg_on/,13,https://redd.it/8v6mho,PUBGChickenDinner,Does anyone on this sub wanna play some PUBG on the PC?,"Nodding OR Not :D

Just looking for some cool people to play with!

Also looking for new gamea to try!

Hit me with your suggestions everyone :D",1530409154.0
8v6jbf,https://www.reddit.com/r/opiates/comments/8v6jbf/how_is_suboxone_different_from_any_opiate/,22,https://redd.it/8v6jbf,milkdudmeowmeow,how is suboxone different from any opiate,"im 3 weeks clean and not trying to use but my dr told me that subs were just like every opiate, i know this is wrong but its been a long time and its alot harder to find what im looking for, so if anyone can tell me how its different and link sources that would be great. thanks in advance ",1530408165.0
8v6hdo,https://www.reddit.com/r/opiates/comments/8v6hdo/kenzos_six_month_scumbag_scam_fest_my/,32,https://redd.it/8v6hdo,Longlivekenzo,Kenzo's six month scumbag scam fest! (My embarrasingly profitable winter of 2016) LONGREAD part 1,"Some of you guys may remember reading the story of my $32,000 scum up. (check my post history) If I had even a fraction of the writing talent of some other members of this sub, I would share some of my stories way more often, because this type of stuff is the reason I love this sub. I feel like the only way I can properly tell the story is in its entirety. So this will definitely get pretty long, so settle in for a long one. (I'm on mobile and tried mybest to format properly)

I don't act like such a piece of shit crumb anymore because I am now on suboxone maintenance. I highly recommend it to hopeless chronic relapsers such as myself. I'm actually a productive member of society now for the first time ever. So I don't scam/rob people anymore. I also feel like it's important to note that karma caught up to me BIG TIME and I definitely paid for all my scumbaggery that you're about to hear. Anyways, onto the story.

November 2016, 5am. I was supposed to see my PO at 8am, but I knew I would fail my urine test. Instead of trying to get into treatment or beg my PO for mercy, I decided to abscond. This meant I would have a warrant for my arrest and eventually I would have to go to jail, but I figured I'd make it through the winter before that happened, and I wanted to keep getting high

So at 5am I head to the city to grab some dope and forget about the consequences that were eventually coming my way. I had just gotten paid so I grabbed two bundles and some powder. While I was looking for a secluded spot to park and get high, my friend D called me on messenger and invited me to his uncle's house. He sent me the address and it was about five minutes from the hood I had just grabbed in. So I decided to go.

D has always been the biggest junkie I've ever met and at this point in time he had no job (he never has a job lol) and a seriously viscous habit. Since he was so close I figured I would go there to enjoy my drugs in relative safety and be JJ for D. I figured he was probably sick af if he is calling me at five a.m to see if I'm in the city. I had never met D's uncle or been to the house but I assumed I would be sneaking in and hiding our drug use. I couldn't have been more wrong. The scene I walked into at Owens house was really bizarre. I see three guys sitting around a table. D, Owen, and Owens friend Mac. It's a typical rowhouse, but this one is a duplex. Owen owned both, the first floor and basement is a  1 bdrm apartment where  Owen lived, and the second floor was a  1 bdrm apartment where  Owen used to have tenants but was now abandoned, and not really liveable anymore. It wasn't immediately clear that this was a full on drug house, but when D and Mac moved in, that's what they turned it into. These three guys were all sitting around the table, stuck, with a shit load of crack and paraphernalia. D explained that they had been up all night smoking crack and they would appreciate it if I could sell them a bundle so they could come down nicely off of all the hard they smoked. I hadn't smoked hard before, but that was about to change

When D pulled out a wad of money, I was shocked. This kid never has money, and any drugs he gets, is done immediately. He tells me between the three of them they cleared almost $600 that night!! I didn't really believe him, so I asked them to bring me into the scheme. Once he did, I didn't return home for six more months lol.

Everyone on r/opiates is familiar with whisper scammers. And most people in America are familiar with catfishing. D was basically combining the two. He had set up multiple accounts on the app ""MeetMe"" with pictures of his ex girlfriends. Since they were exes from before D was a junkie felon POS These girls were all pretty hot. A little too hot IMHO, but since he knew these girls and dated them before, he had pictures that weren't on the internet anywhere. The catfish profiles he set up where really elaborate and well done. They were all at least over a month old. 

He opened up the app to show me how it worked, and as soon as he did there were literally HUNDREDS of thirsty dudes hitting ""Gia"" up. It was really eye opening to see what girls have to deal with in their DMs. New messages (and tons of dick pics Lmao) came in CONSTANTLY. a legitimately overwhelming number of messages that would be impossible to keep up with. He narrowed it down by looking for people that were close to our city, that had a car, and that responded positively when we asked if they got high. Starting with weed and eventually asking about percs and Molly. A ton of dudes fit that criteria, and the majority of them were complete fuckboys who's opening line was something like ""Damn bb you so fine, I wanna spoil you and splurge on you, I'll treat you right I'm a good dude."" (FUCKING LOL) seriously guys, it was comical how cringey/desperate and cliche 98% of these dudes were.... I digress....

D, Owen and Mac were all working separate profiles. The first goal was to get guys to come over to ""smoke, Netflix&Chill, and see what happens"". With an agreement that they would buy or split some weed/molly/percs from ""Gia's"" ""neighbor"". We would either give a random address close by, or give the address for the abandon apartment upstairs. Getting guys to agree to this wasn't as hard as you may think. I was convinced that nobody was dumb enough to fall for it, especially with how common the phrase ""catfishing"" had become, but honestly the hardest part was just pretending to be a flirty interested girl and not coming across desperate for money or shady. But even if the guys noticed some red flags, a ton of them ignored it! The scam could go a few different ways depending on how the conversation went, sometimes it was sex for money, sometimes it was having them buy drugs from us, or even them trading their weed or pills for our weed or pills. 

It's really important to point out right here that we didn't actually have any real drugs! We used the age old oregano and bayleaves for weed. A glued piece if folded paper for dabs. And some random heart pills for percs or opana. Random supplement capsules for Molly's. Since meetme is ostensibly a dating or friend finding app, a solid percentage of our possible victims weren't very educated when it comes to drugs, and if they were, we were able to tell during the convo and change the scam accordingly.

So in no time at all, D has a guy on his way over to get high and chill with Gia. (At fucking 8am no less! God Damn are guys thirsty and desperate!) When the guy gets to the address we provided, D hands the phone off to Owen. Grabs 4 mollies and 5 ""dubs"" of the fake weed. And runs out to meet the poor bastard who fell into the trap. Owen texts the dude and stalls him, saying he is putting the dogs away, or putting her hair up. Whatever. didnnt matter, he just needed to buy a couple of minutes. Then once D gets to the house, he explains he's the neighbor coming to sell gia her drugs, but he's late for work. He tells the guy that gia's door is around back. This whole time Owen is texting the guy saying the same thing. This puts the victim at ease because D clearly isn't the one texting him.... because he's right in front of him. This makes him believe the girl is actually real. HA! They had it down to a fucking science. D then returns to the house with $200 dollars. I was floored. There's no way people are this stupid! There's now way it can be this easy! If he really just made $200 this early in the morning, imagine a Friday night! Right then and there I was all in. I figured I could make some serious money with my natural born bullshitting and this new scam. The next six months were absolutely insane. And if I didn't witness it first-hand, I wouldn't.believe this.scam.actually worked. But it did. It worked insanely well, the money started really rolling in. The meetme scam became all of our full-time jobs.

Parts 2 and more if people actually read this. Lmk what you think!",1530407588.0
8v6gda,https://www.reddit.com/r/opiates/comments/8v6gda/amneal_8mg_bupenaloxone/,13,https://redd.it/8v6gda,SiriusIsBlack,Amneal 8mg bupe/naloxone,"So my insurance just stopped covering the strips. They are now giving me these pills. Can you snort these fuckers? I'm bored, been off opiates for years, and sobriety still sucks. I need a kick. Anyone know?",1530407287.0
8v6fxa,https://www.reddit.com/r/opiates/comments/8v6fxa/thinking_about_shooting_up_for_the_first_time/,25,https://redd.it/8v6fxa,HalfHeartedBootyCall,Thinking about shooting up for the first time,Title says it all. I guess that's it I've blown too much money sniffing dope. I've never been scared of needles... Well at least the idea of sticking myself. Infact I think I'd rather enjoy it.,1530407161.0
8v6f4u,https://www.reddit.com/r/opiates/comments/8v6f4u/love_and_hate_and_disappointment/,8,https://redd.it/8v6f4u,chipper1997,love and hate and disappointment,"i love and hate dope, i love the way it makes me feel... but i HATE what i've become. this shit has made me lose the most beautiful girl i've ever met. she was my everything. the reason i woke up in the morning, the reason i was happy... she is the love of my life, we were engaged madly in love and we are soul mates, my best friend. she had the greatest personality, we had the same weird sense of humor, the same weird personality, the same aspirations in life, and then dope got me. we were both usin dope and when i was snorting it was fine, we never got carried away never used for more than 3 days a month and then the needle fever hit me, i wasn't content with snorting it anymore, i stilll got high, but i realised that i could get high faster with a needle and i was hooked instantly.. the rush was too good, the second  best thing i ever felt in my life besides love. i lost all motivation to do anything besides work just to by more dope, i got lazy, she wanted to move on to the next chapter in life do what we always wanted to do together, travel the world, but i was caught in chapter dope... i got clean but it was too late. basically boys, NEVER TOUCH A NEEDLE IF YOU HAVEN'T ALREADY it will suck you into addiction faster than you can blink man, she warned me but i was too stubborn, thought i was mentally strong enough to keep it the way i always had, just chipping here and there, but nope.            if you see this em, i love you and hope we can still be friends, i'm sorry i let you down girl :(",1530406918.0
