7f7xiy,https://www.reddit.com/r/opiates/comments/7f7xiy/finally_taking_a_week_long_tolerance_break/,12,https://redd.it/7f7xiy,BongChong420,Finally taking a week long tolerance break.,Wish me luck :),1511535244.0
7f7xhm,https://www.reddit.com/r/opiates/comments/7f7xhm/i_dont_want_it_you_can_have_it_back_im_taking_my/,20,https://redd.it/7f7xhm,angelxrose,"I don't want it, you can have it back. I'm taking my life back.","I don't like throwing up. I don't like crying. I don't like scaring my family. I don't like getting chills. My stomach hurts always and I can't keep anything down. I don't want to touch heroin again. 
My friend decided he's done with it when I said I wasn't going to be using anymore. He has to go on subs because it's dangerous for him. I should be fine if I just stop. 
I had to get sober anyway, my boy has been sober for like 6 months  and hes coming home for Christmas, and I can't be a bad influence or have him around that at all.

It won't be that bad, the only drug I need is weed, it's pretty medicinal for me. 
I'm going to see my physicatrist this week, she doesn't know I do drugs.... she recently found out I smoked weed (I've been seeing her for 6 years and smoking that entire time)
I'm 18 now so my parents won't find out. I should just come clean. This isn't right anymore.",1511535230.0
7f7q9x,https://www.reddit.com/r/opiates/comments/7f7q9x/music_while_doped/,13,https://redd.it/7f7q9x,dickballsanus,Music while doped?,a complete album would be nice but songs work too,1511533064.0
7f7npe,https://www.reddit.com/r/opiates/comments/7f7npe/guess_whos_bouta_do_a_nice_shot_of_fentdope/,5,https://redd.it/7f7npe,Thankkratom,Guess whos bouta do a nice shot of fentdope????,"In bout five-six hours im going to do the first shot since Sunday at exactly 8:37 😔 Been in TX with family managing with etilozam kratom and a certian seed, omw back to NY right now fucking crawling with anticipation couldnt tell my mother next to me so im telling yallll. No shooting dope since sunday has been hell, fuck if I couldve shot some water I may have been happy.  Cant fucking wait, ima little boy on chrusmas eve rn mother fuckers. Hope yall are having a good a time as me, just took bout 3mg worth of etiz with oral morphine/codeine/thebaine, happy as a motherfucker ignoring there dumb ass airplane mode shite.",1511532290.0
7f7kyo,https://www.reddit.com/r/opiates/comments/7f7kyo/etizolam_for_small_opiate_withdrawl/,4,https://redd.it/7f7kyo,856Hosting,Etizolam for small Opiate withdrawl.,"Hello , I know this isn't the smartest idea but I only have 2 weeks worth of Etizolam and wanted to use it at night to sleep. I recently stopped opiates and the withdraws aren't terrible but they are catching up to me. I was on low doses (Spilting 2-3x 15mg) of Oxy and didn't use daily but for the past 2-3 weeks I have. I need to get better sleep. I also plan on working out and finding some other hobbies. I've rarely taken a benzo's.",1511531394.0
7f7k7g,https://www.reddit.com/r/opiates/comments/7f7k7g/opioidbenzo_tolerance_based_on_depression_40mg/,2,https://redd.it/7f7k7g,tracy_fleeb,"Opioid/Benzo tolerance based on depression. 40mg Oxy, 6mg Alpraz - still feel suicidal.","I feel like the worse my depression is, the less drugs work. My tolerance levels should have me feeling contented but I just feel sadness and even anxiety. Time to find some harry, methinks. ",1511531170.0
7f7au2,https://www.reddit.com/r/opiates/comments/7f7au2/happy_dayz/,6,https://redd.it/7f7au2,spent-gladiator-2,Happy Dayz,"My pack landed today even though Dream market's been down loads this past few days with all the DDOS shit, thank fuck <3 1.25g of FIRE Afghan #3 :) so I'm good until my 18th bday next Sunday.. finally learning to ration my shit so I can get a better high & save money too.. aiming for a bag a day instead of >2 which is what I'd been having recently... Love you guys, may JJ smile upon you all xox",1511528046.0
7f7aqf,https://www.reddit.com/r/opiates/comments/7f7aqf/heroin_15/,15,https://redd.it/7f7aqf,dopey4,Heroin 1-5,"Hey, I was just curious about where all the different types of heroin come from.  I'm in major midwest metropolitan area.  I assume that the dope we get is #4?  Why is #4 so much more expensive?  ",1511528007.0
7f784w,https://imgur.com/a/6FE4c,26,https://redd.it/7f784w,r1ckyh1mself,Yeah...about that.,,1511527069.0
7f76sg,https://www.reddit.com/r/opiates/comments/7f76sg/i_had_a_botched_surgery_and_now_take_opiates/,52,https://redd.it/7f76sg,ENS_Patient,I had a botched surgery and now take opiates,"To be more specific, I went in for a small surgery and the surgeon skipped thr surgical consent process and cut out my sinuses against my will. 

[Description](https://imgur.com/gallery/a19Yv)

So now I have this incredibly shitty disease called [empty nose syndrome](http://www.sciencedirect.com/science/article/pii/S1879729612000312)

I have ongoing incredible pain from breathing and this frightening and insidious feeling of suffocation. These feelings never go away and get worse when I exert myself. 

Opiates help me cope, so I take them now. Without this medication I probably would have killed myself earlier this year. The pain is unimaginable. 

I'm scared when I hear about placing new regulations on prescription pain killers, or when healthcare providers label people ""drug seeking"" or tell me ""opiates are the wrong medication"" for empty nose syndrome, even though there is no medication and no cure, and it's the only thing that helps. 

I feel like I have to constantly take fiber rich foods to avoid constipation too.

Anyway, I'm suffering pretty bad and I'm glad I have access to these drugs. The medical industry is just so corrupt and dangerous, I almost can't believe it. 

I'm glad I'm alive, but if I didn't have these medications I wouldn't want to be. Every breathe hurts and every activity that makes me breathe harder exponentially increases my pain. 

Anyway, thought I'd share some of my pain, and thank other forum participants for supporting people's access to pain medication. Thanks guys.",1511526598.0
7f72hp,https://www.reddit.com/r/opiates/comments/7f72hp/favorite_song_to_nod_to/,2,https://redd.it/7f72hp,extreme77,Favorite song to nod to,"My boyfriend he gets around, he does favors for Leo downtown
They didn't know it would be a set up, cops surround
That was when we started fighting, that was when I moved out
That was just the beginning, look at me now

I have given up explaining sorrow
Oh I have given up on my hotel
I'm up here dancing like a martyr
But I have given up on casting spells
Oh I have given

Miss Lonelyhearts you've got to help me,
I have tried most everything
Short of my head in the oven
Short of drinking kerosene

Oh I have given

https://youtu.be/o1ppdP8G0LE",1511525030.0
7f6vgg,https://i.redd.it/h31hy7wbqwzz.jpg,23,https://redd.it/7f6vgg,Codexyne,Did rock on brown heroin is a sign of good quality ?,,1511522369.0
7f6lor,https://www.reddit.com/r/opiates/comments/7f6lor/a_relatable_shit_post/,5,https://redd.it/7f6lor,Monochronos,A relatable shit post.,"Ya gotta love being halfway across the country w/d’ing. Knowing I️ got good shit at the crib back home isn’t helping. Man wtf do y’all do to kill the time. 

It usually goes for me: beat off like a billion times, taking long soaks in the tub and listening to music...but then ya get annoyed at the fucking music and just wanna give your brain a bullet enema. 

Judging from the posts here everyone has generally had a good Thanksgiving so that’s good. I’m around a bunch of good people but like another poster said “I’m always alone even when I’m not” 

Return flight 6am Saturday cannot come soon enough. Fuck. ",1511518563.0
7f6eq3,https://www.reddit.com/r/opiates/comments/7f6eq3/so_disappointed/,7,https://redd.it/7f6eq3,throwmeawaynowboi,So disappointed,"So I'm planning on quitting opi's after 1 and a half years of use but wanted to fuck around with dope before I quit because why the fuck not. Anyway monkey water is my preferred ROA and this last pick up is going to be my last before I get on subs. Well I'm disappointed as shit because I only have one dboy and he stopped selling tar completely a few days ago and only has powder now. This normally wouldn't be a problem but the powder is trash. It keeps withdrawals away but the high is nothing compared to the tar. I get so fucking sleepy after railing a line too. Like it has to be cut with a looooot of benedryl. I'm disappointed obviously because I wanted to pick up some great tar before getting clean and get high as shit but now I'm stuck with benadryl cut with a small amount of heroin. It's really confusing too because his tar was fire so you would assume the powder would be too but somehow someway it's a dumpster fire. It makes me sad because the powder looks great, like a nice bag of brown sugar. 

I guess I should be happy I have any dope at all. Sorry for the rant y'all just gotta get the frustration out. I have no one else to talk to about this shit. 
",1511515951.0
7f64kb,https://i.redd.it/sof77whevvzz.jpg,3,https://redd.it/7f64kb,ewport,"oxycodone 20mg rails, havent done opi pills in a while, feeling nice :)",,1511511910.0
7f63wc,https://www.reddit.com/r/opiates/comments/7f63wc/first_time_brown_user/,13,https://redd.it/7f63wc,r039S903X2,First time brown user,"If I wanted to do brown for the first time, no shooting tho, what would I ask for? As far as the slang term? ",1511511620.0
7f62av,https://i.redd.it/c4zb89wrsvzz.jpg,5,https://redd.it/7f62av,nickdankersley,"180 10MG Norco’s manufactured by Sun Pharmaceutical. So many people love these, I just tend to get sick when I take them so have never had the chance to fully enjoy them unless I was dealing with some serious pain that needed to be relieved. I prefer an IP204 any day no doubt!",,1511511018.0
7f61p7,https://www.reddit.com/r/opiates/comments/7f61p7/no_high_off_suboxone/,5,https://redd.it/7f61p7,r039S903X2,No high off suboxone,"I've been taking suboxone (few times subutex) for about 3 years now and my brother always told me how he would basically get a small high and ""energy punch"" when he would take them once In a while when he could come across them(he's not prescribed anywhere near as much as i am - 1.5 or 2 of the 8mg per day, sometime doctor changed doses) 
As stated I've been on them for 3 years, I've gotten all the manufactures damn near possible (orange pills, white pills, and j know there's multiple brands for both orange and white, and I was even on the films that come in foil for about 2/3 years. it's never any different for me. How does my brother (and most addicts / people) get high off of them and i do not? We (me and my bro would be taking the same does too, even tried it when neither us had any tolerance to it at all.) I feel like after 3 years I woulda taken it completely correctly at least ONCE, meaning i should have gotten high at least ONCE!! I guess I'm glad I don't get high so it'll be easier to kick when needed, but stilll, a nigga tryna get Hugh once in a while, especially with the supply that's currently available. 

ANY IDEA ON WHAT IM DOING WRONG YOU DOP FIENDS?! Lol jk love all yous!",1511510799.0
7f5zlp,https://www.reddit.com/r/opiates/comments/7f5zlp/conversation_anyone/,23,https://redd.it/7f5zlp,Howismydriving95,"Conversation, anyone?","This bad motor scooters working a night shift and feelin mighty bored. In that talkative phase, anyone else feeling that way? Down to rant about music, film (well any medium of art really), politics... how porcupines have sex, down for anything really. Hope you guys are doing well tonight.",1511510017.0
7f5y7l,https://www.reddit.com/r/opiates/comments/7f5y7l/sinus_infection_for_almost_2_months_snorting/,28,https://redd.it/7f5y7l,PadawanLOA,Sinus infection for almost 2 months... snorting question,"So I snorted something that I really shouldn't have ( had Apap in it and i wasnt aware) and I've had a terrible sinus infection, loss of sense of smell and almost no sense of taste left and can't breathe out of my nose and . Night sweats for almost 2 months. Just wondering if anyone has had this sort of experience.... I've been avoiding the doctors as I don't want to have to explain this but I've come across stories of necrosis that are terrifying.... will the doctors know I snort even if I try and lie about it? What are other possible excuses or can I just say my symptoms and that's it.... ",1511509469.0
7f5xq9,https://www.reddit.com/r/opiates/comments/7f5xq9/self_harm_and_heroin/,3,https://redd.it/7f5xq9,angelxrose,Self Harm and Heroin,"I used tows self harm in middle school and had a few more small bouts of relapsing throughout high school. 
I found myself buying a crafting blade last night with intentions of cutting. 

I don't know why I went back. I haven't had urges in years. Im not going to make it a problem though. I'm completely off my meds (antidepressant and mood stabilizer) and have been for about three weeks now. I think I'm starting to feel the effects of that, leading me to  this. I got into a fight with  someone I care about, love maybe. I was told I'd   my stuff back and then we wouldn't talk or see each other anymore. I panic. We apologize. We understand we're both half asleep. I take blame for freaking out. I wanted to talk about it but he falls asleep. 

I'm alone.

I rail my last four bags at once. Never done so many like that. I don't feel pain  now, it's been about ten minutes. I dismantled a razor and I accidentally sliced the tip of my finger getting it out. I feel nothing. I run the blade across my arm. I think I'm on the wrong side because I feel nothing. But then the line becomes white, and red, filling with blood
.
This is similar to registering your shot in a sick way. You watch the ident of pressure on your arm either stay the same (which indicates the actual blade side was not used) or fill and bead up with blood.

It just didn't hurt. Usually it stings as the skin tears, usually it hurts. That's dimorphine for you. That could be dangerous though. I had no way of knowing or feeling how feel deep I'm going


I'm nodding out and dripping sweat. I'm mostly likely going to throw up-  

I had to stop typing to throw up. There wasn't much to throw up despite it being thanksgiving. My stomach is bad. 

I nodded out with this post open in my hand at 12:07 am.... I don't know if the post is actually even done. ",1511509278.0
7f5wab,https://i.redd.it/12fsr9w0mvzz.jpg,36,https://redd.it/7f5wab,incrediblyfvkinghigh,When you move across the country away from you junkie friends just to end up walking 5 miles to cop the first week you’re there. Whatcha gonna do.,,1511508746.0
7f5rw5,https://www.reddit.com/r/opiates/comments/7f5rw5/tried_a_whiteboy_wannabe_dboy_out/,9,https://redd.it/7f5rw5,Gudfeels31,Tried a whiteboy wannabe dboy out....,"Pure white-alotta fent. Basically same bags from another dboy gang but the gang has a bit of D in it to relieve those urges. This motherfucker though, he is on point with delivery and quantity but he has a upper in it his cut. I can see the tiny crystals in the powder. Do a small dose before bed and the drip taste normal but than I am tossing and turning with energy after ",1511507162.0
7f5nxb,https://www.reddit.com/r/opiates/comments/7f5nxb/what_did_i_do_wrong/,8,https://redd.it/7f5nxb,Tanwhiteman,What did i do wrong?,"I ate 3 30 mg roxys in a spand of 7 hours. Started to get a really bad headache. Took a 10 mg norco 3 hours later. Puked everywhere, and i still got a bad headache. Wtf happened?",1511505744.0
7f5nd1,https://www.reddit.com/r/opiates/comments/7f5nd1/what_did_yall_eat_for_thanksgiving/,34,https://redd.it/7f5nd1,ricketycricket96,What did y'all eat for Thanksgiving?,"Fried a turkey, smoked a ham, green bean casserole, sweet potato casserole, cranberry shit, biscuits, mashed potatoes, stuffing, sparkling cider, wine, and beer. And two grav bong hits. 

Also had 4 different pies (cherry, apple, pumpkin, and chocolate cream) but was too caught up in a guitar hero tournament to eat pie.",1511505547.0
7f5n4l,https://www.reddit.com/r/opiates/comments/7f5n4l/thankful_i_guess/,8,https://redd.it/7f5n4l,Smew256,Thankful i guess,I am at work till 5am central I only got to have .5mg of sub today and nobody answered and I couldn't get anything from anybody. So I am thankful I have a job wish I could be high...,1511505465.0
7f5f4o,https://i.redd.it/2meelsy94vzz.jpg,8,https://redd.it/7f5f4o,xNegative_Creepx,Happy Dopesgiving y'all!!!,,1511502780.0
7f5dwp,https://www.reddit.com/r/opiates/comments/7f5dwp/my_dads_the_real_mvp/,32,https://redd.it/7f5dwp,Jangles710,My dads the real MVP,"So I'm going in vacation in like 6 hours, and I been in hella pain since surgery so bi stupidly blew through all NY Roxie's I was prescribed abd had worrying about WDs on vacation cause that's a bummer and he hospital had me on multiple opiates in high doses for about two months again. 

Well we went to thanksgiving at my aunts around the block for the day. All my family noticed I was not my normal self and was in pain. And out of left field I'm smoking a butt outside and NY pops strolls over and opens his hand and there's 50 Roxy 10s, he give me three and says they for vacation so I can enjoy myself. Never would have guessed he would do that for me..but also wanna know where he got em from he said he just bought hem for me. 

Stoked for this trip now knowing I have nothing to worry about. Love my dad he's a god amongst men.",1511502372.0
7f5bu6,https://www.reddit.com/r/opiates/comments/7f5bu6/uhhh_so/,12,https://redd.it/7f5bu6,ewport,uhhh so...,i just found a guy who sells fenty patches snd shit and im like ??? he also sells 3 bags of ecp for $30 and im just like???happy thanksgiving!,1511501673.0
7f59zg,https://www.reddit.com/r/opiates/comments/7f59zg/im_drunk/,14,https://redd.it/7f59zg,ldawg413,I'm drunk,"And I just wanna say I love guys and this page, even though I don't post much


And I managed to get a hydro from my aunt, yay me lol (low tolerance but still a HUGE love for opiates😍) ",1511501091.0
7f58yy,https://www.reddit.com/r/opiates/comments/7f58yy/got_started_late_but_thanksgiving_tinychat_is/,3,https://redd.it/7f58yy,everything_is_still,got started late but thanksgiving tinychat is open for anyone who wants to listen to music and tell holiday horror stories. sorry for repost.,"**Tinychat can be VERY shitty about the mobile app so if you can connect with a computer, that is the best option.**  
firstly, this chat is not affiliated with this subreddit or its moderators, and has its own moderators, rules, and etiquette. if you feel someone there has slighted you take it up with the moderators of tinychat, as it is completely unaffiliated with and not endorsed by this or any other subreddit.  
just a reminder and an announcement that a bunch of your fellow degenerate junkies, chippers, and tourists hang out in [our very own tinychat room](http://tinychat.com/ropiatesubchat) which has been an ongoing tradition for something like four years now. the location, for those who can't do links for whatever reason, is http://tinychat.com/ropiatesubchat.  

tinychat is an extremely buggy videochat client, but also the only one that fills its particular niche---that being, anyone who knows the room name may enter, and it has a youtube player. any technical difficulties may be addressed by the moderator, namely me. we like to hang out, listen to music, talk about random shit, and lately have even had our own resident sketch artist who draws random crap upon request. the primary purposes for the room's existence are companionship and harm reduction---it's nice to be able to shoot up with others around, even if you are technically alone in the non-digital sense, and have people keeping an eye on you. we're also glad to help with any problems you might be having, or questions you might need answered. we aim to be a welcoming, friendly space for the members of this subreddit to do what we do in good company without judgement. so stop by if you are bored, or just need to talk.  

if it appears like there is a moderator in the room but who is not speaking, just type a few sentences to summon them back. if you are on mobile it is not immediately apparent that there is anyone in the room. either click the button shaped like an outline of a person (i think) to see the list, or say hello to see if anyone responds.  


rules:  

1. pick a unique username. this is to protect other users so we know who is who, given the nature of the sort of activities we enjoy. 

2. no lurking. again, to protect the other users. if you come in the room be prepared to introduce yourself and participate for at least a few minutes so we know you're not up to any shenanigans. if you are lurking you will be warned and then given a generous ten minutes to announce yourself. if the time runs out, you will be kicked (not banned) until you are ready to come in and actually participate. if you are a known member whose identity can be confirmed, this rule is not applicable.  

3. no -isms or hate speech, even accidental. one warning will be issued, any continued insistence on such behavior will result in a ban. bans can be contested by pm'ing a moderator (me). this includes but is not limited to racism, sexism, homophobia, and transphobia. for example, if you are not black, use of the n-word, even with the -a ending, will not be tolerated. i don't care if your friend down the block lets you say it, it's not your lane. 

4. no auditory fuckery. due to peculiarities of the transmission of sound over a chat, certain echos and effects can be amplified to the point of being severely distressing. if it is determined that your end is causing an echo you will be asked to use headphones, or to mute your microphone when not speaking. deliberately making strange or unpleasant noises to annoy other chatters will not be tolerated, and your broadcast will be closed. (this only means that your video/audio feed will be terminated--you will still be allowed to type.)  

i know the rules seem like a lot but there's really only four of them, and only two that pertain to just behaving in a manner that isn't dickish. 
thanks, and hope to see you there! **don't use alone.**",1511500767.0
7f55yr,https://www.reddit.com/r/opiates/comments/7f55yr/super_stony_and_full_as_fuck/,3,https://redd.it/7f55yr,DragonChaser760,Super Stony and full as fuck,I don’t eat much like I’m sure a lot of you but today I probably ate like 3/4 days worth of normal eating for me and I’m in my bed like the bloated piece of shit I am haha...I was super bummed about not being able to cop till Monday but this Tahoe OG and Cheese(herb) got me chilling the fuck out and recently I’ve been getting pissed cause i haven’t been getting as high as i used to so hopefully a week will kinda help? Monday is gonna be chill hopefully Saturday tho if I can find a good excuse to have Dad let me use truck I need a car fuck,1511499841.0
7f5406,https://imgur.com/a/DSENa,10,https://redd.it/7f5406,JTurtle83,What you boys and girls think? These seem like the real deal but I've mostly been getting As and Ms lately. Thanks,,1511499230.0
7f4zz0,https://www.reddit.com/r/opiates/comments/7f4zz0/i_miss_my_sister/,10,https://redd.it/7f4zz0,andimlike,I miss my sister,That is all,1511497891.0
7f4yc9,https://i.redd.it/h9llecc5ouzz.jpg,14,https://redd.it/7f4yc9,monkeyjorts,Happy Thanksgiving to my favorite subreddit and all its denizens!,,1511497357.0
7f4wo9,https://www.reddit.com/r/opiates/comments/7f4wo9/almost_got_pulled_over_but_the_universe_was_on_my/,8,https://redd.it/7f4wo9,blake2001xx,"Almost got pulled over, but the universe was on my side","So me & 2 friend went to cop, it was a big sale because we all pitched On enough weed & xans & norcos to last a month. Everything went good when we met & we were all feeling hella good my 1 friend that was driving though took a norco without telling us & he was being crazy driving 85 on the freeway & we didn't notice because we were smoking a backwood. But I did notice a motor cycle cop & I was like oh shit out of paranoia because the drugs we have, then I saw he was speeding, then I saw the motorcycle cop turn his lights on & go to put his speedometer away & he dropped it, in that 3-5 second setback we were able to weave through cars to the right lane & exit & didn't get arrested. Hooray lmao. Hope you also have had good nights",1511496790.0
7f4urv,https://i.redd.it/er8l0ismkuzz.jpg,9,https://redd.it/7f4urv,s__v__p,Happy Nodsgiving. This along with 10mg oxy and 1/2mg klonopin is my dinner,,1511496172.0
7f4n9p,https://i.redd.it/lff0793aduzz.jpg,14,https://redd.it/7f4n9p,LaidBackWorker,speedballs all night long... my favorite thing in the world.,,1511493712.0
7f4ixs,https://www.reddit.com/r/opiates/comments/7f4ixs/heaven_knows_what_2014/,6,https://redd.it/7f4ixs,SmokingRickyWilliams,Heaven Knows What (2014),"The best movie I have seen recently is ""Good Time"" so I went searching through the directors (brothers from NYC) filmography and discovered a fantastic little junkie gem titled Heaven Knows What. It's based on the unpublished memoir of the lead actress who spent a considerable amount of time living on the street as a junkie in the Upper East Side of NYC. It's a fantastically accurate portrayal of heroin addiction and the day to day struggle of staying well and attempting to hold on to your soul, as well as the unique toxicity of junkie love. Highly recommended, I torrented it not sure if it's on Netflix or not. ",1511492337.0
7f4iiu,https://www.reddit.com/r/opiates/comments/7f4iiu/most_realistic_dope_shooting_scene_in_movies_or/,30,https://redd.it/7f4iiu,Milo2541,Most Realistic Dope Shooting Scene In Movies or Television ?,"In your opinion, what is the most realistic portrayal of dope shooting in a movie or television ?",1511492208.0
