7wlxqw,https://www.reddit.com/r/opiates/comments/7wlxqw/the_time_i_almost_got_robbed/,28,https://redd.it/7wlxqw,Opithrowawaytrash,The time I almost got robbed,"This happened probably a year ago and was probably the stupidest thing I’ve done in active addiction 

So I’d gotten a 10 pack of 30s a few times from this girls bf who I worked with and had just gotten out of prison and everything has always gone straight.

Well this time dude wanted to meet at a Walgreens and I pull up and he tells me to come inside and then motions to a cig pack on the shelf in one of the aisles and says leave the money there. I’m like nah that’s too sketch just come out to my car so I can check them out and shit. He follows me to my car and I get in and he’s like standing between me and the door and hands me the cig pack and I’m just getting sketched out now and tell him hop in this is weird as fuck.

Well dude gets in and I’m looking at the pills and they are purple and shit and I’m like dude these are what I wanted and he’s all telling me they are new and shit. Well I just got a brand new iPhone and so I start searching the imprint and shit and they are fucking ambien. Im like dude I don’t want these and he’s all like come on bro I didn’t come up for nothing give me something for them and I’m just like dude these aren’t worth shit.

Now I should mention the money($300) is sitting in the door pocket on my side and I’ve got my leg blocking the pocket Incase he tried anything.

Well dude pulls out a pistol and puts it to my head and yelling to give him the money, now I live in a red neck ass state and there’s no hood in the entire state so these dudes are just wanna be gangsters for the most part and I was dope sick as fuck and that was all my money. I told him he’s not gonna shoot me over $300 and to get the fuck out of my car, well he ends up pistol whipping me and splitting my head wide the fuck open like blood is everywhere and starts punching me. I’m laying on my horn yelling and shit and he reaches over me to the door pocket so I start teein off on his head bouncing it off the horn and people are stopping in the parking lot just watching. Dude finally gives up and says something like calling me a pussy white boy and how he’s gonna kill me and bails out of the car. I floor it out of the parking lot but not before clipping him with the car and hitting him on my way out. Get home and shower and the bleeding is just turning everything bright ass red. 

In the end I got 8 stitches, my orbital socket was fractured and the interior of my car was forever ruined and blood stained but I kept my money, he left the gun and pills and his phone lol. Ended up trading he gun for pills the next day so wasn’t a total loss lol.",1518275448.0
7wlszd,https://www.reddit.com/r/opiates/comments/7wlszd/in_terms_of_pain_relief/,22,https://redd.it/7wlszd,Op8d_,In terms of pain relief,"Does one opiate really help kill the pain better than a different opiate at the same relative dose? Is fentanyl the best from a purely analgesic factor? Opana? Dilly's? Good ole h?

And one with real pain and experience?",1518274025.0
7wlna2,https://www.reddit.com/r/opiates/comments/7wlna2/gaming_on_opiates/,32,https://redd.it/7wlna2,Dysphoria_III,Gaming on Opiates,Anyone else here play fortnite on opiates? Holy shot the adrenaline rushes are intense lol and it’d be cool to maybe squad up with some of you if you do :) I’m on psn if anyone is interested,1518272137.0
7wlmv1,https://www.reddit.com/r/opiates/comments/7wlmv1/harm_reduction_or_escalation/,4,https://redd.it/7wlmv1,Lickarockonfoil,Harm Reduction or Escalation,"A few days ago I ran into an old friend at the gas station. He was filling out a lotto ticket at the counter with his back to me. I walked up behind him and said, “hey, you got those lotto folds?”

He smiled and we talked for a while. I could tell he was pissed about something but in line at the gas station wasn’t the place to hash it out. 

I spent the rest of the day trying to recall just what I did to fuck him over and the only thing I could come up with is that I showed his son how to use a needle. 

Truth be told, at the time I was under the impression that his son, my good friend at the time, had shot up before because he told me as much. He said he was having a hard time hitting and asked if I’d help. So I did. 

Soon after I moved to the otherside of the country and ten years slide by. I move back and find out my homie got popped writing bad scripts, reduced his time by ratting on his friends, and still did time on a handful of felonies. 

I’m almost certain that he told his folks I taught him to use a needle and in their minds all of the shit their kid did is my fault.

This wasn’t the first time shit like this happened either. Years ago a girl I ran with and dated did the same thing. Told me she shot up before and asked if I’d help her hit. Again, she came from a dope using family so I didn’t question her. Fast forward a few years and she’s downstate turning tricks and a few people want to fuck me up for introducing her to the needle....

The thing is, in both cases, I probably would have shown them both how to inject if they had been honest about it being their first time. I used to volunteer at a mobile syringe exchange, I’m a proponent of harm reduction and have seen and lived the consequences of unsterile injection practices. 

On the other hand I do feel a little guilt about the way things turned out for these two. Is it my fault? Fuck no. Ive been using a needle on and off since 98 and have managed to do it without sucking dick or hanging my ass out for garunteed felony time.

None the less r/opiates, I’m curious about your opinions and experiences. Has a desire to practice harm reduction ever painted you as the “bad guy”? Have you ever felt responsible on any level for leading a pal down a dark path? 

",1518271972.0
7wlgie,https://www.reddit.com/r/opiates/comments/7wlgie/beam_me_up_scotty/,14,https://redd.it/7wlgie,Oldman6868,Beam me up Scotty!,"Anyone else wish that our phones could upload a photo of something and then somehow the phone ""transmits"" whatever the photo is of. At the moment I am particularly wishing that some or all of these loaded  fits full of h would suddenly appear! Oh well dream on!",1518269721.0
7wlgcz,https://www.reddit.com/r/opiates/comments/7wlgcz/is_this_desperate/,6,https://redd.it/7wlgcz,rockbottom11,Is this desperate,"Felt like doing some D last night. Problem is I have only one connect. Havent seen him around town in months and he got a new phone number so there's no way to connect with him.

Knocked on his door last night and his mom said he wasnt there. I knocked on his door the other day too and the same thing happened. I didn't want to be a bother anymore so I did something unusual...

I walk down the street to the ShopRite and stole Post-its and a pen. I then went back to his house and left a note with my phone number written on his front door. I didn't want the post it to fall off so I tore off the glue part of like 2 other post its just to tape it down well.

I just wake and baked and feeling introspective. Kind of feel what I did last night was desperate. let me know if you feel the same",1518269661.0
7wlfcq,https://www.reddit.com/r/Drugs/comments/7wf6kf/need_some_clarification_before_i_call_this_girl,11,https://redd.it/7wlfcq,speedy_hippie,"What the fuck people, why did he even need to make a post :D (x-post from /r/drugs)",,1518269310.0
7wle94,https://www.politico.com/story/2018/02/06/kellyanne-conway-opioid-drug-czar-325457,6,https://redd.it/7wle94,DenverDopeMan,Trump Administration putting political appointees over drug policy professionals to combat epidemic.,,1518268855.0
7wlcir,https://www.reddit.com/r/opiates/comments/7wlcir/harm_reduction_over_the_counter_narcan/,2,https://redd.it/7wlcir,into_the_mist,Harm reduction/ over the counter Narcan,"Walgreens is starting to carry otc Narcan. You don't need a prescription to get the drug. I called a local Walgreens last night and the pharmacist had never even heard of the program because apparently it's brand new. She looked it up though and it's legit. She said a pack of two shots would be about $40. Keep in mind that in your area it may cost more. According to what I've read they're rolling the program out in all Walgreens in all 45 states that allow it. Here is a link for more information and if you Google it you'll be able to find even more.

https://www.google.com/amp/www.ajc.com/news/national/walgreens-begin-selling-otc-narcan-combat-opioid-epidemic/PExk0ijHUcoJ2dMerEipiN/amp.html",1518268185.0
7wl60s,https://www.reddit.com/r/opiates/comments/7wl60s/im_mo_north_memphis_than_some_dog_food_up_my_nose/,10,https://redd.it/7wl60s,Thaistyle86,I'm mo' North Memphis than some dog food up my nose. I'm mo' North Memphis in the hood scoopin' junkie hoes,"Mayyyyne Project Pat c. 2003 still goes too hard in my car.  Sometimes I wonder what Asian dope fiend hoes think about it...

My regimen tonight is 360 mg codeine, 400 mg tramadol, 1400mg soma, 4 mg xanax, and a couple of beers hoping my boy comes through with some fire dope tomorrow",1518265646.0
7wl1xc,https://www.reddit.com/r/opiates/comments/7wl1xc/guys_im_almost_out_and_need_help_and_suggestions/,26,https://redd.it/7wl1xc,tempeoaccountio,Guys im almost out and need help and suggestions,"I have 3x 100mg  morphone sr pills left to last till tuesday/hopefully i get rescripted Wednesday..

Im on 200mg a day.

Today i just took 1 pill. This has to last me for around 24 hours ....


I really dont know how to make them last the craving is insane.

I have a very small amount of benzo lying around..... but i have to work 2 of these days.. my idea would be to force myself to sleep for as long as possible... but people would notice obviously.

Wtf can i do :(

Im thinking of breaking a leg to get something from a&e...

Edit. Didnt have to break my leg! ",1518263975.0
7wkzr9,https://www.reddit.com/r/opiates/comments/7wkzr9/overdose/,16,https://redd.it/7wkzr9,daddytilt,Overdose,I was told by a friend that he injected milk into someones arm to reverse his heroin overdose and it worked. Does anyone know anything about this? Is it true or false. I cant see injecting milk being goood for you. Know about other remedies to reversing overdose symptoms other than Narcan? Any information would be greatly appreciated. ,1518262954.0
7wkutd,https://www.reddit.com/r/opiates/comments/7wkutd/something_weird_going_on_with_my_dillys/,5,https://redd.it/7wkutd,HuntressIskra,Something weird going on with my dillys...,"Okay so I've posted a few times here. 2 pills of 4mg dilaudid is my DOC... I can easily take like 20-40mg a day and stay happy. 

I recently took about a 3 week break. Im just assuming my tolerance went down so I took just 4mg instead of 8mg right away. I felt fine, everything was great. Did 16mg that night. 

The next day (today) I took 4mg when I got up in the afternoon... Instantly start vomiting. It's been 12 hours and I'm still vomiting. I can't keep any food or liquids down. What the hell?! Every time I try to snort another pill I throw up. 

Has anyone else ever experienced this?! I've been using for about a year now.... ",1518260589.0
7wkrsz,https://i.redd.it/z3ys2adb6df01.jpg,12,https://redd.it/7wkrsz,alexnothing,Addicts trying to get opiates,,1518259108.0
7wkpc2,https://www.reddit.com/r/opiates/comments/7wkpc2/on_4_and_a_half_hours_fucking_piss_post/,15,https://redd.it/7wkpc2,bunnies4r5,On 4 and a half hours..... fucking piss post...,"Man I am getting so fed up with not being able to piss. It has never taken me 4 hours with no fucking results. Im litetally in my room naked sweating bullets trying so very hard to take a piss. I have had episodes where ot can be hard to go but not like this. I had this exact same issue last week and after 6 fucking hours i finally went but thats 6 hours of my dope high wasted and now its happening again. I am so full of liquid i can feel the urine at the tip of my dick but it just wont come out, I am on yhe verge of tears......

allright, thanks for reading my rant, back to tying to pee, wish me fucking luck....",1518257854.0
7wkjyj,https://i.redd.it/rdbnr55hvcf01.jpg,18,https://redd.it/7wkjyj,sugarhillsix,Prepared for my Overnight Shift. Had a Bad Day. Trying to Improve it.,,1518255464.0
7wkhrb,https://i.redd.it/gi60iif4scf01.jpg,19,https://redd.it/7wkhrb,StayWoke11,"Dinner of champions. Cheerios with Hershey’s syrup. And a little 4.5 gram chunk of mexican mud. What’s your favorite late night munchie snack? Need some new ideas, I’m not very creative in the kitchen.",,1518254363.0
