a0ctpv,https://www.reddit.com/r/opiates/comments/a0ctpv/lets_talk_about_the_first_time_you_tried_heroin/,9,https://redd.it/a0ctpv,ubercharlesinit,Lets talk about the first time you tried heroin,"So I'm genuinely interested in people's first times trying heroin. The thought process and events that led up to you using. Did you enjoy it your first time? Did you continue to use and if you did, did you plan on it?

I kind of had two ""first times"" trying heroin.. Both times I thought I was doing another substance.. the first instance I was about 18 I believe and I wasn't too familiar with opiates at all to be honest, had some experience with like oxys and hydros but nothing too extensive, same thing with my friends no one had much knowledge. Well this was around 2015 and me and my friends listen to a lot of modern rap and these rappers are always rapping about xans and lean and shit.. well we all know codeine is the main ingredient in lean that gets you lit.. well this older dude 21 ish started living with one of my younger about 16ish friends cause his house was kind of the trap and what not. Well to shorten it up this dude stating selling all these kids ""codeine powder"" ...... Well right away I knew to get codeine powder you need to do a cold water extract from pills and these kids were getting grams of this shit I knew it didn't add up. Tried warning them this is probably heroin but no one knew for sure. WELL IT JUST SO HAPPEN IM THE ONLY ONE IN MY FRIENDS GROUP THAT OWNED OR USED TEST KITS. So I ask to get half g of this stuff to test it. And to be honest I couldn't determine just heroin from the test it looked like heroin and a mix of different rcs cause it was funky but like the green was there so it could of still possibly been Codeine but in my mind I kind of knew? Ended up putting this shit up my nose and I've taken codeine before and this was muuuuuch stronger weigh wise. Yeah ended up telling everyone and they were in denial for about another couple weeks until it came out that it was heroin and they kind of knew the whole time. At this point no one cared, fuck it right?
Second instance I was tryna grab some bars off my friend cause I was driving 150 miles somewhere close to his city to buy a car. Well I was supposed to get like 45 bars or something, ended up getting this powder and told it was ""alprazolam powder"" well I put some up my nose and kind of knew it was opiate high but was in denial myself. It was a super good friend that sold it to me, we still talk to this day and I kind of confronted him about it and didn't really get much of a response. Now he's my only trusted heroin dealer.......

Lemme know your thoughts and personal experiences?",1543182851.0
a0crvu,https://www.reddit.com/r/opiates/comments/a0crvu/vivatrol_opiate_blocker_shots/,10,https://redd.it/a0crvu,chillioutdogg,Vivatrol opiate blocker shots,My girlfriend is scheduled to get a vivatrol shot in 2 days but smoked 2 points last night? Is she going to be sick when she gets that shot? I know doctors say you can’t use anything 10 days before getting the shot. Any info on how to prepare her body to get ready for the shot is much appreciated ,1543182518.0
a0cngx,https://i.redd.it/qrn18iywpj021.jpg,14,https://redd.it/a0cngx,twistplot,"My sister overdosed back in 2017. Recently went back through her things and found this. For those struggling, I wish the “hopefully not” turns out to be a definitely not/not anytime soon for you. I believe in you.",,1543181683.0
a0cl3x,https://www.reddit.com/r/opiates/comments/a0cl3x/where_to_hide_my_stash_in_carryon/,20,https://redd.it/a0cl3x,Duttylaundry,Where to hide my stash in carryon,"So after much debate I've decided to not risk bringing dope on the plane to my family vacation.  So that means I will need to bring a few suboxone strips and about 30 valium pills.  I figure I will separate the strips and hide one in my wallet, one between the pages of a book, etc.  But my question is if I cant find an otc medication that is the same color and looks similar to the valium (green Mylan 477) could I just put them in a container of mints? Or will they even inspect the otc medications close enough go tell they are a different color?
",1543181259.0
a0chzl,https://i.redd.it/5prde76wmj021.jpg,11,https://redd.it/a0chzl,bongtheripper666,Some killer fent I paid 100 he said I probably needed to cut it I thought he was bullshiting me but I took a hit the size of a grain of sand shit knocked me on my ass first opiates I've had in awhile since I got my job back,,1543180667.0
a0chj5,https://www.reddit.com/r/opiates/comments/a0chj5/plugging_oxymorphone/,4,https://redd.it/a0chj5,Colaman23,Plugging oxymorphone,"Is it worth it? What is the bioavailability compared to snorting? Not looking to shoot, and snorting always gets the job done, I’m just wondering if plugging would have any added kick ",1543180579.0
a0ce2l,https://i.redd.it/dbd11wjukj021.jpg,9,https://redd.it/a0ce2l,ahha43,Am I trippin or is one of these different? Got from the same guy but the right one feels slightly skinnier. Does that happen with pills sometimes?,,1543179977.0
a0cc0r,https://www.reddit.com/r/opiates/comments/a0cc0r/how_popular_is_fent/,6,https://redd.it/a0cc0r,That-one-timeitried,How popular is fent,"So where I live I've never ran into fent. Its all bth here that comes straight from Mexico but I'm moving in a month for my husband's job, it's also a border state (the big one) I'm nervous about finding dope when I get there but then I started thinking about fent and wondering if it's really popular in other places. Is it popular where you live?",1543179611.0
a0c4gy,https://i.redd.it/w1tg2poqfj021.jpg,27,https://redd.it/a0c4gy,AK-caveman101,Would this get you lit,,1543178267.0
a0c2zy,https://www.reddit.com/r/opiates/comments/a0c2zy/rc_opiates/,6,https://redd.it/a0c2zy,NodEazy,RC Opiates?,Are there any RC opiates that wont show up on a regular 10 panel drug test.? ,1543178020.0
a0c1ce,https://www.reddit.com/r/opiates/comments/a0c1ce/im_asking_santa_for_narcan_this_christmas/,7,https://redd.it/a0c1ce,sohee9687,I’m asking Santa for Narcan this Christmas,,1543177726.0
a0bz0j,https://i.redd.it/a2n9nbwwcj021.jpg,4,https://redd.it/a0bz0j,acslater89,Weooooo Lectos. Valiums an dillies. Happy day,,1543177310.0
a0bw0e,https://i.imgur.com/OjFNRE0.jpg,23,https://redd.it/a0bw0e,I_touch_meinself,Why do you have to play me like this Gam Gam?,,1543176803.0
a0burr,https://www.reddit.com/r/opiates/comments/a0burr/how_can_i_help_a_relative_who_is_oblivious_and/,30,https://redd.it/a0burr,CDN_a,How can I help a relative who is oblivious and doesn't want help?,It's a tragic situation and I haven't a clue how to approach the situation. A relative is using Oxycontin and I fear is addicted and will die without intervention. What can I do? Is there anything I can do? Any help much appreciated! Thank you!,1543176574.0
a0bu9b,https://www.reddit.com/r/opiates/comments/a0bu9b/put_your_favourite_song_lyric_about_heroin_in_the/,49,https://redd.it/a0bu9b,weedtripper,"Put your favourite song lyric about heroin in the comments, then see who can guess what yours comes from!",,1543176487.0
a0bqam,https://www.reddit.com/r/opiates/comments/a0bqam/new_to_fentanyl/,20,https://redd.it/a0bqam,seth1134,New to Fentanyl,"I was switched from 10mg Percocet to 12 fentanyl, I have been freezing (something rare to me as I tend to be nearly immune to it until now), having a constant runny nose, terrible fits of anxiety and depression. I was put on to the patch because I failed a drug test (for THC... which I told them I use to help me with the pain. He was a huge dick about it and put me on this patch instead of the pills and told me I have a drug problem!?!) I am on day 12 of this patch and I am not adjusting to it. He refused to answer any of my questions so I need help from you all. 
Thanks, 
Seth",1543175790.0
a0b0pl,https://www.reddit.com/r/opiates/comments/a0b0pl/heroin/,27,https://redd.it/a0b0pl,ChavExplorer,Heroin,Does anyone here actually take heroin recreationally without becoming addicted? ,1543171229.0
a0azt1,https://i.redd.it/u1lqf5dbui021.jpg,18,https://redd.it/a0azt1,30gauge,My $50 gram. I love border towns.,,1543171054.0
a0atgt,https://i.redd.it/3b0ibp5tqi021.jpg,4,https://redd.it/a0atgt,Pharmer760,First time smoking in over a year,,1543169880.0
a0atfm,https://www.reddit.com/r/opiates/comments/a0atfm/suboxone_and_the_hazzle_to_cheat_it/,4,https://redd.it/a0atfm,DopieOne,Suboxone and the hazzle to “cheat” it,"If I took 12 Mg suboxone this morning 5.30 am,                            
 I’ll take nothin tomorrow maybe 20 Mg methadone.                        
and the kickstart Tuesday with 40 Mg methadone and then starts smoking #3 

- would that be a total waste?? I have some .5 k pins to stir shit up both days.",1543169873.0
a0ao0y,https://i.redd.it/uwhe5t6tni021.jpg,9,https://redd.it/a0ao0y,EskomojoE,Good investment to go with your scale,,1543168866.0
a0alnp,https://i.redd.it/wmijlsfjmi021.jpg,9,https://redd.it/a0alnp,throwthisaway1273747,I just shot up and my arm had a weird reaction. Can someone help me out and try to explain?,,1543168448.0
a084et,https://www.reddit.com/r/opiates/comments/a084et/just_used_my_last_two_bags_cant_reup_immediately/,8,https://redd.it/a084et,FrankNSam,"Just used my last two bags. Can’t re-up immediately, should I take Kratom or Suboxone next?",Title says it all.,1543148890.0
a0ajz1,https://www.reddit.com/r/opiates/comments/a0ajz1/boofing_gunpowder/,2,https://redd.it/a0ajz1,WryneckNigga,Boofing gunpowder,How well does gunpowder usually dissolve in water. I'm planning to use an oral syringe to boof some. Any tips?,1543168145.0
a096qu,https://www.reddit.com/r/opiates/comments/a096qu/how_many_of_you_guys_would_compare_your_lives_to/,13,https://redd.it/a096qu,FizzyJews,How many of you guys would compare your lives to those that I see on Live PD?,,1543158706.0
a09bbr,https://www.reddit.com/r/opiates/comments/a09bbr/got_some_fire_on_a_front_from_the_d_boy_after_2/,2,https://redd.it/a09bbr,monwymike42314,Got some fire on a front from the d boy after 2 days of being sick and broke,(https://i.imgur.com/08T3ZbU.jpg),1543159730.0
a0afpu,https://i.redd.it/g6c7b8waji021.jpg,6,https://redd.it/a0afpu,jlogic420,"Xans, half g of dope and a tiny bit of fent",,1543167373.0
a0ae0n,https://www.reddit.com/r/opiates/comments/a0ae0n/suboxne_questions/,3,https://redd.it/a0ae0n,BigPharma_Cartel225,Suboxne questions,"I took 1 8mg strip around 7am, and another at 8am yesterday. I threw up 10 minutes after the second strip so I'm not sure how much absorbed. I took these too soon after my last opiate dose and went in withdrawal symptoms, it's been around 30 hours so far, how much longer should I wait before trying to dose again with an opiate that's not a sub to get the effects I read so much conflicting info on bing bc google censorship. Anyone have any idea? Thanks

",1543167081.0
a0addd,https://i.imgur.com/lc689Gh.jpg,8,https://redd.it/a0addd,GATOR_SIMPSON,🐼 gang 😁,,1543166974.0
a0a8fo,https://www.reddit.com/r/opiates/comments/a0a8fo/pleasant_experience_with_pharmacist_cashier_not/,71,https://redd.it/a0a8fo,CranjusMcBasketball2,Pleasant experience with pharmacist. Cashier not so much,"I usually go to Walgreens to buy syringes. I rarely, if ever have a problem besides the sideways glances and judgement. 

This time, I sent my husband. The girl behind the counter gave him shit, and made sure to loudly ask him if he had a prescription.  When he said no, she went and loudly asked the pharmacist. Well, the pharmacist reemed her and said something to the effect of ""why would he need a prescription? This is part of our safety policy, to provide clean needles to those who need them. This is what we're here for, to make sure they aren't using dirty needles. Give him his syringes.""

Right on pharmacist!

",1543166094.0
a0a89l,https://www.reddit.com/r/opiates/comments/a0a89l/separate_heroin_from_cut/,10,https://redd.it/a0a89l,macd0g,Separate heroin from cut,"Is there a process to separate the heroin from the cut? Like I know with pills you can filter it and then microwave it or something? Would a process like that work for just straight powdered heroin? 

Whatever this bag is cut with is making the shots really thick and kind of waxy/slimy. If there's a way to get whatever that nasty cut is out, I'd feel a lot better about IVing it. TIA",1543166059.0
a0a4df,https://www.reddit.com/r/opiates/comments/a0a4df/dhc_pills_are_waxy/,3,https://redd.it/a0a4df,Razulol,DHC pills are Waxy?,Got DHC slow release 60 mg's. Smashed them into powder but they are Waxy. Will it still slow release if i take the powder waxy? How can i remove the Wax inside,1543165395.0
a0a0fe,https://imgur.com/a/LG7HiRj/,4,https://redd.it/a0a0fe,Oxiconone,I found this chart to be particularly informative. Most contain non opiates & opiates however this includes blocks etc. I found it interesting anyway 😊,,1543164703.0
a09ow8,https://www.reddit.com/r/opiates/comments/a09ow8/whisper_hook_up/,11,https://redd.it/a09ow8,doublebforthe775,Whisper hook up,So this guy us asking me to pay in amazon gift cards. But only 15 bucks. I figure its a scam. But why ask for so Little? ,1543162502.0
a09khq,https://www.reddit.com/r/opiates/comments/a09khq/is_getting_needles_a_big_hassle_for_you_guys/,39,https://redd.it/a09khq,oneshotnicky,Is getting needles a big hassle for you guys?,"So I don't shoot anything and I don't plan on it(im an idiot and I fear id fuck the process up and get an infection or worse)

But my friend just got arrested trying to get needles in CVS. He said he needed them for his diabetic girlfriend they said no but he kept asking and begging. He got the needles went directly to the bathroom shot up nodded off and the employees called the cops and they found an 8 ball of dope on him and took him to jail",1543161620.0
a09dj6,https://www.reddit.com/r/opiates/comments/a09dj6/thick_solution/,14,https://redd.it/a09dj6,macd0g,Thick solution,"We got some ""white china"" (yeah right, dboy) today and when I did my shot, I noticed that when I cooked it a little it had made the solution extremely thick. The next shot we did, I didn't heat it at all and it was less thick but still enough to be worrisome. Not sure what it was cut with but is this safe to be injecting? Is there anything I can do besides diluting it more with water? It's weak as hell so I have to do a lot per shot and my rig only holds so much water and I've diluted as much as I can but it's still thicker than other boy I've had. ",1543160200.0
a09a81,https://www.reddit.com/r/opiates/comments/a09a81/am_i_the_only_one_here_who_just_enjoys_a_light/,9,https://redd.it/a09a81,RazorsharpLTU,Am i the only one here who just enjoys a light buzz?,"Hey, i've been a user of codeine for about a year right now, strangely i have no need to use it anymore, just some odd reason. A month ago i was having what would be ""withdrawal"" symptoms, and craving. But now i just... stopped. Guess my tolerance skyrocketed for some odd reason and i just don't feel the ""high"" as much, but i never went in to get high off my ass or nodd out, just treat my anxiety and as a light social drug (not as extreme as meth or MDMA, less draining on the whole)

Is it just me, or am i the only one who is able to use opiates lightly and just be content with that? I was offered fentalouges recently, but rejected them too, even knowing that they're far cheaper and more cost effective...

Anyone else here who can use light opiates and not crave them/go about a week or so without using? And i'm not talking about the guys here who have been dabling in opiates or just using for 2/3 months. I'm talking about the 1 year+ constant users (once a week or more)",1543159497.0
a097w3,https://imgur.com/dPAwioI,9,https://redd.it/a097w3,fuckathrowy,Dooe porn (no fent) 😍,,1543158970.0
a093dp,https://i.redd.it/gjpaop6frh021.jpg,12,https://redd.it/a093dp,longpig154,Heavenly,,1543157973.0
