7966pe,https://www.reddit.com/r/opiates/comments/7966pe/first_day_on_methadone/,7,https://redd.it/7966pe,Iledahorsetowater,First day on methadone,"I feel warm and fuzzy and a little sleepy with absolutely no withdrawal. Went out to lunch, then picked up a friend and kicked it. He just started the methadone clinic too 2 weeks ago. We smoked a bowl and watched tv on this rainy day until he had to catch the bus. It seems like it might go well. 

I want to eventually have more energy and not be as tired but to not be in withdrawal and feel comfy feels great. Adjusting to this won't be too bad. Feel hungry though. ",1509139669.0
7962jy,https://www.reddit.com/r/opiates/comments/7962jy/quitting_pain_management/,4,https://redd.it/7962jy,time4browser,Quitting pain management,"So I've realized that I have to stop getting opiate prescriptions because I've blown the hatch off my addiction and started taking a lot more than prescribed.  I want to quit opiates altogether but don't want to mess up my medical records.  Can I just not show up at my next appointment or should I go and tell the doctor I'm going to stop the clinic.  I'm on my last warning there anyway, tested positive for fentanyl once, been short a pill or two and cancelled an appointment with little notice.  I don't want her to think I'm scared of the drug test again and simply bailed, then flag my records.  I need to leave on good terms in case I need the option of pain management in the future.",1509138485.0
79602b,https://www.reddit.com/r/opiates/comments/79602b/opiod_billionaire_gets_slapped_with_rico_for/,3,https://redd.it/79602b,DarknessIsVisitingMe,Opiod billionaire gets slapped with RICO for pushing Fent,"This fucker is done, if he's lucky 20 yrs will be the judge showing mercy if convicted. He better have squirrled away quite a few million cause all his assets are frozen and if he didn't prepare public defender in the house.

I loved dope, but when my boys started dropping in 2000 from fent laced bags that were done not to supe it up but to OD a homie so the addicts would come running to the shit ""that's gotta be good if it killed his ass""

Do your thing folks no judgement. There's more fent then smack on the street, and more oxy presses that are straight fent on the markets.

Stay safe out there and always have Naloxone nearby just in case.

https://www.forbes.com/sites/michelatindera/2017/10/26/opioid-billionaire-arrested-on-racketeering-charges/#4b2fe1936a00",1509137807.0
795qsx,http://www.qontrac.ml/2017/10/the-hard-way.html?m=0,6,https://redd.it/795qsx,Dumpythewhale,This was on r/documentaries. What do u guys think of it?,,1509135265.0
795p62,https://www.reddit.com/r/opiates/comments/795p62/subutexsubuxone_aka_buprenorfine/,6,https://redd.it/795p62,AleSuo,Subutex/subuxone aka buprenorfine,How common is abusing subutex/-xone at the us? At Finland bupre has replased the spot of heroin and other opioids at being the most abused drug. I was just wondering since it's purpose is to be a replacement to heroin and since heroin is quite common at the us it must be seriosly rare that someone would abuse subutex or subuxone.,1509134837.0
795o1h,https://i.redd.it/fjei5ft9ifuz.jpg,12,https://redd.it/795o1h,petepopspercs,Just Re’d up so you know I’m feeling good!,,1509134570.0
795ndd,https://youtu.be/mrZRURcb1cM,4,https://redd.it/795ndd,pm_me_that_fire,Dream,,1509134393.0
795i9i,https://www.reddit.com/r/opiates/comments/795i9i/102717_official_fun_friday_thread_get_in_here/,14,https://redd.it/795i9i,Cujuabled,10-27-17 Official Fun Friday Thread. Get in here. Also I need advice.,"It's one of those days where I have jack shit going on, but those in my life are all busy. So my plan was to chill on here with you guys, but it's pretty damn slow on here so far so you guys must be doing stuff too. 

To get things going I have a question. So my best friend and I got along great right off the bat. We always say that she's my feminine side, or if I were a girl it would be her, we're basically the same person. She doesn't have any sort of addiction problem, but she's pretty knowledgeable about it. She's helped me out a ton since we met and I've always called her the MVP of my support system. However, self destruction mode is my default, it's honestly all I know, so I couldn't imagine how exhausting it must be to willingly help me through this, but I'm being grateful for what she's done. So this summer it had been crossing my mind that she doesn't have any sort of obligation toward me, but she still puts up with my bullshit. So I had a good talk with her, and basically said that I realise being my best friend is very emotionally taxing, and if she ever needs a break from that side of me I would completely understand. She told me it's definitely not easy but she loves me, knows that I'm more than my addiction, and she'll have my back through thick and thin. This was an incredible relief to hear. 

So it was probably a little over a month ago that I made a phone call her. One thing led to another, and she was just sobbing over the phone and said my self destruction is too much for her and she can't take it anymore, and she needs that distance. I told her I completely understand and wish she had told me earlier. I was under the impression that it was distance from my fatal flaw, but no. Since that phone call I've seen her for maybe 40 minutes total in person, which I've only seen her when she needs me to sell her pot. She pretty much only hits me up for pot, we don't actually talk anymore. 

You guys I miss her so fucking much. A lot of bad shit has started happening since that phone call, and also another a couple other people have dropped me even though I've used heroin only 2 or 3 times in this last month. I can't blame them, but it hurts. I didn't even utilize my support system often, but now that it's basically gone I don't know what to do. I want these people back but they don't want me. I'm trying really hard not get sucked into beating myself up for yet again losing something great in my life to my flaws. Except I didn't even really LOSE them, they actively and consciously made the decision to remove me from their life, and I put them in the position where they felt that necessary. They know I'm clean, but still don't seem to want to see me. How the fuck do I cope with this? It feels terrible and I don't want it to anymore, it's killing me but I don't know how to internally deal with this.

Also love you guys. Happy fun Friday.",1509133017.0
795gdq,https://www.reddit.com/r/opiates/comments/795gdq/smoking_soft/,16,https://redd.it/795gdq,Btghasel,smoking soft?,"i know its not an opiate, but bear with me. how have you guys smoked soft? i obviously know hard is really the best way to smoke coke, but all i got is soft at the moment. ive heard adding a little baking soda and water, stirring it up, ""cooking"" that mix on the foil, while simultaneously smoking it is basically your best option, but I'm open to suggestions. thanks. ",1509132522.0
7957r0,https://www.reddit.com/r/opiates/comments/7957r0/pain_management_and_heroin/,20,https://redd.it/7957r0,calibound96,Pain Management and Heroin...,"Alright guys I have a weird situation. What do you all do when your doctor won't adjust dosage to your tolerance that he gave you in the first place and you eventually need to go to rehab of some sort for heroin whether by choice or court order? It's just a wierd position for me because I've tried methadone/sub clinics, non drug assisted treatment and everything but everywhere turns me away for being in pain management... How do I fix this because I'm basically stuck taking 1/2 -1/3 the dose I need unless I buy strips/syrup(done, not that codeine crap)/pills (you all know that doesn't make sense if you've used heroin...) or just do heroin. I mean what do I have to tell these people besides that I want off pain management? I've had some pretty compassionate therapists / social workers look at me and say ""Damn... You're stuck in between a rock and a hard place honestly"" and it all looks pretty bleak. ",1509130246.0
7957hc,https://www.reddit.com/r/opiates/comments/7957hc/first_time_poster_beginning_wds/,18,https://redd.it/7957hc,woahcotrez,First time poster beginning WDs,"I hate it so much. At work hiding in my car for a few minutes. Can't take anymore sick time or I'll be fired. No money, and my family wants me to do errands for them all weekend. Idk what to do at this point except pray for what you guys call Junkie Jesus 😂",1509130174.0
7953r0,https://i.redd.it/pffy0bfd2fuz.jpg,50,https://redd.it/7953r0,Cts--V,No land in sight for 100 nautical miles. For the ones asking for more pics lol,,1509129189.0
7951rk,https://i.redd.it/byt7w0ls0fuz.jpg,118,https://redd.it/7951rk,Cts--V,This chickens been staring at my car for a minute now lol,,1509128658.0
794zsm,https://www.reddit.com/r/opiates/comments/794zsm/i_used_to_make_fun_of_the_rls_commercials_more/,62,https://redd.it/794zsm,inlovewithheroin,I used to make fun of the RLS commercials (more like restless body syndrome),"I thought it was made up when I was a kid. Little did I know....isn't it ironic? Dontcha think? 🎶 😑 How can a sensation that is not pain be so agonizing? It's a crock of shit. I'd rather bite my own finger off (if it would grow back😂) than go through that again. I'm praying for those of you currently in the middle of full blown WD. It's by far the worst feeling in the world. 

Those of you planning a relapse...take a moment to remember. 

drugs that help: gabapentin, clonadine, Imodium, kratom, suboxone, magnesium ",1509128138.0
794typ,https://i.redd.it/057jo9odueuz.jpg,16,https://redd.it/794typ,TARmander1,Picked up a 40 of some golden brown powdery at the moment due to lack of moisture. It's .65 including what's prep'd,,1509126645.0
794sml,https://www.reddit.com/r/opiates/comments/794sml/withdrawals/,10,https://redd.it/794sml,bussinscripts12,Withdrawals...,What a beautiful thing ! 😝😳🙄🔥😷🤧,1509126320.0
794sgp,http://www.qontrac.ml/2017/10/the-hard-way.html,6,https://redd.it/794sgp,jblake8912,The Hard Way (2000) - A young man prepares to be handcuffed to his bed for two weeks to beat his heroin addiction once and for all.,,1509126272.0
794s8v,https://i.redd.it/xr0m2k4jteuz.jpg,67,https://redd.it/794s8v,Btghasel,sniffin lines in class lol,,1509126213.0
794rvb,https://www.reddit.com/r/opiates/comments/794rvb/hollow_echo/,5,https://redd.it/794rvb,Lipstickcigarette,Hollow echo,"The sound of the shower, man made rain soaking tile floors, the boom boom clash when his body fell hidden behind a locked door. When it began to stream into the hallway, then finally, somebody noticed.

It was his girlfriend, and I remember that scream as if it was my own, the hopelessness and scrambling ""SOMEBODY FUCKING CALL 911"". Flashing lights and sirens, ""everyone hide your shit"". The wilted lives sped off and we were left in a house exactly the same as before, and we all got high again.

My conscience shrieked to no avail, guilt never really disappears with my sweet inhale but god damn it, does it get easier.

Little did I know that night that her scream was a not only a declaration of anguish but a premonition, for I made that noise I'd only heard once before as I collapsed to my kitchen floor one July afternoon. 

Overdose is lights out, so by that logic being high is like a dimmer switch. Someone tell me why when I learned of the death of the love of my life I ran, and dimmed my own lights until it was dark at 3pm and my chest had nearly nothing inside.

I think my chest must really have nothing inside, if my sister's death just made me want to get high.",1509126116.0
794onr,https://i.redd.it/vw769hqqqeuz.jpg,18,https://redd.it/794onr,fadedALLday10,"Fire grey dope, shits the best hasn’t been around in a couple weeks. So glad it’s back. Stay safe brothers",,1509125290.0
794mw0,https://www.reddit.com/r/opiates/comments/794mw0/cant_cum_on_methadone/,6,https://redd.it/794mw0,JunkieJewelryOP8,Can't cum on methadone...,"It can be kind of annoying.... Beating my dick til it's about to bleed, to no avail.... Fuck.",1509124844.0
794kv5,https://www.reddit.com/r/opiates/comments/794kv5/so_that_didnt_work_as_planned/,9,https://redd.it/794kv5,igottheblues1,so that didn't work as planned,"I quit CT on Oct 2 and had about 2.5 weeks in when I decided I would try my hand at chipping. Fast forward to today and I did a line this morning when I went to work, went at lunch to get more and just did another line. I know most people will say I told you so, because they had when I announced I was attempting to chip. I guess it was a test for myself and I most definitely failed! So that leaves me with what to do next...I'm thinking my best option at this point is to slowly taper off what I have right now, then jump right onto lope and kratom for a week and then just stay away from dope altogether. Maybe some pills on the weekends. I  appreciate everyone's support and advice, even though I didn't take the advice when offered.  I had to learn this lesson the hard way, as usual (for me)",1509124320.0
794ig9,https://www.reddit.com/r/opiates/comments/794ig9/rush_or_long_lasting_high/,7,https://redd.it/794ig9,trynakick,Rush or long lasting high?,"One more bored-at-work question for this pre-halloween Friday.




Am I alone in liking long-lasting high of bupe, extended release oxys and the tea that shall not be named?




I really never enjoyed the rush of H or Dilaudid or even insufflated IR oxycodone as much as knowing I'm going to feel good for 8+ hours.




The rush definitely feels good but I could never get over the panic that I had over done it. Especially with H when I was never totally sure of the purity.




I'm not a huge fan of nodding really hard, I hate it when the rush keeps intensifying after I'm where I want to be, but I love the 'glow' for the few hours after I've dosed.




The weird thing is that I think I take after my father in this preference. He was addicted to pharma pills for 20+ years, but never really went above 20-30mg oral at a time.




Ok... this is my last post of the day. I have another one I was thinking about posting about how to maintain 'regularity' while using (I seem to be the only person I know who didn't have that particular problem). But I'll save that for another day and stop spamming this sub.





I love the community here, and always happy to chat, especially if you have questions about a sub taper or multiple addictions (I was a 5th a day boozer for some of my time deep into opiates). Thanks to (almost) all for being so welcoming and friendly!





-TK",1509123718.0
794iee,https://www.reddit.com/r/opiates/comments/794iee/as_promisedheres_my_most_frightening_experience/,41,https://redd.it/794iee,Euronymous_Greyjoy,As promised...here's my most frightening experience with $100 worth of H and a cop... (quite long...but worth it),"First, I want to apologize for how long this is going to be.

This was in early October 2014. My girlfriend (who used to post here from time to time...not sure if any of you know her or recognize the name u/frodo_lives) and I were new to heroin. We both had regular scripts for pain meds (vicodin 10 for me, percocet 10 for her), as I had/have a back issue, and she had severe stomach pain (severe IBD with colitis + 3 hernias). A friend of mine introduced us to H when we were both out of our scripts, and she was in immense pain. I attempted to get pills, but couldn't find any. We both were against hopping on the heroin train, but given the amount of pain she was in, we said fuck it. We never really became addicted...it just became like a weekend thing. Bought a bunch for the weekend and have a good time, then stabilize throughout the week.

One weekend in November, we were hanging out, and again she was in quite a bit of pain with no pain meds. Her refill day was about 5 days away. So I asked her if she wanted me to run and get some dope, and of course she said yes. Now, she lived about an hour away from where i live, and that's where I had to go since the only dealer I knew was in my city. So I made the trip, bought $100 worth, and started the hour long trip back to her house.

About halfway through the trip, I began to feel weird. Nauseous as fuck, and a bit drowsy. I did not do a line since I don't like being doped up and driving (especially for such a long trip), and it had been over a week since I had anything, so I wasn't going through withdrawals or anything. I still have no explanation as to what I was feeling. I made the decision to get off on the next exit and find a Speedway to buy a Sprite or 7-Up for my stomach. Once on the exit, I lost control of the car (it had started to rain a bit as well), and ended up slamming into a tree.

My immediate thought was, ""Fuck! I'm fucked!"" since I had $100 worth of heroin in my laptop bag, and the cops are surely going to come. So I began thinking...I'm in a wooded area, it's a single car accident...cops won't be here for at least a few minutes. That gives me enough time to stash the dope in the woods somewhere. And that's when a female cop knocked on my window...

She asked if I was okay and if I had been drinking and all...standard procedure. I explained to her what happened...I was taken out of the car, frisked, and given a breathalyzer, which I absolutely passed. I ended up sitting in the back of her car while she assessed the situation, and called someone to tow my car. It was stuck between two trees, and it was impossible to get out without chainsawing one of the trees. Now, that would upset anyone...losing your car that way, having no transportation, not even knowing what city you're in. But me..? I was just concerned about my stash. She comes back to me and says, ""Well, you obviously won't be able to drive this. Can you get a ride somewhere?"" I told her yes, and then she asked me if there was anything in the car that I needed. ""My phone, and...uhhh...my laptop bag."" She goes to retrieve those items, and I begin to piss my pants (figuratively).

Now...there are two things you should know. One, the heroin I got was in capsules (which is my preferred method...fucking hate baggies), and I had put them in one of my prescription bottles for vicodin. I don't know if any of you are familiar with the bottles that the Target pharmacy uses (or used to use...I think they're CVS now), but they were shaped oddly, and were a dark red color instead of the standard amber. So it's a bit more difficult to actually determine what's in those bottles unless you open it.

The cop comes back to me, and I'm waiting to hear the dreaded question of the $100 worth of heroin I have. She hands me my phone and my laptop bag, and says, ""You know...some of those prescriptions you have in that bag can cause drowsiness. Did you take any of them?"" I also had a blood pressure medication, Zoloft, and Ativan. I said, ""Well yes, but in the morning when I'm supposed to. Haven't taken anything since then."" And then she says...""There was a knife in the car with some blood on it. You know anything about that?""

I had totally forgotten about the knife. What it was (and this is my explanation to her as well) was a pathetic cry for attention/fake suicide attempt. It was my blood on the knife from about a week or so ago. I have Borderline Personality Disorder, and we often resort to threats of suicide when faced with perceived abandonment, and that's what that was. I showed her my pseudo-scars from the ""attempt,"" and told her that I was kept in a psych ward for 3 days, and told her that she could call them to verify if she wanted. She says, ""No, there's no need for that. I believe you. However, I should cite you for OVI because of the prescriptions. But I won't.""

She cited me for failure to operate, handed me her business card, and said I was free to go. At that moment, I suddenly became religious (I'm an atheist), because that had to be divine intervention, yeah? God came down and stopped her from identifying the $100 worth of heroin in my vicodin bottle.

End of the story here...I walked over to a McDonald's and got a Sprite and a McChicken (plain...fuck you mayonaise), and got an Uber to take me the remaining 25 miles or so to the girlfriend's house.

And once I arrived...I told her this story. And then we cut up our lines to snort with that business card that the cop gave me.

I seriously want to write this scene into one of my screenplays, but it's actually been difficult to translate to that format. Once again, I apologize for how long this is. Like I said in the previous thread...I ramble and I love adding unnecessary details. I'm a storyteller, dammit!

What are some of your close calls?

Oh, also...if any of you did know u/frodo_lives from her infrequent posts here, I should tell you that she passed away in March 2016. Not from an overdose or anything drug related. It was her aforementioned stomach issues. It was a stomach rupture (gastric hemorrhage). It's been almost 20 months since she's been gone, and I'm still grieving as if it's only been a day. Love of my life and all. (Sorry for the downer ending, but I figured I'd update about her just in case anyone knew her.)

*tl;dr; wrecked my car after buying $100 worth of heroin, somehow the cop on the scene did not notice said heroin, despite looking in the bag where it was*",1509123707.0
794dsn,https://i.redd.it/2xv27qneheuz.jpg,145,https://redd.it/794dsn,schizoidparanoid,Picking up with the bestie this morning. 🔥🔥🔥,,1509122136.0
794dhf,https://www.reddit.com/r/opiates/comments/794dhf/ah_fuck_man/,5,https://redd.it/794dhf,ryangoesdownhill,Ah fuck man,"Just brushed my teeth and then threw up sweets that I ate earlier so they're covered in sugar and acid again

For fucks sake",1509122042.0
794b6j,https://www.reddit.com/r/opiates/comments/794b6j/tfw/,4,https://redd.it/794b6j,poppypossy,Tfw,You have to drive an hour to cop 2 oxys to avoid wd,1509121447.0
794b1r,https://www.reddit.com/r/opiates/comments/794b1r/whats_the_reason_for_junkie_behavior/,7,https://redd.it/794b1r,thrrwy,Whats the reason for junkie behavior?,"Got a question..
Are the common junkie behaviors such as selfishness, lying, stealing, unreliability, etc caused by 



a. the lifestyle of needing to consume a substance regularly that is illegal (and therefore expensive) and socially unacceptable and taboo?


or


b. the effects of being high daily and regularly consuming psychoactive substances?",1509121413.0
794ae0,https://www.reddit.com/r/opiates/comments/794ae0/jj_or_a_junkie_dillema/,12,https://redd.it/794ae0,trynakick,"JJ, or a junkie dillema?","Hi. Recently started spending more time here because you all are more friendly than the onion subs that I started this account for a few years ago. Bored at work so this is just a story/casual conversation starter.





About 5 years ago I was waiting for the subway and stumbled upon about 25 8/2 sub strips scattered like confetti around the ground. I was chipping at the time, and I saw a few choices.





1. Take them all to pharmacy and hope the pharmacy could track who lost them. If I lost a months worth of subs I'd certainly be trying to get a refill.




2. Take it as a sign to quit the pills/boy and take the subs.




3. Look at it as a big come up. Minimum I could sell them for is $15, so $350 would be some nice spending money (for drugs, of course.)





I did a combination of 1 and 2. I took one to the pharmacy closest to the station, told the pharmacist my story. Hopefully one person trying to get clean was helped and the cops were actually forced to believe that they lost their script (even though I'm sure they were trying to sell them or something. the only way they would have ended up on the ground where they were is if something shady went down, and the fact no one had picked them up yet really shocked me.)





This was my first exposure to subs, I liked them as a way to take a tolerance break and save some money/be more functional, and a few years later decided to switch exclusively to subs, which I am on to this day.





Anyway, not really an interesting story, but... what would you do?",1509121238.0
7945x6,http://www.cleveland.com/metro/index.ssf/2017/10/cuyahoga_county_files_lawsuit.html,3,https://redd.it/7945x6,pap3rw8,"Ohio county sues drug companies, distributors, and doctors, alleging racketeering that created opioid epidemic",,1509120064.0
