7gahn6,https://i.redd.it/iohjjeuicu001.jpg,12,https://redd.it/7gahn6,sadbabie_,Been too stoned off my ass to realize this was delivered and sitting on my porch all day lol but yay finally.,,1511929294.0
7gab0s,https://i.redd.it/nphji7t87u001.jpg,35,https://redd.it/7gab0s,vforvendetta8870,What's your favorite snack when high?,,1511927517.0
7gaazy,https://www.reddit.com/r/opiates/comments/7gaazy/fuck_thisshit_im_out_part_2/,25,https://redd.it/7gaazy,myfaceinthesink,"Fuck thisshit, I'm out - Part 2","See my post history for my first post.

So yeah, a few more days have passed since I quit heroin, 10 days in total now and I still don't have any cravings.

Two Subutex I order for withdrawal came in very delayed and arrived when I was already through the worst, so I said fuck it and threw them away. I don't want to be near opiates.

I feel like I can do this. I am passing time with weed and the occasional pregabalin. Sometimes Xanax for my insomnia, but besides that, I didn't take any other drugs since then and don't really crave them.

I might get some psychedelics soon to trip again after such a long time. It might help me rewire my brain.

That's all the updates for now, take care people!
I'll occasional update, maybe at the 2 week or 1 month mark, I'll see.

Love you people.",1511927510.0
7gaah2,https://www.reddit.com/r/opiates/comments/7gaah2/suboxone_to_oxycodoneoral/,15,https://redd.it/7gaah2,thriveorsurvive,Suboxone to oxycodone(oral),"So I’ve been on suboxone, 2.5 strips a day for 2 weeks, if I wanted to get back on my oxycodone, how long do I have to wait? ",1511927383.0
7ga9zz,https://www.reddit.com/r/opiates/comments/7ga9zz/have_to_be_responsible_to_stay_well/,22,https://redd.it/7ga9zz,unitedstateofamanada,Have to be responsible to stay well,"I have been using a lot lately. I had a drug fueled weekend with my boyfriend and still wasn't enough drugs for sure, we spent a lot on them but still wamted more naturally. Same with our time together. But now it's time to slow way down amd taper back on the drugs I've got until Sunday which is not much. At least I'm kind of good at this when I have to be. 

Since I have barely any drugs I hope that means that like the rest of y'all have lots of drugs or something if that makes sense lol

Edit: added couple sentences, too vague at first ",1511927251.0
7ga8or,https://www.reddit.com/r/opiates/comments/7ga8or/when_you_get_taken_care_of/,4,https://redd.it/7ga8or,BraveHash,When you get taken care of,"So i hit my dude up since he told me earlier in the day that he had some roxy 10s and i just wanted to grab 2 of them since if i get anymore than that i will end up doing them before the night is over and not have anything for tomorrow. 

Well like 2 weeks i had helped him out with some stuff so when he pulled up and we done the deal i was bout to get out of the car and he stopped me and handed me 4 more and told me they were for helping him out and that he didn't forget about me. So tonight is my lucky night and i'm gonna get high af and hope to be able to save at least 2 to do before work tomorrow",1511926892.0
7ga88d,https://www.reddit.com/r/opiates/comments/7ga88d/my_dboy_takes_food_stamps_i_wish_i_never_found/,12,https://redd.it/7ga88d,everything_is_still,My dboy takes food stamps. I wish I never found this out. Find out more on tinychat!,"

**Tinychat can be VERY shitty about the mobile app so if you can connect with a computer, that is the best option.**  
firstly, this chat is not affiliated with this subreddit or its moderators, and has its own moderators, rules, and etiquette. if you feel someone there has slighted you take it up with the moderators of tinychat, as it is completely unaffiliated with and not endorsed by this or any other subreddit.  
just a reminder and an announcement that a bunch of your fellow degenerate junkies, chippers, and tourists hang out in [our very own tinychat room](http://tinychat.com/ropiatesubchat) which has been an ongoing tradition for something like four years now. the location, for those who can't do links for whatever reason, is http://tinychat.com/ropiatesubchat.  

tinychat is an extremely buggy videochat client, but also the only one that fills its particular niche---that being, anyone who knows the room name may enter, and it has a youtube player. any technical difficulties may be addressed by the moderator, namely me. we like to hang out, listen to music, talk about random shit, and lately have even had our own resident sketch artist who draws random crap upon request. the primary purposes for the room's existence are companionship and harm reduction---it's nice to be able to shoot up with others around, even if you are technically alone in the non-digital sense, and have people keeping an eye on you. we're also glad to help with any problems you might be having, or questions you might need answered. we aim to be a welcoming, friendly space for the members of this subreddit to do what we do in good company without judgement. so stop by if you are bored, or just need to talk.  

if it appears like there is a moderator in the room but who is not speaking, just type a few sentences to summon them back. if you are on mobile it is not immediately apparent that there is anyone in the room. either click the button shaped like an outline of a person (i think) to see the list, or say hello to see if anyone responds.  


rules:  

1. pick a unique username. this is to protect other users so we know who is who, given the nature of the sort of activities we enjoy. 

2. no lurking. again, to protect the other users. if you come in the room be prepared to introduce yourself and participate for at least a few minutes so we know you're not up to any shenanigans. if you are lurking you will be warned and then given a generous ten minutes to announce yourself. if the time runs out, you will be kicked (not banned) until you are ready to come in and actually participate. if you are a known member whose identity can be confirmed, this rule is not applicable.  

3. no -isms or hate speech, even accidental. one warning will be issued, any continued insistence on such behavior will result in a ban. bans can be contested by pm'ing a moderator (me). this includes but is not limited to racism, sexism, homophobia, and transphobia. for example, if you are not black, use of the n-word, even with the -a ending, will not be tolerated. i don't care if your friend down the block lets you say it, it's not your lane. 

4. no auditory fuckery. due to peculiarities of the transmission of sound over a chat, certain echos and effects can be amplified to the point of being severely distressing. if it is determined that your end is causing an echo you will be asked to use headphones, or to mute your microphone when not speaking. deliberately making strange or unpleasant noises to annoy other chatters will not be tolerated, and your broadcast will be closed. (this only means that your video/audio feed will be terminated--you will still be allowed to type.)  

i know the rules seem like a lot but there's really only four of them, and only two that pertain to just behaving in a manner that isn't dickish. 
thanks, and hope to see you there! **don't use alone.**",1511926774.0
7ga74k,https://imgur.com/a/Eo2aM,8,https://redd.it/7ga74k,Duke_stashington,patience is virtue (and expensive),,1511926460.0
7ga69s,https://www.reddit.com/r/opiates/comments/7ga69s/got_a_job/,22,https://redd.it/7ga69s,Barnabay,Got a job!,"Just got a job, finnaly! I'll be working for the governement but no drug test needed! 18$ an hour to do a job that doesnt need a collegial diploma!
Finnaly i'll be able to get high, get high for me tonight to celebrate!",1511926240.0
7ga688,https://www.reddit.com/r/opiates/comments/7ga688/first_time_iv/,12,https://redd.it/7ga688,queencatlady09,First Time IV,"So about once a week or so I like to enjoy a night of oxy or dillies. I usually snort the dilaudid, but I know the only real way to get the best out of them is to IV.  I’ve had a lot of experience with IV dilaudid in the hospital setting and so I know my dosage and I also know my pills come straight from the pharmacy. 
What I need advice on is prep and how to prepare the pills.
As well as advice on what needles and filters and where to acquire them. 
I’m pretty confident about the actual process since I used to draw blood for a living and am a pretty good stick. I actually have some leftover 23 gauge butterfly needles, but I also know for injecting that’s rather large. I also have one 31 gauge insulin needle with a 50unit syringe. Are any of these sufficient? ",1511926228.0
7ga4yv,https://www.reddit.com/r/opiates/comments/7ga4yv/cheerios/,4,https://redd.it/7ga4yv,pms2,cheerios,i swear this is the best food for wen u cant seem to keep anything down,1511925899.0
7ga1tc,https://www.reddit.com/r/opiates/comments/7ga1tc/crossover_tram_to_hydro/,5,https://redd.it/7ga1tc,40throw,crossover tram to hydro,"was taking tram about 2 or 300 mgs a day and have had the good fortune to switch over to hydrocodone 10mgs been holding at 3 a day but here n there will get up to 4. 


used to take hydro a while back maybe 4 yrs ago now was the last time. started up tram again this past march. seems like the tram had very little effect on my tolerance for hydro i can take just one of thse guys and feel really good for along time. probably could get away with just taking two a day. 


although the hydro completely covers the tram i have sort of had this crappy rls in the early eve but thats about it. ",1511925065.0
7ga0sp,https://i.redd.it/l74hfxd6zt001.jpg,7,https://redd.it/7ga0sp,Errl_Phant,Nice little pick up from earlier today,,1511924807.0
7g9lft,https://i.redd.it/vpgtqi5hnt001.jpg,10,https://redd.it/7g9lft,beep_bop_benzo,Been clean for about 4 months but had a super shitty day and decided to pick up. This shit is strong.,,1511920894.0
7g9iha,https://www.reddit.com/r/opiates/comments/7g9iha/trying_opiates_recreationally_this_weekend_tips/,67,https://redd.it/7g9iha,IRedditalready99,Trying Opiates Recreationally this weekend. Tips?,"So this weekend I am trying Buprenorphine. This will be my first opiate use recreationally. I understand that Buprenorphine has different bonding affinities than other opiates, but for someone with no tolerance I should be pretty high. I also understand that this opiate is many more times stronger than morphine. I am going to take like 1-2mg intranasally. I might also add some Vistiril. I am buying an 8mg Suboxone, but after I take the 2mg I'm flushing the rest down the toilet in order to not pursue potential temptations. I am doing this because, I have tried tons of drugs like: LSD, Shrooms, Weed, DPH, Cocaine, DXM, Alcohol, Xanax, etc. I want to try everything in my lifetime, so naturally at least one opiate is on my list. 

I debated this decision for a while. I understand opiates are no game and their power must be treated with respect. As a result, I am surely playing with fire. But I have strong will and don't think I will let this drug take to much of a hold on me. Any tips for doing this safely? I am obviously nervous about this but my mind is made up. I have studied the consequences of opiate use and the neurology behind it for quite some time. I have also read this subreddit for awhile. I feel I am ready if taken responsibly. Any feedback is appreciated. Cheers

Edit: Thanks for the very rapid and supportive comments. I think I will pass on the opiate attempt (for now at least) in exchange for some Molly/MDMA (another I need to add to my resume.) You guys scared me the shit out of me as expected. Sorry if I disappointed people curious about a future update. Also might take people suggestions and wait for a more euphoric opiate such as Oxy's or Hydro's. Gotta make the experience special I guess. Thanks again and I wish you friends the best. ",1511920176.0
7g9fuv,https://i.redd.it/yzva286jjt001.jpg,16,https://redd.it/7g9fuv,Katchfran1,EVERYONE NEEDS TO READ THIS BOOK,,1511919545.0
7g9e9g,https://www.reddit.com/r/opiates/comments/7g9e9g/the_best_part_about_taking_a_few_days_off/,7,https://redd.it/7g9e9g,Apg3410,The best part about taking a few days off!,Test best part (for me) about taking a few days off opiates is finally taking a good shit! As we all know opiates make us very constipated! It's such a nice feeling to finally have a solid dump! Sorry guys just thought I'd share. ,1511919147.0
7g9c5u,https://www.reddit.com/r/opiates/comments/7g9c5u/800_mg_of_gabapentin_first_time_use/,14,https://redd.it/7g9c5u,goklissa,800 mg of Gabapentin [first time use],Recently come into possession of 800 mg of gaba and I'd like a bit of advice on how to get the best possible experience (will I even experience anything with so small a dose?) Ive had a bit of experience with hydrocodone before but nothing else. Advice? ,1511918658.0
7g992b,https://www.reddit.com/r/opiates/comments/7g992b/what_is_the_average_street_value_of_a_8mg/,41,https://redd.it/7g992b,Jason4hees,What is the average street value of a 8mg suboxone strip in your area?,,1511917868.0
7g9763,https://www.reddit.com/r/opiates/comments/7g9763/being_sick_and_sick/,7,https://redd.it/7g9763,raviopi,Being sick and sick.,"Man, I’ve had this upper respiratory tract infection for a couple days, and I ran out of the dirty so now I’m dopesick. This Thursday I get paid. When I’m finally well and feeling better, it will be such a feeling of relief. I can’t wait.",1511917391.0
7g936c,https://www.reddit.com/r/opiates/comments/7g936c/help_with_snorting_h/,9,https://redd.it/7g936c,realninjashit1,Help With Snorting H,"Ofc I know how to snort dope. But about 8 years ago, I had surgery on my nasal cavity because it was rly  hard to breathe through nose.

I had what's called a turbinate reduction. Turbinates are shelves in your nose that help make air moist, and prolly some other shit IDK about. But when you snort stuff, a lot of the powder hits turbinates. 

I've just realized that a lot of stuff I snort makes it into my stomach, bypassing my nose because I don't have as much turbinate surface area as normal people.

I don't want to progress to shooting. It's hard to plug when you're stopped up all the time, too. Does anybody have any tips to increase nasal absorption?

I thought maybe a nasal sprayer w/ solution might work. IDK.

Thanks for any help ",1511916416.0
7g915j,https://www.reddit.com/r/opiates/comments/7g915j/nausea_6_hours_after_smoking_tar/,6,https://redd.it/7g915j,NorthBayPsychonaut,Nausea 6 hours after smoking tar ?,i smoked tar at around ~10-11am ish and its 4:36pm now and ive been feeling nauseuos for the past couple hours. i dont have a habit and hardly do it however a little while after i smoked the tar i snorted a tiny little bit (broke down with baking powder) and now im depleted of energy and feel like throwing up and cant eat. is it the dope or something else ?,1511915911.0
7g8t3h,https://www.reddit.com/r/gifs/comments/7g5fhp/her_hair_looks_like_ink_in_the_water/?st=JAKAHYEY&sh=dbef0f13https://www.reddit.com/r/gifs/comments/7g5fhp/her_hair_looks_like_ink_in_the_water/?st=JAKAHYEY&sh=dbef0f13,4,https://redd.it/7g8t3h,TrippleIntegralMeme,When the needle is finally in the vein,,1511914004.0
7g8gkx,https://i.redd.it/p60xtspzts001.jpg,17,https://redd.it/7g8gkx,AwwmanitsRalph,Happy holidays from the trap tree. May Santa rob the pharmacy on his way to your home,,1511910961.0
7g8ezb,https://i.redd.it/y9b8u03yss001.jpg,7,https://redd.it/7g8ezb,throwthrow_gengar,Trail art 🌀,,1511910603.0
7g8azk,https://www.reddit.com/r/opiates/comments/7g8azk/people_are_taking_advantage_of_my_kindness_and_i/,35,https://redd.it/7g8azk,milk0fthepoppy,People are taking advantage of my kindness and I don't know how to deal with it besides cry,"I'm so over it. I've met people in this game, people have screwed me over but I have 3 people who I trust and thought were good. 

I'm not wealthy by any means. I work my butt off and bring in money. I'm also scared of the hood so I know a few people who I pay to get me product and deliver it to me. I tip them well.

In the last day or two, 2 of the 3 have screwed me over. One of them is my neighbor. Yeah. I gave him $300 to get me product, and he said he would be right back. After not responding for hours, he responds 14 hours later and says he fell asleep and now hes at work. Then, he says his mom is sick. Now, its that the guy he got it from is angry and it has to be tomorow.

Person 2 I gave $100 and they ghosted me. This is after us linking up manyyyy times. 50% of that 100 was basically a tip. I was desperate. and Sick.

Now I have no money left, am sick, lying curdled up wondering why people are like this. I would never ever ever steal from others. Especially people who are nice to me. My heart literally hurts, it pangs in pain just thinking about doing that to someone.

Why do people do this? Why am I so helpless? Why do people who are mean end up being winners? Sigh.",1511909670.0
7g82zb,https://www.reddit.com/r/opiates/comments/7g82zb/wish_i_hadnt_sold_most_of_my_oxy_oc_80s/,20,https://redd.it/7g82zb,King_Charles_42,Wish I hadn’t sold most of my Oxy OC 80s :/,I mean maybe it’s a good thing cuz now I have a very small supply and have no way of getting more besides roxys. But the fact that the money isn’t making me happy enough to get over that I don’t have a lot of them anymore is concerning. Like why the fuck am I not valuing money over drugs???,1511907913.0
7g82v0,https://www.reddit.com/r/opiates/comments/7g82v0/fentanyl_warning_for_north_manhattan_washington/,1,https://redd.it/7g82v0,AskSasha,Fentanyl Warning for North Manhattan/ Washington Hts NYC (11/28),"This week's ""bad batch"" alert for North Manhattan area-- 

**Light pink baggies** in the North Manhattan area have tested positive for fentanyl and are linked to **serious overdoses** and **multiple adverse reactions** (bad burning/stinging sensation when injecting, abnormal foaming and blood clotting). Essentially whatever else is in there is causing some bad coagulation apparently... whatever the case, it doesn't sound good. 

[Picture can be found here](https://imgur.com/a/zRY3Y)

Stay safe everyone! We also just had another positive (""king of death"" stamp) but as it's not yet linked to anything significant, I'm keeping it off the alert for now. Just a heads up though~
",1511907885.0
7g81gt,https://www.reddit.com/r/opiates/comments/7g81gt/been_in_and_out_the_pill_game_10_years_and_ive/,24,https://redd.it/7g81gt,baconisgud222,Been in and out the pill game 10 years and I've never seen an Opana,"The only pills I've ever seen are norcos, percs, roxis, and fent patches. Where in the hell do people find Opanas? Is it a regional thing? I've never even heard them mentioned where I'm from.",1511907571.0
7g815t,https://i.redd.it/5g7c6azqjs001.jpg,4,https://redd.it/7g815t,412dopefool,Elmo and I want the same thing for Xmas!,,1511907509.0
7g7ztp,https://www.reddit.com/r/opiates/comments/7g7ztp/i_am_starting_to_conclude_than_snorting_heroin_is/,19,https://redd.it/7g7ztp,MagnaMagicBtu,I am starting to conclude than snorting Heroin is actually a better method than injecting it,"Now I know that upon reading the title of this thread, most of you are probably responding with utter shock and disbelief. I can almost see you shaking your heads and saying ""But, what about the rush? What about the 100% bio-availability? You are really telling us we should stop IVing our dope?"". Well, yes, in fact I am. Allow me to explain:

Even though IV is the most efficient way to use heroin (it ALL goes directly into the bloodstream) your body simply compensates for this, raising your tolerance. So, within less than a week of shooting dope I was already needing to shoot as much or perhaps even more dope to get off as when I was sniffing. Not only that, but for some reason IV heroin lasts significantly less time than snorted. So you actually spend more money when you IV than when you sniff.

So what reason is there to IV? Well, there is a rush. A feeling of intense pleasure (or just plain intensity sometimes) that lasts about a minute after you slam down that plunger. Naturally, this minute of intense pleasure is highly prized and sought after. It is the best minute of a junkie's day. However, in my case at least, I feel like sometimes the rest of the high can be somewhat of a let down afterward because its never as good as the rush and IV is a LOT more fiendish, kinda like smoking Crack vs snorting Cocaine.

Any comments? Thoughts? ",1511907228.0
7g7xir,https://www.reddit.com/r/opiates/comments/7g7xir/aching_after_a_shot/,5,https://redd.it/7g7xir,Cremedelapeng,Aching after a shot,"So I just snowballed myself in that vein by the knuckly bit on the back of your wrist, I'm certain that I hit it all (or at least 99% of it) but now it aches in the core of my wrist. Is it possible I nicked a tendon or muscle? Its not painful just noticeable.",1511906722.0
7g7wj3,https://i.redd.it/b6j8wysngs001.jpg,16,https://redd.it/7g7wj3,Lemonadepants_,This PSA in my local subway station,,1511906497.0
7g7uig,https://www.reddit.com/r/opiates/comments/7g7uig/the_numbers_test/,9,https://redd.it/7g7uig,DopeHammahead,The numbers test,When you're left with a bunch of janky ass rigs and you need to pick the best one for the job... I always choose the one that has the most visible numbers. Anyone else do this?,1511906092.0
7g7rv6,https://www.reddit.com/r/opiates/comments/7g7rv6/when_can_i_take_this_suboxone/,24,https://redd.it/7g7rv6,throwmeawaynowboi,When can I take this suboxone,My last dose of dope was between 1 and 2 am last night. 24 hours? Could I try taking small doses? ,1511905509.0
7g7rnf,https://www.reddit.com/r/opiates/comments/7g7rnf/i_fucking_love_injecting/,43,https://redd.it/7g7rnf,SirNarcotics,I fucking love injecting,"Just the whole process of injecting is so damn satisfying. Cooking up the perfect shot, finding the right vein, sticking it in and feeling the 'ol familiar sting, registering and seeing the blood flow into the syringe, then finally pushing down on the plunger and immediately feeling the kick. I recognize that IV'ing is the worst possible way to use but damn its often satisfying. 

Whenever I'm not using I miss IV'ing so damn much.",1511905462.0
7g7qg3,https://i.redd.it/d7x40gmucs001.png,3,https://redd.it/7g7qg3,bodeinbrazzy,OM -50,,1511905195.0
7g7q0b,https://i.redd.it/shb4cx1hcs001.jpg,2,https://redd.it/7g7q0b,PatsyClinesDaughter,2 more Lol.,,1511905092.0
7g7pv9,https://i.redd.it/9awm5fcacs001.jpg,14,https://redd.it/7g7pv9,hillbabe285,"NewBags, pretty diesel.",,1511905058.0
7g7ocq,https://i.redd.it/1x6kri9hbs001.jpg,10,https://redd.it/7g7ocq,DizDiq,Morning blues. And school bus rides :) have a good day y'all,,1511904730.0
7g7n00,https://i.redd.it/hzprbtoeas001.jpg,85,https://redd.it/7g7n00,fishstx420,"30mg Morphine SR up the ass. I really hope this works, I couldn't find anything to filter it with so it's a bit chunky. Wish me luck!",,1511904428.0
7g7m2i,https://www.reddit.com/r/opiates/comments/7g7m2i/for_those_of_us_whose_families_know_we_use_how/,20,https://redd.it/7g7m2i,speedygoneslow,"For those of us whose families know we use, how did the confrontation go when they found out, and how did they find out?","So, who all has families who are fully aware that you're using/have used? Just curious to hear some stories of how they found out and how the big chat/confrontation went with them.

Mine was just being absolutely clumsy as fuck. I was in the midst of a couple months long binge and had been just chucking my discarded foil under a cabinet in my bedroom (still lived with them then). This was already clumsy enough, but it never actually got me caught. 

My girlfriend was over so I was sneaking off to the toilet for a smoke every now and then and finished a slice of foil that I was using. Rather than taking it back with me I just dropped it down the back of the bath. As usual my memory for the better of me and I totally forgot until I received a nice little text saying 'Your mother found some foil behind the bath. have you been smoking heroin?'

My answer was of course I did but not in a long time. That was foiled when I got home to find them sitting in the main room with a coffee table full of used foil, so many good time lain over that table. 

My dad knew exactly what it was used for but encouraged me to tell my mum it was a different painkiller (Oxycontin). 

Since then I've moved out and certainly don't leave any foil about when I'm back visiting!

Not the most exciting story, but sure you guys have some interesting stories!

To those still in the closet, it's the small stupid mistakes that get you, be careful dudes!",1511904221.0
7g7la7,https://www.reddit.com/r/opiates/comments/7g7la7/shipping_packages_best_results/,7,https://redd.it/7g7la7,freefarts,Shipping packages - best results,"For quick overnight shipping of packages, what is the best service to use? Is usps better than fed ex or ups? Who’s had experience in this? ",1511904035.0
7g7ket,https://www.reddit.com/r/opiates/comments/7g7ket/you_are_a_good_pwrson/,13,https://redd.it/7g7ket,30clipcartel,You are a good pwrson,I hope you have a beautidul day,1511903847.0
7g7c5s,https://www.reddit.com/r/opiates/comments/7g7c5s/christmas_present_yall_might_like/,7,https://redd.it/7g7c5s,klove99,Christmas present yall might like?,"I know the Christmas season is upcoming... maybe some of you would consider getting this for your SO or yourself?

https://www.amazon.com/dp/B01BZX3HZU/ref=pd_sbs_107_3?_encoding=UTF8&psc=1&refRID=VPNVGJ3668CZWXTQ6HM5",1511902131.0
