7wp1re,https://www.reddit.com/r/opiates/comments/7wp1re/dodging_this_you_owe/,19,https://redd.it/7wp1re,sloan_fitch,Dodging this you owe...,"Note: Did this on a phone at work so it's rife with typographical errors, title included.


I owed Cliff a battery for the Mac Book I sold him. He told me to pay for soda a couple of times this week and that he'd order the battery on his pay day. Btw I made off like a bandit, do those in the know... it has a Corey2Duo.


Last week he wanted to hang at my house for a little because a girl was gonna come knocking to get pills bc ""she was desperate"".


Turns out according to my sub connect that he took this other girls $300 for blues, spent it for himself and told her that he needed it bc he was sick but he'd pay her back.

&nbsp;

Here's some exerts from his message. Long story short, I told him I'd buy him soda tonight as I promised.

Cliffnotes/from text messages:

""Instead of the commercial  COKE AND A SMILE, its  PEPSI AND A BUMP OR 2""

""I dont always bother u w/bad news.  I want ya to hang a bit after and rip a bump or 2 maybe. Thats all.""


After he asked me if I'm still working til 10pm and after I said that I'd drop off his soda on my way home I also said:

""And I gotta get started an emergency turtle rank repaid when I get home for squirt.""

To which cliff responded:


""You know i dont mind coming over to ur crib and helping you wit the turtle repairs.  I just want to get out of the house, is that ok sir ?""

""Like obv u stop in to drop off the soda after work and id love to come chill after that.  That would be very cool.""

&nbsp;

Thanks to the Intel from my sub connect, I think I know the reality. He's dodging the girl he owes $300 to.",1518304871.0
7woyta,https://www.reddit.com/r/opiates/comments/7woyta/whats_life_like_after_withdrawals/,34,https://redd.it/7woyta,lurkndturf,What’s life like after withdrawals?,"I feel like I’m in a constant state of withdrawal, from one substance or another. Oxy, then suboxone, then kratom - until it comes full circle again.

I can’t imagine a life without opiates, what’s it really like when you’re clean? Is it as dull and lifeless as I fear? Or really invigorating and meaningful? 
",1518304056.0
7woymb,https://i.redd.it/6d4p9hfsvgf01.jpg,1,https://redd.it/7woymb,alaskanthunderfuckup,Another day another run or two or three,,1518303999.0
7woyes,https://www.reddit.com/r/opiates/comments/7woyes/shooting_question/,27,https://redd.it/7woyes,John___41285,Shooting question,This is a legit question so before the mods remove it please hear me out. My BF /u/goatcan and I both have veins that are pretty shot after years of hardcore IV meth use. Is it possible we could inject into our penis's and has anyone done it before. I know this comes with huge risks but between the 2 of use we've wasted alot of H the last couple weeks missing shots. If anyone could help out we'd greatly appreciate it. ,1518303940.0
7woy6b,https://www.reddit.com/r/opiates/comments/7woy6b/_/,9,https://redd.it/7woy6b,opiatedabs,$$$,"I know that there’s tons of posts like this. A lot of us deal with pretty much the same issues buttttttt i hate when this happens. 

Seriously have been waiting for someone to answer since 5am! Boyfriend and I have plenty of cash. Finally after waiting all day it is 2:45pm now and we just got some black. We were just chilling in the car in a parking lot until we could meet someone. Our main guy calls us back finally and says to drive to his house his girlfriend will serve us just call her. So we call and she doesn’t answer. We drive to the next town over and in the back of my head I just felt like it wasn’t going to work out. Surprisingly we get to our dboys house and his girlfriend brings our dope to us within 5 minutes. Usually we have to wait a minimum of 30 minutes to over an hour when we get to their house so it was nice not having to wait for once. I totally wasn’t expecting her to meet us that fast. Everytime we have one of those days where we have money but nobody answers I swear that it’s always around 2:30-3:30 when we finally can pick up some dope. 

Hope everyone has a good weekend! Let everyone be safe, not be sick, and may your dope be fire! ",1518303876.0
7wox9w,https://imgur.com/gallery/2Ll3g,22,https://redd.it/7wox9w,clerror,Picked up some Hydro 10’s for gaming tonight.,,1518303636.0
7wow4u,https://www.reddit.com/r/opiates/comments/7wow4u/other_europeans/,4,https://redd.it/7wow4u,Dkopiates,Other Europeans,"I use citric acid in very small amounts and when i do a shot it's stil got that burning sensation when you empty the plunger. Anyone got something even milder that will still make my product (heroin nr 3) injectable with full effects.

Happy nods everyone i just did a shot and i'm felling fantastic right now, just slighty worried about the introducing acid part.

",1518303339.0
7wotrs,http://traceyh415.blogspot.com/2018/02/when-you-corner-dog.html,12,https://redd.it/7wotrs,traceyh415,When you corner a dog,,1518302702.0
7worw8,https://i.redd.it/1hornyycqgf01.jpg,6,https://redd.it/7worw8,TryingToCatchANod,Nothing special but anything helps. What do you guys think of these brands. Sun Pharmaceuticals & Amneal....not a fan of sun,,1518302172.0
7woo5x,https://www.reddit.com/r/opiates/comments/7woo5x/boofing_xanax_and_advice_for_copping_dope_for_the/,19,https://redd.it/7woo5x,dyingsober,boofing xanax and advice for copping dope for the first time...and other dramatic shit because I’m problematic,"I know this in opiates. I’m more familiar/trust you guys.
I deleted my long dramatic posts..because they’re long and dramatic.

TLDR of the other post: boyfriend got sent to rehab, he has all the connects and I don’t have my car. I manage to get one of our dboys by commenting my number on his Venmo..


I Was supposed to get my car back Friday. They say maybe it’ll be ready Tuesday. My boyfriend gets out Wednesday. I do not want to make him relapse. I hope I can even see him. His dad called me this morning, telling me not to go near him. That I’m no longer welcome in the house. That I’ll get over it, I’m 18, and should go do some homework.

They don’t know I use. Like I’m clean to them. Maybe they think I’m the reason he relapsed. I wasn’t. He was using When I met him. If anything he’s the main reason I got addicted..
guess I’ll just have to wait until he gets out and see how things go. Thinking about sending them a fucking edible arrangement. 

I’m sick. I had three bags, they got wet. Desperately left it out to dry, scraped it. Soaked the bags in water and boofed it. Water turned brown so I got something out of it... even shoved the fucking wet bag up my ass. Fucking pathetic.

I got this kid to drive me to (nj city were dope is sold) yesterday. Only he crashed his car on the way to my fucking house.

Today I got this girl who doesn’t use to drive me. Straight up told her what was gonna happen.

I call my dboy, straight to voicemail. Five calls and thirty minutes later he picks up. 300 dollars (100 from the original kid who was going to drive) for 70 bags. Fair. Whatever. I’ve never copped alone though. I’m scared honestly. I have the worst luck. It’s like the universe is preventing me from getting this dope. Or being happy.

I’ve never been this suicidal before. I know that’s bad to say. Especially since I’ve had multiple suicide attempts. So it’s going to be hard not to purposely use 7/8/9/10 bags just to... make this stop. Maybe I’m naive and young. But I’m hurting so badly. I’ve reached out to everyone I could think of... I begged my mom to bring me to my psychiatrist, they didn’t answer, I begged her to bring me to the hospital...written off as dramatic. A bunch of my gabapentin got wet along with my bags (a water bottle spilled in my purse). So I don’t even know if it’ll work but I must have taken about 15-20 if not more. (100mg each). It won’t kill me but I wish it fucking would.

I understand I am dramatic. I’m scared because I’m alone and without my boyfriend. I’m always with him. I’m terribly attached to him and miss him dearly. I’ve never been in love the way I am with him. And now everything is against us. I’d like to think he’d pick me over his family. He’s very mad at them. But in reality... they will kick him out. He has no choice. 

I don’t know how much I can take. I’ve been suffering for six years from mental illness. I get no relief. Ever. No medication, no therapy, no iop... I just don’t think I’m biologically fit to be alive.

Anyway I guess the main question... I took .5mg of xanax today in attempt to stop my mind from racing. My heart pounding. The intense fucking anxiety and constant daydreaming of overdosing. Maybe it took the edge off. I’m not getting fucking shit out of it.

So, if I were to crush up some Xanax and boof it... would it work? I guess chemically, I’m not even looking to get high, I’d love to get high, but I want to be able to take .5-.75 and just.. get the most out of it. I don’t know what will make it most worth my while.

Any advice on copping too... as far as I’m concerned I call, go where he says, he walks up to the car and it’s  quick exchange, then I high tail the fuck out of that place. I don’t know. I’m just nervous.

If anyone would like to talk by the way... please pm me. I know it’s desperate. I feel so alone. I’ve been sitting in my bed for days... I couldn’t even tell you the last time I ate. I just feel sick. I feel like I’m dying. Nothing gives me joy...I cry and sleep all day. The minutes drag on. I can’t fucking take this.

By tonight I’ll have my dope if everything goes well. And then I’ll have to feel better...right? Oh god. I need to.

I don’t know how much I can take anymore. I’m weak.",1518301139.0
7wolqf,https://www.reddit.com/r/opiates/comments/7wolqf/another_chipping_gone_bad_story/,8,https://redd.it/7wolqf,speedy_hippie,Another chipping gone bad story,"Im sure no one even recognizes my nick but i have been active here for mayby a year or something, and tried oxy for the first time at the end of spring 2017 with my SO. 

We binged for a few days a few times and fell in love with it, after abusing stims on and off for 1,5 years together but still maintaining control.

 We took a 8-11week break after the few binges, the last one being before the halfway point of summer. Then we started chipping, using once a week, usually 40-150mg used between us per session (most of the time all nighters because oxy keeps us awake)

We succesfully chipped until january, but started using almost daily in early january. Its now the night between saturday and sunday and we last used on wednesday so we managed to go to school. This is the only break longer than 1day we have had since early january.

Thursday and friday we just laid on the sofa as we couldnt get ourselves up and felt super depressed, have been taking a little bit of benzos to make it more bearable.

We were supposed to get an OC80 tonight but the dealer stopped answering, mayby this is a sign to continue not using, mayby not. We will probably try to cop some oxy tomorrow.


If someone remembers me talking about chipping in a positive manner and if someone told me that it isnt possible, now is the time to say ""I told you so"".


Im sure noone even reads this but i needed to vent somewhere, im feeling depressed af, borderline suicidal and super lethargic.",1518300490.0
7wojwm,https://www.reddit.com/r/opiates/comments/7wojwm/can_someone_tell_me/,3,https://redd.it/7wojwm,moondogg222,Can someone tell me,What tapentadol is ? Really curious,1518300020.0
7wojim,https://www.reddit.com/r/opiates/comments/7wojim/fentanyl_warning_traverse_city/,1,https://redd.it/7wojim,trifleswithbears,Fentanyl Warning - Traverse City,"If you have purchased heroin in the last few days to a week, it may be laced with fentanyl again. One man died a few days ago.  Cops are not 100% sure but they are warning people. It may have come from Indiana or Saginaw. 

Hope this is okay to post, I'm new to reddit but I see the rules about no locations or sourcing, but I am seeing a lot of fent warnings that mention locations, so ¯\_(-.-)_/¯",1518299908.0
7wojfu,https://i.redd.it/ycczcq2kjgf01.jpg,11,https://redd.it/7wojfu,TCBlue89,"So ive been following this group for years, just wonder if anyone else had these yellow 15s or 30s. Idk why but it had a hell of a kick to it. Stay safe out there and be careful who you deal with.",,1518299886.0
7woila,https://www.reddit.com/r/opiates/comments/7woila/on_day_8_aid_with_these_next_two_weeks/,7,https://redd.it/7woila,aymama,On day 8! Aid with these next two weeks,"Sup bropiates,

I know I know, google, search. But me just writing this out to y’all is helping since no one has known about my addiction. 

Had the worst six days of my life, but can say with pride the physical is gone! Some slight hot/cold and sweats but nothing like it was. 

I’m just wondering what has worked for those of you who got passed the next two weeks? I read that’s when most relapse and I refuse to do so. But I can endure physical pain a lot better than the mental I’m in and heading into. 

So what have you guys done, used, or whatever to get passed the PAWS? I hope every day gets easier, but not sure what to expect mentally. ",1518299661.0
7wohzf,https://i.redd.it/a0ac6719igf01.jpg,7,https://redd.it/7wohzf,Darknets-N-Dragons,Successfully took a 2.5 week break... I earned this ;),,1518299491.0
7wog32,https://www.reddit.com/r/opiates/comments/7wog32/anyone_able_to_quit_smoking_while_still_using/,29,https://redd.it/7wog32,newpills2018,Anyone able to quit smoking while still using?,I know they say you have to quit drinking for a while when you first quit smoking cigarettes because if you're a smoker it's REALLY hard not to smoke when you're drinking. But is it the same with opiates? Do they increase your cigarette cravings so much that you need to quit opiates too for a while if you want to kick cigarettes?,1518298979.0
7wodd8,https://www.reddit.com/r/opiates/comments/7wodd8/torn/,9,https://redd.it/7wodd8,ALWAYSandFOREVER2018,Torn,"Sometimes I am torn between the life I live now and the life I once lived. (Clean and sober 5+ years.) Somedays I reminisce about a horribly simple time, living on the streets and using. I just needed to vent to the only people who can understand. 
Just to clarify, most days are good. I no longer daydream about my DOC everyday. I wouldn't trade my beautiful life now to go back to what I was; but some days, every so often I still crave that sweet warmth that only one thing can bring. The one thing that make all problems and worries disappear into the fog for a brief moment. 
Thanks for letting me ramble. (If you're sober and craving, please know you are NEVER alone and that the cravings will eventually pass; just as mine is passing as I type this out.) 

One love, xoxo",1518298262.0
7wocqz,https://i.redd.it/pt6zbzj9egf01.jpg,35,https://redd.it/7wocqz,MOST_mdmAMAZiNG_1,Out the pharm,,1518298104.0
7wo33f,https://www.reddit.com/r/opiates/comments/7wo33f/doctor_messed_up_and_prescribed_me_bupenorphine/,9,https://redd.it/7wo33f,fucccccccccxxx,"Doctor messed up and prescribed me Bupenorphine Tablets , instead of film, are they the same thing?","Currently on 16mg a day. Are the films more or less potent ? Are they identical ? What is you all's experience with this , any help would be appreciated , wondering if should go back and get him to write me a new script or not.",1518295525.0
7wo2hg,https://i.redd.it/aumcsiq36gf01.jpg,14,https://redd.it/7wo2hg,2PillsAndAPopsicle,Happy Saturday you lovely creatures.,,1518295365.0
7wo0yw,https://www.reddit.com/r/opiates/comments/7wo0yw/cyp2d6_inhibitors/,6,https://redd.it/7wo0yw,BiggaNiggaPlz,cyp2d6 inhibitors,Anyone look into cyp2d6 inhibitors to potentiate highs? I've only taken it with Benadryl which somewhat potentiates but wondering if someone has tried something better. Wondering because I don't ever get a true high from any opiates I take so I think my body metabolizes it too quickly.,1518294970.0
7wo0aw,https://www.reddit.com/r/opiates/comments/7wo0aw/ohno520o/,5,https://redd.it/7wo0aw,NWOPIATER,Oh-no-520-O?,"I'm certain I'm totally butchering his user name but does anyone out there know where he's been? 

He posted quite a bit but I haven't seen him around in a long time.  Hope he's ok.  I tried to look up his post history bit because I don't know how to spell his user name, I'm coming up empty handed.

Thanks fam!",1518294802.0
7wnt4n,https://www.reddit.com/r/opiates/comments/7wnt4n/methadone_measurement_question/,31,https://redd.it/7wnt4n,windfl0wer,methadone measurement question,"how can u tell how many mg methadone is? just bought some from my boy and its apparently 300mg but it doesnt look like it. Hope to God it is tho since I just spent $100 on it and Im with my family for the next 2 days and cannot be sick. So anyone have a clue how I can measure it and see how many mg it is. Pic below 

[Picture ](https://imgur.com/a/lMQ5A)",1518292969.0
7wnsu0,https://imgur.com/a/enGSC,4,https://redd.it/7wnsu0,Opitefiendly,Moon rocks!!!,,1518292901.0
7wnprg,https://www.reddit.com/r/opiates/comments/7wnprg/pain_relief_for_pinched_nerve_without/,6,https://redd.it/7wnprg,kenrather12,Pain relief for pinched nerve WITHOUT acetaminophen,"Hey, I was prescribed tramadol 50mg at night to help me at least be able to sleep with the pain as it keeps me up at night(pinched nerve in my neck c1-c3 region) and it doesn't work. I also would like something to work during the day as well. I have used up to 400mg per day and it doesn't do shit to my pain at all, I thought it was a pain reliever?!. I was told that everything the Dr. could prescribe that was not lidocaine/novacaine patches was narcotics and they typically make people drowsy. I am a student in university and I don't want to be unable to think or high. I want pain relief because it is making it hard to sleep and concentrate while doing homework/assignments. I have researched and found that MOST medications for pain/opioids have acetaminophen in them with the narcotic and I have had kidney failure in the past that almost killed me and I am already on zoloft and stimulants for ADHD and I don't want to kill my liver/kidneys any more, so I was wondering what meds are good for neck/pinched nerve pain that do not contains acetaminophen. Thanks! ",1518292134.0
7wnilg,https://www.reddit.com/r/opiates/comments/7wnilg/donating_blood/,15,https://redd.it/7wnilg,_Cxnts,Donating blood?,"Fuck. So, I've been clean for about 3 days now because.. I've got no money. I told myself I'd stay clean but the physical AND mental are both killing me. I've never donated blood before and honestly don't want to reach a new low... Somebody help...",1518290300.0
7wnh89,https://imgur.com/a/la8ST,22,https://redd.it/7wnh89,Illbethereinfive,THE sniffers version of abscesses,,1518289940.0
7wnfu4,https://i.redd.it/lzigu2qyoff01.jpg,26,https://redd.it/7wnfu4,GiveMeMoreG74,Panda Porn,,1518289611.0
7wnbg5,https://i.redd.it/vrlf4qbmlff01.jpg,25,https://redd.it/7wnbg5,Rattlesnakejake91,Nice gram I can't even enjoy today since I took some sub last night oh well there's allways tommrow lol,,1518288515.0
7wn9k6,https://i.imgur.com/issafpG.jpg,35,https://redd.it/7wn9k6,Fataaronatgmail,Non user looking for answers,,1518288043.0
7wn7iz,https://www.reddit.com/r/opiates/comments/7wn7iz/how_long_does_it_take_a_fent_patch_to_kick_in/,5,https://redd.it/7wn7iz,jmc79,how long does it take a fent patch to kick in ?,,1518287529.0
7wn6il,https://www.reddit.com/r/opiates/comments/7wn6il/suboxone/,7,https://redd.it/7wn6il,Rattlesnakejake91,Suboxone,This is a stupid question that I most likely know the answer too but is there anyway to get around the opiate blocker in suboxone even a bit like if I do a decent amount of dope could I feel it? ,1518287269.0
7wmt1m,https://www.reddit.com/r/opiates/comments/7wmt1m/potentiate_before_plugging_morphine/,3,https://redd.it/7wmt1m,quickstopclerk59,Potentiate before plugging morphine?,"After a lot of searching I couldn’t find any answers to this. I’m down to my last 15 mg of morphine IR. I will definitely be plugging it to maximize the effect. I’m wondering if there’s anything I can do to maximize effects/prolong it as much as possible. I have DXM, Cimetidine, benedryl, Xanax, trams, and soma. I’m used to potentiating for oral use, but I don’t know if it’s worth it for plugging. Any insight? Thanks!",1518283923.0
7wms12,https://www.reddit.com/r/opiates/comments/7wms12/question_about_kratom/,9,https://redd.it/7wms12,Slamples1,Question about kratom,"Hi I have a question: I didn’t think I was going to get any dope today so I took 6 grams of kratom in the morning around 9 am. Then my guy came through, so I’m wondering how long I should wait to do that. I read a couple posts on here with some people saying it actually potentiates the dope for them, and others saying it blocks it out completely and makes it a waste. Any help is appreciated. ",1518283686.0
7wmnly,https://www.reddit.com/r/opiates/comments/7wmnly/unsatisfaction/,40,https://redd.it/7wmnly,Dysphoria_III,Unsatisfaction.,When I get high once I start coming off the peak I always make myself feel bummed out an like I’m not high anymore and I just can’t wait to reside. I know I still feel good and am happy but I convince myself I’m not and that I’m basically sober after the first 30 minutes. Anyone else experience this? I know I could redose but I know it’ll be the best for me if I wait like 8 hours and get a second really strong high for the day.,1518282562.0
7wmlhc,https://www.reddit.com/r/opiates/comments/7wmlhc/i_just_dont_understand_all_the_people_who_use/,41,https://redd.it/7wmlhc,williamskeat,I just don't understand all the people who use benzos with their opiates,"I know everyone is different and I am CERTAINLY not here to judge. I just don't get the appeal of benzos.  I love opiates, I've been an on and off junkie for a long time but I've NEVER been able to get any pleasure out of benzos.  They just make me tired and not want to move and usually I completely forget my opiate high if I combine them and I pass out immediately.  For me nothing ruins a good opiate high like benzos.  Am I crazy?  Every time I see benzos with opiates I cringe. The only thing I use benzos for is to help with detox.  Anyone else feel this way? Benzos just don't seem recreational at all to me.",1518282038.0
7wm5y1,https://www.reddit.com/r/opiates/comments/7wm5y1/pill_inquiry_are_these_pressed_or_real_deal/,5,https://redd.it/7wm5y1,SHG_Luke,[PILL INQUIRY] Are these pressed or real deal?,"https://i.imgur.com/qBzLRFr.jpg

Hydrocodone.",1518277871.0
7wm37s,https://www.reddit.com/r/opiates/comments/7wm37s/subutex/,12,https://redd.it/7wm37s,jerryriceintheflesh,Subutex,How much do strips go for in your guys area? Don't post your area just the price ,1518277085.0
7wm23n,https://www.google.com/amp/www.foxnews.com/us/2018/02/09/33-pounds-fentanyl-enough-to-wipe-out-massachusetts-seized-in-boston.amp.html,2,https://redd.it/7wm23n,BlueyArmstrong,Huge fent/dope/bust in Boston,,1518276750.0
