auzvo7,https://www.reddit.com/r/opiates/comments/auzvo7/the_science_of_addiction_tell_me_again_how_this/,15,https://redd.it/auzvo7,realcat67,The science of addiction. Tell me again how this works?,"I have been reading up on addiction research, because I would really like to understand why this is such a hard problem to solve.  How does it work?

Because I am reading that it is about chemicals in my brain. They call ‘em neurotransmitters. Drugs release them, stuff like dopamine.

That is a chemical that controls how rewards work. I do some coke, release dopamine, feel awesome, the reward center in my brain is activated, so now, naturally, I want more.

Simple. I buy more coke, do it, get more dopamine, etc etc.

So you can watch youtube and see that we have it all figured out.

But wait a minute. Too much dopamine makes me feel like shit. I am anxious. Nervous. I just want to feel better.

Obviously coke is not a good way to do this. I need some heroin to calm down.

Heroin, you see, is an opiate. Opiates affect the neurotransmitters called endorphins. They help change your perception of pain, as in feel none.

If you exercise, your body releases endorphins, which make you not depressed and happy. You get a reward for exercise.

Hold up, I thought dopamine did the reward thing?

Now it gets even weirder. Cause serotonin is the chemical that is supposed to mediate happiness, anxiety and mood. It stops you from being depressed.

Ok, now you are just fucking with me.  You just said dopamine motivates you to seek out and achieve pleasure. That it would make you happy. And too much dopamine makes you anxious. But serotonin does this stuff?

Hmm, confusing.

Also, there is the neurotransmitter called Gaba. It chills out the nervous system. It regulates anxiety and other things.

Didn’t we just say that dopamine affects anxiety levels? Too much dopamine can even excite you to death. And what about endorphins? Take that dope away and you are guaranteed to get anxious.

There are other neurotransmitters. Acetylcholine, glutamate, norepinephrine and more. You don't even want to know what these ones bring to the table, because then you are going to cuss me out and tell me to stop this bullshit.

Then there are hormones, which are also chemicals but another type of beast. Some, like testosterone, can make you feel aggressive, happy and powerful.

Hmm, that is funny cause I thought neurotransmitters did that. I thought they controlled your mood and made you feel good.

Yes, well you see, it is complicated.

Yes, complicated as fuck. I do not believe there is a single human being on earth that is capable of really understanding what is going on at this point.

Maybe a computer could do it, because there are some really powerful ones. The problem with that idea is that computers require human programmers.

But humans require exact, logical data and rules to write code. Data that we apparently do not have. So that won’t work. At least right now.

So we are left with many, many paradoxes. Some people can taper off addictive amounts of opiates in 3 or 4 days, pain free and be fine. Some people try for months to taper off and still have to kick hard at the end. Wtf? How does that work?

Good old mama nature never, ever, does things the easy way. Which is normally a good thing or we would all probably still be one cell organisms floating in a pond somewhere. Evolution is trial and error and increasing levels of complexity.

This stuff is just not that easy to understand and there is definitely information missing from the puzzle. Maybe we will figure it out in the future. I don’t think we will be able to fix addiction until we do.",1551190337.0
auzme6,https://www.reddit.com/r/opiates/comments/auzme6/infection/,8,https://redd.it/auzme6,marstars85,Infection?,Started last night and got worse started with a small head ache and progressively got worse This morning theres huge throbbing pain in my head and behind my eyes. Pain when I move my head pain when I cough. my eyes are red my mouth seems dry. should I go to the hospital.,1551188779.0
auyqa3,https://www.reddit.com/r/opiates/comments/auyqa3/the_most_detailed_boofingplugging_guide/,5,https://redd.it/auyqa3,TotalBath,The most detailed boofing/plugging guide,"Very helpful

Happy boofing

https://wiki.tripsit.me/wiki/Quick_Guide_to_Plugging
",1551182886.0
auyptu,https://www.reddit.com/r/opiates/comments/auyptu/happiness_is_not_an_accident_nor_something_you/,19,https://redd.it/auyptu,wizardtoo,"Happiness is not an accident, nor something you wish for. Happiness is something you design.",Everything that happens to you is either an opportunity to grow or an obstacle to keep you from growing. You get to choose.,1551182793.0
auyhk6,https://www.reddit.com/r/opiates/comments/auyhk6/advice/,17,https://redd.it/auyhk6,ClarkSD23,Advice,"I was recently given a random UA test by my adderall Dr. after 2 years of going to him. I failed for Suboxen & Morphine (IV H) that combined with a “Heroin overdose” on my medical history from 3 years ago resulted in getting terminated from the practice.

I sincerely need my adderall script for my ADHD & being able to function at work. I have a new Dr. visit scheduled later this month, any advice on how I should approach this w the new Dr.? Seeing as the UA results are now on my record & should have an excuse prepared etc. Thanks",1551181157.0
auyd9o,https://www.reddit.com/r/opiates/comments/auyd9o/have_you_ever_tried_endocodil_40_ir/,14,https://redd.it/auyd9o,LFRoxiesPLZsendhalp,Have you ever tried: endocodil 40 IR?,"Edit: Fuck, I must be pretty lit, this shit is a novel. 

So while strolling through the fields tonight, I saw some very low priced Oxy IR of a dosage I've never seen before. Looks like they're unmarked yellow circles in blister packs, and are listed at 40mg. Previously, I had only been aware of 40mg being available as XR, so I was pretty curious as to what these were.

After some Sherlocking, it seems these are endocodil, a Mexican pharma brand. From what I hear, there's a tamper-proof coating to prevent snorting, however the coating has been described as similar to the old OCs, and can therefore be remedied pretty easily.

My ROA for Oxy is always oral (better BA and I just don't like snorting in general). I typically take mboxes and the like, so not used to dealing with tamper coating. If these are truly IR and I'm going oral, do I care about the coating, like, at all? Will it take longer to start working, similarly to what I've heard about XR?

I'd love to hear some firsthand experience with these. I was only able to find bits and pieces of info about them, and only a couple of posts here, with very little feedback from those who have taken them. Any differences in the high or silly shit like that, or is it just straight up the same?

I did harvest some from the fields, and should be able to provide my own experience in a couple of days, but I'd like to have the most data possible about it before going all pacman on them, so I figured I'd ask some questions in the interim. I will say, if they're 1:1 legit, this will def be the new hotness for me, less than half the price of any other legit pharma IRs I've found. ",1551180215.0
auxtbb,https://www.reddit.com/r/opiates/comments/auxtbb/banging_oxys_yay_or_nay/,8,https://redd.it/auxtbb,dillydelhi,Banging Oxys yay or nay?,"  
I just got .22ug micron filters!

is it still best to eat or snort my oc 80s?",1551175669.0
auxpys,https://www.reddit.com/r/opiates/comments/auxpys/thinking_of_getting_in_suboxone_opinions/,10,https://redd.it/auxpys,SmackMyTitsUp,Thinking of getting in suboxone. Opinions?,"So I have been using for about 5 years, and just in the last month it has started to get a bit out of hand. I'm seeing that I am using when I really don't want to be.

So anyway, I figure it's time to get some help in the form of pharmacotherapy. At this stage I'm thinking of going on a suboxone program. I'm actually really excited about it.

I feel like my heroin usage isn't too high, and I really don't want to be addicted to suboxone but I figure if I keep going this way my heroin use will be stupid high and it will be worse than the suboxone addiction will be anyway. I really wish you didn't have to go on a 'program', and instead could just have suboxone on hand for whenever I feel the urge to use heroin. Instead, they insist I become addicted to suboxone to get a script at all. 

I'm looking for people with experience with suboxone to share their knowledge, negative or positive, with suboxone.

Peace and love people, stay safe.",1551174902.0
auxi4w,https://i.redd.it/ffdjqbfdsvi21.jpg,26,https://redd.it/auxi4w,Z_M4L,Refill day baby M30s & Xanz,,1551173060.0
auxeu0,https://www.reddit.com/r/opiates/comments/auxeu0/refills_at_cvs/,15,https://redd.it/auxeu0,PMmeyourheart,Refills at cvs,So has anybody had issues refilling their rx at cvs? I went to pick up my norco rx at 1230am the day I was eligible for a refill. The pharmacist told me that they no longer allow narcotic prescriptions to be picked up after midnight! Anybody heard of this? I'm in California.,1551172274.0
aux88d,https://i.redd.it/6y1ka8wllvi21.jpg,24,https://redd.it/aux88d,Barto310,What exactly do i have here.. seems like the opiate gods blessed me... any advice on what i can do with this or the value?,,1551170786.0
auwzcx,https://www.reddit.com/r/opiates/comments/auwzcx/still_withdrawing_on_suboxone/,7,https://redd.it/auwzcx,NicholiSpottigof,Still Withdrawing On Suboxone,"So, I took Suboxone about 7 hours ago now, and I still score like a 10 or 11 on the COWS sheet. I'm at a loss. I waited the right amount of time, I felt better when it kicked in so I know I didn't precipitate withdrawal.
Regardless, the urge to use is strong. I just want to fucking sleep. My habit is at around .4g a day, and I took an 8 mg sub.
I am miserable with gooseflesh, hot flashes and cold sweats, and the worst muscle tension ever. Should I take more subs?

Edit: For anyone else in this situation that sees this post, the people in the comments were right. I took subs every 2 hours till I felt better, which amounted to 16mg. I still felt pretty shit, so I waited 12 hours and took more Suboxone. Still felt like shit for a while, but after 22 hours after I'd taken the first dose, I feel like I did before I even took them. 

Oh, I still can't fucking sleep though, but I don't think this is a usual experience. I think anyone that doesn't have preexisting insomnia issues would be able to sleep at this point 

Now to relapse in 2 days, knowing me anyways.",1551168765.0
auwnft,https://www.reddit.com/r/opiates/comments/auwnft/needle_nonsense/,21,https://redd.it/auwnft,swagdaddyhammerD-i-k,Needle Nonsense,"Lately I have been having WAY too many problems finding new points!! I took a hiatus from the life and luckily put aside a couple, but jow I am lost. Back in the day we were lucky and said my friend was Diabetic and bought 5,000 from Wallgreens. Now I hear horror stories of cops being called or asking for a ID and being blacklisted (moms a nurse so medical advice and assistance is complicated) and of course needle exchanges close when I'm off of work and havent heard anything decent! Any advice? back alley knowledge? hell even stories, lol i like those

ps. Let me know if you are a like-minded enthusiast in the Mile High, all my friends didn't make it and could us someone to look out for me while I do the same for you ",1551166191.0
auwloy,https://www.reddit.com/r/opiates/comments/auwloy/yet_another_faq_how_do_i_prep_morphine_er_pills/,11,https://redd.it/auwloy,amywinehouse777,Yet another FAQ: how do I prep Morphine ER pills for plugging?,"I know this has probably been asked a lot, but I can’t find any tips for the specific kind of pill I have. They’re the Mbox 15mg ones. I have no idea how to prep these. I’ve tried to plug OP 80s before, but it just turned into a gooey mess of disappointment, which is why I want to make sure I get it right this time. 

Do I suck the coating off of it? If so, how do I know when the coating is gone? Also, do I have to heat these up for the binders to break down? I’m a complete noob when it comes to these fancy ER pills, and I seriously don’t want to waste it like I did with the 80s. I’m planning on taking only 7.5mg (my DOC is Norco, and I only take 10mg at a time. Tolerance is pretty damn low.) so hopefully I won’t have to go through much trouble to do this. ",1551165841.0
auwf7y,https://i.redd.it/ji7dbx103vi21.jpg,47,https://redd.it/auwf7y,upintheairforgood,"My first/hopefully last stash post. Been a lurker for ever. But I’m traveling across the US to Mexico for a treatment combination of ibogaine, ayahuasca, DMT sprinkle in there maybe? (None of which I’ve tried ever). With western medicine for safety and eastern spirituality for growth?wish me luck",,1551164523.0
auwcoc,https://i.redd.it/9hpl3d2i1vi21.jpg,6,https://redd.it/auwcoc,bagsinmysocks,Miss you bro.,,1551164029.0
auw96i,https://i.redd.it/xap2bhehzui21.jpg,0,https://redd.it/auw96i,Alexdens,See mom? I told you!,,1551163338.0
auvyad,https://www.reddit.com/r/opiates/comments/auvyad/please_help/,11,https://redd.it/auvyad,peeperanon,PLEASE HELP!,"Has anyone taken a hair follicle drug test? If so, could you send me the digital copy of your results? Basically, I need to forge a negative hair follicle test for my family. If I can just get basic documents, I can forge it to have my information on it using photoshop. This is very time sensitive, if you can help that would be much appreciated, and Junkie Jesus will remember you helping out a fellow bropiate!",1551161237.0
auvwfq,https://www.reddit.com/r/opiates/comments/auvwfq/the_suboxone_detox_dude/,9,https://redd.it/auvwfq,Bobhill187,The suboxone detox dude,"So I've been without subs for damn near 30 day, 25 something like that....I'm still off of them(yay) not using(yay) but I lost my job due to some just straight up bullshit related to a background check(it came up clean the first time(bullshit), it was temp to hire and I was scheduled to go perm, hence the fucking.....I at least had extra money for another month rent and electrical and now I'm going to use the time to centre myself and find a job that is not so time consuming   and a better shift for me...... FML though all that work showing up during withdrawal only to get canned when it's over, no fault of my own, sometimes I wouldn't have any luck at all if it wasn't bad....
Oh yeah I still take kratom but I,ve been craving subs bad, id rather just do dope and honestly I'm just staying away from it all.....it's the cravings now, that hollow life feeling without my filler....grrr I probably need to switch kratom strain or up my dose on it actually, maybe something like a low dose of codeine spread out through the day would be beneficial....",1551160912.0
auvs7w,https://www.reddit.com/r/opiates/comments/auvs7w/question_for_whose_ecp_has_lots_of_fent_in_it/,9,https://redd.it/auvs7w,cozywarmedblanket,Question for whose ECP has lots of fent in it,"I have this theory that as China no longer ships the good fent analogs as easily, and as peoples' kilo stashes are running out, that the Fent on the street is going to start being the weird analogs that the people over in /r/fentanyl and others who seek out just Fent are finding.  


**So, have you been noticing any weird dissociation effects or cannabinoid effects?  Has the fent feeling changed?  Are bags still just as ""hot""?**

&#x200B;

I'm well aware that Fent is being made and coming up from Mexico now, but I think thats being distributed in a different way to different people.   I think things are going to get weird on the streets for a bit unless someone is still supplying easily and directly without having to know a ton of people.  I also know there are some fent labs in the US here and there, but I also don't think its going to replace the huge amount that was being bought from china.    


I mean, how long can all the kilos last that were purchased?  Ive read in some invite only forums that some pill pressers are running low on Fent-HCL, A-fent, Fu-f, etc and aren't quite sure what to do next.   


Thoughts?  Even just a direct answer from people in the area would be cool?

&#x200B;

THANKS IN ADVANCE, HAPPY NODS MY FRIENDS",1551160151.0
auvjcn,https://i.redd.it/fgtu5zmblui21.jpg,24,https://redd.it/auvjcn,rattattatttt,This evenings pickup,,1551158585.0
auv7ac,https://www.reddit.com/r/opiates/comments/auv7ac/using_relapse_as_a_tool/,17,https://redd.it/auv7ac,spicypepper_,Using relapse as a tool.,"Hello everyone! i am not an opiate user but have a strange situation. One of my best friends (j) was talking to this girl (m) for a couple months. He was extremely transparent as in they are not in a relationship and he cannot handle being in one. she said since she was in recovery from being addicted to heroine she cannot handle a relationship either. Me and my friend J are not opiate users. Well tonight my friend J told M that while they are very good friends he doesn’t have feelings for her in a romantic way, since she has been hinting on going on dates and such. She got extremely mad/upset and went and bought a bag and used. directly after she called my friend to tell him it was his fault and that she relapsed because of him. now my friend feels extremely trapped and is scared to do anything because he doesn’t want her to do anything stupid. Has anyone dealt with anything like this before??? I care deeply about my friend and don’t want him to feel this way. I also don’t want the girl to feel so bad that she’s using. I mean i think if it was that easy to tip her into a relapse she shouldn’t have gotten involved w anyone, romantic or not. but i could sound very ignorant from being an outsider to addiction. if anyone has any advice on how to approach this it would be really appreciated by me and j. thank you in advance ",1551156532.0
auv62r,https://i.redd.it/czmf2msleui21.jpg,4,https://redd.it/auv62r,Shadyaku69,True as truth can be,,1551156319.0
auv3ua,https://i.redd.it/yoiz8v4gdui21.jpg,4,https://redd.it/auv3ua,amywinehouse777,"Mbox morphine. Definitely not my DOC, but it keeps the withdrawals away.",,1551155929.0
auutwa,https://www.reddit.com/r/opiates/comments/auutwa/sweet_deal_for_hydromorphone/,7,https://redd.it/auutwa,SomnusTheJunkie,Sweet deal for hydromorphone,"Tomorrow morning I'm getting 5 8mg dilaudid for only $40!! Of course hydromorphone has no legs but the rush is unreal. Normally I find Ds in my area for $25-30, I've once heard of someone on the other side of town from me getting them for $15, but I can't believe I found some who gets a script of $120/month and selling them so so fucking cheap.  He actually snorts dope himself and same with the Ds but says the Ds suck. (Well duhhhh) so that's why he's willing to sell them so cheap. He's only come across hydros, blues and H but never Ds. Hopefully he never finds out the price but so now, 5 for $50 or 12 for $100 is insane :) 

Edit: (mathz) Basically getting hydromorphone $1 per mg. ",1551154201.0
auuy63,https://www.reddit.com/r/opiates/comments/auuy63/oral_opium_dose/,4,https://redd.it/auuy63,Shpicy,Oral opium dose,What’s a good oral dose to start off using opium?,1551154930.0
auuz9m,https://www.reddit.com/r/opiates/comments/auuz9m/are_you_asleep/,11,https://redd.it/auuz9m,dripANDdrown,“Are you asleep?!”,"My girl and I were fucking after a long night of yay. Popped some klonopin in the beginning and then we started taking the oxy she’d been saving. It’s a special occasion thing for both of us.

Mid fuck, dick about to go limp, she’s on top. I was just laying back and letting her do work and she goes  “are your eyes closed? ARE YOU ASLEEP?!” I was totally nodding off lmaooo

She was 10/10 chill about it and realized it’s biology and not “how I really feel”

I’m sure this is common. Thought I’d share. ",1551155119.0
auuxgu,https://i.redd.it/os8ixak3aui21.jpg,4,https://redd.it/auuxgu,Shadyaku69,Its a beautiful night ; its raining Oxys,,1551154804.0
auukh6,https://i.redd.it/bc4ry05j3ui21.jpg,1,https://redd.it/auukh6,purpp222x,Need something stronger than 5’s but they’ll do for now,,1551152593.0
auuil5,http://www.bccsu.ca/wp-content/uploads/2019/02/Report-Heroin-Compassion-Clubs.pdf,3,https://redd.it/auuil5,meta232323,I still have faith in humanity : heroin buyers club proposed by researchers.,,1551152286.0
auuike,https://i.redd.it/e4qiwt8k2ui21.jpg,18,https://redd.it/auuike,madasahatter1985,"My first post is a small one, but was able to pick up a couple real mboxes tonight. Haven't come across these in my area much lately that aren't pressies! Now time for a hot bubble bath and some crappy night time TV to relax a bit! Peace and love folks!",,1551152282.0
auuh3x,https://www.reddit.com/r/opiates/comments/auuh3x/oops_i_did_it_again/,16,https://redd.it/auuh3x,King__ginger,Oops I did it again,"I popped 2 tramadol,
Even though I know tomorrow I'll wanna kill myself,
Ooh baby baby

Oops I played with my head
Will 5htp help me with depression?
Tomorrow maby?

Sneakish, non rhymed edit: I've also got caffeine/ltryptphan pills, more tramadol, a plethora of diazapines, some phenylethylamine, magnolia bark extract or phenibut.

Again, this isn't for fun, I'm having fun ATM. But tramadol makes me suicidal the next day, idk why. Other opiates are find, never got these kind of withdrawals. Also again, gotta work tomorrow so I'm just listing things I can still function on.

Recommendations for the best tramadol hangover cure other than ""don't take it if it make you suicidal"",I know, we know, I'm stupid. ",1551152037.0
auudsg,https://i.redd.it/8fdqfor70ui21.jpg,34,https://redd.it/auudsg,friendofbillss,They might be pricey but them caps be 🔥🔥,,1551151479.0
auucwi,https://i.redd.it/drw429przti21.jpg,9,https://redd.it/auucwi,bears21xxx,"Hey have anyone tried the 319 tramadols, where they any good",,1551151340.0
auu3b3,https://i.redd.it/exbo89r0vti21.jpg,9,https://redd.it/auu3b3,ancat100,20 10mg oxys and half of a K 71 opana. Not a huge stash but they’re authentic pills and relatively good photo quality. I hate grainy pill pics lol,,1551149734.0
autzep,https://www.reddit.com/r/opiates/comments/autzep/why_are_pressed_pills_made_to_look_like_an_actual/,20,https://redd.it/autzep,TayDavies95,Why are pressed pills made to look like an actual narcotic?,I've met a ton of people that are fine with taking presses and I've seen them advertised at such. With that in mind what is the point of making them look like let's say oxy's if everyone knows that's not what they are? Even on here I see people post pictures with presses as if the stamp makes them feel a bit better about taking it. No disrespect at all I'm just curious.,1551149083.0
autt6t,https://www.reddit.com/r/opiates/comments/autt6t/whats_the_best_way_to_take_an_451_suboxone/,4,https://redd.it/autt6t,needtopass00,What’s the best way to take AN 451 Suboxone?,I tried taking 2mgs sublingually earlier and it doesn’t feel like it did anything at all!  Can I snort it or shoot it or what?  It has naloxone in it so that’s why im worried.,1551148083.0
autt49,https://www.reddit.com/r/opiates/comments/autt49/west_coast_question_re_fentanyl/,5,https://redd.it/autt49,Fishonaheater22,West coast question re: fentanyl,How likely is a heroin user on the west coast to find fentanyl in gunpowder or bth?,1551148070.0
autr81,https://www.reddit.com/r/opiates/comments/autr81/am_i_free/,12,https://redd.it/autr81,Bobsagetthefaggot69,Am I... free?,"I'll try and make this  and sweet. Been on buperenorphine for 3 years and have reduced dramatically over the last six months. I've been on 0.70mg of zubsolv for 2ish months. I know that is more close to 1mg of suboxone in terms of biovail. I dropped completely and it's been 4 days of hell. Then, last night i took 2mg loperamide x15 around 3am. I woke up, went to work and have felt pretty damn good the entire day. Am I out of hell or is the lope possibly masking my WD still?",1551147763.0
autr24,https://i.redd.it/awb7bp0uoti21.gif,20,https://redd.it/autr24,tumeg102,Got a 4 of Morton Grove (wok) from the doc. 1 Line for each Vanilla Cream NY Seltzer :),,1551147736.0
autpjw,https://i.redd.it/3ht1kuzboti21.jpg,22,https://redd.it/autpjw,freeetiz,What's the best way to dose this for a first timer that weighs 125?,,1551147494.0
