27v1vj,https://www.reddit.com/r/opiates/comments/27v1vj/pawn_shop_good_idea/,38,https://redd.it/27v1vj,pdxguy1000,Pawn Shop? Good Idea?,"I have never pawned shit before. I would only take out a loan for a couple hundred at most, more like 200, until I get paid July 1st. The collateral I am thinking about using is an old family engagement ring that I am going to give to my girl eventually. The ring has been legitimately valued at about $13,000. Is it smart to use this as collateral? I don't really have anything else. I will 100 percent have the money to pay this loan back with the interest and fees and I will not lose the ring due to not paying the loan. I just don't want to experience withdrawal. I have never used a pawn shop before so I am asking you guys.",1402475630.0
27uo58,http://imgur.com/gDcXzCm,5,https://redd.it/27uo58,xboxaddict501,"I dont know if this is interesting to any of you guys but, This is a crime scene photo of Kurt Cobain's Kit taken on the day he died.",,1402461354.0
27unph,http://cdn.ebaumsworld.com/mediaFiles/picture/2315435/84152402.jpg,12,https://redd.it/27unph,meowforme90,Victorian Era Morphine Set,,1402461004.0
27uh0j,https://www.reddit.com/r/opiates/comments/27uh0j/working_while_clean/,9,https://redd.it/27uh0j,ironoxysweetie4,Working while clean..,"Hmm let's see, I have not worked in almost 6 moths due to some crazy union stuff that went on in January, now I am going back to Work in the morning. I was thinking about it earlier and this is the first job I have been on that I am clean in almost 3 years. Already in my head I an thinking what I can do with that first pay check... sad I know. I have been clean for almost 3 weeks now and it is getting harder every day it seems like.. I am still having cold chills and sneezing like crazy and kicky legs at night so I still am not in my feeling normal state. 

I guess what I an getting at is I know that I am about to have plenty of money to afford my habit and I get this feeling I am gonna completely ruin my clean time soon as I get my hands on money.. what would you do? ",1402456095.0
27ucd2,http://i.imgur.com/LfXS2aB.jpg,12,https://redd.it/27ucd2,traceyh415,Things junkies need (wipes not shown),,1402452914.0
27u9os,https://www.reddit.com/r/opiates/comments/27u9os/best_way_to_get_sticky_bth_off_of_aluminum_foil/,11,https://redd.it/27u9os,BeltBiteMarks,best way to get sticky bth off of aluminum foil... (freezer/hot water over spoon?) others?,who has answers!? gotta super sticky batch.... why so sticky? the freezer wont even get it super hard,1402451052.0
27u9cm,https://www.reddit.com/r/opiates/comments/27u9cm/moved_ten_minutes_across_town_and_lost_all/,12,https://redd.it/27u9cm,anotherrandoguy2,Moved ten minutes across town and lost all connects. Any suggestions on how to go about and get lucky enough to score some down?,"I've never been able to just spot someone and cop off them like that, and assume it's pretty rare, but in case there are ways to raise my chances. Fucking hot in TX and just need a damn shot.",1402450815.0
27u5gm,https://www.reddit.com/r/opiates/comments/27u5gm/concern_about_insurance_dropping_my_coverage_of/,8,https://redd.it/27u5gm,DirtyElbierto,Concern about insurance dropping my coverage of Suboxone,"Hey guys.   I still haven't had a chance to talk to my doctor, because I just got the letter in the mail today...  but basically my healthcare provider is no longer going to cover Suboxone starting July 1, 2014 (thanks for the heads up, assholes).   They list Zubsolv as a ""lower-cost option"" on this letter, but do not state if it will be reduced price, or simply purchased with a co-pay as I do now.

That's not my primary question, though... what I really want to know, is if any of you have had experience with and/or know whether my doctor will even be able to prescribe this Zubsolv or not?   I had never heard about the drug until today, and have never heard my doctor mention it before.   The doctor I see specializes in neuro-medicine, and has begun treating people with addiction problems... so I would think they could prescribe it?   But I don't know.

Any nuggets of wisdom from someone in the know would at least slow my heart rate down at this point.  The difference between subs being covered and not being covered... is me being bankrupt.  I cannot afford $20 a day.   

Thanks in advance for any info you guys might have.  ",1402448182.0
27u4j4,https://www.reddit.com/r/opiates/comments/27u4j4/how_long_do_yall_think_it_will_take_for_a_bag_to/,23,https://redd.it/27u4j4,WorthlessDenver,How long do yall think it will take for a bag to pass through my system?,"So basically im in a new town and after doing a bit of research I found a spot to score from. I end up getting a 50 (it was in a black bag tied off) and for some odd reason I felt the need to keep it in my mouth. Lets just say it was a 6th sense. So i start to walk back to where my car is parked and im trying to use my keys to find it. Its fucking gone. Got towed, I go into panic mode and this security guard comes up with a shit eating grin on his face and tells me he knows where i went and why. So he had it towed. Then he tells me hes gonna search me. Fuck no i swallow that bitch and he notices and makes sum stupid comment about it. So my last 200$ to stay well in a new city till i get my first pay check is gone to get my car out of the impound. And on top of that im sick. So this happend about 1:30 and its about 4 hours later. 1 hour ago i drank a magnesium citrate. Do yall think theres any chance its gonna come out tonight. I fucking hate working sick, im just a plain ass.



 Edit 1 : went to the bathroom.... nothing, watery. Not sure if that was all the magnesium citrate or will i go again? 



 Edit 2 : went to bathroom 2nd time wondering how pissed my roomates are that im shitting in the tub. Nothing yet, im thinking about getting another bottle of magnesium citrate.


Edit 3: Success, I dident think it would work. When took my morning shit it was all watery except for something i pushed out. I dident think much of it but when i looked down at the toilet i saw it. My eyes lit up like it was x-mas day. Right after tho i almost dropped it in the sink, I had to dull down my excitement. It was triple wrapped in black bags. The dope was pretty fire also, Im wrting this as i am 2 steps away from nodding.  ",1402447552.0
27tx06,https://www.reddit.com/r/opiates/comments/27tx06/weird_shit/,22,https://redd.it/27tx06,Followthebleeder,Weird shit,"So the guy that middles for me just brought back some shit I've never seen before. Unmarked wax bags with no stamp. I know it's dope because it's clumped up like dope. The weird part is, amidst the clumps are these little black specs. Any explanations? It's been about 10 minutes since I snorted 2 bags and I don't feel a damn thing. Waited all day for dope and now that I have it I just wanna get rid of it. Any and all suggestions welcome.",1402442631.0
27twmp,https://www.reddit.com/r/opiates/comments/27twmp/how_long_do_your_nods_last/,7,https://redd.it/27twmp,Zikboy99,How long do your nods last?,When you nod off how long does it usually take for you to wake back up?,1402442368.0
27tps1,https://www.reddit.com/r/opiates/comments/27tps1/getting_clean_going_through_withdrawals_the_right/,18,https://redd.it/27tps1,SoL_and_Sick,Getting clean: going through withdrawals the right way...?,"Hi all. I'm planning out my kicking endeavor now, despite having some medical issues where pain management is needed I've found that I'm not enjoying myself any more. No amount of dope, pills or what have you gives me any euphoria any more. It's just the next dose to stay well. As such I'm planning on getting clean to take a little break and sort my life out. I know I'll probably return once I reach my goals and I'm okay with that. I just want my tolerance to go back down and experience extended sobriety for a bit. Bliss without suffering becomes suffering itself. 

So my goal is to make the acute withdrawal period as minimal as possible. My habit in a tangible measurement is about equal to 400mg Roxicodone/day. Some days it's dope, some days it's Diluadid, some it's CWE norcos. So first on the agenda is:

1.) Titrate my doses down over 8 weeks, whilst I acquire the things I need for when I'm off. I chose a long titration period because I want to guarantee my success. I know cold turkey makes me much more likely to go drive down town and find a dboy. I've never done a proper weaning before and this may make things a lot easier. 
2.) My shopping list for things I'm going to stockpile for the week of withdrawal symptoms: 

•Loperamide- standard protocol. I'm on the fence since I suffer from bad constipation even while sober, but invaluable during the runs. 
•Lunesta and Ambien- Anything that helps guarantee a full night sleep is to be worshipped. These drugs work for me and I'm planning on rotating between them to keep tolerance down. Have to remember my goal is to sleep, not get buzzed and play with the ambien walrus. 
•Xanax and Valium- Not wanting to replace one addiction with another but I can take benzos here and there without worry. Great for mood stabilization, getting rest and muscle relaxation
•Soma- For when RLS and muscle spasms are kicking my ass
•Multivitamin with focus on amino acids, magnesium, zinc, b vitamins and vitamin c. All stuff I'm probably deficient in these days. 
•Coca Leaf Tea- Nausea, oxygenation, and mood elevation. I've heard great things about drinking a cup of this in the morning during withdrawals. 
•Peppermint Tea- Nausea and mental relaxation. For me it's just a thing I enjoy the taste of. It calms me down when I'm wound up. 
•Kava Kava- Another ethnobotanical I've heard great things about. I can't take kratom due to it causing terrible anxiety and restlessness for me. 
•DXM only Robitussin- I've found that 150mg of DXM daily helped with past withdrawals immensely. I don't know why scientifically but I have seen it mentioned on OTC wd help threads on various forums. 
•Cigarettes- this isn't a time to add more stress by trying to quit something else too. 
•Fresh Passion flower and dwarf skullcap- I was lucky and my garden has grown well. I've heard some interesting things about these plants. Some conflicting. What I've gathered is they can be potent and psychoactive when fresh but lose much of their strength while dried out. Just various ways to occupy my mind and attempt relaxation. 
•Mary Jane- 2 lunesta, a mug of peppermint tea, and a fat bowl of kind and I'm out like a light. 
•2 L of mineral water a day- Hydration can help immensely I hear. 
•A weeks worth of my favorite junk, comfort and chocolate foods- Any semblance of comfort and happiness is welcome. 

I apologize for the piss poor formatting as I'm on mobile right now. Is this idea and shopping list a step in the right direction? Are there some things I've forgotten that would help me out? Any tips and insight would be very appreciated. I'm trying to make the withdrawals suck as little as possible this time. 

Much love.  ",1402438078.0
27thzt,https://www.reddit.com/r/opiates/comments/27thzt/what_does_one_do_when_high_on_painkillers_for_fun/,36,https://redd.it/27thzt,stellies,What does one do when high on painkillers for fun?,Basically I want to know how to have a more pleasant time while high on painkillers.,1402433424.0
27thyq,https://www.reddit.com/r/opiates/comments/27thyq/going_to_a_garden_party/,7,https://redd.it/27thyq,Skitkorv,Going to a garden party,"I threw a bunch of seeds in my parents garden last fall and they have flowers everywhere. My dad just called me and said that the crowns are pointing up on them, he is unsure what to do next. Time to go show the old man my gardening skills.",1402433413.0
27tgwr,https://www.reddit.com/r/opiates/comments/27tgwr/your_favorite_song_about_opaites/,77,https://redd.it/27tgwr,TallUnicorn,Your favorite song about Opaites,What's your favorite song that references opiates? ,1402432815.0
27tele,http://www.medscape.com/viewarticle/826473?src=wnl_edit_tpal&uac=211814HT,3,https://redd.it/27tele,mykalASHE,Bunavail - The newest form and delivery method for buprenorphine replacement therapy. Lower doses achieve same results.,,1402431557.0
27tbai,https://www.reddit.com/r/opiates/comments/27tbai/fellow_dopers_i_ask_for_your_assistance_please/,8,https://redd.it/27tbai,Opiad,"Fellow Dopers, I ask for your assistance. Please, help out a man in need. (I'm getting ready to kick and need advice)","I have been doing the wonderful Heroin for 2 and a half weeks straight.  I didn't really plan it out, but it happened.  I also shot for the first time a week ago.  It was glorious, and now it's trouble.  :)


So far my withdrawals are not that bad.  I could kick them quite easily if I could just smoke pot all day and then take Ativan to sleep.  

Unfortunately I have to work and life at this time will not allow for that.  I can't smoke before work, and I can't be good enough at 50% while I'm suffering.

Fortunately, a time is coming up very soon where I have what I need to go through withdrawals.  

But what if there things that would help me feel, at the least, ""normal"" enough to work?  Then I could stop buying dope sooner, and kill this first long term binge I've ever been on.

I have heard about methadone, and stuff like that, and I'm sure a vic 5 or two for the really shitty hours would be enough.


I want to hear from the best R/Opiates!  Tell me, what can I use to help make the wean to clean easier.  I have the money and the means to get ANYTHING I need, so without buying heroin specifically, what things will help?

TL;DR:  Trying to quit heroin.  have minor physical symptoms and moderate mental symptoms.  Wants info on good drugs that will help make for an easier ""Wean to Clean"" transition.  ",1402429821.0
27su4a,https://www.reddit.com/r/opiates/comments/27su4a/hep_c_questions_answered/,7,https://redd.it/27su4a,AReynoldsHCV,Hep C Questions Answered,"Hey Everyone,

I'm available for awhile to answer any questions you have on hepatitis C.

Best
Andrew
Hepatitis C Education Manager, Project Inform
  ",1402420371.0
27sqmw,https://www.reddit.com/r/opiates/comments/27sqmw/im_so_angry/,26,https://redd.it/27sqmw,WeedMonstah,I'm so angry,"The usual. My fault. A trusted dealer isn't trusted anymore, she ripped me off. Not a huge sum of money but its the principle and being fucked over that makes me rage. So much i actually shake a little bit. 

Fuck that fucking junkie whore. The next time she crawls for me to help, it'll be a great pleasure to laugh her out of my apartment. She might also notice her friendcircle going smaller. 

No one fucking double-crosses me without a punishment. I'll use the next months smear campaigning her to hell. Ruthlessly because that fucking whore deserver every single bit of that. Fuck that bitch. 

If she wasn't a woman, i would have already beat the living, cheating shit out of her. ",1402418536.0
27sndy,https://www.reddit.com/r/opiates/comments/27sndy/ive_been_saying_no_lately/,16,https://redd.it/27sndy,cornflake_jones,"I've been saying ""no"" lately","And it has been working.
That is all 
Thank you",1402416586.0
27z0kc,https://www.reddit.com/r/opiates/comments/27z0kc/30mg_oxycodone_eth_446_safe_to_insufflate/,3,https://redd.it/27z0kc,mrfit10k,30mg Oxycodone (ETH 446) safe to insufflate?,"[I'm referring to these.](http://www.drugs.com/imprints/eth-446-8237.html)
",1402588291.0
27yzqg,https://www.reddit.com/r/opiates/comments/27yzqg/follow_up_ran_out_of_oxy_and_dope_while_on/,7,https://redd.it/27yzqg,I_Love_Heroin,"Follow up: Ran out of oxy and dope while on vacation, just did some subutex, not sure what to do next.","This is a bit of a follow-up to my last post. I'm on vacation with my girlfriend and did finished of the oxy and dope I brought about half way through the trip. I waited as long as I could by knocking myself out with Xanax, weed, and beer last night. That makes it about 24 hours since I last did any real opiates when I ripped open and scraped out all of my old dope bags and smoked the last of my oxy (I know most people in this sub think smoking pills is stupid/wasteful, but I fucking love it way more that sniffing or shooting).

This morning I woke up way before I normally would because I was really starting to feel sick. I've definitely been sicker before. Probably could have lasted a few more hours, but I thought maybe I'd be able to go back to sleep, so I sniffed around 2 mg of my subutex and immediately felt significantly better. Not high, but hardly sick anymore, maybe still some chills and nausea.

So, from here I have a few different options. By far the most appealing choice right now to my junkie brain is to crush up some more subutex, sniff it, and try to get high. Probably not a great plan if I want to do my oxy tomorrow, however, if I could stay on the subutex for a while, I could try to stockpile my oxy (I am given 3 30s in the morning and 3 more before bed when I'm at home) and either sell it and buy some dope, or just smoke a bunch and get high as fuck. The only issue with this option is that I don't know if I have the willpower to not do the oxy if I have it, even if I know the bupe will block some/most of it.

Option 2 would be to just try to survive the next 24 hours on the ~2mg I just did and take my oxy tomorrow morning. I know all of the bupe won't be out of my system, but I'm sure 90mg of oxy will still fuck me up. I could even sniff or plug it for higher BA. The main problem with this option is that I have to make a ~5 hour drive back home tonight then try to sleep somehow, and I don't know if I will be able to resist doing more subutex which would then ruin any oxy I did tomorrow morning.

Option 3 is by far the worst, but from past experience, I'm guessing it's what going to happen because I'm a stupid fucking junkie with no willpower. That would be to do enough subutex today and tonight to get high, then try to wait as long as possible tomorrow to do my oxy and hope that I can break through. That would probably give me between 12 and 18 hours since I sniffed any subutex, but to stay high today and tonight, I'd probably need to sniff between 8mg and 12mg throughout the day.

So that's where I'm at now. Sorry for the long post. Thanks for reading if anyone made it to the end. Any advice or thoughts would be greatly appreciated",1402587787.0
27yzok,https://www.reddit.com/r/opiates/comments/27yzok/poppy_seed_tea_question/,1,https://redd.it/27yzok,i_poke_smot420,Poppy seed tea question,"So ive been thinking about trying poppy seed tea with my friend and had some questions. I have a very very small opiate tolerance and my buddy has a small one. I was wondering what poppy seed to buy, how many pounds and a good recipe for making it. Also the amounts for our tolerances. The only thing im worried about is I've read stories and heard of people over dosing and dying on it. Thanks",1402587754.0
27yz1k,https://www.reddit.com/r/opiates/comments/27yz1k/pricedosage_question_for_suboxone/,20,https://redd.it/27yz1k,hey-thisisathrowaway,Price/dosage question for suboxone,"Ive just come across some and want to try it. I have no tolerance to opiates anymore, and no idea on an appropriate price. Suggestions on pricing/dosage? ",1402587359.0
27yl8p,https://www.reddit.com/r/opiates/comments/27yl8p/opiated_olympics/,61,https://redd.it/27yl8p,ComfblyNumb,Opiated Olympics,"So I am at work, trying to get through my day... typing emails and doing what I do.  Then a thought crosses my mind:  I probably type several hundred, if not thousand words a day... with my left eye closed!  So then I wonder if I could be one of the fastest one-eyed typers out there, and immediately my brain goes into the thoughts of a competition of similar tasks for Opiated people to compete in.  Any other 'sports' you can think of besides One Eyed Typing?  ",1402577865.0
27ykk8,https://www.reddit.com/r/opiates/comments/27ykk8/cold_shots_for_west_coast_tar_and_cotton_fever/,30,https://redd.it/27ykk8,Meliae,Cold shots for west coast tar.. and cotton fever.,"Evening dearies,

I am very fortunate to live in an area where we have needle exchanges. For those less blessed, I have a lovely older gentleman and his adorable much older dog so by my house when I need, and like Santa, he brings jolly gifts with him: a hundred box of the absolute best needles, easy touches, for $1. I can get up to $5 (500) as long as I am exchanging a relatively equal amount of dirties, medical grade blue tournequets, cotton (these cute little pre rolled balls), alcohol swabs by the hundreds, and these tiny little cookers, all packed in a clean new sanitary sharps container. He is Santa. He is a saint. Seriously, he is a lovely person and you should shower him with tips and hugs for what he does for people like us. 

Now this is all good and awesome but for the past month, no matter what I do, I more often than not get struck with a wild case of cotton fever. Agglomerans is a bitch yo. 
I always use a new cotton, New rig, and only up until a day or two ago, I always cooked my gear till boil to ward away the nasties. 

Different dope, still get aggro'd by agglo, clean everything with alcohol, still get fucked. Wtfihatemylife. Ok so.. the only thing that remains a constant are the cottons. Brand new in the baggies he brought them to me in. 

Theory: tainted source of cotton for filters is infested with p agglomerans. I have started microwaving them extensively before use. Has anyone else heard of this? Is that possible? I would assume they would sanitise them but it would seem not. I also find using the brand name q tips solves the problem. Should I let Santa know his pile of presents is plagued with pestilence? 

Sort of separate topic: I have recently discovered that (duh) heating my shot results in a shittier shot, yes, I brain well, I know. Given tar's typically unsanitary travels and origin, it would seem unwise to do this, and I am especially gunshy for all the puking and shivering in bed I have done lately see above, 

Does anyone else risk it with room temp raw shots? Am I gonna die, y'all? 

Xoxo",1402577236.0
27ygdv,https://www.reddit.com/r/opiates/comments/27ygdv/are_there_any_over_the_counter_drugs_with_effects/,30,https://redd.it/27ygdv,lecherous_hump,Are there any over the counter drugs with effects similar to an opiate? (In the U.S.),Edit: this can include actual opiates that are legal to buy. I didn't realize any were until someone pointed out poppy seeds.,1402573174.0
27ydh8,https://www.reddit.com/r/opiates/comments/27ydh8/narco_cwe/,19,https://redd.it/27ydh8,Ibinnoddin,Narco cwe,I just crushed my narco and mixed in water now do I put in freezer? Saw a post about dangers of apap so I decided to play it safe. I want to have a healthy liver and happy nod. The narco is 5/500 please help ,1402569861.0
27y1u5,https://www.reddit.com/r/opiates/comments/27y1u5/why_does_a_120mg_codeine_knock_me_on_my_ass_but_i/,3,https://redd.it/27y1u5,Drug_Throw,"Why does a 120mg Codeine knock me on my ass, but I need about 40mg Hydro to even feel anything?","If 40mg of Hydro makes me feel a decent but not strong buzz, shouldn't it take a couple hundred milligrams of codeine?",1402554291.0
27xt5x,https://www.reddit.com/r/opiates/comments/27xt5x/fentanyl_neos/,10,https://redd.it/27xt5x,WakefulJet,Fentanyl neos!,"For those who are familliar about fentanyl patches, have probably seen there friends die or go through terrible withdrawls. I have heard the big drug companies are trying to make non abusive version witch u can not sniff, smoke or even digestest quickly. Can anyone comfirm this for me? Years of suffering are about to end if it is true. First post ever btw. The neos are going to be pills not patches.
",1402546660.0
27xs87,http://i.imgur.com/7qyOe9O.jpg,3,https://redd.it/27xs87,Skitkorv,Deadheading poppies?,,1402545959.0
27xo7l,https://www.reddit.com/r/opiates/comments/27xo7l/need_help_with_withdrawal_specifically_rls/,30,https://redd.it/27xo7l,bethleh,"Need help with withdrawal, specifically RLS","So im laying in bed, kicking like an infant and cannot for the life of me seem to find a comfortable position to fall asleep. Does anyone have any suggestions to help with the RLS? It seems as though im going to have one of those long sweaty no sleep nights, and not because of sex (I wish..sex drive is 0 now) Any help is greatly alprappreciated. Thank you in advance.",1402543027.0
