a12dsa,https://www.reddit.com/r/opiates/comments/a12dsa/how_should_i_use_purple_dope/,10,https://redd.it/a12dsa,MySinfulThrowaway,How should I use purple dope?,"Right, so I'm an occasional opiate user, sniff h a few times a month. I got a new plug, but he only has this purple dope. How am I supposed to use it? I don't shoot, so that's out of the question. I know there is fent in it, so how should I use it without dying?",1543376066.0
a12db9,https://i.redd.it/5ply46lnrz021.jpg,22,https://redd.it/a12db9,longpig154,What are your Opinions on tramadol?,,1543375976.0
a125i7,https://www.reddit.com/r/opiates/comments/a125i7/mix_mdma_with_suboxone/,4,https://redd.it/a125i7,Cestpasproblem,Mix mdma with suboxone?,"Hey guys, quick question. I'm planning on  rollthing this week, just going to take one capsule of molly and maybe drop half a tab of acid. However, I take suboxone, is there any interactions with mixing the two? did a little research but couldnt find much, from with I gather it's safe but just wanted to hear yalls input :)",1543374354.0
a1231o,https://www.reddit.com/r/opiates/comments/a1231o/first_time_using_opiates_how_much_is_to_much/,17,https://redd.it/a1231o,ana_and_boredom,First Time Using Opiates- How much is to much?,"So short summary, I just want to sleep again, I have gone weeks and months without a full night sleep. I have a pretty good idea of why, but that is for another thread. In reality I have only one choice and chance for medication, and that is oxy 30s, and I have been considering buying a few; that being said I have a good amount of experience with weed and some psychedelics, but not much at all with opiates, and I want to know if oxy 30s are to much to start with, and if not how should I go about using it- thanks for the feedback and answers. :)
 ",1543373865.0
a11zvw,https://www.reddit.com/r/opiates/comments/a11zvw/update_from_my_last_post_almost_three_months_ago/,10,https://redd.it/a11zvw,CleanDate083118,Update from my last post almost three months ago,"I last [posted] (https://www.reddit.com/r/opiates/comments/9bimnw/just_did_my_very_last_shot_im_in_it_for_the_long/) almost three months ago about quitting and moving out of my parents house in the dope infested area and in with my brother two states away.

 Well so far I am doing the best I ever have in my life. My debts are being paid, no using, no cravings, I put on 20 pounds, I found a well paying job that helped me buy myself a car with cash and two weeks after that I am now about to sign a lease to rent a new place. This is going to be the greatest change of my life, it's the first time I'll be 100% on my own. 


Probably nobody remembers my last post but I was in terrible full blown crack and IV heroin daily use at the time and now I'm on the path to greater success doing better than ever. Please, everyone, never give up. I'm a massive fuck up, convicted felon with trash credit and was in massive debt at the time and I was still able to pull myself out of the hole. If I could do it, you can too. I believe in all of you. ",1543373223.0
a11znk,https://i.redd.it/242c8hybjz021.jpg,15,https://redd.it/a11znk,Ctrlmachete666,After a year clean. I'm strung out again. Vamonos! (Not my lame scale),,1543373180.0
a11rh0,https://i.redd.it/0lz5k6ldez021.jpg,127,https://redd.it/a11rh0,TrollerCoaster870,My bad man,,1543371509.0
a11mrc,https://www.reddit.com/r/opiates/comments/a11mrc/doggy_hydrocodone_syrup/,12,https://redd.it/a11mrc,Insanefrompain,doggy hydrocodone syrup,"today was helping a friend with his older dog, its having trouble breathing. so we get to the vet the guy says chronic bronchitis. then gave the dog some scripts, antibiotics and liquid hydro 5mg/ml formula. filled the script right there onsite. if i didnt see it with my own eyes i never would have believed it. please note this medicine will NOT be diverted for human consumption, the dog needs it and the dog will get all of it. with an syringe for liquids we shot that stuff into the little guys mouth. he tried to gag it back up but it got down and now im sure that little guy is feeling a hell of a lot better! ",1543370529.0
a11lhe,https://www.reddit.com/r/opiates/comments/a11lhe/is_otc_codeine_absolutely_gone_in_the_us/,7,https://redd.it/a11lhe,KurdtCobain,Is OTC Codeine absolutely gone in the U.S?,"Shit, I'm back visiting in the states and I could have sworn you used to be able to get Tylenol or somethin' that had Codeine in it OTC. Now I don't see it in anything.


Is there anywhere that you can still get Codeine legally in the U.S?? ",1543370287.0
a11kmt,https://www.reddit.com/r/opiates/comments/a11kmt/what_kind_of_dumb_shit_has_the_plug_tried_to_pull/,17,https://redd.it/a11kmt,o-p-yum,What kind of dumb shit has the plug tried to pull on you?,"I get it.. Folks will say ""my dealer is the best and he delivers promptly and it's a free market you shouldn't deal with that bs or those prices "". 

This post isn't for you. 

Has anyone had a dealer think they're getting one over on you or trying to subtly bullshit you? Like man I've been in the game since 2003 I'm quite the bullshitter but do tell me more.

For instance my main pill plug, I met through my sister. Very early on however he started getting weird about her knowing about our business and made sure it stayed between us. He always said he was getting them from wherever, I didn't care. But I caught on really quick that they are his script and the entire thing is a fucking lie. It was annoying at first but now I'm downright insulted cause this has gone on for over 2 years. And today he had me waiting all fucking day for this imaginary guys refill and finally at 7pm 11 hours later says it won't be till Thursday but he happens to have 3 on him. Like dude I know they are your fucking pills stop trying to act like they aren't. 

Anyway then my regular weed guy got into some beef with his girl so he sent his room mate ""from now on"" well I had changed the order to more weed, and expecting more weed I gave the guy more money. He looks at it... Does a quick maf and leaves knowing it was extra. Now, it was only $10, and I own a scale--should have weighed it right then.. But I didn't. I trusted him as an extension of my guy... They live in the same fucking house. Anyway better believe I weighed it in front of him before handed over the money tonight. 

I don't get into a lot of situations where things go awfully wrong because I don't mess with strangers but I've had the plugs I trust most (like known for 10 years) get comfortable enough to try and fuck with me. Can't trust anyone. 

What are your stories? I'm alone and high as fuck sitting looking at the Christmas tree bored as hell. ",1543370100.0
a11jkt,https://www.reddit.com/r/opiates/comments/a11jkt/nova_jess_apples4jess_if_youre_out_there_and_okay/,10,https://redd.it/a11jkt,SpeakingHonestly,"NOVA Jess (apples4jess), if you're out there and OKAY, please let me know.","Hey everyone. I humbly request that you refrain from downvoting this [shit]post—and it's the last thing I want to do, trust me I know you're not here for my sake and that this is a self-serving post, for which your downvote would be entirely justified. Knowing that, and that the odds of her actually seeing this are very slim, I really have no other options or means of getting a hold of her. If I remembered the name of that damn kindercare place she works at I could call it but I can't for the life of me. I only went there once and I'm a total fucking knuckledragging GPS-warrior. It's outside the 15-mile radius that is my mental-map of this area. (I can't commit directions to memory for shit.. like if there is a fuckin direction-specific mental retardation, or some kind of cartographic amnesia, I have it)

We partnered up on many a journey, using the buddy system. Anyway we looked out for each other for a long time but had a falling out where she blocked my number (her literal go-to move if you looked at her wrong), only unlike every previous argument, I don't think she ever unblocked it. Her one reddit username that I knew was long since disused and I just want to make sure she's alright. 

I don't expect—and won't ask—you all to up this post, but if any of you are in contact w/ her please ask her to reach out to me. ",1543369888.0
a11j07,https://i.redd.it/nosygyl79z021.jpg,15,https://redd.it/a11j07,MikazukiAugus92,"What yall think. Paid a good amount for the g, damn I wish I got stamps, still fire though.",,1543369774.0
a11hdp,https://www.reddit.com/r/opiates/comments/a11hdp/is_there_a_different_euphoric_feeling_between/,5,https://redd.it/a11hdp,Shermanator25,Is there a different euphoric feeling between hydrocodone and oxy,,1543369432.0
a119g9,https://i.imgur.com/jllTG8r.png,19,https://redd.it/a119g9,PM_ME_OPIATES,What the fuck is wrong with me...,,1543367890.0
a116qq,https://i.redd.it/7ddsdemy1z021.jpg,21,https://redd.it/a116qq,traceyh415,Don’t let this speedball be the end,,1543367362.0
a110ji,https://i.redd.it/nqz966xdyy021.jpg,7,https://redd.it/a110ji,caughtyoulookinn,"Nice pickup, also got my script of klonopin (not pictured) which i proceeded to eat a bunch and then wound up with 2 and a half buns of some dark, bomb ECP 💣💣💣💣💣. JJ was on my side today happy nods everyone!",,1543366132.0
a10so4,https://www.reddit.com/r/opiates/comments/a10so4/im_slowly_destroying_myself_id_rather_be_dead_at/,25,https://redd.it/a10so4,freedagoat2169,I’m slowly destroying myself. I’d rather be dead at this point honestly,"The only thing that has kept me from moving on to heroin and IV’ing is imagining the look in my mother’s eye’s if she ever found out... 


But I am only kidding myself right now. I’m an addict just as much as the person shooting up. 

My habit is oxycodone 60+ mg a day. It’s killing my wallet. Most of all it’s killing me. 

I buy 10 at a time, and that’s finished in about 4-5 days. I keep telling myself every time I buy that this is the last time. 

But every time I run out, a text comes from my guy telling me he has more. 

And all I have to do is imagine the relief throughout my body and mind when I pop or snort that blue little pill. It just makes everything right. 

All my anxiety’s go away. My bones stop aching. I stop thinking about my problems, my dad having lung cancer, me being 25 and not doing  a thing but getting high- I seem to be at ease with it all. 

This shit makes me feel to good and it’s fucking killing me. 

I don’t want to do anything else but get high. ANY day sober is spent in bed, just waiting to make it to my next dose.

Wtf am I even living for? I let my parents down and ultimately myself down.
I can’t see myself without this shit. Everything is just a drag and a chore without it. Oh well. 

On the way to pick up 10 more. ",1543364555.0
a10il5,https://www.reddit.com/r/opiates/comments/a10il5/how_to_get_my_pain_doc_to_give_me_something/,25,https://redd.it/a10il5,Lokiisagod,How to get my pain doc to give me something stronger.,"I have 2 bulging disks in my back. No other issues that I am aware of but I am in immense pain. I am currently prescribed 90 Norco 10mg a month, 3x daily. I run out in 2 weeks, half because they barely work, half because (of course) I enjoy the buzz. What can I do or say to my doc to get him to prescribe me something stronger? Money is an issue also. The Norco cost me around $30. I’d like to stay in that range. I’ve looked up prices for Percocet 5 or 7.5 and 20mg Morphine and they are within my price range. How do I get him to prescribe me one of those?",1543362560.0
a10hlf,https://i.redd.it/ecrs2i35ny021.jpg,11,https://redd.it/a10hlf,iluvdrugz,NoseBall,,1543362356.0
a107sn,https://i.redd.it/pm773dhhhy021.jpg,44,https://redd.it/a107sn,DunkLordDaddy,Is $100 for a bottle of 180mL of this stuff a good deal?,,1543360449.0
a0zz20,https://www.reddit.com/r/opiates/comments/a0zz20/how_do_you_feel_about_safe_injection_spaces/,9,https://redd.it/a0zz20,Imaginary_Source,How do you feel about Safe Injection Spaces ?,"How do you feel about having a ""government regulated"" spot where you could safely use opiates? ",1543358838.0
a0zwjc,https://www.reddit.com/r/opiates/comments/a0zwjc/what_is_the_od_protocol_not_a_emergency/,8,https://redd.it/a0zwjc,zmanzax,What is the od protocol NOT a emergency,"What are you exposed to do if some one od's?  I know you call the emergency hotline but what position should you put them in, do you do a sternum rub and when do you administer the narcan just go thorough the time line please. ",1543358385.0
a0zsqx,https://i.redd.it/84b9oic99y021.jpg,10,https://redd.it/a0zsqx,HydroHideOut,I'm a happy camper... for now ;),,1543357696.0
a0zsnh,https://www.reddit.com/r/opiates/comments/a0zsnh/likelihood_of_being_switched_from_ops_roxys_to/,11,https://redd.it/a0zsnh,Quartz-Crystal08,Likelihood of being switched from OP’s & Roxys to Fent. Patches...,"I’m legally prescribed 60 - 20mg oxycontin and 90 - 5mg roxys every month. My new insurance doesn’t cover oxycontin, only Xtampa, which is much more expensive and harder to find at the pharmacies. With my new insurance plan, Fentanyl patches are cheaper and are actually listed as a recommended alternative by the insurance company on their formulary. What’s the likelihood of my doctor switching me to Duragesic (or generic) if I ask? I’m just tired of planning my days around my end schedule and having to lug them with me wherever I go. My doctor has never questioned my usage, nor has threatened to cut me off (yet anyway). ",1543357682.0
a0zs7o,https://www.reddit.com/r/opiates/comments/a0zs7o/to_dose_or_not_to_dose/,12,https://redd.it/a0zs7o,starlitobaby615,To dose or not to dose?,"I am inducting subs tomorrow. I want to get clean for a bit, plan on loading up on them and then tapering over a 7-8 day period. I have access to about a dozen subs, should be good. Heres my question..

If I have 2 points left of some dope- should i finish it, or save it in case of Precipitated withdrawal?  Last time i tried to induct subs, i got on them, didn't PWD, but felt so bad i ended up doing the dope i saved in case of PWD. Then the times Ive finished all my shit, I've taken the sub too early. Both times i took it too early scared the living shit out of me and I literally almost went crazy, was the worst withdrawal I've ever experienced. so I have a weird mental thing  against subs. 

I know the obvious answer is probably to finish the shit and then induct subs... Im planning on waiting 15hr minimum or until I feel terrible. I just know even if i take the sub ill probably tell myself ""or just do the burmese method"", then ill just keep using. But at the same time- if i get PWD ill go fucking nuts and wished i stayed on.  

&#x200B;

I know i sound so dumb and naive and unexperienced. I almost asking a common sense question. The reason I can't judge withdrawals easily is because the first 24hr without anything the only symptoms I typically get is having no energy, like cant even get out of bed cause of no energy. So ill keep waiting and waiting to dose subs when my body is already ready and yea it just never works... any tips on induction would be awesome. I apologize if this is a stupid post.

&#x200B;

Best",1543357598.0
a0zp45,https://www.reddit.com/r/opiates/comments/a0zp45/psa_disclaimer_regarding_recent_influx_of_posts/,4,https://redd.it/a0zp45,chasingd0pamine,"PSA: DISCLAIMER regarding recent influx of posts mentioning/calling out scammers on here, warning our members, & sourcing reminder!","Hey guys. I wanted to bring attention to a very important issue that has been presented in recent times here, and with that said going forward to make sure that our members are made aware - with explanation- of what the deal is with such issues ***especially as they are potential risk to our entire subreddit & its continued existence!***

---

**the main reason for this announcement is an influx recently of posts and comments being made on here that call out people on here trying to scam our members - either by sharing a screenshot, or linking the offender's reddit name and user profile**

I understand the concern and desire to protect our community and intend to just warn our members of scammers out trying to get people, and I respect the concern for our members here & their safety. *However* - 

#WE CANNOT ALLOW AT ALL, IN ANY CAPACITY, FOR PUBLIC MENTION AND/OR DISCUSSION OF THIS GOING ON HERE!!! 

**Please DO NOT make any posts linking screenshot of scammers trying to bait you, make any posts linking their username or any of their info, or make any other public mention on here / discussion of any of this.**

If you want to actually, seriously help our community's well being with any report of this kind of PM scam attempts you know of - please redirect your concerns and your intended message to modmail instead and handle it with our mod team. That is the only thing we can do. 

**THE REASON FOR THIS RULE & POLICY?**

-There should be no reason to even need to warn any of our members about being scammed possibly!! Because the *only* way you or anyone will ever get scammed on here is if you decide to break our number one rule about no sourcing, in which case thats on you and the sub needs to be left out of your gullible mistake & your careless choice to risk this place by participating in sourcing of any kind!!!

- in other words: the way that our members can be warned hoe to not get scammed, is to not.fucking.source.!

- (even furthermore-) If we allow people to disclose any acknowledgement of them actually falling for a scam, then we are allowing it being a risk to our entire possibly subreddit being banned- by acknowledging that sourcing is happening & allowing it. 

- if you post about being scammed by someone personally here and call them out: both YOU AND the scammer are going to have to be banned for sourcing. You cannot admit to breaking our rules here in any context! This is an official warning. 


**TLDR: we appreciate the warnings and concern for our members about not being fucked over and scammed by these predators, but we cannot allow you to call out sourcing of any type happening whether in public or in PM here. Our members should never even be at risk of scam because if they just follow the rules they will not be sourcing in the first place!!**",1543357029.0
a0zneb,https://www.reddit.com/r/opiates/comments/a0zneb/been_getting_good_stuff_lately/,5,https://redd.it/a0zneb,NotPoliticalyCorrect,Been getting good stuff lately,"So I've been going to the same person for the last 3/4 weeks and they've been quite consistent and had everyday and their stuff has been quite good. They got a new batch a couple of days ago and it's even better 😀 
   Yesterday I was skint and didn't get paid till today . I phoned up my guy and asked if he could do me a bag till today and he said he couldn't as he didn't do tick. So thought I was fucked but he called a couple of minutes later laughing his head off and said of course he'd do me a bag and to come in. Sat for a little while and ended up leaving with this couple and walked them to the chemist and we got syringes. Once we came out she offered me a bag which was really nice of her & him didn't ask or anything they just offered it . We went to this shopping centre to use their toilets but the guy is drinking a can of beer so security won't let him in and we needed water as the chemist didn't have any water amps. I go in do my hit and fill a couple up with water for them but when I come out they've disappeared . So I just go to the bus stop and head home. Went into day and payed the debt and got a couple and headed home . 
      There's a letter there for me and it's for Jury duty !! Pmsl WTF I've got a criminal record like a phone book and have been in prison multiple times so no idea why they want me to do that shit ! Hope it's a drugs case or someone I know because I'm not guilty all the way lol Though once I go to court I'll be recognised so don't think I'll get chosen ! Lol 
    Hope everyone is good and not WD love from Scotland ",1543356722.0
a0zn18,https://imgur.com/j1Ne210,6,https://redd.it/a0zn18,Heyhey_mythrowaway,"Well this was a nice surprise, its been a long time since we last met, and the price is right!",,1543356656.0
a0zloh,https://i.redd.it/afgj5t6i5y021.jpg,5,https://redd.it/a0zloh,Isdemon,🤩,,1543356421.0
a0zfuy,https://i.redd.it/myobzo1d2y021.jpg,11,https://redd.it/a0zfuy,the4lorist20,"The D.F.C.(Dirty Fingernail Crew) why is that everyone(90%) in r/opiates has dirty fingernails? Ive been ther myself. We are already injecting or ingesting a disgustingly beautiful drug! First 3 things you loss once you start to use! Self-Respect, dignity and clearly showering! Not my pic!!",,1543355362.0
a0z04c,https://www.reddit.com/r/opiates/comments/a0z04c/wd_from_morphine_sulphate/,1,https://redd.it/a0z04c,burningtrashtime,WD from morphine sulphate,"hey all, 

I’ve been dealing with chronic pain due to a jaw disorder that my medical insurance insists is a dental problem and my dental insurance insists is a medical problem (so no coverage, yay!). pain is unbearable but all my doctors think “take ibuprofen” is sufficient advice. long story short, I ended up with a connection and took about 20mg of hydrocodone per day to manage pain for the past few years, then have been on 30mg of morphine sulphate ER for the past six months or so. 

my contact is about to run dry, so I’m trying to get a sense of what I’m in for in terms of withdrawal. only ever took what I needed to manage pain, and have begun taking CBD oil to try to help with my jaw and hopefully curb some of the anxiety. how long incapacitated am I gonna be during this process? is kratom worth trying out to help ease me off this? ",1543352551.0
a0zcra,https://www.reddit.com/r/opiates/comments/a0zcra/snorting_methadone/,8,https://redd.it/a0zcra,missilesarefun,Snorting Methadone,Anyone here have any experience snorting methadone? Im just very curious as to what its effects would be. ,1543354780.0
a0zbxw,https://www.reddit.com/r/opiates/comments/a0zbxw/im_fucking_doing_it_and_couldnt_be_any_happier/,107,https://redd.it/a0zbxw,dirtymikenthe112,I’m Fucking doing it and couldn’t be any happier,"Yesterday, I finally fucking did it. I reached out for help. Called my mom, spilled the beans thinking I was about to be disowned. I was shown nothing but LOVE.

After talking further today, we came up with a plan when I come home from college for winter break. 

I grew the fucking pair to say I needed help, and I will be admitting myself to rehab within 2 weeks for a 30 day program. Talked to one of the lady’s I will work with at this recovery center over the phone today, gave me nothing but hope in that I will find myself again. I’m very excited I took this big step to admit my addiction, and I can’t wait to be fucking clean from this shit.

To anyone struggling, you’re not alone. If you can, grow the pair and get help for YOURSELF, no one else. That’s what I realized yesterday, and idk I’m just venting. Hope y’all stay safe using, I’ll miss the feeling ofcourse but I will never ever miss this life. Peace out homies",1543354633.0
a0z47u,https://i.redd.it/i5u50d43wx021.jpg,4,https://redd.it/a0z47u,longpig154,"Oxycodone,hydrocodone and Clonazepam",,1543353251.0
a0z3zj,https://www.reddit.com/r/opiates/comments/a0z3zj/finally_found_a_good_potentitators_mix/,0,https://redd.it/a0z3zj,DopeGuy1234,Finally found a good potentitators mix,"Hi guys and gals, I made a post yesterday about mixing my dope with loratadin. Its a h2 anti histaminia. It woked good for me. I sniffed .1 or maybe .2 and catched a great nod. Today I tested and experimented with other potentiators. And at today I found a great combo for me. I sniffed a point of great dope and added: 60mg of DXM, 40mg of loratidin, 75mg doxylamin, that was 2 hours ago and I still nod out from a point. Normally I need .5-.7 of dope to get such an intense and long nod. I for sure know that this combo is not very healthy etc. but I just got about 2g of dope left and need to make the best out of it. Maybe I can help someone with ghat info. I will now post the recommended amounts which I found on a website about that thematic:
DXM 15-60mg and 30mg is the sweetspot
loratidin 20-60mg and 40mg is the sweetspot
Doxylamin 25-75mg and 25mg is the sweetspot

Maybe this will help someone. I just can aay that I am still in nod city which I am more than happy for. After I got more dope I will test each on his own and give a review about it. Stay safe my fellow opi foends. ",1543353209.0
a0yziu,https://i.redd.it/hl5iiznotx021.jpg,10,https://redd.it/a0yziu,JM900339,Re-up Day: My fav combo. Going to be a very productive day!,,1543352452.0
a0yz1f,https://i.redd.it/ej4nxbvgtx021.jpg,20,https://redd.it/a0yz1f,16yrsopiuser,So... my buddy left all his stuff in my rides car and she found it .... hoping my girl doesn’t find it before I give it back lmao.,,1543352372.0
