8c27z3,https://www.reddit.com/r/opiates/comments/8c27z3/most_heroin_youve_ever_seenhad/,15,https://redd.it/8c27z3,drugsnhugs01,Most heroin you've ever seen/had?,I'm curious if there are any el chapos here because I usually see no more than a few grams. ,1523650298.0
8c27kw,https://www.reddit.com/r/opiates/comments/8c27kw/should_i_bother_trying_to_get_something_out_of_my/,20,https://redd.it/8c27kw,Euphoriac-,Should I bother trying to get something out of my subs? Or am I setting myself up to be sick as fuck?,I've never really felt them before. Just noticed they curbed the cravings and obv kept me well. I just induced again after 3 days coming off a couple months on oxy that ended with dosing 560mg a day. I've taken 4mg and they've stopped most of my WDs. Just wondering if I eat another 28mg to get the ceiling dose will I have a bad time?,1523650211.0
8c27fg,https://i.redd.it/8vw762fpgqr01.jpg,3,https://redd.it/8c27fg,xanieman311,"I could care less about all these addys,gabs and subs I just want some xanax😣",,1523650178.0
8c21q9,https://www.reddit.com/r/opiates/comments/8c21q9/3_weeks_on_3_weeks_off/,9,https://redd.it/8c21q9,felcher2000,3 weeks on 3 weeks off,"I work in offshore oil and gas and my roster is 3 weeks at work and then 3 weeks at home. I never take drugs to work but at home I use every day as much as I can. 
I use 2 -3 subs to avoid withdrawal when I get back to work. I have been doing this for 8 years.
It is a cycle of use and I fucking love it. The first few shots when I get home is like I'm a virgin again. 
You would think after breaking through the physical wds after 3 weeks that I would be mad to get back on it .... But no mentally I can not wait I just fucking love it I'm a pig too 
Well that's my story stay safe people and happy H ",1523648943.0
8c1y56,https://www.reddit.com/r/opiates/comments/8c1y56/damn_you_oxycontin/,17,https://redd.it/8c1y56,diamond_eyes_81,Damn you oxycontin!,"So I got some op 10s today, more or less to help a friend out who had them because they needed to sell them for some Bill money. I've never messed with them, know just basics about them due to my nursing background, and I deal with chronic pain everyday of my life, and oxy helps tremendously, obviously....but of course I like to dabble recreationally as well. 

Anyway, wtf is with those things! I read up to see about any recreational value, and it appeared semi simple to get around the time release aspect. Its friday, im off for the weekend so i tried to bypass the er to catch a little buzz. Nope. It's insane! Anyone have any experience they'd like to share? Any helpful hints? ",1523648180.0
8c1b9g,https://www.reddit.com/r/opiates/comments/8c1b9g/give_me_nods_or_give_me_death/,2,https://redd.it/8c1b9g,3ntropyftw,Give me nods or give me death!,,1523643157.0
8c1tvs,https://www.reddit.com/r/opiates/comments/8c1tvs/did_a_28_day_rehab_program_didnt_work_now_gonna/,8,https://redd.it/8c1tvs,SixCylinder777,"Did a 28 day rehab program, didn't work, now gonna do 3 months..","What's up r/opiates, I've been going pretty ham with my usage lately, as I came out of a 28 day program too, ""the reasons? There are no reasons, who needs reasons when you've got heroin?""... 

Anyway, so now, since a very loving family member has offered to fund it, I'm gonna do a 3 month stretch, gonna do a fast suboxone taper cos I'm tired of being addicted to methadone... its gonna be tough, but hey, I need it... I've been smoking 2 grams of crack, shooting 4 grams of skag, and taking 100mg+ plus of 'done and 40-80mg diazepam since I came out... this isn't what I want... 

Send me love ya'll, and I send love to you addicts trying to get sober.. after 11yrs of heroin/polysubstance addiction I really need this... but what I'm aiming at is those of you with like 2yr and below habits who feel hopeless... it's tough, BUT NOT IMPOSSIBLE, don't wait til you get to where I am, and if you don't die, that's exactly where you'll be... 

I'm gonna miss Reddit and this sub, gonna miss my dogs, my fam and my city, but they aren't going anywhere... I need to get right, I've caused too much pain.. 

Love to all of you, I'm shipping out 🙌🏾👊🏽",1523647237.0
8c1p22,https://www.reddit.com/r/opiates/comments/8c1p22/will_methadone_fail_as_heroin_in_a_drug_test/,2,https://redd.it/8c1p22,bleeditout22,Will methadone fail as heroin in a drug test?,"Years ago, I was popped with a random at job. I took a 10mg methadone that day, and I failed for heroin. Yesterday, I had to take a blood test at a hospital while high on heroin and methadone. I go to the methadone clinic, so I'm curious to know if the heroin and methadone will fail as one? ",1523646157.0
8c1e8s,https://www.reddit.com/r/opiates/comments/8c1e8s/was_at_the_hospital_and_they_gave_me_an_option_of/,44,https://redd.it/8c1e8s,Matthew15651,Was at the hospital and they gave me an option of me injecting Morphine inside of me whenever I want at the press of a button... Atop of that took Oxy... God it was amazing,,1523643841.0
8c1lhj,https://i.redd.it/w8izph3e2qr01.jpg,15,https://redd.it/8c1lhj,skyfullofsand,And people say you cant buy happiness,,1523645377.0
8c1hhg,https://www.reddit.com/r/opiates/comments/8c1hhg/safety_of_dosing_question/,2,https://redd.it/8c1hhg,shinigamiboutit,Safety of Dosing question,"I took 15mg hydro at 6:30 am and 50mg vyvanse 
The hydro has worn off can I take a small dose of a benzo and it be safe ",1523644537.0
8c1dum,https://www.reddit.com/r/opiates/comments/8c1dum/humiliated_by_the_pharmacy/,113,https://redd.it/8c1dum,PoisonKiss43,Humiliated by the pharmacy,"I use the same pharmacy every time I fill my rx. I have used the same brand of pharmacy forever. I went to get my pain meds filled today, its been 31 days. The pharmacy told me it was on back order, they didn’t have any, didn’t know when they would, and didn’t really know what to tell me. I asked what my options were.... they told me to try other pharmacies. So I went to the next Walgreens about 8 miles up the road. I explained to them what I was told. The lady came back and questioned why I was on this side of town. My ID is my dads house, I live with my man in his house over here. I work at the hospital nearby (hence my insurance, and how I met him). The lady told me that the pharmacist felt uncomfortable filling this rx (even though he could see in their fucking records that I only sue them!!!!!) But that he would do it this time but I needed to have my id switched to this side of town if I want to fill anything else. I even had to show my fucking work badge to prove it, I can’t imagine pts who are worse off than me who deal with such shit. ",1523643750.0
8c1dfr,https://www.reddit.com/r/opiates/comments/8c1dfr/average_costs_fentanyl_powder/,8,https://redd.it/8c1dfr,jezebel_hell,average costs fentanyl powder,just trying to get a sense of costs for pure powder... anyone know about costs per quantity and by region? (i know we aren't supposed to talk about regions on here but maybe some external sources on this?) thanks!,1523643663.0
8c1bri,https://www.reddit.com/r/opiates/comments/8c1bri/chronic_illness/,4,https://redd.it/8c1bri,gerhoemi,Chronic Illness,"I’m a longtime lurker - this is my first post in this sub. I have an autoimmune disease that causes chronic pain & with the new regulations on opiates it leaves people like me in the fucking dark. 

I’m too scared to even ask my doctor (half the time) for meds when I truly need them, and I don’t know the first thing about obtaining them other ways. It’s frustrating as shit!! So, I suffer on a daily basis bc of some bureaucratic bullshit.   

Sorry for the rant - sometimes you just have to get it out! ",1523643275.0
8c14ka,https://www.reddit.com/r/opiates/comments/8c14ka/fentanyl_pressies/,7,https://redd.it/8c14ka,jezebel_hell,fentanyl pressies,anyone have a good how-to for DIY pressies? thinking about making my own so I can control doses,1523641727.0
8c122d,https://www.reddit.com/r/opiates/comments/8c122d/subbenzo_doc_halp_pls/,5,https://redd.it/8c122d,Piss_on_you_,Sub/benzo doc halp pls,"Ok so first I fucking love u guys. Everytime i start feeling shitty i come here and yall make everything better.  Now ive been clean from dope since sunday (HOLY SHIT) and been on zubsolv since monday. Doc gave me the 11.4s that i took half for the first 2 days and then only a quarter a day for the past two days. Its been fucking incredible. No cravings, no sickness, i have energy and my body doesnt hurt. BUT i am having these intense anxiety/depression episodes that are pretty shitty. Like, im used to it cuz its been a part of my life for almost 18 years but i noticed on one of the forms i signed that they prescribe bupe and benzos among other things and holy shit .5 of xanax a day REALLY helps me. Ive never been prescribed any benzos tho so how do i get them? I have zero interest in abusing them and genuinely would benefit from them, but i need to know the best way of asking. Should i just say ive had them before and theh really helped, or describle my symtoms and say prozac and zoloft dont help(truth)? ",1523641209.0
8c0y08,https://i.redd.it/81kqp56inpr01.jpg,13,https://redd.it/8c0y08,bmille561,Fentasick,,1523640351.0
8c0m6k,https://www.reddit.com/r/opiates/comments/8c0m6k/when_your_mind_is_more_powerful_then_drugs/,7,https://redd.it/8c0m6k,BMjonesin,When your mind is more powerful then drugs,"Man it's insane how strong our minds are.
Our thoughts really do seem to create a reality.

I've been living in such a negative frame of mind lately and it seems to just make everything worse! 
(Well I mean I guess duh lol) 

But seriously though, so much of this is mental: 
Like how we will be withdrawing our balls off, in such a shitty head space and yet once we have the relief in our hands it's like the symptoms seemingly disappear.

Or like how when you know you'll get to score soon. Or even worse when you know you can't score again.

For me it's like I never feel the ""last bag"" if I don't know when the next ""fix"" is.

Or how the week prior to rehab I could not feel high for the life of me because I was too damn stressed about the pending mental and physical doom of detox.

So that being said I'm really trying to use this principle to be more positive and make sobriety a tiny teeny bit easier.

Idk it's hard as fuck. Obviously these drugs fuck with our chemical makeup and how we think and react. 
Yet yesterday I had this moment where I just genuinely wanted nothing to do with dope or getting high. I did the bare minimum amount to stay well and usually this is hard af for me because I am so use to obsessing over my use and feeling normal. 

But again yesterday my head was above water all day. I wasn't necessarily positive but I wasn't dwelling in negative either. It was bearable.
I keep busy and just was so turned off by the idea of getting high. It's like my brain finally has made a connection that getting High and continuing to use= pain and misery.

Bleh. 

Just random thoughts from my mind. 

(Side note- yesterday my power got shut off and I have $70 to my name for 4 days..normally I'd be going APE SHIT. my mind would produce nothing but negative thoughts. Thus making it a million times harder to get through a day.
Yet idk, I was ok. I think for the first time in awhile I had a bit of a hold on my mental state.
That Or my subconscious is just screaming to get clean.) 

Idk. Y'all feel me? ",1523637860.0
8c0gry,https://www.reddit.com/r/opiates/comments/8c0gry/nice_way_to_start_the_day/,5,https://redd.it/8c0gry,06audis4,Nice way to start the day,https://imgur.com/a/4tPFb,1523636699.0
8c0h6p,https://www.reddit.com/r/opiates/comments/8c0h6p/trying_to_get_online_prescription_for/,2,https://redd.it/8c0h6p,jksndcvjhasduhjv,Trying to get online prescription for codeine/dihydrocodeine. Would like some help with the questions.,"Question 1: ""What diagnosis was given for your condition? (by GP)""


Question 2: ""Provide a history of your symptoms, how and when it started, and how it affects your normal daily activities.""


Online pharmacist wants me to answer these two questions. Would like some advice on what to put down. Thanks in advance for the help.",1523636788.0
8c0hc0,https://www.reddit.com/r/opiates/comments/8c0hc0/sub_to_dilly_tolerance/,6,https://redd.it/8c0hc0,gearshake,Sub to dilly tolerance?,"I get well on 4mg sub sublingual or 1-2mg IV. I have only used dilaudid very early on in my experiences, and I didn’t IV at that time. Pretty sad to say I wasted them up my nose, still got ripped though. Anyway I might come into some of these and I’d like to know what your thoughts are on how much I should IV. I have strictly used heroin in stamp bags, doing 4-5 good quality bags per shot at my absolute highest. Now I’m on sub. I know I’d have to wait, I’ve done the sub to dope back to sub game before. What’s a good shot in my situation? 8mg? More? I’m clueless with pills, dope is my go to.",1523636818.0
8c0cub,https://www.reddit.com/r/opiates/comments/8c0cub/a_little_variety4_diff_kinds/,8,https://redd.it/8c0cub,06audis4,A little variety...4 diff kinds,https://imgur.com/a/pn3BW,1523635853.0
8c0ala,https://www.reddit.com/r/opiates/comments/8c0ala/i_need_to_vent/,9,https://redd.it/8c0ala,ldawg413,I need to vent,"So I take sub when I’m not doin pills right? And my tolerance is low so when I get an 8mg sub I fold it so it has creases and I can cut evenly... I usually take about an 8th. Yesterday morning I opened a new one before work. Today’s my birthday and I woke up and went to take some sub and it’s like half gone! So I call my sister cause she was over yesterday and likes to take some sometimes to get housework or whatever done. She tried to deny it and I’m like that’s weird cause this was brand new so she admits it. I’m just so upset that she would take it without asking. I don’t have a script so they’re hard to find and I ALWAYS give her some when she asks so whys she gotta go and ruin my morning like this? Ugh.

Thanks for reading ❤️",1523635374.0
8c05lg,https://www.reddit.com/r/opiates/comments/8c05lg/oramorph_oral_solution_10_mg5_ml_rectally/,1,https://redd.it/8c05lg,Zoromorph10mg,Oramorph Oral Solution 10 mg/5 ml rectally,Will this be more potent if I administer it rectally?,1523634329.0
8c065l,https://i.redd.it/eoewdxpx5pr01.jpg,28,https://redd.it/8c065l,Pandamania07,"Getting these 10 Opana, question is are these the ones you can break down ? I know 10mg but there is literally NO OPANA by me... I either get them today or tomorrow and want to snort them",,1523634440.0
8bzxqs,https://i.redd.it/y1zrc1og0pr01.jpg,15,https://redd.it/8bzxqs,kenkaniff23,Oh happy days... When JJ walked,,1523632605.0
8bzx76,https://www.reddit.com/r/opiates/comments/8bzx76/wish_me_luck_fam_new_opportunity_coming/,12,https://redd.it/8bzx76,needtopass00,Wish me luck fam new opportunity coming,"Been working in a shit hole town in the middle of nowhere fucking up my life for the past two years.   Have an interview for a job closer to my family (all my kid's grandparents will be within an hour, 4 hours away now).  Lil bit of a pay cut but better benefits so if they offer it I'm gonna take it. 

Main thing is I need outta this town.  I gotta plug that has endless supply and he fronts.  He's bad for me.

I've used once in the last 2 weeks.  I used Tuesday and I wish to fuck I wouldn't have I'd be free and clear but I'm not feeling too bad.  Just hit 250 push-ups since work is slow so I think the low T is going away.  Trying to eat all I can before the interview so I can get rid of this gaunt face.  Ive worked for this company before when I was 100% clean so I can't be looking all fuckin opiated or like I crawled out of a cave. 

Wish me luck fam this company randoms so it would be the motivation I need to stay clean.  Gonna have to work around this first piss test but I'm not too worried about that.  I know it's coming so I'll be ready.",1523632494.0
8bzwax,https://www.reddit.com/r/opiates/comments/8bzwax/second_owi_in_3_monthswhat_to_expect/,12,https://redd.it/8bzwax,bleeditout22,Second OWI in 3 months.....what to expect.,"In February, I got too high and got pulled over and had a blood test. Yesterday, I nodded off, somebody called me in, and I got another blood test. I have not been charged with either incident yet. I'm kinda freaking out because I've never been in trouble and I have no idea what to expect. I had nothing on me for either occasion. ",1523632301.0
8bzuwg,https://www.reddit.com/r/opiates/comments/8bzuwg/pre_employment_drug_test/,20,https://redd.it/8bzuwg,red_hi_tec,Pre employment drug test,I have a pre employment drug test today and all I have is 2 week old urine that has had water added to it to produce more volume. Ive passed lab tests before with pretty old urine. Do you guys think ill be ok? Any experience using old or urine with water added to it? I'm kind of bugging out. Also im at IOP now and they want to drug test me here but i dont have enough piss for both tests. I'm gona try and just not take the test and leave but that may be difficult because they center gives me a ride home. I could also ask one of the people at IOP for piss but that would blow my cover and i don't really trust anyone here like that. What the hell should i do!,1523631992.0
8bzqzz,https://i.redd.it/g9rwcjm4wor01.jpg,31,https://redd.it/8bzqzz,awer0515,Pickup for the day,,1523631150.0
8bzpm0,https://www.reddit.com/r/opiates/comments/8bzpm0/vivatrol/,11,https://redd.it/8bzpm0,erudite1994,Vivatrol,Anybody have any positive or negative experiences? Currently on day 2 of the 7 day cold turkey in order to get it. ,1523630861.0
8bz7m0,https://www.reddit.com/r/opiates/comments/8bz7m0/friday_the_13th/,14,https://redd.it/8bz7m0,FantasticMrFox69,Friday the 13th,Wishing everyone on here a noddy Friday 13th!,1523626650.0
8bzin0,https://imgur.com/a/M1EYG,92,https://redd.it/8bzin0,white_guard,UK Pharma grade diacetylmorphine! Friend's dad was GP for many years- BINGO,,1523629257.0
8bzgbr,https://mobile.nytimes.com/2018/04/12/nyregion/overdose-antidote-naloxone-investigation-hard-to-buy.html,4,https://redd.it/8bzgbr,traceyh415,Overdose Antidote Is Supposed to Be Easy to Get. It’s Not.,,1523628745.0
8bzdfs,https://www.reddit.com/r/opiates/comments/8bzdfs/craigslist_question/,9,https://redd.it/8bzdfs,AbanoR,Craigslist question:,"So at first I thought Craigslist personally banned me from their personals section cause of how many times I had posted about trying to find drugs, but now I know they took it down due to FOSTA or whatever. So my question is, can you still use craigslist for copping now and if so, how do you go about it? It’s my only real source of connects right now, ",1523628104.0
8bz1gc,https://www.reddit.com/r/opiates/comments/8bz1gc/mother_fucker_ugh/,48,https://redd.it/8bz1gc,o-p-yum,Mother fucker.. Ugh.,"Welp. I really had good intentions for this refill. I really did. 

I ran out early last month and landed myself right in the heat of withdrawal when my dad visited from 18 hours away. He drove 18 hours to spend 3 days with me, drunk and withdrawing, and I completely ruined our visit. 

I had good intentions to do better with this refill. I have a 7 day pill box. I cut them into halves and set out my weeks worth. 

Then that weeks worth ran out and I kept dipping. I'm right back up to a dosage that's triple my prescribed daily amount. The worst part of this refill is my doc cut a pill a day so I am already working with 30 less than normal. 

I still have half my script left but Idk how long that will last. The kicker is I'm not even enjoying them. Usually I'm active and energetic when I take my oxy but I had the flu 2 weeks ago and my body has just changed. I've slept all day every day this week. I feel stupid and sick on them. Why do I keep redosing? 

I can't let myself sit here and go through wd this weekend cause that would seriously suck for my family, but come Monday, I'll have all day all week to deal with the effects. 

If I can stick to my dosing schedule I'll have at least 40 left on Monday. Even if I go to the excess I'll still have a weeks worth left of my script. I think it will help the wd knowing I'm sitting on pills. I won't feel so desperate. I can start taking then the week before my refill. 

Sorry for rambling. I'm just so pissed at myself. The road to hell is paved with good intentions I guess. ",1523625101.0
8bywdl,https://i.redd.it/4roeheh7aor01.jpg,7,https://redd.it/8bywdl,Flyonz,"Book haul from my new needle exchange, they give these out too!",,1523623775.0
8byn1g,https://www.reddit.com/r/opiates/comments/8byn1g/codiene/,9,https://redd.it/8byn1g,420Omega,Codiene,How many codiene 30s will i have to take to be fucked up. Never done it before. Only done weed and mdma,1523621235.0
8bylla,https://www.reddit.com/r/opiates/comments/8bylla/im_drunk_and_this_sucks_shit_posticus_maximus/,6,https://redd.it/8bylla,Euphoriac-,I'm drunk and this sucks. (shit posticus maximus),I left half a gram of oxy in my mates care. My family is all away at a gathering to celebrate something special in our long term family friend's life. I didn't even get a proper invite. My family knows about my use mostly (including meth like fuck I hooked some of them up). As far as they know I'm all good and just drink atm. I guess I sometimes get drunk and make an ass of myself like I am in this post. It's such a shame cos one of the friends is not long for this world. Nobody told me everyone else is going. I'm drunk cos I ate beers all day and I can easily raid where my stash is but I don't want to lose trust like that but fuck I'm hurting. I even got on tinder to try find someone to spend some time with and I've got nobody right now. Fuck. Do I raid? It's been 3 days it would really help. Do I respect? My (supposedly close) family is away without me. Do I do the right thing? Like who am I even doing it for? Fucking shit post galore.,1523620824.0
8byj1m,https://www.reddit.com/r/opiates/comments/8byj1m/nodding_music_like_earl_sweatshirt_mf_doom/,17,https://redd.it/8byj1m,shinigamiboutit,"Nodding music like earl sweatshirt, mf doom, captain Murphy, Kendrick, Freddie Gibbs, Quasimoto,",Any suggestions like those ? ,1523620060.0
8byka2,https://www.reddit.com/r/opiates/comments/8byka2/if_i_relapse_while_taking_naltrexone_daily_pills/,6,https://redd.it/8byka2,jmachine5,If I relapse while taking naltrexone daily pills will next dose put me in withdrawals?,"I’ve been on naltrexone 50mg a day for about a week. Yesterday I decided to try to use, to no avail. Didn’t feel a thing. My question is, when I dose this morning will it still send me into precipitated withdrawals or no since the opiates never got in the receptors anyways? Thanks for the help!",1523620431.0
8bybzu,https://imgur.com/0hBOsOU,3,https://redd.it/8bybzu,DrBeastBro,It's a sign from God,,1523617814.0
8by80r,https://i.redd.it/eh2525efonr01.jpg,19,https://redd.it/8by80r,S903R039,Oh sweet Jesus I can see how theses addicting. Sweet fucking relief.,,1523616446.0
8bxhry,https://www.reddit.com/r/opiates/comments/8bxhry/airplane/,7,https://redd.it/8bxhry,Userr69,Airplane,How you get done on an airplane,1523606212.0
8bxbrx,https://www.reddit.com/r/opiates/comments/8bxbrx/amazing_boy_and_somefire_ass_girl/,6,https://redd.it/8bxbrx,atmos1026,Amazing boy and some.fire ass girl!!,"http://i.imgur.com/qHRIgUN.jpg
Well that's just the boy for some.reason it won't show the girl, I'm going to see if it will let me post it in the comments.

http://imgur.com/FKVm9tK


https://www.reddit.com/r/opiates/comments/8bxh7j/fire_ass_white_girl/ 

Link for the coke",1523603854.0
8bxv9m,https://www.reddit.com/r/opiates/comments/8bxv9m/oc80s_from_the_dnm/,8,https://redd.it/8bxv9m,skiitour69,Oc80s from the DNM,Has anybody got some ?? I order a few about a year ago and all was good but I just didn't get why they were only 30 bucks. I think they still are. To me that price seems deecent for them not being available anymore. ,1523611632.0
8bxuhs,https://www.reddit.com/r/opiates/comments/8bxuhs/weird_reaction_to_heroin/,11,https://redd.it/8bxuhs,MikeBane,Weird Reaction To Heroin,"So I did about 40mg of this Afghan grey h4. My heart rate went to 58 bpm and my blood pressure rose to 150/90. I snorted very small lines for about 4 hours straight, anywhere between 10-20 minutes in between each line. Now I don't believe it was fent, but something it was cut with that my body is reacting negatively to. I experienced slight neck tension, tingles in my left arm and hand that comes and goes, and I have felt a palpitation here and there which rockets my anxiety up. I am awake, conscious, not exactly labored breathing but not breathing normally either, feel mildly nauseous, and yeah I didn't do too much either - the euphoria is mediocre, the painkilling effects are generally working, but this is unlike my last experience with #4 heroin. Any leads or thoughts? Sorry for spamming the sub tonight.",1523611324.0
8bxpo9,https://www.reddit.com/r/opiates/comments/8bxpo9/tips_on_cold_copping/,16,https://redd.it/8bxpo9,oEXTRaCTs,Tips on Cold Copping,"I'm living in a new college town and dope is not very big in the college / frat scene. The school is in the middle of no where surrounded by corn fields and other farms in the surround area so I'm sure Meth and Dope must be around. I just have no idea how to go about finding some. Its 3:50am here right now and if I get some tips then I'm going to go out looking. Or do I make the 2.5 hour trip early in the morning to go back to the big city that I'm from and know I can get it.
",1523609494.0
8bxp2x,https://i.redd.it/vvzgvyuz2nr01.jpg,16,https://redd.it/8bxp2x,skiitour69,OP porn,,1523609251.0
8bxlpg,https://i.redd.it/yc4b1kitymr01.jpg,29,https://redd.it/8bxlpg,Hyper_Gamma_Spaces,"These are impossible to find in SA, I’m buzzing. What’s the best way to take these?",,1523607838.0
