8n9x0q,https://www.reddit.com/r/opiates/comments/8n9x0q/requesting_advice_regarding_prescriptions_please/,2,https://redd.it/8n9x0q,PM_ME_BEARDS_PLEASE,Requesting advice regarding prescriptions please,"Hello all,

So a couple of years ago, I had a serious car accident and as a result had three operations to 'fix' the damage done to my shattered collar bones. Unfortunately, the surgeon, for lack of a better term, completely botched the operations and I've now been left with two very much abnormal collar bones, along with a lot of pain and nerve\-pain surrounding the area. I take Lyrica for the nerve pain, which is an absolute god\-send, but that isn't what this is about right now.

It's been two years and I've had a steady oxycodone prescription from my very understanding doctor to keep me from hating the inevitable life of pain. However, with my last visit, he said to me that he doesn't consider it wise to keep writing me scripts for the substance, siting obvious addictive properties, etc. I will begrudgingly admit that I am, to a certain extent, physically dependent on opioid pain relief. However, I really am not sure what to do if he isn't going to continue providing me with scripts. Of course, I can overload myself with ibuprofen/voltaren \(doclofernac sodium\) which \*may\* help, but previous experience has shown me that nothing other than oxycodone will touch the pain I feel on a near\-daily basis. 

To preface my question, I have a good and open dialogue with my doctor. He knows that I am responsible, and copiously research any drug before I will ingest it. I live in Australia, where alternatives such as Kratom are illegal. Does anybody have any ideas as to how I can explain to my doctor that I'm not sure that I can get by without opioid pain relief? I don't want to have to resort to buying them from the dark\-net \(I don't even know how to do that that\). Alternatively, does anybody have any ideas as to alternative pain relief I could try?

Please, any input would be advised. Thank you in advance!  \(x/post to r/drugs\)",1527697303.0
8n9vkd,https://www.youtube.com/watch?v=T54LIrCND5I,65,https://redd.it/8n9vkd,0samaBinNoddin,"Here is the video segment of Tracey on the Today Show. Brought a tear to my eyes, knowing the lives are being saved. Thank you from All of us Tracey!",,1527696997.0
8n9vep,https://www.reddit.com/r/opiates/comments/8n9vep/how_would_you_describe_withdraw/,10,https://redd.it/8n9vep,Biastrallover22,How would you describe withdraw?," For me I'd describe withdraw as the worst flu I ever had and having the feeling of getting your heart broken at the same time. It's  just so godamn miserable. 

Stupid idea but say someone wanted to try heroin maybe give them some then give them subs 20 mins after so they know what withdraw feels like then they can understand if they really want to get in the shit

Edit thanks to user hydromorph  for telling me it's  withdrawl. I thought it was before but then I read somewhere it was but anyway thanks for the correction I'll see if I can change the title.",1527696968.0
8n9rdg,https://www.reddit.com/r/opiates/comments/8n9rdg/hydrocodone_vs_oxycodone_opirage/,6,https://redd.it/8n9rdg,life_wasted_again,Hydrocodone vs Oxycodone Opi-Rage,"I know this definitely isn't the first post about that opi-rage we're all familiar with, but I just wanted to get some opinions. I used to take hydrocodone all the time and it would make me wonderfully happy and whatnot, but recently every time I take hydrocodone (and this is ONLY specific to hydrocodone) I find myself easily set off.

Now I know I didn't give much background here, but my hydro use has been infrequent and despite taking 5-10mg once a day, every day (a ridiculously small dose compared to a rec dose 😉) for a few months, that daily usage has ceased for a while (it's been 2-3 months) so I know that this probably isn't a matter of tolerance.

Oxycodone still makes me feel great, sociable, awake, and impossible to piss off, although hydro was always my DOC and I've never used oxy the same way I've used hydros; my oxy use has been pretty much restricted to recreational use maybe once or twice a month, as I've accepted the reality that opioids are now a treat due to their rarity and I might as well enjoy my pain relief 😊 (and oddly, oxy never does shit for my pain unless I do take a rec dose of 20-30mg).

TLDR: Hydrocodone used to make me feel happy, but now I just get pissed off every time I take it, though oxycodone/other opioids don't seem to set me off like this. I don't know if something in my brain CHANGED or what, but now I can't take my DOC because it turns me into a prick 😞😢.",1527696157.0
8n9plw,https://www.reddit.com/r/opiates/comments/8n9plw/hydrocodone_appreciation/,13,https://redd.it/8n9plw,drippinBloodHoney,Hydrocodone appreciation,"Idk why everyone here is always hating on hydro, I know that people say it’s really weak (even at the level of codeine, which is ridiculous) but a lot of people who say that are already at the “shooting h/morphine/dilaudid every few hours” phase of opiate addiction. But to occasional users, hydros are perfection in a pill.

It hurts my soul to see fellow opiate addicts ragging on such a good high. At least y’all still leave oxy/Percocet alone lmao

BTW this isn’t anything against heavy dope users, I completely understand why shooting is fun :)",1527695822.0
8n9onk,https://www.reddit.com/r/opiates/comments/8n9onk/having_a_ball_on_the_way_out/,10,https://redd.it/8n9onk,0samaBinNoddin,Having a BALL on the way out.,"This is the first and last time I will ever buy a Ball of tar. After this sack, im done with this life. Its been 8 years of wasted potential and happiness, for a drug that only masks the pain and sorrow. Its time to deal with life head on, and finally get the life I know im capiable of having. This is also the highest amount I have ever bought, and figured I should go out, while having a ball. Its been fun folks. Im sure ill still post around here. 

Also, a side note, alot of people have been mixing my name up with /u/UsamaBinNoddin and I just had to clarify, that we are not the same user. I used to go by /u/Shabizzle420, but in a weed induced paranoia trip, I deleted that account because it was sort of linked to my personal life. 

Nod on and be safe fellow bropiates!

(http://imgur.com/sZ70KOe.jpg)",1527695625.0
8n9l5d,https://www.reddit.com/r/opiates/comments/8n9l5d/hydromorphone_question/,9,https://redd.it/8n9l5d,corgisandcocaine,Hydromorphone question,"Lemme start by saying I don't shoot anything and don't want to anytime soon. I understand that with IVing out of the question, insufflating is the way to go. I usually insufflate 6mg over the course of a few hours I only do this maybe once a month so my tolerance isn't huge. I was wondering if i had the hydro to spare, would it be nice to combine orally taking 2-4mg on top of insufflating some. Would this make it last a little longer? Or would it just be a waste?",1527694887.0
8n9ekf,https://www.reddit.com/r/opiates/comments/8n9ekf/what_are_some_opiaterelated_shitty_life_pro_tips/,6,https://redd.it/8n9ekf,His_Dudeness_94,What are some opiate-related shitty life pro tips?,"I'm high as shit on Lyrica and dope and waiting on my train. So let's have some fun, shall we? I think k we can come up with a bunch of shitty life pro tips that are related to opiates.

I'll start. Looking for an unorthodox method of penis enlargement? Inject street drugs in a penile artery! Double your girth and length in no time (pornstars *hate* it!!!)

Also shout out to auto correct and swift key for allowing me to type this post
",1527693531.0
8n9ass,https://www.reddit.com/r/opiates/comments/8n9ass/do_you_get_a_sharp_muscle_pain_in_your_abdomen/,2,https://redd.it/8n9ass,opiateman916,Do you get a sharp muscle pain in your abdomen ?,"I sometimes, not ways get a pain across my stomach above my belly button. It's a tight feeling ,it almost helps when I hit my stomach ,not hard . Any way I get it from norcos and 30s if i do alot on empty stomach. Sometime when I eat it happens (while on pills or took em a hour b4 eating ) vanyways. Lmk yall",1527692735.0
8n997e,https://www.reddit.com/r/opiates/comments/8n997e/possible_inadvertent_speedball_instead_of_goof/,12,https://redd.it/8n997e,MrPhilF,Possible inadvertent Speed-Ball instead of goof,"So I'm obviously pretty much rhetorically asking this but......What are the odds that this crack- head accidentally mixed in some Coke or Crack with the Shard that I picked up off him? 

I mixed in about a point  .1 to .15 out of my baggie of shards  with my .25 black shot (fire tar) and gave it a feathery kiss with my Bic. I then stirred it up and plopped a bit o' cotton into the nourishing stew residing in my cooker. After lamenting my lack of cleanz i drew up the concoction and tied off. Tap tap with my pointer finger and I found an eager and plump little vein on the upper outer portion of the crook in my elbow. 

I proceeded to slip the instrument of my ...relief/ bondage/wellness/servitude/ fleeting moment of joy and contentment ... beneath my skin and smoothly  (luckily) into the vein. Draw back..""Mmm yea positive register"" ... blood mingles with joy juice ....I slowly yet steadily depress the plunger to the halfway point ...dally ..for a split portion of a second and continue pushing that shit into my holy vessle ..slowly.. as I feel the rush pounding its way into my cerebellum .. chugga chuggchugga like a locomotive. cresting an airy peak picking up steam on its downward trek. 

With this dope quarter gram is decent enough that I take it slow just in case.

..Elevator straight into my skull...my.blood carries the magic potion to my soul. ...finish my shot gently disengage like a post-coital scenario.


FUCKING WHAM WHAM wham WHAM.  HELLOOOO...from the tips of my toes past my prick to my nose and up to the roots from whence my hair grows ....tingle tingle pins n needles ...cold fire rushes like my.blood to every corner of my flesh....DING -a- RING-a-ding-ding-ding-A- BING!!! Bell rung like I'd just taken a huge hit of crack. The up rush totally eclipses my very decent shot of dope.

It felt like a Speed-Ball very much but it was a goofball???",1527692416.0
8n97g1,https://www.reddit.com/r/opiates/comments/8n97g1/shaky_knees/,16,https://redd.it/8n97g1,2ndwaveobserver,Shaky knees,Going through TSA currently with a little bit in my personal bag and getting past the dog...ugh. I know it’s probably just a bomb dog but still. One of those days that it feels like everyone in the world is looking at me. Including the dog lol ,1527692035.0
8n8v96,https://www.reddit.com/r/opiates/comments/8n8v96/i_tried_tar_it_doesnt_work/,12,https://redd.it/8n8v96,opiateman916,I tried tar. It doesnt work,"I tried tar yesterday I made monkey water and I smoke it off foil, when I smoke it made me gag every time, I don't plan on doing this again but I have a .1 / 2left and I want to use it to get high in 2 days from now when my withdrawal start so I can go to work without shiting myself I will not i v it s*** so trash anyways I wouldn't want it in my body like that. rather just smoke it or eat it or some s*** anyways I need to know how to make this f****** .1 of tarp work I'm down to try foil again it's just so goddamn nasty I throw up",1527689364.0
8n6dz4,https://www.reddit.com/r/opiates/comments/8n6dz4/appreciation_post/,0,https://redd.it/8n6dz4,hbarnes55,Appreciation post,Just like to say you guys are great! I learn a lot here ,1527661913.0
8n88ho,https://www.reddit.com/r/opiates/comments/8n88ho/care_packages/,4,https://redd.it/8n88ho,SALEX2018,Care Packages,"Some of you may have watched the Today show segment with Tracey or the HBO special.  I'd like to offer help as well, to anyone that might want to Naloxone.  Please message me privately with your info so I can send them out.  I absolutely respect your privacy and your choices.  If you just need to talk to someone, please also feel free to message me, I am always available to listen and will try to help if I can.",1527683959.0
8n8ljj,https://i.imgur.com/rHuaeGo.jpg,4,https://redd.it/8n8ljj,LoveYoMutha,Finally..,,1527687181.0
8n8jox,https://www.today.com/video/meet-the-heroine-of-heroin-who-is-fighting-america-s-drug-crisis-1244444227683,7,https://redd.it/8n8jox,somaticnickel60,Mods are asleep.Thanks to Moderator.,,1527686731.0
8n8fvn,https://www.youtube.com/attribution_link?a=8wOX0hLPK5k&u=%2Fwatch%3Fv%3Dao8L-0nSYzg%26feature%3Dshare,5,https://redd.it/8n8fvn,dori_88,Addiction: Building Rat Park & Human Connection,,1527685776.0
8n8fg2,https://i.redd.it/c9nyxejcsz011.jpg,11,https://redd.it/8n8fg2,Alexp456,Percs and a pup,,1527685681.0
8n89bd,https://www.thefix.com/naloxone-and-high-price-doing-nothing#.Ww6cOu8HlFQ.reddit,0,https://redd.it/8n89bd,traceyh415,Naloxone and the High Price of Doing Nothing | The Fix,,1527684179.0
8n86id,https://www.reddit.com/r/opiates/comments/8n86id/pro_tip_constipated_get_over_it_and_give_yourself/,15,https://redd.it/8n86id,FrankNSam,Pro tip: constipated? Get over it and give yourself an enema,"There seems to be more shit posts lately, and none of them ever discuss enemas. I have an attachment that goes on to the hose for my handheld sprayer, but you can buy refillable enemas at the store. All you do is inflate your colon with nice warm water. It helps unstick the poo from the colon wall, lubricates the poop, and helps stimulate movement. Sure, the giant poop is still going to tear your asshole out, but it’s a small price to pay. The key is to give yourself enemas all the time so that you don’t go more than a couple of days without a movement.

Some people don’t like the idea of sticking something up their ass; get over it. The cure for an impacted bowel is to remove the bowel. Enemas will keep you happy and healthy!",1527683461.0
8n83tv,https://www.reddit.com/r/opiates/comments/8n83tv/just_saw_a_segment_on_tracey_on_todag/,22,https://redd.it/8n83tv,Carlos_Danger11,Just saw a segment on Tracey on Todag,"Keep fighting the good fight, Love. You are truly an angel. Can someone tag her on here to make sure she gets my message?
Edit- Today not “Todag”",1527682740.0
8n838r,https://www.reddit.com/r/opiates/comments/8n838r/you_guys_are_on_the_today_show_right_now/,2,https://redd.it/8n838r,AmerikanInfidel,You guys are on the Today show right now!,"Tracy, thanks for what you do! ",1527682583.0
8n818p,https://www.reddit.com/r/opiates/comments/8n818p/binding_affinity_question/,25,https://redd.it/8n818p,gethighbeforyoudie,Binding Affinity Question,"So we all know that bupe has a huge binding affinity- hence precip wds because it knocks off the other opiates. I've heard that Fent has an even higher binding affinity. If this isn't true, this negates the whole question but that's what I've read and heard. Now, if this is true, will taking suboxone before fent reduce the effectiveness of the fent or because fent has a higher binding affinity it will just knock the bupe right off and you'll achieve regular effects. Literture proving me right or wrong would be appreciated.",1527682067.0
8n7ga9,https://i.redd.it/4jzsp19fyy011.jpg,29,https://redd.it/8n7ga9,aaron62691,The first few days in a detox center,,1527675615.0
8n7dau,https://i.redd.it/7dsa3mxfvy011.jpg,29,https://redd.it/8n7dau,SadPillMom,"Good morning, all! Can you please tell me what I need to know about these? (morphine) Strength vs 60mg hydrocodone? How much should they cost? Thanks in advance and have a wonderful day! 💖💙",,1527674614.0
8n7a78,https://www.reddit.com/r/opiates/comments/8n7a78/oxycodone_in_the_uk/,12,https://redd.it/8n7a78,febreezeguy,Oxycodone in the UK,"Anyone from the UK willing to shed some light on the general domestic scene of Oxycodone, both script and darknet/street. It's a Class A drug so you can get some serious time.

When is it prescribed? What manufacturing brand is the most common? Are presses common in the black market?",1527673634.0
8n6xcq,https://i.redd.it/c0oe6qshey011.jpg,6,https://redd.it/8n6xcq,seanmichael02,"When I first acquired a dilaudid connect, way back when I was innocent and those lasted me a couple of days💜 now they would last a couple of hours maybe?😵😂",,1527668912.0
8n6x16,https://www.reddit.com/r/opiates/comments/8n6x16/i_love_this_community_so_goddamn_much/,4,https://redd.it/8n6x16,WorkYouFuck,I love this community so goddamn much.,"For real, y'all are amazing. As a (recovering) addict, I don't have many people to talk to about this part of my life. No one else really understands what it's like to live this life, and those who do find out about my Mr. Hyde immediately get uncomfortable around me and start judging me. So I come here to vent and talk about my struggles with sobriety and the immeasurable guilt I feel for not only being a heroin addict, but also for the things I've done to get well/high. For the most part, y'all understand and don't judge, and offer help in the form of advice and a shoulder to cry on.

Which brings me to the reason for this post:

u/soibowmyhead and u/mdot801 saw my post and absolutely came through for me. u/soibowmyhead bought me a pizza for dinner last night, and u/mdot801 brought me lunch from McDonald's AND a gift card so I could get some food later on, as well. So I had dinner last night, and for the first time in a long time ate all three meals today. I had leftover pizza for breakfast, and McDonald's for lunch and dinner. Pepper in the fact that a friend who owed me some cash from a while ago ACTUALLY came through today and bought me some cigarettes and a drink, and today was one of the best days I've had in a very, VERY long time. ",1527668781.0
8n6u3e,https://i.redd.it/zbywudvpay011.jpg,13,https://redd.it/8n6u3e,seanmichael02,"For when I’m out of smack and dils. A last ditch effort, trying to stockpile them for when I am suffering withdraw with no end in sight😁",,1527667642.0
8n6qbp,https://i.redd.it/3flhxpkk6y011.jpg,7,https://redd.it/8n6qbp,seanmichael02,Finally! Finally finally finally😍 managed to find a dboy close by through a friend. This was my first pickup and the first time I’ve had smack in a long time so this has been a treat💜 gonna ask about other goodies soon😈 he’s one of the ‘has a backpack full of what you want/need.”💜💜💜,,1527666250.0
8n6px2,https://i.redd.it/dnnq7hj36y011.jpg,8,https://redd.it/8n6px2,gangsta232,More of my 100 percent real Actavis oxycodone 30mgs,,1527666092.0
8n6g94,https://www.reddit.com/r/opiates/comments/8n6g94/meeting_with_lawmakers_need_your_opinionshelp/,21,https://redd.it/8n6g94,fat_loser_junkie,Meeting With Lawmakers - Need Your Opinions/Help,"Hey guys and gals...

I've been invited to sit down with some local lawmakers, politicians, judges, and politicians to discuss the *(God, I hate this term)* opioid epidemic. In July, I'll be meeting with various local politicians from county commissioners office, a few judges, the county sheriff, my local state representatives, plus staff from the governor's office.

The meeting is slated to be a kind of round-table Q-and-A where they can ask what is wanted/needed by the community and we can ask what their respective offices are planning/are willing to do. This is going to be a two-day event and I've been guaranteed some one-on-one time *(knowing my luck, probably with the sheriff's office)* in addition to the normal group dynamic stuff. 

So, now that you know the background, what do you think I should be bringing to the table? Before anyone says ""supervised injection sites,"" please keep in mind this is a very rural, very Republican area. While pie-in-the-sky goals are great, it's been hard to get them to even consider simple harm reduction efforts, so let's keep shit in the realm of possibility. The fact that these die-hard conservatives are even making this much of an effort is goddamned amazing as is; no need to piss off all the old white guys by asking them for free blow and hookers. *(Besides - they want all the coke and whores for themselves...)*

If anyone has any peer-reviewed studies/publications they think I should mention, that'd be extremely helpful. Also, if anyone has any information on programs which qualify for federal or outside, third-party funding, please, *please* let me know. The cheaper or freer something is the more likely they'll be to support it.

Thanks everyone, and I'll be sure to update you all after the fact.

*P.S. - Everyone go register to vote. Get involved with your local politics. Even junkies need a voice in government; especially junkies.*",1527662721.0
8n6eti,https://www.reddit.com/r/opiates/comments/8n6eti/first_time_hydrocodone/,0,https://redd.it/8n6eti,webefulish,First Time Hydrocodone,"Ive tried almost all the opiates/opioids known to man but today I finally came across my first chance to try hydrocodone. I have plenty of experience with oxycodone and hydromorphone so im assuming the effects will be similar. I had a tooth pulled earlier and was given a script of 6 5mg (30mg in total) of hydrocodone for the pain. I dont use real opiates/opioids much anymore and normally just use kratom to keep myself well. Figured it would be best to CWE all of the pills at once and drink the tea down quick. Just finished it and it tasted surprisingly bitter! Hope 30mg is a solid dose. Cant remember when the last time I got to take an opioid I never had before was.

Also my only question is is it true that hydrocodone has the same potency as morphine by weight? Thats what I read online.",1527662194.0
8n6eix,https://imgur.com/Tr2w8mF,7,https://redd.it/8n6eix,TableChairguy,Got these in today. Thought y'all would like them,,1527662101.0
8n69t3,https://www.reddit.com/r/opiates/comments/8n69t3/holy_fuck_i_can_see_why_people_get_addicted/,14,https://redd.it/8n69t3,47piirates,"Holy fuck, I can see why people get addicted","Had my first time with hydros 10mg and I felt super happy and relaxed. It was kinda like a weed high, but more relaxing and a lot of smiling. I was playing some PUBG and i usually would get stressed but i felt so happy playing and getting killed didnt make me rage at all. After the high, I felt like I wanted more, but stopped myself. I plan on doing it again these next 2 days since its my last days of senior year. After that, im flushing this shit down the drain. 

Just wanted to get it off my chest. If anyone wants to add on, feel free.",1527660539.0
8n69b8,https://i.redd.it/5dmhd9x3px011.jpg,20,https://redd.it/8n69b8,Omarffomthewire,"Hey Bropiates, it's time for everyone's favorite game show....Pressed or not pressed!!! Todays show is brought to you by Bob O'Panda's hose clamps. When you need to contain a leak, call Bob.",,1527660378.0
8n654z,https://www.reddit.com/r/opiates/comments/8n654z/may_have_taken_too_much/,22,https://redd.it/8n654z,veryflatstanley,May have taken too much,"So I have a fairly low tolerance rn, I’ve done oxy maybe 3 times  in the past 9 months. I took 30 mg last week and was feeling good. Today I picked up two blues and snorted 15mg at maybe 3pm. Then I took 30 mg at 8pm on an empty stomach. Two hours ago, at 11 Pm I took the last 15mg. The last dose  didn’t really kick in for like an hour (I smoked then it kicked in) and for the past 45 mins or so I’ve been struggling to stay awake.. is 45 mg enough to kill someone with a fairly low tolerance? I’m worried because I have dropped my phone maybe 3 tines sitting on the couch so now I’m standing in my kitchen to help stay awake until I’m not high. Could someone tell  me that I’m just freaking out or that I am close to an OD.. any advice appreciated thanks ",1527658999.0
8n6359,https://www.reddit.com/r/opiates/comments/8n6359/chops_complimenting_opiates_benzos/,10,https://redd.it/8n6359,AshyLarry2,Chops complimenting opiates & benzos,"I took 4 MG (2nd time using xan in months) and have been nicely complimenting them with chops. For alll of you ignorant to chops it’s weed and tobacco (often American spirits, I use Marlboro 27) mixed in a preferably larger bong (beaker bottom works best). The trick is you snap the whole in one hit (crazy head rush and beautiful bud high). Chops mix so damn well with any benzo or opiate I would highly recommend ",1527658318.0
8n6185,https://i.redd.it/sqkn8py6hx011.jpg,5,https://redd.it/8n6185,Carpet_Surfer216,"Yes, you ❤️",,1527657716.0
8n5zmn,https://www.reddit.com/r/opiates/comments/8n5zmn/methadone_after_sub/,5,https://redd.it/8n5zmn,Exa8yte,Methadone After Sub?,"Ran out after about a half gram bth habit IV yesterday. I've taken about 3mg of sub today IV. I've been about 70% but still have bad anxiety and cold/hot chills so I'm about to pick up methadone to see if it'll ease my symptoms a little better. Can I take the methadone tonight? It's been a few hours since my last sub miligram subutex dose. Also I read that the oral bioavailability is very high so Iv doesn't make much of a difference. How long does is the onset of methadone. Should I wait until tomorrow?

Edit: they are 10mg a piece how many should I take? Been on 200mg per day very very hight quality bth intranasal for the first 10 months or so and switched to IV about two months ago and doubled my dose pretty much.",1527657222.0
8n5uwc,https://www.reddit.com/r/opiates/comments/8n5uwc/have_you_ever_saw_a_ghost_on_opiates_our/,18,https://redd.it/8n5uwc,suckingonabanana,Have you ever saw a ghost on opiates our something wierd,I was high but not wasted nodding in bed and i swear i saw. A shodow person walk through my door take a left go through my wall....and only the tv was on ....freaked me out,1527655777.0
8n5otc,https://i.redd.it/t2ninyr16x011.jpg,2,https://redd.it/8n5otc,jlogic420,"More M 30s, subs, Amps, hydro and the last of those lovely oxy Caps I moved hundreds of... I sure miss them..",,1527653984.0
