avnipz,https://www.reddit.com/r/opiates/comments/avnipz/music_to_shoot_up_to/,15,https://redd.it/avnipz,Dijdjdhhs,Music to shoot up to?,"I love listening to musid when i get high. I smoke weed with my opiates, and i love listening to a good song when i push off. I seriously feel like it makes the rush twice as good. My go to bands are pink floyd and the doors. I like a really loud psychedelic sound to carry me away. What kind of music do you guys like to shoot up to? Anybody else feel like it makes rhe rush better? I will not shoot up without at least havint a sont on my phone ideally i like to setup my speaker tho. 

My favorite songs that i would recommend shooting up too and rushing too.

Heroin-velvet underground
When the musics over- The Doors
Back door man-The Doors
On the run- pink floyd
Breathe- pink floyd
Combination of the 2-janis joplin
Reveloution- the beatles
",1551332872.0
avnhs6,https://www.reddit.com/r/opiates/comments/avnhs6/kratom_as_a_substitute_for_hydromorphone/,14,https://redd.it/avnhs6,Throwdrugway,Kratom as a substitute for hydromorphone,"I know somebody who has a a bit of an opiate problem but the problem is that they have a desease that causes chronic pain, their doctor recently cut their prescription which drove them to the darkweb (got screwed)

I'm worried that it might get worse or an illegal supply could be tainted with fentanyl.

Is kratom a viable alternative, or atleast supplement to hydromorphone as far as pain and addiction purposes go? ",1551332677.0
avn3j8,https://www.reddit.com/r/opiates/comments/avn3j8/i_need_a_little_help_managing_my_suboxone_script/,11,https://redd.it/avn3j8,Additional_Sugar,I need a little help managing my suboxone script.,"**So a little background :**

I've gotten myself a great doctor, been seeing them for about a year now after 4 years of buying my subs myself from local connects.

**Current situation:** 

&#x200B;

I'm prescribed 2 8mg strips a day. I generally dont take anything til i'm getting up and moving for the day , or as i'm about to walk into work, etc.

When i first get my script filled I will find myself taking 3-4 throughout my day. They actually do make me feel better and more motivated getting through the busy night shift . 

I usually run out about half way through my monthly and have to buy what i need til i get to my next appointment which is just frustrating, and I know each time that i did it to myself.      ~~i'm a piece of shit~~

I really need to find a regimen and stick to it., I've thought of only taking one with me to work, i recently cut a day from my shift that links up with the one day off a week i get to give my self a 2 day break and let some of the sub run out of my system a bit. 

I also tried to set up my appointments to the ""every two weeks""  and that got me pushed to monthly appointments which screwed me even further. 

I'm worried that if I speak to my Dr. or my therapist that they will kick me out for abusing my prescription and that would really screw me right now. 

anyway thanks for reading and if you have any advice i'd really love the input ! 

**<3**

**TL;DR I basically abuse my suboxone script and i'm looking for ways to help control my usage before I get caught up with no meds or less than i should have. thanks:)**

&#x200B;",1551329847.0
avmyye,https://www.reddit.com/r/opiates/comments/avmyye/subs/,4,https://redd.it/avmyye,unephi,subs?,"got ahold of 2 8/2mg subs and took one of them chunk by chunk over the course of like 5 days.. just a couple little bumps under the tongue a night.. the effect is already definitely decreased. if one stopped now, do you think there would be a pretty significant withdrawal that one should be prepared for? and how long to wait to take another chunk and avoid any issues?
",1551328933.0
avmuxq,https://www.reddit.com/r/opiates/comments/avmuxq/with_years_of_abstinence_the_allure_remains/,5,https://redd.it/avmuxq,ifhe7733,"With years of abstinence, the allure remains","I've never been addicted to heroin but was a weekend user for five years or so. It's been several years since I've used any opiates.

I just listened to a song that seemed to describe my relationship with opiates really well. And despite the fact that several loved ones of mine have died because of heroin, my first reaction was to want to use heroin.

I remember, years ago, hearing people say that chipping long term just isn't possible. And they're right - there's a reason I stopped, and it's because I started trying to rationalize using on Wednesdays plus weekends to use more but still avoid physical dependence. I recognized that that was addict thinking.

But when I think of heroin the thing I think about is the first time, that feeling of a warm security blanket and heroin telling me I'm safe. It makes me sad that I'll never feel that again, that feeling of perfection never comes back once it's gone.",1551328124.0
avmw9a,https://v.redd.it/yffocwl3m8j21,10,https://redd.it/avmw9a,BroadStreet_Bully5,"Saw on Daily Show, got a hardy chuckle.",,1551328408.0
avmq12,https://www.reddit.com/r/opiates/comments/avmq12/freaking_myself_out_while_on_oxy_urgent/,18,https://redd.it/avmq12,duckling01,Freaking myself out? While on oxy URGENT :(,i did 35 mg of oxy and im freaking out because my breathing is slowed down im not nodding and i took 30 mg 2 hours ago snorted 5 30 mins ago i should be fine right??? You only OD while nodding or u pass out? i have anxiety so maybe im working myself up :/,1551327180.0
avma7l,https://www.reddit.com/r/opiates/comments/avma7l/do_regular_opiate_potentiators_work_for_suboxone/,4,https://redd.it/avma7l,ogpoppaswank,Do regular opiate potentiators work for suboxone as well?,"I typically will buy tabs either the ""n8 stop signs"" or ""Zubsolv"". I almost always break down 4mg at a time and use intranasal administration. I wonder that if I'm bypassing first pass metabolism, will any traditional potentiators have any effect? And if not, are there any other methods that could help absorption or anything to boost or compliment effects of said sub?",1551324333.0
avm4w0,https://i.redd.it/4j5wxc2f78j21.jpg,42,https://redd.it/avm4w0,unalert,~75g of Gunpowder 😁😁😁😁😁,,1551323412.0
avm0ht,https://i.redd.it/ngalfjc558j21.jpg,7,https://redd.it/avm0ht,knickswillwinachip,Pick up after going almost 2 months without any oxys (minus the 2 in my belly),,1551322634.0
avm0gm,https://i.redd.it/nnfzi3j458j21.jpg,4,https://redd.it/avm0gm,Jokawild9,Dillys are my favorite 🙃,,1551322628.0
avlzph,https://www.reddit.com/r/opiates/comments/avlzph/noob_here_percocet_promethazine_and_hydroxyzine/,7,https://redd.it/avlzph,throwitallaway6083,"Noob here. Percocet, promethazine, and hydroxyzine an ok combo?",,1551322497.0
avlwt9,https://www.reddit.com/r/opiates/comments/avlwt9/summer_is_coming/,7,https://redd.it/avlwt9,realcat67,Summer is coming…,"It is springtime in a really big city in Georgia and blue skies are everywhere.

Have you ever noticed how people drive with their windows closed, even when it is 70 degrees? That is so weird.

I had an interesting experience today. I had to go to a dentist.

He fixes my tooth and tells me to take some advil, which I am fine with. Then he gives me a script for vicodin.

I tell him thanks, but I do not take opiates.

And he says, well, they are pain pills. If you are in pain, you may need them.

I say, thanks again, but it would be a waste.

That is that, but as I am driving away, I start thinking.

If you are in pain, you need pain meds.

And I am remembering the countless times I self medicated with iv heroin. I guess I was in pain. So I start wondering exactly what my pain was. Trying to pin it down exactly. Not a generalized, I didn’t feel right kind of deal.

In my case, I think it involved feeling different. From the time I was a little kid, if I didn’t know you, I saw you as a potential threat. Even if I did know you, I kept an eye on you.

To me, people were unpredictable. I would say the wrong thing and suddenly I was not cool. Oops.

As I got older, I learned how to better handle people, but I never really understood how to be social. I was still a bit hyper alert, and watched people closely to make sure I didn’t say or do anything that freaked them out.

This was exhausting. 

I suppose this must have been painful, because the minute I was exposed to heroin, I was all over it. It felt great and it insulated me from my own inability to connect.

I was cool.

Years later, I somehow figured out that heroin was like a magic trick. It sort of looked like real life, but you could tell something shifty was going on.

Heroin was a permanent barrier between me and the people that I wanted to love. I simply could not feel them while I was high.

I was out of tune. Like a human guitar. I was on a different frequency. The wrong harmonic.

This was ok when I was a kid, but eventually it got kind of bleak.

At some point, I wanted to hang out with regular humans. The internet was just not enough. My junkie friends were not enough. Life just kept rolling by.

Whatever happiness was, I definitely did not have it.

Just as bad, I was literally chained up to the dope and I could do nothing without making the required arrangements.

This all really sucked, once I thought about it. It became intolerable.

But looking at it now, I understand the truth of what this dentist said to me. Pain meds for pain. It doesn’t get any more simple than that.",1551321975.0
avltq6,https://i.redd.it/089by9ne18j21.jpg,14,https://redd.it/avltq6,springdominion,I could not be any happier after this grip.,,1551321400.0
avltdc,https://www.reddit.com/r/opiates/comments/avltdc/i_know_theres_no_sourcing_but_i_cant_find/,27,https://redd.it/avltdc,opimang732,I know there’s no sourcing but I can’t find syringes for the life of me,"I live in Florida and have tried quite a few pharmacies but to no avail. I usually ask for 30 gauge 1ml syringes but everytime they ask who or what I need them for and then ask if I have a prescription for insulin, blah blah...

Are there any particular stores you guys have had good luck with in Florida? Also what exactly should I ask for and what should I say if they ask why or who it’s for? 

I know about i sourcing and I’m not asking for exact store locations just the company’s in Florida you have had good luck with. ",1551321325.0
avlnbv,https://www.reddit.com/r/opiates/comments/avlnbv/suboxone_absorption/,6,https://redd.it/avlnbv,FredoKruger,Suboxone absorption,"I just started on suboxone about a week ago and for the first day or two when I took it, first of all the taste seemed a lot stronger when i swallowed it after letting it dissolve under my tongue and secondly I got an actual kind of high from it (which I wasnt expecting). From day 3 until now, I've been taking it the same way but the taste when I swallow is nowhere near as strong, and the high is not there. They even doubled my dose today and still nothing. My question is what is the most effective way to take my tablet? Should I crush the tablet with my teeth and let the powder sit under my tongue or just let the whole tablet dissolve under my tongue? How long should I keep the sub under my tongue before I swallow? Basically i just want to know how to get the most effect out of my suboxone.",1551320242.0
avljio,https://www.reddit.com/r/opiates/comments/avljio/injecting_in_neck_plz_help/,18,https://redd.it/avljio,milowpm,Injecting in neck? Plz help,"Legit havin alot of trouble hittin myself anywhere so i got s brand new fresh fuckin rig n was thinkin about trying my neck. Anyone have any experiences or tips for me?

I jus drove 2 hrs round trip for a (rare here in my parts) gram of ecp n im already stressin over the trip bein a waste if i cant hit. Fucking subs ruined my shit. Any help is appreciated thanx yall!",1551319542.0
avlj2d,https://www.reddit.com/r/opiates/comments/avlj2d/when_did_you_disclose_your_habit_to_potential/,28,https://redd.it/avlj2d,frowney_turkey838,When did you disclose your habit to potential mates?,"I have been on a date with a girl and have a second planned, but I am not sure if I should tell her about my heroin use. It seems like it would probably scare her away. I want to wait until we are serious before I tell her (or she inevitably finds out), but I don't want to wait too long.",1551319464.0
avli9y,https://i.redd.it/wjw0utz8v7j21.jpg,12,https://redd.it/avli9y,throwitawaynowordoem,A small score from today,,1551319319.0
avleff,https://www.reddit.com/r/opiates/comments/avleff/need_new_hustles_asap_price_of_dope_going_down/,16,https://redd.it/avleff,TrappersAnon,Need new hustles asap. Price of dope going down?,"Ok, so sometimes I make shit tons of money for days through middle man, and selling every drug ever made to people and dont get sick for many many days. Other times my luck dries up and I'm hurting hard af to make even 10 bucks...Well I jus did a big ol shot of plain H, so I am trying to make a gameplan while im not shitting myself, and going thru hardcore wd. 

I am a convicted felon and on the run at this time. I am also on the run, a job with a corporation isnt going to work due to my background. I am very willing to work though, and do odd jobs whenever possible. Ive panhandeled before, and tbh it is not for me. Very sketchy at this time to do that tbh. Its just not possible to do atm, take my word for it. 

I need to throw this in, for the people that say quit. I am basically in the methadone program right now. They just need my entrance fee and I get to start. So  tbh, the main point of this post is to figure put how to get money thru methods I dont normally do to get into this methadone program and pay for the medication.

In b4 prostitution.",1551318646.0
avlcdj,https://imgur.com/achWnE8,5,https://redd.it/avlcdj,CAPS_LOCK_USERNAME,Should I try to drain these or something?,,1551318275.0
avl9lk,https://www.reddit.com/r/opiates/comments/avl9lk/how_will_you_guys_be_able_to_buy_your_huawei_mate/,44,https://redd.it/avl9lk,sometimesguru,How will you guys be able to buy your huawei mate x with drugs as a hobby,Yeah 2600dollars is quite a lot if you have this kind of hobby. I dont understand how you guys get the money for your foldable,1551317781.0
avl1nu,https://i.redd.it/co55xe09m7j21.jpg,2,https://redd.it/avl1nu,treevaahyn,Not sure you wanted me to follow you. But you left me no choice.,,1551316392.0
avl1d2,https://i.redd.it/z0g70q7fm7j21.jpg,18,https://redd.it/avl1d2,happygirraff,"90% sure these contain Fent, no test kit needed.",,1551316338.0
avkssz,https://www.reddit.com/r/opiates/comments/avkssz/why_cant_i_learn_how_to_shoot/,52,https://redd.it/avkssz,MaterialCatch,Why can’t I learn how to shoot,"Why the fuck is this so difficult for me, like everything about it. Went through five syringes the past hour. Suck at working the torniquet or the needle/plunger with one hand and keeping it steady. Idk how to register. This is really difficult

How do you tie a torniquet anyway so that you can release it when one hand is on the needle and the other is getting pricked.

And how do you hit veins, I have nearly virgin veins and idk why I have so much trouble. I’m so frustrated, I just want to be better at this already, why can’t I be like you guys who get it easily in one try. Must have had over ten tries and nothing more sucessful than a little tiny bit went into a vein and I felt it

I’ve wasted half my shot already and been backloading it into a new syringe to try again after failing but I’m reluctant to try again without finding some advice pn how to do this.

I know basics but I’m getting so frustrated and really suck at this. Is it supposed to be easy?",1551314821.0
avkpgw,https://www.reddit.com/r/opiates/comments/avkpgw/oral_opium/,2,https://redd.it/avkpgw,sergey_the_serb,Oral opium,Anyone have any experience with oral opium ? I can't see to find any dosages online,1551314250.0
avkoza,https://www.reddit.com/r/opiates/comments/avkoza/quitting_over_the_next_few_weeks_slow_taper/,2,https://redd.it/avkoza,Comfycodone,"Quitting over the next few weeks, slow taper","My habit isnt that high, about 40mg of oxy/equivalent per day. I'm just not getting the same high that I once was, and fuck switching to heroin. I'm gonna do a slow taper, just wanted to know if you guys think this would work. I was gonna immediately cut my dose in half for about 3 days, then after that cut in half again for another three days, then another half to where I'm only taking 5mg of oxy every day for a week and then stop completely. I expect I'll still feel some withdrawal effects after that but I'm hoping it won't be as bad as the flu-like symptoms. I've quit years ago when I had a 60mg a day habit and went cold Turkey, but that was my first time quitting so it was super easy and barely had any withdrawals. I recently went about 3 days without a dose and almost called out of work I was feeling so bad, so I'm going to try and taper. 

Do you guys think this taper would work for this low dose habit? I'm really only concerned that I won't be able to stop myself from taking all my stash at once to get high, anyone got any advice on that as well? I really need to quit because I figure the high just ain't worth the money. I'm trying to save up enough for a sailboat that I can live on, and that's already gonna take a couple years to afford. If I dont quit now, I'll never be able to get it.

Edit: alrighty then",1551314162.0
avkoya,https://i.redd.it/4a3d5wsxf7j21.jpg,39,https://redd.it/avkoya,DamaskDragon,"Got some Oxys, I’ve never tried them and would like to at least once. I read on tripsit.me that a common dose is 10-25mg? I thought that seemed high so I came here to ask you guys for your advice and opinions. I also read it takes less to feel a buzz if you insufflate them and I’m open to doing that",,1551314159.0
avkk9m,https://www.reddit.com/r/opiates/comments/avkk9m/newbie_question/,7,https://redd.it/avkk9m,BESTSINGEDEUW,Newbie question,I have a mg 80 xr oxycodone would that be safe to take with no tolerance? I'm a pretty big guy ,1551313387.0
avk4l5,https://www.reddit.com/r/opiates/comments/avk4l5/what_would_you_do/,31,https://redd.it/avk4l5,canewalking1972,What would you do?,"I had my doc appointment set for the 28th for the past month. I get an automated call saying my appointment is the the 1st.  Im 100% sure its the 28th. We dont forget our refill days...

I call and tell them that and say theres a discrepancy in the schedule and he will speak to the doctor to fill it today or tomorrow. No one calls back. I call 15 min before the office closes and they tell me everyone is gone.  Tomorrow is fine. Its day 30. So it wouldnt be early nor am i trying to cheat to get it early. I will be out of meds tomorrow. 

I told him i wont be able to come in on the 1st. I wont be able to get out of bed. 

I left a nice long message from there website explainijg there mistake and hopefully hear from them tomorrow morning. 

My doc has sent it in before with out seeing me since i had surgery and was un able to get to her.

Before you ask. The script is for 120. 15mg oxy hcl.

The idea of me getting it tomorrow per my orginal appointment was making me happy.

I dont abuse them. Just the anxiousness of being out and getting sick has made my stomach in nots.

Since this is clearly an administrative mistake they should take care of it right? I told them if i had the meds id still come in on the 1st for there documentation of me being there.


Edit: So i just spoke to the same man I spoke to yesterday, and he was very apologetic and kind of even started crying. He told me he saw my record and i never missed an appointment, never late, always nice. So there wouldnt be a problem.  He says the doc should have no issue filling it as long as I promise ill be there tomorrow for documentation the doc saw me since its a c2 medication. ( been going there over a year) 

Edit #2 : Not sure if you get a notification if i edit this but anywho. I spoke to the same man. My doc is in another office on an emergency from another doc calling out. He said he will contact her and she should fill it. Just waiting on the notification from CVS or a call back saying she sent it in. Thanks to all who commented. Ill update again once I get the script to let you all know I am fine. 


Edit #3. Doc called it in. Just picked up my script. Anxiety is no more. Andbpain free.
Thank you alll for talking with me through this.",1551310818.0
avkbxn,https://www.reddit.com/r/opiates/comments/avkbxn/they_supposedly_tested_a_balloon_in_oregon_and/,49,https://redd.it/avkbxn,ASavageLost,"They supposedly tested a balloon in Oregon and found it was over 25% human feces. I don't know if that's true. But it has nothing to do with this post, either way.","  

By the time I get to the motel, the parking lot is full of junkies waiting for me to open for business. The sun is not over the skyline, yet. And breath looks like hot smoke in the cold. Their lunatic eyes flicker pale death. The black and harrowed faces of the horde watch me, these unholy congregants staring silent and hostile. It’s almost like I’m some stranger come upon a tribe of savages in the urban wilderness or even their own high priest cursed with disease or something like that. You know? So, I walk to my door. They make way, parting like that fabled body of water and wait for me to invite them in.

“Three at a time.” I say pointing. “You. You. And you first. After that, three at a time.”

My business is no secret. Not that I can say it ever was, but now, anyone with half a lick of sense can see that whoever is renting out room 127 sells dope. Sells something anyway. It makes me uneasy. There’s so much to be paranoid about.

“What you need?” I ask the first guy. 

He opens his mouth. His breath is hot and stinks. “Got 210 bucks here, boss. What you got?”

“I’ll give you a ball.” 

That's probably a little high. But, my prices fluctuate with the way I'm feeling about whoever is buying. Besides, he doesn't seem to care. Probably because he knows that the reputation the dope has will get him his money back fast. And then some. I weigh it out. Put it in a bag. He flashes a grim toothed grin and rubs his hands on his jeans. He wears a hood. He looks like a cartoon witch and steps back out into the parking lot. It goes on like that for an hour. Non-stop sales. A gram. Another eighth. Whatever 17 bucks will get. Of course, Eddy and Peanut Boy and the rest of the regulars show up. And once noon comes around, I put my bag on my back and walk back towards the bus stop. 

Now, I can’t say it’s the first time that I am seeing a green Ford Taurus with dark tinted windows across the street. Because, I know it’s not the first time I’ve seen it. But it is the first time that I notice that I have seen it before. And that, very likely, it’s the law. It’s surveillance. But I know they won’t make their move, now, so I keep walking and do my best to forget about them until I have to deal with it.  ",1551311991.0
avkb9k,https://i.redd.it/dbrs2qd597j21.jpg,15,https://redd.it/avkb9k,dreamchase7,Touchdown! 🏈,,1551311881.0
avk9ng,https://www.reddit.com/r/opiates/comments/avk9ng/goddamn_it/,0,https://redd.it/avk9ng,peachyyy_,goddamn it,"my dude finally somehow got his hands on some ECP (at least it appears to be, it resembles that more than anything else i’ve seen). 
& for some reason i’m his only customer that wants it (i’m on the west coast so it’s all tar all the time), so he is legit saving it for me whenever i cop. bless his little soul. the shit is fucking fire. 

but GODDAMN IT the second time i hit him up to cop some; his phone is off. i think he may have got caught up :(

story of my goddamn life tho. i swear. 

",1551311622.0
avk8ul,https://www.reddit.com/r/opiates/comments/avk8ul/clean_for_7_months_using_methadone/,15,https://redd.it/avk8ul,caco2521,"""clean"" for 7 months, using methadone","Yay, I was an IV morphine user, for 4 years, I was using all my money for morphine, it sucks.

 I have been on 80mg/day, well, I was truly a speedball addict, all my shots for the final 2 yrs had coke.

I had an OD, and all my family discovered, sad been the junkie of the family, I got a ride to hospital and them they fucked me givin 10mg 4x/day ORALLY, so obviously the wds starts, been on hell, they tappered 800mg/day IV, with 40mg to 10mg and then put me on methadone, 10mg got to 60mg. Why they dont just detoxed morph, I was having hard wds anyway, that dose is ridicuously. 

My psichyatrist after that put me on 100mg of methadone/day, oh, I was a benzo abuser too, tappering  now with 5mg of kpins/day (didnt botthered me because in rehab they are giving me kpins).

In rehab I was tooking daily:
- 5mg kpins
- 20mg lexapro
- 450mg pregabalin
- 100mg dones 
- 300mg seroquel

Seroquel makes me sleepy all day, I hate quetiapine.

After rehab I cut off seroquel, and stop taking, my psichy put me on trazadone 50mg/day for sleep, didnt do much for me. I have no money after, loose my job, and was living with my mom, but I relapsed on coke, and crack trying a coke IV rush, but it is nothing compared. 3 days binge, I am supervised closed now because mom got me snorting coke with a rock behind. Fuck, they think I was using for months, but it was a relapse, I am supervised 24/7 today, it sucks too.

Too explain everything, I am a borderline, I cut myself often, border type depressive one, to explain my meds, today I am on psych, and psicoterapy trying to have some reason to live.

Lost my girl, and my family, I am really depressed, got one more med, 300mg bupropion/day.

And now they will tapper me from meth and kpins, some tips for me? I am really messed up, and my anxiety got to the top, how bad is the tappering? 

Thx",1551311490.0
