7wc5oy,https://www.reddit.com/r/opiates/comments/7wc5oy/how_many_days_of_consecutive_use_can_it_take_to/,3,https://redd.it/7wc5oy,anudderbrudder,How many days of consecutive use can it take to develop dependance?,"Say if a person uses a small amount, say 20-40mg of oxy per day. how many days of this would it take for this person to start having withdrawals when they stop using? assuming that in this time they don't start to up their use and stick to 20-40mg spread out over the day.",1518165619.0
7wc5kg,https://www.reddit.com/r/opiates/comments/7wc5kg/switching_from_oxy_to_heroin_advice/,14,https://redd.it/7wc5kg,Excellent_Throwaway,Switching from oxy to heroin? Advice?,"Hey everyone,


Long time lurker/subscriber here (via my regular acct, but due to some of my friends (and former students) knowing that handle, I felt I should use a throwaway for this, I hope that's ok).  I have a quick question for everyone that I'm sure has been discussed before, but I have yet to find a thread here, or anywhere else (i.e. bluelight, etc) that seems to apply specifically to my situation.


I suffer from severe chronic pain.  As such, I've been taking oxycodone pretty regularly for the last 10 months or so (sporadically before that).  I've been able to manage this pretty well, generally I put up with my pain the best I can during the day and leave my doses until the evening - taking 7/5-15mg a nights.  Otherwise, I spend all night on the floor with my legs propped up sobbing.  I don't think I've ever gone over 30mgs a day.  Well, with the good ol' ""opiate epidemic"" gaining momentum, doctors are becoming increasingly less willing to give prescriptions - I lost mine and a friend of mine (who usually threw me her extras) lost hers as well.  Meanwhile, other connections for opiate pharmaceuticals are also few and far between.  So, I'm getting a little terrified here - not because of withdrawal or anything, rather over actual ability to function/sleep due to pain.  


So my question is this: how bad is the switch to heroin?  I'm not interested in injecting.  I'm not interested in chasing a rush.  I really, legitimately want to know how snorting or smoking heroin compares to orally taking oxy or snorting opana.  I'm not sure I would've considered it, but I have a friend who did oxy a fair amount and then tried snorting heroin and swore to me that it was pretty much the same.  Anyway, no matter how much oxy/opana I've had available to me, I have always been able to manage my doses...is that doable with heroin (again, only snorting or smoking, NO IV), or is heroin really this big, bad monster that is soooooo much more terrible and worse than oxy?  From everything I read, it seems like people are ALL over the board about it; some folks say they think oxy is better than heroin, others than heroin is better than oxy.  I know a lot of other threads that deal with switching from oxy to heroin would say that my daily oxy dose is pretty low and advise me NOT to make the switch because of that, but this isn't about money --- it's truly about availability, I'm simply unable to get oxy anymore.  Any advice would help.  I'm honestly desperate.


Thanks to everyone who reads and chimes in, you have no idea how much I really appreciate it.  ",1518165560.0
7wc44t,https://www.reddit.com/r/opiates/comments/7wc44t/maybe_someone_can_shed_some_light/,8,https://redd.it/7wc44t,emitpan00,Maybe someone can shed some light?,"I don't use drugs but my older does. His drug of choice is tar herion, right now he lives with our mom and myself and gets high on Suboxone maybe three to five times a day and absolutely denies it whenever we bring it up even though we found like ten packets of it in one of his pill bottles. He has a three year old daughter and if his baby momma ever found out he wouldn't be able to see her anymore. He is lazy and always nodding out and has abdominal pains because of the Suboxone. Is there anything that could help him stop abusing the Suboxone? Should I just take all of it away? Should I threaten to tell his baby momma? I'm not trying to be mean but he is 27 years old and does nothing. He doesn't have a job and sleeps all day because he is up all night. Is there someone with any advice? ",1518164922.0
7wc1lp,https://i.redd.it/r6k3d9w3b5f01.jpg,3,https://redd.it/7wc1lp,tiffntuff,Teeny Tiny Dope Porn.,,1518163867.0
7wbz6k,https://www.reddit.com/r/opiates/comments/7wbz6k/broke_my_last_syringe_out_of_money_what_do/,23,https://redd.it/7wbz6k,brokenhalo6054,"Broke my last syringe, out of money, what do?","Hey guys, first of all I already understand that I made a mistake relapsing, and there's no real good reason for it so I'll spare the details leading up to that.

So anyway, today after a 4 and a half month break, I decided to pick up a couple of bags.  Long story short, I took up a couple of very small shots in a burger king to get a feel for it again, and lo and behold when I got home my syringe had clogged, and I broke it trying to fix it..

So I started snorting it, and it just feels like such a waste.  I have no more money, and there's a blizzard out anyway.  I don't even enjoy it that much, it burns the fuck out of my nose (it's probably cut to shit), makes me nauseous, no rush, the whole thing makes me angry.  It makes me wanna pick up again as soon as I can because I couldn't get that satisfying high that I wanted.  Even after a 4 month tolerance break snorting it does almost nothing for me.  Almost.

So my question to you guys is; Is there a more effective way to ingest heroin other than snorting or injecting?  Or could I possibly make a syringe?  I still have the broken needle.  Everything is intact, the 'pull back' part with the plunger is just broken in half.  Thanks.  

P.S. Sorry if this is somehow against the rules.  I skimmed them before posting and it didn't seem like I was breaking any",1518162865.0
7wbwue,https://www.reddit.com/r/opiates/comments/7wbwue/oxygen_is_my_friend/,0,https://redd.it/7wbwue,hippocunt6969,oxygen is my friend,"only because oxygen allows me to breath oxycodone in my nose these lil blue guys got me going  
",1518161808.0
7wbw1v,https://i.redd.it/nj0en1e145f01.jpg,0,https://redd.it/7wbw1v,PandaBroads,Yeet,,1518161499.0
7wbuvl,https://www.reddit.com/r/opiates/comments/7wbuvl/tldr_junkie_jesus_in_the_form_of_a_homie_cast_a/,3,https://redd.it/7wbuvl,DragonChaser760,tldr: Junkie Jesus in the form of a homie cast a Restoration spell on me,"So me and this middle go back a bit, he's helped me out since the early days of RollKrawl was around and not shunned. Well fast foreword to the past couple months and shit has been hectic with a mixture of both me and him. 1st I openly admit one of the incidents was partly my fault, being a junkie in full blown withdraw and driving for 50mins I get to the spot and let him know I was there, all along the way I was updating him which I could have chilled a bit but just since its a drive I wanna guarantee it ya feel me? He's pretty annoyed at this point and I get the ""Chill the fuck out man, I'm 15mins away"" great....we all know what that means so I try and hang tight as I can and 15mins go by as if my skin was being peeled back every minute but I gave the demon 10 extra minutes to play with my flesh before I hit up my guy again. I got a response along the lines of  ""You're really starting to piss me off bruh, no money is worth this shit"" wooooooow!! I'm fucking floored!!! So I tell him to fuck off and punch the dash board a few times before I make the agonizing dry dick drive back home. That's one of the worst feelings that comes with being an addict, having everything assured and making a drive and getting ghosted and have to go back empty handed....ok.... now THIS TIME wasn't my fault at all and really quick cause I know you're thinking *why the fuck did you go back to him?* I was actually in his area one time and hit him up and it went fine, so we met up 2 times before THIS INCIDENT. I already have to drive far but this time he was right by the boarder which adds an extra 30-35 minutes to my trip but you gotta do what you gotta do when you're hurting. I make the trip while feeling the same fucking demon in the form of a child kicking the shit out of my lower back the entire hour and 45 minute drive cause my dumb ass chose a Friday to be sick and it feels fishy already. He's 'good' just waiting on the man to cross the boarder....uhhh ok fuck...15 minutes roll by and I follow up and now 'he's waiting in line to cross it'll be soon chill out' UGGGGH! What other choice do I have? 35 minutes pass and I'm super irritated and before I can send a text I get an address to go to. FUCK YEAH! Alright I head there it's a business complex so I hit him up to ask which building, a street, fucking give me an idea of where to meet for fucks sake. I'm sick of texting so I call him and guess what!? His Phone was off...., dead, fucking NOTHING!! I'm so fucking furious, I delete his number before making the fucking agonizing ride home with the little fuck demon co-pilot. one more fast foreword to today being in like day 3 of withdraw and I get a text from a random number that so happened to be him 'hey dude I have real ecp right now' which is strange cause I'm not on the East Coast...I'm broke as fuck  tho so respond with 'cool, im broke as fuck tho man' and he lets me know if I can make it out there he can help me out...da fuck? He said 'yeah man I really feel bad for what happened last time' Stunned I fucking make the drive and homie was straight legit and gave me some tar and some buds along with the ECP ....BAAAAM!!  High Level Restoration of faith in humanity cast on me. Fucking hell such a chill homie. ",1518161023.0
7wbt1k,https://www.reddit.com/r/opiates/comments/7wbt1k/took_percocet_for_the_first_time_threw_up_all_day/,6,https://redd.it/7wbt1k,unravelandtravel,"Took Percocet for the first time, threw up all day.","At around 1pm I took 22mg cut in fourths (3/4) of Percocet. I asked my friend to take me to get some food but he said it would be better to wait to see if my body would want to eat. I disagreed since I hadn’t eaten since 9am but he was the driver so I didn’t push too hard.  

  By 1:45 I wasn’t feeling much so I took the remaining 8mg. When it finally kicked in around 2 I felt amazing. Relaxed warm and TIRED. I decided I was still hungry but the second we got to the drive thru I had an intense urge to vomit so I just  ordered a bottle of water. 
  
  When we got to my friends house at around 2:30 I yakked the second we got out of the car. It was just Hawaiian Punch  (what I took the pill with) and a little bit of water since I hadn’t eaten. 

  Over the course of the day I vomited at least 7 times. By the third time there wasn’t any water left to throw up so I was just throwing up yellow stomach acid. I’ve felt nauseous all day and still do and was only able to keep down 2 bites of chicken noodle soup long after the perc had worn off.  


Edit: changed “remaining 8” to “remaining 8mg”
   
  
  ",1518160317.0
7wbst6,https://www.reddit.com/r/opiates/comments/7wbst6/can_never_deny_free_oxy/,10,https://redd.it/7wbst6,waxtelephone2,Can never deny free oxy,"Good buddy of mine scored x8 20 mg Oxycodone. Offered me some fat rails 60 mg each but I denied them as heart broken as I was. 

He has a girlfriend but she’s straight edge and takes over if he nods to hard. So he wanted to share with me. 

Contemplated it so hard I was kind of scared of taking them because my tolerance must be low so I didn’t. 

I should have but it’s whatever I’m glad I didn’t. First time going out in public in over a month straight",1518160225.0
7wbrd7,https://i.redd.it/lmqxmz9ny4f01.jpg,16,https://redd.it/7wbrd7,RoxyPoppin,School bus porn. And a couple A215s to hold me off until re up tomorrow,,1518159676.0
7wbl4r,https://www.reddit.com/r/opiates/comments/7wbl4r/fine_people_of_ropiates_do_benzos_weaken_the_rush/,5,https://redd.it/7wbl4r,Howismydriving95,Fine people of r/opiates- do benzos weaken the rush of h for any of you?,"I know that might sound dumb- almost everyone I know has said that the combination makes the h stronger- not necessarily potentiation, but you get the idea. However, for me, if I’ve taken benzos before having a shot, it seems to significantly weaken the rush. Or at least make it much, much more subtle. I was wondering if anyone else had similar experiences? I’d appreciate any responses, thank you. ",1518157315.0
7wbkm0,https://www.reddit.com/r/opiates/comments/7wbkm0/i_am_blessed/,9,https://redd.it/7wbkm0,dig-drug,I AM BLESSED,I just had some china powder inside of a folded up piece of paper sitting on top of my table and my stupid ass made a quick motion with my arm and the wind created by my motion made the piece of paper flip over off of the table and land on the ground right side up. As it was falling I felt my heart drop as I watched my product fall to the ground in slow motion. I picked it up in disgust and miraculously I looked into the paper and almost all of it was still sitting there. Nothing else but a higher being looking over me today  can explain the blessing I just got. ,1518157130.0
7wbi0q,https://www.reddit.com/r/opiates/comments/7wbi0q/anyone_read_midnight_line_by_lee_child/,0,https://redd.it/7wbi0q,Throwawayforshitt,Anyone read Midnight Line by Lee Child?,"Pretty good book. Does okay at presenting opiate addiction. Doesn't denigrate addicts, rather denigrates the fucked up shit that some specific addicts do. In my eyes thats straight.

Anyways great storyline",1518156229.0
7wbgnx,https://www.reddit.com/r/opiates/comments/7wbgnx/finding_stuff/,9,https://redd.it/7wbgnx,johnny_gilb,finding stuff,"so whats a place you have just found some pills. obviously excluding a cabinet or someones house, like i mean you were just minding your own business and found something and it was cool. anywhere you found multiple times? ",1518155787.0
7wber2,https://www.reddit.com/r/opiates/comments/7wber2/i_know_its_not_opiate_related_but_for_those_that/,2,https://redd.it/7wber2,HalfHeartedBootyCall,I know it's not opiate related but for those that play video games.....,If anyone plays Fortnight on the PS4 feel free to pm me and we'll play sometime.....,1518155155.0
7wbdzl,https://www.reddit.com/r/opiates/comments/7wbdzl/ex_oblivione_by_hp_lovecraft/,13,https://redd.it/7wbdzl,ExOblivion,Ex Oblivione by H.P. Lovecraft.,"I first read this story at age 17, now I am almost 40... It has always remained in my mind as a story of drugs, depression, and death. It reminds me of my own journey with opiates and my self-destructive nature. I've used my nickname for a long time... I'm getting better, but I could have unlocked that door at any time....

It'll only take a moment...

Ex Oblivione by H.P. Lovecraft

When the last days were upon me, and the ugly trifles of existence began to drive me to madness like the small drops of water that torturers let fall ceaselessly upon one spot of their victim’s body, I loved the irradiate refuge of sleep. In my dreams I found a little of the beauty I had vainly sought in life, and wandered through old gardens and enchanted woods.

Once when the wind was soft and scented I heard the south calling, and sailed endlessly and languorously under strange stars.

Once when the gentle rain fell I glided in a barge down a sunless stream under the earth till I reached another world of purple twilight, iridescent arbours, and undying roses.

And once I walked through a golden valley that led to shadowy groves and ruins, and ended in a mighty wall green with antique vines, and pierced by a little gate of bronze.

Many times I walked through that valley, and longer and longer would I pause in the spectral half-light where the giant trees squirmed and twisted grotesquely, and the grey ground stretched damply from trunk to trunk, sometimes disclosing the mould-stained stones of buried temples. And always the goal of my fancies was the mighty vine-grown wall with the little gate of bronze therein.

After a while, as the days of waking became less and less bearable from their greyness and sameness, I would often drift in opiate peace through the valley and the shadowy groves, and wonder how I might seize them for my eternal dwelling-place, so that I need no more crawl back to a dull world stript of interest and new colours. And as I looked upon the little gate in the mighty wall, I felt that beyond it lay a dream-country from which, once it was entered, there would be no return.

So each night in sleep I strove to find the hidden latch of the gate in the ivied antique wall, though it was exceedingly well hidden. And I would tell myself that the realm beyond the wall was not more lasting merely, but more lovely and radiant as well.

Then one night in the dream-city of Zakarion I found a yellowed papyrus filled with the thoughts of dream-sages who dwelt of old in that city, and who were too wise ever to be born in the waking world. Therein were written many things concerning the world of dream, and among them was lore of a golden valley and a sacred grove with temples, and a high wall pierced by a little bronze gate. When I saw this lore, I knew that it touched on the scenes I had haunted, and I therefore read long in the yellowed papyrus.

Some of the dream-sages wrote gorgeously of the wonders beyond the irrepassable gate, but others told of horror and disappointment. I knew not which to believe, yet longed more and more to cross forever into the unknown land; for doubt and secrecy are the lure of lures, and no new horror can be more terrible than the daily torture of the commonplace. So when I learned of the drug which would unlock the gate and drive me through, I resolved to take it when next I awaked.

Last night I swallowed the drug and floated dreamily into the golden valley and the shadowy groves; and when I came this time to the antique wall, I saw that the small gate of bronze was ajar. From beyond came a glow that weirdly lit the giant twisted trees and the tops of the buried temples, and I drifted on songfully, expectant of the glories of the land from whence I should never return.

But as the gate swung wider and the sorcery of drug and dream pushed me through, I knew that all sights and glories were at an end; for in that new realm was neither land nor sea, but only the white void of unpeopled and illimitable space. So, happier than I had ever dared hoped to be, I dissolved again into that native infinity of crystal oblivion from which the daemon Life had called me for one brief and desolate hour.",1518154917.0
7wbaui,https://i.redd.it/kljpuw5kh4f01.jpg,11,https://redd.it/7wbaui,soberasfuck,When you are sick and digging through foils only to discover...,,1518153927.0
7wba7h,https://www.reddit.com/r/opiates/comments/7wba7h/getting_my_dope_in_the_mail/,12,https://redd.it/7wba7h,pushingluck,getting my dope in the mail,mail lady comes around 9:30am but I have a doctor appointment at 3:30 tomorrow. if I do like .1 do you think i’ll be not looking high by the afternoon? or at least not have pinpoint pupils?,1518153727.0
7wba30,https://www.reddit.com/r/opiates/comments/7wba30/waking_up_cross_eyed_to_song/,1,https://redd.it/7wba30,cashmerepear,Waking up cross eyed to song.,"https://youtu.be/ktLf9TrziGM

Favorite album has to be self titled Sublime album. What's yours?
",1518153683.0
7wb90l,https://www.reddit.com/r/opiates/comments/7wb90l/would_you_rather/,13,https://redd.it/7wb90l,pillsonpillsonpills,Would you RATHER,"Get offered free 8 30mg oxy or 4 40mg oxymorphone. Both would be legit, free, and abusable. ",1518153323.0
7wb67n,https://www.reddit.com/r/opiates/comments/7wb67n/whats_the_best_way_to_hide_a_few_pills_on_a_day/,18,https://redd.it/7wb67n,SmokeNPills,What’s the best way to hide a few pills on a day long road trip?,"I’m driving somewhere in the next few weeks that’s going to take all day. The route is full of cops that search a lot of people so it’s dangerous to have anything on you. 

I’m trying to take a small amount. Like 4 blues and 8 kpins. 

Where’s the best place to put these to guarantee they aren’t found if i’m searched? 

Thanks in advance ",1518152475.0
7wb21i,https://www.reddit.com/r/opiates/comments/7wb21i/pm_doc_appt_in_the_morning_wish_me_well/,6,https://redd.it/7wb21i,Catman12000,Pm doc appt in the morning. Wish me well!,I’m not worried about UA or anything going wrong. Just hoping everything stays the same. Thanks y’all ,1518151203.0
7way0o,https://www.reddit.com/r/opiates/comments/7way0o/got_harassed_because_i_love_this_community/,15,https://redd.it/7way0o,pymmit,Got harassed because I love this community.,"Hey fam, I love it here.  Even though I'm clean, I like to help people stay safe, and even reminisce and chuckle with the only other people who understand. 

Just a bit ago in another subreddit I frequent about a show I love called Harmonquest I was deliberately researched, then essentially put on blast for all to see.

I might have to leave here, and come back someone new... somebody always ruins it for everyone... even the Internet nowadays.",1518149943.0
7watf1,https://www.reddit.com/r/opiates/comments/7watf1/op_40_question/,4,https://redd.it/7watf1,e8smakemegreat,OP 40 Question,"sup fellas,

So currently I use about 90-120mg of IR oxy a day in 30mg doses. My dude currently only has the OP 40s and is offering a pretty good price.. After doing some research on here and online it seems like everyone agrees that OPs are shit. Pretty much I was wondering if it's even worth it for me to grab these 40s and how many of them would I have to take in order to feel decent? If i take two 30mg IRs at once I feel a good high, so would 2 OP 40s have me feeling good? or just be a waste? Thanks!!",1518148593.0
7wapgc,https://www.reddit.com/r/opiates/comments/7wapgc/how_long_should_i_wait_to_do_my_oxi_i_did_a/,10,https://redd.it/7wapgc,XxLOGANIDUSxX,How long should I wait to do my oxi? I did a quarter of a 20mg sub at 8pm.,,1518147410.0
7waoj0,https://imgur.com/a/WoVJF,8,https://redd.it/7waoj0,IAmVerizonGuy,All my refillls over three ones! Just for thinking about they’re coming! Hang out in there!,,1518147135.0
7wan8j,https://www.reddit.com/r/opiates/comments/7wan8j/helping_a_friend_kickwould_appreciate_some_advice/,9,https://redd.it/7wan8j,kickout_thejams,Helping a friend kick...would appreciate some advice.,I have a friend who has been a dopesmoker for several months now in NYC.  He has no health insurance and doesn’t think he can really afford to pay out of pocket for a doctor.  He can’t take time off work because he has bills to pay.  He believes he can still work if only he could get a few subs to help with symptoms.  Is there any affordable or sliding scale program we can look into for him?  Would really appreciate any info so we can get him kicking  out the jams in good health.  Thanks for taking the time to read.  Stay cool y’all!,1518146733.0
7wai89,https://www.reddit.com/r/opiates/comments/7wai89/a_funny_thing_i_was_just_told_regarding_suboxone/,17,https://redd.it/7wai89,Op8d_,A funny thing I was just told regarding suboxone,"This ex of mine just told me that she doesn't wait anytime after doing her subs to do dope because if she wipes the blocker off the sub strip then she can still get high off opiates.

The blocker being the letter n on the strips. 

I tried to explain to her while thats great she is still getting high, the science of it all doesn't agree with her logic. Both the being able to wipe off the naloxone, and the naloxone being the cause of the blockage.",1518145380.0
7wac39,https://www.reddit.com/r/opiates/comments/7wac39/noddin_out/,60,https://redd.it/7wac39,Cocaineconnosieur,Noddin out,I’m buying around 100mgs of oxycodone in 5mg pills for me and a friend and am wondering how much to snort in order to get us each a decent nod. I’ve done them twice now but never got very high as I only did around 10mgs at once.,1518143672.0
7waa5d,https://imgur.com/a/QkvT1,4,https://redd.it/7waa5d,Wallaby_Way_Sydney,My New Phone Theme I Thought Y'all Might Like,,1518143124.0
7wa9zs,https://www.reddit.com/r/opiates/comments/7wa9zs/odbs_musical_shitpost/,1,https://redd.it/7wa9zs,OlDirtyBurton,ODB's Musical Shitpost,[Closure](https://youtu.be/kA68XGTp4nE),1518143077.0
7wa82w,https://i.redd.it/62fobmpqj3f01.jpg,10,https://redd.it/7wa82w,Manik209,Bth pickup,,1518142556.0
7wa62u,https://www.reddit.com/r/opiates/comments/7wa62u/dosed_15mg_of_hydrocodone_2_hours_ago_not_feeling/,23,https://redd.it/7wa62u,skinnymemedude22,"Dosed 15mg of hydrocodone 2 hours ago, not feeling high?","I have no tolerance and made sure to wait an hour and a half after eating, but I just feel itchy. Any idea why?",1518141995.0
7w9zo4,https://www.reddit.com/r/opiates/comments/7w9zo4/in_the_hospital/,8,https://redd.it/7w9zo4,OxyJay,In the hospital,"With severe stomach pains
I don't remember morphine being this good",1518140284.0
7w9yi0,http://fox59.com/2018/02/08/san-francisco-to-open-nations-first-heroin-injection-sites/,19,https://redd.it/7w9yi0,tydalt,Did I miss something or did nobody post this amazing news out of SF?,,1518139951.0
7w9w2i,https://www.reddit.com/r/opiates/comments/7w9w2i/a_funny/,1,https://redd.it/7w9w2i,yabadabadobadthingz,A Funny,The Maybelline tattoo brow gel commercial. Beautiful eyes. They are pinned. I’m sure from the lighting but do you guys check out eyes on the TV??  ,1518139300.0
