8vvc5h,https://i.redd.it/g9kx3e46hs711.jpg,56,https://redd.it/8vvc5h,foreverstayhigh,Beautiful liquid hydrocodone,,1530648108.0
8vvbwi,https://www.reddit.com/r/opiates/comments/8vvbwi/rant_fuuuuuuuuuuuck_the_usps/,62,https://redd.it/8vvbwi,Sovereign_Mind,[RANT] FUUUUUUUUUUUCK THE USPS,"god damn lazy fucking cunt ass pussy bitches I hope your children get type 3 hepaherpies with suicidal and patricidal inclinations and burn your souls to the ground.

NO PACK TODAY AND THEY CLOSED TOMORROW ALL ORDERS SHIPPED PRIORITY AT SATURDAY 7pm 
😂😂😂😂🔫🔫🔫🔫 JOKES ON ME ASSHOLES

(I know its not the post office fault but I gotta blame someone right?)

GUESS ILL JUST HAVE TO WAIT UNTIL THURSDAY *maniacal laugh*😂😂😂😂",1530648059.0
8vvab2,https://www.reddit.com/r/opiates/comments/8vvab2/what_is_it_like_to_be_an_heroin_or_opioid_addict/,33,https://redd.it/8vvab2,team_satan_666,What is it like to be an heroin or opioid addict?,"I’m a stoner myself, the only drugs I do are psychedelics but I’m curios, what is it like to be addicted to heroin or opioids In general? Like what type of lifestyle do you live?",1530647700.0
8vv7ed,https://www.reddit.com/r/opiates/comments/8vv7ed/the_lies_we_tell_ourselves/,3,https://redd.it/8vv7ed,lebrunjame5,the lies we tell ourselves,"woke up.. told myself i was gonna save my last 30 for late tonight so that it doesnt wear off by the day’s end.. 

it is now 3:45pm.. i am leaving work early and ima comin for that oxy",1530647082.0
8vundb,https://imgur.com/3WwAFOK.jpg,16,https://redd.it/8vundb,phytop,A Happy #4's Eve To My Boys Wit sTrapS,,1530642947.0
8vugsf,https://www.reddit.com/r/opiates/comments/8vugsf/does_promethazine_poteniate_just_about_every/,7,https://redd.it/8vugsf,foreverstayhigh,Does promethazine poteniate just about every opiate or does it poteniate some more than others?,,1530641593.0
8vu0c1,https://www.reddit.com/r/opiates/comments/8vu0c1/heroic_drug_dealer_vaccinates_poor_in_brazil/,7,https://redd.it/8vu0c1,Johndough1066,Heroic Drug Dealer Vaccinates Poor in Brazil,"A few days ago I asked about good drug dealers, but this guy takes the cake! He literally has just saved countless lives.  

https://www.google.com/amp/www.newsweek.com/gang-boss-who-kidnapped-nurses-vaccinate-poor-hailed-modern-day-robin-hood-808675%3famp=1",1530638351.0
8vtwgm,https://i.redd.it/v90c7yztlr711.jpg,44,https://redd.it/8vtwgm,PatchworkNeurology,Lemme help,,1530637571.0
8vtus5,https://www.reddit.com/r/opiates/comments/8vtus5/how_do_i_stay_off_this_shit/,6,https://redd.it/8vtus5,CaliforniaDreamWalk,How do I stay off this shit?,"Last night I finished my last cap, I have $1350 and some change in the bank and just sent my rent check in the mail for.. $13 fucking 50. 

It's taking everything I have not to dip into it and go get a couple caps to have a good day and be happy and feel normal. I had to quit my second job and my day job is closed all week so I have no money coming in and I need to get a job at night but I'm miserable mentally and physically and all I can think about it going out and getting a cap before my girlfriend gets home at 3 who thinks I've been clean.

I don't know what to do right now,",1530637263.0
8vtqsc,https://www.reddit.com/r/opiates/comments/8vtqsc/what_analog_am_i_getting/,15,https://redd.it/8vtqsc,AngryChair007,What analog am I getting,"Hello all, hope everything’s going well for everyone today. Now I wanna know, can someone give me a basic rundown of which each fent analog feels like/what it’s effects are? I know there’s a lot of them but describing the effects from all the ones you may have experienced or know about will help. I get fent dope but I wanna know what analog (if it is one) I’m getting. I know there’s no way to tell without a test kit but idk if they make them for analogs and I also don’t wanna have to test for every analog if they do. Thank you for the help in advance 

 Tl;dr I wanna know the effects of as many different fentalogues as possible to see what they are like and possibly compare it to the stuff I get. Thanks ",1530636464.0
8vtkrx,https://www.reddit.com/r/opiates/comments/8vtkrx/40_on_the_way/,15,https://redd.it/8vtkrx,idgafsolid,$40 on the way ...,"I'm going to try my best and not use it for opiates. I really am having a harder time than I thought coming off around 100mg Oxy a day. My Uncle is nice enough to help me out with the money but I don't want to reset yet. Shitpost, I just hope I have the will power. ",1530635256.0
8vt71n,https://www.reddit.com/r/opiates/comments/8vt71n/i_just_got_stabbed_virtually_by_rdrugs_ropiates/,41,https://redd.it/8vt71n,seemeoverhere,i just got stabbed virtually by r/drugs. r/opiates help me out,"u guys prob know way more then me but r/drugs i asked them if lsd will work good with heroin. and usernames with 420 in it wanted to attak me calling me a moron and stupid. there definitly not past the age 14. oh well im a mature adualt.

so um do u guys know if lsd will work on heroin. im already on heroin and i just wanna go to the city firework show in 10 hours. the lsd is gooood so let me know :)

love u opiate family. no homo :) happy thjrd  july ",1530632450.0
8vtaj7,https://www.reddit.com/r/opiates/comments/8vtaj7/twenty_eight_day_one_dopesickness_and_depression/,16,https://redd.it/8vtaj7,guiltparade_,"Twenty eight, day one: dopesickness and depression.","What a way to spend a birthday. I've already used up a lifetimes worth of JJs. Would anyone else also rather be sick in the winter?

Edit @ 4:33 EST: Meeting dude in 5 minutes for a b and a half. I'm so ready ugh. Only ten more minutes tops til I'm feeling well. 

Thsnks for all the positive vibes fam. ",1530633189.0
8vt0q1,http://imgur.com/fRshFb3,96,https://redd.it/8vt0q1,DillyQueen,"Tried to OD intentionally, 2 grams of ECP and 40mg of Xanax. Now I’m here. Maybe this will make me get clean. Love all yalls faces.",,1530631110.0
8vt03h,https://www.reddit.com/r/opiates/comments/8vt03h/bth_question/,12,https://redd.it/8vt03h,hotmesssExpresss,BTH question,"Long time lurker but this is my first post. Thought you guys could answer a question for me. 

Got some BTH that won't smoke. It just sizzles a little and expands almost like those little black snake fireworks. Tastes awful too. Any suggestions on how to smoke it or should I do it some other way?

Thanks and much love for my opi fam! ",1530630986.0
8vsnc4,https://ibin.co/47Q3JvD83C9u.jpg,20,https://redd.it/8vsnc4,Leobardo_da_Vinci,Breakfast of champions! Nice to wake up to when you haven't had anything left to wake up to in months.,,1530628273.0
8vsmnh,https://www.reddit.com/r/opiates/comments/8vsmnh/score_one_for_the_team_that/,7,https://redd.it/8vsmnh,ohthatsreallycool,Score one for the team that...,...forgets where they put their drugs and then finds them later! It’s like giving a present to yourself!,1530628129.0
8vrsqm,https://www.reddit.com/r/opiates/comments/8vrsqm/withdrawal_weapons/,28,https://redd.it/8vrsqm,KravenMoreHead888,Withdrawal weapons,"So I am about to hop off the train. Haven't been on my worst bender but have been doing dope in Thailand for about 3 months straight up to a half gram a day. I snort never shoot. I have access to dope but it's time to save money and reset the receptors.  Anyways this time I have access to many weapons to fight the evil ninja that is known as withdrawal. 

First I will be using loperamide also known as Immodium to start the battle.  He is bringing his friends omeprazole and cimintedine to give him strength and I'm thinking to use him for the first 4 days. 

Next to the battle is gabapentin.  Thailand is actually pretty unique in the sense that you don't need a script for gabapentin or lyrica so u can get as much as that as I need.  If anyone has any advice as to how much to use of either other both substance then I think we might be able to put a whooping on withdrawals ass. Also plan to use for 4 days.

Finally I want to finish withdrawal off with the weapon of the angels : Tramadol.  I'm not a huge fan but it's also otc in Thailand and it helps with the paws although I know it can be addictive as well. 

Anyways.  Please if anyone has any advice or dosage recommendations I would really appreciate it. I have to work full time and I can't be a dope sick idiot.  I've had a lot of success with gabapentin in the past but I don't remember how much and I don't think I liked the side effects.  Lyrica might be worth a shot.

Thanks for the tips!",1530620944.0
8vrp2d,https://www.reddit.com/r/opiates/comments/8vrp2d/how_ive_been_able_to_poo_lately_on_the_regular/,10,https://redd.it/8vrp2d,igottheblues1,how I've been able to poo lately on the regular,"before i go to bed i eat a couple of stool softeners, then i wake up i smoke between 4-5 cigs over the course of about an hour, put on pants that are very tight in the gut region, drink 2 cups of coffee and then bam! it's been working for about a week now so i thought I'd do a psa and share",1530619961.0
8vrn92,https://i.redd.it/ewlo34d04q711.jpg,17,https://redd.it/8vrn92,KravenMoreHead888,Thailand dope,,1530619476.0
8vrkaj,https://www.reddit.com/r/opiates/comments/8vrkaj/endocet/,21,https://redd.it/8vrkaj,atetoomany,Endocet.,"Hey guys longer time lurker and and a few time poster. How do y'all feel about endocet? Just v got prescribed 90 of em and they for me work fucking great. Woke up and sitting in the bath feeling awesome typing this. 
What's y'alls thoughts on it?",1530618623.0
8vrdeo,https://i.redd.it/s9w7vsy5vp711.jpg,17,https://redd.it/8vrdeo,g0uchp0tat0,When prescription day finally rolls around. 5 days never seems so long when you're waiting for that trip to the pharmacy,,1530616502.0
8vrc0z,https://www.reddit.com/r/opiates/comments/8vrc0z/snorting_subs_and_how_tf_do_you_search_on_here/,5,https://redd.it/8vrc0z,BlueJeanBabyBlues,Snorting subs and how TF do you search on here?,"I’m obviously not that tech savvy, how the F do you search for past topics and poss on the app??  I know it’s been answered but, what’s the deal with snorting suboxone tablets?  Does it get you high?  ",1530616071.0
8vr8z0,https://www.reddit.com/r/opiates/comments/8vr8z0/where_is_my_shot_did_i_cook_it_yet_did_i_spill_it/,6,https://redd.it/8vr8z0,heroinista,Where is my shot? Did I cook it yet? Did I spill it?!,"OH. I’m super high. I already cooked my shot. The cooker is empty because I already drew it up in the rig. The rig is empty because I already banged my shot...

Does anyone else ever do this immediately after banging a shot?! It’s the weirdest thing, it’s like I nod out for a couple seconds or maybe longer, and then when my empty rig catches my eye my mind starts racing until I have a moment of clarity and snap back into reality. 

Anyone else do this kind of stuff when you’re high?  Hope everyone on here is having a good night/morning!",1530615104.0
8vr3gc,https://www.reddit.com/r/opiates/comments/8vr3gc/opioids_nicotine/,3,https://redd.it/8vr3gc,LetsGetFloated,Opioids + Nicotine,"I started taking opioids 3 years ago. I remember, that I had to vomit when I smoked cigs while on oxy or other opioids. I am wondering why? Whats the reason?",1530613213.0
8vqv78,https://www.reddit.com/r/opiates/comments/8vqv78/looking_for_a_movie_that_will_good_to_watch_on/,27,https://redd.it/8vqv78,kurapikachu64,Looking for a movie that will good to watch on dope. Feeling a comedy.,"I usually have music playing when I get my nods on, but right now I feel like having a comedy film. 

Suggestions? Something funny and okay to fade in and out of. A rewatch of something is totally fine, but I'm already pretty high and just feel too lazy to pick something myself. Came to you dope ass people for ideas of what to watch. Would appreciate the help.

Hope everyone is having a good night/day, stay safe and happy nods to all.",1530610435.0
8vqtb4,https://www.reddit.com/r/opiates/comments/8vqtb4/yesterday_was_my_birthday/,14,https://redd.it/8vqtb4,jf209,Yesterday was my birthday,"This is my third relapse with H/opiates. This time was a six week stint and I burned through every dollar I had/lost a very reasonable job (20/hr). I’m lucky to not be homeless right now as my roommate is a good friend/great person. He also feels somewhat responsible for my relapse as he provided me with the dboy connect. 

It’s been about eight days since I last got high. I have an appointment on Thursday with a physician whom I’m gonna try and get a sub script from. I’ve been using Fent patches to hold off withdrawals provided from a family member that’s been helping me out. 

All I can say is that this is my worst birthday yet. I’ve never enjoyed my birthdays. Low self-esteeem, depression, etc. but all I thought about yesterday was how much I’ve fucked my life over in a few weeks time and how all I want is to get high. 

This stupid fucking drug had ruined my life yet again. I’m back at square one and I’m getting too old to start over again. I have basically no life skills nor do I really have the familial support to keep doing this. I’m lucky I’m not homeless again.

I don’t know. Just needed to vent a bit. This sub is the only place I find community. I just don’t know how to do this shit sober. ",1530609775.0
8vqqhm,https://imgur.com/WlCS0Vo,23,https://redd.it/8vqqhm,MonkeytheFunkyJunkie,Every time,,1530608774.0
8vqnqq,https://www.reddit.com/r/opiates/comments/8vqnqq/i_wrote_yall_a_poem_prolly_pulitzer_prize_material/,18,https://redd.it/8vqnqq,undadub,I wrote yall a poem (prolly pulitzer prize material),"    I miss...    
    ...I miss when my wife found my works n thought they were pens n orange caps.
    ...I miss doing shots on the toilet, mid-crap
    ...I miss abusing all my Amexs and Venmos
    ...I miss winning arguments by slipping folks benzos
        
    ...I miss when she didn't know know the distinct smell of crack
    ...I miss blaming energy drinks for my eyes bein wack
    ...I miss bandos, motels and dopefiends that trick
    ...I hate it when xanax dun fuks with my dick
    
    ...I miss when people used to Western Union me money.
    ...I miss open air drug markets, snowy or sunny
    ...I miss when my wife couldn't tell when I raided her debit
    ...Cause lawd knows i cant do shit w my 420 credit
    
    ...I miss speedballs, D, and my trusty ol' glock
    ...I pray to the lord I don't shoot off my cock
    ...and if I got to be honest to a certain degree
    ...I'm still really pissed I havent died by OD


((Apologies for the horrible formatting.))",1530607791.0
8vqnlh,https://www.reddit.com/r/opiates/comments/8vqnlh/a_serious_question/,11,https://redd.it/8vqnlh,uncle_fam,A serious question,"Why do people overdose and how can I prevent myself from an od?

I use xanax and morphine. Any advice would be greatly appreciated. I don't snort or inject only oral ingestion.",1530607731.0
8vqk3a,https://i.redd.it/yepz7n731p711.jpg,20,https://redd.it/8vqk3a,ToxicCandi,"Heh , unspeakable things 😏.",,1530606380.0
8vqay9,https://www.reddit.com/r/opiates/comments/8vqay9/i_want_all_of_you_to_know/,85,https://redd.it/8vqay9,HelpfulPerson703,I want all of you to know,"Hey guys, I deleted my post because it blew up a lot quicker than I was expecting and I felt paranoid about it reaching someone we knew. I'm amazed and overwhelmed by the outpouring it got. Please, please take care of each other.",1530603126.0
8vqcum,https://imgur.com/1eUTrox,10,https://redd.it/8vqcum,The-Crimson-Fuckr,K57's for breakfast. Mornin' you guys,,1530603758.0
8vq9dh,http://imgur.com/W2AtITC,7,https://redd.it/8vq9dh,Stone998,More really good gunpowder,,1530602586.0
8vq827,https://www.reddit.com/r/opiates/comments/8vq827/important_question/,8,https://redd.it/8vq827,FrmBURGHinCHI,Important question!,"I think I've seen someone ask this before ... Not sure if an accurate answer was given...
I have to go visit my family for 3 days coming up in the next couple weeks. I really won't have the time or privacy to fix up shots for myself while I'm there. If I were to make up 6 shots for the stay there... Do you guys think they will stay good? AT LEAST good enough to keep me well? If not, does anyone have any other suggestions that might work? Anything quick enough to seem like I'm just peeing? Lol... Help me! In all the years I've been doing this shit I've never had to do this. Its really important they don't suspect shit bc I'm ""two years clean"". I'm having enough issues figuring out what to do about my tracks. Ugh... Family. I wish it would just be acceptable to not go. Fuckkkk. ",1530602131.0
8vq729,https://www.reddit.com/r/opiates/comments/8vq729/at_least_some_people_are_understanding_in_this/,22,https://redd.it/8vq729,AgingHippieLiberal,At least some people are understanding in this world.,"For some reason almost everyone I deal with in the drug game is irrational and impatient. I middle for a few people to buy pills (don't worry, I'm not one of those asshole middles, I don't even ask to get paid for the deal, I only take extra money when its offered) and whether its the plug being late, out, or any little hiccup in the deal I almost always get constantly bitched at until the deal is done. Except for this one dude, we'll call J. 

J is the coolest dude I know. When he wants something, he gives me the cash, tells me what he wants, and no matter what happens he's cool with it. One time my plug was about to reup so I got the cash and went to the plugs house. I got there before the delivery so I was there as it got dropped off and they were presses. I didn't pay anything yet so I still had his cash, and when I called to let J know what was up he said no biggie, hold onto my cash and get them whenever you can. I never take advantage of him being so chill, I just really appreciate knowing someone who understands the struggles. 

Just today he placed a big order and since my main was out I had to go through a backup. I checked them and they looked good, but when I got home the imprint was all fucked on all but one pill. I tell J I got fucked over but I'll make it right on payday. He says no problem, he just wants the legit one. I'm normally able to drive to him but tonight I couldn't, and I know J has a suspended license so he shouldn't be driving so I tell him if i can find a ride ill be there. He says he'll risk it and drive to me. 

When he got here I apologized like hell, told him to just give me a few days and ill set things straight. Again, he's totally calm and cool about it, and then he hands me some cash for the trouble. No matter how many ways I tried to tell him not to pay me for losing his money he won't let me turn it down.

Sorry I know this post has no real point but I've been smoking crystal all night and as we all know it makes you want to share everything with anyone who will listen",1530601812.0
8vpp4k,https://www.reddit.com/r/opiates/comments/8vpp4k/do_yall_get_more_creative_on_drugs_at_first_i_did/,8,https://redd.it/8vpp4k,Painkiller830,"Do y’all get more creative on drugs? At first, I did. Then slowly but surely, I was believing I was being creative when really the drugs were just dulling my senses and minimizing my imagination so to speak",,1530595981.0
8vpntk,https://soundcloud.com/perky_jackson/1-13-18a?in=perky_jackson/sets/perky-jackson-tracks,16,https://redd.it/8vpntk,FlippdScript,"Lurked for years, check this shit out honest feedback is appreciated",,1530595599.0
8vpkc0,https://www.reddit.com/r/opiates/comments/8vpkc0/should_i_just_quit_my_job_more_info_below/,23,https://redd.it/8vpkc0,texasguy99,Should I just quit my job? More info below.,"So I’ve been iV’ing heroin since about 2 weeks out of rehab in March. I’m finally at the point where my tolerance is going through the roof and my veins are hard to find. There are many days where I end up late to work Bc it takes me an hour to hit. Or Bc I have to wait on my drug dealer and I don’t feel like going to work dope sick. Basically this addiction is making me a horrible employee and very inconsistent. Ive been looking for other jobs and I don’t necessarily have the best job. I could find a similar job probably in a week. 

I also drive for Lyft on the side so I could do that full time for a little bit until I find a new job. Just asking is it even worth it to keep working this job right now? Or should I just quit and concentrate on getting better? And then I can Lyft for cash while I look for a new job. I also recently signed up for an online teaching certificate program and I’m just waiting to hear back to see if I’m accepted. 

I really don’t wanna lose my job but I’m really starting to think it’s not worth it. I’m so stressed out and basically every other day I feel like I’m late or trying to get out of work Bc of some heroin related problem. I’m just in a really bad place right now. Any advice would be great right now. Let me know what y’all think. ",1530594557.0
8vpjjj,https://i.redd.it/dkpbjat81o711.jpg,12,https://redd.it/8vpjjj,jlogic420,"God I love roxi. Pop 4-5, snort 1-2 and 2 dillies 10 Mins later and I'm floating. Redose as necessary.",,1530594333.0
8vph8z,https://youtu.be/e6YYRLfUZ5M,7,https://redd.it/8vph8z,arebee20,fuck with this song heavy thought you guys would too,,1530593682.0
8vperk,https://i.redd.it/pnsk0hz8xn711.jpg,5,https://redd.it/8vperk,nadimishka,"Maybe a repost, who knows, still related so hard though",,1530592980.0
8vpca8,https://i.redd.it/55nj0x63vn711.jpg,14,https://redd.it/8vpca8,Omarffomthewire,I have the sudden urge for fruit stripes gum.,,1530592255.0
