8d19xy,https://www.reddit.com/r/opiates/comments/8d19xy/how_many_of_you_dont_actually_want_to_stop/,1,https://redd.it/8d19xy,Xxnoah69xx,How many of you don't actually want to stop?,"I'm sure that most people who have been abusing opi's long term wish they would have never even started, but I'm curious as to how many people have no interest in stopping. For the past 3 almost 4 years now, I've been able to keep my habit well under control. I only do pills (oxy and tramadol) as heroin is a much more slippery slope. I'm only 20 and as of recently I am now basically the boss at my great paying job meaning I am in charge of guys almost double my age because no one works even close to as hard as I do. I had my first few experiences with PK's when I was a sophomore in highschool. One of the kids in our stoner friend group had some sort of muscular atrophy condition I believe it was so he was always had a ridiculous amount of pills he would hand out to us like candy. The first few times I tried hydro and oxy it was fun but nothing I would go out of my way to get. It wasn't until a few years later that I tried again that my love for opis really started. I used to be a huge stoner because it would work wonders for my anxiety and depression up until I had a full blown nightmare acid trip. Ever since, weed has been ruined and that was about 4 years ago now. I do use them everyday after work. It might sound dumb but I have a personal rule where I won't get high until 5:00 or later if I'm still at work. I never work while high. I redose once at 8:00 or 9:00 and will very rarely redose for a second time. I never go more than a few weeks at a time without taking a tolerance break so that I don't become too physically dependent. I don't enjoy any other drug at all really and I have no intention of stopping anytime soon. I don't see anything wrong with my drug use as it's not hurting anyone else, it doesn't get in the way of my responsibilities. Addiction and health issues aside, I see my drug use no different than someone who get's stoned or has a few drinks every night. The concept is the same. ",1524009452.0
8d185f,https://i.redd.it/fnzwkhxq3ks01.jpg,0,https://redd.it/8d185f,suzymariee,Fentanyl.... been getting this consistently for a year now. I dont think there's any real h around here,,1524009019.0
8d16sr,https://i.redd.it/49jyevqs2ks01.jpg,1,https://redd.it/8d16sr,Mikeydeez883,It’s about that time. Today is a good day.,,1524008699.0
8d16ge,https://www.reddit.com/r/opiates/comments/8d16ge/what_would_burn_super_bad_to_snort/,5,https://redd.it/8d16ge,OpiLobster,What would burn super bad to snort?,My friends dumbass wife keeps trying to steal my shit. She thinks she can trick me into letting her hold it by saying she ll take care of it so no one steals it or will ration it to me when my plugs out of town so I don't run out too soon. Of course she just wants to get into it. What would burn really bad to mix w cut?,1524008617.0
8d15ix,https://www.reddit.com/r/opiates/comments/8d15ix/help_allergic_reaction/,2,https://redd.it/8d15ix,Durtsqwurt,Help? Allergic reaction?,"I take 90mgs at a time of oxy about 3-4 times a week. Been doing this for two years and no problem except how damn expensive it is. However I just took 300mg of codeine and I’m pretty sure I’m having an allergic reaction. I just took a promethazine 12.5 mg to help counter the swelling in my wrists and fingers and it may be helping but I would like to know if I should bite the bullet and go to the ER or wait a little bit  ps. Don’t get I on a high horse about how bad too much Tylenol is for me. Because I know. 
Thanks",1524008383.0
8d156m,https://www.reddit.com/r/opiates/comments/8d156m/question_about_relapse/,3,https://redd.it/8d156m,kawi_l0ve,Question about relapse..,"So I’ve been clean off all opioids for about 65 days, and I just decided to dance with the devil again.. 
So far I have snorted half a generic OxyContin 80mg, how much can I do before I’m in withdrawal territory and how many days in a row can I use? 
Been down this road far to many times before and I don’t want to go threw withdrawals again.. I know it was stupid to pick up but I have been so miserable and it’s almost my bday and needed some relief!!

",1524008298.0
8d11bu,https://www.reddit.com/r/opiates/comments/8d11bu/whats_your_funniest_opiateopioid_story/,10,https://redd.it/8d11bu,-moose-squirrel,What's your funniest opiate/opioid story?,"What I find to be very funny from my perspective is when I'm talking to my unknowing family about how bad heroin is while I am near nodding off with pupils pinned as hell. It may not sound funny and it may actually sound damn near mean, but I think its funny how people can look over obvious clues (that I educated them about) and not know I am using. 

When I get itchy from heroin, I even say, ""I'm getting itchy again, must be the heroin."" and they just laugh like I am just joking, or when I go to buy my heroin, I straight up say, ""well, I gotta eat breakfast first, get my heroin, then I can pick you up.""

Maybe it's my way of convincing myself I am not lying to them to not feel guilty, idk. Does anyone else do this or joke about their use?

Tell me your funniest opiate/opioid related story. ",1524007330.0
8d0xop,https://www.reddit.com/r/opiates/comments/8d0xop/tips_on_iv_drug_safety_from_a_medical_professional/,23,https://redd.it/8d0xop,benz0babe,TIPS ON IV DRUG SAFETY FROM A MEDICAL PROFESSIONAL,"If you are going to go ahead and choose to IV your drug of choice then you might as well be as safe as you possibly can while doing so. So I am a trained phlebotomist which if you don’t know is somebody that taps veins and draws blood all day long. Below is a list of tips you should ALWAYS follow when shooting to preserve your veins, heart, and avoiding infection. 


CLEANLINESS/ STAYING STERILE:
Before beginning your session, always make sure that your hands are WASHED CLEAN and that the area that you will be having your substances and rigs is clean as well. 
Please I cannot stress this enough, use a brand new needle every time. Do not ever share needles with anybody else as well.  You can purchase them on Amazon in bulk for very very cheap. There’s no reason you should be using dull and all needles.
Clean the injection site with alcohol swab, rub the swab in a circular motion for 15 seconds. It should be 70% alcohol or higher.


 NEEDLES:
Use a new needle every single time if you can, if not use it only up to 4 to 5 times tops if your budget is tight. This is because the duller the needle gets, the more damage and scarring it will cause to your veins that is irreparable and nobody WANTS track marks. This is KEY to keeping your skin and veins in as good as a condition as you can while shooting. You wouldn’t even know I shot.

If you do reuse a needle rinse it and sterilize it if possible you can boil them in hot water on the stove. If you cannot boil it, make sure you thoroughly rinse it and store it with the cap on in a sterile place. I was also just told bleach is just as effective if not more!! May even be as easier option. 

Use the smallest gauge needle that you possibly can. This will obviously cause the least amount of damage.

And obviously before administration, make sure all air bubbles are removed my tapping the side of the syringe and pushing the remaining air out.

FINDING A VEIN:

Stay away from veins in your feet, 

Constantly rotate the sites that you use. It is not smart to keep going up or down a vein a half an inch and shooting multiple times in that area. You should let it rest and use a different spot.

Try to use your ante cubical which is the center vein in the ditch of your arm. If not, use any vein that is large and easily accessible. 

When tourniquetting, the rule of thumb is 4-6 inches above the injection site. Make it so that you can remove the tourniquet while injecting. I do this by having the end of it in my mouth or having a belt wrapped around under my thigh and up and over my arm and doing it that way.

Make sure the bevel of the needle which is the pointed opening is FACING UPWARDS. This is proper practice and less damaging to veins. 

If you are in a vein and did not register, DO NOT DIG AROUND. Pull out, get the air out, and attempt again. I CANNOT stress this enough!! This causes major scarring and damage to your veins. Think of it as taking a knife and cutting up your veins. Not good.

If you are using veins on your forearm that tend to roll you can use your tourniquet above the site as well as one below to keep the vein from rolling. 

Drinking water will help keep your veins open and more easily accessible so make sure to drink water and keep hydrated always. This is honestly a huge huge tip especially for people with smaller veins.



SHOOTING:

Once you have registered, pull back slowly and push a little bit in, register again and pull the plunger back to make sure you are still in the vein, push a little bit more in and register one more time to make sure you were in the vein. This is also a ridiculously important part. You will never ever get an abscess if you register three times. It makes me cringe when I see people register once and then slam the rest of the syringe.

As you are pushing the plunger in for the last push, you should be removing the tourniquet at this point. You MUST leave the needle in before you take the tourniquet off so that pressure is not shooting towards the injection site. This will cause bad damage to your veins and major bruising. 

AFTER THE SHOT:

Once you have removed the tourniquet, slowly remove the needle and have a paper towel or tissue ready to place MODERATE pressure on the site for a least a minute. This will prevent brusing. 

Put on a bandaid with a fresh piece of rolled up paper towel under it so it applies pressure and enjoy your high! 




SORRY FOR THE LENGTH! But this stuff is all so important guys. You literally cannot even tell I shoot up because of these practices. Enjoy guys! And PLEASE me know if you have any questions. I am more than happy to help you guys out with being safe. Message me anytime. 



 


",1524006445.0
8d0xb6,https://www.reddit.com/r/opiates/comments/8d0xb6/harm_reduction_resources/,0,https://redd.it/8d0xb6,Lynnekha,Harm reduction resources,"I'm a harm reduction nurse and I'm currently doing some research on different online communities that people use to talk about keeping themselves and their friends safe. I found this, and I'm looking around for some other spots, but I thought I'd ask for advice on any facebook groups/other subreddits/blogs/etc where people go to navigate things. Can anybody help me? TIA",1524006359.0
8d0w3j,https://www.reddit.com/r/opiates/comments/8d0w3j/nateoxne_and_use/,6,https://redd.it/8d0w3j,erudite1994,Nateoxne and use,I am supposed to get my shot on Monday. Would one 30mg blue make me sick if I got the shot? Would it be dangerous? I just want to use one more time before I never use again.,1524006079.0
8d0v1w,https://i.redd.it/55pcomt8ujs01.jpg,1,https://redd.it/8d0v1w,piKurp0ison,Exactly how I look after doing this lol #onlythebest #qualitynnquantity #safenodes,,1524005834.0
8d0utu,https://www.reddit.com/r/opiates/comments/8d0utu/update_to_fentanyl_warning_system_and_policies/,1,https://redd.it/8d0utu,KickerS12X,Update to fentanyl warning system and policies related to it,"Starting tonight there are going to be some changes to the way that we handle the fentanyl warnings and the information associated with them. Right now when someone submits a fent warning we lock the post and 'sticky' it to the top of the page. This system used to work really well back when the vast majority of heroin was.....HEROIN! and not the other way around, as we can only have 2 things 'stickied' at once and we might have 3-4 warnings in one day.

There will now just be one post stickied to the top of the sub titled 'Fentanyl warnings and information' or something similar to that. Inside this post there will be some information that is common sense to some, and valuable to others; like where to purchase fent test strips, signs of fentanyl dope, and other stuff like that. There will also be all of the fentanyl warnings that have been submitted to us listed from most recent and getting older.

**You guys will still submit the fentanyl warnings the same way that you have been** and we will continue to lock them, but they will be compiled, linked to, and organized inside this one post at the top of the sub. There will also be some additional features added like searchable flair and some other little things.

If anyone has any questions or comments feel free to leave them here and we will address them. Thanks folks!

* Kick and the mod team",1524005778.0
8d0qx7,https://v.redd.it/cwfzfypwqjs01,15,https://redd.it/8d0qx7,benz0babe,*Shooting vid* I love seeing a register so for those of you that do too... here’s a shot I just took. Dozing like a bihhh right now. Enjoy :),,1524004855.0
8d0ptp,https://i.redd.it/uqbxhvngqjs01.jpg,5,https://redd.it/8d0ptp,EskomojoE,"mainly benzos, but opiates will always have my heart",,1524004557.0
8d0ok7,https://www.reddit.com/r/opiates/comments/8d0ok7/in_a_hurry_to_wait/,1,https://redd.it/8d0ok7,admiral_hastings,In A Hurry To Wait,"Sitting at the bar, trying not to be nauseous so I can drink enough to steady my hands for my shot.. 

""Where we`re going we don't need veins..""

Is anyone waiting to cop?
Have you scored? 
",1524004258.0
8d0m6j,https://soundcloud.com/g59/marlborosandwhitewidow,11,https://redd.it/8d0m6j,dopenpizza,"Gave up lean and sprite cause, that heron keeps me duckin",,1524003699.0
8d0ki2,https://i.redd.it/31axjowrmjs01.jpg,15,https://redd.it/8d0ki2,BigLegSmallArm,Identifying what type of H this is,,1524003323.0
8d0isd,https://i.redd.it/6dwpi0slljs01.jpg,4,https://redd.it/8d0isd,DontRuinUs_GodSaid,Real or pressed? Came across E8’s for the first time. Anyone?,,1524002923.0
8d0g8f,https://www.reddit.com/r/opiates/comments/8d0g8f/shitty_middleman_stories/,4,https://redd.it/8d0g8f,makethecan,Shitty Middleman Stories?,"I was just reminiscing about a time before I got a good plug.  A time about two months ago when I was dealing with this fuckboy named Coby who was a meth head.

For the first couple times, I got hooked up straight, I guess now that was to lure me in.  I never had to wait, I never got slacked and the shit was always fire.

Within a week the bags were getting slacker, the dope shittier and I'd have to wait upwards of three hours just to score a shit, slack point of bap.

To top it off, this motherfucker wouldn't answer the phone half the time.  I ended up having to buy overpriced blues in the interim and texted him telling him that he had lost a $300 play.

He texted me back with ""money doesn't make me move"".

I broke off all contact with him after that and continued to buy overpriced blues until I got a solid connection that is ALWAYS fat and I come to them, not the other way around.  No waiting or any bullshit.

And the DOPE IS FIRE ASF.

What are your middleman horror stories?  Feel free to post, I'd love to read them!",1524002337.0
8d0dn7,https://www.reddit.com/r/opiates/comments/8d0dn7/dont_you_just_hate_it_when/,5,https://redd.it/8d0dn7,TheSilentArt,Don't you just hate it when....,"...you are SO freaking thirsty because of how dehydrated you get from either pills, snorting, or iv H and you start chugging down water or your beverage of choice only to feel that feeling you get when you know you are going to throw up.
Sure enough less than 5 minutes later you throw up once (projectile vomit) and all of the precious water or beverage comes up all at once and you are still fucking thirsty ... FML
This just happened to me again just before I typed this while I was at work.",1524001737.0
8d0czm,https://www.reddit.com/r/opiates/comments/8d0czm/difference_between_1_2_3_4/,6,https://redd.it/8d0czm,chorebitsnresinhits,"Difference between #1, #2, #3, #4?","I don't shoot, I only snort. Been hooked on it for about 4 years. Anyway, I see you guys post a lot about different kinds, but I'm not sure what that means. Any info helps. Happy highs, everybody!",1524001589.0
8d0bbz,https://www.reddit.com/r/opiates/comments/8d0bbz/is_it_really_this_hard_to_find_h_that_i_can_trust/,43,https://redd.it/8d0bbz,Slut4blood666,Is it really this hard to find H that I can trust?,"I’ve never done H before (but I have snorted and eaten oxy’s before). Lately I’ve been wanting to try heroin really really bad but don’t even know how to begin my search for it. No one in my life messes around with that stuff mostly just pills and coke. I did however had a dboy who sells weed say he can find the H for me. Got a text from him that the H is secured but I’m too chicken to buy it and risk overdosing if it’s cut with fent. I also don’t know the guy hat I will be buying it from. It concerns me that I will be very easy to fool. I’m petite, you would never guess I’ve done drugs and although I’m 26 I look extremely young. What should I do? I thought about going to a few bars and hanging with the really drunk people but again, you never know what has fent. (My bf died because his pills had fent) ",1524001195.0
8d09n1,https://youtu.be/q07Mn6vtiw4,10,https://redd.it/8d09n1,heyhyena,The entire opiate experience described in a rick and morty clip,,1524000799.0
8d06pj,https://www.reddit.com/r/opiates/comments/8d06pj/paws/,2,https://redd.it/8d06pj,TuggyMcGlintock,PAWS,"This should prob be in the recovery sub but fuck it maybe it will help the people struggling and it is related to opiates. Got off that hamster wheel last week (Wednesday), first day no sub, been on like .5 mg the last two days. Anyways I truly feel like a fish out of water sometimes in early recovery. Like just uncomfortable as fuck...idk what to say/do/can’t think straight/body feels weird. But it could be worse and I’m pretty lucky to have only missed a day of work and I have a chance to make this stick...at least I’m not lining the pockets of a dealer that doesn’t give a fuck about me and wasting my life away...it is hard to rebuild but it needs to fuckin be done so don’t procrastinate on it, get to it. Same goes for taking the pledge to go through WD, get subs they aren’t hard to find if you have dope connects...nut up and go through 24 but really like 12 hours of misery...and then you give yourself a chance. ",1524000173.0
8d05e0,https://www.reddit.com/r/opiates/comments/8d05e0/eating_30_sniffing_30/,1,https://redd.it/8d05e0,donewithroxy,Eating 30 sniffing 30?,Any reason I shouldnt eat 30 and sniff my other 30? Been doing this for awhile now and recently found this page. Just curious if anyone else does this or if it’s just me. ,1523999873.0
8d03s8,https://www.reddit.com/r/opiates/comments/8d03s8/i_have_chronic_pain_but_im_also_an_addict/,6,https://redd.it/8d03s8,dhoover2112,I have chronic pain but I'm also an addict,"I am in pain management for my chronic kyphosis in my upper back. I usually take all my hydros within a week or two, but my wife has had it with me and is doling out 2 a day which is not even touching my pain. She also is keeping my gabapentin which I was on high doses. I am in pain, and sick. Anything to help with this? I am on the verge of divorce which means I'll get to manage my own meds again. How sick is that?",1523999528.0
8d020b,https://www.reddit.com/r/opiates/comments/8d020b/todays_plan/,5,https://redd.it/8d020b,ReptilePins,Today's Plan,"Been about 34 hours since my last dose. WD's are definitely there but not the worst I have experienced. Expecting dboy to come through sometime in the next 4 hours (yes, that is how vague he can be)
Anyway, I just popped 15 ativans to ease the WD and help the the time go until the dboy comes thru.",1523999144.0
8czzgu,https://www.reddit.com/r/opiates/comments/8czzgu/doseing_reprocutions/,0,https://redd.it/8czzgu,Oxiconone,Doseing reprocutions,"Hey guys. Need a little advice;

What would one expect if they were to take 150-200mg Oxy daily for 5 weeks and then stop cold?

First week - 50-100mg daily
Second week - 75 - 125mg daily
Third, fourth and fifth week - 125 - 200mg daily.

Comfort meds available : Lyrica (Pregabalin) & Codeine Phosphate tabs (30mg no APAP)

Thanks!",1523998607.0
8czy9s,https://www.reddit.com/r/opiates/comments/8czy9s/question_about_withdrawals/,5,https://redd.it/8czy9s,aeiouabanana,Question about withdrawals,"So, I was just wondering how long do I have to stop using before the withdrawals stop coming back. 


I’m at that point where I don’t feel happy on it or off it. I’m so fucked. I don’t have any money any more and I can’t just casually enjoy some good opiates. 

Advice ?????? Answers ????",1523998328.0
8cztgc,https://www.reddit.com/r/opiates/comments/8cztgc/oxy_tolerance_high_but_kratom_tolerance_low/,1,https://redd.it/8cztgc,ScentedNipple69,Oxy tolerance high but kratom tolerance low,"Its so fucking weird. Basically I can do 1-2g of kratom in a dose, and up to like 4g total in the day and be great. With oxy i need atleast 45-60mg at once to feel it. Wtf is up with that? Feel like it should be reversed",1523997273.0
8czq5c,https://www.reddit.com/r/opiates/comments/8czq5c/not_related_to_opiates_but_rbenzodiazepines/,3,https://redd.it/8czq5c,Painkiller830,Not related to opiates but r/benzodiazepines couldn’t help,So I’ve recently picked up some yellow footballs and I just wanted to ask if any manufacturer found it worthy to press one of these babies? It is a low dose of Xanax which is why I doubt anyone would press it but it just seems bigger than they ought to be. Anyone care to enlighten me? And yes I picked these up off the street ,1523996569.0
8czpv8,https://www.youtube.com/watch?v=bWYcbZrRr70,6,https://redd.it/8czpv8,ZachGreeen,i relate to this song title too hard,,1523996506.0
8czpd9,https://www.reddit.com/r/opiates/comments/8czpd9/anyone_else_fried_their_tolerance_and_feel_from/,1,https://redd.it/8czpd9,FINLANDISGREATEST,"Anyone else ""fried"" their tolerance and feel from oxy/kratom at some point? Feel like I burned my brain out","
Used to wake up and when I took my first pills, felt amazing, how most of you feel. Last year found out about kratom. Started a bad habit of taking more oxy some days and supplementing with kratom on low days.

Somehow, early this year, after 4 years of taking opiates, the euphoria went away. Like tolerant 24/7 even though I have that microwithdrawal in the morning before dosing

Often when I get my new batch of oxy I set aside hard work ""treat"" days where I take like up to 50-80mg and borrow from other days (where I just do kratom and 10mg). 2014-2017 those days I'd be drooling in love with myself. Now, when I tried that past couple months, just felt no different than 30mg, but tired, very itchy, bad eyesight. Extra side effects, no bliss. I get a legal perscription 30mg for nerve pain,in my late 20's now so maybe age plays a role.

I got into potentiators from here when I was running low and got desperate to make every bit count. Grapefruit juice, tonic water and DXM at the end of high dosing days, because it's supposed to reset tolerance. 

Maybe it was that, maybe it was sometimes taking kratom on the same day as normal oxy dose, in the afternoon, when in the past only took oxy between 9am-2pm, and toughing through the afternoon crash

Maybe if I figure out what I did wrong, I'll learn something valuable about tolerance and getting the most of your opiates, something I can teach others to avoid so they don't have this happen.",1523996398.0
8czn9f,https://www.reddit.com/r/opiates/comments/8czn9f/shooting_fent_patches_and_getting_cotton_fever/,8,https://redd.it/8czn9f,HeroinPillsLovecraft,Shooting fent patches and getting cotton fever sucks! Goddammit! (Shitpost),"So I soaked two used 25mcg overnight in water, in a shot glass.  Took em out, and chewed on em.  Even added a green to the shot.  Got kinda high for 30min then went to freezing, shaking, which just making my back killing me even worse, hurting everywhere, and a headache.  Eating Vic's all day trying to feel better, and it's not really working.  Threw away shot glass, rig, and cotton.   0/10 would not recommend!",1523995958.0
8cz9eu,https://www.reddit.com/r/opiates/comments/8cz9eu/can_you_smoke_the_dried_flowers_of_opium/,9,https://redd.it/8cz9eu,gonnabenormal,Can you smoke the dried flowers of opium?,,1523993026.0
8czewq,https://www.reddit.com/r/opiates/comments/8czewq/for_those_on_methadonebupe_maintenance_is/,1,https://redd.it/8czewq,tachibanakanade,for those on methadone/bupe maintenance: is vitadone worth it?,"title.  
  
is vitadone worth the price? it's $25 for 90 tablets and you have to take 3 each day.",1523994197.0
8czd87,https://i.redd.it/nb6i9yvjuis01.jpg,16,https://redd.it/8czd87,Hercules88,When your on your three last bags and your about to take a month off from that dog food to lower your tolerance and save some money...This stuff is truly a life saver!! 🤙🏼🌿🍃 because no one likes to be dope sick. Especially not me!!,,1523993840.0
8czd3g,https://www.reddit.com/r/opiates/comments/8czd3g/suboxone_question/,8,https://redd.it/8czd3g,Phillyman0715,Suboxone question,"What’s the best way to take Suboxone? I have 2 orange pills that say AN 415, and I snorted half and ate the other by letting it dissolve under my tongue. Just curious what the best and most effective method is, i already took one I plan on taking the other soon! Thanks reddit ",1523993818.0
8czbsq,https://i.redd.it/poa1dtaptis01.jpg,3,https://redd.it/8czbsq,opiateman916,Ima be high,,1523993543.0
