93hk6p,https://www.reddit.com/r/opiates/comments/93hk6p/alternatives_to_baking_tower_for_making_bth/,10,https://redd.it/93hk6p,saymandont,Alternatives to baking tower for making BTH snortable.,I dont have any baking powder right now and was wondering what common stuff I could use instead. Thanks!,1533065150.0
93hba2,https://i.redd.it/tfpe5dx8zbd11.jpg,47,https://redd.it/93hba2,SixCylinder777,"In South Africa you can get methadone without a script or a consult, 3 bottles (360mg) cost me R320 (R20=1USD).. so it cost me 16 USD...",,1533063462.0
93h7lz,https://www.reddit.com/r/opiates/comments/93h7lz/some_guy_got_in_a_lot_of_trouble_because_of_our/,4,https://redd.it/93h7lz,ActavisAndBars,"Some guy got in a lot of trouble, because of our account names being so similar.","       Well he sent me a longer version, but basically he has been forced off Suboxone and his OLDER sister told his family my account was his. He said the counter tops in my picture kind of looks like one in his own house. 

Sorry brother and stay strong. Even if you have a sister who can’t take care of her kid or keep her Xanax script filled longer than two days. 

Dudes sisters takes mad psychedelics, adderall and Cocaine..... and Meth. But called him a junkie. I’ll take being a junkie over not being able to watch my kids everyday. 

He said has pictures and tons of messages with her incriminating herself, but he’s 8 years younger than her and going somewhere in life and isn’t sweating her.

Give this guy a virtual high five, because this is all Georgia and our names our backwards.

His is BarsAndActavis.



",1533062776.0
93h32u,https://www.reddit.com/r/opiates/comments/93h32u/unique_suboxone_withdrawal_question/,8,https://redd.it/93h32u,stitches_lk,Unique Suboxone Withdrawal Question,"I have been taking approximately 1mg - 2mg per day for one week just because it gets me high.  I plan on stopping tomorrow and keeping what I have left.  Although in the past I was a bad opioid addict, I currently am not right now and haven’t been for years.  So will I have any withdraw after taking such a small amount daily for one week?

Btw love you guys y’all are always helpful",1533061910.0
93gz9x,https://i.redd.it/pqog705jsbd11.jpg,16,https://redd.it/93gz9x,OutdoorwiththeIndoor,Loaded to the ceiling. Hope everybody is doing well.,,1533061203.0
93gheo,https://i.redd.it/emdq2xuoibd11.jpg,21,https://redd.it/93gheo,Butters3398,anyone else immediately pour out all their stash to get a better idea of how much you got? I do because i sniff my stuff,,1533057918.0
93gfbv,https://www.reddit.com/r/opiates/comments/93gfbv/how_are_you_guys_not_afraid_to_buy_dope_from_the/,16,https://redd.it/93gfbv,Casperthebenzoghost,How are you guys not afraid to buy dope from the bm,Like you have to go download all these different programs and feds could catch you or whatever. Yall have balls fr fr. ,1533057535.0
93g5j1,https://i.redd.it/o2i0d2v7cbd11.jpg,39,https://redd.it/93g5j1,moon_meander,Anybody else have friends in situations like this?,,1533055713.0
93g056,https://www.reddit.com/r/opiates/comments/93g056/some_legal_pharmacy_opiates_to_buy_in_denmark/,2,https://redd.it/93g056,rake98,Some legal pharmacy opiates to buy in Denmark?,I'm searching for any that could be bought without prescription. Do you know any?,1533054737.0
93fske,https://www.vice.com/en_us/article/5gkgm8/lincoln-clarkes-series-about-addicted-vancouver-women-is-still-amazing,2,https://redd.it/93fske,Flyonz,Vancouver's East Side by Lincoln Clarke,,1533053320.0
93fl8d,https://i.imgur.com/MOZ0fNA.jpg,13,https://redd.it/93fl8d,Oxiconone,Awesome combo! 😁,,1533051937.0
93fl2q,https://www.reddit.com/r/opiates/comments/93fl2q/is_there_any_evidence_that_paracetamol/,6,https://redd.it/93fl2q,Erinddal,Is there any evidence that Paracetamol potentiates Oxy,"I've tried both, with and without, and to me it actually feels stronger without Para added.",1533051904.0
93fjns,https://youtu.be/WlqRC2iM8S8,1,https://redd.it/93fjns,Oxiconone,"Oxycodone & Hard dance 😃. 200mg Oxy, 60mg Diazepam and a night out clubbing with massive rig. Apologies to those who find this offensive! Next club night, may drop in some MD 🤯",,1533051618.0
93f87i,https://www.reddit.com/r/opiates/comments/93f87i/shooting_dilaudidother_pills/,3,https://redd.it/93f87i,corgisandcocaine,Shooting Dilaudid/other pills,This is a noob question but how do you guys shoot pills? Like a PMS hyrdromorphone IR pill for example. How do you not inject all the filler??,1533049408.0
93f3r8,https://www.reddit.com/r/opiates/comments/93f3r8/after_reading_a_sample_from_traceys_book_the_big/,11,https://redd.it/93f3r8,FD3S_13B_REW,After reading a sample from Tracey's book 'The big fix' can anyone link to more similar stories?,"I've ordered the book off Amazon but whilst I wait, I'd love to read more stories like this. Can anyone link me up to more stories please?",1533048515.0
93f005,https://www.reddit.com/r/opiates/comments/93f005/i_am_so_sad_and_anxious_guys/,35,https://redd.it/93f005,Iamsoanxious123,I am so sad and anxious guys.,"Please berate me and tell me I'm a fucking retard.

I've been doing oxy for three months, and when I am not doing them I get so unbelievably anxious it is unreal. I have a beautiful girlfriend that loves me to death, and is way more driven than me. She's halfway through university, I'm just a loser who lucked their way into a bit of money.

Tonight I picked up heroin. I tried to stop doing pills but the anxiety is unbearable. My heart is in a knot, and I'm about to do real dope for the first time. I snort for what it's worth. :(

I am so freaking depressed and I can not ask for help. I can't keep doing dope either.

Edit: I did a .08 line. It is fantastic. Instant relief of my anxiety. ",1533047770.0
93ez4s,https://www.reddit.com/r/opiates/comments/93ez4s/heroin_lasting_20_hours_is_this_normal/,10,https://redd.it/93ez4s,FD3S_13B_REW,Heroin lasting 20+ hours. Is this normal?,"I smoke half teenth of UK heroin a day which I assume comes from Pakistan and I'm not getting any physical withdrawal  even 20+ hours in. Mentally I'm withdrawing as I'm counting the seconds for the dealer to start his day. My pupils are a normal size during this. I just wondered what it could be cut with for it to last this long. I have started to physically feel wd just 12 hours in using the same gear before, but it's been ages since that's happened. I'm not taking anything else at all and haven't taken anything else prior to this. Could the roa make a big difference? I've never gone beyond 20 hours because I always seem to finish it by 14.00 and then i redose at 10.00am next morning when the dealer comes online. ",1533047593.0
93ez2p,https://www.reddit.com/r/opiates/comments/93ez2p/urinary_incontinence/,7,https://redd.it/93ez2p,curiouspapageorgio,Urinary incontinence,"As most of us know, opiates make it hard to piss due to some relaxing or tightening of our piss channel. I forget which one and I can't find any articles at the moment. So, lately I've been having extreme trouble in emptying my bladder. I spend a long time just standing there, *flood*ing my mind with thoughts of waterfalls and pouring drinks. I think I've found the solution for myself at least and hopefully to others. I do my best without aid to get the flow perking up. Then I get the sink running and start chugging a bottle of water and that dual-action seems to really get duh pee out muh peepee. I know constipation is talked about more here so how about you guys share any unconventional methods you might personally have for relieving that. We know about enemas, fiber, stool softeners, getting yourself sick for a bit (fuck that btw), etc. Maybe some of you have your girl blumpkin you out. Idk. Happy morning everyone.  May your Tuesday bring you twos and not ones. I'm high. Love you.",1533047583.0
93dr1f,https://www.reddit.com/r/opiates/comments/93dr1f/how_slowfast_is_it_reasonable_to_taper_off_heroin/,3,https://redd.it/93dr1f,PhilosophyBlue,How slow/fast is it reasonable to taper off heroin?,,1533037455.0
93dtct,https://www.reddit.com/r/opiates/comments/93dtct/iv_cathater/,10,https://redd.it/93dtct,Throwaway77667,Iv cathater,R they worth getting if you could get them cheap on Amazon? Would It be something that you could put in the morning and last all day of shooting up. I even seen some that have two injection ports (speedballs with class) ,1533038069.0
93dqnf,https://www.reddit.com/r/opiates/comments/93dqnf/codeine_surprised_me_a_little/,18,https://redd.it/93dqnf,corgisandcocaine,Codeine surprised me a little,"I’m an occasional opiate user with experience with hydromorphone, percocets, hydrocodone, suboxone and kratom (if that counts). Anyways I’ve had to access to TONS of T3s for a long time now but never bothered cause after researching it, it sounded like a waste of time because it seemed to sickening/uncomfortable to be worth the very mild buzz. But the combo of having nothing else at my disposal and being bored has lead to me to take 5 (150mg). And I have to say I’m pleasantly surprised. Not nodding out or anything but the buzz is pretty damn cozy. Idk I’m just rambling anyone else think codeine is underrated? ",1533037346.0
93dk3h,https://www.reddit.com/r/opiates/comments/93dk3h/pain_scripts_in_the_usa/,9,https://redd.it/93dk3h,Wolawong,Pain scripts in the USA?,How easy is it to get a pain script in America if you have healthcare? In the UK the NHS does bot give out anything.,1533035514.0
93dg2p,https://www.reddit.com/r/opiates/comments/93dg2p/speedball_dosaging/,27,https://redd.it/93dg2p,sixxdegrees,Speedball dosaging?,"I have been slamming opiates and cocaine/ meth separately for over a year but I want to try a speedball. Right now I shoot 50mg of oxycodone at a time as for coke I don’t have a scale so I just eyeball it and start with a tiny dose and gradually increase throughout the night. I am just wondering if I should do a smaller dose of oxy when I mix it with coke or will 50mg still be fine? 
Thanks! ",1533034393.0
93d6bc,https://i.redd.it/jt6m6ug6c9d11.jpg,11,https://redd.it/93d6bc,beennoddin313,Long time lurker first official post! Best dope I’ve ever had was this color! Been getting this stuff for the past few days and it is impressive!,,1533031491.0
93d40r,https://i.imgur.com/Hb1QVfC.jpg,24,https://redd.it/93d40r,time_to_forget,When your entire persona that landed you an attractive girl in a relationship less than a week in was all drug based.,,1533030770.0
93d32k,https://i.redd.it/5tlz5h3v89d11.jpg,22,https://redd.it/93d32k,US_2_EU_420,good morning opi fam. Hiding out in the work bathroom for my morning foil hits. That good EU #3. Wishing everyone a good day,,1533030446.0
93d1dy,https://i.redd.it/q1l31zxr79d11.jpg,7,https://redd.it/93d1dy,christinambowers,God damn I love suboxone,,1533030005.0
93cvyz,https://www.reddit.com/r/opiates/comments/93cvyz/i_had_a_thought_the_other_day/,3,https://redd.it/93cvyz,ApprehensiveKey,I had a thought the other day,I thought the other day 'Everyone leaves but Oxy never will'. And then I felt a feeling of strong happiness.  What is wrong with my brain.,1533028391.0
93cvhg,https://i.redd.it/l85rmsih29d11.jpg,8,https://redd.it/93cvhg,sensisandwich,Some more 🔥 i had to get more:),,1533028227.0
93cvfo,https://www.reddit.com/r/opiates/comments/93cvfo/120_hours_still_not_in_sub_withdrawal/,9,https://redd.it/93cvfo,Nancykillsyou,"120 Hours, Still Not in Sub Withdrawal???","So I was on subs for a few months then went through a full detox...

After that short detox I could get full opiate effects.

Long story short I got back on 10 mg for 1 week then discontinued. As of today it has been 120 hours since my last final discontinued dose and I am getting absolutely ZERO effects from any (strong) opiates. I know half life is 37 hours, with full withdrawal coming in around the 72 mark, but this is WAYYY past that point. Been drinking water, keeping my metabolism up.

What is going on? Should I give it more time? I have never heard of withdrawal taking THIS long. AND have never experienced this. I’ve even taken measures to speed up my metabolism. I don’t even feel that bad. Is there a way to speed up the process? Has anyone ever experienced this? I don’t want to keep wasting precious goodies to keep “testing” to see if I’m all clear or not. ",1533028213.0
93cj5p,https://www.reddit.com/r/opiates/comments/93cj5p/yall_ever_fuck_with_ketamine_in_the_mix/,6,https://redd.it/93cj5p,floatyz,Y’all ever fuck with ketamine in the mix?,"Recently posted about dabblin with some #4 from the onion tommmorow , y’all know if ketamine is aight that same day ? No opiate tolerance atm",1533024009.0
93cg7s,https://www.reddit.com/r/opiates/comments/93cg7s/slow_boring_overnight_shift_at_work/,3,https://redd.it/93cg7s,NINtronica,"Slow, boring overnight shift at work?","Time to make it a bit more interesting with 60mg of hydrocodone and 80mg of baclofen, and some HBO Go streaming. Just wish I had some weed with me to cap it all off. What are you guys indulging in tonight?",1533023023.0
93cfgz,https://www.reddit.com/r/opiates/comments/93cfgz/viminol/,12,https://redd.it/93cfgz,caco2521,viminol?,"has anyone heard of it before? Its OTC in my country, brand name Dividol, and the active compound is viminolpara-hydroxybenzoate, I didnt find basically any info on this, besides its an opiod (or not?) very weird posts on google and nothing telling me what I want to know.

has anyone heard/saw viminol? Its an super synthetic opioid? Heres it is OTC, but Idk if it has any recreational value? My tolerance is very very high, IVing 450mg-500mg/day of morph, so I dont think, even if it is an opioid that will have effects on me (otc convince me that it shouldnt be potent), but I found nothing about this weird compound.

Anyone?",1533022778.0
93cch1,https://www.reddit.com/r/opiates/comments/93cch1/cliff_once_watched_a_space_shuttle_launch/,4,https://redd.it/93cch1,sloan_fitch,Cliff Once Watched a Space Shuttle Launch,"This memory from his youth stuck with him straight through the days that opiates hijacked his physiology and psyche. As many here are already aware, as he got more dependent some of his worst traits became amplified. Laziness, moochiness and dishonesty in collusion to drive away other productive human individuals. His laziness tied into his slovenly attitudes towards housekeeping and hygiene. This of course helped in the creation of the environment which is well suited to support a thriving bed bug population.


&nbsp;


Bed Bugs from space, who parked their damaged ship in high orbit used a landing pod to enter Earth's atmosphere. They actually made their way into Cliff's home via a case of Twinkies. Who would've thought? When the first space bed bugs began biting - they employed an ability which was unique to their race. This allowed them to establish an electrochemical connection via the blood and nerve fibers and in effect allowed them to form a connection with Cliff's mind. They scanned or detected memory fragments of life experiences that left an indelible impression, and the launch of the American Space Shuttle was one of them.


&nbsp;



The Space Shuttle is no more, while Orion and SLS are behind schedule. There's no way the current mass of bedbugs would be able to board any rocket in their entirety. That's okay, they can do it in small groups. However, the Russian Soyuz rocket is not an option. The Russians don't tolerate bullshit. Though consideration has been given to sneaking aboard in a box of cigars it turns out the Russians stopped smoking Cigars in space when they stopped operating their own space station Mir.


&nbsp;


Eventually, the mass of alien bed bugs which form Cliff did manage to make aboard a rocket. When word got out that Elon Musk might be sending a car to space, the bugs seized upon this opportunity and formed a plan. A small group of bugs managed to stuff themselves within folded sheets of paper in an envelope containing a U-Line catalogue. This was shipped to a the Teasla Motors manufacturing plant at which they in turn made their way into the upholstery of the Tesla Roadster that would ultimately be placed aboard the new Falcon Heavy rocket. 


&nbsp;


Little did the central mass which currently forms Cliff, nor did the bugs in the upholstry know until it was too late that car would not spend any time in Earth orbit. Nope, this car was sent on a trans-Martian trajectory. It would seem that nobody went out of their way to perform detailed calculations. It was expected that the car may go to Mars or that it may end up in the asteroid belt. Either way, this small group of bed bugs are not likely to be rejoined with members from the original mass of bed bugs that are working to hold the shape of Cliff as they swarm beneath his clothing.



&nbsp;



Will they break away group of bugs make it to Mars or the asteroid belt? Will the central mass of alien bed bugs send more members to hitch a ride on a future SpaceX Dragon cargo capsule? Perhaps they will wait for the Crew Dragon variant to become operational so that they'll have access to upholstery and warm bodies.


These and many more questions will be answered in the continuing saga of the alien bed bugs which have chosen Cliff as their host.",1533021807.0
93cajf,https://i.redd.it/6vseh5aph8d11.jpg,16,https://redd.it/93cajf,scooby_dg_99,Not much but such pretty pills,,1533021236.0
93c775,https://www.reddit.com/r/opiates/comments/93c775/iving_dillys_vs_opana_10_ir/,7,https://redd.it/93c775,StandfieldMarlo,IV'ing dillys Vs opana 10 IR,"Never shot the IR pana's but I'm getting 60 tomorrow.  How do they compare?

Thanks for any info.",1533020215.0
93c6dx,https://www.reddit.com/r/opiates/comments/93c6dx/why_in_withdrawal/,5,https://redd.it/93c6dx,Question-mark-kick,Why in withdrawal,Does one stretch so much and so hard ? It’s like I stretch so hard my skin feels like it could rip.  ,1533019958.0
93bto7,https://www.reddit.com/r/opiates/comments/93bto7/gotta_love_it_when_you_find_someone_who_shares/,1,https://redd.it/93bto7,freddy_storm_blessed,gotta love it when you find someone who shares your sense of humor,[texting my running partner](https://imgur.com/a/a970rMA),1533016115.0
93bu56,https://i.redd.it/wvp9ywsr28d11.png,14,https://redd.it/93bu56,Battard,Sharon Osbourne cashing in on opioid crisis,,1533016260.0
93brht,https://www.reddit.com/r/opiates/comments/93brht/i_did_it_again_im_fucking_trash/,14,https://redd.it/93brht,Iwantaporsche,I did it again. I’m fucking trash.,"I did it again. I stole from my best friend, something so fucking stupid. My thought process was that I was going to sell it for cheap for some money for some pills.

He found out. The rest of our friends found out. Good job you piece of shit. I seriously fucking hate myself.",1533015456.0
93bp61,https://i.redd.it/sl7g9ghgy7d11.jpg,1,https://redd.it/93bp61,opiatetrippin,Happy Nodds my good people!,,1533014767.0
93bncb,https://www.reddit.com/r/opiates/comments/93bncb/no_high_anymore/,7,https://redd.it/93bncb,FlyingCardinal,No high anymore....,"I guess my tolence is just way high now.  Used to, I could take a half of a panda and be flying.  Now, if I take a whole one, I am lucky to get a buzz but it is prob just a irritating nod.  I hate the nods.  I want the energy high!  I guess this is normal?",1533014235.0
93bmgn,https://www.reddit.com/r/opiates/comments/93bmgn/i_need_everyones_advice/,6,https://redd.it/93bmgn,ceasedtolive,I need everyones advice,"Okay so I've fucked up. So I have to go cold turkey off panadiene forte (all you heavier drug users are laughing) I've been taking more then 240 tablets a month for 3 years, I have never gone a day without them. So I need to know what the fuck to expect, how long the withdrawal will last, and just any advice whatsoever. I would massively appreciate it. I'm not gonna lie I'm so scared.

I also don't want to take any other drug to get off a drug. Unless a vitamin or like ibuprofen also don't smoke weed at all I've been off that for 2 years. Don't know if this changes anything but I have severe anxiety, borderline personality disorder and c-ptsd. Thank you! ",1533014000.0
93bcfp,https://www.reddit.com/r/opiates/comments/93bcfp/need_help_tapering/,3,https://redd.it/93bcfp,ThrowawayOxyScared,Need help tapering,I’ve been on 30 mg daily of oxycodone for about 3 weeks. I’m about to run out and having major anxiety about withdrawals. I have 3.5 10mg of oxy left and was planning to cut down to 10 mg each day and 5 mg on the last day. Am I to expect going through withdrawals? What can I do to help with anxiety and other withdrawal symptoms I may experience? I have a very demanding job and can’t take any time off.,1533011315.0
93bj3e,https://www.reddit.com/r/opiates/comments/93bj3e/oxycontin_extreme_nausea/,9,https://redd.it/93bj3e,mxwkey,Oxycontin - Extreme Nausea,"Hey guys, I know it’s normal for some people to get sick on oxy sometimes but this seems a bit excessive and idk whether or not I should be worried and if I should see a doctor to check if it’s something else entirely. 

I took 20mg last night (around 1am) and 15 mg this morning (around 11am) and since my second dose I’ve thrown up 6 times. It’s now 3pm. I’ve never thrown up on OC before so I was wondering if this is normal or if there’s something actually wrong with my body rn. 

I hadn’t eaten since 6pm yesterday when I took the second dose and I threw up 5 times before I got lunch around 1pm today and once since (just now) so I’m getting worried that this might be wrecking my throat a bit. 

I know the general advice is going to just be “go see a doctor” but I’d prefer to avoid that if I can figure that this is a regular occurrence for some people as I’m kinda broke rn. ",1533013094.0
93bf5k,https://www.reddit.com/r/opiates/comments/93bf5k/break_up_while_semi_sober/,12,https://redd.it/93bf5k,Kseagle35,Break Up while semi sober,"sorry for the wall of text, on mob
 
I recently was dumped by the girl of my dreams, after around 6 or 7 months of being together. She knew of my addiction after I opened up to eachother shortly after meeting. She's literally the only thing that was bright in my life, and now she's gone, because she found out I had used kratom, and drank a 6 pack of beer.. I'm seriously feeling incredibly depressed, and suicidal. I either want to be high until the pain goes away, or die quickly. It's just so utterly terrible experiencing your first real heart break while sober.. ",1533012038.0
93behh,https://i.redd.it/7ogimnksp7d11.jpg,13,https://redd.it/93behh,SuperFried,Methadone question,,1533011857.0
93b837,https://i.redd.it/pwwer59uk7d11.jpg,19,https://redd.it/93b837,sensisandwich,!🔥! ... Literally the best I've ever had in over a decade strong.,,1533010185.0
93b7ri,https://i.redd.it/5kg5fvwkk7d11.jpg,4,https://redd.it/93b7ri,whatsupmykneegrows,Player 2 has entered the battlefield!,,1533010101.0
93b7kj,https://www.reddit.com/r/opiates/comments/93b7kj/real_quick_been_off_suboxone_2mg_x2_daily_for_30/,5,https://redd.it/93b7kj,iAmAPickleYo,"Real Quick: been off Suboxone 2mg x2 daily for 30 hours, will I feel my good ol’ morphine high or is this going to be a waste? Must I wait longer?","So I been on subs for over 30 days. My girl calculated I’ve been clean from regular opiates/opioids (morphine, Oxycodone) for around 90 days. I acquired fifteen 30mg morphine ER pills. My last dose of Suboxone yesterday was 2mg at 10am and 2mg at 7pm, so counting the hours since my last 2mg dosage it’s been 30 hours.

IMPORTANT: Will I be good to take some morphine and actually feel it and say I would take 150-200mg morphine orally with my old tolerance months ago and nod the hell out hard; should I take the same dose due to the Suboxone being a strong opioid? Or start lower honestly?",1533010046.0
93b6nx,https://www.reddit.com/r/opiates/comments/93b6nx/klonopin_after_oxycontin/,3,https://redd.it/93b6nx,ImaDrugAddict_jk_hah,Klonopin after oxycontin,"Hi, how long do i have to wait to take a klonopin after taking Oxycontin? Took an oxy 20 mg 6 hours ago and want to take a 2 mg klonopin. Dont have a tolerance to either drugs.
",1533009822.0
93b6e0,https://i.redd.it/lnwt457kj7d11.jpg,1,https://redd.it/93b6e0,whatsupmykneegrows,And that’s a wrap folks!,,1533009757.0
93b43y,https://www.reddit.com/r/opiates/comments/93b43y/took_a_relapse_om_heroin_yesterday/,11,https://redd.it/93b43y,SpaceAndT1me,Took a relapse om heroin yesterday,"I feel so dissappointed, had been clean since May 23rd with only a few times getting drunk.

The reason I believe was that I've become over-confident. Stopped going to NA and  yesterday I looked up my dealers number and called him. My girlfriend haven't noticed yet and im thinking of keeping this a secret. All of the 0.5 grams are gone and from here on all I can do is just learn from this and look forward.

Thank you for listening, you and The dealer are The only people that know about this, but I'm going to attend a NA meeting here in Stockholm today and get this off my chest.

If anyone from sweden that wants to talk, or just anyone, feel free to message me. Im currently studying to become a doctor, its my 3rd year and I'm going to specialize in addiction. I'd love to share some of my knowledge and experiences.

Love",1533009157.0
