8sxxx0,https://www.reddit.com/r/opiates/comments/8sxxx0/got_ripped/,5,https://redd.it/8sxxx0,idgafsolid,Got ripped ...,So me and my friend matched $135 to get a lolarge order of Oxy 20s from my good friend. Well good friend ended up selling us 300mg of fuck OPs. Thank God he's a good friend because he also had K 56s to trade in replace mg per mg. ,1529636110.0
8sxv3x,https://i.redd.it/a7aw8xistg511.jpg,8,https://redd.it/8sxv3x,Fletch8692,Time for liftoff...Happy nods,,1529635376.0
8sxv0s,https://www.reddit.com/r/opiates/comments/8sxv0s/hydromorphone/,7,https://redd.it/8sxv0s,dopenpizza,Hydromorphone,"Pills. Hydromorphone (dilaudid) IR 8mg -
Capsules. Hydromorphone contin (dilaudid) ER 9mg -

What do/would you guys pay for the above per pill/cap?

I used to get 8mg dillies for $15/per not sure what they’re worth these days around here. 

I’ll get to the point; I’m going to cop 190 9mg hydromorph contin but I’m not sure what i should be paying.. 

Just wanted to hear some numbers from you guys; what you actually pay(if you cop dills), what you think the 9mg ER’s are worth, and the MOST you would pay per 9mg ER.",1529635353.0
8sxq67,https://i.redd.it/aezkuxb4qg511.jpg,25,https://redd.it/8sxq67,SIKIC__,Graduated from hydrocodone to oxycodone today :/,,1529634138.0
8sxop8,https://www.reddit.com/r/opiates/comments/8sxop8/how_much_oxycodone_would_kill_an_average/,27,https://redd.it/8sxop8,silentcauga,"How much oxycodone would kill an average, opiate-naive adult?","I know this isn't black and white but I'm just curious if anyone had a rough estimate. Anecdotal evidence would be great...if you knew the person just had opiates in their system. I often find myself in the argument of Xanax not being fatal on its own without other cns depressants, and most ""overdoses"" are a synergy of two+ drugs but I know you can OD on straight opiates alone, so for the sake of this discussion just focus on oxycodone (or hydrocodone if relevant, I guess). Average weight/height adult user with no tolerance, what would the lethal dose be?

My guess is around 300 mg but I have no evidence. I haven't gone anywhere near that and don't plan on it, I always air on the side of caution with my dose, I'm just genuinely curious because when I look it up, all I find are addiction info websites.",1529633768.0
8sxnvr,https://www.reddit.com/r/opiates/comments/8sxnvr/is_2methylmaf_legall_in_the_us/,17,https://redd.it/8sxnvr,jamdeuce,Is 2-methyl-maf legall in the us,I know the analog act however is it specifically scheduled itself ,1529633400.0
8sxi24,https://i.redd.it/g0iwc0rijg511.jpg,30,https://redd.it/8sxi24,billymaysOXYsnort,Got these little sweeties... Havent had them in forever. Are they as common in The States as they are in Canada? And how does everyone like good ol Hydromorphcontin??? Lmk,,1529631919.0
8sxcr3,https://www.reddit.com/r/opiates/comments/8sxcr3/people_speaking_on_the_potency_of_bupenorphine/,27,https://redd.it/8sxcr3,chrislantern,People speaking on the potency of bupenorphine,"I hate when people on forums and reddit swear the bupenorphine is this super strong and potent partial agonist and no one needs more then 4mg doctors just prescribe a lot to get you hooked.  I have seen numerous people give out advice saying you will need no more then 8mg of suboxone to hold you.

Coming off a a large IV fentdope habit I can tell you that 24mg barely held me correctly for 24 hours, sometimes I needed to take the maximum dose recommended by the manufacturer; 32mg 

While 4mg of bupenorphine may squash your withdrawal from 150mg of oxycodone, it will do nothing for habits of harder opiates such as diacetylmorphine, oxymorphone, and hydromorphone.

Just saying users with big habits: realistically you’ll need about 16mg after induction.",1529630620.0
8sxck2,https://i.redd.it/wxawyx8ifg511.jpg,13,https://redd.it/8sxck2,bubbz21,Gettin lit,,1529630573.0
8sxa8m,https://i.imgur.com/UPJmB4Z.jpg,23,https://redd.it/8sxa8m,dori_88,Day 11. I got this Yesterday. I had 90 Days a few months back but didn't do a program. Hopefully it sticks longer this time.,,1529629843.0
8sx7bx,https://www.reddit.com/r/opiates/comments/8sx7bx/need_to_sleep_but_need_to_pee_i_cant_pee_so_i/,6,https://redd.it/8sx7bx,monstrousnuggets,Need to sleep but need to pee; I can't pee so I can't sleep. Help?! :(,"Hey all. I'm up early tomorrow so I really need to fall asleep soon to be fresh when I wake up.. But I'm absolutely bursting for a piss, however because of urinary retention I can't. I can't sleep when I need to pee so badly. 

What could I do to help? I've held my breath and pushed, I've tried it from many different positions, I pressed my lower stomach and gooch, I had a tap running, hell I even dipped my ballsack into warm water for 5 minutes.. I simply cannot pee, and it sucks! :(

I would appreciate any tips you might have since I assume most have you have gone through the same thing at one point",1529629123.0
8swsy1,https://www.reddit.com/r/opiates/comments/8swsy1/okay_so_i_got_some_new_stuff_you_can_see_from_my/,15,https://redd.it/8swsy1,fuckwad6969,"Okay so I got some new stuff you can see from my most recent post with a pic and I’m just wondering, this stuff doesn’t have a strong drip at all, like I don’t even taste it at all basically, so I was wondering why? It’s pretty good shit too but it doesn’t give me that drip that so long for.",,1529625444.0
8swvui,https://i.redd.it/bm8oprcf2g511.jpg,11,https://redd.it/8swvui,Keyboardpaladin,Just copped from the man 😩👌🏼💦 y'all think these are presses?,,1529626170.0
8swtpz,https://www.reddit.com/r/opiates/comments/8swtpz/i_accidentally_froze_my_cwe_am_i_fucked/,9,https://redd.it/8swtpz,Highnessnathan,I accidentally froze my CWE am i fucked?,"I put my already filter codeine extraction in my new fridge but it was turned up to high. Its now fully frozen, is it revivable? if so how thanks. ",1529625631.0
8swtmy,https://tonic.vice.com/en_us/article/8xevwb/dea-raids-addiction-doctors,14,https://redd.it/8swtmy,oneultralamewhiteboy,The Feds Are Raiding the Offices of Doctors Who Prescribe Addiction Medication,,1529625614.0
8swpff,https://www.reddit.com/r/opiates/comments/8swpff/prescribed_tramadol_for_pain_should_i_keep_taking/,13,https://redd.it/8swpff,Moek611,Prescribed Tramadol for Pain: Should I keep taking it?,"I was prescribed 50mg of tramadol up to 4 times daily as needed after severely bruising my shin. 

The pain is definitely challenging and I have been having trouble sleeping through the night with it, but frankly, I am extremely wary of the addiction potential of tramadol. After taking around 100mg for the past 3 days, I definitely get the allure. 

My brother is an opiate addict and I use weed, lsd and alcohol recreationally. 

How much tramadol can I use and for how many days without running into wd’s? 

Is it even worth the risk? Maybe I should just deal with the pain for a few weeks. 

Appreciate your help! 

",1529624597.0
8swoak,https://i.redd.it/3h1oy4wtwf511.jpg,4,https://redd.it/8swoak,jf209,Plug let me cop. No W/Ds tonight. We gettin high.,,1529624292.0
8swiw0,https://www.reddit.com/r/opiates/comments/8swiw0/check_out_the_movie_a_thousand_junkies/,4,https://redd.it/8swiw0,junksterno1,"check out the movie ""A Thousand Junkies""",I am about 15 minutes in to it so far and it's pretty well done. The 3 guys in it met in recovery. It's on hulu.,1529622960.0
8swgk1,https://i.redd.it/8uk1j35brf511.jpg,7,https://redd.it/8swgk1,medicatedwiz420,Ready for my 3 day weekend!!,,1529622435.0
8swbg2,https://www.reddit.com/r/opiates/comments/8swbg2/so_im_fucked/,23,https://redd.it/8swbg2,xan-foo,so im fucked.,okay so i go to my PM doc everything is fine..i get my script for 120 oxy 15s n 30 xanax .5s.Now the fucked up part..go to the pharmacy they say theyre out until july 2nd..so i make my rounds to every other pharmacy in town and hear the same exact thing..even some in other towns....wtf am i supposed to do?,1529621274.0
8swab9,https://i.redd.it/rvn3csb3nf511.jpg,3,https://redd.it/8swab9,squishyturd,Good plan,,1529621015.0
8swa0n,https://www.reddit.com/r/opiates/comments/8swa0n/max_dose_of_percocet/,6,https://redd.it/8swa0n,OtisLukas,Max Dose of Percocet,"I've been trying to find information about the maximum safe dose for percocet because I'm concerned about the acetametaphine in it.

What I don't understand is why every site says the max daily dose for 7.5/325 = 8 pills a day but only 6 per day for 10/325??

It's the same amount of tylenol so I don't get it. Does this make sense to anyone?

Anyway, I'm stuck with nothing but Perk 10's so how many can I take without ODing on tylenol?",1529620950.0
8sw6wx,https://www.reddit.com/r/opiates/comments/8sw6wx/withdrawals/,5,https://redd.it/8sw6wx,filtermissen_dk,Withdrawals,"In the last 24 hours I did 160 mg and then 12 hours later I did 160mg more..
How many days I’m going back WD?
I went 4 days before the 24 hours, am I back to start?",1529620215.0
8sw5q1,https://i.redd.it/tpufwxfvjf511.jpg,33,https://redd.it/8sw5q1,TheHorridIntrovert,just keep your cool... almost there,,1529619938.0
8sw20q,https://www.reddit.com/r/opiates/comments/8sw20q/stomach_is_so_fucked_up_been_homeless_eating_all/,22,https://redd.it/8sw20q,Toodeeptonod,Stomach is so fucked up been homeless eating all u can eat contests,I've been homeless for the last week so having spare money for food has been scarce to say the least. By me there are theee places that have food challenges. One is eat at a huge steak on 30 min. Another is eat 6 wings with spicy as hell sauce and another is a buriitto thing. I've been forcing myself to eat it bc one i can't afford to pay if I lose and two i don't have money to eat. Now k know the real man versus food challenge means ,1529619107.0
8svqt2,https://www.reddit.com/r/opiates/comments/8svqt2/kick_starting_your_brain_to_naturally_make/,11,https://redd.it/8svqt2,dejaentendood,Kick starting your brain to naturally make dopamine/serotonin again?,"Is there any medication that does this? I know exercise and a good diet help but I'm wondering about a medication. 

Like okay, I've never used steroids (testosterone) but I've done a lot of research on it and when you use steroids for a while your body stops making it naturally, so when you stop it takes a good while for your body to start again. To combat this, a lot of people take PCT (post cycle therapy) there are a few different brands, but their purpose is to make the body start making testosterone naturally again a lot faster than it would without taking any medication. 

Is there not anything like that but for dopamine? I'm not too educated on the science of drug addiction so this is probably a stupid question, but I figured I'd ask anyways. Is what I'm asking impossible to make? Are people working on making something that does this? Lol. Imagine if there was a medication that made your brain make the chemicals naturally again at normal levels within like a month or two rather than like 3-6 months (I know it varies) then you would just get through the shitty acutes and know that the PAWS wouldn't last nearly as long. Sorry this was long, I'm just dreaming I guess ",1529616647.0
8svqe9,https://www.facebook.com/HeroinAngels/videos/399249800557361/,18,https://redd.it/8svqe9,tydalt,I heard Canadians were chill. WTF is up with these asshats reacting to an OD? Sickening/infuriating.,,1529616560.0
8svgem,https://www.reddit.com/r/opiates/comments/8svgem/when_your_boss_says/,15,https://redd.it/8svgem,casualuserabuser,When your boss says...,"""Damn you know your a pretty good worker for a dope head"" cause he thinks you smoke weed all the time when actually your just a dope head who still smokes weed all the time lmfao 

Made me feel pretty good about my use at work but still I know it doesn't make it okay. Soon I hope to be off this dope train but I hate the thought of withdrawals at work. ",1529614429.0
8sv84x,https://i.redd.it/dzt6qfq8ye511.jpg,13,https://redd.it/8sv84x,clerror,Afternoon pick up. Be safe and happy nods everyone.,,1529612687.0
8sv6uq,https://m.youtube.com/watch?v=QSWf8KggnII,1,https://redd.it/8sv6uq,JustAUsername124,"First time poster, just want you guys to hear this song, makes me feel better",,1529612412.0
8sv6ch,https://www.reddit.com/r/opiates/comments/8sv6ch/6_fucking_pharmacys_to_get_one_script/,48,https://redd.it/8sv6ch,TableChairguy,6 fucking pharmacys to get one script.,"Fuck that. The pharmacy I go to for my dads perc (can bearly leave the bed) script ran out of meds and wont have any til Monday. Ok thats fine. Go to the one a mile down the road ""go to where you've been getting them filled"" okay fine. Go to walmart but address is for different town so they won't do it. They're 100$ cheaper at the original pharmacy that was out. So drive 50 miles back to my dads walmart. ""We don't fill Dr. Blah blahs scripts"". The fuck ever then. Next pharmacy after them just a ""No"". Fuck off. Finally a fucking walgreens 10 miles away in the next town fills them after they call and ask the doctor is its okay to fill it. A 65 year old veteran thats been on pain meds for 20 years can't get a fucking script is a disgrace. 6 pahrmacys and 5 hours later I can finally give them to him. Just needed to tell someone this",1529612303.0
8sv0hx,https://www.reddit.com/r/opiates/comments/8sv0hx/i_couldnt_do_it/,26,https://redd.it/8sv0hx,RedditUser1512,I couldn't do it,Had a 5 day road trip planned with some freinds swore I would get on subs before  heading away. I just couldn't last the 24 hours I'm too weak. I managed to nab the only room in the lodge with a double bed so I can be alone don't know if I have enough to last the whole holiday or if the  next place will even have a place to use. I smoke it btw.  Got xanax and that shit that makes your shit hard that does not pass the blood brain barrier without the help of pepper which I have if I run out. Last time that lasted a good 30 hours or so.,1529611116.0
8sv04t,https://i.redd.it/4anch9tate511.png,3,https://redd.it/8sv04t,wavyjones710,"not much, to the moon.",,1529611041.0
8susw7,https://www.reddit.com/r/opiates/comments/8susw7/question_about_suboxone_withdrawal/,14,https://redd.it/8susw7,misspi430,question about suboxone withdrawal,been on subs 3 years time to get off this shit...been on methadone last time I got off of it I ate subs 50-60hr since last dose and it PUT me in 100x times worse withdrawals my question is coming off subs 50-60hr since last dose if I use opiates Will it help or make me sick like it did with the methadone and suboxone,1529609559.0
8sushj,https://www.reddit.com/r/opiates/comments/8sushj/i_am_in_fact_being_followed_by_an_undercover_cop/,57,https://redd.it/8sushj,frezhberry,"I am in fact being followed by an undercover cop, police have confirmed it.","I was told he was just doing his job and has claimed to have busted me on several occasions. 

...I've never been busted for more than a traffic ticket so wtf? 

I stop doing dope and the hammer comes down? 
",1529609473.0
8surtq,https://www.reddit.com/r/opiates/comments/8surtq/trying_to_score_another_lean_script_same_doctor/,11,https://redd.it/8surtq,helixman21,Trying to score another LEAN script Same Doctor (Help),"Hey guys so I had successfully scored a 10oz Script around the first of May and its now Almost the beginning of July. Roughly 2 whole months right? Do you think it’s acceptable to go in again and do the same thing I did before with the same doctor office I have 100% success rate of getting syrup scripts at. The medicine 10 oz was for around 20 days worth as prescribed , so its been roughly 50 days + since I got that script. In the narcotics prescription database if shouldn’t flag my name right ? I think the time has been legit enough to come back with similar symptoms as last time to get a script? I could say I have a low immune system and I usually get sick every so often times throughout the year? Thanks",1529609340.0
8suqut,https://i.redd.it/dircfjhtne511.jpg,27,https://redd.it/8suqut,samcayler44,"2064 V 3 Codeine pill opinions? Just copped 4 from my plug, said one will fuck me up. I’m experienced with Percs and Hydros. Never had these before",,1529609160.0
8suq7w,https://www.reddit.com/r/opiates/comments/8suq7w/would_you_say_5mg_of_opana_snorted_is_equal_to/,7,https://redd.it/8suq7w,BongChong420,Would you say 5mg of opana snorted is equal to 30mg of oxycodone orally/snorted?,"I got two G77’s :) 🐼 I’ve done it before, but my tolerance was confusing, because I didn’t know if I was tolerant to the 30mg of oxycodone I did in one go, or the 60mg in total thru the day, which was often the case, doing my doses twice a day.",1529608910.0
8sunns,https://www.reddit.com/r/opiates/comments/8sunns/fake_a51/,6,https://redd.it/8sunns,berosee,Fake A51?????,"[https://imgur.com/a/DCytZMV](https://imgur.com/a/DCytZMV)  


They look weird when light hits them and when they are in shadow you can barely see the imprint, you can tell they are dirty from his hands, they crack nice theres no lip ( ive seen really bad fakes) and theese seem perfect under close inspection. Picture doesnt do it justice but gives you an idea",1529608367.0
