7fgr2l,https://www.reddit.com/r/opiates/comments/7fgr2l/do_opiates_change_how_you_socialize/,19,https://redd.it/7fgr2l,ItsNotHectic,Do opiates change how you socialize?,"I have noticed this weird thing lately with myself where I will say something such as a flippant remark which I dont put any thought in to and I will get a reaction as though it was silly or if the converation is heated then offensive. The remarks are slightly embarassing and out of character.

Im narrowing it down to either opiate usage or PTSD.",1511632448.0
7fgq40,https://www.reddit.com/r/opiates/comments/7fgq40/vivitrol_when_you_arent_ready/,7,https://redd.it/7fgq40,gratefuljunk,Vivitrol when you aren’t ready,"Has been horrible. I’m still blowing my paycheck the day after I get it because now I’m just shooting coke, popping xan presses and gabapentin, and smoking dabs. Got paid yesterday and my account is already emptied. Im such a fucking idiot. ",1511632197.0
7fgox9,https://www.reddit.com/r/opiates/comments/7fgox9/benzos_killing_rush/,3,https://redd.it/7fgox9,Thankkratom,Benzos killing rush?,"Had to use mad etilozam durring Thanksgiving week as I was on vacation, didnt even think about, or relize because of past benzo addiction that 6 days of 2-3mg a day would put me back in benzo addiction. Was to worried about melting my damn brain to the point that I wouldnt miss my beloved dope. Didnt think about what id do when I finally got back after what felt like a month. Did a small tester shot due to the benzos still being in my system, just wasnt right. Did a little more, still wasnt right, so I did just a little more. Ended up never getting a fucking rush and nodded out at a retardedly early hour. Woke up a few hours later and preceded to nearly deleriously prep and regester a shot one every two hours or so, sleeping in between shots,from midnight until 6am. Ended up waking up an hour later just to throw up yellow shit for the whole morning. Bouta go try again. Would not recommend to anyone.",1511631901.0
7fgmce,https://www.reddit.com/r/opiates/comments/7fgmce/_/,5,https://redd.it/7fgmce,sarahjane710,?????,"Ok so I relapsed and didn't call in or show up to my job for a couple days, im off it again now,  a couple days later,  and wonder8ng is there any way I can get my job back or keep my job?? What can I tell them? Fuck :(",1511631226.0
7fgllm,https://www.reddit.com/r/opiates/comments/7fgllm/i_know_nausea_is_normal_w_opiates/,9,https://redd.it/7fgllm,sadbabie_,I know nausea is normal w opiates,But holy shit sometimes I feel like an infinite vomit machine. Even if I don't puke then I have this annoying lingering nausea that won't go away unless I purge. Sometimes (a lot) the excitement of about to be doing the shot makes me puke. But the thing I hate most is doing a shot and the rush is about to kick in but I puke and it fucking ruins the rush. Sitting with a loaded rig right in front of me at this moment calming myself down cause I know I'll def puke as soon as I bang it. This sucks. Anybody else deal w this?,1511631032.0
7fglf1,https://i.redd.it/abm4dlqhp5001.jpg,7,https://redd.it/7fglf1,bussinscripts12,It's a love/hate relationship with these 😎,,1511630984.0
7fgk3g,https://i.redd.it/atbshcnho5001.jpg,1,https://redd.it/7fgk3g,Dust906,Need a boost ? Try Ddrops ! Sunshine in one drop !,,1511630649.0
7fgjhx,https://www.reddit.com/r/opiates/comments/7fgjhx/watching_opiate_related_youtube_channels/,1,https://redd.it/7fgjhx,SuicidalSteve,Watching opiate related YouTube channels?,"Anyone else like watching YouTube videos related to withdrawal, recovery, or even active use? I use to have a pretty prominent channel and deleted it years ago. I regret it every day and always think about starting up another one. The main focus would be on recovery and staying clean. ",1511630483.0
7fgj30,https://www.reddit.com/r/opiates/comments/7fgj30/my_mom_is_a_closet_opiate_addict_she_recently/,17,https://redd.it/7fgj30,bolognamacaroni,My mom is a closet opiate addict. She recently came to visit me from out of state. She tried to steal my Klonopin but I caught her. I lost trust with her and dont know how to confront her about it.,"My mom has used opiates for about 20 years. She has chronic pain but way over uses. She won't admit it to anyone in the family. Recently it has gotten so bad. She can't work anymore and is still hidding it from her kids. 

She came to visit me from out of state. While staying with me she went in my nightstand, through my medication and stole my anti anxiety meds (Benzodiazepine). When I confronted her about the handful I found in her jacket she claims she needed them for sleep and thought they where lunesta. Which I told her she could not have and made it clear I am not giving her my prescription. 

She brushed it off like it was nothing. Time has passed and Now I dont know what to do or how to talk to her. I've lost her trust and dont trust her coming to visit anymore and dont trust her word. 

How do I fix our relationship and confront her about her use. I don't live in the same state and am worried she will do something harsh if I approach this the wrong way. ",1511630373.0
7fgi49,https://www.reddit.com/r/opiates/comments/7fgi49/i_stopped_opiates_only_during_a_week_and_the/,3,https://redd.it/7fgi49,LiveLoveAsap1,I stopped opiates only during a week and the effects was amazing,"In the past few months i used to take everyday tramadol, and then one time per week 100mg of morphine +  300mg of codeine  + 100mg of promethazine, but last week i felt that the effects i had from the  morphine and codeine wasn't as good as it used to be, so i decided to stop all the tramadol

I've managed to don't take opiates during an entire week and then   i took again my morphine codeine and promethazine combo and i was so surprised when it kicked it, i felt again that warm and relaxing feeling in my entire body, a slight euphoria, and i was nodding so bad too, it took me like 20 minutes to write on my keyboard a 10 words sentence, i think i also that i fell asleep in front of the computer during an entire hour, i don't remember much

I thought that in order to get my tolerance back to normal and have great effects again i would have to stop opiates during like 3 or 4 weeks, why only a one week break  helped so much ? is it because i was only taking tramadol and it's a very weak opiate ? Or is it maybe because i only took  everyday tramadol only  during 2 or 3 months max before i decided to stop ? ",1511630124.0
7fgh00,https://www.reddit.com/r/videos/comments/7feygw/americas_opioid_epidemic/?st=1Z141Z3&sh=b3e6a7a5,20,https://redd.it/7fgh00,2ndwaveobserver,Anyone see this yet?,,1511629832.0
7fggkh,https://www.reddit.com/r/opiates/comments/7fggkh/kill_yourself_junkie/,97,https://redd.it/7fggkh,NoseCandiez,"Kill yourself, junkie!","I finally got my first random PM from another redditor saying:

“You sad ass junkie. You should just kill yourself”

Does that mean I’m officially a real member of r/opiates? 

I love people on the internet. They have such huge balls. ",1511629725.0
7fgfgl,https://imgur.com/TcEtZp0,25,https://redd.it/7fgfgl,HalfHeartedBootyCall,Where did all that money go?,,1511629449.0
7fgdg3,https://www.reddit.com/r/opiates/comments/7fgdg3/i_need_help_identifying_this_ecp_or_china_white/,12,https://redd.it/7fgdg3,Opihoe,I need help identifying this ecp or China white?,"Throwaway btw!! 

Im on the west coast and I've never seen ecp or China  white I just need some help.
My guy said this is China white.. but right when I got it the first thing I thought was ecp. He doesn't do dope so I didn't expect him to know.

It smells slightly like vinegar and the chunks are pretty solid. Thanks.

https://imgur.com/a/SOjU2",1511628938.0
7fg6si,https://www.reddit.com/r/opiates/comments/7fg6si/subs_or_kratom/,9,https://redd.it/7fg6si,time4browser,Subs or Kratom?,Which would you prefer for maintenance or to keep withdrawals away?,1511627173.0
7fg586,https://www.reddit.com/r/opiates/comments/7fg586/hemlock_grove_to_pass_the_time_while_im_in_wd/,7,https://redd.it/7fg586,diditap,Hemlock Grove to pass the time while I'm in w/d,Dude this show makes no sense. But it's fucking entertaining. Send prayers that something comes through.,1511626741.0
7fg1ax,https://www.reddit.com/r/opiates/comments/7fg1ax/obvious_bullshit_fakes/,10,https://redd.it/7fg1ax,CandyCaneMayne,Obvious bullshit fakes,"Yesterday someone offered to trade me 30 roxi’s (30mg IR oxycodone) for 30 8mg suboxone (bupe/Naloxone) tablets. 

Why in the fuck would anyone be dumb enough to trade their R’s like that.....?

....unless those blue bitches were fake/pressed. Nice try, asshole. ",1511625680.0
7fg119,https://www.reddit.com/r/opiates/comments/7fg119/one_year_clean/,13,https://redd.it/7fg119,Sweetraindrop30,One year Clean,"Whatsup y’all, just wanted to stop by and let you guys kno if you wanna stop you can. It’s not easy but after a year I’m finding that cravings are gone almost completely and life is good again. Good luck if you want to get help and if you don’t that’s cool too, just be careful! ",1511625615.0
7fw1iu,https://www.reddit.com/r/opiates/comments/7fw1iu/day_2_im_at_work/,34,https://redd.it/7fw1iu,igottheblues1,"day 2, I'm at work","made it to work so that's impressive, go me! took a piece of sub this am, not sure if its really working, although I guess it is since I'm not hunched over the bowl right now. I don't know what I was expecting with subs but I basically thought they knocked all wds out. I'm still going through the hot/ cold flashes and my nose is leaking like a friggin faucet, but other than that and a general sense of lethargy I am at work and able to function so that's good. Wish me luck as they day progresses",1511797674.0
7fvorg,https://www.reddit.com/r/opiates/comments/7fvorg/walked_into_work_and_got_an_unexpected_check/,11,https://redd.it/7fvorg,on3lasttime,Walked into work and got an unexpected check,"Well, it’s easy to quit when the funds are low....now I’ve got a pocket full of money and it’s burning a hole as I type. Fuck, I’m only 48 hours clean and all I can think about is a fat line. ",1511794571.0
7fvl1a,https://www.reddit.com/r/opiates/comments/7fvl1a/ive_gotta_stop_going_on_this_subreddit_before_bed/,37,https://redd.it/7fvl1a,Dopana,I've gotta stop going on this subreddit before bed.,"Althroughout my dream, I was eating a 2LB bag of 2mg Xanax Sour Patch Kids. Thoroughly pissed when I woke up.",1511793607.0
7fvjc2,https://www.reddit.com/r/opiates/comments/7fvjc2/still_not_feeling_oxy30s/,7,https://redd.it/7fvjc2,r039S903X2,Still not feeling oxy30's,"Took suboxone for few years, last 6 months I was doing 4-2mg dieses..... wheen can i take a perc30?? I wasted some thinking it would work!!!",1511793142.0
7fvhz0,https://www.reddit.com/r/opiates/comments/7fvhz0/what_is_chipping_and_how_do_you_do_it_shit_post/,20,https://redd.it/7fvhz0,freefarts,What is chipping and how do you do it? [shit post],"You mean to tell me that you have many, but take sparingly? I can’t wrap my head around how that works. ",1511792763.0
7fvgh8,https://i.imgur.com/gw05JBp.jpg,34,https://redd.it/7fvgh8,MunchAllDay,"Long time lurker. I guess I'm part of it now, for good or bad.",,1511792358.0
7fvavv,https://www.reddit.com/r/opiates/comments/7fvavv/first_opiate_free_thanksgiving_in_years/,37,https://redd.it/7fvavv,Monstermeteorrider,First Opiate Free Thanksgiving in years!,"I quit my prescribed opiates on 12/15/16 cold turkey. It was the hardest thing I've done.

This is the first holiday season in years where I haven't been controlled by a pill in my pocket and that feels great!

Enjoy one another. Make some time for friends and family. If you are using, know you too can stop and please stay safe.",1511790828.0
7fv3qg,https://www.reddit.com/r/opiates/comments/7fv3qg/need_advice_on_using_frozen_urine_for_suboxone/,7,https://redd.it/7fv3qg,Masterzanteka,Need advice on using frozen urine for suboxone drug test,So I got a new sub doctor recently and I'm in an IOP for another month. Anyways I used half gram of dope and half gram of crack on Wednesday plus smoked a tiny bit of weed on Friday. I get a drug test once a week at my iop and that might be tonight if not it'll be then be tomorrow or Thursday. So like 3 weeks ago when I just had the sub in my system I froze a bottle of piss in a water bottle then put it in a dark plastic bag inside another plastic ziplock. I read online you could store urine for drug tests like this for a couple months and it would still be good. Anyways I went to take it out of the freezer just now and put it in the fridge to start thawing. Well when I did I smelled the urine and it smelled pretty stale that real strong pungent smell of old piss. Would this still be useable for my drug test or has it gone bad to the point where they will be able to tell besides the smell? I know the smell is a concern as well but thinking I might be able to pull that off but just wanted to see what your thoughts were on if they'll be able to tell with the test. Like the nurse will probably smell that it's stale as fuck but I'm hoping if I can somehow get past that part it'll at least pass there tests. I'm almost positive they use like a 7 or 10 panel and then only send to lab if it's positive for something. Any help is appreciated especially if you have experience with what I'm describing. What you guys think?,1511788749.0
7fuzaq,https://www.reddit.com/r/opiates/comments/7fuzaq/im_22_hours_into_withdrawal/,24,https://redd.it/7fuzaq,dori_88,I'm 22 hours into withdrawal,"I'm 22hrs into withdrawals. Cold turkey so to speak. I have a tiny amount of xanax and some lyrica. Today, im going to call my psychiatrist and see if he'll script me enough clonidine/bezo/maybe seraquil? To fight the rest of the withdrawal. If not I'll call my pain specialist and beg for a squeeze me in appointmrntt today. If that doesn't work i can alwaus call my hematologist office who has been a godsend to me over the years. 

I'm doing this all at my boyfriend's place. My parents are out of town. When they get back I'll be 5 days sober. I'll have done it. 

As for the pain? I'll see how bad it REALLY is over the next few months. Maybe alternative measures can help more than I previously thought. 

Edit: oh and I'm pretty sure i have a current uti that needs abolishing and my period is due anywhere from now to 3days.  FUCK. I just realized this.  ",1511787388.0
7fuy9c,https://www.reddit.com/r/opiates/comments/7fuy9c/hydromorphone_question/,20,https://redd.it/7fuy9c,Thiscrazygrl,Hydromorphone question,"So I got a few of these and I’ve already went through 5 and I feel like I ruined them cause I didn’t feel anything. So am I doing it wrong? I crush up the pill, mix it with water like I normally do my H shot and filter it through a cotton swab and then shoot. But what’s left over in the cup is a super messy white residue mess and the cotton is pretty much clogged from all the white stuff. Is this the correct way? ",1511787038.0
7fuuav,https://i.redd.it/gtznib5ohi001.jpg,42,https://redd.it/7fuuav,torstargoldie,1 gram of pure Codeine Phosphate in 8.7ml,,1511785741.0
7fuq5u,https://www.reddit.com/r/opiates/comments/7fuq5u/question_about_bricks/,20,https://redd.it/7fuq5u,iplugambien,Question about bricks,"I see pics of bricks, and mentioned a lot, and i've asked how much is in a brick, but they Only answer the prices, so how many grams are there in a brick?",1511784372.0
7fu3oo,https://www.reddit.com/r/opiates/comments/7fu3oo/overdose/,10,https://redd.it/7fu3oo,TattedLegendUGKing,Overdose,So up to how long after a shot can overdose happen if no other drugs were taken ,1511776099.0
7fttg6,https://www.reddit.com/r/opiates/comments/7fttg6/fastrst_opiate_out_of_saliva/,42,https://redd.it/7fttg6,opiodness,Fastrst opiate out of saliva,"So at a cut off of 20ng/ml saliva test what opiate leaves fastest? This site says hydro https://americanaddictioncenters.org/prescription-drugs/how-long-in-system/  but others say it still takes 2 days, we have crappy roadside tests here and I want to keep taking opiates nut basically cant",1511772221.0
7fttcj,https://www.reddit.com/r/opiates/comments/7fttcj/grapefruit_and_tramadol/,2,https://redd.it/7fttcj,ok_tru,Grapefruit and tramadol,I've got very little tolerance to opiates so I'm currently nodding off of 3 cups of grapefruit juice and 250mg of tramadol and listening to Led Zeppelin. Life's good - sending love to all my fellow r/opiates fam!! Enjoy your night!!,1511772182.0
7ftn5b,https://www.reddit.com/r/opiates/comments/7ftn5b/snorting_hydromorpone_question/,4,https://redd.it/7ftn5b,ttaayylloorr1111,Snorting hydromorpone question,"I’ve been snorting 3-12mg of hydromophone dry for a few years now but I read online that it’s stronger to mix it with a little bit of water first. I can’t find many details about it online and I had a few questions about it. How much water do I mix it with? How thick or thin should it be.. like just a few drops to make it sticky or lots to make it watery? & I don’t have an oral syringe or a nasal sprayer so how do I snort it? Won’t the solution stick to the inside of the straw? People always tell me to “mix it with water and snort it” but I’m not exactly sure how lol any advice would be great, thanks :D",1511769813.0
7ftk2i,https://www.reddit.com/r/opiates/comments/7ftk2i/to_the_window_to_the_wall_til_the_speed_drip_down/,11,https://redd.it/7ftk2i,everything_is_still,"To the window! To the wall! Til the speed drip down my balls. TC, motherfucker, TC.","
Yes, I know it's late so I'm expecting little if any response, and let's just blame drugs and a great memory for anything that is of no immediate or future use or relevance to my life for the title of the post but the sentiment changeth not. Besides, with whom shall I share the penultimate quicksphere of this night? 


**Tinychat can be VERY shitty about the mobile app so if you can connect with a computer, that is the best option.**  
firstly, this chat is not affiliated with this subreddit or its moderators, and has its own moderators, rules, and etiquette. if you feel someone there has slighted you take it up with the moderators of tinychat, as it is completely unaffiliated with and not endorsed by this or any other subreddit.  
just a reminder and an announcement that a bunch of your fellow degenerate junkies, chippers, and tourists hang out in [our very own tinychat room](http://tinychat.com/ropiatesubchat) which has been an ongoing tradition for something like four years now. the location, for those who can't do links for whatever reason, is http://tinychat.com/ropiatesubchat.  

tinychat is an extremely buggy videochat client, but also the only one that fills its particular niche---that being, anyone who knows the room name may enter, and it has a youtube player. any technical difficulties may be addressed by the moderator, namely me. we like to hang out, listen to music, talk about random shit, and lately have even had our own resident sketch artist who draws random crap upon request. the primary purposes for the room's existence are companionship and harm reduction---it's nice to be able to shoot up with others around, even if you are technically alone in the non-digital sense, and have people keeping an eye on you. we're also glad to help with any problems you might be having, or questions you might need answered. we aim to be a welcoming, friendly space for the members of this subreddit to do what we do in good company without judgement. so stop by if you are bored, or just need to talk.  

if it appears like there is a moderator in the room but who is not speaking, just type a few sentences to summon them back. if you are on mobile it is not immediately apparent that there is anyone in the room. either click the button shaped like an outline of a person (i think) to see the list, or say hello to see if anyone responds.  


rules:  

1. pick a unique username. this is to protect other users so we know who is who, given the nature of the sort of activities we enjoy. 

2. no lurking. again, to protect the other users. if you come in the room be prepared to introduce yourself and participate for at least a few minutes so we know you're not up to any shenanigans. if you are lurking you will be warned and then given a generous ten minutes to announce yourself. if the time runs out, you will be kicked (not banned) until you are ready to come in and actually participate. if you are a known member whose identity can be confirmed, this rule is not applicable.  

3. no -isms or hate speech, even accidental. one warning will be issued, any continued insistence on such behavior will result in a ban. bans can be contested by pm'ing a moderator (me). this includes but is not limited to racism, sexism, homophobia, and transphobia. for example, if you are not black, use of the n-word, even with the -a ending, will not be tolerated. i don't care if your friend down the block lets you say it, it's not your lane. 

4. no auditory fuckery. due to peculiarities of the transmission of sound over a chat, certain echos and effects can be amplified to the point of being severely distressing. if it is determined that your end is causing an echo you will be asked to use headphones, or to mute your microphone when not speaking. deliberately making strange or unpleasant noises to annoy other chatters will not be tolerated, and your broadcast will be closed. (this only means that your video/audio feed will be terminated--you will still be allowed to type.)  

i know the rules seem like a lot but there's really only four of them, and only two that pertain to just behaving in a manner that isn't dickish. 
thanks, and hope to see you there! **don't use alone.**",1511768665.0
7fteoh,https://www.reddit.com/r/opiates/comments/7fteoh/assuming_money_were_unlimited_whats_the_maximum/,24,https://redd.it/7fteoh,obviouslyaman,"Assuming money were unlimited, what's the maximum tolerance to heroin one could build?","Assume for the sake of argument that it was pure, pharmaceutical grade heroin.  Somewhere between 2-4 grams/day?    ",1511766722.0
7ftcd3,https://i.redd.it/3ic910jpug001.jpg,10,https://redd.it/7ftcd3,pornthrowaway1948,Not all opiates but still counts right? 🤷‍♂️,,1511765918.0
7ft9xg,https://www.reddit.com/r/opiates/comments/7ft9xg/help_cant_sleep/,9,https://redd.it/7ft9xg,alwaysoxysearchin,Help can't sleep!,I relapsed after being clean for 10 months. It's been a week and all physical shit is gone but I can't sleep and it's driving me batshit crazy. Please help!,1511765038.0
7ft6j7,https://www.reddit.com/r/opiates/comments/7ft6j7/tootache_and_wd/,8,https://redd.it/7ft6j7,TheAccountOfZack,Tootache and wd,Any remedys for a toothache im about to enter day 2 until subs come tomorrow hurts worse than wd any suggestions.,1511763858.0
7ft4qv,https://www.reddit.com/r/opiates/comments/7ft4qv/opiate_hangover_or_withdrawals/,7,https://redd.it/7ft4qv,laflame999,opiate hangover or withdrawals?,"yesterday was  the first time in a week and a half using opioids, i took 120mg codeine and 50mg hydrocodone. with my tolerance it takes me 65mg hydro to get me high, and 50mg oxy to get me high. 

today i woke up after sleeping for a lifetime, and felt hot as fuck and my body was aching. i had a 104 temp fever, which i eventually got down and i don't feel hot anymore, however, my body still is a little achy.

is this the start of wd's, or just an opiate hangover? thank you guys for your help 

",1511763254.0
7ft3k5,https://www.reddit.com/r/opiates/comments/7ft3k5/iv_use_booting_allergic_reactionhives/,4,https://redd.it/7ft3k5,Bombasskush,IV use + booting = allergic reaction/hives?,"Hello r/opiates, I've posted a couple of times here before, usually just shitposts or commenting on users posts with help or what not, but today I have a question for you all. I recently discovered what booting is, and ever since I've found out about it I don't use without doing so afterword. The problem is, recently I've noticed almost every time I boot once or twice after slamming the goodness, I get this itch all around the site where I inserted, and soon after pulling out I get these hive like warm bumps all over. I know I don't miss my vein, but it swells up like I do for about 10-15 minutes after I'm done and clean up, then goes away shortly after it appears (unlike when one misses their vein and it swells and hurts for the next couple of days). I was wondering if anyone else has ever experienced this before, if anyone has an explanation for this strange, uncomfortable side effect and if someone has a way of preventing this from happening. If not, I will try to figure it out by myself, but I thought this was the best place to come and seek help from all you loving people! Happy nodding everyone, I wish you all a safe and warm night, and happy late thanksgiving! Cheers!",1511762885.0
7ft2s6,https://www.reddit.com/r/opiates/comments/7ft2s6/hangover_or_start_of_wd/,3,https://redd.it/7ft2s6,opilude,Hangover?? or start of wd?,"little background.. i don't have a huge tolerance, but 50mg oxycodone gets me high, 60mg hydrocodone gets me high. I got 120mg of codeine and read thats equal to about 20mg oxy.

so last night i took 120mg codeine and 50mg hydrocodone, and woke up today with an intense fever. 104.5 temp. ended up breaking the fever but my body is a lil achy still, i have an appetite and can eat, i just want to know what the fuck happened. this has never happened to me before, this was my first time taking opiates in about a week and a half.",1511762629.0
