8pqmzd,https://imgur.com/a/vP0SV1G,0,https://redd.it/8pqmzd,KickerS12X,Seems Lil' Xan's trash ass is proud of the fact that he has sold fent laced pills.,,1528521228.0
8pqmqm,https://i.redd.it/ng0iuaqmsw211.jpg,1,https://redd.it/8pqmqm,iTakeTunics,"Don't Believe The Hype, Canada's No Picnic",,1528521151.0
8pqlhu,https://i.redd.it/i2wpe2gcrw211.jpg,1,https://redd.it/8pqlhu,wizardbloo,"(Sorry for Shitty pic, phones battery too low for Flash)Very weird reaction to iv. Had this same crazy sharp pain shoot down my arm without even pushing the plunger down or pulling it back. Then when I did pull back blood came in so I tried push in a little. But the syringe would NOT push in at all.",,1528520717.0
8pqk7z,https://i.redd.it/4dhxyt35qw211.jpg,3,https://redd.it/8pqk7z,TheLoneProspector,Girlfriend hooked on oxy but wondering what this may be?,,1528520312.0
8pqi33,https://www.reddit.com/r/opiates/comments/8pqi33/buying_rigs_on_amazon/,0,https://redd.it/8pqi33,push__,Buying rigs on Amazon,"Is there any reason not to buy rigs from amazon? I have the gauge and count I want in my cart, but I am a little hesitant to order. It would seem that there would be more of a discussion on here about ordering from the internet (i want to use amazon specifically because I have a gift card). I don't see ordering online as a recommendation for getting rigs in this sub often.

Is there something I'm missing? What should I know before I order?

",1528519584.0
8pqhit,https://www.reddit.com/r/opiates/comments/8pqhit/how_do_different_opiatesopioids_compare_in_terms/,0,https://redd.it/8pqhit,Gumamba,How do different opiates/opioids compare in terms of feeling?,"Hey guys, i'm not an opiate user really, but I am very interested in drugs in general, and I thought this question might be better suited here than in r/drugs. 

Basically I'm curious how different opiates and opioids feel qualitatively from each other, like how beer and wine can feel slightly different.  For example how does a morphine dose feel compared to an equivalent dose of heroin or hydromorphone? I have no reference point other than kratom, so it might be hard for me to understand but i'm really curious. Is there much difference at all? I know some are more peppy and others are more sedative, but I'm interested to see what you all have to say. ",1528519396.0
8pqend,https://www.reddit.com/r/opiates/comments/8pqend/just_took_my_first_opishit/,6,https://redd.it/8pqend,throwaway666718,Just took my first Opishit,"Binged hard on some vicodin for two weeks and only ate junk food. 

So I sit down on the toilet today with my phone in hand and get to it. Hmm, this isn't as easy as usual. A few minutes pass as I'm scrolling through Facebook and trying to squeeze it out. Fuck, this is a lot harder than I thought. 

I put my phone away so I can focus and I try again. Minor success, I feel a small nug plop into the water. I give another really hard push, bad idea. I had just abruptly begun giving birth to what was approximately the circumference of a can of fucking beans. 

My life begun to flash before my eyes. I could literally feel my asshole being torn apart. I stopped in fear as I remembered the gif of an anal prolapse I once saw on /r/fiftyfifty. Do those happen if you push too fast? Who the fuck knows. I played it safe and pushed this brown monster out slowly and carefully. 

By the time I was finished, I had tears in my eyes and I was too lightheaded to stand up. As I wiped, I noticed my asshole was at least two centimeter wider. My first Opishit. I guess I'll be looking forward to more of these. ",1528518459.0
8pqdir,https://i.redd.it/401yne2kjw211.jpg,3,https://redd.it/8pqdir,TryingToCatchANod,Another score 5 30s for after I take some 15s and somas...I’m gonna catch that nod this weekend.,,1528518125.0
8pqcwl,https://www.reddit.com/r/opiates/comments/8pqcwl/are_opiates_nmda_antagonists/,7,https://redd.it/8pqcwl,RuffSamurai,Are opiates NMDA antagonists?,"Lately I’ve noticed opiates don’t give me as much euphoria lately. They still feel fucking fantastic but they don’t give me that big smile and bliss they used too. It’s not a tolerance thing as I don’t use frequently. They more so just sedate me and I still love them. 

The reason I ask is because I have very bad ptsd and when things got bad, well I started not being able to use drugs anymore due to terrible disassociation. Disassociation is linked to NMDA receptors, I cant smoke weed anymore and I can’t drink anymore as they both activate NMDA receptors.

I was wondering if opiates trigger NMDA activity and that is why I don’t get as much euphoria from them lately. ",1528517915.0
8pq8rj,https://www.reddit.com/r/opiates/comments/8pq8rj/scared_of_nodding/,3,https://redd.it/8pq8rj,Monotub1,Scared of nodding,Whenever I do opiates I fight the nod but it’s really hard to because I’m scared I’ll die. Will you actually die in a nod because sometimes I forget to breath and have to make myself,1528516610.0
8pq80j,https://www.reddit.com/r/opiates/comments/8pq80j/am_i_really_sober/,5,https://redd.it/8pq80j,YoungGoosebump,Am I really sober?,"Hello to the most amazing sub on reddit!

I have a question I have really been struggling with the last couple days and I don't have anyone that I can talk to about this stuff, so here we go.

Am I really sober?

I graduated from college and made a super hard and heart breaking decision to relocate from the Midwest to the west coast. I cried like a little bitch when I had to pack up my diploma and belongings and leave my amazing friend group. I moved to the West Coast because I love the weather, the culture, the women...  I also have a decent job out here. Another HUGE REASON I left the midwest for the west coast is because I wanted to be in an environment where I didn't have access to opiates on a bi-weekly basis. Where I live now, I don't know anyone who does drugs, and that is a good thing. (I still go through intense moments of cravings if that matters)

Anyways, here is the problem. I have been sober for four months and my life is okay right now. Its really boring, but I am working and I am approaching five months of being sober. HOWEVER, I know that deep down, if junkie Jesus presented himself tomorrow.... I wouldn't be able to help myself. If a bottle of pink 10s fell from the sky, I would not have the power to say no. I would be crushing up lines on the sidewalk.

So am I really sober? I out myself in a position where I am living in a nice place, working, and I am technically clean on PURPOSE... But if I was given the opportunity to dance with the Devil again, I would do the tango. ",1528516380.0
8pq68w,https://www.reddit.com/r/opiates/comments/8pq68w/waiting_for_ride_to_pick_up/,3,https://redd.it/8pq68w,raviopi,Waiting for ride to pick up,"Ughhhhhh long story short... a good buddy of mine (jk we’ve actually only chilled like twice) is taking me to the plugs place when he gets off work. He gets paid today, and we are putting our money together to get more of the good. I’m gonna be walking away with 3 grams (of tar) for 150. It’s 10:42 and he told me this morning he’s getting off at 10-ish. He delivers pizzas and told me at around 9:20 that he was on his last two deliveries. I’m sick af and waiting on bro. I want to text or call him to see what’s up, but I don’t want to be an ass. Guess I’m just writing this to pass time, because I’m getting so gd restless.",1528515853.0
8pq4uh,https://www.reddit.com/r/opiates/comments/8pq4uh/faces_of_addiction_by_chris_arnade/,1,https://redd.it/8pq4uh,madzilla3,Faces of addiction by Chris Arnade,"https://www.flickr.com/photos/arnade/albums/72157627894114489 

Hopefully the link works, a super cool photographer/journalist goes around the Bronx and takes pictures and gets to know addicts. I spent all day looking through it and reading. Also after a week of getting shitty dope and doing tons just to stay well, I'm finally in a nice nod off some good shit! ",1528515435.0
8pq2iw,https://www.reddit.com/r/opiates/comments/8pq2iw/to_nod_or_not_to_nod_cest_la_question/,7,https://redd.it/8pq2iw,OPS_MOM_AMA,"To nod or not to nod, c'est la question","My shift is over and I'm heading back to my comfy home, where I plan to continue work on my painting, which I can't wait to share. I was gonna take this weekend's dose tomorrow, but I'm sooo tempted to go for it tonight. 

Chipping has saved me from having a completely ridiculous tolerance but takes immense self control. The days I don't use are a blur of counting down to the next visit from the poppy goddess. 

Now I've talked myself into tonight lol. If anyone wants to chat tonight, or see the painting so far, HMU! 😊",1528514781.0
8pq0qm,https://www.reddit.com/r/opiates/comments/8pq0qm/whats_worse_having_tons_of_money_for_drugs_and_no/,17,https://redd.it/8pq0qm,iFARMdaGANJA,What's worse? Having tons of money for drugs and no plug? Or no money for drugs with a good plug?,Im the first one. It's fucking driving me insane.,1528514254.0
8pq0ci,https://i.imgur.com/3CzQgsw.jpg,4,https://redd.it/8pq0ci,Xxnoah69xx,Whisper finally worked out 2 times in 24 hours,,1528514139.0
8ppyba,https://i.redd.it/wpj820dx5w211.jpg,8,https://redd.it/8ppyba,TryingToCatchANod,Might catch that nod I’ve been trying for,,1528513549.0
8ppxdr,https://www.reddit.com/r/opiates/comments/8ppxdr/am_i_sick/,7,https://redd.it/8ppxdr,Monotub1,Am i sick,I did oxy yesterday and the day before all day from 6 am and stayed up literally almost all night on it for the 2 days to cope with some shit that’s been going on and now all day I’ve been sweating horribly my stomach feels bad and I’m anxious could this be some withdrawals symptoms,1528513282.0
8ppuk0,https://www.reddit.com/r/opiates/comments/8ppuk0/are_avinzas_still_around/,11,https://redd.it/8ppuk0,sensisandwich,Are Avinza's still around??,"I was recently cleaning around my computer desk and found a BUNCH of empty Avinza 120mg capsules (empty unfortunately: ( ).  And I loved these, in part bcuz I would get them for $10 a pop, bcuz I knew someone who got these rx'd, there first time he told me about them he described them as like morphine, as well as the first time he got fentanyl patches, I agree, that any strong opiate especially heroin, is technically like morphine, especially heroin, or diacetylmorphine.. but I immediately got on the internet and looked up ""Avinza""& to my delight found out they were indeed morphine sulfate extended release capsules:).  I purchased 2/$20 and opened the 1st one up to discover beads inside, @ 1st I was not very efficient at crushing then into a fine powder, but with time became very proficient at it..I'd dump the beads into a shot-glass and had a guitar string winder that's handle was perfectly suited to crushing them up!!  I then would take a $ bill and snort that amazingly bitter powder, and wait for bliss, and even though it would take a few mins to ""come up"" it never failed me! At first, I could do about 75/80% of a 120mg and be high as hell, but unfortunately as w/any opiate, tolerance occurred, and I would do one whole pill per dose, then one and a half, then 2.... I definitely was spoiled with a amazing hook-up.... And payed the price in the long run, physical addiction.  But I then started taking oxy (the OG, ""OC's"", God I'd do unmentionable things to get my hands on a few 80mg OC's again!!). And supplement, that with a nice stay off fent. Patchs I had collected for quite some time.... And then I found opana, then heroin.. at first insufflated, then I.v.  now I love iv heroin probably more than any other opiates, but if I could get those Avinza Cap's again for $10/a piece, I would take them over street H. Every time... I saw a Kadian 90mg I believe about a year & a half ago... But never again seen any Avinza capsules going around the street pharm scene.... Was wondering if/how many of you have experienced w/these, and what your opinion of these bad boys r??

Note, I never have tried iv morphine, in any format, besides diamorphine.  But I was wondering how well these bad boys would have gone into my veins???",1528512428.0
8ppubq,https://i.redd.it/5dugkfoh2w211.jpg,7,https://redd.it/8ppubq,douoweme,My stash for now. Bar is pressed 100%,,1528512360.0
8ppu90,https://i.redd.it/vl6gr29f2w211.jpg,1,https://redd.it/8ppu90,phlufhead,Some dank powder I got while out of town,,1528512341.0
8ppu20,https://i.redd.it/96whkj892w211.jpg,34,https://redd.it/8ppu20,Carpet_Surfer216,What’s your EDC? Just picked this up today. I usually carry Kershaw’s but I lost mine so replacement until a new Kershaw or a Benchmade?,,1528512283.0
8pptkc,https://i.redd.it/43y3dbps1w211.jpg,2,https://redd.it/8pptkc,Carpet_Surfer216,Isn’t it a shame kids these days aren’t learning cursive in school.,,1528512146.0
8pprt4,https://www.reddit.com/r/opiates/comments/8pprt4/just_got_out_of_jail/,8,https://redd.it/8pprt4,travs3dpe,Just Got Out of Jail,So I knew I had warrants and didn't put up a fight. Que two days of utter discomfort and being shackled and paraded around two different city and county jails until I saw a judge. I thought the judge would be cool since I just missed a court date for some old dope charges... well he was not. Dude straight up says you know the max on this is 7 years I would think you would be more diligent and revokes the initial bond and slaps on a $10k bond which 10 percent needs to be paid. It sucked but thankfully I came up with the bread and am back home. Good lord it was nasty in there nothing to sleep on just crammed with people and I guess since im laid back the cell they chucked me in with 18 black gangbangers me being the only white guy wasn't that bad. Actually they were hilarious but man I dont wanna repeat that experience. Guess Ill be staying super duper fucking sober now and talking to my lawyer about what to do to stay out of that god awful shit hole. BTW CO's you can suck my dick you all are mean for nooooo reason. ,1528511634.0
8ppoal,https://www.reddit.com/r/opiates/comments/8ppoal/inject_physeptone/,2,https://redd.it/8ppoal,NatalieApp,Inject physeptone,"Sup y'all. Currently posting on my gfs account as I don't have a phone at the moment. I've been on methadone for a few months now 60mgs a day. My mate is offering to trade one of my takeaways for his physeptone tablets. He reckons methadone liquid does more for his pain. Cunts fucked in the head but that's beside the point. If I were to do this trade, would it be worth injecting the physeptone pills? They're 10mg a pop. I haven't found anything on the google but maybe my pals here on opiates have some idea? ",1528510614.0
8ppnoc,https://www.reddit.com/r/opiates/comments/8ppnoc/adding_to_the_friday_hype/,0,https://redd.it/8ppnoc,DragonChaser760,Adding to the Friday hype!,It's Friday just finished smoking about a G and saved an another G for the weekend which is dam near impossible for me to do! The beach is 10 beautiful minutes away on bike as I'm coasting through my Mexican hood I'll stop and grab some chicharrones with a beer/black n Mild and watch the sunset....when we're not sick and high and have a full stash there's VERY few things that can top that joy....a blessed curse. ,1528510445.0
8ppnnx,https://i.redd.it/oc7h4biqwv211.jpg,9,https://redd.it/8ppnnx,yung_enzo,"Dealer just gave this to me saying it’s China white, any thought? Haven’t tried it yet. West coast native though, usually get tar or gun powder",,1528510442.0
8ppmqn,https://i.redd.it/q8dl3bo0wv211.jpg,7,https://redd.it/8ppmqn,HighFi208,Question is this bad I don’t shoot ima smoker it’s from donating plasma but should I get it checked out? Does it look bad?,,1528510183.0
8ppkmg,https://www.reddit.com/r/opiates/comments/8ppkmg/i_suggest_you_poor_souls_that_dont_want_to_deal/,21,https://redd.it/8ppkmg,PrettyflawedButtrfly,I suggest you poor souls that don't want to deal with my YAAAEEEEEDD up ramblings.. start to take cover.,Because...... IT'S. ABOUT. TO. GO. DOWN...... Hide yo' kids and hide yo' wife!! :),1528509579.0
8ppjn1,https://www.reddit.com/r/opiates/comments/8ppjn1/my_dboy_is_out_of_town/,0,https://redd.it/8ppjn1,mermaidmistress2018,My dboy is out of town.,"Anyways his younger cousin has been filling in for him. My normal dboy isnt on dboy time. His cousin on the other hand is. Well he tells me to come to the spot. I get all the way there, and he calls says it's hot wait a min. Well a min turns into 45. So after he isnt answering my calls, I just simply send a text saying ""I was already here when you called, so I've been sitting here waiting, so if this isn't gonna go down, I need to know if I'm going to my other boy or nah?"" And miraculously 5 secs later I get a come thru text. uh-huh. Not letting these d-boys make me  wait all summer 2018!",1528509280.0
8ppif4,https://www.reddit.com/r/opiates/comments/8ppif4/new_fentanyl_analogue_bmf/,17,https://redd.it/8ppif4,RoastBeefEnthusiast,New Fentanyl Analogue: BMF,"This has been released some time over the past few days.  

I have a good feeling about this one, lads. 





",1528508923.0
8ppg9x,https://www.reddit.com/r/opiates/comments/8ppg9x/top_3_opiate_songsmusic_videos/,10,https://redd.it/8ppg9x,percykgr,Top 3 Opiate Songs/Music Videos,"Whattup ope fam. Recreational user currently on a break til my vacation but I wanna talk. Whats your top 3 songs/mv to listen to while having a good nod? For me its

1) Green Day - Jesus of Suburbia. Song is fucking amazing, the music video is really intriguing & it hits me with nostalgia. 

2) Travis Scott - Drugs you should try it. Seriously, if you like rap + opiates & havent heard this song while nodding with a cigarette in hand, do yourself a favor. The song literally enhances the high for me, if I could describe oxy in a song itd be this. 


3) Lil Peep - Star Shopping. Another great song to listen to outside smoking a stoge, with your vision fading in & out looking at the stars. Fucking beautiful. 


Honorable Mentions: Earl Sweatshirt - Grief, $uicideboy$ - KYS P3, Kendrick Lamar - Real

",1528508308.0
8ppe3i,https://i.redd.it/liqe0hzhov211.jpg,10,https://redd.it/8ppe3i,Omarffomthewire,My Friday night....A few k20's and a bunch of Mbox 15's and sun pharmaceutical 10's.,,1528507674.0
8ppc9r,https://www.reddit.com/r/opiates/comments/8ppc9r/how_did_you_start/,10,https://redd.it/8ppc9r,Spook093,How did you start?,Only ever done script meds but I was just curious how did most of y'all get here?,1528507169.0
8ppbol,https://www.reddit.com/r/opiates/comments/8ppbol/yeah_its_probably_fake/,12,https://redd.it/8ppbol,t1ffuneluv,Yeah it’s probably fake...,"So I just copped some H, and it’s pure white, the chic says it’s China white wich I have never seen in TN. So how do I figure if it’s really dope? Its seemingly doing its job but something is off I think it may be gabby because it does help with withdrawal ",1528506991.0
8pp8s0,https://www.reddit.com/r/opiates/comments/8pp8s0/blessed_by_junkie_jesus/,3,https://redd.it/8pp8s0,high3rprimat3,Blessed by Junkie Jesus,"First post so not sure if this qualifies. Ive been a long time lurker and user, but i’ve been cutting back and just chipping. So i went on a little binge and of course everyone i know is out so i started feeling mild w/d and was about to take kratom when i got the urge to clean my car in the hopes of finding something lol. Low and behold i find a yellow perc 10 (round C 230 pill) under the driver seat 🤤. Potato quality pic but it was the best i could do before shoving it down my throat lmao

Happy nods and enjoy your weekend fam!

https://imgur.com/a/jm1N09S
",1528506209.0
8pp89m,https://www.reddit.com/r/opiates/comments/8pp89m/fuck_it_i_guess/,23,https://redd.it/8pp89m,freddy_storm_blessed,fuck it I guess,"my cat went missing a week ago, and last night my old husky passed away in her sleep. I know it's not the same as losing loved ones but damn if it doesn't feel like it. I just lost the two closest friends I had in the world. honestly feels like life isn't worth bothering with anymore sometimes.

I know it probably looks pretty pathetic to slip into abject depression from losing your pets, but fuck it I guess. I just miss my little homies.",1528506071.0
8pp5tz,https://i.redd.it/gpt9kvgthv211.jpg,7,https://redd.it/8pp5tz,RYear87,"Tried using whisper to find a new plug, saddest pill press I’ve ever seen, no markings on both sides, they didn’t even try.",,1528505405.0
8pp5sw,https://www.reddit.com/r/opiates/comments/8pp5sw/going_back_to_sub_after_relapse/,5,https://redd.it/8pp5sw,timtam256,Going back to sub after relapse?,I've been doing Subs pretty solidly for the last like 4 months. Doing about 12-16mg a day and I thought if I waited 24 hours I would be able to get high on some 30s (I was wrong) I've done 5 30s today hoping to feel sonething and haven't felt shit. Now my question is do I have to wait to reinduct again or can I just take some sub before work in the morning? It will be about 50 hours since my last sub before I go to work and about 12 hours since my last 30.,1528505396.0
8pp5qu,https://i.redd.it/gkzfuw1qhv211.jpg,16,https://redd.it/8pp5qu,casualuserabuser,Its a good friday my dudes. A .7 and 2 (pressed) xans for $66. Hows your weekends goin everyone.,,1528505375.0
8pp3dm,https://i.redd.it/qeep0cryfv211.jpg,11,https://redd.it/8pp3dm,mashed---potatoes,"I know you guys like pinpoint pupils, happy nods!",,1528504783.0
8porr2,https://www.reddit.com/r/opiates/comments/8porr2/all_hail_junkie_jesus/,14,https://redd.it/8porr2,Whatmyskindoin,all hail junkie jesus,"Dope sick day 3 and I feel like I'm dying. I go to see ma for a lil bit. My older bro is there and he slips me a bag.

Fuck yes.

Only, all of my rigs are at my house. (Fuck.)

I search my bag to find one slightly bent clogged needle. Okay, fine. I put a lighter to it and shake some isopropyl up in that bitch. And it unclogs, kind of. Now, I say kind of, because it doesn't draw up liquid. It only squirts it. 

Fuuuuck. That means I'll have to guess if I'm in the vein. So you bet your booty I backload that shit and feel for my best vein, and slam it.

No bubble. I fucking did it, motherfuckers. Somehow, some way.

I wish there was a needle exchange here lol.",1528501790.0
8poqvl,https://i.redd.it/34puvofc6v211.jpg,2,https://redd.it/8poqvl,R_Trains_Delayed,"***WARNING TO THOSE IN NYC AND TRI-STATE AREA. IF YOU COME ARCOSS THIS CHARCOAL DOPE,PLEASE BE CAREFUL*** A very close friend of mine just overdosed a couple days ago from one. If your relapsing do not do a whole bag. Everyone else just stay safe.",,1528501557.0
8poqtg,https://www.reddit.com/r/opiates/comments/8poqtg/fuck_why_scumbags/,8,https://redd.it/8poqtg,jaxsonwayne4,Fuck why scumbags,So I trusted my money with a friend and haven't heard from him like wtf I was going to pay you extra to come through ,1528501540.0
8pokl6,https://www.reddit.com/r/opiates/comments/8pokl6/painful_dope/,18,https://redd.it/8pokl6,kdaury12,Painful dope?,"Hello. First time post here, long time user. 

Has anyone ever gotten some ECP usually brown in color that when injected produces a very strange sensation. It starts out with a tingly, pins and needles type feeling over your body. Waves of this feeling and sometimes a flushing, hot, pressure type feeling followed by a strange pain in usually your fingertips, feet, etc. it’s a very strange and uncomfortable sensation and it’s a real bummer when I score and it’s this stuff although it rarely happens. 

I was thinking it was possibly a cut so I tried to not heat and just cold shoot it, same sensation no difference. I’ve also thought that possibly it’s some kind of less processed dope that is more in the morphine stage, and that is possibly allergic to morphine. It produces a different high all together along with the sensation. Anyone else ever experience this or have any idea what could cause it?!?! ",1528499990.0
8pohks,https://www.reddit.com/r/opiates/comments/8pohks/t_189_yellow_30mg_oc/,41,https://redd.it/8pohks,veryquestionablelol,T 189 yellow 30mg oc,"I have 2 t 189 yellow 30mg oxys and i plan on useing 1 ml of cold water and put the 1ml in a spoon along with 1 pill and let the pill sit in the spoon and water for 5/10 mins or until the pill is disloved in the water, then use a cig filter to draw the solution. I am wanting to know if this will work and if i need to do a nother step like heating the solution be for i draw it up etc, if this is not the correct way to bang this pill please let me know how to do it the right way thank you all ",1528499299.0
8poe28,https://i.redd.it/0pgzh6y3xu211.jpg,4,https://redd.it/8poe28,cmblf995,Quite literal,,1528498443.0
8podno,https://imgur.com/C80Qo7N,5,https://redd.it/8podno,Throwawaydopey87-,Gotta keep these eyes open somehow!,,1528498351.0
8pocjt,https://imgur.com/lAu2lsy,3,https://redd.it/8pocjt,Throwawaydopey87-,Recent pickup keeping me sane!,,1528498092.0
8po6zb,https://www.reddit.com/r/opiates/comments/8po6zb/internal_conflict_am_i_an_addict_or_just_a_heroin/,8,https://redd.it/8po6zb,lurkndturf,Internal conflict - am I an addict or just a heroin addict?,"If anyone does heroin for, let’s say, a week, habitually - they will suffer from physical dependence which I think transforms into a mental one somewhere along the line. So is everyone who uses heroin an addict?",1528496806.0
8po6b1,https://imgur.com/a/ihpdLxH/,0,https://redd.it/8po6b1,Oxiconone,Light on or light off lol. What I can say is Kinder got it right!,,1528496657.0
8po1tq,https://i.redd.it/4i7vv2gqou211.jpg,6,https://redd.it/8po1tq,Quittingsoonish1,Something light,,1528495633.0
8po384,https://i.redd.it/dduhl0uopu211.jpg,29,https://redd.it/8po384,throwaway555kgn,Help! Are these c real or did I get knocked? I tired a quarter and it seems okay. Could they have just gotten wet?,,1528495949.0
