8o0xpb,https://www.reddit.com/r/opiates/comments/8o0xpb/holy_shit_i_just_made_the_easiest_quickest_money/,48,https://redd.it/8o0xpb,Hampford_Cheezeit_96,"Holy shit, I just made the easiest, quickest money of my life. I'm not really sure how to feel, but whenever I do feel something, I sure as shit will be high for it.","Alright so I've been a lurker and occasional poster on here for years. This is a new username though because I ""unremembered"" my password for my older one and also, I kinda wanted to make a throwaway for this story anyhow. 

Besides cold copping adventures, my favorite type of stories to read on here are the ones where people talk about all the random ways they've hustled up the day's dope money. I know many people on this sub hold down full-time jobs, so this may not always apply to everyone, but regardless, I think we can all appreciate the unique ways us kinda folk often resort to in order to come up with some cold, hard cash. I never had anything worth posting about. I feel like I do now.

My boy came over yesterday morning to chill and shoot the shit. He also deals a little crys on the side for some extra dope income, so we were doing some hot rails (my first time, HOLY SHIT) and as often the case with speed, the conversation was flowing. Here's where I make note of the relevant fact that my buddy is bi-sexual. He somehow gets into telling me all about his random hookups, mostly all of them made possible thanks to the grindr app. As fate would have it, right that moment, he gets a text from one of his grindr hookups and proceeds to tell me about their ""relationship""...

Basically, he meets this dude usually once a week at the local porn shop. He's an older, married guy who likes to get groped in public. So they go into the back part of the porn shop where they have the little theaters with porn playing and also these tiny private rooms. My buddy will grope his package out in the open a few times and then go into a private room and help him finish. Dude pays him $200 every time for this.

I'm hearing this and can't help but think to myself ""Damn, I won't lie, if I was bi or gay, I'd be all over this"". Then, the wheels in my brain start turning and now I'm trying to think how I could possibly get involved in this ""deal"" without doing anything I don't want to do or feel comfortable doing. If it wasn't for the speed, I don't think I ever would have gotten on this line of thinking, but I digress.  All I knew was that within the next 12-24 hours, I'd be coming down from the speed and craving dope. But, I was broke and dopeless. That being said, naturally, I laid out my idea to my buddy to hear his thoughts.

I am 100% straight and completely comfortable with my sexuality. I really don't think anything I would do or say would really make me question that, so maybe that's why I was willing to participate. With that said, I still did not want to blow or jerk off or really have much of any physical contact with this random old dude. So I suggested to my buddy, to suggest to this guy, that I come with, rub up against this dude's shit outside his pants, and then just watch the rest of it go down. Since he's into voyeurism and all or whatever. As luck would have it, my physical description, and the fact that I'm a straight dude, is right up this guy's alley and he's IN. He comes out and offers us $600 cash for our time. So $300 each. Morals be damned, I couldn't turn it down.

I'm not gonna go into major detail about the actual events, because it wasn't all that exciting and I've already written half a book. But yeah. We went. At first, it was super fucking weird for me but I just kept thinking how I just need to push through for the $300 at the end. 

Well, this shit ended up being a breeze. Here was my ""participation""....I literally brushed up against this guys junk on two separate occasions. Didn't touch anything directly really. Total of about 45 seconds. Then the rest of the time I ""watched"" those two do whatever they did and had my hand in my pants, but I was really just watching porn on my phone of some hot teens with big tits. Still couldn't get hard though.

The whole thing lasted 15-20 minutes tops. Guy discreetly gave us the $600 cash and we got out of there and went back home. Made it back home within the hour. And we were each $300 richer. I immediately hit up the dopeman for 2 bundles and all in all....I was a happy camper.

Am I proud of it? Not really. But shit, I didn't cross any of my personal boundaries and it was hands down the easiest, quickest $300 of my life. ",1527950542.0
8o0t8h,https://www.reddit.com/r/opiates/comments/8o0t8h/guy_fronted_me/,32,https://redd.it/8o0t8h,Monotub1,Guy fronted me..,"Hey guys i need some advice. There’s a dude around here that sells downers (oxy, hydro, xans, Valium, etc) 

He fronted me a couple 80s a week ago and they looked really real so I popped half of one no tolerance.

This high was very unpleasant my eyes couldn’t stay open, I projectile vomited and was way to high

I didn’t think it was fent still maybe just because I had no tolerance so the next day I took another 40 and the high was so strong I puked my guts up 3 times I could barely talk or stay awake.

So I text the guy asking if it’s a fenty press and he swears it isn’t and gives me all this shit about how he would never do that to his customer

Well it turns out this guy is selling dilaudid that’s laced with fentanyl apparently there’s hotspots in which one pill is as potent as 8 of them...

I owe this guy 200$ should I pay him back for fent pressed oxies ? I could have died I was going to mix the 40 with a Xanax?",1527948977.0
8o0mln,https://www.reddit.com/r/opiates/comments/8o0mln/whatever_happened_to_that_hollywood_undead_kid/,12,https://redd.it/8o0mln,NodEazy,Whatever happened to that Hollywood undead kid who used to steal his grandmas used fent patches out of the trashcan and suck on em. You still alive homie? I miss your post plz com bak frend,"And when he wanted to cold cop so he took a white tee and wrote something of the nature of ""looking or drugs"" on the shirt in sharpie and was going to go walk through the hood wearing it lmaoooo. IF YOU READING THIS PLEASE COME BACK LOL",1527947031.0
8o0l41,https://www.reddit.com/r/opiates/comments/8o0l41/6218_daily_check_in_whos_copping_today_how_is/,21,https://redd.it/8o0l41,NodEazy,"(6/2/18) Daily Check in, who's copping today? How is everyone?",Waiting on a Western Union so I can go cop a gram of good! Where yall at???,1527946612.0
8o0gl1,https://www.reddit.com/r/opiates/comments/8o0gl1/whats_the_best_for_my_tolerance_between_these_2/,2,https://redd.it/8o0gl1,K-HoIe,What's the best for my tolerance between these 2 ?,"So i'm plugging morphine almost everyday now but i'd like to maintain my tolerance if possible

i've made some type of schedule and i have 2 options, i'd like to know which one is the best to keep my tolerance low

first one :

Mon : 50mg, Tue : 100mg, Wed : 25/50mg, Thu : 50mg, Fri : 125mg, Sat : 25/50mg, Sun : 50mg

and the other one is just 

tuesday 125mg, friday : 125mg and sunday 100mg

Which one is the worst ? is it better to use everyday, but with low dosage, or use like 3 times a week with higher dosage for the  tolerance ? ",1527945250.0
8nzyai,https://i.redd.it/fiymc6lgpk111.png,4,https://redd.it/8nzyai,lori171717,Does this one work ? Idk much about what composition is optional,,1527938953.0
8nzqnv,https://www.reddit.com/r/opiates/comments/8nzqnv/help_what_should_i_do_please_respond/,12,https://redd.it/8nzqnv,breadhater42,HELP WHAT SHOULD I DO PLEASE RESPOND :(,"Sorry for this emergency post but can someone please help me make sense of what just happened to me; So just half an hour ago I was speedballing China (fentanyl) and really really strong fishscale coke IV with my girlfriend for about 30 mins and then I took an average shot for me (or so I thought) and then started to have the most intense drug experience I’ve ever had, and I’ve tried everything from hydros to DMT. 

My physical symptoms: My face went completely numb, my vision went blurry, I had the worst ringing in my ears that you can ever imagine, to the point that I couldn’t hear anything else. My head felt like someone was hitting it with a hammer, my heart felt like it was going to beat out of my chest and I felt like I was having the worst anxiety attack ever, maybe close to having a heart attack. I fell to the floor panicking while my girlfriend held me down and tried to calm me down for what felt like 15 mins but she said it only lasted 5 mins. The next 30 mins after that I had low auditory ringing and a nasty headache that’s slowly started to decline in intensity.

The mental symptoms I experienced were even worse, I really thought I was going to die which made my anxiety unbearable. I had visual and auditory hallucinations like seeing shadow people, intense visual snow, and hearing whispers. I thought I was going to be fucked up forever. 

Can someone please tell me if I should call 911 or go to a doctor tomorrow? I’m still having extreme anxiety and my chest and left arm are still numb from the experience. My heartbeat has slowly gotten better but it’s still going a million miles a minute and it’s been about an hour from the incident as I type this. I don’t feel there anymore and disassociated intensely and wondering if I should see a psychiatrist. My girlfriend and I came to the conclusion that I accidentally put all coke and no china in the shot which made me almost OD on the coke if that’s even possible. Sorry for the rambling, you guys are the only people I can go to and I’m just so confused on what to do.

",1527935771.0
8nzpzj,https://www.reddit.com/r/opiates/comments/8nzpzj/i_had_the_tighest_ass_pucker_situation_this/,25,https://redd.it/8nzpzj,Dxm_druid,"I had the tighest ass pucker situation this morning, I can't believe I didn't get pulled over. Also do undercovers have long hair ever? Or beards?","So this morning I went to go cop, at like 2 am. I got my shit and  I'm sitting  in the same parking spot of the apartment complex I copped at prepping my speedball. So I blast off and decide I wanted to have just some coke in my next shot since ther wasn't enough in the first one. So I'm makling this shot and some spills out of the bag onto my passanger seat and I'm cleaning up etc. This is all  taking time and at some point I see a white guy with a longish hair  he's beard thats tatted up with long hair and dressed kinda fantsy like, He's a few cars down but I'm fairly certain he can't see my rig or anything. But if he looked into my car he would've seen me and the street lamp probbably gave him enough light to see a young, well dressed, clean cut white kid who doesn't belong in the City named after an Indian, and who probbably lives in one of the nicer white towns a bit up north. So anyways I see him run from his car to what appears to be an apartment. I didn't look too long though so I didnt see exactly where he ran too. He comes back a minute or 2 later with a cigarette in mouth and gets into his car. So while all this is going on I'm looking for my rig in my car and can't find it so I open the door and step out to get a better view. The boy bagy was in my door and the wind took it out which blows massive donkey dicks. So I look for my phone and decide I want to start looking for the bagy and my shot can wait. I'm also barefoot which I'm sure looks sketchy as fuck. So I step lut onto the parking area and start scanning with my phone but obly to no avail. I quickly noticed 2 cars which looked to be the county sherrifs  sitting in the road with their lights pointed at the row of cars I'm in. I tried not to look like I was poanicking and running away so I continued my search acting like I belonged there and was looking for something I dropped. Then I turned around and walked like 3 to 4 feet back to my car to try and clean everything up. There was some coke on my seat  and the passanger seat,  freshly  used rig, and credit card with white powder on it. I scambled to get everything as clean as possible before they come over to where I'm at wich is probbably going to be impossible. Lucky for me they probbably had some serious call going on since they  just  drove  past me  and  a few minutes later I hear their sirens go off. So basically I think the white guy from earlier is infact an undercover since he was wite, fit, young, and dressed well. He ran out saw me in my car, rand back in and left and called his buddies in, who pulled up a decent amount away from me, but I'm sure they were looking directly at my head, wondering what I was doing. They were most likely looking for a reason to stop me and question me but sat there for a few minutes since Iwasn't doing anything they could stop me for. Or I'm overthinking it and the 2 of them might've just been on patrol in the same complex in 2 different cars.
",1527935456.0
8nzmna,https://i.imgur.com/qt8Zi69.jpg,11,https://redd.it/8nzmna,Oxiconone,I just love these caps. So easy to snort. No hassle. No fuss. No drama! Haha 😆,,1527934029.0
8nzkap,https://www.reddit.com/r/opiates/comments/8nzkap/a_little_reminder/,0,https://redd.it/8nzkap,life_wasted_again,A Little Reminder...,"I just wanted to remind you all that there's absolutely NO recreational value in death; if you're doing something incredibly questionable and want help, here's your shot 💉💊

On a serious note though, I understand why someone is willing to die for the feeling of being high because it's FUCKING GREAT, but at what cost guys? Thinking about the costs generates MORE guilt and perpetuates excuses to use, so don't think too hard. Life is easy when you can't feel, but is that really living?

This isn't me hating on anybody because as I see it, to each their own and as long as you aren't bothering me or someone else, nobody else should be bothering you.

If you wanna addict then by all means please addict, if you wanna detox then detox. Drugs are so in the moment, step back for a second and figure out which one you want to go with, but be true to and honest with yourself.

What do you want out of life? I don't want to see anymore of you guys dying because of hot bags of dope or pressies, but y'all are gonna do what you're gonna do and I get that. Just ask yourself one more time though, what do you want out of life? At the very least though, if death doesn't scare you, remember that if you're dead you can't get high again 😉",1527933028.0
8nzk0o,https://i.redd.it/rqfhj8xf7k111.jpg,15,https://redd.it/8nzk0o,assoumahmad1,Love reUP day :),,1527932896.0
8nzg4o,https://i.redd.it/puq3tflg2k111.jpg,11,https://redd.it/8nzg4o,phlufhead,Do you like stuff?,,1527931217.0
8nzf70,https://i.redd.it/711xdmc91k111.jpg,23,https://redd.it/8nzf70,phlufhead,Yo,,1527930813.0
8nzcrh,https://www.reddit.com/r/opiates/comments/8nzcrh/renocontin_40mg/,9,https://redd.it/8nzcrh,SnapDragon0,Renocontin 40mg,"hi all, I got my hands on some renocontin 40mg, what would be the best course of action to feel the effects of these bad boys, my only opiate tolerance is off the occasional 180mg hit of codeine phosphate which give me a nice really short lived buzz. 

thanks in advance!",1527929752.0
8nz711,https://www.reddit.com/r/opiates/comments/8nz711/chronic_pain_tightrope/,5,https://redd.it/8nz711,life_wasted_again,Chronic Pain Tight-Rope,"I'm gonna preface this post by saying that yes I'm aware that this isn't /r/chronicpain, but I feel as if this is the community this post truly belongs in. I want to start by giving a bit of vague backstory about myself and my experience with chronic pain from an early age, alongside anxiety and occasional depression.

Well, the first drug that I ever took was half of a .25mg Xanax that was given to me by a parent, but although I only had this one experience, it seemed to have opened the gates in my mind to a certain curious fascination with achieving an altered state of consciousness. This began my journey into not only wanting to try most drugs, but ALL of the drugs because I thought that it would give me some enhanced perspective, or something naive like that.

Anyway, I first ran into hydros towards the middle of my freshman year in highschool, but I wouldn't be able to get hydros here and there on a regular basis (if I wanted them: I found that they helped me socialize, alleviated anxiety, turned me into the class pet, and also nullified the back pain that I had started to notice once in a while... more about this later.) I never became dependent on pills in school, despite having the resources to, I managed to get a grip on that.

For me, the real trouble started when I turned to taking kratom in heaping piles using the toss and wash method, the trouble wasn't the kratom however, it was the dosage. I was taking absurd amounts, dosing 4-5x a day just to fend off bone-chilling shivers towards the very end. At first, with any opioids, I had that same alleviation of anxiety and an energizing feeling of passion and attention to detail in things I would do in day to day life. I've been moderately dependent on some ""legally"" acquired hydromorphone (4-8mg rectal/day), morphine (75mg+/day), even hydrocodone and oxycodone. My kratom habit became horrendous by the very end of my sophomore year, so my pediatrician referred me to an addiction counselor who after trying to taper me off slowly, decided that it would be best to cold-turkey me. He had my pediatrician write me a script for 10 days of comfort meds: 1mg of Ativan 4x a day in someone who had never been prescribed benzos before. I felt as if I was being truly crucified for the first two days and hardly even had enough energy to eat, though the Ativan still didn't take away the restlessness in my arms or legs. Part of me began to wonder if I was simply returning to normal, or if something was wrong with me, as the pain in my shoulders and back came back full force.

Well, as healthcare in the US would have it, my pediatrician's next step was to refer my dumb ass to a psychiatrist who, after seeing me twice, started me on a healthy dose of Klonopin daily (as well as writing scripts for any stimulant I wanted, because I guess the narcolepsy I was having from her initial script for Ativan made me qualify for having ADD on her survey.) Unequivocally, starting daily Klonopin has been the single worst decision I've ever made in my life, but I digress. Still, despite having resolved my anxiety issue now by turning myself into an absurdly over-medicated freak, I was having this terrible back pain that I had noticed during my physical in my freshman year, but attributed to wearing a backpack that day.

I'll spare you my life story, but after seeing the same pediatrician almost weekly because of unbearable muscle and joint pain, I was told that it was just ""growing pains"" after having a whole blood test and X-rays done. At this point, I think a lot of people can relate, after hearing the same ""Oh you're just looking for pain pills"" thing from literally everyone: family, friends, doctors... you really start to believe it.

Fast forward to freshman year of college and I see a new primary care doc after I turn 18 who, after doing one test, refers me to a rheumatologist. She tells me that she didn't even have to see me to tell me what I had, the blood work and X-rays were telling enough. She diagnosed me with an autoimmune disease called ankylosing spondylitis, a degenerative inflammatory arthritis primarily affecting the spine (basically, the discs become damaged and then fuse the vertebrae together over time). Since being diagnosed, and still having flares of excruciating pain (despite being on a biologic that I have to stick myself with every week that costs my insurance company ~$5k/mo), my primary tells me that ""We don't want to start narcotics, because you always have to increase the dose"" or ""We don't want to start narcotics considering your age.""

I've never asked him for a narcotic, I've only repeated the truth: I'm fucking sick of taking 800mg of Advil 3 times a day with a Tylenol or two alongside it just to be able to leave my house. A huge part of dealing with chronic pain is acceptance, yes, but this guy won't even give me 10 Tylenol 3s... I'm at a fucking loss lol.

Sorry for rambling and shit, it's early but I cant sleep because it's raining and my neck feels ready to pop. I just want to hear about other people's experiences with similar things or recommendations as far as getting either the help I need or the help I think I need. Not looking to buy drugs online, not looking to get into dope, just want people's opinions who have dealt with doctors and similar conditions.",1527927133.0
8nz534,https://www.reddit.com/r/opiates/comments/8nz534/relapse_after_break_up/,6,https://redd.it/8nz534,Kdiamondace,Relapse after break up,"Hey guys so i was clean for around a year while i was dating this girl now im right back to getting high. Im depressed, lonely and missing my ex. I know if i keep this up its just going to make things worse. Anyway im just lonely and want some advice and people to talk to....Thanks guys",1527926270.0
8nz30c,https://i.redd.it/zh041jhykj111.jpg,18,https://redd.it/8nz30c,oxyskullkid,"Oxy 15, 1mg Xan and Kpin and making sure I’m ready for season 2 :)",,1527925331.0
8nyzqr,https://www.reddit.com/r/opiates/comments/8nyzqr/first_time_staying_out_friday_night_late_in_years/,3,https://redd.it/8nyzqr,iAmAPickleYo,First time staying out Friday night late in years... no opiates,"So I don’t wanna make this hangout session awkward because I never hang and if I did it was when I was high on Oxycodone per se, but I haven’t been touching opiates daily but socializing feels extremely hard. Also I have my Adderall and I never experimented with staying up on them all night for fun/to chill, but I am tonight and it’s 3:15am I took three Adderall 20mg few hours apart since 8am.. and 20mg of my Valium... and I see other people take Adderall and get hyper but having ADHD additionally I’m actually feeling tired and what not even when taking it. 

PS: never abused Adderall because of the said damage on dopamine receptor fears and what not. But my buddy took 270mg of Adderall so far, I’m only 60mg in.",1527923871.0
8nyz0g,https://i.redd.it/xj4k8ghnfj111.jpg,15,https://redd.it/8nyz0g,phlufhead,Can you buy these otc everywhere? Not gonna help me out any.. just curious,,1527923548.0
8nyy2t,https://i.redd.it/u3nk9amjej111.jpg,9,https://redd.it/8nyy2t,OPS_MOM_AMA,The best potentiator of all.,,1527923178.0
8nyvzp,https://i.redd.it/0k5xrayybj111.jpg,31,https://redd.it/8nyvzp,phlufhead,One for the night stand,,1527922309.0
8nyq36,https://i.redd.it/lywmm9e35j111.jpg,20,https://redd.it/8nyq36,NatalieApp,What is this? Supposed to be 80oxy but no markings,,1527920004.0
8nyo0r,https://www.reddit.com/r/opiates/comments/8nyo0r/will_i_have_withdrawals/,4,https://redd.it/8nyo0r,throwaway666718,Will I have withdrawals?,"For the last ~2 weeks, I've been taking either Tramadol or Vicodin everyday.  

I took Tramadol was for the first 9 days, and each time I would take ~300mg throughout the day. It was 37.5/325 Tramadol, so honestly I was worried more about the APAP than anything, but so far I'm okay.

The last 3 days I've been taking Vicodin. It's 5/325 Vicodin and I take ~45mg throughout the day.

I want to binge for a few more days until I run out, but I'm getting pretty worried about having to face withdrawals. Am I already fucked? If so, how fucked? What kind of symptoms should I expect with these doses and how long will they last? ",1527919269.0
8nyla1,https://www.reddit.com/r/opiates/comments/8nyla1/bullshit_just_plain_bullshit/,8,https://redd.it/8nyla1,BrandonS5931,"Bullshit, just plain Bullshit","I'm just sick and tried of getting ripped off! If your going to sell dope then fucking sell dope! I don't think that's too much to ask but I can't sling a dead opossum around here without hitting someone who's ripped my off! (Sorry about that analogy but I'm country as shit) but like I was going on about! My supposedly best fiend oh I mean freind just try to stab me cause he tried to a rip me off, what the fuck!! Really! I was in the Marines for 8 years and I can handle myself so I took the knife from him and he ran like the little bitch he is! I just wish it was like it used to be when a man's word was enough but nowadays that all out the window! I hate to agree with the media but ""The Epidemic"" is real here, I live in a small county in a state above SC, Everyone knows everybodys business and the ""Black,"" market here is even smaller, so why would you even try that fucking bullshit! Idk but I'm sorry I went on like that I just thought y'all like to here about what it's like here in Hillbilly Hell, y'all have a good night",1527918239.0
8nyk7m,https://www.reddit.com/r/opiates/comments/8nyk7m/tramadol_safety_questions/,6,https://redd.it/8nyk7m,dumbquestionmachine,Tramadol Safety Questions,"Hey guys! So I recently got a couple Tramadol 50mg pills (4 to be exact). Now I am a daily user of kratom, about 8g a day. I have heard that Tramadol does not interact with most drugs very well. I was wondering If I wanted to take some of this Tramadol should I just skip my kratom doses for the day? How dangerous is Tramadol? I just learned about the seizure risk with Tramadol as I have never taken this before. How easy is it to have a seizure on this? Any info would be greatly appreciated, sorry if any of these are dumb questions. Thanks guys!",1527917835.0
