8whgc3,https://i.redd.it/55ae1hl3i9811.jpg,17,https://redd.it/8whgc3,jlogic420,Pharma Bars and oxy,,1530854245.0
8whfsv,https://i.redd.it/yhaj8wynh9811.jpg,5,https://redd.it/8whfsv,Sovereign_Mind,"my best friend just got into town ans brought the white, I had the brown. gonna be a good night",,1530854092.0
8whent,https://i.redd.it/3qt96skog9811.jpg,18,https://redd.it/8whent,hbarnes55,Just a laid back night with my boo 😊 my camera is poor quality,,1530853761.0
8wha2s,https://www.reddit.com/r/opiates/comments/8wha2s/question_about_temgesic/,8,https://redd.it/8wha2s,whereismymindohyeah,Question about temgesic,"Little background, chronic pain patient who was prescribed oxy, came off it about 5 days ago(my decision) as it was not helping too much and I was having to buy extra pills each month. 
Anyway my pain doc has prescribed 200mcg temgesic sublingual tablets to take as required for pain relief. He said I should be fine taking it say 3 or 4 days a week and opiate free the other days. My question is will the 3 or 4 days of use be enough to make me withdrawal the days I don't use it?
I have no experience with bupe at all aside from norspan patches which made me terribly sick.",1530852462.0
8wh7bj,https://www.reddit.com/r/opiates/comments/8wh7bj/should_i_take_more_oxy_to_enhance_my_experience/,1,https://redd.it/8wh7bj,awer0515,Should I take more oxy to enhance my experience or a little bit of xanax?,I've taken 75mg of oxy IR so far and I'm not sure if I should add another 15-45mg or if I should take like 1mg of Xanax or like a .5 of Xanax and a .25 of Klonopin. I have a really heavy benzo tolerance so I can take 20-30mg of Xanax at once and not blackout or be fucked up like some people I know get off of 2 mg. I know opiates and benzos aren't safe to combine but I wanted y'alls opinions since I have a heavy benzo tolerance and I'm not a rookie to opiates. It takes 120-150 of oxy to make me nod.  I've already taken 5 mg of Xanax and a .5 of Klonopin this morning as well but that was 12 hours ago. Took the oxy 40 minutes ago and I'm feeling pretty good right now but I'm shooting for a good ass nod while I smoke and try to enjoy my last day of getting high for a week and a half since I'm going to visit family. Thanks for taking the time to read my post and hopefully give me some feedback.,1530851654.0
8wh6zd,https://www.reddit.com/r/opiates/comments/8wh6zd/how_long_of_a_break_would_i_have_to_take_to_be/,5,https://redd.it/8wh6zd,SJH009,How long of a break would I have to take to be able to use again over a weekend and not risk getting dopesick again?,"Hi all, 

I've been clean for about a week and some change. Prior to that I was dependent on opiates for like a year with only a few clean days here and there. I decided to stop cold turkey because it was starting to really get out of hand and I wanted out before I was in too deep. Anyway, my dope dude is leaving the city for good in about 2 weeks and I want to pick up again and have on last hurrah before leaving it for the time being. He's my only link that has real H, everything else here are fentalogues which I have no intention on touching. So once he's gone I won't have access to anything. I was hoping to get a gram and do that over a weekend but I'm worried I'll go back to square one because it's so soon. What do you think? Also wondering if my tolerance will go down by then? When this happens ill have like 2 weeks of clean time. ",1530851557.0
8wh3jy,https://i.redd.it/c1ermypa79811.jpg,3,https://redd.it/8wh3jy,deadeyelewlew,"My little stash for tonight, .3 dope .3 ice and a quarter of weed",,1530850606.0
8wgz7f,https://www.reddit.com/r/opiates/comments/8wgz7f/do_you_smoke_cigarettes/,47,https://redd.it/8wgz7f,ajsatx,Do you smoke cigarettes?,"It seems like almost everyone I know who's done dope also smoked, but not me. I can't imagine having to spend that extra money!",1530849463.0
8wgv57,https://www.reddit.com/r/opiates/comments/8wgv57/driving_lyft_a_good_job_for_an_addict_like_me/,13,https://redd.it/8wgv57,bluebonnet-queen,Driving Lyft: a good job for an addict like me.,"Don't normally post with a throwaway. But since this is my ""job"" I will.

I was scared for a long time to start working again. I dreaded having to go into work early while dopesick, and trying to hide it. 

But with Lyft I can choose when I work. So if I really need to I can work all morning, gather up enough money to score, go cop, then come home and chill out for an hour or two before turning my app back on. I always try my best to be sober in the car tho, so taking a powernap before working again helps. It's really ideal for my situation.",1530848340.0
8wgtyy,https://www.youtube.com/attribution_link?a=d1zWQQTzGZM&u=%2Fwatch%3Fv%3DDLbqnmvLPKE%26feature%3Dshare,2,https://redd.it/8wgtyy,travs3dpe,grandson - Bury Me Face Down (Audio),,1530848084.0
8wgsxj,https://www.reddit.com/r/opiates/comments/8wgsxj/downward_spiral/,13,https://redd.it/8wgsxj,Sovereign_Mind,Downward Spiral,"Drive down
Down
Down
The highway.
God does does
Doesn’t know where.
You dont care,
Just stare,
Down
Down
Down
That road,
Black asphalt long travelled,
beaten, worn.
Destined?
Despair.",1530847811.0
8wgsgk,https://i.redd.it/ixc81aiky8811.jpg,26,https://redd.it/8wgsgk,awer0515,She finally came through 😬 got everything for free,,1530847674.0
8wgn1d,https://www.reddit.com/r/opiates/comments/8wgn1d/compassionate_doctor/,9,https://redd.it/8wgn1d,TrappeddownSouth,Compassionate Doctor!!!,"For the past 6 months, I have been dealing with complications from a surgery gone awry. I had a bad abscess drained - full anasthesia, 4 days in hospital. Unfortanately, the surgeon left dead tissue in my leg which almost lead to gas gangrene.

Since then, I have been dealing with a spreading and recurring infection in my leg. I have been hospitalized 6 additional times for 46 days total and have had 4 additional surgeries to clear up the infection. Two of the wounds created since then are right on my left and right groin - each about 1.5""×6-7""×1.5"" deep. Bad area for wounds - despite going to wound care and taking copious amounts of antibiotics, they have repeatedly gotten reinfected.

Needless to say, I have been dealing with A LOT of pain. There are plenty of bad days when I can barely walk.

Unfortanately, pain control has been a major issue. While I am in the hospital, I am usually good. They have good hospitalists where I go and knowing my tolerance and seeing my old charts, they usually give me 20-30mg of Oxycodone every 4-6 hours + IV morphine or hydromotphone for breakthrough pain.

When I get out though, I am screwed. Thus far, I have been sent home with scripts ranging from 20 800mg Ibuprofens or 12 5/325 Percs to at best, 24 5mg Oxycodones or 12 15mg Oxycodones. Since they are hospitalists, I cannit follow up with them. Wound Care will not prescribe narcotics and the three primary care doctors I have seen have AT MOST given me a couple days worth of 5/325 Vicodins or Percocets.

Part of the issue I know is my ""checkered"" medical history. But I am in LEGIT pain - any doctor can see the GAPING wounds and if they look at my chart, they can see this is an ongoing issue. Even so, it would take me 6-8 weeks just to see a Pain Management doctor.

In addition, the state I live in just passed a new Opiate Epidenic law. Non-Pain Management doctors cannot prescribe new patiebns more than 90 Morphine Mg equivalents per day. They use a 2:1 ratio, so that is ONLY 45mg of Oxycodone. Scripts cannot be for more than 5 days and some pharmacies, like Wal Mart, have their own policies not to fill scripts for more than 50 morphine mg equivalents (that is less than 3 Perc 10s per day). While their are exceptions to the new law, the state makes these doctors jump through 20 hoops to get there. It is asinine.

For the past 6 days, I have been in the hospital AGAIN! I had my two groin wounds re opened and the re infection cut out. Cue more pain!

As such, I was shocked today. The doctor I have beem seeing in the hospital was real cool - PLUS he has his own practice. Even though it is risky for him to do so, when he discharged me, he actually spent a couple hours jumoing through the state's hoops and gave me a 7-day prescription for 20mg Oxycodone to be taken every 4 hours. I have no intention of abusing this - I only want to be pain free or at least have manageable pain.

Plus, I am able to see him in a week - he made the appt and told me we can work together to manage my pain until my wounds are healed or this ordeal is over. That could easily be another 2-3 months. Even so, I am BEYOND HAPPY to have a TRUE AND COMPASSIO MNATE doctor - for the first rime in months, I see a light at the end of the tunnel of this ordeal!!!",1530846237.0
8wg61g,https://www.reddit.com/r/opiates/comments/8wg61g/midazolam_monkey_water/,17,https://redd.it/8wg61g,tramalove,"Midazolam ""monkey water""","I have posted the last days about Midazolam score. I've ate, snort and IV'd It. There is no opiate warm rush, but a strong feeling of calm hits hard when IV. Snorted and orally is similar, but slower and milder.  When doing my research, I found no report about how much it hurts when snorted! O God, a cough any eyes full of tears. So I started IV, but tolerance build fast and I've tried up to 37 mg IV and didn't get an awesome rush. I kept reading reading and found that a lower pH helps with water solubility. I IV'd with some  acetic acid from vinegar, with better results, but nothing extraordinary. 

So, as snorting hurt so much, I decided to prepare **sloth water**, which is a similar acidic solution to ""monkey water"" with this unique water soluble benzo. 

Write this took me like 45 min
Stay safe!",1530841888.0
8wftk3,https://www.reddit.com/r/opiates/comments/8wftk3/spending_habits_oxy_panda_life_quality/,24,https://redd.it/8wftk3,starlitobaby615,Spending habits / Oxy & Panda/ life quality,"If you were single male, late 20s, very low living expenses and made 1800-2800$ a week, would you feel guilty spending 350 (small week) - 500$ a week on oxy / panda? Sometimes I max out at 650$ ish..

It helps immensely with stomach issues (I literally wake up and puke stomach acid on the days I don’t dose.. even when on sub or Kratom) and improves my life quality so much, but I can’t get over how much I’m spending.

Can’t get a script for over 15mg a day due to my age and the opiate scare. Also had a script taken away for trying to taper myself? So I may have burnt my bridge.

Any advice? Sorry is this is a bratty question.. sucks having to pay to feel able to eat or sleep without choking on stomach acid. Literally a day or night difference in my life, and the people who love me like me better when I’m medicated as well, as I’m not sick and in bed a lot (like before I found opiates)",1530838700.0
8wftiu,https://www.reddit.com/r/opiates/comments/8wftiu/anyone_ever_noticed_that_suboxone_causes_opiates/,29,https://redd.it/8wftiu,AmbGrr,Anyone ever noticed that suboxone causes opiates to stay in your system longer and can cause you to fail a drug test even 2 weeks after using?,"The first month I started treatment, i messed up 2 weeks in and used half of a 20 panda. It being 2 weeks before my next test, i thought it would be okay but my dip test came up positive for oxy. Which seems crazy to me. This has happened to my friends too though. Why does this happen? Anyone know?",1530838690.0
8wfonl,https://www.reddit.com/r/opiates/comments/8wfonl/you_know_your_a_junkie_when/,115,https://redd.it/8wfonl,travs3dpe,You Know Your A Junkie When...,"You go to white castle in the hood and get out of your car and the homeless dude out front recognizes you and says AY TRAVS MY NIGGA YOU STILL ALIVE YOU GUTTER MOFUCKA! Yeah Slime im somehow alive and see your still smoking crack. Gave him a few bucks and some smokes hope he got that rock. The white castle was awful , as expected. ",1530837477.0
8wfn1p,https://www.reddit.com/r/opiates/comments/8wfn1p/that_feeling_when_you_finally_hit/,7,https://redd.it/8wfn1p,dopeboy1989,That feeling when you finally hit,So I know the rush and the itch and all that but when I get a good shot it feels like I have a bit of an allergic reaction my face gets all red and hot and stuff am I allergic to something in the dope cuz I don't get it Everytime just sometimes but it's been with different dope and I always get ecp I wonder if it's the cut or something idk cuz if I miss a little bit and get some under my skin my whole arm will break out with like hives for like an HR or so after but when I get a good shot my whole face and arms get red and splotchy for a little bit and then it goes away is this everyone or just me ? ,1530837057.0
8wdecw,https://www.reddit.com/r/opiates/comments/8wdecw/pharmaceutical_morphine_im_for_first_time_user_23m/,5,https://redd.it/8wdecw,habitual_habitual,Pharmaceutical Morphine IM for first time user (23M),"Hey all, I have the opportunity to acquire some pharmaceutical morphine vials,  I have no prior experience with opiates aside from having Percocet after a dental operation. 

I am experienced in using Ketamine intramuscularly, and while I went through a brief phase of chronic use-until-its-gone, I ultimately moved on from that. After using a needle the first time, I've gained a certain respect for factory-sealed, quality pharmaceutical products, and I am looking to expand my knowledge and experience. 

Furthermore, this morphine is something I want to have on hand for my adventure bag, in case anything goes wrong in the wilderness and I need something strong to keep my head on. 

So my question, is this advisable for a first timer? I am what you would call a drug nerd, I am not a fiend but I use considerably more than a non [user.](https://user.So) So assuming I get some of this morphine to have on hand, and I try 10mg IM while I'm on vacation, is it really likely that I develop a habit? I would really hate to be out there in the wilderness with a compound fracture and not have it on hand, but once I have it I'm pretty certain I'd like to try it just for kicks also. 

What do you recommend?",1530819503.0
8wfd27,https://www.reddit.com/r/opiates/comments/8wfd27/is_this_the_extent_of_codeine/,6,https://redd.it/8wfd27,AllisonMarieeee,Is this the extent of codeine?,"Hi friends! So I have no opiate tolerance, never taken anything besides Adderall and weed before so this is a first and I'm not sure how it should feel. I drank 30 mg an hour ago and then another 30 half an hour ago so I'm at 60 so far. My arms feel numb, I feel relaxed and more social but I kinda expected more from this I guess lol. Just feels like weed without the mental oomph. I feel good but I don't feel high. Is this the extent of what it will do or should I take more? I'm a 20 year old female 5'3 and 140 lbs",1530834670.0
8wfau0,https://i.redd.it/kvdyrtrbu7811.jpg,15,https://redd.it/8wfau0,iluvdrugz,After dinner dessert. 1 and a half down. 1 and a half to go. Plus a nice cocktail to bring it all together.,,1530834137.0
8wf3b0,https://i.redd.it/lae1shp1p7811.jpg,71,https://redd.it/8wf3b0,PizzaPelican,What would you do for one of these?,,1530832361.0
8wc29r,https://i.redd.it/igr7fvs0u5811.jpg,2,https://redd.it/8wc29r,phallometric_device,<3,,1530809823.0
8we0jp,https://i.redd.it/0leh3zpsz6811.jpg,2,https://redd.it/8we0jp,finnishopiates,"My treats for tonight, 20mg IR oxy and 3,13mg/ml codeine",,1530823933.0
8wf09l,https://i.redd.it/7zuukuezm7811.jpg,19,https://redd.it/8wf09l,EvilxxTaco,When you're cleaning and find the beans you didn't know you dropped behind the night stand.,,1530831669.0
8wemf7,https://www.reddit.com/r/opiates/comments/8wemf7/suboxone_got_me_high_one_day_and_sick_the_next/,4,https://redd.it/8wemf7,Popcorn23401,Suboxone got me high one day and sick the next?,"So I am used to 50–60mg oxy a day then went cold turkey for 3 days and took 4mg of sub in the morning and was high as fuck. I ended up taking another 4 in the evening and I was fucked up again. Anyway I woke up today and took another 4 and I’ve been sick all day. Stomach is upset, big headache, and not high at all. Is this normal? Any help guys? Thanks.",1530828521.0
8wex4e,https://i.redd.it/zsdp7lbrk7811.jpg,0,https://redd.it/8wex4e,Ryan_21593,Scored a little again,,1530830921.0
8wew8u,https://www.reddit.com/r/opiates/comments/8wew8u/whats_your_personal_record_of_clean_time/,55,https://redd.it/8wew8u,SnikkiDoodle_31,What's your personal record of clean time?,"Interested in hearing everyone's longest stint of being clean. Just from opiates/your DOC because I consider occasional drinking or smoking the ganja clean as long as you don't over do it. 

What's your personal record? Did you go to a medical detox or inpatient rehab to get clean or did you just do it at home? Any IOP or NOP? Were you on maintenance drugs long term, for a quick taper, or not at all. 

Basically I'm curious which way is the ""most successful"" in getting or staying clean. And who better to ask than us on r/opiates ourselves? ",1530830729.0
8wev23,https://www.reddit.com/r/opiates/comments/8wev23/any_way_to_know_if_there_is_a_warrant_out_for/,25,https://redd.it/8wev23,foxi4roxi,Any way to know if there is a warrant out for your arrest??,"This is in regards to my post the other day about being charged with the wrong substance. The current citation is a misd. Possession of oxy. The officer stated upon state lab results he could change the charge and as I’ve done some research the charge would change to a felony if in fact he decided to go off of what lab results verify. My lawyer is trying to just plead guilty to the misdemeanor and get it taken care of as soon as possible, hopefully before lab results come back. All depends on the DA’s decision. My question is if In fact everything goes wrong and I do get a charge for a felony and a warrant is issued for my arrest, is there anyway I can know of this so I can just turn myself in rather than getting my door kicked in and totally embarrassed by my family? I just feel as if my life is completely in fear right now and I’m constantly looking over my shoulder not knowing if there is a warrant out for my arrest? Any and all opinions would be helpful, thank you!",1530830453.0
8wetft,https://i.redd.it/ajbpupu9i7811.jpg,6,https://redd.it/8wetft,itchy-itchydextro,Evolution ig,,1530830084.0
8wes24,https://www.reddit.com/r/opiates/comments/8wes24/cracking_down_on_opiates/,6,https://redd.it/8wes24,69Seabass69,Cracking down on opiates .,"This shit pisses me off . They are  the reason more people are dying and prices are going through the roof.  I am so tired of the Opiate “Epidemic “ it’s a bunch of pussy ass bitches . Most people if not any are not dying from pain pills there dying from the fake ones that were made because of the crackdown . Does everyone else think this is stupid as fuck ?

https://www.painnewsnetwork.org/stories/2016/6/23/us-inundated-with-fake-fentanyl-pills",1530829774.0
8wes1c,https://www.reddit.com/r/opiates/comments/8wes1c/blow_n_fent/,5,https://redd.it/8wes1c,btcmillenial,blow n fent,"4 days into my bender and i'm still going strong, copped .8 of fentanyl hcl, 11g of blow, and 4 fent pressed blues

the bender continues!!!",1530829769.0
8weocp,https://i.redd.it/w9i3f5twe7811.jpg,17,https://redd.it/8weocp,sizz_lor,Got some afghan #4 . Is this stuff smokeable?,,1530828954.0
8wehg6,https://www.reddit.com/r/opiates/comments/8wehg6/i_got_the_4mg_alprazolam_gummy_worms_helps_so/,19,https://redd.it/8wehg6,g3rm3y,I got the 4mg alprazolam gummy worms! (Helps so much during wd),"Thanks to everyone who helped me tips and tricks while going thru my first awful opiate wd. I ate one gummy and within 4 mins I almost feel totally normal and relaxed, besides some muscle cramps and twitches, but nothing like before, i hope this info reaches someone who is going thru their first wd alph is a life saver for having a sleep aid.. I took 3mg melatonin and a fuck ton of muscle relaxers and that cocktail of Tylenol and muscle relaxers didn’t do much of anything , thank god the plug came theu w the gummies, he showed hella love by selling me 8, 4mg alprazolam gummy’s for 10$!! And he also shot me a quarter ounce of some ight tree for 10$, I love being able to form such a good relationship w people over drugs, we Fr hell each other out, because NO ONE will know how it feels until they go thru it themselves.. much love -germ 
Edit: Feel free to comment any tips you have that have worked for you in the past. (: I quit cold turkey so I definitely needed a benzo.. ",1530827463.0
8wegvn,https://www.reddit.com/r/opiates/comments/8wegvn/difference_between_fentanyl_and_heroin/,9,https://redd.it/8wegvn,Sovereign_Mind,Difference between Fentanyl and Heroin,"[NOTE: I ONLY SNORT]

The difference between heroin laced with fentanyl and regular heroin is HUGE. fent heroin lasts for around an hour, and is wayyy more intense, stronger, and more euphoric. after 1-2 hours, intense cravings begin. after a day of doing fent dope, I find that the next day I an extremely stressed and on edge. the only thing I can do is get more.

REAL HEROIN comes on nice and SLOW. it is NOT intense. it is a very mild and warm LOADS of itching. these effects can last from 6 to 8 HOURS before cravings begin.

Honestly I feel like fent is the crack form of heroin, and cocaine would be regular diamorphine. I do like heroin more even though it is less euphoric. much more pleasant. most stamp baggies in the southeast are a high concentration of fentanyl and have hardly any diamorphine.

thoughts? agree? disagree?",1530827336.0
8weghc,https://www.reddit.com/r/opiates/comments/8weghc/planning_a_relapse_vaction/,11,https://redd.it/8weghc,red_hi_tec,Planning a relapse vaction,"I been clean (on subs,and weed) for little over 3 months now and im going to visit my best friend and take off work for a week. Going to stop taking my subs on Saturday and when i get there hes gona habe atleast 10 grams like he always does. Hopefully can get some benzos too. Gona try and just do it for the time im visiting and take a sub on the way home.",1530827254.0
8we5s4,https://www.reddit.com/r/opiates/comments/8we5s4/yooo_lets_talk_about_health_problems_weve_ignored/,17,https://redd.it/8we5s4,o-p-yum,Yooo let's talk about health problems we've ignored for way too long in active addiction!,Idk whats wrong with me but I am seeing specialist after specialist. I have taken a turn for the worst in the last month. My quality of life is at an all time low. I'm just ignoring that quietly burning to ashes on the back burner while I focus on being high. Smh.,1530824999.0
8we4cq,https://www.reddit.com/r/opiates/comments/8we4cq/why_does_opiate_withdrawal_feel_exactly_like_a_flu/,4,https://redd.it/8we4cq,TruckloadOfCorgis,Why does opiate withdrawal feel exactly like a flu?,"I've always wondered the scientific reason why opiate withdrawal feels exactly like a super-flu. I've withdrawn from other drugs and while you feel like shit, they feel like their own unique experience, not like any other disease. But here I am on day 6 of lowering my Suboxone dose and I swear I cannot tell if I really have a cold or if its withdrawal. It feels EXACTLY the same. I'm so tempted to take 1mg and see if it all goes away, confirming that it's not a flu. That would be stupid though so I won't

But flu symptoms are caused by the immune system fighting off a foreign invader, and opiate withdrawal isn't a foreign invader attacking the body, so why does the body feel like its fighting a virus when withdrawing from opiates

Google doesn't help with this question it just gives me websites with generic withdrawal info",1530824706.0
8we3dk,https://www.reddit.com/r/opiates/comments/8we3dk/what_damage_am_i_doing_to_myself/,10,https://redd.it/8we3dk,petergreensfm,What damage am I doing to myself?,"4 days ago I found 180 30/500 codeine/paracetamol tablets. I’ve been doing cold water extractions on them and I went through 100 of them in 3 days. Is doing this much codeine damaging any of my organs? I know the paracetamol could be damaging my liver, but I’m not sure what doing 3 grams of codeine in 3 days would do to my other organs. Should I slow down?",1530824505.0
8we1xf,https://i.redd.it/uyfguj4v07811.jpg,23,https://redd.it/8we1xf,OxyTheOxen,America runs on Dunkins’ shady bathroom deals....my guy just handed these to me...says he’s tired of not being able to sell them and said “you’re the only one that bought them and that’s only cause I kinda tricked you the other night” hahaha I guess it all comes out in the wash after all !,,1530824228.0
8wdv5f,https://i.imgur.com/8s2L1lS.jpg,46,https://redd.it/8wdv5f,OpiCyde,Been on subs 2 months now but haven’t stopped picking up when the plug has them. 45 more coming tomorrow. God I’m a moron.,,1530822853.0
8wdv33,https://www.reddit.com/r/opiates/comments/8wdv33/kratom_help/,11,https://redd.it/8wdv33,mrsjohnson87,Kratom help,Im sure its been asked a million times but i HAVE to get off oxy and want to get some kratom because ive heard its a godsend. Can someone please tell me the best kind to get and how much to take and also the best way to take it? And is it ok to get it from the gas station or smokeshop? Any advice welcome. Thanks guys and girls! Love yall ❤,1530822843.0
