250ovu,https://www.reddit.com/r/opiates/comments/250ovu/sigh_2_weeks_till_real_connect_need_help_w_pst/,3,https://redd.it/250ovu,LoneRegret,"Sigh. 2 Weeks Till Real Connect, Need Help W/ PST","So, for some stupid reason my connects refill date has been postponed by 2 weeks. This is immensely depressing considering I'd waited two long weeks for this day to come. Digressing, I'm an avid opiophile and have tasted everything under the rainbow, infact having a heroin addiction for many years out of highschool...I now only use pills, and subsequently chip because I've had 8 years of stupid levels of addiction. I haven't, however, tried poppy seed tea. I'm wondering if anyone might recommend brands, the only bulk supplier I know of in my city is Winco but I can't speak as to the quality of their product. I'd just like some ideas of what to try, I'll ingest any amount to chase comfort. Thanks!",1399526267.0
250j4m,https://www.reddit.com/r/opiates/comments/250j4m/do_you_remember_this_user/,25,https://redd.it/250j4m,Duramaxpower,Do you remember this user?,"Hey y'all,

We've been slowly acclimating ourselves to the BTH that our new city provides.  It helps that we've gotten some cool new plugs thanks to a few very generous peoples.  As I said before, we really never realized how lucky we were getting $170 bricks of ECP back in the dirty.


Anyway, I wanted to see if anyone remembered a member here who posted quite a bit of d0pe p0rn...they were stamped bags of ECP; however, they were stamped with things like airplanes and ""mile high.""  I believe this member was procuring them in the same area we're in now...Rocky Mountain Region.  I'm pretty sure these posts were made within the last year or so, and he/she had made quite a few, showing new batches and a reasonable quantity.  If you can remember who that was, or can find one of those old posts, that's great.  If you could be so kind to PM me with what you know about that user, particularly their handle, we'd really appreciate it!

It's a long shot, but hey why not...you guys are awesome!",1399521594.0
250h4b,https://www.reddit.com/r/opiates/comments/250h4b/to_those_who_have_caught_a_case/,21,https://redd.it/250h4b,opiatethrowaway420,To those who have caught a case....,"Tell us how it all went down.

Were you raided due to being investigated,  snitched on, or just caught slippin'?",1399520068.0
250eyt,https://www.reddit.com/r/opiates/comments/250eyt/charges_for_possession_of_heroin_and_naloxone/,23,https://redd.it/250eyt,jld2k6,Charges for possession of heroin and naloxone dropped! I'm not going to be a felon! Thank god. Be careful guys.,"I got really lucky. The only thing I'm being charged with is the IM needle that went with the naloxone tracy was nice enough to send to me. I get sentenced in two months. Wish me luck! Careful guys, it's really easy to catch a felony with the habit of opiates.

Edit: they dropped all three but I had to plead no contest to attempt to possess drugs. Tracey was right when she told me they would drop the naloxone charge :) I need to replace my naloxone now but I think I'm gonna get it prescribed this time and go the 100% legal route. I am sad the fate of my naloxone was an incinerator and not saving someomes life though :(

Edit 3: the other awesome part is I was not even arrested so there are no mugshots of me able to be googled. The paramedics were bros and told the police that my hear rate being over 100 meant I should go to the hospital. I didn't even think I was being charged until I was served papers and a court date. ",1399518536.0
250am4,https://www.reddit.com/r/opiates/comments/250am4/ohio_harm_reduction_people/,16,https://redd.it/250am4,traceyh415,Ohio Harm Reduction People,I am going to be in your state soon helping get the Cincinnati Needle Exchange off the ground and raising funds for harm reduction! We will be looking for volunteers. More details coming soon. ,1399515657.0
2509iv,https://www.reddit.com/r/opiates/comments/2509iv/summer_tours/,53,https://redd.it/2509iv,Fluffhead3,Summer Tours,"Anybody looking forward to summer concert season as much as I am? Phish, The Avett Brothers, and DMB are some that I know I'm 100% going to. How about you guys??",1399514941.0
2505u9,https://www.reddit.com/r/opiates/comments/2505u9/pill_crusher/,32,https://redd.it/2505u9,tennis22,Pill crusher,"For all you pill users who bust your pills down and rail them, I highly recommend buying one of the pill crushers from Walgreens/cvs.  Def the best 8 bucks I've spent. Saves me so much time and gets the powder nice and fine.  Extremely happy with my purchase. That is all.",1399512581.0
25055o,https://www.reddit.com/r/opiates/comments/25055o/only_very_mild_effects_with_pst/,22,https://redd.it/25055o,DeputyClementine,Only very mild effects with PST?,"Hi guys and gals! 

I received my package of poppy seeds today, made a batch a couple hours ago and gotta admit that I'm really not too impressed with it. I'm wondering if I did it wrong, just need more seeds, or since I'm on about 15mg Methadone daily that may be interfering with it. (I should add that I ordered from a very reliable vendor so I'm 99% sure it's not the seeds.)

I used about 2lbs of seeds, covered to about an inch above them wIth warm water in a container and shook for about 2 min. 
Drained that and then repeated. Oh and I also added lemon to the water. 

I honestly can't tell too much difference other then it has helped my nerves and pain a bit, which is great but I was thinking I'd be a little more happier right about now. 

So is this it or did I miss a step or should I try again with maybe more seeds next time? 

Thanks in advance for any help!",1399512143.0
2504hu,https://www.reddit.com/r/opiates/comments/2504hu/anyone_know_where_to_get_some_decent_poppy_seeds/,9,https://redd.it/2504hu,Stabbing_Squidward,anyone know where to get some decent poppy seeds?,"So I was a long time (5 year) heavy oxy user, I have been on suboxone management for 2 years and was recently kicked out because they made counseling mandatory and with a family and a job where I'm on call constantly it wasn't manageable for me. I have a few strips left that I've been savoring, trying to stretch em for as long as I can. My question is, I've been reading a lot about this poppy seed tea and I'm thinking it will be helpful in shaking the WD's of subs, but where do I find a decent unwashed bag of seeds? I've looked all over amazon and every item has people raving about it while others are saying ""totally washed don't waste your money."" Where the hell can I find a reliable source of unwashed seeds? Price isn't an issue. It doesn't have to be from amazon, it's just obviously more convenient coming ordering on there. Please help a fellow opiate addict in need. Thanks",1399511711.0
24zws0,https://www.reddit.com/r/opiates/comments/24zws0/so_guys_whats_something_positive_thats_happened/,72,https://redd.it/24zws0,AtheistAstronaut,"So guys, what's something positive that's happened to you lately?","We all have our bad stories here and our good ones (almost always about dope).

I know this is a sub about opiates, but let's hear some good news about stuff going on in you guys' lives that don't have anything to do with opiates! 

I'm ready for some good news about my favorite people on reddit!",1399506656.0
24zphv,https://www.reddit.com/r/opiates/comments/24zphv/mystery_substance/,29,https://redd.it/24zphv,JohnCurtisSnow,Mystery Substance,"A friend of mine found some baggies of a beige powder, to me it smells like clay or makeup but apparantly there were stamp wrappers with it. I tried to test it via melting it on foil but without water it just turns to ash, with water it does produce white smoke but does NOT turn into the typical ""beatle"". Anyone have a clue? Ill post a picture shortly.",1399501976.0
24zlh2,https://www.reddit.com/r/opiates/comments/24zlh2/anybody_else_get_uncomfortably_horny_after_kicking/,9,https://redd.it/24zlh2,ImPlayingTheSims,Anybody else get uncomfortably horny after kicking?,,1399499597.0
24zfo5,https://www.reddit.com/r/opiates/comments/24zfo5/so_today_was_a_pretty_good_day_except_for_one/,17,https://redd.it/24zfo5,suburbiaresident,So today was a pretty good day except for one thing that just happened,"I scored 4 30s, and came home, shot 'em, and was just hanging out. Went outside for a cigarette in my backyard and sat down in a chair out there. As soon as I sat down, I heard it. The thing you never want to hear, here in Arizona. *rattlerattle* Fucking rattlesnakes. Two of them. I climbed up onto my chair, considering one was less than a foot a way, and when I did, it coiled up with it's head raised, and I flipped out and jumped as far as I could off of it and now I'm stuck inside. I'm too afraid to go back out. 

fucking snakes",1399496314.0
24z9hw,http://www.youtube.com/attribution_link?a=annUMgzTDrY&u=%2Fwatch%3Fv%3D-hLVl7Asp3k%26feature%3Dshare,9,https://redd.it/24z9hw,someone-who-is-me,Steven Drozd (of the Flaming Lips) talks candidly about his heroin addiction while cooking a shot,,1399492839.0
24z3xj,https://www.reddit.com/r/opiates/comments/24z3xj/pill_identification/,7,https://redd.it/24z3xj,Rcap,Pill Identification,"Sup guys and gals?

So, I've got a bird with a serious medical condition.  Due to this squawkingly painful condition, she is prescribed a plethora of drugs, including 40mg oxymorphone ER.

Now, she usually goes for the generic (win-win, cheaper and SUPER FUCKIN ABUSABLE!!!) formulations, and those are usually the g7x's.  Today however, she gives me some from her talons, and they are light yellow, round pills with 230 printed on one side and a crescent moon on the other.

Has anyone else come across this formulation from 40mg ERs?  Googling doesn't give me enough confirmation one way or the other.  She assures me that they are correct, that they are crushable and snortable.  I would like more confirmation to make sure that they are what they claim to be.  I'm pretty sure they are, however it certainly doesn't hurt to ask.  =]

Thanks guys and gals, nod on!",1399489622.0
24z0eq,https://www.reddit.com/r/opiates/comments/24z0eq/west_coast_question/,16,https://redd.it/24z0eq,ThrowawayBags,West coast question,Hey I'm an east coaster so all I've ever seen is ECP in stamps. I understand that basically all of the D on the west coast is BTH but seeing as they are near THE Golden Triangle why isn't there more high grade Asian powder? Too much ocean to cross? Also where is Asian powder popular is that more a thing of the past with the occasional China white making it here through Asian gangs?,1399487577.0
24yzg1,https://www.reddit.com/r/opiates/comments/24yzg1/going_to_rehab_four_circles/,16,https://redd.it/24yzg1,smokedtunic,Going to rehab (four circles),"Well guys, this is what it amounted to. I moved in with my dad two months ago after getting the cops called on me by my mom and kicked out.. I got my ged, and got a job, and of course hooked in with the h scene in the area. GOt caught shooting. My dad was gonna kick me out of the apartment, and my threatened to cut ties with me along with the rest of my family, unless I go to this four circles treatment center out in NC. This is all because I left my works in a stupid place. So, rather than being disowned by the fam, homeless, and broke, I folded. I'm getting driven there now. It's 2 months :((((... This just sucks so bad. I was about to start working tomorrow too. Wish me luck dudes :/",1399487004.0
24ylg4,http://imgur.com/SfsbhBq,14,https://redd.it/24ylg4,NoddingKing,"My sister got this for me, I thought you guys would appreciate it",,1399478713.0
254sz4,https://www.reddit.com/r/opiates/comments/254sz4/xartemis_questions/,14,https://redd.it/254sz4,sizz-,Xartemis questions,Doctor just prescribed me the new Xartemis drug on the marker. It is oxycodone hydrochloride. He said the 7.5 were at the strength of usually 15mg. I told the doctor I was allergic to tylenol and of course it has 325mg of acetaminophen in it so I'm going to go back and ask him to change it. Does anyone have any experience with this stuff or any helpful things to say?,1399648156.0
254s8w,https://www.reddit.com/r/opiates/comments/254s8w/my_daily_call_logs_amount_to_my_boss_my_dad_and/,9,https://redd.it/254s8w,__alt_account,"My daily call logs amount to my boss, my dad, and my drug dealer",That is all,1399647693.0
254dj6,https://www.reddit.com/r/opiates/comments/254dj6/the_human_element/,16,https://redd.it/254dj6,RockinRoxiThrowAway,The Human Element,"Ive been spending a lot of time quasi-lurking with you folks lately,  occasionally posting here and there.  Ive read of a lot of close calls, first times,  the last times, loss, frustration, the last times, confusion and rage at dealers, fear of going forward, and  also, the last times.

Ive been using in secret (pills) for maybe like 10 years, and up until recently, VERY heavily.  In moderation (which we all know never lasts) it was great! It helped my anxiety and depression, made me fall back in love with the activities that I still thought about and performed in my head, but could never get motivated or care enough to keep pursuing. Apathy is such a cunt.

It's been really nice seeing the experiences of others, the good and bad, that I can relate too. The greater Seattle area isn't the ""Wild West"" that some of you are used to, getting my DOC'S- to this point- have involved shady, untrustworthy punks that apparently secretly pack a 9mm just so he can rip you off for $175. ""I'll be here if you wanna do something bout it"" is all he said. 

Id given this punk ass probably just around $20k over the last couple years and thats how he wanted to play it out. Didnt even have the balls to tell me what apt he ran into. Plus he knew I was in a hurry and codnt wait for hin to make the pickup and get back to my car. 55 minutez into waiting I try callin him 3 times, to no avail.  5 minutes later I get a message back telli  me to ""take it for a loss, and lose my fucking number""
Fuck I wanna get revenge on him, expecially since I helped bailed his ass outta jail when  hiz parents wouldnt, did all the driving for pickups for him, and STILL couldn't get a GD  break in price. Plus he would occasionally slip forgeries to my friends or I thinking he'd sneak off before we'd notice, or sneak under-strength pills in. Plus, he'd turn this a 10-20 minute round trip drive through Brier or Terrace. Good Lord.

On the other end of the spectrum, there are (most) YOU GUYS! Giving out  advice, tips, borderline medical advice to your fellow mellows. And it just makes me feel better about all the secrets I have to keep up and be strong for others, and manage  smiles that I havent had sincerely felf since HS.

The spectrum of users-addicts and all the different substances we use to weave ourselves blankets of warmth and comfort is astounding. 

But, I should reiterate I don't judge, especially because I have no one around me to talk/enjoy it with, ive rather enjoyed chatting a bit with some of you peopls!

Thank you everyone!  And if youre around that 4-two-five area code, PM me!


TLDR: Some people really fucking blow. A lot of you have been very cool to a newbie, and just decent people in general. Always looking to make a new friend and chat about experiences",1399635960.0
254ce2,https://www.reddit.com/r/opiates/comments/254ce2/12_years_of_using_stops_today/,56,https://redd.it/254ce2,Morkabby,12 years of using stops today,"Today begins my climb to sobriety. I've been using heroin for a very very long time, same with prescription pills. 

About a half gram to a gram a day and I've been using 240 20mg oxies and 180 30mg hydromorph contins a month ",1399634708.0
2542bg,https://www.reddit.com/r/opiates/comments/2542bg/disease_or_personal_choice/,44,https://redd.it/2542bg,mrehr,Disease or personal choice?,What model of addiction do you subscribe to? Personally I don't think its a disease; I think its personal choice. Like when it really comes down to it if I want off I need to decide so an every time I use its because I want to. I think its all personal choice.,1399620912.0
25422b,https://www.reddit.com/r/opiates/comments/25422b/anyone_else_ever_have_this_happen/,34,https://redd.it/25422b,30blueworld,Anyone else ever have this happen?,I've been physically dependent to opiates for about 6 years now and have went through wd's soooo many times and over a few of those years learned that dope does nothing but make shit worse. Well due to some lack of research I recently came to a different state (dryest place ever imaginable) and have started going through wd's again except this time it's almost like the dope is helping!? ,1399620585.0
253zie,https://www.reddit.com/r/opiates/comments/253zie/shitty_situation/,10,https://redd.it/253zie,opithrowateaway,Shitty Situation,"Pun totally intended. This blows, I put drugs in my bum to get high, but I need it to be clear in there however the drugs I put into my bum make it so nothing ever comes out. Completely dumb and random post but I'm sure someone out there understands lmao 

/random pointless high rant",1399617584.0
253yer,https://i.imgur.com/YWoVCXm.jpg,18,https://redd.it/253yer,LeJoyfulMerchant,CT blank bundle + 40 piece of hard,,1399616369.0
253uox,http://youtu.be/8SzkF0bFXs4,0,https://redd.it/253uox,dope_eloped,Hi. An instrumental song I made a few years ago. It's chill.,,1399612597.0
253trg,https://www.reddit.com/r/opiates/comments/253trg/direct_deposit/,16,https://redd.it/253trg,throwbrianaway,direct deposit...,"anyone else have problems with direct deposit?  I can't budget my money for shit, and of course I tell all my dboys to wait till 12 for my money to clear and I'll meet em.  I'll even pay extra because they stayed up.  well My check shows its through on the mobile app, but at the banks atm, nothing.  at another atm, nothing. I'm beyond frustrated right now I'm about to PUNCH THROUGH THIS FUCKING GAS STATION QUICKIE MART WINDOW. 

but I won't.  I'll just cry and bitch on here like the piece of shit I am.  added to the fact is that my dealer hasn't answered me anyway, So maybe it's a blessing in disguise.  I bet If my money DID go through, and I couldn't get anything, I'd be even.more frustrated. oh well. just want to rant to people.who get the struggle.  and no I'm not sick, I have plenty of subs.  But I purposely didn't take today thinking I'd be high tonight. ugh.",1399611753.0
253qgf,https://www.reddit.com/r/opiates/comments/253qgf/still_nodding/,3,https://redd.it/253qgf,Whatamidoinghurr,Still nodding,"As you might recall my SO and I have been really really slowing down on our intake. Maybe have picked up twice in the last week.     We picked up a gram today and i smoked about .2 and nodded out for a couple hours, well i woke up, fucked her then went out back fur a smoke, and my ass is still nodding.       
I mean usually when i nod nap i wake up and smoke more but holy shit I'm still nodding after a two hour nap.      
Fuck yeah.       
All praise the nod God, hallelujah!!!!!",1399608967.0
253p6n,https://www.reddit.com/r/opiates/comments/253p6n/question/,5,https://redd.it/253p6n,Heylooktheresastar,Question??,Can you shoot herion and Roxys in the same shot? ,1399608067.0
253e9n,https://www.reddit.com/r/opiates/comments/253e9n/anyone_know_anything_about_iv_neurotransmitter/,29,https://redd.it/253e9n,thetedster180,Anyone know anything about IV neurotransmitter repair therapy to get over withdrawals and cravings/ feel normal?,"I've found a little bit of stuff online discussing this and it sounds like a miracle to be honest. 

http://execucarearc.com/neurotransmitter-restoration-for-detox-from-addiction/

http://www.stgregoryctr.com/detox-services/

God what I would give to feel normal and make it through the way I feel when I stop using... 
",1399600323.0
253bus,https://www.reddit.com/r/opiates/comments/253bus/after_only_scoring_percs_for_like_the_last_month/,7,https://redd.it/253bus,espy22,"After only scoring percs for like the last month, i'm so happy with this [Porno of pills]","http://imgur.com/1MCe3L0

:3 :3",1399598705.0
2535fl,https://www.reddit.com/r/opiates/comments/2535fl/job_offer_coming/,27,https://redd.it/2535fl,junkiebopeep,Job offer coming!,"Had a GREAT interview today, and it looks like I'll have an offer within the next few days.

The only bummer to it is that they drug test, which means I'm going to have to withdraw so I can drop clean urine. I have subs, but my rehab found subs in my urine so I'm kind of afraid to risk it. 

But it'll be good to be working again finally, so I guess it's worth feeling shitty for a few days. Hell, maybe I can get up the motivation to stay clean! 

Anyway, what a great day! I did a shot while driving for the first time which was fun. I switched to 28g from 29 and it's been so much easier to hit!",1399594226.0
252xuo,https://www.reddit.com/r/opiates/comments/252xuo/favorite_blend/,11,https://redd.it/252xuo,pugderpants,Favorite blend ~~~,"I know I've posted a lot recently, but whatever! I like you guys.

Do you ever blend strains? Do you have any favorite blends?

I jus started, and I can't get over 1.5g Get Kratom's Green Indo + 0.8g~ HS'a Green Malay. Sooo physically relaxing with such a nice mood lift!

Edit: SO, apparently I've been posting all of my kratom related posts to /r/opiates. I honestly have no idea why that happened. Sorry!",1399589087.0
252xn8,https://www.reddit.com/r/opiates/comments/252xn8/maybe_we_should_all_start_taking_positive_action/,18,https://redd.it/252xn8,pugderpants,Maybe we should all start taking positive action?,"As we all know, if there's any negative press or threats of banning, we'll definitely hear about it. But maybe we should start preemptively striking and taking positive action - promoting facts and positive press, donating/helping legitimate sites/groups that are doing so, as well as writing to state reps informing them about kratom _before_ bills arise. 

I know that, here in Texas, there are a few state reps strongly pushing for medical marijuana. I'm thinking of writing short letters to them thanking them for their efforts, and giving them some facts about kratom. Maybe this way we can start helping lawmakers form positive opinions of kratom, before the fear mongering takes hold.

Thoughts?

EDIT: OH MY GOD this was totally meant for /r/kratom. Whoopswhoopswhoops",1399588953.0
252wrj,https://www.reddit.com/r/opiates/comments/252wrj/my_experience_with_cravings_after_kicking_this/,16,https://redd.it/252wrj,JuicyJay,My experience with cravings after kicking this time.,"I have gotten off opiates a few times and relapsed on day 5-6 due to cravings. They are a bitch that you still deal with months after stopping. My experience this time is completely different. I'm on day 6 no dope and day 4 no bupe.  Usually at this time I can't stop thinking about dope and it leads me to relapse. But this time is different and I believe it's all due to a tip I got while in detox.

We had to attend an aa meeting while in detox. One guys story is what completely changed the way I was going about this whole recovery thing. He told us about when he first got clean his cravings were so bad.  He was going to these na meetings and was amazed that people weren't having cravings at only a month or two clean. So he asked them what they were doing to stop them. He told us that all they did was ask their higher power to remove the cravings from them. So that's what I've been doing. I believe in a god, but I also believe you have all the power. So I started saying/praying that I wouldn't have cravings. This is the only thing I have done differently this time, and at like 4 days with absolutely no opiates (2mg of bupe early in the morning was the last dose I took) I haven't had one craving yet. 

It really was that simple for me. Many times a day I say in my head, I won't have cravings, and I don't want to do dope ever. By saying it in my head so many times a day, I constantly remind myself that I don't in fact want to go through the hell of withdraws ever again. I feel so much better at this point then I would have ever imagined.",1399588380.0
252wlw,https://www.reddit.com/r/opiates/comments/252wlw/iv_question/,21,https://redd.it/252wlw,turtlescooter,IV Question,"Ok, I'm usually pretty hesitant about about posting questions because I feel like a dumbass, but google isn't helping here. I've IVed dillys about 6 times, and the last two times (2 shots, 4mg each, about 4 hours apart), when my SO hit the vein in the crook of my arm, my upper arm (bicep area) completely spazzed out. It wasn't bad enough to where he could tell that it was shaking, but I definitely could. It felt like a muscle spasm. 

Does anyone know why this is and if it is something I should be worried about? We're planning on doing it again tomorrow, and I'm a little nervous. ",1399588276.0
