7ddafy,https://www.reddit.com/r/opiates/comments/7ddafy/every_night_i_dream_about_opiates/,5,https://redd.it/7ddafy,Psychonaut424,Every night I dream about opiates...,I hate being clean.. I hate everything about it. I'm so depressed and every night I dream about opiates. Last night was about dillies and it's making me go crazy... How do I make cravings like this go away. Im already on Kratom and it doesn't do shit for the paws. So what else do I need to do,1510847861.0
7dd9mz,https://www.reddit.com/r/opiates/comments/7dd9mz/probation_done/,22,https://redd.it/7dd9mz,alwaysintosomethin,Probation = DONE,Holy shit its really over now. I really got my shit together during this time too and never violated once. Its a Damn good feeling not being property of the state anymore.,1510847673.0
7dd86e,https://www.reddit.com/r/opiates/comments/7dd86e/i_think_i_just_went_from_liking_opiates_to_full/,12,https://redd.it/7dd86e,binge_chipper,I think I just went from liking opiates to full on addict,Well I know I was hooked from the first timw I tried. But I onlt ever sis it maybe once a month. Now I just shot a bupe and selling my ahit to hopefukky get some duckinf heroin I kust want to nod forever I lost the game guys I ducjed up,1510847311.0
7dd7r8,https://www.reddit.com/r/opiates/comments/7dd7r8/ummmm/,16,https://redd.it/7dd7r8,ryangoesdownhill,Ummmm,"A crackhead just came up to my car, got his dick out and pissed in front of me while wide eyed, while I was singing along to Everybody Hurts

k",1510847207.0
7dcxgy,https://www.reddit.com/r/opiates/comments/7dcxgy/triggered_at_the_doctor/,3,https://redd.it/7dcxgy,lmaokate,Triggered at the doctor,"I've been clean from IV opiates for about four months with no triggers or negativity. Today I went to the doctor for some blood work. Watching the needle go in and feeling it, triggered. ",1510844537.0
7dcudi,https://www.reddit.com/r/opiates/comments/7dcudi/my_methadone_man_got_busted/,16,https://redd.it/7dcudi,johnnybadd,My methadone man got busted,"So I'm fucked and back on Heroin with a shite high tolerance. I haven't got the money to score everyday.

Can immodium and codeine cover the worse when I can't afford H? 

",1510843739.0
7dcl82,https://i.redd.it/yajcyo02hcyz.jpg,100,https://redd.it/7dcl82,ATownN_Down,Which One of You Hit My Local Pharmacy Last Night? =P,,1510841197.0
7dcl23,https://www.reddit.com/r/opiates/comments/7dcl23/im_back_if_you_didnt_notice_lol/,3,https://redd.it/7dcl23,jarr1k,I'm back if you didn't notice lol,"Hey all! I haven't posted in a few weeks as life has been busy enough such that I've neglected Facebook and twitter, let alone Reddit! Just wanted to wish you all well and hope you're coasting into a good weekend whether you're sober or not. Cheers!
",1510841149.0
7dcgt8,https://www.reddit.com/r/opiates/comments/7dcgt8/is_opium_dangerous/,3,https://redd.it/7dcgt8,TehScudworth,Is Opium dangerous?,"If you smoke Opium are you likely to get as addicted as you would with Heroin? Would it be possible to smoke once and not do it again?
I would never try Heroin but Opium seems more gentle... idk anyway-my only experience with opiates has been codeine ",1510839873.0
7dc4ha,https://www.reddit.com/r/opiates/comments/7dc4ha/need_some_advice_on_withdrawal/,5,https://redd.it/7dc4ha,bloodcontra,Need some advice on withdrawal,"So I'm gonna make this short because the last thing I wanna have to do right now is think and type it out, but for the past month and a half to 2 months I've been dabbling in H, and the past 2 or so weeks I've been doing it almost everyday. It's day 3 of me not having any and what the fuck man, I just feel so uncomfortable and mentally (as well as physically) run down. I wake up at like 2am having soaked the side of the bed I'm on with sweat. When will this get better? What can I do to make this not so shitty? I took a couple barbs this morning and that's kinda sorta doing something but I still feel like shit.",1510836084.0
7dc4ei,https://www.reddit.com/r/opiates/comments/7dc4ei/i_forgot_normal_people_dont_really_know_drugs_i/,12,https://redd.it/7dc4ei,NotStephany,I forgot normal people don’t really *know* drugs. I was mentioning how much i love Percocet. and my boyfriend asked “what’s percocet?” i was...SHOCKED and FLABBERGASTED !!,"i asked how on earth had he never learned about one of the greatest drugs on this earth. He said he “couldn’t see the appeal” when i tried to explain it to him. Granted he’s very straight edge, has never even touched a cigarette. 

Anyway, i’m clean now and my poison was heroin, but something about perc will always have a special place in my heart. I think it’s because that was the first drug i ever “had”. 

I was like 14? And i had just gotten 2 wisdom teeth removed and because i had shitty insurance at the time it would not pay for anesthesia so i had to be very painfully awake while they pulled my teeth and i remember feeling the nerves being pulled from my jaw and wondering why it felt like sandpaper. Anyway, the doctor felt real bad about that so he prescribed me a BUNCH of percocet i’m honestly surprised the pharmacy let the order go through. (Then again, this was 9 years ago) 

I remember coming home and my jaw hurt so bad, the doctor said i could take 2 at a time. The strongest thing i had ever fucked with was extra strength Excedrin so this really was a shock. 

After they hit me, i remember thinking “wow, so **this** is drugs? Cool, i want to be doing that *always*.” That was the greatest 2 weeks of my life, then they all ran out 😔. I only got to do them once or twice a year when i, or a family member got hurt, or a friend would spot me. Fast forward 7 years later someone tells me that there’s stuff that’s *stronger than that*. I was like “Absolutely, hell fuckin yeah, sign me right on up.” 

Anyway, now i just smoke weed and chill, like i’m currently doing right now. ",1510836065.0
7dc3nc,https://www.reddit.com/r/opiates/comments/7dc3nc/legit_m30s/,6,https://redd.it/7dc3nc,cashmerepear,Legit M30s?,"https://imgur.com/lnhHoQi

Does these looks Legit? First time I ever tried an opiate was M30 and they were fent laced. 

Guy claims to be a ""score king"" and he's heavily against pressed pills. ",1510835800.0
7dc2rt,https://www.reddit.com/r/opiates/comments/7dc2rt/long_term_users_that_never_used_a_needle/,57,https://redd.it/7dc2rt,Papdugi369,Long term users that never used a needle?,"For those that haven't shot up, how long have you been using ?  

Just curious because I'm 34 now, been using on and off since age 19 and I remember being told its only a matter of time before I stop sniffing it and start shooting up, still hasn't happened yet 15 years later, so curious if there is anyone else that has been a long term user but never used a needle too?",1510835489.0
7dbxyq,https://www.reddit.com/r/opiates/comments/7dbxyq/hellish_looped_song_in_head_during_wds/,23,https://redd.it/7dbxyq,SmokingRickyWilliams,Hellish looped song in head during WDs,Does anyone else get just one small otherwise unimportant section of a song looping in their head on repeat when they're hurting? Drives me batshit fucking insane and was wondering if was a unique quirk or could yall relate?,1510833779.0
7dbxi9,https://i.redd.it/u5rdvfxhubyz.jpg,13,https://redd.it/7dbxi9,PatsyClinesDaughter,Shot prepped for the AM :)),,1510833632.0
7dbx98,https://www.reddit.com/r/opiates/comments/7dbx98/relaxation_starter_pack/,10,https://redd.it/7dbx98,MagnaMagicBtu,Relaxation Starter Pack,5 Hydrocodone 5mg and 9 10mg Hydro and 3 grams weed.,1510833550.0
7dbsct,https://www.reddit.com/r/opiates/comments/7dbsct/pricing/,8,https://redd.it/7dbsct,LetLoveInspire,Pricing ?,Hey so the OG let me know yesterday that he had some morphine pills come in. He says they usually are sold by milligram and these are 30’s he is selling at $20 a piece. Is  his overpriced or a good deal?,1510831610.0
7dbsa0,https://imgur.com/a/rnx0S,1,https://redd.it/7dbsa0,Ghotiah_LORD,What religion exists for those who are down and out? [Short Fiction Story],,1510831578.0
7dbjkb,https://www.reddit.com/r/opiates/comments/7dbjkb/fuck_fent_rip_peep/,14,https://redd.it/7dbjkb,ZSCroft,Fuck fent RIP Peep,"Just another kid to some of you but this man was my hero, and this fucking drug and that fucking dealer took my inspiration from me at 21 years old (same age as me) im fucking hurt right now.

I hope the person that did this to him dies much less peacefully than he did you piece of fucking shit man what the fuck im lost right now",1510827937.0
7dbj38,https://www.reddit.com/r/opiates/comments/7dbj38/good_thrillers_to_watch_on_opiates/,9,https://redd.it/7dbj38,FreeEggsToastTeaOnMe,Good thrillers to watch on opiates?,"Man this it movie is going to suck I can tell : https://i.ytimg.com/vi/S5qv21eKFwg/maxresdefault.jpg

8 minutes in I'm ready to shut it off. Fake ass cheap cgi team",1510827736.0
7dbg2c,https://medium.com/@CaseyP_Sports/paying-with-pennies-drugs-addiction-6e51ed1017e6,5,https://redd.it/7dbg2c,noseleedseat,"Head Full of Junk, Bag Full of Copper: A Sad, Personal Story From The Other Side (Medium)",,1510826523.0
7dbfd0,https://www.reddit.com/r/opiates/comments/7dbfd0/guess_who_has_a_hole_in_their_pocket_the_guy_who/,15,https://redd.it/7dbfd0,ImStupidMakeFunOfMe,Guess who has a hole in their pocket? The guy who dropped a loaded syringe in the middle of the common area at business school,"LONG POST INCOMING

Throwaway for obvious reasons.  I'm a finance major in one of the top 10 undergraduate business programs in the country (not trying to brag, just trying to set the stage for how out-of-place this was) and I had an absolutely BRILLIANT idea today.  Since I had an exam, I decided that I would mix the last of my dope into a large shot and bring it with me to the business school building where my class was, and boot up in the bathroom beforehand.  I've never shot up in a school building (and never will again) and I had just finished lifting, so I was wearing a pair of old sweatpants.  I walk into the building, and about halfway to my class I put my hand in my pocket and realize the rig I loaded is not there.  I check the other pocket in bewilderment, but it's not there either, and I'm SURE I put it in my pocket.

I presently break out in a cold sweat as I feel a small hole in the pocket of my pants, and realize that somewhere on the 5 minute walk from the parking garage, past the campus police station, and into the business school, I have shedded a syringe loaded with what is unmistakably heroin.  Of course I turn around and begin to retrace my steps.

At this point, I feel it is necessary to point out that the building which houses our business school is one of the newest buildings on our campus, and is basically where my school pours most of its money.  To set the scene, we're talking marble floors in a huge atrium with a giant statue of one of the famous politicians who attended the school standing in the middle.  In short, this is not the type of place where you find drug paraphernalia.  Yet as I'm retracing my steps, I spot the orange cap to my loaded syringe sitting just inside the doors of the main entrance to the building.  I'm immediately struck by extremely conflicting emotions: on the one hand I am happy/relieved to have found it so fast, and I know it must have only been sitting there for a minute or so.  On the other hand, I realize that if I can see this loaded syringe sitting DIRECTLY IN THE MIDDLE of this nice marble floor from 50 feet away, just about anyone else can too.

It is here I know that Junkie Jesus was looking out for me, because despite this rig falling somewhere it could not possibly have been more visible, which also happens to be the area of the business school which sees the most foot traffic, not a single soul walked through those doors between the time when I dropped it and when I saw it.  I mean, it could not have been any more obvious.  There is a desk where a receptionist sits just inside the doors to direct visitors and help people, and had she been sitting at her desk, this rig would have been in the middle of her field of vision.  But mercifully, nobody saw it.

As I walked over towards it, I actually debated (for all of 3 seconds) whether I needed to just leave it, because I was worried someone HAD seen it, and was simply waiting to see who would come back to pick it up.  But then I realized 1. This is the last of my dope and I am not leaving this super-dank shot sitting on the floor, and 2. There will be a fucking shitstorm if someone comes and finds this thing sitting there.  Thinking fast, I went and picked it up, and then went outside, reached into my bag, and threw out a used rig I had in my backpack as discretely as possible, so that if someone actually was looking, I would look like someone who found a loaded syringe on the ground and decided to do the good thing and throw it out.

From there, i quickly went into the bathroom, did my shot (was slightly ruined by the fear the cops were going to swoop in at any moment), and then threw out every stitch of paraphernalia I had with me or on me.  I am never bringing anything with me on campus again.

TL;DR what the title says",1510826208.0
7dbe15,https://www.reddit.com/r/opiates/comments/7dbe15/bloody_nose/,4,https://redd.it/7dbe15,DopedRenaissance,Bloody nose,"I've always snorted my dope, back home when I was snorting it everyday I never had this problem. However since I moved every time I snort dope my nose is full of blood. This never happened before, and I just find it weird. I was thinking it could be the dope but it's been different the last 3 times. Could it be from not snorting stuff for 2 months then starting up again? I just don't get why this is happening. However this stuff I got now is hard to break up, but the stuff I had the other day wasn't... anyone experience this?",1510825634.0
7db6ty,https://www.reddit.com/r/opiates/comments/7db6ty/sorry_to_keep_complaining_here/,11,https://redd.it/7db6ty,WorkYouFuck,Sorry to keep complaining here...,"But this is the only place I can be open. I still have this awful abscess going on. Get my antibiotics day after tomorrow. My arm has grown huge, and it now hurts all up and down. I want to go back to the ER and see if they can drain it yet, but I can't afford more debt. But this is possibly the most pain I have ever been in. I can't move my arm at all. It looks like someone implanted a fucking golf ball in there. I'm honestly really fucking scared and don't know what to do. ",1510822470.0
7db29p,https://youtube.com/watch?v=yFAnn2j4iB0,0,https://redd.it/7db29p,icarebecusyoudo,"My Memory Is So Fucked, This Song Helps Remind Me",,1510820455.0
7dawzf,https://i.redd.it/y7xsh74qkayz.jpg,15,https://redd.it/7dawzf,slkdefnm,Who still loves Mallinckrodt? /s,,1510818220.0
7datq6,https://www.youtube.com/watch?v=QNWlVBMD_hI,11,https://redd.it/7datq6,UsamaBinNoddin,.,,1510816912.0
7daph3,https://www.reddit.com/r/opiates/comments/7daph3/rip_lil_peep/,67,https://redd.it/7daph3,percykgr,RIP Lil Peep,"Artist named Lil Peep overdosed tonight on fentanyl, presumably pressed xanax. Wasn’t a huge fan, but he made a couple songs I’d enjoy while high, and it’s sad to see someone taken so young from opiates...

RIP",1510815325.0
7dah85,https://youtu.be/JnYebSbA5HE,20,https://redd.it/7dah85,VERYRARE___FTP,New device to help with withdrawals....thoughts? 🤔,,1510812261.0
7daf9u,https://www.reddit.com/r/opiates/comments/7daf9u/igi_back_too_hwere/,14,https://redd.it/7daf9u,adrilimaisatruehuman,"igi back,, too hwere","and i realize that yeh

life is better spent round other fellow humans riht

and opiates for example heroina re pleasurele

and i injedted hydromoprhone a wee ago

but lsd and mdmda are somemthing else

theyre melting my words yheah changeing my perspective for not even kiiding you

so yeah 


i got to agree life a scam

marriage wont last

but its not ur fault

its societies

but change urself a lil bit and ull influence society a bit at ñeast


im fucked on lsd and mdma but

yeah i feel such a strong force proecting me and guifing me.

so stay safe kids
scape samsara
mata

mokhsa",1510811620.0
7da9iu,https://i.redd.it/cy9yq9y8v9yz.jpg,22,https://redd.it/7da9iu,laneberlin,Do these M box 30’s look legit?,,1510809667.0
7da3y2,https://i.imgur.com/BQkYxKx.jpg,16,https://redd.it/7da3y2,travellingdreamer,A little bit of cocaine acetate to go with a fat shot of diesel.,,1510807886.0
7da25x,https://www.reddit.com/r/opiates/comments/7da25x/having_a_decent_night/,4,https://redd.it/7da25x,DragonChaser760,Having a Decent night....,"was supposed to go hangout with my homie at the beach but that fell through no biggy..just pretty lonely lately...I got alittle less then .1 left of tar I'm gonna smoke the rest...wish I had a smoke...finished my black and mild skating to the store to pick up a tall boy of Hurricane...anyone else drink that? FUCKING High Gravity man!!! $2.25 for a tall boy that's 8.1% ALC haha I fuck around and call it the ""bargain brew"" wooo shits hefty!! Also got like a G or some of that bomb ass Cali doja gonna back the bong ina min and might play Divinity Origins for PS4 it's pretty much DnD on console.....I'm a nerd like that and LOVE RPGs...I got a Fighter/Rouge/Paladin/Ranger pretty decent party but I'm seeing my Paladin is starting to turn into a healer when I wanted him to be more melee based so might have to switch him out....long rants Im kinda high can you tell? HA Life is goood ohhhh I also have a few 2mg subs for when I can't pick up cause I already used a majority of my check....Love ya'll be safe! Rant OVER ",1510807328.0
7da0wj,https://www.reddit.com/r/opiates/comments/7da0wj/are_yall_paying_1_per_mg_for_pills/,4,https://redd.it/7da0wj,yeyestayquite,Are y'all paying $1 per mg for pills?,I'm sick of paying out the ass for pills but Dr's around here won't give you a script for anything. Is anyone dealing with this same bullshit??,1510806929.0
7da010,https://imgur.com/a/of9Vf,1,https://redd.it/7da010,FormalizedNitrazepam,CRIMINAL ACTIVITIES,,1510806668.0
7d9zr3,https://www.reddit.com/r/opiates/comments/7d9zr3/buprenorphine_uk_advice/,1,https://redd.it/7d9zr3,Smorg1,Buprenorphine UK Advice,"I don't want to tarnish my medical records by requesting the need for Bupe or Methadone (hate methadone) in the UK's NHS Drug Counseling services by going through drug services.

Are there any ways one can obtain Subutex (Buprenorphine) outside of these NHS channels that don't tarnish your record? Perhaps private paid for health services like BUPA?

I obtained a week supply and it's been amazing. A couple more weeks worth I think could set me straight.

Thanks all",1510806581.0
7d9wek,http://www.cbc.ca/news/politics/opioid-prescription-heroin-1.4403709,8,https://redd.it/7d9wek,Barnabay,Canada want to give addicts free heroin!,,1510805557.0
7d9vrt,https://www.reddit.com/r/opiates/comments/7d9vrt/dang_guys/,16,https://redd.it/7d9vrt,Gutterlungz1,Dang guys...,"Been doing good lately. Been off the needle 6 months. Job is going terrific. 3 places want me to work for them right now because of what I can do. My arm is infected right now from being in the ocean w a cut and I guess I got some bacteria in it, so I took the day off work. I got SO MUCH accomplished. I was just writing in my diary how good everything is going and how good it feels to get so much accomplished in one day. So many little errands that I’ve been meaning to take care of. Back when I was junkin’, even if I made a fucking phone call that I had been meaning to make, I felt accomplished. Was thinking to myself how nice tomorrow will be now that I got all of this shit done and I can just chill all day and watch movies and whatever. 

So job going good. No drugs for 6 months (yay). Getting stuff done in life. Been working out like a motherfucker and feel fit as fuck. Looking really good. My best friend today also just asked me to be his best man at his wedding, something I never thought anyone would want me to do...

Also- been banging this HOT AS FUCKING FUCK girl lately... I showed one of my buddies a pic of her and he didn’t even believe I could get a girl like that. He thought I was lying. Kinda felt good man. Anyway, girl wanted me to get an std check. Now, I honestly don’t have that much sex with different people and I was just checked (clean) last year, so STD check wasn’t super high on my priorities... I’m not showing any symptoms or anything. The girl just wanted us both to get checked so we could bang without condoms. So, getting checked was not even on my fucking radar until she brought it up the other day...I was just gonna do it more as a courtesy to her than anything else. 

So I’m out doing my errands. Finish the last thing I wanted to do that day. It’s late in the afternoon and I happen to be like directly across the parking lot from the clinic and I think “fuck it, one last thing for today then I’m going home”.  

I walk in. It’s a free clinic. I just checked the boxes of the shit I wanted to get checked for and waited a couple minutes until they called me back. Pissed if a cup. Pricked my finger for blood. As we were waiting for the “instant” blood test thing to show a result I did more paperwork. As we were doing paperwork I saw the nurse guy glance at one of the strips that had blood on it and I noticed his demeanor change a little bit. He was kind of stern when I first walked in. Very terse and short. I was probably his last person for the day as it was almost 5 and he probably just wanted to get the fuck out of there. After he glanced at the strip his voice softened. His eyes became kinder. He said nothing and continued with questioning for his paper work. I dismissed it as me being paranoid. In a couple seconds he was gonna tell me that I was all good and send me on my way....

After the paperwork was done he looked at me and said “ok...let’s talk about your results”

Me “...k”

Him “so this strip is for HIV....you are negative”

Me “praise Jesus”

Him “this other test is for hep C....”

Me “....”

Him “i have some news for you...you are positive for hep C”

I was waiting for him to smile and tell me he was fucking with me and that I’m good and free to go. He didn’t. 

Fuck. 

God fucking damnit. Are you fucking kidding me?

He says there’s a 20% chance it was a false positive and they would have to draw actual blood instead of doing finger prick to know for sure but since my veins are totally fucked they were unable to do it. I’m gonna have to pound water and go for a run then go in tomorrow to have blood drawn to know for sure. 

You guys are the first to know. I haven’t even told my mom yet. I’m extremely upset about all of this.

So there I was, fantasizing about how great it’s gonna feel to get ALL my errands done and actually be able to chill on my days off instead of running around doing shit... and now I gotta go give them blood and probably get treated for hep fucking C. Not to mention break the news to this girl. 

I just can’t believe it. I mean, I even went and got a fucking flu shot today just because that’s the type of shit normal adults do! I mean, FUCK!

Fuck me, fam. 

Ain’t that some shit? 

As always, thanks for reading. 

Also- let this be a fucking lesson for everyone out there. Even after you get clean as fuck and you have your life back together... the life still has a way of catching up to you. One way or another, the piper gets paid. ",1510805375.0
7d9srh,https://www.reddit.com/r/opiates/comments/7d9srh/anyone_else_develop_a_lazy_eye_after_getting_high/,11,https://redd.it/7d9srh,87_Till_Infinity,Anyone else develop a lazy eye after getting high?,"I have what we could consider ""normal eyes"" when sober. 

However I noticed today that the reason my vision is so screwed up when high is because one eye is not looking where the other is.

Anyone else experience this?",1510804483.0
7d9plb,https://www.reddit.com/r/opiates/comments/7d9plb/question_can_you_achieve_an_opiatelike_high_from/,6,https://redd.it/7d9plb,8k7k6k5k4k,[Question] Can you achieve an Opiate-like high from California Poppy Extract?,I just randomly saw this pop up on a [google search](http://www.nutritiongeeks.com/details2.asp?Prod=california-poppy-extract-herb-pharm&Prodgp=53771&utm_source=adwordspla&utm_medium=cpc&utm_term=53771&gclid=CjwKCAiA6K_QBRA8EiwASvtjZTaLziHx7-UOvMQeTtA7o7iCXS3kldTJyq4n4H7U3X8NlItMd--aBxoCLhUQAvD_BwE) and couldn't find much info about it besides actually chewing/smoking the flower or seeds itself. I'm wondering if this is possible. Any advice would be appreciated. :),1510803551.0
7d9nuo,https://www.reddit.com/r/opiates/comments/7d9nuo/tobacco/,7,https://redd.it/7d9nuo,Chardeemacdennis45,Tobacco,"It's no secret tobacco goes well with opis. I usually like to smoke cigarettes but tonight I couldn't get any. I found a nice cigar I've been keeping in my room. 

I've been sitting on my porch and smoking this cigar tonight and it's amazing! Anyone else ever smoke cigars when high?

I also have zero tobacco interest when I'm not high.",1510803029.0
7d9noh,https://www.reddit.com/r/opiates/comments/7d9noh/fentanyl_warningcalifornia/,0,https://redd.it/7d9noh,spinderella69,Fentanyl warning-California,"I was asked to post a fentanyl warning for Riverside California. The tar has visible white flecks in it, and the dealer confirmed it contains fentanyl. Be safe everyone.",1510802979.0
