8mqhuk,https://www.reddit.com/r/opiates/comments/8mqhuk/anxiety_leading_up_to_quitting/,8,https://redd.it/8mqhuk,Keyboardpaladin,Anxiety leading up to quitting,"As I watch my ""final"" stash get smaller and smaller it's giving me a lot of anxiety. Every time I've tried to quit I've felt determined and in the complete right mindset. This time, I'm completely fucking scared and I'm not sure why. It feels weird that I'll be giving something up that has been such a huge part of my life for over 2 years, something that's brought me so much happiness (sometimes). Anyone know how to deal with this? I just want to be done with this for good already but maybe I'm scared because I'm doubting whether or not I can actually do this.",1527518076.0
8mqhgl,https://www.reddit.com/r/opiates/comments/8mqhgl/how_are_your_veins_intravenous_injections_thread/,13,https://redd.it/8mqhgl,sage1337,How are your veins? Intravenous injections thread.,"I need info on how much damage to vein is caused by properly done injection. Data from people who tend to shoot for long time will be great. Photos are appreciated.

If you have some protips about how to take care of your veins etc it will also be great to read.",1527517996.0
8mqb0y,https://www.reddit.com/r/opiates/comments/8mqb0y/heart_palpitations_after_withdrawal/,10,https://redd.it/8mqb0y,kramercosmo69,Heart palpitations after withdrawal,"Hey guys,

So I’ve noticed that when I withdraw, like the 3rd day I start getting an irregular heartbeat.  I actually dealt with this a year ago and went to an ER, then a week later went to a cardiologist.  The dr gave me a heart monitor to wear, then I even did an echocardiogram.  EXPENSIVE.  But everything was fine.

It went away eventually after being clean.  

Anyways, I fucked up and got hooked on oxy again.
I went from 140mg + per day to a taper of 30 and then 15 per day over about 8 days. I didn’t have many palpitations.

Now I’m at 72 hours of totally clean and the palpitations start up.  It’s weird, like 15 mg a day kept them at bay?  I guess my brain functions have to get used to zero opiates?

Just looking to see if anyone else deals with this ?  
Thanks !",1527516516.0
8mq93v,https://www.reddit.com/r/opiates/comments/8mq93v/mixing_morphine_and_xanax_is_it_a_good_combo/,10,https://redd.it/8mq93v,LiveLoveAsap1,"Mixing morphine and xanax, is it a good combo ?","Is it enjoyable ? i'm considering buying some xanax since i already have a shit ton of morphine

Also can i use the xanax for the withdrawals ?",1527516087.0
8mpyra,https://www.reddit.com/r/opiates/comments/8mpyra/whats_ropiates_favorite_syringes/,9,https://redd.it/8mpyra,SwearToGodImNotAShil,What's /r/opiates' favorite syringes?,"I like 10cc, 25 gauge, 1 1/2""w/ Luer lock tips. 

Jk lol i'm not a veterinarian

Easy touch 31g 0.5cc 1/2"".

What's you guys' and gals' favorite syringes?",1527513261.0
8moy1k,https://www.reddit.com/r/opiates/comments/8moy1k/nodding_while_redditing/,5,https://redd.it/8moy1k,KPROTON,Nodding While Redditing,Anyone else ever accidentally up/down vote every post because you’re just nodding out the whole entire time lol. No? Just me? K fml,1527501390.0
8moxd4,https://www.reddit.com/r/opiates/comments/8moxd4/long_term_oxycodone_dependence/,4,https://redd.it/8moxd4,idgafsolid,Long term Oxycodone dependence?,"Considering dual broken clavicles which has also caused my 13+ degree scoliosis I seem to require a higher dosage to grasp my pain relief plus the favoured nod. Originally taking a 7.5 mg Percocet a day starting two years ago, which sometimes even induced nausea, I now find myself having a total consumption of up to 40mg - 60mg a day but not feeling anything by bed time and pain returning. I'm in my very early twenties with a son so dependence worries me to an extent. I love my DOC, controlling my almost three year addiction, keeping family and money life stable, but my worry is this pain I can't control. I want to be able to be active with my son yet without the pain in my entire back. Thoughts, opinions, or advice? ",1527501129.0
8morbt,https://www.reddit.com/r/opiates/comments/8morbt/post_any_addictshit_youve_miraculously_gotten/,31,https://redd.it/8morbt,DegenerateLee,POST *ANY* addict-shit you've miraculously gotten away with,"Wanna hear some cool stories, anything from doing something especially dumb in front of cops while dirty as fuck and getting away with it, robbing/burning/stealing and never getting caught, doing/saying something dumb in front of pain management doc and still being given your script, doing some retarded super-fucked-up-im-clearly-on-drugs shit at work and still having a job etc.


-

This is /r/opiates so anything goes!!! Well, anything except some normal day to day shit, because ""well I copped today and had an uneventful drive home"" isn't all that exciting",1527498825.0
8momby,https://www.cohealth.org.au/health-services/drugs-and-alcohol/naloxone/,11,https://redd.it/8momby,spaceholiday2018,"Free naloxone in Melbourne, AUS for 1 month",,1527496898.0
8moadc,https://imgur.com/a/iKsxXG3,14,https://redd.it/8moadc,IVprincess,"Just logged on after a month, can't we all just agree somebody giving you the tools to destroy you is not doing what's best for you under any circumstance? 'Path to hell paved with good intention' 'the devil is disguised as pretty girls or w.e tf the Bible says' 'read comment for explanation'",,1527492290.0
8mo3tc,https://imgur.com/zkZxbYP,13,https://redd.it/8mo3tc,CurryNotSlurry,A memorial day to remember - 84,,1527490003.0
8mo2ge,https://i.redd.it/f6d1drkzkj011.jpg,43,https://redd.it/8mo2ge,OtisLukas,Just cold copped a bun of this...wtf is it?,,1527489501.0
8mo19a,https://www.reddit.com/r/opiates/comments/8mo19a/few_questions_about_h/,5,https://redd.it/8mo19a,Annie_My_Love,Few questions about H,"I been using blues for about 2 years and I just got some H to hold me over while I can't find any pills. I usually do 10\-15 blues a day, how much H should I snort for the first time? it looks like white powder if that matters",1527489081.0
8mo0pp,https://i.redd.it/7ckvyv39jj011.jpg,25,https://redd.it/8mo0pp,Painkiller830,Thoughts?,,1527488909.0
8mnw9k,https://www.reddit.com/r/opiates/comments/8mnw9k/fent_patches/,4,https://redd.it/8mnw9k,Neegrodomis,Fent patches,"I'm gonna finally get my hands on a fent patch for the first time and I'm put it on my skin opposed to smokin it or whatever and I was just wondering if I should worry about falling out if I have no tolerance on a part of a fent patch(not sure of the dose)

update- decided fucj that shit got some football xans instead",1527487380.0
8mnvxz,https://www.reddit.com/r/opiates/comments/8mnvxz/is_fent_back_in_the_south/,10,https://redd.it/8mnvxz,Iledahorsetowater,Is fent back in the South?,"Why have I been pissing dirty for fent for 2 weeks and everything’s switched to pure white odorless tasteless leave no track marks but make you act erratic as shit fentanyl? I love fent bc the tracks aren’t bad but high sucks dick. My dealers have all had the same shit for 3 years not changed from batch to batch, and bam. Fent. Blowing through my daily dope allowance.",1527487278.0
8mnvcn,https://www.reddit.com/r/opiates/comments/8mnvcn/will_5325_hydrocodone_cause_me_to_nod_off_on_an/,13,https://redd.it/8mnvcn,ddiss3,Will 5/325 Hydrocodone cause me to nod off on an empty stomach?,"Im planning to take like 2 -3 on an empty stomach. I dont want to get really fucked up, just a light buzz where no one will notice

Edit:This is weak shit",1527487069.0
8mnuyo,https://www.reddit.com/r/opiates/comments/8mnuyo/how_long_after_taking_valium_to_take_hydrocodone/,6,https://redd.it/8mnuyo,ThrowawayCheese12345,How long after taking Valium to take hydrocodone?,"I took 65 mg diazepam over the past 2 days and it heard it has hella long half life. This was my first ever benzo experience. Tho it was a few years old so maybe less potent.


If I was gonna take 60 mg hydro, how long should I wait to make sure I don’t accidentally overdose or some shit?


I’m new to both benzos and opiates but I have high tolerance to both, yay for my wallet",1527486945.0
8mnqmv,https://www.reddit.com/r/opiates/comments/8mnqmv/staying_clean_during_a_break_up/,9,https://redd.it/8mnqmv,Kdiamondace,Staying clean during a break up??,Alright guys Im going through a break up with my girl right now. We were together about 14 months and was the main reason i ended up getting clean. I love her to death but its over now. All i want to do right now is go shoot some dope. Ive been clean 14 months. help guys!,1527485526.0
8mnlxy,https://www.reddit.com/r/opiates/comments/8mnlxy/anyone_ever_legit_had_fent_laced_blow/,7,https://redd.it/8mnlxy,2ndwaveobserver,Anyone ever legit had fent laced blow?,Got some stuff and my buddy says it might be cut with fent which I’m not so sure about. Just curious if anyone has encountered it or not.  ,1527484059.0
8mnhqq,https://www.reddit.com/r/opiates/comments/8mnhqq/why_is_it_so_hard_to_quit/,28,https://redd.it/8mnhqq,forfunATX,Why is it so hard to quit?,"Anyone else find it impossible to quit shootin that good good up? Who am I kidding, I know a large percent of y'all know what I mean. It's not like I havent tried infact it seems to get harder to stop with every sobriety attempt. 

Ive been to rehab many times, sober living, daily meetings and working the steps. Even alternative methods of maintaining sobriety, and I feel like I keep going downhill faster every attempt. Last time I was in rehab I had my dboy smuggle some in for me because I couldn't fight the urge even though I was 3 hours away in the country in a nice facility with great people. So now I feel defeated, I'm getting my script of suboxone filled tuesday and gonna do my best to actually take them. I already feel like I failed and I havent started. I think I know why I grew up being constantly told never try drugs because this is no life anybody should live.

Sorry for bitchfest",1527482700.0
8mnfi4,https://www.reddit.com/r/opiates/comments/8mnfi4/fentanyl_warning_houston_tx_832713281346/,5,https://redd.it/8mnfi4,imalonemusic,"Fentanyl Warning - Houston, TX (832/713/281/346)","Light purple bags.  
Powder is tan/off white, rocky but breaks into powder pretty easily.  
https://i.imgur.com/OQVQ4It.jpg  
  
I'd be dead right now if not for my boyfriend, stay safe y'all.",1527481968.0
8mne1s,https://www.reddit.com/r/opiates/comments/8mne1s/tianeptine/,26,https://redd.it/8mne1s,RankedAmateur,Tianeptine,"Hello all

I just wanted to type up a quick post suggesting tianeptine to those who enjoy opiates - I took 350mg about an hour and a half ago and am definitely feeling pretty good. This is a pretty high dose but I was looking to experience it on a recreational level and have some tolerance to opiates with recent use. If you decide to try it, work your way up don’t use my dose as a benchmark, everyone’s biochemistry and tolerance are different. That being said this drug doesn’t cause much respiratory depression and has a great safety profile. I’ve heard withdrawals can be pretty rough but don’t plan on using it very often, despite using other opiates with more regularity. It definitely has opiate activity at this dose - my mood is quite elevated, and my pupils a bit constricted. If I stay still I’ll “nod” in a way, not to the extent of a large dose of other opiates but I’ll kindve close my eyes for a bit and not want to open them. I’ll also add that I am starting to get than opiate itch, which I personally enjoy. Even though my dose is mostly just starting to kick in, I’ve read that the duration is extremely short, 2-4 hours with the sodium salt. Can’t comment on the sulphate version of this compound currently but I did get some for future experimentation.

I’ve used this drug a long time ago with no tolerance - I forget what amount, but it was definitely a recreational dose and I had no tolerance at the time. The nod on the occasion was much stronger along with extreme pupil construction. So for people new to opiates, again, use good judgement ingesting, it can be stronger than what I’m making it out to be currently.

This drug has a lot going for it in that it is relatively cheap, legal, and has nootropic qualities. Worth researching if that kindve thing is of interest to the reader. It’s a unique opiate in that it is a tricyclic antidepressant, not a traditional opiate but demonstrates mu and delta agonist qualities with no kappa affinity. In layman’s terms, it effects the brain in the way that an opiate with desirable qualities would at larger doses.

I wanted this to be a quick informative dip your toes in the info type post, ill end it here and go back to enjoying my high.

If anyone has any experience or info regarding tianeptine, feel free to add it. For those with questions, I’ll try my best to answer them with the preface I’m no expert on it or pharmacology.

Thanks for reading and consider trying it if you enjoy opiates.

Thanks for reading all! 
R.A.",1527481481.0
8mndvh,https://i.redd.it/1udu5rfzwi011.jpg,22,https://redd.it/8mndvh,R_Trains_Delayed,Still using. Might as well give some porn.,,1527481422.0
8mnbtl,https://www.reddit.com/r/opiates/comments/8mnbtl/dry_as_a_desert_out_there/,16,https://redd.it/8mnbtl,OtisLukas,Dry as a desert out there,"Am I the only one noticing that supplies are drying up? I keep reading the streets are flooded with opiates but all my plugs are dry this weekend. The past month my main two dboys only had pills and they were raising prices.  I asked them what's up and they said no one wants to fuck with dope right now cause it's too hot. 

I'm in a major city not the middle of nowhere so I wondering what the fuck is going on?

Am I just unlucky right now or are you guys noticing this too?",1527480764.0
8mnaf2,https://i.redd.it/ma6f94zrti011.jpg,9,https://redd.it/8mnaf2,jlogic420,Another 4oz bottle of hydrocodone,,1527480342.0
8mmztn,http://imgur.com/a/Z7UrgVD,6,https://redd.it/8mmztn,Opiaway11,Something different morphine eslon 200mg er,,1527477142.0
8mn0i5,https://www.reddit.com/r/opiates/comments/8mn0i5/i_know_as_soon_as_you_hear_tramadol_youll_tell_me/,4,https://redd.it/8mn0i5,Painkiller830,I know as soon as you hear tramadol you’ll tell me to fuck off but please hear me out,"I’ve done a pretty good job of maintaining a 500 mg a day tramadol habit for the past 5 years. 
There’s many problems with this situation, but the main one being the hellish ssri and opioid withdrawal after stopping for a day. 
I always run out of my script a week early , every month, it never fails. 

So I suppose my question is, how can I taper down the week before I run out? To make the withdrawal week a bit more comfy. 
I’m fresh out of kratom but I have a shitload of lyrica (no tolerance) and weed , 20 mg of flexiril, an ounce of phenibut and some loperamide. 
I can get my hands on Xanax and k pins need be.
Also, I need to be able to function at work so I can’t be zombied out on benzo’s 
I don’t expect y’all to have a magic cure but any piece of advice would help ",1527477349.0
8mmy8o,https://imgur.com/jSLhi1u,10,https://redd.it/8mmy8o,DenverDopeMan,My cat found my stash!,,1527476697.0
8mmx4y,https://i.redd.it/qewck5p1ii011.jpg,14,https://redd.it/8mmx4y,connerwest9,How's it look? First time buying powder,,1527476399.0
8mmuw2,https://www.reddit.com/r/opiates/comments/8mmuw2/would_anyone_care_to_hear_my_tale_of_woe/,25,https://redd.it/8mmuw2,waiting_with_lou,Would anyone care to hear my tale of woe?,"What's up bropiates(spare me please its tongue-in-cheek) I have once again fucked around. Relapsed, almost killed myself about 3 times driving on heroin, benzos, and alcohol (with a pending DUI mind you). Got kicked out of the house, roommate steals my macbook and my camera. And now my girl found out I took her bars and told me shes probably leaving me (I'm thinking she wont but I still feel wretched because I love the piss out of her) and she doesn't even know I went on a week heroin bender. Also left an implied suicide note for my baby sister to find and traumatize the fuck out of her.

Luckily I didn't slam anything and I got about two weeks of squatting essentially at my grandparents to figure some shit out but man am I spinning rn. I think Layne Staley once said 'used to be curious, now this shit is sustenance'. It's like something I can never run away from, and since I'm still battling wicked depression, trauma, anhendonia from being of opiates I've been substituting other downers even before the relapse. I guess it's just time to buckle down and get some mental health and addiction related support and try and preserve. I also lost my card and wont have money till Thursday and ate my 2 bars I had saved for detox right now on day one because of the s/o. 


Did I mention I lost my job for calling in to support my lady while she had a medical procedure and then showed up high the next day, like nodding standing up high.


Man I really screwed the pooch here. But all is not lost. I just really dont want to lose the girl, shes a real gem and I love her more than life itself at times(yes I know that I at times engage in borderline codependency with her). But my best friend from birth who doesn't even drink seems to have secured a really cheap room and wants me on my feet so I am grateful for that and having a room to kick dope in.

 Any kind words or advice would really brighten my day. No negativity please, I have enough guilt as is and I know everyone of you regulars here have done this or worse a million times over. Precisely why I post here. I'm gonna hit a meeting tomorrow, get a sponsor, and get in it to win it or I'm shooting dope on the street again or in box.

TL/DR
Relapsed, almost died, got kicked out, a roommate stole computer, stole from gf and she may leave me, lost my job, and left my baby sis a suicide note now I'm all fucked up but not going back to junk

much love, 
if theres anyone on here who remembers me, esp. tinychat please chime in
loudawg",1527475700.0
8mmt1v,https://www.reddit.com/r/opiates/comments/8mmt1v/kratom/,8,https://redd.it/8mmt1v,Straightfromthewest,Kratom,"I plan on kicking my habit starting tomorrow, it was supposed to be today but I was around family and couldn't do it yet. I have some maeng da kratom powder (the brand is leave, I paid a way too much at a head shop but I couldn't wait), I have about 80 grams or so left. I tried taking it with water I've tried up to 3 grams but never felt anything from it. What is the best way to take it? Also, how much should I take? My tolerance is .5 of bth through out the day. I honestly don't even care for getting high from it, I more or less just want relief from my withdrawal symptoms which are unbearable (cold sweats, chills, rls, sleeplessness, extreme cravings, anxiety) thanks for the help. ",1527475132.0
8mmqcn,https://www.reddit.com/r/opiates/comments/8mmqcn/i_got_some_dried_pods_not_sure_what_to_do_with/,6,https://redd.it/8mmqcn,ditfloss,"I got some dried pods, not sure what to do with them","Do I just extract the seeds, ground the pods and stems, and make a tea? or is it best to just put the powder in some capsules and ingest? or is making smokeable opium the better idea? (no clue how to do that).",1527474339.0
8mmp3l,https://www.reddit.com/r/opiates/comments/8mmp3l/ive_been_on_legal_cheap_pure_heroin_for_over_15/,129,https://redd.it/8mmp3l,scoredpoppies,I’ve been on legal cheap pure heroin for over 15 years. Literally ALL of the problems blamed on opiates are the result of the PROHIBITION of opiates.,"Hi,

I live in the UK and am on diamorphine (pure heroin) maintenance.

I get 7 packs of 5 100mg injectable ampules once a week from the chemist. It costs me £28 a week.

The heroin is pure and I just mix it with sterile water and inject it intravenously.

I feel completely normal and live a completely normal and functional life with a well-paying job and a family. I have been for 15 years since being able to access legal pure heroin.

All the problems I experienced back in the day that are blamed on “heroin” are really the result of the PROHIBITION of heroin.

Cheers!
Chris",1527473966.0
8mmops,https://i.redd.it/au06u6jhai011.jpg,8,https://redd.it/8mmops,benz0babe,M Box 🤟🏼,,1527473855.0
8mmnzb,https://www.reddit.com/r/opiates/comments/8mmnzb/coke_is_a_good_laxative_lol/,9,https://redd.it/8mmnzb,alamomattie,Coke is a good laxative lol,Unclogs me every time ;-),1527473665.0
8mmndm,https://imgur.com/Pk7lzmF,10,https://redd.it/8mmndm,DenverDopeMan,The look my cat gives me when he sees me nodding out.,,1527473495.0
8mmn9z,https://www.reddit.com/r/opiates/comments/8mmn9z/you_like_country/,6,https://redd.it/8mmn9z,suckingonabanana,You like country,Why does Every music  video.end our start In a  dope ass down south old ass home..makes you wanna shoot a gun it so ba .....thata what i want with chick ens....my dope head dream .,1527473465.0
8mmke1,https://www.reddit.com/r/opiates/comments/8mmke1/feelin_sick/,7,https://redd.it/8mmke1,thecatsmeow311,feelin sick,just ran out of boy a few hours ago..really feeling it now. took 300 mg of gabapentin and a xanax but hot as hell..pray for me,1527472676.0
8mmi33,https://www.reddit.com/r/opiates/comments/8mmi33/helping_people_pick_up/,31,https://redd.it/8mmi33,DenverDopeMan,Helping people pick up,"Does anyone else like helping others pick up dope?  I like hearing people say ""man this stuff is amazing, thank you so much!"" because I like knowing people enjoy the quality of the product I can get.  I am not one of the asshole middle men that demand a lot for my services; I just add a $10 to the price of a gram.   What do you guys require from people if they ask for your help?",1527472059.0
8mmedd,https://www.reddit.com/r/opiates/comments/8mmedd/oxycodoneacetaminophen_best_roa/,9,https://redd.it/8mmedd,habui,oxycodone-acetaminophen best ROA?,"getting some percs, was wondering if they can be snorted or booted? i can’t imagine the apap is great for those, uh, orafaces. i know a cwe is ideal, but COULD they be effective without removing the apap?",1527471027.0
8mme8j,https://www.reddit.com/r/opiates/comments/8mme8j/need_something_to_fill_the_emptiness/,9,https://redd.it/8mme8j,D_e-A_d,Need something to fill the emptiness,"All I want to do is get some more oxy and vicodin even tho I’ve only done both a few times, maybe even some H. I need something to stop the emptiness, something to take away all the suicidal shit. The first 15 years of my life I was abused, it finally stopped 1 year ago but every time I look around it’s so real, the depression deepens everyday. 3 inpatient hospitals did nothing, partial hospitals did nothing too. At this point all I want to do is take some oxy and vicodin, that’s the best of the two paths I’d go down. I’ve taken both a couple times and at least it’s something different. Sorry for the longish post that’s kinda off topic ",1527470992.0
8mmdt0,https://i.redd.it/myy4v0al1i011.jpg,13,https://redd.it/8mmdt0,OxyMoron510,Two more PANDA to end my night,,1527470868.0
8mmczj,https://www.reddit.com/r/opiates/comments/8mmczj/suboxone_not_working/,16,https://redd.it/8mmczj,bouncybear11563,Suboxone not working,"I don’t know what to do. I waited 2 days after my last dose and I’ve already taken 24mg of suboxone, 4 mgs at a time. I still feel awful. Not any worse, hardly any better. Might have stopped the abdominal pains but I still have the sweats, dilated pupils, pains and all. Is it possible I’m not absorbing it?? Perhaps it’s not really working because I have a huge habit? I just want to quit or at least take a break so bad. Have any of you experienced this? Sorry for the whining.",1527470628.0
8mm8b1,https://www.reddit.com/r/opiates/comments/8mm8b1/can_any_one_tell_me_about_acteyl_fetynal/,9,https://redd.it/8mm8b1,bigerock,Can any one tell me about acteyl fetynal?,So I'm pretty sure what I am getting right now is acetyl fentanyl I'm not sure though. It test as fentanyl but the legs are shorter then normal fentanyl normally I'll be good for 7 to 8 hrs with fentanyl but with this I notice myself getting sick in about 2.5 to 4 hrs it's insane. It hits well with a nice rush will nod me out just not lasting at all. I can say I love it and hate it at the same time. Does this sound like acetyl fentanyl?,1527469314.0
