9493jd,https://www.reddit.com/r/opiates/comments/9493jd/potentiating_opiates_with_a_little_bit_of_dxm/,16,https://redd.it/9493jd,newlightpsych,Potentiating opiates with a little bit of DXM,"So as you may know, DXM - most usually found in cough syrups - potentiates opiates by quite a bit. But as to the WAY it does this, oh boy... Even from a little dose of like 40mg DXM, the closed eye visuals while nodding just get so much more intense and PURELY AWESOME. They totally draw you in, till you snap out of it and then you're like WOAH, only to nod right back to a new CEV unfolding in front of your closed eyelids. 

It's like the first time you got really high on an opiate and you'd have those waking dreams start once you closed your eyes. This is still easily achievable with a high dose of opis alone, but if you want to have nice nods from less opiates and a little bit of cheap cough syrup, I highly recommend this combination. If anybody has some experience to share about this combo I'll be happy to hear it! And, as always, please be careful - you may have a high tolerance but in cases like this one with DXM, potentiating opiates may cause you some unexpected reactions. As always, go slow, go steady, and I wish happy nods to yall on this fine Friday afternoon! ",1533298743.0
948xp8,https://i.redd.it/1x8mcfrhavd11.jpg,11,https://redd.it/948xp8,TowTruckNYC,That good ol ecp with a strong vinegar smell,,1533297271.0
948vk2,https://www.reddit.com/r/opiates/comments/948vk2/chronic_pain_patients_could_use_some_advice/,16,https://redd.it/948vk2,chronpainthrow222,Chronic pain patients? COuld use some advice.,"I'm 28m & just below 100 lbs at 5'7 with a severe case of crohn's disease. I was actually just approved for disability (small yay) a couple months ago, the judge actually approved me that day and said it was one of the worst cases she's seen.

I've tried humira, stellara, imuran, gs-5745 (experimental), remicade, mercaptopurine, methotrexate, and of course steroids. My gi doesn't even know what to try next. Nothing is working. I've been hospitalized more times than I can count. Also had a bowel resection a couple years ago.

I usually go to my GP for pain meds (120 5mg and a few times 7.5mg percocet for the past two years) which just barley helps enough to keep me sane, however last visit he cut it down to 100. It seems like he's trying to get me off them...randomly...


I really can't do this without something for the pain. It's constant, I can't sleep, eat, or enjoy anything. I don't really know what to do.

It's worth noting I'm a pretty passive person and have a hard time fighting for myself, especially to doctors and stuff. I always feel like if I push I'll just get cut off and be labeled a drug seeker.

This may be a dumb post but in all honesty I'm a bit panicky and overwhelmed right now at the thought of having nothing to relieve the pain. Thank's for reading.



",1533296682.0
948u5l,https://www.reddit.com/r/opiates/comments/948u5l/is_there_an_upper_threshold_to_h_tolerance/,23,https://redd.it/948u5l,senumi,Is there an upper threshold to H tolerance?,"Or is that just a myth? Couldn't find anything reliable from googling beyond that on heroin-assisted treatment programs people tend to settle at a dose of up to 3g/day. 

I'm on day 2 of an involuntary detox so I can fly on Monday and wanting some good news. ;(",1533296274.0
948rof,https://i.redd.it/dysd8vq65vd11.jpg,8,https://redd.it/948rof,lakers338,Fuck,,1533295604.0
948mcw,https://i.redd.it/6dprktay0vd11.jpg,71,https://redd.it/948mcw,Blueeyedjunkiee,Dope porn. This is how much I have stored for “just Incase” my dealer decides to not be around the sleeve at the bottom in the plastic bag is new tho. Saving atleast 1 bag a day really adds up eventually,,1533294066.0
948iz7,https://www.reddit.com/r/opiates/comments/948iz7/how_long_until_the_nausea_goes_away/,10,https://redd.it/948iz7,Spxboy,How long until the nausea goes away? =(,"I tried heroin about 11 hours ago. I had a bad experience due to uncontrollable nodding while trying to watch doctor who and I puked 2 hours in. Projectile vomited all over my floor. Ever since puking, I've had mild nausea that is really annoying. Anyone else get this?",1533293074.0
9483jo,https://www.reddit.com/r/opiates/comments/9483jo/how_bad_an_idea_is_doing_h_for_the_1st_time_while/,21,https://redd.it/9483jo,OpiLobster,How bad an idea is doing H for the 1st time while already on xanax?,This kids at my place and was doing coke earlier in the night. Then as the cokes wearing off he does some Xanax. Now he's all fucked up on Xanax and really wants to try heroin for the first fucking time. I'm putting my foot down and saying nope not here at least. How bad an idea is it for them to let him do some boy (fire) on top of being already knocked down from Xanax. He has almost no tolerance to Xanax and absolutely no tolerance to heroin so I'm thinking he'd probably die if they let him do even a bump of this shit. He's already so fucked up off the xan ppl are a lil worried. It's dumb af right? I mean doing H for the 1st time is incredibly stupid but doing it on top of being wasted on Xanax is just setting me up to have to deal with having his corpse removed correct?,1533288082.0
947so1,https://i.redd.it/drtfsogy7ud11.jpg,7,https://redd.it/947so1,ewport,update: found another green and a half so i crushed it. gonna snort before i roll this lil indica boi :3,,1533284312.0
947pvu,https://i.redd.it/w8f6be925ud11.jpg,12,https://redd.it/947pvu,The-Damn-Thing,"One of the only ones left on the road. Its 3:00am, im driving tgrough the south, sick as a dog withdrawaling from methadone witg a nice .5 of good tar waiting for me on the other end. Only 3 hours to go. Happy nods!",,1533283342.0
947ozs,https://www.reddit.com/r/opiates/comments/947ozs/opinions_on_fent/,6,https://redd.it/947ozs,legal_u4ia,Opinions on fent?,"I used order fent powder and make a solution to dose with, but I can't find any more so I just ordered feint-pressed oxys. The listing didn't mention dosage or which analogs were used or whatnot.

What are your opinions on fent? Specifically feint-pressed oxys? Ever since meth entered my life, opioid mental euphoria became underwhelming; that's why I'm looking for fent, it has an incredible body high.",1533283050.0
947lyo,https://www.reddit.com/r/opiates/comments/947lyo/can_someone_tell_me_if_you_can_still_donatesell/,4,https://redd.it/947lyo,tThugnNasty,Can someone tell me if you can still donate/sell your blood/plasma if you currently,"Are using IV heroin? I don't work tomorrow and thus is my only option for money at this point so I wanted to go.  Like I don't have a ton of tracks and I'm healthy and look clean cut but since I use BTH i don't have big ol veins anymore. So is there Anyone thats been in my position that could shed some light on this for me ? Any help would be appreciated. Thanks. 
Also can you tell them which arm you prefer? My left has some bruises and a spider bite in afraid they'd think Is an abscess. ",1533282005.0
947h98,https://i.redd.it/bxzxy6klwtd11.jpg,13,https://redd.it/947h98,themdirtym30s,When payday and the plugs reup day align...,,1533280496.0
947h94,https://i.redd.it/eanql1kiwtd11.jpg,32,https://redd.it/947h94,bluelightR,Oxy Evey single Day!,,1533280495.0
947d1a,https://www.reddit.com/r/opiates/comments/947d1a/anyone_else/,6,https://redd.it/947d1a,Apoc4554,Anyone else,My best friend died of an overdose before i really started using (just bumming/ort buying a bag or 2 off him when he came over). Now i use every or every other weekend and cant help feeling like even worse trash because im flirting with the thing that killed him. Does anyone else get this feeling.,1533279203.0
947c4i,https://i.redd.it/6pfpfpssrtd11.jpg,24,https://redd.it/947c4i,PalmtopTaigaa,Refill Day! Couldn't have came sooner,,1533278902.0
947614,https://i.redd.it/pek7qqgbmtd11.jpg,17,https://redd.it/947614,ewport,im off about 2 bars with a medium tol to heroin. should i snort this K8 and chew that half? also smoke a lil j? obv saving the other 2 footballs for tmmr. 2:17am here on the east coast,,1533277034.0
9470h1,https://i.redd.it/c60yphe7htd11.jpg,18,https://redd.it/9470h1,heroinista,the feeling of satisfaction I get when I register is almost a high by itself... have a good night out there tonight everyone 🖤,,1533275316.0
946xyz,https://www.reddit.com/r/opiates/comments/946xyz/why_are_there_movies_about_drug_use_and_hardly/,13,https://redd.it/946xyz,seanpaulsteak,Why are there movies about drug use and hardly any movies about getting sober from drug use. Any suggestions on movies about recovery? Or books on recovery or any tips to get and stay sober?!!,,1533274549.0
946ylm,https://i.imgur.com/BbFAc1r.jpg,20,https://redd.it/946ylm,functioningjunkie,Pen Porn,,1533274753.0
946er7,https://www.reddit.com/r/opiates/comments/946er7/please_help_me_anyone/,34,https://redd.it/946er7,Smoof34,Please help me anyone,"I feel so horrible.  My girlfriend killed herself.  I had been on immodium since we met, we met right when I was kicked off suboxone in December and I tried to withdrawal but ended up relapsing on Dope for a month then on immodium.  I had a suboxone appointment this past Tuesday and I didn’t want to take any more immodium because I had been feeling chest tightness and it was scaring me.  So I used her car to go try to get some Xanax pills.  She found out by checking my location and she was so angry.  I didn’t even get the Xanax I turned around right away because she said she was gna leave the house without her phone.  I got home and she was gone, I called her parents and tried to find her then she came back at 5 am.  Then we weren’t really talking much that day cause she was mad at me and I was upset because I felt so bad but also like i just did it because I didn’t want to take immodium and I felt it wasn’t that bad.  Then I wake up the next morning and I see she had texted me saying she loved me and I could come sleep upstairs rather than on the couch, but that she didn’t know how to get past this.  She wasn’t home I thought she was at work and a couple hours police showed up and said she had shot herself in the head.  She parked her car somewhere and walked off into the woods and killed herself.  And it’s all my fault I’m so fucking stupid and horrible she was everything tobme she was how I finally wanted to be alive again, I had gotten a job and then moved across the country to be with her.  My baby girl died scared and alone and she had been saying she was toxic for me and we were never going to work out but she was so wrong she made me so fucking happy.  She had been sexually abused as a child and never really got help so she said she just always had this anger and sadness inside her and hurt.  And she had such issues trusting me because of what had happened to her.  When I relapsed in January we had only been dating a month and she left me and I knew I wasn’t good enough for her so I started talking to a new girl but not serious but last week she told me she still checked that girls face book every other day to see what she had that she didn’t.  But I told her that that girl was my second choice, I only got with her because she had left me! And then after a couple weeks me and that girl stopped and me and my baby got back together.  She was so amazing and so sweet but she was just so hurt and I didn’t get her help soon enough.  We had been talking to get her a therapist and she had called a bunch but couldn’t find one that was a female and also took her insurance.  I should have tried harder to help her find one.  I should have answered her text that night.  I should have sucked up through the withdrawal and not left to get Xanax.  I should have gotten off the immodium months ago.  I should have tried harder to show her how much I loved her how I truly meant that she was the most incredible and beautiful person I had ever met and that I was truly wanting to spend my entire life loving her and trying to make her happy.  I’m so so sorry baby I’m so sorry I didn’t help you enough.  I don’t know how to go on all I can think aboht is relapsing and dying to be with her.  I barely have any friends anymore because of my past issues with drugs even tho I haven’t used heroin in a year and a half except those couple weeks in January.  I posted this in the opiate recovery sub but it is just getting worse every day I don’t know how to survive this.  

Edit: she was NOT an opiate user.  She had only ever drank and smoked weed a little and did Molly once.  ",1533269307.0
946dpg,https://imgur.com/6f8jwSZ,27,https://redd.it/946dpg,suicidecommittee,Trying to impress the ladies like...,,1533269052.0
946b84,https://www.reddit.com/r/opiates/comments/946b84/how_did_you_start/,30,https://redd.it/946b84,Bonafide-Beatnik,How did you start?,"I’m curious to know who here began using opioids legally by prescription of a doctor? And who began using illegally in the beginning? Feel free to explain why, how, what kind, age, etc. As much detail as you would like to share. (Within the limitations of the rules of course.) This is just a topic that I think is very twisted and one sided in the media which is why I’d love to hear actual stories.",1533268450.0
946ac5,https://www.reddit.com/r/opiates/comments/946ac5/dboy/,9,https://redd.it/946ac5,wayone1,Dboy,"If they sell you garbage do you stop going through them or ask them to make it right. 

I’ve been going through the same guy for over two years and just bought 5gs that suck. I called him and he said it was the same shit I got last time. This is not true. What should I do?",1533268243.0
9466ja,https://www.reddit.com/r/opiates/comments/9466ja/off_to_rehab_tomorrow/,12,https://redd.it/9466ja,donttouchmy_tray,Off to rehab tomorrow,"I am off to rehab for my first time tomorrow. Don’t really know how I’m feeling atm or what I should be feeling. Pretty lost, confused and meh. Idk. Shit post. Sorry. ",1533267268.0
9466ft,https://i.imgur.com/yk6fOpR.jpg,131,https://redd.it/9466ft,Sober_junkies,"3rd & 4th abscesses, 1st was less than a year 1/2 ago...",,1533267244.0
9465w0,https://i.redd.it/fc0bh1tsssd11.jpg,13,https://redd.it/9465w0,Alexandrezico10,I’m subbed to this page for the memes. Now I am returning the favor,,1533267107.0
945ly4,https://www.reddit.com/r/opiates/comments/945ly4/who_here_legitimately_thought_they_had_a_bad_cold/,19,https://redd.it/945ly4,Dammit234,Who here legitimately thought they had a bad cold the first time going through WDs?,,1533262426.0
945i9h,https://www.reddit.com/r/opiates/comments/945i9h/snorting_dillies/,8,https://redd.it/945i9h,helixman21,Snorting Dillies,First time I just did it and honestly I feel pretty good ,1533261567.0
9454ln,https://www.reddit.com/r/opiates/comments/9454ln/tfw_you_snap_the_plunger_of_your_last_needle_in/,4,https://redd.it/9454ln,neighborhooddopeboy,>tfw you snap the plunger of your last needle in half trying to unclog it,Many tears were shed on this fine afternoon.,1533258369.0
945zbh,https://v.redd.it/0po81qldosd11,4,https://redd.it/945zbh,Jooobe,Time to have fun,,1533265656.0
945x8h,https://www.reddit.com/r/opiates/comments/945x8h/12_hour_shift_not_without_opiates/,3,https://redd.it/945x8h,NINtronica,12 hour shift... Not without opiates!,"Got another tedious 12 hour shift tonight. This definitely calls for a methadone/baclofen enhancement. Have a couple Norco too, but we'll see how sedated the mdone and muscle relaxants make me. Definitely don't wanna get caught on the nod at work lol. Worst case scenario I have some methylphenidate if things get too noddy. Cheers guys! Hope you guys are having a very noddy Thursday night! :)",1533265134.0
945tp8,https://www.youtube.com/watch?v=Ru820Vm9BaI,0,https://redd.it/945tp8,weekiller87,"Love me some Mickey Avalon, song about drugs/opiates and hilarity.",,1533264286.0
945tnj,https://www.reddit.com/r/opiates/comments/945tnj/holiday_weekend_break_for_the_duke/,3,https://redd.it/945tnj,RaouldDuke,Holiday weekend break for the Duke!,"So as some know I am done with dependency but sobriety nah! i even kicked the trazadone but sleeping or not sleeping is killing me.

Its been a week so boy,girl and rock tonight. Just arrived home, all went well and I am currently feeling like a junkstar. Bank holiday weekend is gonna be a holiday!!!! Thrown in a bottle of henny and xans on top and its happys days are here again!

Happy nods to the nodders, prayers and wishes to those struggling with the kick. I love you all, everyone of you JUNKSTARS!!!!!

as cube would say... today was a good day!",1533264273.0
945tlk,https://www.reddit.com/r/opiates/comments/945tlk/morphine_sr_help/,5,https://redd.it/945tlk,percykgr,Morphine SR help,"I can get morphine SR 15mg for pretty cheap, I wanna take like 300mg to get high but i only take orally, if i crushed em all up and like put them in a soda would that break the SR and make it instant? any help appreciated ",1533264260.0
945oed,https://i.redd.it/bdtfbiqkgsd11.jpg,10,https://redd.it/945oed,sleepstanding1,The sub clinic did me justice,,1533263002.0
945o1c,https://www.reddit.com/r/opiates/comments/945o1c/snorting_ms_contin_morphine/,27,https://redd.it/945o1c,VandalizedMan,Snorting MS Contin Morphine.,"I got some Purple MS Contin 30mgs morphine... I can take 6 of them in a day, and today I've already taken 4 of them... I want to know, how good is the high of snorting one?

I always crush them up and wash them down with some water or soda, I parachuted one of them, and often times when I take morphine, even 120mg at once, I feel a little bit of something if nothing. Will snorting one of them do a great high? 

Is it safe to snort MS Contin Morphine?
Is the high better than oral?",1533262917.0
945iep,https://www.reddit.com/r/opiates/comments/945iep/hey_has_any_one_heard_of_30s_being_repressed_to/,21,https://redd.it/945iep,repairmancam22,Hey has any one heard of 30s being repressed to doubling itself but having half as much of the potency? For example turning 50 30s into a 100,I have M boxs 30s that look maybe a little lighter but def have oxy in it I get high and it has the oxy drip they could be a 100% but someone told me about the doubling so it still test for but is basically a 15 so i have been skeptical also it breaks down slightly easier (or at least than vs i just had) it seems like they are slightly soft but maybe not have had mbox in awhile ,1533261604.0
945b69,https://www.reddit.com/r/opiates/comments/945b69/need_advice/,17,https://redd.it/945b69,bradster101111,Need advice,So a friend and I get our doc on the 16 of the month from same guy. I make mine last because I can afford more I guess. He always runs out 2 weeks early and makes me feel guilty and I always cave and give him some of mine. This last month I told him the deal. If he isn’t smart I’m not gonna help him this time. Now he’s home with 3 kids no ac and making me feel like shit again. I can’t put myself at risk but I am too nice and I feel bad.  This sucks,1533259917.0
945av0,https://i.redd.it/sxssen577sd11.jpg,18,https://redd.it/945av0,rarelycarely,"One fine day. Everything worked out so smooth today. Got our hustle on and had $350 made in about 2hrs. Copped this bit till tomorrow, when I can buy a larger amount. How'd everyone else's day go??",,1533259844.0
94582y,https://i.redd.it/rnoskv385sd11.jpg,9,https://redd.it/94582y,sensisandwich,Demon & angelz wit dirty faces!,,1533259179.0
9457lz,https://i.redd.it/arlfq31w4sd11.jpg,11,https://redd.it/9457lz,sensisandwich,.94... :)!!!!!,,1533259067.0
9455i1,https://www.reddit.com/r/opiates/comments/9455i1/i_have_a_few_quick_question_on_withdrawing_and/,11,https://redd.it/9455i1,Fuckedupfuckupp,I have a few quick question on withdrawing and what can make it easier.,How much would Xanax and Valium help with withdrawls? And Ibuprofen as much as is safe a day. Any other suggestions to add in l? also I can’t get any methadone or subs. So everything legal that would help pretty much. ,1533258572.0
944zjo,https://i.redd.it/k65vcvmazrd11.jpg,27,https://redd.it/944zjo,thelarustatrust,8 grams of heroin #3.,,1533257188.0
944w4i,https://www.reddit.com/r/opiates/comments/944w4i/worse_bone_head_move_losing_stuff/,44,https://redd.it/944w4i,MetroMaker,Worse Bone Head Move Losing Stuff,"Everyone loses stuff. What is the most bone headed move that YOU caused. I don't mean rip offs or cops or misplaced. I'll start.

 I just bought an 8 and I was feeling good on a nice, sunny Sunday afternoon in football season. Just perfect fall weather. I USED TO keep stuff in medicine bottles, which was really stupid mainly because of all of the information on the label. I needed a refill on my non - pain medicine, so I took what I thought was the refill bottle to the pharmacy and dropped it off.  I realized my bone headed mistake when I got home. Yep - my 8 was in the refill bottle and fortunately I had enough control still to NOT go back to the pharmacy and ask for my 8 back. Next day I was like a paranoid crack head to pick up my refill and thank you JJ, they just handed me my meds. That's my BONE HEADED STORY. ",1533256376.0
944v4a,https://www.reddit.com/r/opiates/comments/944v4a/passed_2nd_ged_today_stressed_2_more_to_go_and/,4,https://redd.it/944v4a,iAmAPickleYo,"Passed 2nd GED today stressed, 2 more to go and military here I come! Little Oxy before I leave dose advice and all needed!!","So I’ve been so stressed with my girl, being controlled, spiteful workers almost making me fail and still passed, and all I have is two more test to take and I’ll be good to go into the Air Force.

Now I know I’ve been over 90+ days clean, I just wanna have a few last Oxy moment before I go in. I been off my Suboxone 4 days now I believe only was taking 2mg twice daily. 

Took 30mg (3 10/325mg) Percocet I don’t think I felt anything.. so I don’t know what dose to start at if I wanna just get a buzz + feel nice, and what dose to start at to get a nod in all honesty!",1533256153.0
944oa6,https://www.reddit.com/r/opiates/comments/944oa6/meeting_girlsboys_at_meetings/,45,https://redd.it/944oa6,MetroMaker,Meeting Girls/Boys at Meetings?,I have been to four AA meetings and there some people that I would like to know. Anyone have much luck meeting a romantic interest at those meetings? ,1533254653.0
944o8y,https://www.reddit.com/r/opiates/comments/944o8y/oxycodone_oral_to_hydromorphone_intranasal_help/,16,https://redd.it/944o8y,helixman21,Oxycodone Oral to Hydromorphone Intranasal help please,"So my regular dose of oxy oral is like 60mg. I found a conversion calculator saying 3.2mg of Dilly IV was the equivalent of 60mg oral oxy. BA Snorting is 56-58% , so 6mg or so snorted would have me feeling almost if not the same as 60mg oral oxy? I have a HUGEEEE tolerance to opiates (Oxy). Thanks for the help",1533254644.0
944juc,https://www.reddit.com/r/opiates/comments/944juc/how_would_decriminalising_and_regulating/,17,https://redd.it/944juc,rumpleshroomskin,How would decriminalising and regulating substances such as heroin effect users and society?,"I keep seeing all these videos, articles and a variety of other media posts about the tragic effects of opiate substances, which I’m sure many of you have experienced personally. Obviously the war on drugs has failed, so where do we look next? I’m interested in hearing your thoughts on what decriminalisation and potentially regulated legalisation of these substances would look like? How would it effect you personally, or how would it either help or hinder people who are struggling with addiction and the issues that come with it? ",1533253633.0
944iol,https://www.reddit.com/r/opiates/comments/944iol/zpills/,3,https://redd.it/944iol,dopevshope,Z-pills,"Do any of you folks like mixing z-pills (zopiclone, zolpidem, zaleplon) with your opiates? Every few months ill get some Ambien or lunesta or *sometimes* zaleplon, and take my dope and then rail some Ambien. (If its Lunesta I just eat it.)
It kicks up the high in a whole new sedative and hypnotic way.
Just curious if anyone else enjoys this.

Also- belsomra (suvorexant; or other orexin inhibitors) has not been nearly as affective as full on sedative hypnotics.

Would love to hear other experiences.",1533253389.0
943wya,https://www.reddit.com/r/opiates/comments/943wya/junkie_essentials_a_playlist/,37,https://redd.it/943wya,darknessdown,Junkie Essentials (A Playlist),"The La's ""There She Goes""

Spiritualized ""Ladies and Gentlemen We Are Floating in Space""

Pink Floyd ""Comfortably Numb""

DIIV ""Dust""

Nirvana ""On a Plain""

Johnny Thunders ""Chinese Rocks""

Fidlar ""No Waves""

The Pains of Being Pure at Heart ""A Teenager in Love""

Brian Jonestown Massacre ""Prozac vs Heroin"" 

The Velvet Underground ""Heroin""

Warren Zevon ""Carmelita"" 

Lou Reed ""A Perfect Day"" 

Neil Young ""Needle and the Damage Done""

Violent Femmes ""Blister in the Sun"" 

Rolling Stones ""Dead Flowers"" 

The Beatles ""Happiness is a Warm Gun""

Wilco ""A Shot in the Arm""

Dandy Warhols ""Not If You Were The Last Junkie On Earth""

\*Bonus\* Demi Lovato ""Sober"" 

What'd I miss?? ",1533248741.0
943ulo,https://www.reddit.com/r/opiates/comments/943ulo/best_way_of_getting_every_little_bit_out_of_those/,17,https://redd.it/943ulo,MetroMaker,Best Way of Getting Every Little Bit Out of those Baby Ziplocks,How do you get every bit out of baby ziplocks? Carol slices them open and scrapes them with a razor blade. ,1533248264.0
943uep,https://i.redd.it/h7t44u2n8rd11.jpg,190,https://redd.it/943uep,,What a dick,,1533248220.0
