9zqbvg,https://www.reddit.com/r/opiates/comments/9zqbvg/another_suboxone_question/,4,https://redd.it/9zqbvg,boinamedcharles,Another suboxone question,"I know this has been asked before but Reddit’s search bar sucks. My question is: I took half an 8mg suboxone strip at 8 am cause I couldn’t find shit. Of course during my lunch break I found 5 perc 10s. How long should I wait to take the percs? I’m guessing at least wait til tomorrow because the half life is 30 hours? 

Edit: really trying to take them as soon as possible but wanna minimize the waste. Will 4mg of bupe jack my tolerance up? I took 4mg of bios Wednesday and 4 this morning ",1542995180.0
9zqapq,https://www.reddit.com/r/opiates/comments/9zqapq/splitting_oxy_er_dodgy_advice_from_a_dr/,8,https://redd.it/9zqapq,bertsugar,[Splitting oxy ER] Dodgy advice from a Dr.,"A doctor I spoke to briefly said that I would not get even doses of 80mg oxy split in 4. One part could contain all of the active ingredient. I don't buy this. I am gonna ask my GP next week

Any thoughts?",1542994964.0
9zq3is,https://www.reddit.com/r/opiates/comments/9zq3is/skin_popping_or_im_heroin/,14,https://redd.it/9zq3is,PeterRoe420,Skin popping or IM heroin,"Hi there,

I am too chicken to try IV heroin because I dont know how yo shoot up.  I know that skin popping or IM is possible but cant find user reports on it.  How does it compare to other ROA.  I have only tried snorting.

Cheers",1542993593.0
9zpy87,https://i.redd.it/199z9cgn34021.jpg,6,https://redd.it/9zpy87,mrsjohnson87,Sucessful day💚💚💚,,1542992596.0
9zpulp,https://www.reddit.com/r/opiates/comments/9zpulp/should_i_fake_an_injury_to_get_into_the_hospital/,38,https://redd.it/9zpulp,Grubbnar,Should I “fake” an injury to get into the hospital?,"First and foremost, I find this to be very umm unethical. That’s the word, right? Also, I’m sorry if this violates any rules. I’m kind of a newb.

Anyway, I  was just wondering if I should “fake” an injury to be admitted to a hospital. I have Crohn’s, a shit ton of adhesions, and a portion of my bowel that is 5mm in diameter.

I know what foods not to eat to cause a bowel obstruction. While in the hospital they would give me dilaudid and replace my patch as well. I’d be in the hospital for a week at least.

I know this is a shit thing to do, but the last time I went through withdrawals I thought suicide would be a better option *insert giant pussy comments now*.

I’d just like to know what you all think. Please save all the negative comments as I feel like a piece of shit for considering this.

- Grub",1542991895.0
9zpprl,https://www.reddit.com/r/opiates/comments/9zpprl/quick_help_please_advice_for_missed_gunpowder/,3,https://redd.it/9zpprl,DrMintRoss,Quick help please (advice for missed gunpowder”,"I’m on the east cost and rarely see tar or gunpowder. But today I somehow got stuck with a decent amount of gun powder, first time I’ve ever used it and I just missed a pretty big size shot in my hand, wondering if it’s more dangerous than the usual Chyna white. If this is a stupid question I’m sorry just want to make sure I’m not in some sort of danger. Thanks I’ll post a pic if need be ",1542990964.0
9zpodf,https://i.redd.it/e9temptzx3021.jpg,8,https://redd.it/9zpodf,RastaTylah,Safe to say I relapsed,,1542990699.0
9zpltb,https://www.reddit.com/r/opiates/comments/9zpltb/what_can_bad_heroin_do/,12,https://redd.it/9zpltb,saxgod420,What can bad heroin do?,A few days ago I had a batch of boy that smoked so strong that I suspected that it had been sprayed with vinegar. It did not chop up to a fine powder like it should’ve and it kind of burned when I snorted it. Now a few days later I have strep like symptoms and my nose is super raw and a little swollen. Coincidence and I’m just sick or do you think the boy caused it??,1542990198.0
9zpllf,https://i.redd.it/yt0b7efdw3021.jpg,20,https://redd.it/9zpllf,swanzy1,Welp. I’m in a good mood now!,,1542990148.0
9zplhx,https://www.reddit.com/r/opiates/comments/9zplhx/ms_contin_200_mg_anyone_tried_the_real_and_the/,3,https://redd.it/9zplhx,bertsugar,ms contin 200 mg. Anyone tried the real and the pressed one?,"Should I buy it, crush and take 1/4 or are these pressed ones too dodgy?",1542990125.0
9zpkss,https://i.redd.it/0u1ze84vv3021.jpg,26,https://redd.it/9zpkss,griftylifts,"oh, same",,1542989970.0
9zpgew,https://www.reddit.com/r/opiates/comments/9zpgew/needles/,12,https://redd.it/9zpgew,skipper489,Needles,Who else goes to walmart to buy the freaking 100 magnum box of rigs because it's cheaper than $3.50 per 10 pack plus I hate going to the pharmacy. Get the hundo pack boom I'm good for like 2 to 3 weeks,1542989102.0
9zpen2,https://imgur.com/a/k9vedLH/,7,https://redd.it/9zpen2,Oxiconone,I have a decision to make guys. I now have the option to swap my Shortec (OxyNorm 20mg) for the equivalent in liquid form (Shortec 10mg/ml concentrated solution). I would still receive the same dose. What do you guys think? Would really appreciate your input 😊🙏🏼,,1542988757.0
9zpe7h,https://www.reddit.com/r/opiates/comments/9zpe7h/is_your_dealer_ballin_or_is_he_just_a_junkie/,24,https://redd.it/9zpe7h,BrianLefevreMD,Is your dealer ballin or is he just a junkie hustling for his own fix?,I’ve never met an actual ballin dealer.,1542988667.0
9zpb8j,https://i.redd.it/63l654h6q3021.png,4,https://redd.it/9zpb8j,skipper489,Sent this to my super masculine bro bro this morning 😂😂😂,,1542988059.0
9zp7ts,https://www.reddit.com/r/opiates/comments/9zp7ts/retail_workers_bulletin_for_black_friday/,17,https://redd.it/9zp7ts,sloan_fitch,Retail Workers Bulletin for Black Friday,"If you're clean... then just eat and pack a lunch. Even if the store says ""we're providing lunch"", don't count on there being a enough when you go on break. Bring something.


If you're not clean, then bring enough to be well if you have and don't use it all at once!



If you're moderately clean or on a Suboxone regiment, take your daily dose and bring a couple of milligrams as a booster dose if you're working in excess of twelve hours.


If you're sick because your friend gave you a bad ETA, then stop hanging out with Cliff! Hio!!!!


&nbsp;


If you are scheduled to work after closing, perhaps resign yourself to the fact that it's going to be a late one. Perhaps find ways not to make it so but some things can't be helped in the ways we'd prefer. Barring going home when we want, make it fun while you're there if possible. 

&nbsp;


If you have a customer who is a reseller, tell them to order it online or something. 


If someone asks for a price match, kindly explain to them that all price matching and rain checks are suspended for the whole weekend. Maybe pretend to care about how the customer feels and act like you feel the same way.



Keep your eyes opened for those who shop in hiked up skirts for some reason. It makes more sense if they're coming out after Thanksgiving dinner like yesterday. 



&nbsp;

Speaking of Thanksgiving.... I say, ""all the time you spend staying late is so that they wont fire you for being late all the time when it comes time to think about it."" In my case, my friend needed help closing his department and had to be back in at 7am while I have to be in at 11:30. He joked, ""ahh you work at 11? You're all mine!!!""

Then my friend made me take an Uber. Well, normally he might offer a ride and I'll say ""I'm good, I want to ride my bike"" but it's like I was leaving work at 3:30am to be back in at 11:30 so he convinced me pretty easily and said the expense will be covered by the company and that he would handle all of that hassle so I didn't even have to lay out the money.


So I get this Russian guy who was talking about rooting Android auto and about his Note 4.... and Moscow being a ""dry cold"", lol just like when people talk about deserts and ""dry heat.""


&nbsp;

My second or third biggest peeve are those people who try to buy five cheap TVs, or five good TVs that are cheap... mofo, that's one per a person. You can do whatever you want... go running around to every register and pretend you didn't buy already.... but don't fucking ask me to hunt for a product five minutes after close. I told you to go to checkout because I was done playing personal shopping assistant with you. Nice people otherwise but just like... look at the pallets of boxes and choose.



In the words of Milton Friedman, you are free to choose. In the words of Milton Bradley, roll that dice!


&nbsp;


In conclusion, I can't wait 'til this concludes but in the mean time I'll try to have fun. I must get ready now, no more jerking around on my computer....I gotta eat in a matter of ten minutes then shower. My boy is calling another Uber because of course I didn't take my bike home last night and all-in-all it's cold enough and I'm tired enough to be real glad for that.


Mind over matter.... I'm not tired, just comparatively sleep deprived. Still better off than many others. Anyway, tomorrow I work at 5pm.. so even if I work 11:30am to 3:30am, I'll get a good night's sleep. I'd prefer to get out by 2am but I'm just resigning to it being a late one so I''m not set for disappointment. This year I have a seasoned newb working with me after hours so at least he'll know what to do.



&nbsp;


Happy Black Friday. First time I heard the term I wasn't familiar, my family never went shopping the day after TG. So I was like ""what's that, the day the stock market crashed in 1980?"" That one was actually called ""Black Monday"" or something. On Turn-A Gundam they have Black History which is really ""dark history"" not of people of African descent. 


Last year I had a crush on this beautiful Pali girl.... I don't think it could have actually worked out longer term unless I was willing to convert to Islam or if she would be willing to be less devoted to her religious beliefs. This year, well I been in a recovery of sorts and last year I was totally not there yet. Some things are the same and some have changed.


There's new potential, new goals, and refined goals. 



Let us proceed to have a good day and evening which will inevitably blend into a good morning before I go to bed once more. Then tomorrow I can play with my tortoise. I'm skipping turtle and tortoise feedings today. I will hopefully have time to plug in their webcams, I wanna see my turtles from work. ",1542987358.0
9zp73f,https://www.reddit.com/r/opiates/comments/9zp73f/do_other_drugs_work_on_suboxone/,8,https://redd.it/9zp73f,InspectorCollector,Do other drugs work on Suboxone?,"Long story short, i'm getting fed up with pressed pills and fakes. They're everywhere, and i'm just too freaked about taking one that they didn't bother to mix properly and die of fent OD. I only ever take real pharma, at least thats what I ask for.

So i'm thinking of going on Suboxone, but I have a vacation planned in spring. It's not a vacation unless i'm also doing coke and drinking, and i'm wondering what sort of interaction there is between these and suboxone. I know how to mix with opiates, but subs i have no experience with.

Worst case scenario, i just keep using questionable pills until after the vacation is over, but i'd prefer to get on subs now so i'm used to it by the time vacation rolls around.

Also, it's safe to say that there is no sort of high, or energy, or happiness, or euphoria with subs, right? I'll just be back to slightly depressed all the time?",1542987209.0
9zp4be,https://www.reddit.com/r/opiates/comments/9zp4be/do_you_think_my_doctor_prescribe_an_opiate_or/,6,https://redd.it/9zp4be,oneshotnicky,Do you think my doctor prescribe an opiate or soma for muscle spasms and cramps,"I KNOW soma isn't an opiate but the other drug subs are useless af so forgive me

I'm very depressed and suicidal so I'm on Zoloft. It wasn't working so they gave me abilify to boost its effects and it's working now my symptoms are greatly reduced the only thing is it gives me really bad muscle spasms, cramps, and stiffness. I tried to man up but it's been a week and it's really bad I can't sleep or even sit still I have to be constantly moving and it's causing pain and extreme discomfort

I took 20mgs of flexaril and it did nothing my junkie ass brain immideatly thought of soma. If you guys had to guess do you think a doctor would write me a script for soma or is it a long shot

",1542986631.0
9zp12o,https://www.reddit.com/r/opiates/comments/9zp12o/tramadol_and_st_johns_wort/,8,https://redd.it/9zp12o,DojoDodo,Tramadol and st john's wort,"My question is: Is it safe to take tramadol, if i took my last dose of st John's on Sunday? Am i risking to get seratonin syndrome? I took st John's for 1 1/2 Week and in that time span i took 900mg every day, if that matters. ",1542985940.0
9zou8h,https://i.redd.it/j3kxqwnef3021.jpg,8,https://redd.it/9zou8h,JustinJoubert,Perfect start to a great weekend...,,1542984449.0
9zot1t,https://i.redd.it/u0tw7tlne3021.jpg,30,https://redd.it/9zot1t,jesterdsmith,Should be fun,,1542984184.0
9zos6k,https://www.reddit.com/r/opiates/comments/9zos6k/morning_bitters/,12,https://redd.it/9zos6k,throwaway666718,Morning bitters,"I used to start my day off with a small cup of slightly bitter, black coffee.

Now I start my days off with a massive cup of disgustingly bitter, green Hydrocodone solution from doing a cold water extraction. I have the 10mg Hydro/650mg APAP green beans and so I'm trying to do my liver a favor by removing the APAP.

I'm just praying for the day where I can get my hands on something snortable like blues or opana. Shit, I'd even try H at this point if I knew were to find it. 

Anyway, good morning. How's everyone doing?",1542983993.0
9zopre,https://i.redd.it/cic5r1dgc3021.jpg,18,https://redd.it/9zopre,Pelgrim,I got lucky as an opiate enthousiast but cry bc uncle died 2 months ago. Patch porn,,1542983462.0
9zolz5,https://www.reddit.com/r/opiates/comments/9zolz5/i_dont_struggle_with_staying_clean_physically_i/,73,https://redd.it/9zolz5,freedagoat2169,I don’t struggle with staying clean physically. I can quit easily. But why is living a sober life so fucking boring to me?,"Guys I tried it. My brain just can’t live sober. I mean I don’t struggle physically I go days and weeks without it no problem. 

But those days are the most boring depressing and dull days. I look forward to nothing but lying down in bed and wasting my days away 

Nothing excites me anymore. Like when I was a teen I’d be happy just to see a friend, grab a bite to eat, play basketball, etc.

Now doing anything is a chore. Nothing fucking excites me unless I’m under the influence

It’s like once I take that little blue pill everything becomes... alright. Why?

It makes me motivated, talkative energetic and I feel like the best me ",1542982601.0
9zoi3k,https://i.redd.it/bflz2jkc73021.jpg,9,https://redd.it/9zoi3k,brokebackboyo,"throwback to the only month in my miserable life i’ve ever been entirely pain free :,) i miss my hydros and oxies",,1542981730.0
9zogmt,https://www.reddit.com/r/opiates/comments/9zogmt/suboxone_effects/,6,https://redd.it/9zogmt,UnitedStateOfDenmark,Suboxone effects,"After two months of taking Suboxone to get over a heavy pain killer addiction. Is it normal to still be heavily slurring your words, stumbling over-self, forgetting things, and other side effects like that?",1542981387.0
9zof2c,https://i.redd.it/90xal2r753021.jpg,0,https://redd.it/9zof2c,bafzilla,Relevant,,1542981008.0
9zod15,https://i.redd.it/z3apxmas33021.jpg,6,https://redd.it/9zod15,DopeGuy1234,Some stash,,1542980528.0
9zo87w,https://www.reddit.com/r/opiates/comments/9zo87w/codeine_dosages/,2,https://redd.it/9zo87w,Riley-jai-campbell,Codeine dosages,"(this will be CWE so paracetamol won’t be an issue) Hey I was just wondering how many mg of codeine is the threshold dose, a high dose and what is the amount of codeine that could lead to OD.",1542979338.0
9zo3pr,https://www.reddit.com/r/opiates/comments/9zo3pr/i_dont_think_these_are_realanyone_have_experience/,16,https://redd.it/9zo3pr,looking_for_contacts,I don't think these are real-anyone have experience with them?,"So I get these from Germany and, while they are VERY good and come in VERY real packaging...i fail to believe they are real because they don't have any imprint on them.

anyway, they are certainly opiates and very powerful but i'm wondering if anyone has experience with shooting them. i have just been smoking them mostly but i'm wondering it they are ok to shoot.

&#x200B;

again i know  you can't see the pills but they look just like a purdue OC 80 except there are zero imprints. they have the normal coating and everything.  


&#x200B;

https://i.redd.it/wqv3eirvw2021.jpg

https://i.redd.it/8ncnnorvw2021.jpg",1542978244.0
9zo38d,https://www.reddit.com/r/opiates/comments/9zo38d/just_spended_half_my_paycheck_on_new_glasses/,2,https://redd.it/9zo38d,heyeveryone2,Just spended half my paycheck on new glasses because the old one broke yesterday :(,"Guess I'll have to stay clean at least to next month so i can pay my bills and buy some christmas gifts. Fuck.

Have a nice day you all :D",1542978128.0
9zo1k0,https://www.reddit.com/r/opiates/comments/9zo1k0/tapentadol_100mg_slow_release/,4,https://redd.it/9zo1k0,Lurenz,Tapentadol 100mg slow release,"Hello everyone, I found some tapentadol in my house, I tried it, nothing special...
Since I don't want to take too many pills at once (I need my liver lol) I was wondering about snorting, I tried that ( yes It bruns but I don't mind it).
I am still not sure if I really felt anything, so is it possible that the time release works even if I crushed them? Should I ""process"" them in a certain kind of way? Or it is just the tapentadol itself that is kind of ""meh"" 
I will try to upload a pic of the pill in the comments",1542977682.0
9znyh4,https://www.reddit.com/r/opiates/comments/9znyh4/combo_safe_or_not_safe/,5,https://redd.it/9znyh4,Larklymark,Combo? Safe or not safe ?,Is it safe too mix dilaudid with other opiates ? Hydrocodone oxycodone etc ??,1542976877.0
9znwli,https://youtu.be/RLIB1nPFQIE?t=24,2,https://redd.it/9znwli,C_Lana_Zepamo,How I introduce myself to dboys I'm trying to cold cop from.,,1542976351.0
9znwck,https://www.reddit.com/r/opiates/comments/9znwck/which_one_of_you_12_year_olds_pissed_off_the_doc/,24,https://redd.it/9znwck,fentdoper,Which one of you 12 year olds pissed off the Doc this time?,"So it seems another 13-14 year old scientist has managed to run off our doc once again.

RIP /u/platinumtower /u/platinum_tower /u/frozen_shark (on Reddit anyway)

Not sure if he's going to come back around again, and I have no idea what happened, but I do know this: some of you guys are some reeeeaaaal fuckboys sometimes.

Thanks, that's all for me.  Happy Thanksgiving everybody.",1542976289.0
9znuu0,https://youtu.be/MQOXbC9irHo,1,https://redd.it/9znuu0,PastafariPete,Painkillers - Rainbow Kitten Surprise,,1542975862.0
9znu6t,https://www.bloomberg.com/news/articles/2018-11-21/u-k-midcaps-have-a-new-biggest-loser-as-analysts-cut-indivior,0,https://redd.it/9znu6t,fentdoper,"Final ruling means more generic ""strip"" suboxone options and uncertain future for Indivior and Sublocade",,1542975684.0
9znt38,https://www.reddit.com/r/opiates/comments/9znt38/phoenix_az_fent_warning/,2,https://redd.it/9znt38,Biscuitsandass,Phoenix AZ fent warning.,"Theres so bth with fent in it, took some and it rushed way harder than it should have, used some test strips and there was fent.",1542975374.0
9znp9u,https://i.redd.it/88o1j253l2021.jpg,4,https://redd.it/9znp9u,throwaway666718,"Can I just crush these and snort them, or do I have to do that microwave bullshit to get the coating off?",,1542974298.0
9znltg,https://www.reddit.com/r/opiates/comments/9znltg/i_have_no_other_options_right_now_so_im_prepared/,13,https://redd.it/9znltg,YouWannaUnpackThat,"I have no other options right now so I'm prepared for the enslaught of negative comments, but hear me out.","Basically my situation is that I'm out of oxy for a few days but I've got like three scripts for tramadol I never filled. Two are for 50mg instant release and one is for 150mg extended release. 
I'd have plenty of the 50mg IR trams, and normally my rec dose of oxy sits at around 30-40mg, So I guess i am clueless regarding equivelance and what sort of high tram will provide in comparison to oxy. I know it's nowhere near as good, but I'm hoping it can give me something. ",1542973250.0
9zmzke,https://www.reddit.com/r/opiates/comments/9zmzke/anyone_else_here_sold_pretty_much_everything/,22,https://redd.it/9zmzke,thomazepam666,"Anyone else here sold pretty much everything they’ve owned , smoked the money and all they have left is a few clothes and their cellphone, fuck I look back on all the shit I used to have and like poof gone for such ridiculous prices as well fuck will do almost anything just to chase H",,1542966286.0
9zn1ku,https://www.reddit.com/r/opiates/comments/9zn1ku/what_was_the_gateway_drug_for_youif_there_was_one/,16,https://redd.it/9zn1ku,oneshotnicky,What was the gateway drug for you(if there was one)?,For me it was Xanax. I would take like 4 of my mom's Oxycodone pills from her large stash to sell to buy weed and cigs when i was in HS but I would never take them because I was afraid of pills. One day I was feeling really anxious and my aunt gave me a Xanax and I felt incredible. After that Xanax I started to experiment with the oxys(I'd sell 3 and keep one for myself) and other shit. I ended up dropping out of HS even though I was an A- average student and I had to get my GED,1542966941.0
9zmybe,https://i.redd.it/pxlrz0caw1021.jpg,2,https://redd.it/9zmybe,YouWannaUnpackThat,"Waiting for another 20 minutes while my grapefruit juice gets where it needs to be to enhance, even just a tiny bit, the effect of my self imposed limit of one 5mg IR Endone tablet. (had 20mg of Valium but I don't need to watch that, four boxes of etizest coming)",,1542965900.0
9zmr4l,https://i.redd.it/wqc4qzitp1021.jpg,15,https://redd.it/9zmr4l,bethieisturnt,Black Friday Bitches,,1542963727.0
9zmn75,https://www.reddit.com/r/opiates/comments/9zmn75/fuckin_life/,24,https://redd.it/9zmn75,sickboy12345,Fuckin life,I've been on probation for 6 months I've probably used h maybe 3 times. I kinda just decided to have a good time fucked this mom and drank and took kpins and smoked weed I'm so fucked whenever I call my number and see if I have a test I'm gonna get revoked and go to jail AGAIN I'm just so tired of this shit. I know I'm rambling but just life sucks sometimes. Even clean off h i still love drinking and smoking weed especially with attractive women. I don't even know what the fuxk I'm doing anymore man,1542962514.0
9zmivi,https://imgur.com/a/NvXlsEo,0,https://redd.it/9zmivi,InhalingHappiness,"Just in case my dope & plug disappear suddenly, I'll have these to comfort me ;)",,1542961190.0
9zm824,https://i.redd.it/eiewg6q091021.jpg,10,https://redd.it/9zm824,theburgle,20$ score,,1542958077.0
9zm72m,https://www.reddit.com/r/opiates/comments/9zm72m/recent_car_accidentdoctors_visit/,8,https://redd.it/9zm72m,Julian6245,Recent car accident/doctors visit,"Hey guys, first time poster here on this sub. Let me start off by explaining my situation. The other day I was in an accident at the fault of another driver and got really bad whiplash and had my chest hit the steering wheel along with my left side of my body being flung towards the drivers door. The pain from that extended all the way to my upper back and neck area from my arm. I hired an attorney through a very well known firm in my city. 

Long story short, I’m 21 years old and my attorney set up an appointment with a pain specialist that works directly for their firm. Being that I’m young, I really want to know how to get the doctor to prescribe medicine that will actually help with this pain. I’ve been taking Tylenol/excedrin/aspirin and most of those either don’t help or just mask the pain for a very short amount of time and then it comes right back just as bad. I took tramadol that a relative gave me and that makes me feel very funny. However, I was offered Vicodin (10/325) by another relative and that one worked the best for me by far. I didn’t feel any funny side effects and I was still able to work and do everything without my pain bothering me and it lasted a good while. 

However, I won’t be getting anymore from that relative so I will have to see how the appointment goes. I’m not sure how to tell my doctor that. I know I can tell them that the excedrin and other OTC medications didn’t work for squat but I doubt I can tell him I tried taking tramadol and Vicodin that wasn’t prescribed to me. 

Is there any advice I can take to try and get the pain management doctor to prescribe me those without sounding like I’m drug seeking since I’m only 21? 

Also, all of this is being paid for by the attorney (prescriptions, appointments, etc.) and I’m pretty sure the pain doctor has to do much as possible to help and win the case. Thanks. ",1542957815.0
9zm56i,https://i.redd.it/ty1sga2p61021.jpg,7,https://redd.it/9zm56i,swinginnipplecocks,It do be that way sometimes,,1542957292.0
9zm4kz,https://www.reddit.com/r/opiates/comments/9zm4kz/so_relatable_used_to_be_my_anthem_when_heavy_use/,0,https://redd.it/9zm4kz,Dilly-dallier,So relatable used to be my anthem when heavy use was a life.,"Suprisingly this song has like no views 
I understand he's  got kind of a choppy  flow but this guys spits truth , its kinda depressing  but its real shit i still vibe to this but it kinda gives me bad nostalgia anyways  if ur high  check this  guy out,he's got a few other good songs but personally  this was always my favourite  
https://youtu.be/Qsg7kfKOZTQ",1542957146.0
