78u01a,https://www.reddit.com/r/opiates/comments/78u01a/paws_is_my_downfall/,14,https://redd.it/78u01a,brokenhalfjap,PAWS is my downfall.,"So I’ve been clean for a little over a week. The physical part of withdrawal is behind me and wasn’t that hard to kick because I was only using for about two weeks being I was in rehab the weeks prior. With that being said ..  how in the fuck do people get through post acute withdrawal? I think the absolute worst is the RLS and the not being able to sleep. I mean that and the whole wanting to do drugs all day everyday is also a big hurdle. I love them so much. The drugs, that is. The only thing that’s actually stopping me is probation and the threat of prison time. I’m not the type of person who would fair well in there. I have a big mouth and a bad attitude. Any advice would be much appreciated.  ",1509002807.0
78tt01,https://i.redd.it/avu4lbc9d4uz.jpg,9,https://redd.it/78tt01,nurseopiates,Ain’t much but damn it’s nice.,,1508999675.0
78tj3c,https://imgur.com/hRVJFFf,9,https://redd.it/78tj3c,AAAAAAAAAAAAAAASs,Cleanup from a homeless camp (from r/WTF),,1508995586.0
78tfb9,https://www.reddit.com/r/opiates/comments/78tfb9/need_some_advice_on_this_heroin_and_dosing/,11,https://redd.it/78tfb9,PontiffTheGreat,Need some advice on this Heroin and Dosing,"Scored some H for the first time yesterday, unclear how pure but definitely heroin. Heres the thing. 700mg of codeine gets me to an incredibly euphoric place (I may metabolize it well) but upon deciding to give some H a sniff and having gone through [two ballons pictured here](https://imgur.com/a/UCIWN) I never reached a peak euphoria anywhere close to what I get with codeine which at this stage is still my DOC. 

I started with small keybumps every 20/30 and felt it come on gently. Over the course of just under 3 hours I had sniffed it all and used about a fourth of it rectally. What I experienced was a mellow, mildly euphoric buzz that grew and plateued for a while. Not what I was expecting. **Could it have been low purity and hence 1.5-2 points of impure gear wasnt actually very much?** or **could it be that my excellent codeine metabolism has yielded me qith a higher tolerance than expected?** or **was the rate of intake simply tol slow? Bigger bumps per interval?**

I am picking up some more today and unsure as to what I should get and how I should do it. 2 balloons? 3/4? Start with half of one insufflated or administered rectally?

Also I thank in advance the comments that will tell me not to chase this high but hopefully I wont be in the 1/4 who become dependant. I am curious, and last night disappointed me so Im going for it one last time. Any advice or tips are much appreciated! :)

Cheers

",1508994082.0
78tf4l,https://www.reddit.com/r/opiates/comments/78tf4l/how_much_immodium_is_safe_to_take/,16,https://redd.it/78tf4l,NJGirlKitty,How much Immodium is safe to take?,"I keep hearing about Immodium causing stuff like heart problems, so I'm wondering what the safest amount to take is? I've taken Immodium before for withdrawals and it was a life saver so I'd still really like to take it? Is the danger only if you take too much at once, or is there a cumulative danger of taking it daily? 

And please don't tell me the ""you'll be constipated for days!"" myth. Immodium doesn't cause any worse constipation than heroin does. ",1508994018.0
78tcjv,https://www.reddit.com/r/opiates/comments/78tcjv/got_a_little_job_tomorrow/,7,https://redd.it/78tcjv,NotPoliticalyCorrect,Got a little job tomorrow,"So my dealer wants me to do a little job for him tomorrow. It's just papering a hall way should take two hours or so .The plaster is a bit fucked so I'll need to fill it and put up lining Paper. Getting an eighth for doing it and since I was skint today he gave us a half gram and he'll pick me up tomorrow morning. I hope it's the same stuff as the half I got today, as it was fire ! And I can't wait to have another fat hit of it. Plus I've got family up from England that I've not seen in 20 odd years. So it should be a good day tomorrow.",1508993042.0
78tacu,https://i.redd.it/o1zr1cf2r3uz.jpg,16,https://redd.it/78tacu,jaggerthebagger123,Fent powder I've been smokin tonight high is very noddy for an hour or two it's soooooo good,,1508992216.0
78t6qx,https://i.redd.it/93v2v5p4n3uz.jpg,18,https://redd.it/78t6qx,Wallaby_Way_Sydney,2 Gs of black love,,1508990891.0
78t4x7,https://www.reddit.com/r/opiates/comments/78t4x7/legalize_subs/,15,https://redd.it/78t4x7,oside33,Legalize subs,"Why aren't subs otc for 21+? I mean alchohol, tobacco, and now weed are pretty much legal (alchohol and tabacco both highly addictive and cause a ton of death) I know they are habit forming, and I've heard you can get high (never took them for a high). But honestly with the so called ""opioid epidemic"" I believe the pros of harm reduction and keeping people being productive would vastly outweigh the cons. I know it's easy to get a script, but I never have because I wouldn't want the mark on my record should I ever have a legitimate need for pain meds. Just a thought.",1508990311.0
78t3j5,https://www.reddit.com/r/opiates/comments/78t3j5/couldnt_be_freakin_happier_to_say_that_i_have/,3,https://redd.it/78t3j5,nurseopiates,"Couldn’t be freakin happier to say that I have found 2 legitimate, awesome plugs for pills off of craigslist. Didn’t think it was possible anymore. 😂",,1508989827.0
78t3bb,https://imgur.com/a/hsRjK,11,https://redd.it/78t3bb,m0ldycr0tch,Wish I had some roxies but something is better than nothing I guess,,1508989749.0
78t16u,https://www.reddit.com/r/opiates/comments/78t16u/dim_broke_and_need_drugs_what_do_i_do/,32,https://redd.it/78t16u,Croy_Bo,"(D)Im broke and need drugs, what do I do?","I have 0 dollars to my name and need dope, what do you guys do in these types of situations ",1508989008.0
78t13l,https://www.reddit.com/r/opiates/comments/78t13l/i_took_5_mg_of_oxycodone_with_zero_effect_dr_said/,6,https://redd.it/78t13l,savemejebus0,I took 5 mg of oxycodone with zero effect. Dr. Said I can do two pills at 10mg. Zero effect. Is that normal? Details in text.,"I had kidney stones and had it for that. Now I have them for a procedure that was done after. I take 10 mg and feel nothing. Still hurts like a motherfucker and you could have told me I took sugar. I THINK I felt a little dizziness, maybe? But nothing else. 

Obviously I wont get addicted because there is nothign to get addicted to and I have no reason to take them if they don't work. 

Anyone know why?",1508988972.0
78szqk,https://www.reddit.com/r/opiates/comments/78szqk/waddup_yall/,18,https://redd.it/78szqk,DaddyD503,Waddup yall,"Hey all. This is still one of my favorite subs even tho I stopped using a while back. You get me and I get you because we been there. I just wanted to drop in and tell you guys that someone loves you. Even though we are addicts there is always hope. I hope everyone is doing wonderful and being safe. To the highest highs, and the lowest lows, there is always hope as long as you're alive and breathing. Be safe everyone. One love ❤️",1508988508.0
78syqi,https://www.reddit.com/r/opiates/comments/78syqi/missing_user_thread/,66,https://redd.it/78syqi,Bad_Mouth_BItchxx,Missing user thread?,"Anyone got a certain user theyre curious or worried about? Maybe someones got answers..idk. 

I know i cant be the only one who wonders were certain homies on this sub disapear too..death, jail, rehab or clean are usually the odds and we can only hope wherever they are theyre doing okay. .

There are a few users ive been curious about but only one comes.to mind right now..anyone known where  /u/PHattygrilledcheese is at? I hope hes ok..",1508988158.0
78sxoj,https://www.reddit.com/r/opiates/comments/78sxoj/a_user_here_was_recently_charged_with/,17,https://redd.it/78sxoj,pap3rw8,A user here was recently charged with manslaughter - middlemen beware!,"A user of this subreddit with whom I'm acquainted in real life was charged with involuntary manslaughter this month. Many states, including my own, are using involuntary manslaughter laws to charge people who provide drugs that cause a fatal overdose. 


I hadn't seen or heard from him in a couple weeks and I knew that he had a possession case pending, so I checked the local court website to see if he had been picked up on a warrant for that. Much to my surprise, there was a new felony case in his name. 

He had been talking about getting back into the middle-man game again because he was short on cash. Apparently he hooked someone up who then passed away as a result of overdosing on his product. This charge is a first-degree felony with mandatory sentencing of 3-11 years. It's very possible that additional charges will be filed that could bring the sentence up to 20+ years. Bond is set at $250,000. It's likely that he'll never be able to post here again.

I'm not going to post his username, but it's someone who participated in here pretty regularly. Mods: PM me if you're interested in who it is, but I won't make it public without permission.

So just a reminder to all the middlemen out there: I know you need money to support your habit, but be extremely careful about selling to support it. Just because you're not a full-scale dealer doesn't mean you won't face the same consequences. This guy probably made $20 or $40 on this transaction, and now he has a death on his conscience and is looking at a long prison term. 



",1508987823.0
78sxit,https://www.reddit.com/r/opiates/comments/78sxit/miss_being_a_junkie/,6,https://redd.it/78sxit,junkieflunkie,Miss being a junkie,"6 mo sober.. 0 friends, 0 social contact, moved to a shit dept now job sucks.. I guess I got 1 person at work might come out and have a beer with me sometimes when i ask

idk man, when i was fiending at least i had purpose in life, trying to chase a high and a dboy. actually had social contact. managing my time to actually make it to work, living my two lives

Now man? I don't have shit to do. My job is pointless. I sit up at my desk and watch youtube on my phone all day. Coworkers all recluses. Shit i show up like 2 hours late some days no one notices. Office space is like a documentary to me.

I come home and sleep. all day. maybe wake up eat some fast food down some nyquil and wake up to my alarm clock blaring and roll into work late rinse repeat",1508987776.0
78stwg,https://www.reddit.com/r/opiates/comments/78stwg/appetite_problems/,4,https://redd.it/78stwg,Gudfeels31,Appetite problems,"Some days are better than others but my appetite has gone to shit in the last couple years. On top of my daily dope habit,I also smoke pot throughout the day. But lately I have no desire or my appetite will kick in at like 3am and I just stuff some doughnuts or chocolate quick an go back to bed. You would think be a habitual pot smoker I'd have intense munchies,thinking on top of the dope I might be developing something not healthy in my gut. What you guys do to get in the mood to tackle a nice big sandwich?   ",1508986581.0
78stdm,https://www.reddit.com/r/opiates/comments/78stdm/fuck_8_days_in_a_row_now_of_using_after_being/,18,https://redd.it/78stdm,wizardbloo,Fuck 8 days in a row now of using after being clean for 30 days...,"But hey my karma points are goin up. Lmfao.

I dont regret using any actually. I fuckin love dope.",1508986407.0
78ssai,https://www.reddit.com/r/opiates/comments/78ssai/fentanyl_home_brew_nasal_spray_tolerance/,8,https://redd.it/78ssai,Soulseeker17,FENTANYL HOME BREW NASAL SPRAY TOLERANCE,"Home brew fentanyl nasal spray tolerance & abuse. 

Ok guys, so here goes. My family don't understand how tolerance to opiates work and especially in my case with fentanyl. I was making my own 'home brew' using fentanyl powder, pure, 98% as a nasal spray. 
At first I started using 1ml per mg at a rate of 4ml over 3 days, this increased to 1mg per ml at a rate of 10 ml in a week and so on. After 12 months I was using 2mg per ml at 90ml (3 x20ml bottles of 2mg strength per 1ml = 90mls a day) they don't get the Math involved in my usage so I find it very hard to get them to understand. They also don't understand how rapidly the tolerance increases with something as strong as fentanyl. When I wouldn't have any fent I would try and stay out of withdrawal , I would need 300mg of OxyContin just to function - and I still struggled. Can anyone point me in the direction of any research done on fentanyl abuse, there just doesn't seem to be any research on actual abuse, not just the drug itself used for medical purposes, my situation was far different. 3grams would only last me a month. Not micrograms, grams. If there's anyone who has had experience the same as I have, I would be interested to know, what happened with your tolerance? How high did it get? Are you still using or did you manage to get clean? I'm now on methadone 80mg - for 10 months now. It's been a hard road, and I'm still coming to terms with just how fast my addiction escalated to what it was. The damage, not just to my life, but my body and brain is sad. I feel like an 80 year old, always sore, bones and joints cracking, my legs still ache, I have extreme memory loss - don't know what day it is half the time or what I did 10 minutes ago. I'm irritable and emotional also. What about you? 
Please only answer if you have experience with home brew fentanyl, as in looking for specific similarities in situations. Thank you so much for your time & answering. ",1508986064.0
78ss21,https://www.reddit.com/r/opiates/comments/78ss21/50_mg_hydrocodone/,7,https://redd.it/78ss21,attremote,50 mg hydrocodone,Earlier today i did a cold water extract of 20 mg of hydrocodone. That was about 8 hours ago amd i just took 30 mg now. Will i be ok? I am worried i over did it,1508985991.0
78spwr,https://www.reddit.com/r/opiates/comments/78spwr/you_guys_should_go_talk_some_sense_into_this_guy/,13,https://redd.it/78spwr,cwo14,You guys should go talk some sense into this guy,"https://www.reddit.com/r/Drugs/comments/78r504/heroin_is_not_addictive_and_why_its_the_best_drug/?st=J97UUTHA&sh=64a267ed

Sorry I don't know a better way to share this with you guys. ",1508985345.0
78somz,https://www.reddit.com/r/opiates/comments/78somz/took_a_long_tolerance_break_and_picking_up_for/,0,https://redd.it/78somz,Whiteguysaid,Took a long tolerance break and picking up for the first time in a long time tomorrow,"Excited of course to get high for the first time in awhile, but also wanting to see the effects of the tolerance break. Will be experimenting and trying out Hydro 10's. Also will try Oxy 10's. All just for fun in the moment. I love tolerance breaks.

I hope tomorrow goes good. Goodnight.",1508984959.0
78sm6w,https://www.reddit.com/r/opiates/comments/78sm6w/does_anyone_know_status_of_two_users_on_here/,39,https://redd.it/78sm6w,PrettyflawedButtrfly,Does anyone know status of two users on here?,"Their names were u/amandajodavies and u/kiss-kiss-bang-bangg? Any info? I've talked to both of them (somewhat), and here recently, just realized I haven't talked to either one or seen posts in awhile.",1508984220.0
78six5,https://www.reddit.com/r/opiates/comments/78six5/which_should_i_get_dhc_or_codeine/,9,https://redd.it/78six5,Psychonaut424,Which should I get. Dhc or codeine,Since my tolerance is getting lower due to Kratom use I figure I can go ahead and try good doses of either substance. I know orally codeine is better because of the bioavailability at 90% and dhc at 20% so the 1.5x more potent thing with dhc doesn't matter when taken orally. But can you take dhc any other way to make it more efficient so I can get the most out of it? For reference my Kratom dose is like 20 grams +/-,1508983248.0
78shlw,https://www.reddit.com/r/opiates/comments/78shlw/how_did_those_of_you_who_found_other_bropiates/,6,https://redd.it/78shlw,hexabumblerumble,How did those of you who found other bropiates find those other bropiates?,"I’m not necessarily looking for other users to hang with I’m just curious so I can keep some ideas in mind.

Going to apologise in  advance for any nonsensical comments as I’ve got a pretty decent nod going on ;)",1508982858.0
78sbdf,https://www.reddit.com/r/opiates/comments/78sbdf/successful_approach/,6,https://redd.it/78sbdf,_basic_bitch,Successful approach?,"K so in my city they have undertaken this huge project called operation Rio Grand. Basically a shit ton of addicts getting arrested and they have implemented some treatment for some of then and plan to implement more. Over a thousand arrests have been made and last I heard they have offered treatment to like 350. The rest are in jail. Do you guys think this is a good approach to the opiate crisis? Let me add its super conservative and addiction is really taboo around here, for example we just recently got a needle exchange and it is only open 4 hours per week. (2 days 2 hours each) I personally don't see how locking addicts up helps. In my experience jail is just like crime school. Only a small group will be allowed treatment the rest will just get a criminal record and spend some time locked up. In the meantime there are desperate junkies all over town because their connects are all in jail.   What do you guys think?        ",1508981013.0
78saqr,https://www.reddit.com/r/opiates/comments/78saqr/cold_turkey/,22,https://redd.it/78saqr,Genieinabottle94,Cold Turkey,This sounds insane but I actually prefer cold turkey method of getting clean instead of going the comfort meds/benzo/ subs route. For me all the comfort meds/benzos/subs just prolong the inevitable. I’d rather face withdrawal head on and get it over with. Or maybe my years of opiate use has somehow Stockholmed me into enjoying my misery??? Anyone else do cold turkey?,1508980832.0
78s91o,https://i.redd.it/u1luk6qrr2uz.jpg,7,https://redd.it/78s91o,RSGuckle,Take me away..,,1508980339.0
78s6z2,https://i.redd.it/ewspk88yp2uz.jpg,19,https://redd.it/78s6z2,Fraxurus,What I live for.,,1508979727.0
78s2jv,https://i.redd.it/3gd91fbyl2uz.jpg,40,https://redd.it/78s2jv,kimakiya,Cried picking up my subs for the week. I feel human again :)! Off to start my program and *maybe* kick dish nashty habiiit!!!,,1508978383.0
78s2d5,https://www.reddit.com/r/opiates/comments/78s2d5/snorting_vs_shooting_h/,28,https://redd.it/78s2d5,nodout94,Snorting vs. Shooting H,"I was using H for about 3 years a few years back and during the whole time I was addicted I never felt the urge to switch from snorting. I developed a 1.5 g a day habit at my worst. I had only ever IVd heroin once and I sincerely didn't like it, it didn't feel any better to me than snorting at all. 

So after snorting everyday for 3 years, now being clean for 4 years and just recently starting again, I've been ordering some .5s and single gs off DNMs and I'm still snorting, no urge to shoot. 

A .5 will last me 10 days, and a g usually lasts me about 2 1/2 to 3 weeks. During that time I'm snorting probably 7+ lines a day and maintaining a constant high. 


Is there anyone else out there who has never made the switch to shooting after snorting for prolonged periods of time? Am I a rare breed? Is there anyone else who tried shooting up and genuinely didn't like it and preferred other ROAs? 


",1508978325.0
78s04j,https://www.reddit.com/r/opiates/comments/78s04j/music_that_reminds_you_of_the_good_times/,14,https://redd.it/78s04j,Combiningsubstances,Music that reminds you of the good times?,"Don't shit on me for asking this but what are your guys' songs and artists that just remind you of being sedated beyond belief?
For me it would have to be Pretty Lights and Tycho. Some of the songs are audible opiates its wild",1508977660.0
78ryp0,https://www.reddit.com/r/opiates/comments/78ryp0/so_i_found_some_op30s/,20,https://redd.it/78ryp0,hemminski,"So, I found some OP30s.","I know that they are not OCs, but my girl doesn't not want ER and this is all I can find. How can she make them IR (besides sitting them in coke overnight)?",1508977257.0
78rxyd,https://www.reddit.com/r/opiates/comments/78rxyd/heroin_not_getting_me_high/,32,https://redd.it/78rxyd,ryangoesdownhill,Heroin not getting me high,"I've started snorting heroin recently actually, and I'm not really feeling the intense heroin euphoria everyone goes on about. I just feel sedated, relaxed happy and content, nothing crazy euphoric. Is this normal?",1508977050.0
78rxiv,https://www.reddit.com/r/opiates/comments/78rxiv/transitioning_to_kratom_then_sub/,2,https://redd.it/78rxiv,dillybr0,Transitioning to kratom then sub,"I recently quit using my doc (primarily morphine and codeine, though it also contained all other alkaloids​), I'm planning on using kratom and klonopin until at least 48 hours after my last dose, hopefully more like 60. Has anyone had issues jumping on subs from kratom? I've done it before and it didn't seem to cause precipitated withdrawal, however, it wasn't the smoothest transition ever. Curious what other people have experienced.",1508976943.0
78rwb7,https://www.reddit.com/r/opiates/comments/78rwb7/opium/,25,https://redd.it/78rwb7,RemyVonLion,Opium?,"I got some poppies in my backyard ripe with opium, but as a hippy-drug user only, I'm concerned about its long-term health effects on things like the liver and kidney, are they worse than alcohol? Is it alright for me to occasionally drizzle it on a bowl of dank to get blazed for a while or is it as bad if not worse than a regular alcohol habit? Cause I don't mind getting hammered on rare occasion. Couldn't find specifics online. Thanks.",1508976630.0
78rv91,https://www.reddit.com/r/opiates/comments/78rv91/fuck_white_dboys/,25,https://redd.it/78rv91,iShootDope_AmA,FUCK White D-Boys,Slow ass mother fuckers,1508976326.0
78ru0p,https://www.reddit.com/r/opiates/comments/78ru0p/whats_worse_benzo_addiction_or_opiates_addiction/,39,https://redd.it/78ru0p,Oxy200,"Whats worse, Benzo addiction? or Opiates addiction?","Withdrawal symptom wise, Anxiety wise, Mental battle wise, Physical wise? Whats worse. ",1508975968.0
78rtgn,https://www.reddit.com/r/opiates/comments/78rtgn/cwe_advice/,8,https://redd.it/78rtgn,theashesofthewake,CWE advice ?,"Going to attempt to do a coldwater extraction on some t3 pills later tonight, to extract the codeine and get rid of acetamenphin as they are actetamenaphin and codeine pills..the pills are labelled on bottle as ""Ratio entoltec 30"" which I assume means the codeine amount ? Anyhow my main question is I have 4 of these t3 pills left, any advice on how much water id need to perform a successful extraction? Would 2 of these pills even be enough for first time user without much opiate tolerance? ",1508975804.0
78rhoq,https://www.reddit.com/r/opiates/comments/78rhoq/pupils_dont_constrict/,11,https://redd.it/78rhoq,blo0dchild,Pupils DON'T constrict?,"I don't know WTF is wrong with my boyfriend. Every time he uses heroin his pupils don't constrict at all. I sound crazy saying this, but it's true. And I can't even find any information about this happening to other people on here or Google.


He's also one of those people who gets uppity instead of noddy while on opiates .. maybe that's the reason, but I doubt it.


Has anyone here experienced this or knows anyone who has? Just curious.


Edit: I didn't really finish my post before submitting; I wanted to end with asking if anyone (knows anyone) who's experienced this.",1508972490.0
