94om7h,https://i.redd.it/n9b9oleur6e11.jpg,13,https://redd.it/94om7h,AwwmanitsRalph,Thanks u/traceyh415 ! Looking forward to reading the book. Even my mom got one. She absolutely loves what you do and dying to meet you lol,,1533436282.0
94om28,https://www.reddit.com/r/opiates/comments/94om28/mixing_ambien_and_dope/,10,https://redd.it/94om28,nynex2,mixing ambien and dope,is it worth it? I like mixing my shots with benzos now and then and I know ambien is similiar to benzos so would this be an interesting combo to take? Obviously I would talk less of both but is it even worth doing? does the sedative effects of ambien add to the heroin high? if so what sort of dosages would you guys recommend? I have no ambien tolerance and I usually do a .2 shot of dope as my standard dose. ,1533436250.0
94ojkc,https://www.reddit.com/r/opiates/comments/94ojkc/i_pushed_the_sharp_side_of_the_blade_into_the/,24,https://redd.it/94ojkc,ASavageLost,"I pushed the sharp side of the blade into the thin, yellowed skin on the head of her abscess. A snake of black blood and green puss slithered down her arm and thudded in clumps on the floor by the drain.","## 

## 

## Danielle PART 2 

## 

## Violent and otherwise destructive behavior was a defense mechanism, necessary to maintain a life of ruthless drug addiction in the streets. It was the unsurprising side effect of a cold and calloused heart, which had no room for things like sentimentality or love. Those things make a person weak and vulnerable in a world where dogs eat dogs, and even mothers eat their children. That may sound extreme, but that is how it was to me. That is how I saw it. If I would sell myself for drugs, plunge a blade into my stomach, steal my grandmother’s jewelry or subject myself to the harsh reality of the streets day in and day out, what would stop me from doing the same to you? Nothing.

## We told everyone we were in love, but love was impossible for people like us. What we really had were attempts to fill our lives’ emotional voids with each other and chemical imbalances in our brains that manifested themselves as romantic fantasy. In a very short time we became very close. Probably because we spent every second of every day together, and every day tried us.

## Somewhere in her head, I was half baby and half bunny like her beloved Bunny O’Reilly from childhood. Her mom had inadvertently programmed her to love that name, and her father programmed her to love men that were no good to her, even though he was pretty good to her when I knew her. I fit the bill. Half bunny and half baby, she called me bubby when I was capable of compassion, but when I had heroin eyes and the hiccups she just called me Clyde.

“Hey Clyde! How come you never call me Bonnie?”

“Cuz your name ain’t Bonnie!”

“So what? A Clyde ain’t nothing without a Bonnie. Just like you ain’t nothing without me. You’re my Clyde. I want to be your Bonnie.”

“You are my Bonnie, baby! But, that ain’t your name. You know how I am. It’s like you wanting me to speak Spanish to you.”

“Yeah! I want you to call me Bonnie, and I want you to speak Spanish to me!”

“What am I supposed to do? Have conversations with myself? You can’t even understand it. That’s weird. Like calling you Bonnie.”

“So what? Call me Bonnie, Clyde! Speak Spanish to me! It’s sexy!”

“Yeah right! You’re name ain’t Bonnie, and you don’t speak Spanish! Now, drop it!”

The trajectory and momentum of my life scared people before she came around, but now it was a 20-pound cannon ball ripping through the air about to smash anyone and anything that got in its way, even her. Instead of one, now a couple of drug dealers wanted to kill me. Most junkies wanted to beat me up, and at least one cop promised to send me to prison the next time she found me. But, the real reason we left town was that the heroin was no good since Vanessa and Smokey got busted, and Danielle said she could make big bucks stripping in the City.

Eight miles north of town, heading to Colorado, a friend of ours called me up and asked if we could score for a kid who was new to town at the homeless shelter. We came over. The kid sniffled and his eyes watered when he yawned. He was sick for sure, so we said we would pick up from Joe and be right back. But we drove to the city after we scored from Joe. Our friend called to tell us that we were disgusting pieces of trash, and he was right. We departed in the grainy black and white of a 1930s movie house featuring Bela Lugosi as Dracula. We were some mad scientist’s undead creatures fleeing to the hills from an angry mob of town folk with their pitchforks and torches.

That first week in the city is mostly a blur. Somehow, we got a hold of some speed and slunk up and down the street in the Camry, suspicious as they get, at all hours of the morning, but the cops never bothered us for it. At a 24-hour donut shop, we took the two dollars and 39 cents out of the tip jar. It must have been early in the month when her SSI check came in, because we were in and out of adult novelty shops across the city buying all kinds of stuff and even had a hotel room. We made connections with new dealers, and let some homeless guy videotape us having sex in a hotel room one night. I stole a pair of stilettos for her, but there was something we had to take care of before she could start stripping.

Not long before we left town I missed an injection and deposited the warm, dirt water of a rinse into the muscle of her forearm. She was thin. Her veins rolled a lot, and she moved around when I dug in her arm trying to register blood. The miss turned into an abscess the size of a golf ball, so we took matters into our own hands in a hotel room.

We stole a pack of shaving razors, a bottle of hydrogen peroxide, some gauze and tape. I broke the thin blade out of one of the shavers and snapped it in half. In the poorly lit bathroom she stood in the tub, while I knelt on the floor outside of it. Danielle shook, and her lips curled in distress. With her right wrist in my left hand I looked at her and said with a smile,

“Now baby, I know that I look like one, but I feel like I should tell you that I’m not actually a doctor.”

“Shut up! It’s not funny! Now hurry up!”

I pushed the sharp side of the blade into the thin, yellowed skin on the head of her abscess. A snake of black blood and green puss slithered down her arm and thudded in clumps on the floor by the drain. She recoiled, but I held her wrist and pulled her back.

“Now, we have to squeeze it.” I pinched her flesh on either side of the bleeding wound and squeezed it. More blood and puss oozed out. Her body shuddered, and she groaned curse words. We were high on heroin, but it didn’t make much difference for her. It was painful. I poked a hole into the top of the bottle of peroxide and sprayed a jet of the fluid into her wound. It fizzed and foamed on the blood.

“Okay. That should be good.” We wrapped it in gauze and taped it up and went to sleep.

The next night we went up to The Bus Stop to get her job at the strip club back. After 15 minutes of waiting in the car, she walked out fuming and cursing back at one of the bouncers, and he screamed from across the parking lot that she was a junkie whore. They did not want her back with a bandage on her arm like that. So we headed back home.

I wasn’t afraid of the death threats there, because if there was anything I knew about back home, it was that no one’s word was worth much. The people who wanted to kill me would have to find me first, and even if they did, they would have to deal with me when they did. I’m not saying that they weren’t dangerous people. They were, but what I am saying is that when it came down to it, so was I.

30 minutes out of the city a blizzard blinded us, and snow covered the interstate. The radio played. The heater warmed the car. She sat naked in the passenger seat, and my hand rested between her legs when the car spun off the road. The car did a few 360s on the highway, before we slid down the embankment of the median. In two minutes a cop came to help us, so she put on a jacket and rolled down the window. He told us to get off the road once he helped us get back onto it. We stopped at the rest stop a few miles up the highway and spent the night.

When we woke up, it was light and the roads were safe. I found the ten-dollar bag of heroin we lost under the seat the night before and split it with her. It was the last of what we bought for a guy that sent us 100 dollars from home a few days before. He thought we would bring him some back some heroin from the city, but now it was all gone.

“What do you think, baby? It’s a four-hour ride back home, and the dope’s no good there.”

“I know, bubby. I know. Let’s go back to the city.”",1533435599.0
94ogn6,https://www.reddit.com/r/opiates/comments/94ogn6/jj_came_through/,10,https://redd.it/94ogn6,adaoud25,JJ came through!!,"Earlier i wrote a post saying ""i can really use JJ right about now"" and lo and behold, he blessed me! Im nit gonna get into details, for i beleive JJ doesn't like that. But i am happy. Beleive, and something will happen!

For the ones who are down on their luck, feinding over pill porn, and feel miserable....i pray JJ blesses you! ",1533434875.0
94ofzv,https://i.redd.it/lpm09zk3n6e11.jpg,16,https://redd.it/94ofzv,philsd,Is this an abscess,,1533434702.0
94oejp,https://www.reddit.com/r/opiates/comments/94oejp/ayyee_fam_hows_everyone_feelin_rn_what_are_you_on/,17,https://redd.it/94oejp,k56pink,Ayyee Fam! How’s everyone feelin’ rn? What are you on?,"I banged a couple of my pinks and then ate a handful of perc 5s, so I’m feelin’ lit. Nods incoming! How’s everyone else’s weekend going? Any good scores out there? Did JJ show up for anyone? Need some opis to talk to on account of being stuck at home alone. I hate noddin’ alone.",1533434325.0
94o4a7,https://i.redd.it/qsyh5mcxd6e11.jpg,5,https://redd.it/94o4a7,King_opi23,Coupl'a Twos! DILLY DILLY,,1533431606.0
94o446,https://www.reddit.com/r/opiates/comments/94o446/is_all_methadone_the_same/,9,https://redd.it/94o446,masterscoonar,Is all methadone the same?,"Like is it all formulated the same. Im in ontario and get the orange see through liquid. Is everyones liquid the same dose and some peolle just get more liquid ML lr is it different like everyone gets the same ML but just the MG varys
",1533431564.0
94o1ur,https://www.reddit.com/r/opiates/comments/94o1ur/opana_15mg_er_e_series/,13,https://redd.it/94o1ur,OG-Instinct,OPANA 15mg ER E series,Buddy gave me one tonight. What’s it like? Never tried. Usually a perk 10 Type Guy. Worth it? is it a better feeling? ,1533430975.0
94o04w,https://www.reddit.com/r/opiates/comments/94o04w/anyone_find_the_reason_opiates_exist_symbolically/,2,https://redd.it/94o04w,N-methylamph,Anyone find the reason opiates exist symbolically beautiful,"So most of you probably know opiates all derive from opium poppies but if any of you don't know why it's because it was created as a defense against predators. Plants like poppies don't have any nutritional value to anything but bugs. 


The amount of opiates on one poppy isn't enough to kill something like a human but more then enough to kill bugs, a defense that kept them safe for a while. That's why when you slit them that milky substance mostly comprised of morphine will slowly ooze out of the hole.


Of course animals found them then eventually humans who took them to another level after they discovered a non lethal dose is fucking awesome but I love the fact the whole reason it exists is a defense against predators.",1533430508.0
94nzy7,https://www.reddit.com/r/opiates/comments/94nzy7/ropiates_irc_hangout_chat_time_comeplay/,106,https://redd.it/94nzy7,chasingd0pamine,r/opiates IRC HANGOUT CHAT TIME - comeplay!!,"hi guys. its about that time - r/opiates IRC chat hangout!!

*disclaimer: this IRC chat room is not an ""official"" r/opiates chat - however there is an r/o mod gonna be in there the entire time (me) and its all good*

comment or PM for chat link!!",1533430458.0
94nz9u,https://www.reddit.com/r/opiates/comments/94nz9u/i_relapsed_on_heroin/,14,https://redd.it/94nz9u,dori_88,I Relapsed ... ... ... on Heroin,"IDK WTF got into me but when I relapsed this past weekend I skipped over pills and went straight for the heroin. If you know me from around here, you know I always stayed the fuck away from Heroin as a personal choice. Yet, when it came down to it i was so done I went and picked up some H that I was able to snort. I feel dumb as fuck now. I'm 5 days off the drugs again. Came clean about it to all my doctors and just about everyone in my life. I am currently hospitalized while they address the pain issues. I was on a ketamine drip for 3 days and now they've started me up on suboxone even though I had a seizure on it once before. Right now that I'm on it, I'm super drowsy. That's the only negative side effect thus far so who knows. Maybe it is a viable option for me.",1533430276.0
94nt7z,https://i.redd.it/kynqs1e856e11.jpg,16,https://redd.it/94nt7z,EphemeralDarknes,Anyone else ? I also enjoy Marlboro 27's and American spirit blacks,,1533428679.0
94nrrp,https://www.reddit.com/r/opiates/comments/94nrrp/ketamine_while_in_active_opiate_roxies/,2,https://redd.it/94nrrp,7venyearsdown,Ketamine while in active opiate (roxies- 180-240mgs/day) addiction,"Wondering if anyone has any experience with K while in active opiate addiction. I've been planning to jump for the past few weeks and haven't even been able to taper. The least amount of blues I've done in a day for the past month was probably like 60mgs, but the last like 5 days it's been between 180-270mgs/day (fucking expensive, I know). Anyway, copped some ketamine today and would like to spend my Sunday (tomorrow) on K and delay my oxy dose as long as possible. 

Anyone on here dose K while addicted to oxy? I don't plan on doing them together, but I'm sure that as soon as I come down from the K, I will need to dose oxy asap. Is there a recommended amount of time I should wait after dosing K before I rail a blue? Has anyone done them simultaneously? Thank you in advance for any info you can provide!",1533428309.0
94nq7a,https://i.redd.it/in1qw8zz26e11.jpg,16,https://redd.it/94nq7a,Omarffomthewire,"""Hey it's Saturday night, you wanna go out?"" They ask. My response-""Na...I'm good""",,1533427932.0
94njpa,https://i.redd.it/tev8hgnyx5e11.png,5,https://redd.it/94njpa,PercocetPete,Posted on the 'trashy' subreddit.....,,1533426329.0
94nido,https://i.redd.it/op0853e8x5e11.jpg,9,https://redd.it/94nido,jlogic420,13 more pinkvcotton(nose) - candies,,1533425988.0
94ndcq,https://www.reddit.com/r/opiates/comments/94ndcq/we_defiled_his_toothbrush_before_we_left_but_i/,16,https://redd.it/94ndcq,ASavageLost,"We defiled his toothbrush before we left, but I can’t remember why."," This is true life stuff.

## 

## 

## Danielle PART 1 

## 

## 

## The scars on my neck belong to her. Two cigarette burns, perfectly round and white, sit two inches below my ears where Frankenstein’s creature had his bolts. I see them every time I shave, and they remind me of hard days with my girl. Her name was Danielle, but I just called her baby.

## In the middle of our arguments we screamed in one another’s faces. Sometimes, I cleared my throat and hawked phlegm into her eyes, and she spat back into mine. We tried to blow each other away with the spray of verbal buckshot until there was nothing left of us. Ten minutes later we made love on the bed or the back seat of the Camry and found something or someone to rob. It was a game we played, and it was killing both of us.

The first time I met her, her boyfriend lay on the floor of my apartment trembling and bleeding through his pants. My drug dealers pulled him out of her Camry on the south side of town and stabbed him in the knee for trying to go around me and deal with them directly. It didn’t work out for him, thus the crying and bleeding on my floor.

“Hi.”

“Hi.”

“Are you Riley?”

“Yes. You must be Danielle.”

“Sure am.” She dropped his head to put her hand out.

“Good to finally meet you.” I smiled and pinched her fingers.

I was seeing a different girl at the time, a 19-year-old red head who liked to smoke her dope and tell me she was on her way over hours before she left her house, but that morning in my apartment, the look in Danielle’s eye told me it was only a matter of time before we got together. Never mind Mike and the red head.

Danielle and Mike used to come over every day before three to laugh at me for nodding out and looking like Teen Wolf. She always tried to get alone with me, but we didn’t hook up until after Mike started beating her again and I spent two weeks locked up, promising myself and everyone else that I would never do heroin again.

Mike took the battery out of her car and held her against her will in a trailer on the Mesa while I sat in jail. Then he passed out one afternoon after he put the battery back in, and she made her escape. Half an hour later, I called her from the payphone outside of the jail, and our reign of terror began.

I should tell you that this is the part of the story where you might want to stop reading. On the next page or so, I’m going to sell a guy a bag of dirt for 40 dollars and turn his face into hamburger meat before I hold him hostage in his bedroom for the night. My girlfriend will beg me to infect her with the Hepatitis C virus, and I will try. A few pages after that, I will rob a dead man, so if you’re not with all that or don’t understand that we were in a bad way, this is a good time to stop reading.

One of the only three heroin dealers in town fronted us packages of dope, and we came back with the money every night. He fronted us more, and we returned with more cash. Then he gave us a half-ounce, but we never came back. He offered anyone in town a 50-dollar bag for our whereabouts and left promises to murder me on her voicemail. We ripped off other junkies. They hated us. We stole merchandise and food from businesses. The owners and employees hated us. Several cops in town knew that I was driving the Camry and that I had a girlfriend. They hated us too, but we hated each other most of all.

Danielle had a monthly prescription for 90 Colonopin and a SSI check. Both were available on the first of the month, and we shot so much dope and took so many pills the first week of the month that our only friend quit hanging out with us. When her orange pill bottle quit rattling and the check was spent, anxiety wrought havoc. More than once she left me at the gas station and freezing at three in the morning while I was buying cigarettes and drove by a few times, screaming and giving me the finger for no reason. Later in the night we would go to the ER looking for meds.

Her Camry became our home. We cleaned out the ashtray at the casino several times a day and listened to Depeche Mode and Seminole Wind by John Anderson. Our diet consisted entirely of Wendy’s spicy chicken nuggets and Baja Blast. She made me give her a shot of dope visibly mixed with my own blood to intentionally contract Hepatitis C. That way I could no longer use contamination as an excuse for why I wouldn’t share a hit or a rinse with her. One afternoon I pulled over on the side of the highway and proposed to her with her own wooden ring. She said yes and we made out like two outlaws in love.

A lot of guys liked her. One of them lived in a nice apartment his parents paid for. His name was Justin. Now I forget what he said, but it made me mad. Then he gave us 40 bucks to go score, so she and I split it between us and put dirt in his bag. He called to complain, but we quit answering the phone. Later that night, I decided we should sleep at his place, so I parked in his parking lot and told her,

“Get all of our blankets and meet me at the front door, baby.”

As I walked through the cobblestone courtyard of the adobe apartment complex, I wondered how mad he was and thought of what I was about to do. I fingered the baggie in my pocket. At his front door breath billowed out of my mouth, and the raps of my knuckles on his door bit cold into my bones. I put my hand back into my pocket and waited. The television played on the other side of the door. He opened it, but the chain only allowed a few inches.

“Who is that? Riley? What do you want? I ought to mess you up for selling me dirt! Get out of here!” The interior light of his apartment poured out yellow through the crack in the door. It looked warm and comfortable.

“I know. I know. Listen. I got something here, to make up for it.” I moved my arm and hand in my pocket, to indicate it was in my pocket. “Open up, so I can show you.”

“Ok.” The door closed momentarily while the chain latch came off. The knob turned. I grabbed it and lodged myself in the doorframe so he couldn’t close it. “What are you doing? You can’t stay here! Why does she have blankets? Dude, what the f\*\*\*? Seriously?” A pile of blankets with Danielle’s legs bounced through the courtyard towards us. I made sure she got in before I let him shut the door.

She threw the blankets on the shag rug in front of his TV. He whined in the kitchen and flapped his arms, but we disregarded him until we had settled in and felt ready to address him. His accusations were mostly accurate, except when he said we didn’t have any heroin. We did, but not for him.

After she and I situated things, I showed him the 20-dollar bag we had. It was enough to shut him up, because we promised to share. We told him we would split it three ways, but in the bathroom, she and I split it down the middle. Afterwards, we rinsed the spoon and cotton filter a few more times, until all that was left was dirt and ash in the spoon. Then we sucked it up and came out of the bathroom to give it to him. He happily took the syringe full of dirty water and never accused us of anything until we hid ourselves in the bathroom again.

Danielle had her pants down, and I sat on the toilet applying cortisone cream to a patch of eczema on her rear end and thigh. She leaned over the sink. The door was locked while I took care of my baby.

“Open up. I know you’re in there doing more! Open up! You pieces of s\*\*\*!” The door shook as he pounded. “Open up! Open the f\*\*\*ing door!” The door hit her in the head when he kicked it in.

My hands ripped the cedar towel rack out of the wall, before I could think. I beat him back out of the bathroom and side-to-side, across the living room with the wooden rod. A symphony of rage blared out of me and into my opponent. I was the impassioned composer of a brutal work, wildly conducting an orchestra of fingers, fists and arms. He tripped and fell backwards over his coffee table and couch.

My shirt was off and sweat was dripping when I threw the rod at his face. He could have it, because I owned him now. I leapt onto his chest for the crescendo of my opus and went to work. I pinned his arms under my legs. Bare knuckles bloodied themselves on his cheeks, and his face turned side to side with each punch. Snot and blood leaked from his mouth and nose, and he squealed as I stopped to catch my breath.

“Please, stop! Please! Please!” My teeth bit into my bottom lip. I looked at him for a second with my fist cocked back, before I tried to drive it through the back of his skull. His face was swollen and discolored and bloody.

“That’s what you get for messing with my girl.” I thought and jumped up to grab the biggest butcher knife in the kitchen. About 10 inches of blade shined in the living room light.

“I will f***ing kill you! You piece of s***! I will f***ing gut you! You f***ing hear me?” The F word constituted about one of every ten of my words back then! “Get in your room and give me your cell phone! You can come out in the morning, when she and I are done. You hear me, you f***ing piece of s***? Come out of the room, and I will stick this f***ing knife in your throat! Your guts will be all over this f***ing floor! You f\*\*\*ing hear me?”

He didn’t say anything. He gave me his phone and held his face as he walked into his room. People around town always told me that he was a fighter. Supposedly he stood up to Diablo once and even “gave him a run for his money.” Everyone always said he was tough, but not that night.

Danielle and I made a bed on the floor out of our blankets. She pulled up some pornography on his phone. Whatever meth we did the day before was too strong and the heroin was too weak to get us to sleep, so we had sex on and off throughout the night. Sometimes, I smoked cigarettes and tried to write poetry on pieces of cardboard box. She played dress up with some clothes that she had brought in. Later in the night she said something that hurt my feelings, so I used the scissors in my hand to stab myself in the leg a few times, but as daylight broke there was forgiveness and more sex. We defiled his toothbrush before we left, but I can’t remember why.",1533424728.0
94nars,https://www.reddit.com/r/opiates/comments/94nars/did_20ml_of_morphine_about_an_hour_ago_and_i_feel/,10,https://redd.it/94nars,Extract_Osu,Did 20ml of morphine about an hour ago and I feel nothing?,"Is this normal? How long should I wait before I do more?

*Update*: I ended up doing 80mg, felt nothing but threw up just now, fun times.",1533424085.0
94nbgb,https://i.redd.it/bneo2ed2s5e11.jpg,26,https://redd.it/94nbgb,zahahn,Made it 24 hours in order to take my sub. changed my mind... i'll try again tomorrow.,,1533424252.0
