8sby58,https://www.reddit.com/r/opiates/comments/8sby58/arrested_after_od_with_only_a_syringe_in_wi_after/,20,https://redd.it/8sby58,sweetb3rrywin3,Arrested after OD with only a syringe in WI after parents called paramedics/ don't count on the good samaritan law in WI,I feel like if they only have the syringe wouldn't they not be able to repeat the test if I wanted a confirmation considering it's already been in contact with reagent fluid which is notorious for false positives. It's such bs they are trying to give me 3 years of drug testing and counseling and if I fuck up i'm auto convicted. Has anyone else ever been in this situation with a deferred prosecution agreement? They say they want people to call the paramedics to save lives but the aided person is still criminally liable for what happens and now I have 3 years hanging over my head. ,1529438363.0
8sbv17,https://www.reddit.com/r/opiates/comments/8sbv17/a_day_in_the_life/,14,https://redd.it/8sbv17,youmeand5bucks,A day in the life...,"It's not even 3pm and I've looked for a stolen car, watched my friend panhandle, another friend tricked herself out for get well money, and I've just been sitting back smoking weed and watching it all. Dope days.",1529437692.0
8sbs27,https://i.redd.it/qu7oa9p5g0511.jpg,3,https://redd.it/8sbs27,lubabe99,"Doctor day fam, have a good one.",,1529437082.0
8sbpwz,https://www.reddit.com/r/opiates/comments/8sbpwz/off_to_rehab_tonight_say_a_prayer_send_a_positive/,8,https://redd.it/8sbpwz,Chardeemacdennis45,Off to rehab tonight say a prayer/ send a positive vibe my way,"I haven't really posted here much lately but I def have still been living that opiate life.

The last 4 days have been the fuck up tour I've had to own up to everything and try to get myself into rehab. (Which hasn't been as easy as I hoped).

I consider myself lucky, I always thought you admit you need rehab and you go but it's been tough finding one that would take me so I'm actually relieved to finally be going tonight.

I have a lot of work to do when I get out and an uphill battle in front of me but I have a great support system I honestly feel so blessed.

If anyone's out there thinking they may need help, ask for it. Don't be an asshole like me and total your car and lose your job in the same week, then still be in denial until your family backs you into a corner to admit you have a problem. 

I'm sure I'll post again when I get out but please send me your good vibes... I haven't started yet but I am in withdrawals and haven't slept in 2 days so I'm hoping they have some comfort meds or something, regardless failure is not an option for me I have to start rebuilding my life.",1529436637.0
8sbpa7,https://www.reddit.com/r/opiates/comments/8sbpa7/in_an_unexpected_drastic_turn_of_events_today_ive/,48,https://redd.it/8sbpa7,frezhberry,In an unexpected drastic turn of events today I've started being stalked by an 'undercover.',"I'm apparently pushing drugs in a stolen vehicle. He kept yelling that I was trying to stash stuff but didn't search the car nor me which got me confused like shouldn't there have been more to this strange ass stop? 

I had nothing to hide and complied with him completely despite his unwarranted aggressive attitude and outlandish and all he gots to say to me is that he will be watching me closely that any wrong move that looks suspicious he's nailing me. I've seen him multiple times since this encounter. 

I didn't know undercovers were supposed to make theirselves so noticed during an 'on going' investigation... 

I'm tripping out here tbh. 

The irony of this post coming the day after my post yesterday about records",1529436500.0
8sbp4l,https://i.redd.it/o0r7a7hbe0511.jpg,23,https://redd.it/8sbp4l,RelicRun,Anyone have XP with Paregoric Tincture? 120 mL bottle.. internet hasn’t been much help.. Vile tasting..,,1529436461.0
8sbjhm,https://www.reddit.com/r/opiates/comments/8sbjhm/epiphany/,3,https://redd.it/8sbjhm,kev647,Epiphany,"I was just messaging a fellow subreddit poster here and as I was sharing my input on their recent decision to get clean when I just realized something huge.  We all know that part of the biggest problem with opiate addiction is that the bad effects of withdrawals don't really appear until a while after your dose - 8-12 hours or so.  BUT, when you administer your favorite opiate while you are sick in the middle of withdrawal, you are immediately healed and your body builds a bond that see's the thing that got you sick initially as the cure, the antidote.  It doesn't have the ability to actually, at a subconscious level, associate the drugs with the sickness.  Great.  But did you ever wonder why when you are relapsing on your opiates, that the effects are not as desirable or as fun?  How many times have you relapsed when you were out of the woods with opiates only to go, ""that wasn't that great..."" and then you are back into your old habits. 

Well I think I figured out why.  When you are sick, the feeling of going from completely miserable to healed and then to high is a huge jump for us.  However, if we are already clean, that jump isn't as noticeable and doesn't seem that big.  That relief while being sick feels huge. 

Has anyone else noticed this?  ",1529435291.0
8sbgrg,https://i.redd.it/a80m1mh890511.jpg,13,https://redd.it/8sbgrg,thelarustatrust,Im sooo high soo soooo high,,1529434760.0
8sbfyx,https://www.reddit.com/r/opiates/comments/8sbfyx/long_term_sub_user_not_feeling_relief_from_18mgs/,6,https://redd.it/8sbfyx,MissyInAction,"Long term sub user not feeling relief from 18+mgs after 6 week relapse (sub doc question, for kicks)","I’ve had about a 4 point habit for the past 6 weeks or so. I can’t afford to keep it up much longer and I have *weeks* of suboxone squirreled away from rapid tapering myself from 18-6mgs shortly after getting put on them over a year ago and keeping the full dose script (I know, not the brightest thing to do, in some ways. The moral ways. Which are pretty much out the window.). Though, perhaps in textbook fashion, once I got Lower the cravings came back and I’m not a very strong person so I relapsed.

My last shot of dope was Sunday at 10PM. It’s now 11:45 AM 36+ hours later. I dosed 8mgs at 7AM after having luck at as little as 18 hours when I tried to get off last time. I went back to bed until 10:30 when I couldn’t sit still, my most hated feeling. I absolutely hate the restless feeling, I don’t get it just in my legs. It feels like my soul needs to simultaneously beat someone up and screw them to death. I dosed another 4mgs at 10:30. 

I put another 8 in my mouth before sending the text and spit it out as soon as more was ordered for me. 

So. Options, if anyone can help. 

1. I have a very good thing going with my sub doctor. I started seeing her 3 years ago and I’ve relapsed exactly twice under her care. I have a feeling if I call her office and plead my case (that I really want to stop, but these withdrawals are making me want to blow my brains out) she may either squeeze me in and give me some stuff to get through the worst of it. but, it probably wouldn’t be any time soon. She books weeks ahead. 

2. Use the points I have coming my way sometime this afternoon and try again tomorrow. 

3. Stick it through and just be fucking sick, because we all need to be. I’m all for a little set punishment, but my kid needs me to be useful. I need to be useful for her. Will the subs eventually work? Is there light at the end of this cold fucking tunnel?

Edit: I went with the first option and I have an appointment with her Friday. Still no idea what to do until then. ",1529434600.0
8sb2je,https://www.reddit.com/r/opiates/comments/8sb2je/i_keep_feeling_drip_5_minutes_after_snorting/,19,https://redd.it/8sb2je,isoulopiates,i keep feeling drip 5 minutes after snorting heroin,"before i would never feel the drip. but a dealer told me and my friend snort small slftly then lay down. i spent $120 on heroin and shared sith everyonr and everyone got me but me. im pretty upset. i snort 20mg with no tlerance and  lay on back and he drip is going down my thorat.

everytime i swallow i feel the heroin and its onky been 5 minutes. should i not swallow so so it stays in throat. or jhst snort softly and not lay down. i really want a nod. could anyone be the nicest person in the world and share the secret recipe tip to get a person freshly new to reddit. i never used reddit in my life. and i subscdibed to like 20 commuminuties right away. so im not gonna be asking opiate questions a lot. just this one time share the opiate hidden knowledge recipe for the god nod for me :) :)",1529431840.0
8sb70t,https://www.reddit.com/r/opiates/comments/8sb70t/tremors_from_withdrawals/,3,https://redd.it/8sb70t,drugznotpugz,Tremors from withdrawals?,"I haven't posted or commented on here in a long time. So let me say, Hello my friends. I hope you are all good and well. Sorry for the wall of text in advance. There's a tl;dr at the bottom.

I've recently decided to get my life together and quit my addictions. So about two months ago I quit taking benzos and have been on maintenance for my opiates. The road hasn't been easy but I feel like I've come a long way. As of right now, I really have no withdrawal symptoms but over the time I've been off everything, I've developed a noticable tremor. Mainly in my hands and its gotten to a point that it's starting to affect certain aspects of my life. Even just typing this out on my phone is a little difficult. Thank god for auto-correct, right? Another thing is that tremors actually run in my family. (There's a specific name for it but I don't want to be identified) My grandfather had them and passed it on to my father. The thing is though, in most cases they don't become evident until your 40's, which is still a ways a way for me. But it technically can develop at any age. My question is do you think this may be some kind of withdrawal? I mean, other than the tremors though, I'm fine. Or do you think I may have an early onset of the disorder. Maybe activated somehow through my drug use? The main thing that's strange is how it progressed after I quit. I mean, since my late teen years I would get a slight tremor from drinking even the smallest amount of coffee or when I was really tired but before this I can't say I ever really noticed much. I know 99% of you have no idea about genetic disorders so I'm mainly asking about your experience with benzodiazepines and/or opiate withdrawal and their link to tremors. Any personal experience would be greatly appreciated.

Tl;dr Have you ever had tremors from benzo and/or opiate withdrawal. When did it start. When did it end. I know there's a lot of variables but anything you could tell me would help.",1529432766.0
8sb6jv,https://i.redd.it/fkuslt5130511.jpg,20,https://redd.it/8sb6jv,IDKwhatTFimDoing168,Of course I’d never be that lucky!,,1529432665.0
8sb224,https://www.washingtonpost.com/news/wonk/wp/2018/06/19/the-growing-case-against-iv-tylenol-once-seen-as-a-solution-to-the-opioid-crisis/,6,https://redd.it/8sb224,ClariceStarr,IV TYLENOL ... for in hospital use after surgery to control pain ?!?! WTF??,,1529431748.0
8sb1fu,https://i.redd.it/ip48dg5yzz411.jpg,34,https://redd.it/8sb1fu,jf209,Everyone should have at least one of these,,1529431632.0
8sb171,https://www.reddit.com/r/opiates/comments/8sb171/tolerance_help/,2,https://redd.it/8sb171,jf209,Tolerance help,"So about three weeks ago I decided to develop an opiate habit again. I was definitely getting Fent powder/China as it was pure powder and completely white. Since then my original plug got a shit ass batch of H. I’ve found a new plug and just bought two g’s off of. I loaded up about a point as a tester and felt nothing, so then I slammed down about a .3 and still felt nothing. Idk if my tolerance is just fucked from the Fent and wondering what I can do to lower it to a reasonable amount again? Should I just stay on maintenance and not look to get high for a week or so? 

I’m guessing jumping straight to the China really fucked with my tolerance. What’re my options here, besides to be slamming a .6+ to get a slight nod off. 

Also, I was strictly railing everything until about three days ago when I decided to start slamming shit (mine as well get my money’s worth). ",1529431578.0
8saz1c,https://www.reddit.com/r/opiates/comments/8saz1c/health_question/,12,https://redd.it/8saz1c,btcmillenial,Health question,"So I drank and smoked a lot last night, I didn't drink much water but ate a lil pizza. Anyways I woke up 8ish hours ago and had a mini Pepsi and went to cope, did a little dope, the best bags I've had in a long time(I'll post pics later) I'm nodding like HARD, idk how I'm writing this still but I'm def gunna be asleep soon, should I drink some Gatorade or something to keep my hydrated  or something? I don't wanna eat and throw up tho. 

Help me out here guys",1529431157.0
8savfu,https://www.reddit.com/r/opiates/comments/8savfu/my_friend_bought_fentanyl_as_heroin_and_called_me/,14,https://redd.it/8savfu,isoulopiates,my friend bought fentanyl as heroin and called me and i gave him the truth he always wanted,"my friend named bendernod called me 3 hours ago and said he bought some heroin for the first time. And of our friend circle im the guy everyone goes to if they want advice on drugs. we are all 19-23 in our friend circle. Pretty much all of my friends play video games and have there money saved and they all just fuck with weed. Im the person without the gaming console i sold it and i kind of have zero dollars saved up. 8:00 am i get woke up by bendernod. I think to myself he never calls this ealy so i answer.

bendernod ""did i wake you up""

me (sizzle)- "" yeah your good just tell me whats  cracking""

bendernod ""i was up all night in *locatiom removed* @heroin el chapo basketball nodding court of drugs** with these hoes dopefiends and dealers had a good night on coke and spent about $250 on just coke and one of the hoes shoots heroin into her arm with a needle. shortly after i asked  if i could buy some! She (kayla)-""yeah baby um here!"" she breaks out some black tar. i asked kayla if she i need to crush it up good because im gonna snort it"" kayla replied calmly yes and she procedded to light up some crack. so sizzle i snorted some and i was feeling real good but it was just a tease. asked Kayla for another bump she said do u have money im out. i gave her $85 and she used my phone and 4am and the dealer came and only kayla met her plug and by 5am i had some heroin. i put it on my scale on top of a $20 bill it weighed .1 so i figured she ripped me of and this would hardly get me high so i went home and  it was 6 am by now. i showerd and ate and laid in bed and figured 8 am was good enough to call you. can i come over""

sizzle- ""yeah pull up gang""

bendernod got here about 2 hours ago and showed me the heroin. reddit gang i believe my friend bought fentanyl!!  after getting the solid like heroin chunk out of the bag. it was pure white!

i explained thats fentanyl and its a good thing he showed up here so i could show him how to use it.

the whole white chunk did weigh 100mg after weighing on my scale to. 

I break bendernod of 6mg bump of this fentanyl and he snorts it up.5 minutes later bendernod feels very good he told me and gets all happy and thanks me explaining how lucky he is to have a kind friend like me and he offers me a bump. i do 12mg because i been doing east coast heroin the past week. and he does 4mg more and he starts nodding.

im glad bendernod had a good time he is still here and it was his idea for me to use reddit. if u want to ask us anything fire away we are gonna watch tv and try and get high. he is on my phone all the time because i trust him. 

questions from me and bendernod. if the reddit gang has a minute to help us out that would me nodsome!! <nod+ awesome> lol

we like any type of music. anyone have a youtube playlist they wanna share?

we have no job so we want to save as much heroin as possible. any tips. bendernod said the dealer told him to take a 20mg bump and lay down flat on back with head up quickly right after snorting a tiny bit for 30 minutes! dealer claims this will save money and promises it will seriously get us very very high if we snort h and lay down on back for 30.

thats pretty much it. we just wanna know if snorting small bumps and laying on back for 30 minutes will get us really high like the dealer saiid!

me and bendernod thank u for reading happy nods and stay high stay positive. throw out the hate and become great. stay safee


",1529430434.0
8saruq,https://www.reddit.com/r/opiates/comments/8saruq/can_you_take_subutex_not_suboxone_and_avoid_pwd/,4,https://redd.it/8saruq,IshitonUrdog,Can you take Subutex (not suboxone) and avoid PWD?,"So I've been trying to kick for a bit and have weened down pretty well since I was planning on going CT. Dont want to but the last time I ate suboxone I put myself into the worst PWD I've ever felt which legit made regular wd seem like nothing compared to this, so I pretty much refuse to take suboxone again. I all the sudden have access to subutex. I know tons of pple think the difference is theres no blocker in subutex which isnt true at all, its the absense of naxalone that makes them different and thats all. Isnt nax what throws you into nasty PWD? Meaning I could potentially start subutex a little earlier while still have some opiates in my system without fear of that same WD? Would be nice to start on subs without having to be full blown sick first. 

Or those that have kicked CT, how long were you physically out of commission for? Would it be better to just CT kick? If I got subs it would only be a few to rapidly taper with. Appreciate any advice. ",1529429671.0
8sargi,https://www.reddit.com/r/opiates/comments/8sargi/bust_my_neck_found_4_year_old_tramadol_have_i/,17,https://redd.it/8sargi,stowawayaccount91,"Bust my neck, found 4+ year old Tramadol. Have I come to the right place?","Hey guys, hope everyone's in high spirits. Last night I messed my neck up at the gym and it's been wrecked all day without getting any better. Feels like muscular pain and discomfort. Found 90 x 100mg tramadols from 2014. Anyone got any experience with old meds? Thanks",1529429597.0
8saogm,https://www.reddit.com/r/opiates/comments/8saogm/anyone_notice_dairy_milkice_cream_yogurt_tastes/,23,https://redd.it/8saogm,Toodeeptonod,Anyone notice dairy (milk/ice cream /yogurt) tastes better on opiates,Whenever I am high I crave dairy for some reason. Milk tastes great and calms my stomach and nausea. I rarely drink milk sober. Anyone else notice this? I assume the sugar and fat is the reason for the cravings ,1529428984.0
8sahyk,https://www.reddit.com/r/opiates/comments/8sahyk/tramadol_and_ssris/,6,https://redd.it/8sahyk,PM_ME_WHATEVERR,Tramadol and SSRIs?,"I know the two both affect your seretonin levels, are they okay to mix though? If I were to take 100mg of tramadol and my 15mg lexapro would I be alright? Would I even get high? I don’t have any other opioids on hand so this is kind of a last resort. Thanks guys",1529427706.0
8safow,https://www.reddit.com/r/opiates/comments/8safow/took_a_12mg_sub_its_not_really_doing_anything/,15,https://redd.it/8safow,ThrowItAway0814,Took a 12mg sub. It's not really doing anything. Still a waste to get high?,"Lately I've been doing about half a bun or so of ECP almost daily. Shit got rough for me and I hit a major depressive episode. I figured it was time to try to snap out so I got a 12mg sub and took it this morning. I had done my last full cap around 2PM or so yesterday and then gathered the remains of some used shit and got an alright amount around 6PM. I've been visiting some family for an event so I don't have my normal hookups. I've gone a day-a day and a half without recently and I've mostly been alright besides cravings.

I feel mostly physically fine although my back is really acting up which got me to relapse in the first place after I was rear ended by another car. And the cravings are killing me mixed with the pain.

Is it worth picking anything up even after taking the sub? I literally don't feel anything. But I don't want to waste",1529427256.0
8sa9m4,https://www.reddit.com/r/opiates/comments/8sa9m4/spoon_alternatives/,29,https://redd.it/8sa9m4,rubym00n,spoon alternatives,"i am lacking a spoon to heat my dope. 

any ideas? ",1529426003.0
8saam1,https://i.redd.it/wkbv10zsjz411.jpg,0,https://redd.it/8saam1,aksel2,Gotta go fast,,1529426203.0
8sa80n,https://i.redd.it/cnfi9wp9iz411.jpg,11,https://redd.it/8sa80n,RollsRoyceRICKY,Numb the pain with the perkys {RIP X},,1529425684.0
8sa5ng,https://www.reddit.com/r/opiates/comments/8sa5ng/world_cup/,31,https://redd.it/8sa5ng,Prey4ATL,World Cup,"What’s going on guys? I know there probably aren’t a lot of soccer fans as I haven’t been seen a World Cup post on here. But just wanted to know if anyone else likes to get blasted and watch the games? I’m Persian so of course I’m rooting for Iran, but once we inevitably get eliminated, France is my backup team as I’ve got family’s connections there! Anyways was just wondering who if any team y’all are rooting for and why?

Happy nods family! :)",1529425175.0
8s9vzi,https://www.reddit.com/r/opiates/comments/8s9vzi/how_do_you_know_whether_you_have_had_a_overdose/,4,https://redd.it/8s9vzi,Greekcap,How do you know whether you have had a overdose on morphine control release but sniffing instead of swallowing along with a gallbladder full of gallstones?,,1529423203.0
8s9ztv,https://www.reddit.com/r/opiates/comments/8s9ztv/a215_vs_all_others/,8,https://redd.it/8s9ztv,rararashishboomba,A215 vs all others,"I know lots of people argue it’s just placebo or something but I 100% disagree. A215s are by far in a different league compared to the rest of the 30 mg oxycodones. M30s are close to providing the same response but just don’t quite get there. In my opinion the A215s are the closest you can get to old school OCs in terms of the energy and mood lift anymore. I just went through a sampling of 4 different types (k-9, v4812, m30, A215) over the last 5 or so days and they all do provide notably different responses. Maybe some people are just lucky and respond the same to all of them but the majority of people I’ve talked to agree that they are NOT the same.

Anyone know why this is? It seems like fillers can’t be the only reason.  ",1529423987.0
8s9xju,https://www.reddit.com/r/opiates/comments/8s9xju/pharmacy_out_of_subutex/,8,https://redd.it/8s9xju,giveszerofuxxxxs,Pharmacy out of subutex,"I placed an order yesterday and they said it would be here today. I took 2 yesterday( instead of My normal 3 8 mg daily) and have one left today, if I don’t get my medicine today am I Gona get dope sick? If I only have one left? Or will the one hold me by?",1529423530.0
8s9vuh,https://www.reddit.com/r/opiates/comments/8s9vuh/harm_reduction_question/,4,https://redd.it/8s9vuh,opithrowaway124,Harm reduction question.,"First off I’m not an IV user I take scripted opiates but I know a lot (pharm background)  so I jump on here to help out. 

Why do people reuse needles? I think they are like $12/100 at Sams. Also do you use alcohol preps?  My area has a bad H problem so I am thinking of trying to help people out. 

Any insight would be great. ",1529423169.0
