8od051,https://www.reddit.com/r/opiates/comments/8od051/todays_dose_kicks_yesterdays_back_in/,0,https://redd.it/8od051,idgafsolid,Todays dose kicks yesterdays back in?,"I took about 50mg Hydrocodone yesterday. Then today I've take another 50mg. This high is much more potent and noddy feeling than the original dosage. 

My question is did today's dose make yesterday's come back into effect to a certain extent? 

I would prefer facts only please. No opinions. Also sorry if this has been answered here before. 

..., Solid. 🤙",1528071504.0
8od02u,https://www.reddit.com/r/opiates/comments/8od02u/went_to_a_mlb_game_today/,0,https://redd.it/8od02u,dumbnamenumber2,Went to a MLB game today,"
Went to a Giant's game today and had to hide my use from my gf bcuz she doesn't know i relapsed last week, only had about 5 weeks clean from H...
And I started to wonder if I was the only person in the 40,000 person  stadium that was using heroin throughout the game on the bathroom. I'm so used to spending half of an outing in the bathroom getting high wether it's  a concert or sports event or whatever.  
Does anyone else have stories of having to heep themselves well when out having fun with frienss or family ? 
I'm hoping to hear stories from you guys so please comment. 👍💉💊⚰",1528071490.0
8oczy5,https://i.redd.it/bc4cdqvfnv111.jpg,0,https://redd.it/8oczy5,anonpotat0,Baby stash- norcos kpins and 1 30mg adderall,,1528071457.0
8ocywd,https://i.redd.it/axt3yz4omv111.jpg,1,https://redd.it/8ocywd,Vincent_Zan_Gogh,Happy nods friends!,,1528071202.0
8ocx95,https://www.reddit.com/r/opiates/comments/8ocx95/nod_pods/,0,https://redd.it/8ocx95,idgafsolid,NOD PODS,"Shitpost. 

I'm about to pass the hell out at work. 50mg Hydrocodone late late late last night, almost early this morning basically. Then another 50mg chewed up during my 7 hour shift. Heavy nods at the moment. Gotta go get myself a Kiwi Apple Redbull. 

 ..., Solid. 🤙",1528070810.0
8ocswf,https://www.reddit.com/r/opiates/comments/8ocswf/smoking_blues/,4,https://redd.it/8ocswf,copolymers,Smoking blues,"If you smoke a real blue vs a fent/pressed blue, how different is the taste/feeling? Mostly taste tho ",1528069658.0
8ocs8i,https://www.reddit.com/r/opiates/comments/8ocs8i/help/,3,https://redd.it/8ocs8i,Monotub1,Help,I’m on one dilaudid 2mg ir i suspect is fent but I also mixed it with a bit of a pressed xan bar that is a random rc benzo I have barely any tolerance to ye other drugs and it seems like I just keep getting higher and higher. I took 3 other dilaudid 2mg plugged yesterday and I didn’t get near this high should I be concerned,1528069489.0
8ocr4q,https://www.reddit.com/r/opiates/comments/8ocr4q/follow_up_on_bth_and_fent/,2,https://redd.it/8ocr4q,frequent_flier69,Follow up on BTH and Fent,"Hey guys, just following up on my posts about turning tar into powder. I had a question regarding the potential fentanyl in the tar I picked up for it. Since I'm relatively new to H, I don't have a lot of experience with how it hits and what the legs truly feel like (although I'm pretty sure I've felt it when I do large oxy doses (for me 50mg+).

Anyway, my question is what is the difference in feeling between fent and pure dope? Does one have more legs/how would I look for a difference in the feeling to know whether or not the tar actually has a lot of fent in it? ",1528069190.0
8ocmcg,https://www.reddit.com/r/opiates/comments/8ocmcg/that_month_i_disappeared_and_the_lost_cliffposts/,2,https://redd.it/8ocmcg,sloan_fitch,That month I disappeared and the lost Cliffposts,"LINKS to early Cliffposts in second paragraph! 

Jim and Jan are friends whom I used to \(and still do\) hang out with every week, maybe a couple of times a week to bullshit around on my computer, maybe learn to code with my friend who did such for a living and smoke blunts. Eventually I was getting into snorting roxies and dope with Clifford and some days I'd leave before too late to meet Cliff or would hang with Cliff instead of hanging out with Jim and Jan. No big deal, this couple who are my friends aren't dicks, they don't give me hell for not being around and if they do they do so for kicks. Surely a bit out of some genuine concern. Jim doesn't like many people so it's high praise if he's wondering to his wife ""where the heck has Sloan been?""

&nbsp;

Well, eventually I was doing dope and pills more frequently. Some of my [early Cliff posts ](https://www.reddit.com/r/opiates/comments/67l68l/another_post_about_the_waiting_game/?ref=share&ref_source=link)were generated by the situations I got myself into back then. Things like ""Cliff owes me three bags, I'm sick and still waiting."" Such posts often consisted of a blow\-by\-blow breakdown and under a different user name than this one although both separated from my real life associated net aliases. Anyway, it was bullshit. In a question to Cliff I'd ask,[ ""did you see Zaino yet?""](https://www.reddit.com/r/opiates/comments/67l68l/another_post_about_the_waiting_game/?ref=share&ref_source=link) It's fun to reflect now that I've made strides in preventing and outright avoiding such scenarios.

&nbsp;

So I'd ask and get such great hits as:

&nbsp;

\- ""It's going down now."" \-Cliff

Over the course of four hours it would become evident nothing was going down. I had my ear tuned to the sound of the middleman's ice cream truck so when I heard it I'd check out the window, notify Cliff and wait for good news. All that only to find out the ice cream man only offered crack and had no dope. In retrospect, maybe the ice cream man really owed Cliff dope and delivered it. If it was a small amount, there's no doubt Cliff would opt to stick it up his nose and not share. These days I am on direct communication terms with Derrick the creamer man and although I would never let myself get into the aforementioned situation again, if I did I would get answers from a less untrustworthy source.

&nbsp;

\- ""Zano just got out of the shower."" \-Cliff

I guess he gave this detail to indicate that the dboy wasn't enroute yet, but would be getting ready to deliver shortly. Of course for a stalling bullshitter, any number of excuses can be made to explain further delays. ""He gotta pick up from the guy, then make a stop, then come here."" Something like that.. it varied. See lost Cliff posts for details.

&nbsp;

\- Other assorted scenarios where Cliff owed me 2\-5 bags of dope repeated throughout the month that I was missing from Jim and Jan's life. A bag being equal to 1/10 of a bundle, 3 bags isn't really significant but nonetheless it is an amount that I was owed and promised by a set time. 

&nbsp;

\-On an early occasion, like after the first Cliff post I was asked to loan him three bags of dope and in exchange for five bags the following day. Interest \-\- that interests me! So sure, I did it only to wait and encounter delays. Often waiting until script day for Cliff to pay me back. I think that was the weekend I spent re\-watching all of Gundam SEED. 

&nbsp;

In the last two bullet points, those insignificant amounts of dope couldn't do much. Maybe could help with a little rationing and maybe could help as part of a taper plan to reduce the intensity of withdrawal. However, doing without such small amounts two days into the withdrawal at least allowed me to be further along in the process. Consuming a couple of bags of dope two days into a three day weekend before a work day would likely reset the withdrawal cycle.

&nbsp;

Eventually rationality won out, I knew there was no way to have enough dope to never be in withdrawal, so if I was to continue using, it only made sense to prioritize getting Suboxone. Cliff appeared to be cooperative but things always went wrong. It was a jynx when he said ""we should never have to go through withdrawal again."" This was said when referring to our existing and new connect for the stuff but both had their deficiencies. One of them drove and sometimes didn't have them upon arrival. The second guy was hit or miss and almost every time I got subs from that guy I was splitting them with Cliff so they only lasted half as long.

&nbsp;

Fast forward a bunch of months, the end of 2017 draws near and Cliff had me buttered up to get $200 in subs at a grand discount. It seemed good and true although I had no evidence. No evidence of his ""friend who gets a script but doesn't use them anymore."" When I finally dropped the $200, just about the last of that pay check I am informed that his ""friend"" has a ""brother who still uses dope."" As a result, Cliff had to buy dope to give to the guy with the subs in exchange for subs. The guy with the subs would then give the dope to his brother. Of course as I waited for the subs to get delivered Cliff stated he fucked up and explained that the guy's brother came by in the morning, picked up the dope and the guy with the Subs stopped answering his phone right after that.

&nbsp;

The night before when I handed over the money I thought I was doing my due diligence asking a series of questions in hopes of ensuring nothing would go wrong. Cliff said that I was stressing him out, ""you're doing that thing you do where you ask the same questions over and over."" I wonder why I would form that habit.... In any case it's obvious I was right to be so inqusitive but stupid and wrong to follow through with my end of the bargain.

&nbsp;

After that I started covering my ass more hardcore. Right before thanksgiving Cliff was talking about getting a brick of dope and I knew he was just trying to butter me up to get on board with committing funds. I said outright, ""I'm not looking to spend my paycheck to get a brick of dope."" To which he said, ""I'm not saying that you are."" Then he went on to say how he was going to get it with or without me and how important it is to not be sick through the Thanksgiving holiday. ""If you don't get dope, I know I'll just end up giving you dope as you need it."" Saying this to build a case for my voluntary investment, because if I didn't have my own Suboxone connect and plans in place he would've been my only option when the sickness started setting in.

&nbsp;

Come Thanksgiving and Black Friday Cliff did not buy bricks of dope. He was couped up in his bed relegated to urinating in Gatorade bottle to avoid walking to the bathroom and incurring his mother's wrath. Why was he broke and without dope if he was indicating just a week earlier that he would have money for dope? Obviously \(I think\), if I went along with the plan he presented the week prior I would've been screwed out of a bunch of money and only gotten half the dope I paid for. From there, I would've likely been sick for Thanksgiving and Black Friday. For work days in which I would be standing for over 12 hours, it's a very cruel setup. Maybe that wasn't Cliff's intention but it certainty wasn't a priority for him to prevent me from going through that experience if I was stupid enough to help him.

&nbsp;

To be continued. For now let us rejoice in the knowledge that we all have the power to ensure we are not dope sick. Let's also rejoice that too many other people don't have a ""Cliff"" in their life. For those who do, just remember that you are the captain of your own destiny. With the yank of the ships telegraph you can tell your engine room to steam forward as you steer a course of your choosing and none other.

&nbsp;

Oh, and yes, I do appreciate my friend Jim and Jan. I just hated traveling to their house dope\-sick although I did at one point learn that on day three or for of dope\-sickness that bicycling and smoking blunts helped tremendously.",1528067997.0
8oclvt,https://i.redd.it/i5fehuvucv111.jpg,5,https://redd.it/8oclvt,pyrrhicsoul,"just a little Sunday Funday package! I hope all is well with everyone, it’s a nod night for me",,1528067890.0
8oclb9,https://imgur.com/8xBc5Zo,2,https://redd.it/8oclb9,cleveland4813,Sunday harijuana anyone?,,1528067768.0
8ocl97,https://www.reddit.com/r/opiates/comments/8ocl97/how_i_became_an_iv_junky_part_1/,10,https://redd.it/8ocl97,lovepussydrugs,How I became an IV junky part 1,"**(Reposting these since i deleted all my posts before. Just in case anyone wants to read)**

**for every 30 upvotes ill post another part tonight** hahaha

---

When i was young i was fascinated with sticking my finger in light sockets. My mom used to tell me ""baby go zoot zoot"" in her creative attempt to deter me. Still, i would keep on shocking myself. Doing things i wasn't supposed to felt good if only because it was forbidden. When they told me to never try drugs, same thing. I think i will tell my kids drugs are not the problem. It is doing them daily which is the problem.

By high school i already knew i would become a drug addict. This was before i had ever even seen a maryjewana cigarette. My perceptive friend would always say, ""dude you sound so stoned"". ""You listen to Pink Floyd and The Doors, you gotta be a pothead!"" Well i was sober, but not by choice. I was so antisocial that i never had access. One day i found out the local skate crowd might know where to acquire some of the herbal remedies making up all my daydreams as of late, dozing off to Dark Side of the Moon. I imagined the feeling to be like the orgasmic tonal qualities of the female vocalist in Great Gig in the Sky. 

I wish i could tell you with certainty that it all began that day. Of course i dont believe that. I lean more towards the destiny theory, or wanted to. It was completely inevitable i end up with an insulin syringe full of oxymorphone sticking out the crook of my arm, held in the sturdy hands of my 50 year old pseduo-doctor junky friend who stayed part time in this drug den. on paper it was registered to the sweet old lady taking us in. I'm not exactly sure what made me make the jump to IV use. Okay, maybe it was peer pressure. Maybe it was... you guessed it: destiny. 

How i was led to this situation is a typical story. I was bored and lonely and just generally jaded with life. Depression since high school had caused everything to take on quite a grey, cold quality (kinda like the atmosphere of a fent buzz). All the weed i smoked helped while it lasted. All this smoking led me to meet many strange characters. One day a weed dealer of mine has this 50 year old guy with him in the car. He says ""hey man if u can get any needles i can hook you up. We have hydros."" Now i had used opiates here and there, but i had never been friends with an IV user. This immediately sparked my interest. In the back of my mind i thought ""this is my chance"".

A few more weeks go by of me simply buying hydros and then eventually opana. I would walk the few miles across town to get to my special little drug den. So many different characters lived there: Roxanne, the sweet but sometimes sour (when on benzos she was a bitch) girl who used to tell me im beautiful. I wish i could say the same for her but seeing a woman crying, hanging upside down from a dryer, trying to register in her last good vein in her foot and failing is not flattering. She was literally a bloody mess. Then you have Red, the hyper junky with obvious disease eating away at his liver. He only shot with gigantic needles. I forget what theyre called. Then Bob, son of our town's huge dealer. Last but not least, Dan and Dillon who would become my using buddies for the next sixth months. 

Dan was a wise 50 year old normal ass dude who got divorced for good after years of slowly falling deeper into addiction. I could tell his wife and kids not wanting him in there lives was the main drive behind his search of a chemical hiding place. He taught me more about the dope game than anyone i know. I loved chilling with him, mostly because i had faith in him to *always* find something for us. He knew everyone. One number fails, onto the next. If that failed we go driving until we find it. 

Now Dillon was probably one of the dumbest kids I've known. He could read but beyond that not much i could say about him. With that said it makes me feel even dumber for letting him be the one to peer pressure me into that shot on that fine, warm day in June. 

It was a normal day like any other, but my life would honestly never be the same after. Well my brain never functioned the same. I walked the normal walk across my small mountain town, felt in my pockets for my 25$ as i turned left up a backroad past the bank. I always recall the dog in the first house on the road barking like rabies where leaking out his ears. Almost like he knew how bad i was about to fuck up. 

I reached ole granny's drug den, going in the front for now because i wasnt labeled as a junky yet in her eyes. I passed Roxanne and a couple other randoms who were resting on the couch. ""Hey sweetie"", she always greeted me in a manner which caused a few butterflies to float up my chest. She was a very attractive woman despite all her self abuse, in her dark sunglasses and tight blue jeans. Her eyes had seen as much pain as any miserable person ever had, if they were open. 

I said my hellos and was ignored by the Granny as usual. She knows why I'm here. I make my way back through the kitchen to the backroom, where i see a gnarly site of two dudes sticking themselves like pin cushions. ""Uhh hey yall got opana?"" I hated trying to snort these endo series ones, but that is all they had. I bought a quarter of a 40mg pill for about  25$ (ridiculous). It was then as i tried to leave dillon comes up to me excited. ""Hey man you gotta try it this way! It is so much better! The rush is unlike anything you have seen"". I told him i didn't know how. ""Danny is good at this man, he can hit ya!"" 

Now danny wasnt ignorant. He at least acted like he wanted to talk me out of it even if deep down he knew he wanted me right in the gutter with em. Why not? Free drugs for them for finding them for me. This was always my deal. Sharing never bothered me. I have empathy for my fellow addict. He finally saw it in my eyes i had decided my fate 20 minutes ago. ""Okay, we got you a fresh rig"".

As he reached up into a little hidden cupboard for the box of needles, i kinda saw my life flash before my eyes right there. What would my mom think of me now? 

I was in for the electrocution of a lifetime now...

(To be continued)",1528067756.0
8ocivv,https://i.redd.it/sgxc6i0qav111.jpg,4,https://redd.it/8ocivv,DeeeezNutssss,Fucking party pack 🎉🎉🎉,,1528067220.0
8oci8r,https://www.reddit.com/r/opiates/comments/8oci8r/opioids_and_nicotine/,0,https://redd.it/8oci8r,KidfromtheBasement,Opioids and Nicotine,I just did my oxy for the day and after a few hits of the juul I'm on cloud 9! But I swear I've also read that nicotine actually decreases opioid concentrations in the blood. Why is this such a great combo? ,1528067084.0
8ochsn,https://imgur.com/N3iHRp8,4,https://redd.it/8ochsn,general_smack,Needle mishap #32 - The time a flying needle just missed my eyeball,,1528066973.0
8ocdgb,https://i.redd.it/myve48n96v111.jpg,16,https://redd.it/8ocdgb,Barzsnotbraws,What I got left from a perc goddess,,1528065857.0
8ocdfh,https://www.reddit.com/r/opiates/comments/8ocdfh/waited_all_day/,0,https://redd.it/8ocdfh,Gnukes,Waited all day,"Waited all day to get well, nobody would pick me up the damn phone, my friend drove over an hour just to meet me (I didn’t hit him up until last, because I didn’t think he would do it) and just now got right. Enjoy the rest of your Sunday everybody!",1528065852.0
8occma,https://www.reddit.com/r/opiates/comments/8occma/morphine/,12,https://redd.it/8occma,esodrevo,Morphine?,"So my wife and I have this batshit friend (using that term loosely) that is a tweak head for sure, anyways we usually just pay for her adderall prescription and she will give us half.   

Well this last time she hits us up offering some morphine. I’ve had IV morphine in the hospital and was lit but it never killed the pain so I always hated it. We decide to cop though it was fourteen 60 mg and one 100 mg pills for 40 bucks. It was a good enough deal so we decided fuck it and got it.

Day 1: oooh this is nice like a light (high?) feeling but too heavy of a couch lock. 

Day 2: Well that took a while to hit but that’s cool now that it’s here.

Day3: Me: Do you feel anything?
            Wife: Like I’ve had a glass of whisky, smoked a whole blunt and forgot to move out of the sun and now have third degree sunburns!

Wife always started over heating.

Day 4,5,6 : I don’t feel shit. Even up’d my dose through out this experience.

Day what ever the fuck this is now: WD blues like a MF. Want to kill everyone that crosses my path and have literally cut 60’s in to eighths so We wouldn’t withdraw too bad. 


Moral of the story I fucking hate this shitty drug called Morphine and never got high enough to welcome  the shitless days and anxiety filled nights!

Is this actually anyone’s drug of choice?  ",1528065646.0
8ocaxw,https://www.reddit.com/r/opiates/comments/8ocaxw/the_kratom_reddit_banned_me_weeks_ago_for_tryna/,1,https://redd.it/8ocaxw,shinigamiboutit,The Kratom reddit banned me weeks ago for tryna stop the ban and inform people,I made a post about calling your local rep and telling them to vote no on the bill. I get permabanned and can’t do anything. What a great community someone try’s to make a difference and stop this shit government and pharma but ya know thanks modders,1528065240.0
8oc9ws,https://i.redd.it/lfhzo3w44v111.jpg,10,https://redd.it/8oc9ws,thetokingbandit,Oxycodone hcl- snorting? Or should I just pop them?,,1528064989.0
8oc95y,https://www.reddit.com/r/opiates/comments/8oc95y/sk_ive_been_told/,15,https://redd.it/8oc95y,mufftartss,Sk I've been told,"My friend said he bought tramadol online
 Seems outrageous
And risky as fuck.
Is that seriously possible?",1528064790.0
8oc5w8,https://www.reddit.com/r/opiates/comments/8oc5w8/west_coast_vs_east_coast/,7,https://redd.it/8oc5w8,PinkLemonade97,West coast vs east coast,I’ve lived and used dope on both coasts for a few years and I’ve always been shocked by how different they are. There are definitely negatives and positives to each coast. Curious to see other people’s opinions.,1528063978.0
8oc2qx,https://www.reddit.com/r/opiates/comments/8oc2qx/withdrawal_question/,3,https://redd.it/8oc2qx,kramercosmo69,Withdrawal question,"Hey so I’ve been 100% opiate free for 9 days now. I withdrew at a super low dose for about a week prior to these 9 days, so let’s say it’s been a 16 day process so far.  This is coming off of roughly 6 months of use, eventually working my way up to 180mg of oxy a day (at the very end).

The worst of the standard withdrawal symptoms are gone, but I feel tired as fuck and weak still. Hard to get out of bed.  Blood pressure is high,  heart palpitations, some mild RLS still. (I’ve had several cardiac workups in the past and everything is normal)

In my head I know you don’t recover from 6 months in just a few days, 

I would just like to hear other people’s experience.  What should I expect?  How long until I feel more “back to normal” ?

This sucks, in a different way from acute withdrawal. I could use some encouragement.  Thanks everyone :)",1528063221.0
8obz20,https://i.redd.it/zlkcooc8wu111.jpg,18,https://redd.it/8obz20,Options-Trad3r,Just got these for $20. What a fucking deal.,,1528062299.0
8obtpk,https://i.redd.it/njge05qbsu111.jpg,1,https://redd.it/8obtpk,Options-Trad3r,"Are you feeling it now, Mr. Krabs?",,1528060984.0
8obpat,https://i.redd.it/i120ha08pu111.jpg,9,https://redd.it/8obpat,phlufhead,Think they know?,,1528059988.0
8obnah,https://www.reddit.com/r/opiates/comments/8obnah/can_we_start_a_rehab_rating_thread_sticky_it_and/,4,https://redd.it/8obnah,travs3dpe,Can We Start a Rehab Rating Thread. Sticky it and keep it updated and ongoing.,"We all know there is no oversight or committee set up to rate rehabs and many of us have experienced scams, abuse and likewise excellent care at certain rehabs. I want to get this going where we all rate which rehabs are best from rankings such as healthcare, staff knowledge, kindness/understanding, price, food, lodging etc. I have a few in mind that I have personally been to and want to have everyone who has been to one put their input. I think this would be a great idea to weed out the shitty rehabs versus the good rehabs. What do you guys think?",1528059549.0
