7gsc6y,https://www.reddit.com/r/opiates/comments/7gsc6y/snri_wd_from_tram/,7,https://redd.it/7gsc6y,40throw,snri wd from tram,"used to take trams - about 300 mgs but now and then would take more but never over 400 in 24 hrs. anyway just got back to the states not too long ago now and just before thanksgiving i stopped taking the tram and switched over to hydrocodone. 


the hydro covers the opiate side of things but suddenly stopping tram also has the bonus of snri withdrawl. i didnt really even notice it too much at first but it snuck up on me! after a few days i def notice wd from the snri side of things.


mostly tired and lethargic despite the hydro which usually for me gives me a great burst of energy. also some rls and chills when its not really that cold, but the worst is def have these moments when i get like really really depressed. seems to come and go thankfully and i try to just tune out the depressing thoughts as best i can. 



was sort of thinking about maybe finding some tram and going back on it and slowly tapering off. i mean maybe i will grit and bear it and just get off the stuff. its effecting me but its not that bad right now i guess. comes and goes in waves too, sort of like benzo wd.",1512100131.0
7gs825,https://www.reddit.com/r/opiates/comments/7gs825/black_tloaties/,9,https://redd.it/7gs825,Fentylove,Black tloaties,"*I meant floaties lmao* Ok so when I heat up my bth it gets little black specs floating in it, am I burning it? Should I be worried?",1512098991.0
7gs6z6,https://i.redd.it/4iytgw19c8101.jpg,13,https://redd.it/7gs6z6,graffythugging,"Little pickup for tonight, nothing major but enough for me lol",,1512098704.0
7gs4yr,https://www.reddit.com/r/opiates/comments/7gs4yr/dilaudid_after_subs/,9,https://redd.it/7gs4yr,queencatlady09,Dilaudid after Subs,"So the past 3 nights I’ve taken 1mg of suboxone films at around 8pm.
So as of now it’s been about 24 hours since my last dose of suboxone and I’m wondering if by tomorrow morning the subs will still be in my system enough to block other meds. 
I have some GI issues and will be at the hospital in the morning for an endoscopy and will also probably receive some IV dilaudid. 
By tomorrow it will probably be around 36 hours from my last 1mg dose. Those 3 days of using 1mg have been my only sub usage ever if that makes a difference. 
I’m not prescribed subs and so I can’t really ask the doctor about it ",1512098175.0
7gs43j,https://www.reddit.com/r/opiates/comments/7gs43j/what_is_the_halflife_of_iv_bupernorphine_zubsolv/,2,https://redd.it/7gs43j,nightmare5005,What is the Half-life of IV bupernorphine (Zubsolv)?,"Upon searching up the half life of bupernorphine I read the the half life's of IV bupernorphine is much shorter than the half life of sublingual bupe. It said that the half life of IV bupe is somewhere between 1.2 and 7.2 hours with a mean half life of 2.2 hours. I have been IVing my bupe for a month or so now and this could explain why I feel like the bupe is wearing off pretty fast. I just wanted to find out if the half life is really that short when IVed, if so this means I would beable feel the effects of other opiates much sooner than if I was taking bupe orally correct? ",1512097942.0
7grzvl,https://www.reddit.com/r/opiates/comments/7grzvl/eye_opening_suboxone_roa/,11,https://redd.it/7grzvl,KaiserGrant,Eye opening Suboxone ROA.,"So this may be a dumb question. So I'm pretty familiar with Suboxone and the many ROA's possible. My brother just got out of the big house and he told me subs are pretty easy to get if you have the money. No surprise there. This is the part I'm questioning. He said he seen inmates cut the strips in tiny micro dose strips and put the strip IN THE CORNER OF THEIR EYE! I figured if anyone else has heard of this method, they would be on this subreddit. So have any of you guys heard of this method of ROA before?",1512096852.0
7gry5e,https://www.reddit.com/r/opiates/comments/7gry5e/crazy_reddit_world/,6,https://redd.it/7gry5e,klove99,Crazy Reddit World,"Yoooooo.. so have any of yall seen ""The Orville"" episode ""Majority Rules?"" I think most episodes of that show are very underdeveloped, but that one is really interesting. An absolute democracy where everything's on the global world feed and people upvote and downvote for life. And when you do shit it gets uploaded and you go on this ""tour"" to try to get upvotes to live. Basically, a society based on Reddit.

 For those who've seen it: 

How crazy is that? Do you think us junkies would get downvoted into oblivion? Also, in that society, truth is voted on. Whatever gets the most votes, wins. Do you think if we lived in such a society, that opiates would be illegal?  Like if this had been going for the last 100 years, do you think The War On Drugs would have happened? Or do you think enough people would have upvoted heroin to make it okay?


Everyone wears one of these on their person, for upvoting/downvoting a person. You can also do it remotely with their badge number

https://scifanatic-wpengine.netdna-ssl.com/wp-content/uploads/2017/10/orv-107-head.jpg",1512096393.0
7grxzl,https://www.reddit.com/r/opiates/comments/7grxzl/not_sure_if_i_should_post_this_here_but_fent_dope/,21,https://redd.it/7grxzl,theguy1112,Not sure if I should post this here but fent dope warning? NYC,"Best friend got dope in NYC and it's white bag red stamp says ""level up"" and he went to see his sub doc a week ago and today and both times tested positive for fent.  Not sure if this is appropriate to put here but figured might as well try.",1512096350.0
7grxrb,https://www.reddit.com/r/opiates/comments/7grxrb/a_15_ir_and_10mg_valium_and_im_slumped/,2,https://redd.it/7grxrb,lt420lt,A 🍑 15 IR and 10mg valium and I'm slumped,Post toe surgery and I'm schlumped hiii as a kite in the skyyy. Might do the last half of the pill i have then call I quits for a couple weeks hope everyone is in a warm blanket of some kind this wonderful evening ,1512096286.0
7grx8z,http://hosted.ap.org/dynamic/stories/U/US_MED_OPIOID_THERAPY_INJECTION?SITE=AP&SECTION=HOME&TEMPLATE=DEFAULT,7,https://redd.it/7grx8z,Grimalkin,AP: US approves monthly injection for opioid addiction,,1512096153.0
7grrwu,https://www.reddit.com/r/opiates/comments/7grrwu/playing_hockey/,4,https://redd.it/7grrwu,Psychonaut424,Playing hockey,Any of you guys play hockey? I wanna get into it but I'm not sure how to go about it without breaking the bank. ,1512094673.0
7grpjm,https://www.reddit.com/r/opiates/comments/7grpjm/lifes_rough/,8,https://redd.it/7grpjm,jman66,Life’s Rough,"So lost my job yesterday (didn’t have to do with drugs) because I stood up for myself to my manager with a power trip. I don’t know what to do with myself I’m so bored I’ve literally been shooting tar and drinking whiskey and cokes all day. I have nightmares about when I found my best friend dead of a fent overdose nightly. 

I’m lonely as fuck and life sucks but heroin heals 

And go make it worse I just boofed a huge chunk of tar cause I’m outta clean syringes. What am I doing with my life :(",1512094030.0
7grnjd,https://www.reddit.com/r/opiates/comments/7grnjd/some_user_of_opiates_want_to_chat_with_a_noobie/,19,https://redd.it/7grnjd,lilkpin,Some user of opiates want to chat with a noobie ? ( lol ),"i wanna know more thing about opiates , if someone could share their experiences with me on chat it would be cool! thanks",1512093507.0
7grmmn,https://www.reddit.com/r/opiates/comments/7grmmn/bupe_in/,9,https://redd.it/7grmmn,ohgotdamn,Bupe IN,"I️f you snort Bupe does it stay in your system shorter? I️ feel very light withdrawals when taking IN even in the same day. Also, not sure how relevant this is, but my pupils aren’t pinned anymore ",1512093266.0
7grldt,https://www.reddit.com/r/opiates/comments/7grldt/help_finding_a_dope_picture_someone_posted/,7,https://redd.it/7grldt,liwanu2017,help finding a dope picture someone posted.,can somebody link me to the really simple drawing of a poppy flower with a girls hand holding it please? i believe from september.,1512092935.0
7grk2r,https://www.reddit.com/r/opiates/comments/7grk2r/are_you_police/,43,https://redd.it/7grk2r,speedygoneslow,Are you Police?,"Why even ask? I mean dude even if I was I'm sure as fuck not gonna tell you I am when I'm barricaded in your flat watching you bag up my shit!

I get the paranoia but even asking that is dumb as fuck!",1512092660.0
7grifa,https://www.reddit.com/r/opiates/comments/7grifa/tomorrow_is_going_to_be_the_7th_day_of_my/,3,https://redd.it/7grifa,BongChong420,"Tomorrow is going to be the 7th day of my tolerance break 😏 I still have these weird, long time distortions. Thought today was Tuesday but it is Thursday.","My point is, I actually made it to thru the seven days. Because I thought I went thru the seven days, three days ago. 😒",1512092215.0
7grgqm,https://www.reddit.com/r/opiates/comments/7grgqm/had_some_questions_about_my_first_time/,2,https://redd.it/7grgqm,feelgoodhitofthesum,Had some questions about my first time,"I started with a really small amount of H. I mostly feel sedated, relaxed, nothing intense like I was expecting but it's super nice.

I've snorted a about half a bag so far, over a 7 hour period. I've been nodding off asleep a lot and felt really good. I fell half-asleep (eyes closed listening to music but like a little bit awake) for a good 4 hours of that period.

I'm really just worried because I don't know how much is too much. I want to do a little bit more but how would I know when a good time to stop is? I haven't been having any nausea (although I have been smoking pot so that probably helps) but I just tried to eat and it made me very nauseated.

Edit: I also have zero tolerance. How fast can I expect tolerance to build? If I try to keep it to like just once a week (good luck to me) will my tolerance reset each time?

2nd edit: When I was asking how much is too much I meant to ask is there any way I can tell if I'm getting close to an OD or anything? I'm just sniffing it

Edit 3 Please read: I just threw up what I tried to eat earlier after sniffing a bit more. I feel fine otherwise but is that normal? I still have decent control of my motor functions",1512091752.0
7grf5s,https://i.redd.it/oiyw8yheq7101.jpg,13,https://redd.it/7grf5s,surkitxx,Pick me up of the day 😁,,1512091351.0
7grc3g,https://www.reddit.com/r/opiates/comments/7grc3g/catch_you_guys_on_sunday_im_going_hunting_all/,3,https://redd.it/7grc3g,schizoidparanoid,"Catch you guys on Sunday: I’m going hunting all weekend! Whitetail, turkey, jackrabbits and wild boar!",See you all you lovely fuckers on Sunday when I get back! There’s no cell signal out in the middle of nowhere where I’m going. Just me and my guns. ,1512090552.0
7gr8pv,https://www.reddit.com/r/opiates/comments/7gr8pv/fuck_it/,5,https://redd.it/7gr8pv,opiateunion,Fuck it,"I haven't used in 4 days and I'm so miserable. All I can think about is getting high. It's consuming me. I'm at my apartment where I go to college and all I want to do is drive to my parents town and buy from my dealer and lay in bed and listen to nirvana till I'm nodding so hard my phone constantly is falling out of my hand. I thought that this past time when I detoxed, I would be done but of course I'm not. I go to NA meetings and all the people always talk about how they hit their rock bottom and they knew they were done and blah blah blah and I am so scared that I'll never get to that point. My using habits have destroyed my relationship with my girlfriend and my friends, and I basically have no one anymore. But I STILL want to use. I know this post had no specific point, I just really needed to vent. ",1512089706.0
7gr8dr,https://www.reddit.com/r/opiates/comments/7gr8dr/any_tips/,22,https://redd.it/7gr8dr,SpayceGhost,Any tips?,"So my the little rubber part of my plunger came off inside in the barrel and so when I pull out the plunger just the plastic part comes out and the little rubber ring stays in the bottom. Does anyone have any suggestions or tips on how to fix this

Edit: I threw it away. Does anyone have some suggestions on sites that have discreet shipping for syringes? Does Tracey still do care packages? I'd happily pay her for one",1512089619.0
7gr7gq,https://www.reddit.com/r/opiates/comments/7gr7gq/high_dose_combos_what_have_u_done/,2,https://redd.it/7gr7gq,GuitarisBlue,High dose combos? What have u done?,"100mg CWE Hydro, 600mg dxm. Anyone have any similar experience? I am have heavy tolerance to opiates this 100mg of hydro was nothing... My daily is 4 - 80s daily. I took the hydro early morning @0900 should I dose 600mg dxm at 1700? Wait? Will it bring some of the hydro feelings back up?

Also big time dxm user in the past, use to surf the plats for days after a break and time off... Attempted Plat sigma a couple times couldn't quite get there.

Sorry for the scrambled mess of a read.",1512089372.0
7gr4hi,https://www.reddit.com/r/opiates/comments/7gr4hi/odb_checking_in/,23,https://redd.it/7gr4hi,OlDirtyBurton,ODB checking in!,"So, drinking tonight.... tomorrow is my day off and it's been a few weeks so I decided to ""chip"" as far as booze goes.

Also, my boss found my arrest report online and I had to have a talk with him concerning the needle charge I got. Thats was fun.

He also learned i've been to jail before, and I'm still employed somehow... He's a cool dude.

Court in 2 weeks, yay. etc. etc.

How are you guys doing tonight?",1512088641.0
7gr10d,https://www.reddit.com/r/opiates/comments/7gr10d/jail/,23,https://redd.it/7gr10d,DopeHammahead,Jail,"This hammer is gonna be stuck in jail come monday. If any of you fine folks would like to write me send me a pm! I promise I'll draw you something cool or write you a poem or something. I'll be bored and this is gonna suck :)

Edit: I probably should have explained what i'm in for. It was kind of embarassing, but basically a domestic assault that culminated in me ODing trying to kill myself. I'm sure some of you are rolling your eyes because im always clean, dirty, happy, killing myself. i guess I was at a turbulent point of time in my life, but this whole incident really has opened my eyes and changed me. If you want to write or know more, PM me. thanks for reading",1512087791.0
7gr0ek,https://www.reddit.com/r/opiates/comments/7gr0ek/does_any_opiates_are_less_harmful_than_codeine/,27,https://redd.it/7gr0ek,lilkpin,does any opiates are less harmful than Codeine? (about the side effects ),"like nausea , low pressure , bad stomach idk , i just used 120mg codeine and after the high i felt so awful",1512087624.0
7gqzkn,https://www.reddit.com/r/opiates/comments/7gqzkn/heres_to_the_excellent_dboy/,6,https://redd.it/7gqzkn,williamskeat,Here's to the excellent dboy.," Today my guy called and asked for a ride.   He needed to go downtown, like a 6 minute ride, and called me out of the blue for some reason. So as I drop him off he gives me $7 cash, a blunt of some super loud, and a 20 bag.   

He told me how much she appreciates having a good customer. Why can't they all be this way?",1512087429.0
7gqyl7,https://i.redd.it/ma7uaem0e7101.jpg,1,https://redd.it/7gqyl7,datphatassREAL,Good thing today's pay day. My bag is getting small.,,1512087205.0
7gqyic,https://www.reddit.com/r/opiates/comments/7gqyic/did_you_fantasise_taking_heroin_before_your_first/,11,https://redd.it/7gqyic,milesred,Did you fantasise taking heroin before your first time?,"As a bit of background, I have smoked / eaten cannabis for 10 years or so, enjoy shrooms, ketamine, MXE and really enjoyed codeine, oxy, pods, kratom, Xanax and a bunch of benzos.

For benzos and oxy, it’s hard to source where I am and I have avoided buying at all cost as I know I would kill my self in months.

I have always had a fascination with heroin and have been incredibly drawn to it. For that reason, I have never taken it. No offence to anyone on this sub, I just know myself so have distanced myself.

I think about it all the time, and how if I lost my friends and family I think I would just buy a ton and see what happened. I dream about being terminally in and taking heroin constantly.

Did any of you have this before you took it for the first time?",1512087188.0
7gqskn,https://www.reddit.com/r/opiates/comments/7gqskn/oxy_80_cdn/,11,https://redd.it/7gqskn,myweirdself,Oxy 80 cdn,"Are these real? Or are they pressed and made by skmeones else, I see white spots but the green won't rub off.. I'm going to cut one in half to see th3 inside for the pics

What are the actual dimension of these? And how much does it weight 

These weight .28g idk the dimensions yet I'll update when home.. my boy got them to me he just got out of prison he used to chop oxy before he was arrested 

https://imgur.com/a/iLKPh",1512085724.0
7gqrl3,https://i.imgur.com/i3Sx5Ag.jpg,21,https://redd.it/7gqrl3,hydromoreplease,Vinegar 👃👃👃,,1512085505.0
7gqoxp,https://www.reddit.com/r/opiates/comments/7gqoxp/please_allow_me_to_introduce_myself/,14,https://redd.it/7gqoxp,DollyDickerson,Please allow me to introduce myself...,"... I'm not a man, certainly not of wealth, and the taste is questionable.

I've finally decided to get myself an account that doesn't have a picture of my face attached to it anywhere so I can talk about... Let's be real, it's so I can talk about all the terrible shit I do in secret and shitpost without worrying my boss, or anyone I know, really, will see it.

So, I thought I would introduce myself, and then I wanted to talk about something  that I know you will all understand, because I don't have anywhere else to share it. I'm sure you understand that, too.  Ok, now that I've already talked your ears off (typed your eyes out?), here's my post.

Hey everyone, I'm ""Dolly"" and I *love* shooting smack. My first time was when I was 22, and I'm now in my 30s, and starting MMT for the first time ever. I have been very lucky, I think, what with the fact that I'm still alive, and also that my husband (also a user) is still alive.

The second half of my post ended up being so long that I might have to post it in two parts. A guy I knew died of an OD a couple weeks ago, and I've spent the last week writing it all out, and I'm still not done, but I wanted to say hi anyway.

It's great reading this group. Thank you all for being here.

Oh yeah, I just finished Trainspotting 2 for the first time. 

... Being a junkie was kind of romantic when I was younger. Now it's just tiring.",1512084837.0
7gqour,https://www.reddit.com/r/opiates/comments/7gqour/anotherr_ua_question/,4,https://redd.it/7gqour,drbea,Anotherr ua question..,"If I were to use a little over a half g (.6) of some fire dope between today and tomorrow, would I be good for a UA on Wednesday next week? (6 days from today/5 if I don't finish it today) or should I not even risk it and just buy some quick fix? I used some quick fix the other day and it actually did work.",1512084819.0
7gqnwb,https://i.redd.it/i6zmq8lb67101.jpg,5,https://redd.it/7gqnwb,schizoidparanoid,Nice dark shot of some straight fire BTH 🔥🔥🔥,,1512084597.0
7gqntu,https://www.reddit.com/r/opiates/comments/7gqntu/the_lure_of_feeling_normal/,1,https://redd.it/7gqntu,Meeeeerrtyujf,The lure of feeling normal,"So today has been a shit day. I’ve got a huge amount of paperwork that I need to complete ASAP otherwise I’ll be a lot trouble. Plus it’s ducking freezing in London and the heating is broken at work so I spent the whole day freezing my nuts off. Then I had a huge argument with my ex. All this added up to me because my in a really shit place by the time I headed home. 

I’ve been a little reckless with my opiate use recently. Having successfully on and off for a long time I’ve been using more days then not. Never huge doses but far too regular. And I’ve had a couple of scares where I’ve nodded off super hard. The last of which was a couple of days ago and I woke up face down in a pillow. I use alone so I’m usually really careful about dose size and only doing half a shot and waiting to see how it hits but yeah it’s still too easy to make a mistake.  

Anyway I decided duck it, and drew myself up a shot. It wasn’t the biggest, I didn’t and don’t feel high. I just feel ok. The slight sore throat I had, can’t feel it. All the shit going on in my life...it’s fine, I’ll deal with it. It’s amazing and it feels like a cheat to resolving all the fucked ways my mind decides to act and make me feel. It’s so dangerous though. I know it is. I’m just really leaving future me in more shit then I am already. I’m just isolating and hiding from it all. I’m just as trapped as I ever was. Ah well I’ll deal with it tomorrow. 

To:dr heroin is a great way to not face your problems. ",1512084580.0
7gqmjw,https://i.redd.it/ojb3j93c57101.jpg,30,https://redd.it/7gqmjw,Foxes_and_Fireflies,It's 🐼 refill day!,,1512084269.0
7gqjf7,https://imgur.com/3rJsfTR,61,https://redd.it/7gqjf7,analog_paint,I like this subreddit,,1512083502.0
7gqin1,https://www.reddit.com/r/opiates/comments/7gqin1/get_the_most_out_of_it/,2,https://redd.it/7gqin1,atomicmannnn,Get the most out of it,"I have 2 and a half white U15 pills. That's the 5mg oxycodone/325mg acetaminophen. 
 
What's the best way to get the most out of these? My tolerance is where I usually take about 20 to 30mg of oxy. 
 
I have some Hydroxyzine(Vistaril) 50mg pills as well, I have read they may help boost the effects but I don't know when the best time to take them is.
 
Edit: I only take them every now and then, the last time I took was last Saturday and it was hydrocodone(3 of the 7.5 pills) so it's been a few days, I just usually take more and don't want them to be wasted.",1512083334.0
7gqfh7,https://www.reddit.com/r/opiates/comments/7gqfh7/i_overdosed_for_the_first_time_last_night/,9,https://redd.it/7gqfh7,1234rufflesking,I overdosed for the first time last night...,"Hey there. Just kind of trying to get my thoughts out here. I've been a pretty heavy H user for the past year, recently got clean about two months ago. My boyfriend and I used last night because we had a long week and thought we'd treat ourselves. We're sniffers, and knew our tolerance was pretty much gone so we were going to be careful... right.

Admittedly, I did my line and thought to myself, hmm that seemed a bit too big. But I was ready to feel that sweet relief again, so I pushed that worry to the back of my mind as that warm feeling started to creep up my body. My boyfriend tells me he's going to the bathroom. I'm feeling good, I lay down on the bed and close my eyes...

Next thing I know, he's standing over me, as I'm laying on the floor, dragging me to my feet and sobbing, telling me to get up. I groggily follow him to the bathroom and he sets me in the bathtub and starts running cold water on me. Through shakey breaths he tells me I overdosed. I start crying, telling him I don't want to die as reality starts to set in. 

Apparently I passed out while he was in the bathroom. He came back and saw me curled up in bed, and thought I was just relaxing after a long day at work. He told me to wake up and tried to play with my hair. No response. He said my name a little louder. Still no response. He noticed then I was breathing very lightly, in shallow wheezes. My boyfriend thankfully knew something was wrong instantly, and carried me to the kitchen and laid me on the floor. He said he tried getting me to wake up by lightly slapping my face and rubbing my sternum. At that point he realized I wasn't breathing at all and my lips were turning blue. He then began giving me mouth to mouth breathing and checking my pupils. 

The scariest part he said was looking at my eyes and seeing how lifeless they looked. Like he could literally see the light fading from them. At the point, he decided to administer chest compressions while dialing 911. Thankfully, before he hit dial, I finally gasped myself into consciousness, which is all that I remember.

I am rattled by what happened. I legitimately do not remember anything that happened after I laid down. And to think that I wouldn't be here right now had he taken just a little longer in the bathroom has truly frightened me. I didn't have a point to this story, I just needed to talk it out. Stay safe everyone.",1512082607.0
7gqemm,https://i.redd.it/cged2nzsz6101.jpg,37,https://redd.it/7gqemm,ashlausmi,when I see 8 different notifications on my lock screen and not a single one is from the plug,,1512082406.0
7gqema,https://i.redd.it/ozcwst2sz6101.jpg,9,https://redd.it/7gqema,PsychologicalAwning,"My high school teachers would be so proud, still getting those good grades!",,1512082404.0
7gqdzx,https://www.reddit.com/r/opiates/comments/7gqdzx/december_30th_will_be_a_year_from_when_my/,4,https://redd.it/7gqdzx,peachyyy_,December 30th will be a year from when my boyfriend OD'd and passed away,"idk wtf I'm guna do x(

I have to go thRu his belongings on Monday...

R.I.P. B I MISS YOU & LOVE YOU SO MUCH!!!! PLEASE HELP WATCH OVER ME

WHY IS THIS REAL

🥀🥀🥀🥀🥀",1512082251.0
7gqd9l,https://www.reddit.com/r/opiates/comments/7gqd9l/morphine_vs_norco/,1,https://redd.it/7gqd9l,throw_away_etc,Morphine vs Norco,I personally have a bit of a tolerance when it comes to Norco 10s (like most here) I recently got 4 mg of IV morphine. My question if anyone can help is what is 4 mg of morphine equivalent to mg Norco wise? Thanks in advance,1512082090.0
7gqcl4,https://i.redd.it/arx2sleey6101.jpg,20,https://redd.it/7gqcl4,Manik209,"Made some more ""cheese"" from tar",,1512081932.0
7gq9u6,https://i.redd.it/shdhshrgw6101.jpg,21,https://redd.it/7gq9u6,lilxanarchy,Tar and Bars,,1512081302.0
