785uqp,https://www.reddit.com/r/opiates/comments/785uqp/can_we_talk_about_the_value_of_life_real_quick/,6,https://redd.it/785uqp,Cujuabled,Can we talk about the value of life real quick?,"I ran into a friend of mine today when I was chillin with a homeless dude on the sidewalk. This friend is pretty straight edge, smokes the occasional joint. He knows I've fucked around in the drug game for awhile and seems fascinated by it. I always reinforce my belief that he has incredible potential and I don't think he should touch any hard drugs or really be affiliated with the drug world whatsoever, and he takes my advice to heart. 

So the homeless homie told me he lost him umbrella, and I'm like, ""dude fuck it I'll go to wal mart right now and get you a brand new one, I'll be right back,"" and my straight edge friend came with me to wal mart while homeless dude stayed posted up flying his cardboard sign. My friend tells me he's always thought I should write a book, because he's heard some of my drug game stories retold from my best friend who he sees often. He said he has so many questions and that a book would answer them. I told him I trust him and know he doesn't judge, ask away and I'll answer honestly. 

We were talking about an area in the county next to ours just before this conversation (for those of you in WA, we were talking about how fucked the KP is) and he asked me what my worst memory is from out on the KP. There's a few, but I told him the story of what I thought was the worst one. 

There was this trap house that my junkie associates and I used to frequent, it was the most popular on the KP before it finally got shut down and closed off with police tape for good. I'm talking bi-weekly raids, constant bloody fights, constant flow of people in and out, kitchen always full of people shooting up, guns and piles of cash out in the open type shit. Ya know, normal trap house stuff. So one guy I had a few good talks with overdoses, and no one finds him until he's good and dead. I tried chest compressions, but he had no heartbeat and we have no clue how long he had been dead. So we take his body outside at like 1 in the morning, and there's about 10 of us yelling over each other about what to do. Yes call 911, fuck no don't call 911, try more chest compressions, try more narcan, etc. It was tense. So in the middle of everyone arguing, the wife of the owner of the house silently drags his body to her car and stuffs him in, then drives away. We're silent. She comes back about 5 minutes later and says she dropped the body in front of the fire station, quit talking about it, it's over. 

So I told him this story and it just got me thinking about the value we hold to life itself in the drug world. No other scene besides in like fuckin Africa are kids walking around with guns and killing each other over 5 dollars. That shit happens all the time. I've lost one friend to murder in this game, and it's just so frustrating that it was over some dope or some dope money. Like where do we draw the line?",1508739100.0
785k3v,https://www.reddit.com/r/opiates/comments/785k3v/lazy_eye/,8,https://redd.it/785k3v,412pgh412,Lazy eye...,"Anyone else get a lazy eye when they do fentanyl or get super high off D?  Only if I do a bunch of F though...  doesn't seem to happen wish straight dope even if I do a lot but the super strong F will like instantly make my one eye start floating...

",1508734977.0
785j7o,https://www.reddit.com/r/opiates/comments/785j7o/grasping_at_straws_til_refill_daythoughts_on_this/,8,https://redd.it/785j7o,Numba2Acct,Grasping at straws til refill day....thoughts on this combo?,"Baseline - 100mg oxy or so to feel anything.

I have 2 20mg OxyContin. I have a shitload of benzos.

If I soak the oxy in Coke til tomorrow night, and take it with 1mg Xanax.....

1. Will I feel good or still nada?
2. With my tolerance, is there any danger?

Alternative is to just drink some beers. But I'd prefer a slight nod.

I don't think the danger is high. But need advice cause I rarely ever mix.
",1508734643.0
785iyh,https://theconversation.com/sugar-in-the-diet-may-increase-risks-of-opioid-addiction-85313,8,https://redd.it/785iyh,mockassin,Sugar in the diet may increase risks of opioid addiction,,1508734531.0
785dmi,https://www.reddit.com/r/opiates/comments/785dmi/is_addiction_compatible_with_dignity/,21,https://redd.it/785dmi,CrystalFieldTheorist,Is addiction compatible with dignity?,"I don't want to specify what either ""addiction"" or ""dignity"" mean.  I just want to hear y'all's thoughts.",1508732583.0
785bgp,https://www.reddit.com/r/opiates/comments/785bgp/anybody_up_and_wanna_chat/,28,https://redd.it/785bgp,throwawaytheopiate,Anybody up and wanna chat?,"Hey yo, 
so I'm five days off of opiates and it's really not that bad, just fiending a little right now. Went into a drug den on the allure of DMT and instead guy pulls out about a kilo of opium and i'm like ""hey now, no thank you"" but i stayed a little longer than i should have. 

I've just been smoking shit tons of hash. It helps a lot. I've also taken small amounts of lope and gabapentin which has helped a lot too. Very excite to be off da opis and get my emotions back! 

Anyways, who's up and wants to chat? What have you been doing today? Y'all staying well? ",1508731810.0
784y3f,https://i.redd.it/ahrjm7pqvhtz.jpg,30,https://redd.it/784y3f,SavAusley,beating Agoraphobia one benzo at a time,,1508727432.0
784w7i,https://i.redd.it/1glla9xythtz.jpg,11,https://redd.it/784w7i,bitchimon12xanax,"Cleaning up my last night line of the night while I half-watch Archer. I'm thankful that I'm not sick, and that I have this wonderful community. Love to all, you're all such beautiful people inside. ❤️",,1508726834.0
784v48,https://www.reddit.com/r/opiates/comments/784v48/i_feel_chill_asf_right_now/,4,https://redd.it/784v48,Anon1020303,I feel chill asf right now,,1508726520.0
784sjo,https://www.reddit.com/r/opiates/comments/784sjo/heroin/,41,https://redd.it/784sjo,thesonofhadesssss,Heroin,How old were you guys when you started using? I'm just wondering about the average age ,1508725643.0
784qdr,https://www.reddit.com/r/opiates/comments/784qdr/ate_small_amount_of_sub_and_still_high/,7,https://redd.it/784qdr,TheGoldenOilcle,Ate small amount of sub and still high,"I don’t really know how this is possible.   I was waiting on my dude for a couple hours and then his phone was off.   So I figured fuck he’s not gonna come through and I was already going through some pretty heavy withdrawals.  I had 1 8mg suboxone strip for a rainy day like this.   I broke a piece off approximately 1-2mg.  Put it under my tongue, after about an hour my dude shows up at my door with my bags.  I didn’t really get much relief from the suboxone still had watery eyes,yawning, and chills.  So I decide to do a little 20 bag maybe .15 of some good ecp/fent mix.  Got a crazy rush and a nice little nod going on.   I didn’t expect to feel anything honestly.  But I’m actually happy with the results.   I feel higher than I would if I would have just done the bag alone.   So is it really true that some small amounts of suboxone can actually potentiate the heroin?  I have been reading a little bit about it and some people call the mix of sub and dope a “dupe”

Happy nodding my friends.  

You guys have kept me entertained for some time now,  I’ve been laid up for a couple of months due to an I hurry an extremely broken foot/ankle due to being an idiot drinking and taking Xanax.  So thank you for all  the laughs and interesting read.  Finally decided to make an account to keep me busy.   Any other recommendations for good subreddits?",1508724934.0
784kqz,https://i.imgur.com/1Qayq4Z.jpg,40,https://redd.it/784kqz,Lifeisdamning,You have to love the color blue,,1508723159.0
784cmf,https://www.reddit.com/r/opiates/comments/784cmf/tolerance_is_a_bitch/,10,https://redd.it/784cmf,heroinAM,Tolerance is a bitch.,"I've quit and picked up again maybe a dozen times now, and the speed at which tolerance comes back is fucking obnoxious. I recently moved from CO to the east coast about a month ago (after about a month and a half clean), and I've been using daily. The shit I'm getting is definitely fent (only used tar prior to this, wasnt nearly as strong), and while a couple weeks ago, a gram would keep me blasted for days, it now takes me 2 points to get a decent high. Fuck, I hate how quickly this shit becomes completely unnafordable, and the fact I'm living in my car and working minimum wage doesn't help. I really need to get on subs asap.",1508720664.0
784c6l,https://www.reddit.com/r/opiates/comments/784c6l/having_a_shit_day/,2,https://redd.it/784c6l,Smew256,Having a shit day,I feel horrible and have a really important job starting tomorrow and wishing had some cuz I am dry. Omg this is shitty fuck I hope tomorrow is ok,1508720535.0
784675,https://www.reddit.com/r/opiates/comments/784675/im_unsubscribing_guys/,21,https://redd.it/784675,Dilly-day-dreamer,I’m unsubscribing guys,"I’ve been here since flj used to post his crazy stories, and loved this scene from the moment I got IV morphine in the hospital, to the Vicodin I got to take home. The hydros turned to oxys and then the oxys dried up. Then came the heroin. Oh god I rode the heroin wave for as long as I could but now I can’t do this anymore. My friends are dead, and I can’t keep looking in here every day. It’s making me sicker, even though I want to stay here... I like you people, I like the drugs we do. But the drugs we do are killing us. How many of our users are still alive? Who’s going to be dead tomorrow? Fuck this shit there’s not going to be a post from my fam on here saying “Andrews dead”

I love you guys, I can’t keep coming here when everyone’s dying. It’s making me sick. I’m un subbing, and keeping this clean streak running as long as I can.

I’m sure I’ll be back though... I’m aaaaalways back after a while...",1508718703.0
7842y7,https://www.reddit.com/r/opiates/comments/7842y7/my_grandmother_took_me_to_score_dope_in_the/,77,https://redd.it/7842y7,ASavageLost,My grandmother took me to score dope in the ghetto and paid for it.,"I had a job valet parking cars at a hotel and went to work that next Saturday night as usual.  If I made enough money in tips while I was working, I would take off with one of the customer’s cars to score in the ghetto, but that night was not good for me.  My mom’s mom, Grand Mary, let me stay at her apartment 10 blocks away, because I didn’t have the LandCruiser to drive back to my place.

In the morning I woke up with my legs on the wall, and when she came to take the sheets off of the couch, she asked me if I wet the bed.

“No.”

“Then why is the sheet so wet?”

“I’m sweating.”

“Why are you sweating?”  She reached out to touch the moisture on my forehead.

“I’m sick.”

“Why are you sick?”

“Um………… I’m sick for heroin.”

“You’re on heroin?”

“Yeah.  I’m on heroin.  I’m sick.”

“Why did you get on heroin, again?”

“I don’t really have a good answer for that, but I get sick, so I can’t really stop.”

“Well, what are you going to do about that?  Isn’t there something you can do?”

“Yes.  I’m supposed to be getting on methadone Tuesday morning.”

“Why wait till Tuesday?”

“That’s when they take people into the program.”

“Hmm.  Well, how are you going to work?”

“I don’t know.  I can’t get anything without money.”

“How much money do you need?”

“Bags go for 50.”

My grandmother went to get her wallet and took me in her Camry to the Conoco on Willow before she took me to work.  I was so high at work that I almost got fired.
",1508717752.0
783x33,https://www.reddit.com/r/opiates/comments/783x33/spent_time_at_the_police_station_today/,45,https://redd.it/783x33,OlDirtyBurton,Spent time at the police station today...,"Feel like a snitch.... My boss kind of twisted my arm about it though.

Yesterday when I closed shop I noticed there was only 2 bucks left in my tip jar (It had been quite a bit more earlier in the day) I told him, He checked the camera and sure enough.... 3 people came in and when I was turned around to get their money, dude shot the shit and was talking to me while reaching in, stealing almost all my tips while the two other people stood there giggling about it.

I knew the places he liked to hang out in town, and seriously tried to talk my boss into just letting me handle it on my own (knock him the fuck out and run his pockets) He said he wanted the dude to get locked up.

Well, right before I had to drop my son off, My girl got a text from her friend saying he was hanging out a few houses down from her's.... I did the responsible (snitch) thing instead of going up there.... 5 cops were there when I drove past.... apparently he had warrants for breaking and entering and is going to trial on a felony breaking and entering charge in a few weeks.

Tl;Dr: I snitched on dude who stole my tips instead of going out and fucking him up.",1508716065.0
783v3x,https://www.reddit.com/r/opiates/comments/783v3x/just_a_soppy_post/,3,https://redd.it/783v3x,hexabumblerumble,Just a soppy post,"Since I’ve been apart of this subreddit, I’ve felt less alone. It’s not that I don’t have friends, it’s that none of them share this particular part of my life, and I don’t want to/can’t let them know about it. I’m the only opiate addict I know. Even though I’ve only posted a handful of times, it’s a comforting thought that I can interact with people in the same boat as me. It’s nice to read about what you guys are up to on a daily basis. 
Peace and love :)",1508715497.0
783uyh,https://www.reddit.com/r/opiates/comments/783uyh/red_haired_tolerance/,12,https://redd.it/783uyh,DrOpies,Red haired tolerance,So I've heard redheads have lower tolerance to opiates. Well I can take 10mg of hydrocodone and be almost nodding. Think that's the reason why? I only take opiates for 7days a week and then take 3 weeks off which helps too. I take 30mg of hydro a day for 7 days and feel great for a week.,1508715449.0
783ti9,https://www.reddit.com/r/opiates/comments/783ti9/hey_fam_its_the_guy_who_posted_a_random_picture/,11,https://redd.it/783ti9,Nightcrawlerfan1,"Hey FAM, its the guy who posted a random picture of himself holding a pizza box, how is everyone?",Hope you're all doing great! Still clean btw,1508715002.0
783skp,https://www.youtube.com/watch?v=YlLE9M63tFQ,0,https://redd.it/783skp,street_philatelist,"""the pills just made me drool"" KING KRULE - emergency blimp",,1508714728.0
783r6t,https://www.reddit.com/r/opiates/comments/783r6t/what_is_your_opiate_of_choice/,43,https://redd.it/783r6t,kitty-gonewild,What is your opiate of choice?,I've only ever used dilaudid aka hydromorphone and I'm just wondering if any of you have used a drug that you like better than it.  ,1508714325.0
783qo4,https://www.reddit.com/r/opiates/comments/783qo4/when_u_have_all_the_cash_yet_all_ya_connects_are/,13,https://redd.it/783qo4,ashlausmi,when u have all the cash yet all ya connects are dry,"worst feeling ever :/ 


whats worse is the backstory. my usual dealer. its him & his girl. his girl cursed me out bc I said not to hmu anymore. she promised me meds, I was omw and she said she sold them all. so I said dont hmu anymore and she cursed me out. so now I deadass have zero connects, zero stash but so much cash ! ",1508714179.0
783p6t,https://www.reddit.com/r/opiates/comments/783p6t/how_many_paracetamol_500_mg_tabs_with_15_mg/,25,https://redd.it/783p6t,Anon1020303,How many paracetamol 500 mg tabs with 15 mg codeine should I have,"I want to get as high as possible without damaging my liver and shit, how many do I take? I have 20 left. ",1508713769.0
783lu8,https://www.reddit.com/r/opiates/comments/783lu8/iv_question/,3,https://redd.it/783lu8,Cujuabled,IV question,"So I used to bang a lot of meth and heroin, been trying to keep away from that, so naturally I've been banging a lot of coke. At one point during my heavy IV drug use, just one day when I would shoot in my right arm, it would feel incredibly uncomfortable putting the needle in my vein. I could just... I don't know, it's as if I became hyper sensitive to metal breaking through every tiny layer of skin and vein until I was in, so I usually try to use my left. Well if you have experience with IV coke, you know it messes your veins the fuck up hardcore, so I had to use a tie off for my most recent shot. I never have to do that after about 3 years of sporadic but for the most part consistent IV use. 

I tied off and had to use my right arm because my I've been using my left too much. Once again it was incredibly uncomfortable getting the needle in there,  I cringed and the hairs stood up on my neck. I register, fine and dandy, and then blast off. But when I blasted off, it felt as if I could feel the liquid entering and coursing through the entry point of my vein. You know how a gust of wind ripples an inflatable tube man at car lots? It was like that, then my whole forearm felt weird. This was probably 15 minutes ago, my forearm still has a strange feeling in it, like an urgent need to stretch like with RLs during opiate WDs, and my hand kinda has it too but a slight twinge of pain to it. There's also some tingly numbness in my forearm and hand, but not a lot. These symptoms are becoming progressively prevelant. 

Did I do something wrong here, or is it just like the muscle tension and vasoconstriction from coke use or what?",1508712783.0
783hzh,https://i.redd.it/nvqk9jbvkgtz.jpg,27,https://redd.it/783hzh,jlogic420,I like to slow down a bit haha,,1508711666.0
783hxq,https://imgur.com/h1Pu03M,131,https://redd.it/783hxq,AllUpInYaAllDay,"There's no new beginnings, no more second chances.",,1508711651.0
783eh4,https://www.reddit.com/r/opiates/comments/783eh4/the_police_not_the_band/,78,https://redd.it/783eh4,NoseCandiez,The police (not the band),"Who on here is a cop? Are you here for business or pleasure? I think it’s kinda cool, knowing that we can openly discuss drugs with/amongst the police without ending up in jail. 

It does still feel kinda wrong but since I don’t do any illegal drugs (LOL) I have nothing to worry about. 


P.s. if you’re a cop, you gotta tell me since I asked. That’s the rule. Everyone knows that. ",1508710660.0
783b9z,https://www.reddit.com/r/opiates/comments/783b9z/i_smoked_some_pot/,35,https://redd.it/783b9z,emptyvessel85,I smoked some pot!,Man I used to smoke weed everyday. Then as my opiate grew my desire to do other drugs lessened til I stopped smoking weed. That was like five years ago. Well today but I went and picked up some methadone because I'd been out since yesterday morning and wasn't feeling good. So we went to pickup and on the way back my girlfriend pulled some fresh Neville's haze crossed with super sour diesel outta the glovebox. I could smell it through two bags and it smelled incredible. So I asked if I could take the green hit outta the bowl and she obliged. So I took the biggest rip I could and held it till my eyes watered and smoke was whispin outta my nostrils. I blew the delicious smoke out and instantly my legs went numb and my back went loose. By the time five minutes had passed we were back to the hotel and all i could do was melt into the bed. Man did I forget what I was missing! God bless weed!,1508709756.0
7834m9,https://www.reddit.com/r/opiates/comments/7834m9/not_posted_in_months_hows_everyone_doing/,5,https://redd.it/7834m9,NotPoliticalyCorrect,Not posted in months hows everyone doing?,"Alright folks how's it going? Hope everyone's fine and not WDing through lack of funds or worse no one has anything !! So I've not posted for a good few months as I've been in town staying at a friend selling heroin. Did it for about 8/10 months and boy what a fucking headache! I forgot how stressful this shit could be plus getting busted 3 times but the fuckers got nothing as any large amounts would be banked at all times and a few tenner bags and halls are easy enough to swallow. 
    Junkies just don't give a fuck!  At the door at 5 am wanting a poxy tenner bag. Personally, I'd never dream of going to someone's door at that time! But that's just me. I'd arrange to go to someone's door at 12:30/1am if I had money going into the bank that night but I would go and tell my dealer I was doing as such and order what I wanted just I case he/she sold out.

   One night we got into a heated argument with a couple of idiots and they came back(I think) and set the door on fire with an aerosol can! Lol, The smoke alarms went off and I went to the front door where flames were licking from underneath the door and setting the carpet on fire and just at that moment the can exploded! As I was right next to it on the other side of the door I fucking shit a brick! And had no idea what was on the other side! So I ended up jumping out the kitchen window and luckily I was on the ground floor and the only person in at the time as the people that caused the altercation had left to go to their own flat which was only a few levels up from me. I phoned for the fire brigade and shouted up to my friends that the close(stairwell) was on fire and to get out as it was quickly filling up with thick black smoke. Just at this point a punter comes up and asks if I've got obviously seeing the fire and black smoke blowing out the back close door I tell him no (which I didn't) and asked if he couldn't see the fucking fire and this wasn't the best time! He asks if my mate is holding up the stairs and I tell him I think he does but now isn't the best time! The crazy bastard then proceeds to go into the close by the fire and up the stairs! Lol He gets there and asks him to sell him a half gram in which ***** asks him if he cant see what is going on and the police and fire brigade are just about to show up but he still insists that he sell him the half while chocking on the thick black smoke ! ***** hunts him and puts wet towels at the front door to block the smoke as his GF doesn't have the best mobility and she's freaking out. Just as the half-wit comes back down the stairs face as black as a coal miner the fire brigade turn up and police and quickly put the fire out. Luckily I didn't panic to much and got rid of everything incriminating in the living room and took the barricade off the front door or they would have had a difficult time getting in but I did just shove the scoring money under the couch but it was still there when the firemen gave the all clear so that was cool the police seemed to think it was some sort of drugs war as in a separate incident a few weeks before it some arsehole set fire to a Pram in the close it was no real danger just a load of smoke. The door, on the other hand, could have been a lot worse! Apparently, there must be a firebug in the area as there have been a number of fires in the area so I'm not sure if it was the people my friends hand a fight with half an hour before the fire. 

  I also started getting a bit heavily into crack though it's not really my drug of choice (I'd rather have a bit of speed) it was good stuff as the guy selling it was going all the way down to England to get it. But the first pipe is always the best and the other ones you are just chasing that first one and your spending £100/£200 on something your not going to get again that night. I was doing alright on the dealing selling about a half ounce easily a day and double or triple that on a good day and was putting out 0.23g for a tenner and 0.47g for £20 so made about £280/290 every half oz. 

  Ended up jacking it in as people where falling out with each other because of the crack it was honestly changing people personalities and I couldn't be fucked with all the bullshit anymore so decided to go back to my mums been here for about a month and I'm down to about a half gram or tenner bag a day and hopefully get on the foil soon as I'm injecting in my groin and it's a bit risky and don't want to risk losing my leg just because I'm lazy and can't be bothered with the rigmarole of finding a vein in my arms as nearly 20 years of this shit has taken its toll I don't have any collapsed veins but some are cerossed and you can't really register in them. So hopefully in a week or two ill be off the shit and have a cupboard full of dihydrocodeine to detox with as well. 

  Anyway, folks happy nodding and all the best from bonny Scotland! ",1508707921.0
7832ub,https://i.redd.it/fda5q5198gtz.jpg,13,https://redd.it/7832ub,jlogic420,The temptation was fucking real,,1508707423.0
78307y,https://i.imgur.com/BgvdnnV.jpg,16,https://redd.it/78307y,heavyheavyshitdude,Whats in my pockets today? What about yours?,,1508706688.0
