awfgd0,https://www.reddit.com/r/opiates/comments/awfgd0/rare_check_in/,3,https://redd.it/awfgd0,UnitGod,Rare check In,"It's a Friday night and I am laying in my bed right now.  I have a form of muscular dystrophy that really blows and takes toll on me mentally, so being sick doesn't help.  Right now I am a little dopesick but pack should show in a few hours this morning.  I pulled myself out of bed this morning and made it to my only class.  Came back and crawled into bed for almost all day.  Haven't eaten today.  It's like I am on top of my game with some fire powder.  I mean I am currently in college, and so so close to finishing.  I need to tough this out and make myself and my family proud.

&#x200B;

It is getting harder to keep up with certain things in my life.  I have a few really cool friends, but I've lost some pretty close ones due to distance and differences in life.  Neither of my roommates use, although they sort of know I do.  I don't hide it, and they've seen me snort.  I don't smoke it or shoot.  But we all smoke weed everyday.  I've saved up almost $8000 while paying for a lot of stuff myself.  I keep myself in check and don't know any local dealers.  Don't know how to cold cop and am glad that I don't even try.  I know what a smart young man I am and the background and family I come from.  

&#x200B;

This is not how I was raised but this is who I am.  No one around me knows of my problem but its still here.  I think maybe someday soon I will talk to my mom and dad and get help.  I love the highs but hate the lows.  I have bigger priorities to take care of in life right now.  I am only 21 years old.  This is more just something that I can ramble off.  Love you all.",1551513284.0
awexyw,https://www.reddit.com/r/opiates/comments/awexyw/i_cant_nod_what_to_do/,14,https://redd.it/awexyw,gopostal44,"I can't nod, what to do ?","So I dabble sometimes in opiates, usually low doses to get a bit of euphoria/motivation, usually go on binges for a few days every other month.


So this time I got oxy 40mg (Europe so oc) and it has been a month since last time. I got a natural tolerance to opiates I think, first time oxy I did 50mg to feel really nice, but was not high af.

So yesterday I ended up doing 150mg in 12 hours and never caught a nod, wasn't sedated at all, what's up with that ?",1551509020.0
awevgl,https://i.redd.it/cj8gs0hohnj21.png,21,https://redd.it/awevgl,hbarnes55,My last shot for the night. Its clear so you guys know what that means. Definitely got fentanyl in it. Hope everyone has a good start to the weekend!,,1551508451.0
awej4i,https://www.reddit.com/r/opiates/comments/awej4i/why_dont_the_cities_that_have_a_needle_program/,3,https://redd.it/awej4i,blakdart,Why don't the cities that have a needle program adopt what ALDI does with their shopping carts?,"As in you give out clean needles for 25 cents each, and the users get their quarters back when they return used needles. Perhaps users could return needles they found for 10 cents each.",1551505788.0
awef8l,https://www.reddit.com/r/opiates/comments/awef8l/taking_klonopin_after_heroin/,10,https://redd.it/awef8l,dontwatchmelaney,Taking Klonopin after heroin,"How long should I wait after taking .5g of heroin over several hours before I can eat some klonopin. Should I be feeling stone sober again? Pins seem less dangerous as the effects are less acute. Just want to be as safe as possible. M

Thanks!",1551504963.0
awedqr,https://i.redd.it/ybwxq7he6nj21.jpg,4,https://redd.it/awedqr,cbdhalkyard,Burned too many bridges huh,,1551504659.0
awe5kb,https://i.redd.it/oau7gfmd1nj21.jpg,27,https://redd.it/awe5kb,WSMFP912,I think we can all relate,,1551502969.0
awe4xr,https://i.redd.it/8gjqybwy0nj21.jpg,3,https://redd.it/awe4xr,CSX302,I need this shirt!,,1551502841.0
awdzh9,https://www.reddit.com/r/opiates/comments/awdzh9/a_price_to_be_paid/,15,https://redd.it/awdzh9,Waiting_on_a_Corner,A Price to be Paid,"“Daddy why do you have all those scars?” asks my youngest son. He sits in my lap playing with my hands, tracing every line with an invisible marker.


I turn my hand over to see the faded but still prominent H burned into my hand.


“This one?” I say pointing to it, while I remember every “last” cigarette that led to my personal brand.


“Not that one, the H is for our family. These lines here” pointing to a large, dark, carving on my forearm.


I am glad that Ty can't yet read the “I AM DEATH” that the lines spell out. But nevertheless I know he will press for an answer. 


I struggle in a fit of “ummm and well you see” until my wife takes notice. 


Dark curled hair frames her face, as her mahogany eyes read my silent plea for help.


Calmly she says “Ty some things don't need an explanation”, picking him up to play with our other two boys. I mouth ‘thank you’ to her as she subtly smiles.


It is only the second talk during church and I'm already seeing patterns in the stucco. Staring at the words suddenly and intensely took me straight to the moment I made them. 



In a blink, I'm 21, living at my parents, driving my shitty 2001 Altima, and losing my mind again…



I was losing a battle with an unknown neurological disorder, or that's what the doctors thought. For a while I was prescribed various antidepressants and antipsychotics. But I was blessed with the occasional script of oxy and a monthly supply of Klonopin, but those had run out a week ago.


The grips of withdrawal had consumed me, the stabbing pain, vomiting, and constant the nausea and flu, of opiate withdrawal showed my mask dying. I had never been in benzodiazepine withdrawal before but, the mix of oxy, klonopin, and a few drinks was blissful. Alone or not I didn't care, the months supply was gone within 10 days, and then madness set in. I saw walls melt, carpets turn to water, cars change color, and voices came to whisper indistinguishable noises in my ear. After two weeks of this my sanity hung by a thread.


My “best” friend at the time asked me to be his best man that night, and normally I would have been excited, but in withdrawal it put a wrench in my plan to end it all. Isopropyl alcohol induced liver failure was my plan, but now I had an obligation.


Instead I decided on a new plan and began meticulously carving into my epidermis. The words “I AM DEATH” bled into my Meeseeks robe, followed by a baking soda chemical burn. 


Words now there forever as a reminder of the inevitable price to be paid. 


With my gaze fixed, my wife senses I'm lost again. She places her hand on my scars, she knows of the demons within. Knowing the secret habits, tastes, and slip ups, that I kept hidden. Slowly she brings my eyes up to hers and I emerged from the icy depths of my past, gasping for breath. 


After a few dirty looks I knew where I was. I tried my best to forget the words, with my wife's hand as my only anchor to this world...

",1551501690.0
awdqre,https://www.reddit.com/r/opiates/comments/awdqre/shots/,8,https://redd.it/awdqre,elementze0,Shots,"So this is a stupid question but I’m new to shooting and I’m curious, do shots go off? Like how long could you leave a shot sitting before you’d need to do it?",1551500070.0
awdqeu,https://i.redd.it/qg7oq16ksmj21.jpg,13,https://redd.it/awdqeu,captnzissou,"What I have left of an ""eighth."" Mexican weight is bullshit! Good dope, tho.",,1551500004.0
awdprf,https://i.redd.it/4450nq08smj21.jpg,4,https://redd.it/awdprf,ghstgrl93,Happy Friday 🥰,,1551499890.0
awdoy1,https://i.redd.it/c38uhersrmj21.jpg,40,https://redd.it/awdoy1,Tjmcp27,Anyone know what dose this Vicodin is in it’s full form thanks,,1551499749.0
awdo1i,https://i.redd.it/erwmsedbrmj21.jpg,8,https://redd.it/awdo1i,xpinsandneedlesx,"New batch of 2g Afghan brown out of the Netherlands-no worries about this ""hot"" order",,1551499587.0
awdjkn,https://i.redd.it/m9uioxawomj21.jpg,6,https://redd.it/awdjkn,rattattatttt,3g rock of some fire ecp,,1551498771.0
awdirj,https://www.reddit.com/r/opiates/comments/awdirj/i_have_to_take_a_ua_tomorrow_a_couple_questions/,13,https://redd.it/awdirj,pillsarebad,I have to take a UA tomorrow. A couple questions...,"How much asparagus should I eat? Should I cook it or eat it raw?

Need max stench.",1551498620.0
awdclz,https://www.reddit.com/r/opiates/comments/awdclz/oxycodone_hci_10mg_with_naloxone_hydrochloride_5mg/,17,https://redd.it/awdclz,rainbowfairy101,Oxycodone hci 10mg with naloxone hydrochloride 5mg,Hey guys my mate has these at the moment just wondering if these have any recreational value because I thought naloxone was use to reverse an opioid overdose.,1551497497.0
awczyp,https://i.redd.it/wni6jkcydmj21.jpg,7,https://redd.it/awczyp,op80morphHead,Yay finally,,1551495096.0
awcwau,https://www.reddit.com/r/opiates/comments/awcwau/what_gauge_should_i_get_for_my_syringes/,4,https://redd.it/awcwau,opismoke,What gauge should I get for my syringes?,"What gauge should I be getting ? Can u help me out these are 26 g I believe I also can get 27. What are the best gauge to get if you.can please help me thanks they aren’t really painful though but if it’s bad for my veins than I should get another type if you can give me some info? Thanks! Be easy let me know  there is another pharmacy with 30 or 31 I can get 30 or 31 but it’s those syringes without the detachable tips and I like the detachable idk why I just do it there isn’t any different between detachable and the ones that u can’t detach than I will get the regular once that are 30g
Let me know best needles to get if there is a difference between detachable and non detachable syringes please let me know! Thanks 
Any help will be appreciated thanks and happy nodding",1551494357.0
awcmdb,https://tonic.vice.com/en_us/article/gyamdy/naloxone-narcan-by-mail,0,https://redd.it/awcmdb,traceyh415,How One Group Is Expanding Access to Overdose-Reversing Drugs Through the Mail,,1551492392.0
awcjb3,https://i.redd.it/gpgfrtv64mj21.jpg,10,https://redd.it/awcjb3,KingPeachy37,Now this is a good time.,,1551491809.0
awcf36,https://i.redd.it/73lnmpps1mj21.jpg,19,https://redd.it/awcf36,fent_boofer,I swear there is more fent then h in this bag. Just woke up from a 4 hour nap off a lil bump.,,1551491005.0
awcesu,https://www.reddit.com/r/opiates/comments/awcesu/dillys_coming_on_tuesday/,3,https://redd.it/awcesu,CoolInformation,Dillys coming on Tuesday...,"Picked up my script on Tuesday but can’t fill it until this coming Tuesday. Frustrated, but I guess I should be happy I get a monthly script at all. Of course the 90 2mg Dillys are gone in 10 days. Sigh...",1551490948.0
awcdru,https://i.redd.it/ful64qs11mj21.jpg,25,https://redd.it/awcdru,HiRoller26,"*OC 80mg Oxy, OC 20mg Oxy HydromorphContin 18mg & 6mg Capsules* (Today’s Score)",,1551490751.0
awcdp1,https://www.reddit.com/r/opiates/comments/awcdp1/considering_snorting_oxycodone_powder_what_should/,4,https://redd.it/awcdp1,OxyNormal5,Considering snorting oxycodone powder what should I expect?,"I’m wanting to see if I can get more out of one pill by snorting it. It’s a capsule, so it’s just plain powder inside. I’ve been taking oxycodone for about 2.5 years. ",1551490735.0
awcd3x,https://i.redd.it/b8lfpwhn0mj21.jpg,5,https://redd.it/awcd3x,dopedupghost666,DOPE PORN!! been trying to leg my right arm heal lately but had to give in 🤤,,1551490619.0
awcaf5,https://i.redd.it/ndpotth2zlj21.jpg,22,https://redd.it/awcaf5,phatMooike,Gotta do what you gotta do,,1551490084.0
awc9hp,https://i.redd.it/vbtej05jylj21.jpg,22,https://redd.it/awc9hp,dopedupghost666,this shots gonna have to tide me over spent about $400 on dope this week,,1551489906.0
awc48o,https://www.reddit.com/r/opiates/comments/awc48o/subs_to_short_acting_opiate_to_detox_rapid_easier/,5,https://redd.it/awc48o,burnwhendone123,Subs to short acting opiate to detox rapid easier.,Any one got experience of switching from a low dose of sub like 1mg a day over to a short acting opiate for a week or couple days however long that way the wd only last a few days instead of a month like with the subs. What short acting Would you use and how long what dose to taper. Thanks for any ideas ,1551488916.0
awc1q2,https://i.redd.it/cz1wvlp6ulj21.jpg,11,https://redd.it/awc1q2,TrappersAnon,Chinese takeout (sweet & sour) & .2 shot of good ass H for dessert!,,1551488446.0
awbyjy,https://www.reddit.com/r/opiates/comments/awbyjy/how_long_after_these_damn_subs_can_i_smoke_some/,2,https://redd.it/awbyjy,assballsandspagett,How long after these damn subs can I smoke some?,"So I am on subutex pills the ones that are just straight buep, I took about 4mg today, how long till I can feel dole again?",1551487851.0
awbr2d,https://i.redd.it/kt801xjbolj21.jpg,23,https://redd.it/awbr2d,caughtyoulookinn,Definitely gonna be a good weekend 😎,,1551486470.0
awb8r6,https://www.reddit.com/r/opiates/comments/awb8r6/i_think_i_got_fent_for_the_first_time_need_advice/,11,https://redd.it/awb8r6,curiousjorgecostanza,I think I got fent for the first time. Need advice.,"Picked up some blues from my guy, he told me they were pressed. I’m somewhat naive to this whole deal so I figured that meant the person just pressed the pills themselves but with the proper mixture etc. 

Hit one today. It was hell. 20 minutes after snorting, I find myself just staring at the tv, ears ringing, tunnel vision, etc. I never really felt afraid for my life as I was breathing fine and still alert to an extent. Everything subsided after about another 20 minutes but I’m still feeling kind of rough. 

Anyway, this whole experience has made me wonder if any of this is worth it? I’ve been able to chip successfully for several year without any major concerns. However, the last few pickups have not had the right high that I’ve been looking for. It seems impossible to get anything pure. It isn’t because of tolerance because I never take any more than 30mg once a week. It just seems like everything is fake shit and I don’t wanna dance with the devil at all. 

What are you guy’s thoughts? I feel like I’ve already made my decision but  just curious if there is any way to find anything legit anymore. ",1551483291.0
awbcrr,https://www.reddit.com/r/opiates/comments/awbcrr/alternate_online/,18,https://redd.it/awbcrr,paulfart_mallcop,Alternate Online,"Ever since the banning of our beloved state-to-state directory, copping in a new place has been so hard. I hate cold copping, and having to cough up a few extra bucks for a stranger to help you out. Since then I've been looking for an alternative, on craigslist, and even whisper. But those alternatives are filled with cops and scams, so I was wondering what the best alternative is now? If this isn't ok, sorry, I would never try and fuck with my favorite sub, so let me know. ",1551483961.0
awb6zf,https://i.redd.it/jftpr9kydlj21.jpg,9,https://redd.it/awb6zf,friendofbillss,Happy Friday y’all,,1551482987.0
awb6bk,https://www.reddit.com/r/opiates/comments/awb6bk/being_forced_into_my_first_na_meeting_tonight/,33,https://redd.it/awb6bk,DrugsOverLove,"Being Forced Into My First NA Meeting Tonight, What Are They Like?",My girlfriend really wants me to go into an NA meeting tonight now that I’ve been off methadone for a month. What are they like? I hear they preach about god? I also hear they preach absolute abstinence from anything that intoxicate you. I personally do not see the benefit of sitting around listening to others complain about their lives. Maybe I’m missing the point here. ,1551482877.0
awb3jk,https://www.reddit.com/r/opiates/comments/awb3jk/is_30mg_of_morphine_fun/,13,https://redd.it/awb3jk,Nit400,Is 30mg of morphine fun?,Anyone enjoy 30mg ir morphine pills? Is it euphoric or how does it compare to blue roxy?,1551482408.0
awb09n,https://i.redd.it/xmp5mfokalj21.jpg,16,https://redd.it/awb09n,DocileFit,Sniff sniff / amazing prices it hurts,,1551481847.0
awatjd,https://www.reddit.com/r/opiates/comments/awatjd/detoxing_in_a_car_while_homeless/,20,https://redd.it/awatjd,fentfiends,Detoxing in a car while homeless,Tonight is our last night in  this hotel. We’re about 27 hours in but tomorrow we have no where to go so I guess we’ll be detoxing in the car. I’m tired of spending every penny we get but fuck I feel like we’ll die in the car,1551480704.0
awasxz,https://i.redd.it/a71sjrfq6lj21.jpg,7,https://redd.it/awasxz,Saint_ofAll_Killers,Made me think of the IVers on here. Stay safe,,1551480609.0
awapgg,https://www.reddit.com/r/opiates/comments/awapgg/30mg_morphine_ir/,1,https://redd.it/awapgg,throwitaway910,30mg morphine IR?,How does this compare to roxy? I’m sure not even close but curious of people’s first hand experiences. What is the common price for it?,1551480020.0
awadap,https://i.redd.it/8nxr8gj6zkj21.jpg,5,https://redd.it/awadap,Spencerlovesmed,25 oxy 10s(-3 of coarse lol) and 16 or so somas (-2.5 or so as well)for a nice boost for the friends next to them I think they compliment each other well. Hey better than nothing right happy Friday folks!! My OT at work tomm will be a bit better lol. Haven’t seen these certain round ones before but,,1551478018.0
awabqe,https://www.reddit.com/r/opiates/comments/awabqe/withdrawals_before_the_new_age/,6,https://redd.it/awabqe,lebrunjame5,withdrawals before the new age,"i wanna start this by saying that obviously nothing can totally fix withdrawals other than the drug ur withdrawing from.. but i was thinking.. how the hell did people get through this shit in the old days?? now with the internet you can watch unlimited movies/TV, read any book you want.. video games.. you can connect to talk with others on here, even order fuckin food or gatorade to your doorstep with ubereats or postmates. i cant even imagine what wd was like before all this was around. any oldheads here to tell me what they used to do to pass the seemingly turtle slow time on the clock? would be interested to hear some stories/things people used to or still do to pass the time",1551477775.0
aw9m9a,https://i.redd.it/j7fx7fijmkj21.jpg,16,https://redd.it/aw9m9a,poppin_4resh,"After an awesome promotion and moving to a new city for work, I stumbled upon somebody with a legitimate script. Copped 20 of these beauties Happy nods and stay safe everyone.",,1551473767.0
aw9p98,https://www.reddit.com/r/opiates/comments/aw9p98/please_help_need_advice_and_some_reassurance/,6,https://redd.it/aw9p98,Throwaway464738,"Please help, need advice and some reassurance.","I'll try to keep this short, semi long time user, 3-4 years of oral opiate usage, at my highest I was at 400mg morphine per day. I had a few short breaks of abstinence but always ended up back where I started. I eventually tried heroin and after a month decided enough was enough. My family helped me to get help along with my amazing partner.

Until last week I had been on buprinorphine for 7 months, I constantly felt horrible and wanted off as quick as I could. I still feel the same way physically, constantly fatigued, lethargic, no motivation to live or even move and waking up each day is a challenge. I can tell there's something wrong with my body.

I seen that some users can have issues with dopamine regulation after kicking the habit and I was wondering if any of you guys had first hand experience or advice, maybe even some motivational words to help me get through this feeling as I'm sure this is what is causing my symptoms. If you have any other ideas or advice please feel free to comment too. It's very hard to find anyone who has managed to break the habit where I live so outside of the internet I don't really have anyone who knows what it's like.",1551474235.0
awa28h,https://www.reddit.com/r/opiates/comments/awa28h/iv_suboxone_pills/,14,https://redd.it/awa28h,iZonked,Iv suboxone pills,Anyone had experience IVing suboxone pills? Thinking about doing seeing how I just crashed my car omw to pickup so now I'm stuck at home. Lemme know ,1551476293.0
aw9ud7,https://www.reddit.com/r/opiates/comments/aw9ud7/10_years_of_thiswhats_my_future/,18,https://redd.it/aw9ud7,donaldo-raymond,10 years of this...what’s my future?,"Ramped from 1 to 2.5 norcos, taken friday Saturday and Sunday for the last 9 and a half years. Been fooling a lot of people to do it. Always a 4 day break between doses (I am a routine kind of guy). Trying to get off on my own with tapering. How much harm have I done and how hard will this be. I know it doesn’t sound that bad but 9 years? I had a huge meltdown a week ago and I need to get off this shit... any help",1551475028.0
aw9wr4,https://www.reddit.com/r/opiates/comments/aw9wr4/tramadol_for_the_first_time/,2,https://redd.it/aw9wr4,Quentinthinkhetrips,Tramadol for the first time,"I got 2x150 tramadol from a freand, i wounder if its a good idea to smoke a bunch of weed on it? And if yes when is the best time to do so 😋",1551475410.0
aw9z2w,https://www.reddit.com/r/opiates/comments/aw9z2w/drug_testoxy/,3,https://redd.it/aw9z2w,Dirtybeard18,Drug test/Oxy,I’m probably just being paranoid but I sniffed 10mg rosy today and I got a drug test Tuesday or wends day will I be okay?,1551475791.0
awa1l5,https://www.reddit.com/r/opiates/comments/awa1l5/i_have_a_lazy_eye_please_help/,12,https://redd.it/awa1l5,dopedupghost666,i have a lazy eye please help,so lately when i get high ive been getting a major lazy eye & its fucking up my vision & im afraid this will become permanent any help  or facts is appreciated ,1551476183.0
aw9xvd,https://i.redd.it/fgqrvxsyrkj21.jpg,15,https://redd.it/aw9xvd,yungdillyboy,Y'all know wtf is going on here.. this shit here taste so bomb!god damnit I seriously cant believe how good this smokes!.. out of all my time of having access to a lot of these I MISSED OUT..,,1551475591.0
aw9v8w,https://www.reddit.com/r/opiates/comments/aw9v8w/fentanyl/,6,https://redd.it/aw9v8w,IdidntHitHerIdidNOT,Fentanyl,"After taking 4 lung fulls of vaped fent (foil and tooter), last night, I would nod off and wake up talking to myself. My wife said that I was having full on conversations with myself. This happened about 3 times last night and I am sorta freaked out that I'm losing my mind...? This has never happened to me on heroin or any other opiate. Should I be concerned? It felt pretty fuckin weird.",1551475172.0
aw9tgc,https://www.reddit.com/r/opiates/comments/aw9tgc/fentdope_vs_dope_ecp/,6,https://redd.it/aw9tgc,SirSniffs,Fentdope vs Dope (ECP),"I recently bought 3g of straight up 100% dope(tested) when I was using fent dope for about 2 months. I always thought dope > fent(Euphoria wise not strength wise ). I hated the real dope , I understand tolerance and such but I'm just confused. If you never touched Fent by this time im happy for you. Im just preparing for what w/d Im gonna have to go through. Sad part is this Fentdope is grey and has legs for 6-7 hours. The brown was disgustingly bad and just wanted to do more. Right now I did like a 0.2-0.3 and I feel better than when I did a whole G (Little by Little)",1551474886.0
aw9s5o,https://i.redd.it/5ma9tio9pkj21.jpg,5,https://redd.it/aw9s5o,tampa91,10 days off subs.. think i’m detoxed tbh.. got scripted 60 .5 kpins on day 7. things been okay..,,1551474683.0
aw9pxs,https://www.reddit.com/r/opiates/comments/aw9pxs/0552_5mg_question/,1,https://redd.it/aw9pxs,volcomstoned420,0552 5mg question,These  0552 m box 5's are just straight up right?  So I'm good to sniff?  Just making sure before i take the whole script that they don't have anything harmful in them. Lol thanks for the help.,1551474333.0
aw9h8i,https://www.reddit.com/r/opiates/comments/aw9h8i/is_there_a_way_to_quantify_murphys_law_when_it/,9,https://redd.it/aw9h8i,Randomuser12345666,Is there a way to quantify Murphy’s law when it pertains to drugs?,"So I finally got a check that I’ve been waiting on that would keep me well for a few days. Low and behold, everyone is out of everything except for some overpriced Norco 10s. Bought 18 for 180. I refused to be dope sick another day. Everyone is out of Oxy. I should’ve been more specific in my prayer last night when I asked God to bless me with painkillers today. I mean, he came through but with a little bit of sarcasm attached.


But back to my original question, how many of you get money and can’t find shit but when you’re broke, people have pills for days?",1551472968.0
aw98ug,https://www.reddit.com/r/opiates/comments/aw98ug/dihydrocodeine_advice_needed/,3,https://redd.it/aw98ug,Lisa_star,Dihydrocodeine Advice needed!,"I usually take codeine, 150mg x 2 or 3 times per day.
I have some dihydrocodeine here to try but have a couple questions.
1. If I've already had 2 doses of codeine today (last one was about 5 hours ago) will I be ok to take the dhc? 
2. Should I take about 1/2 the amount as I've heard it's roughly twice as strong? And I'm always worried about side effects.
Thanks guys. ",1551471648.0
aw92u0,https://www.reddit.com/r/opiates/comments/aw92u0/music_is_better_on_opiates/,14,https://redd.it/aw92u0,CokedUpEng,Music is better on opiates,"Especially through headphones!!!...Just had two pints of beer and popped two 30s for lunch now sitting here at my corporate desk job headphones plugged in without a care in the world. 

Stay safe this weekend bropiates ",1551470705.0
aw8zy9,https://www.reddit.com/r/opiates/comments/aw8zy9/whats_your_current_oxy_dose/,9,https://redd.it/aw8zy9,mattiowa100,What’s your current oxy dose?,"Kind of an odd question but I find my tolerance building quickly taking 30mg per dose, just took 60mg and feeling good.

What do you take per dose right now? I need a tolerance break. ",1551470264.0
aw8zkq,https://v.redd.it/m731l1zxbkj21,23,https://redd.it/aw8zkq,boofxans,When you're 5 minutes late & the dealer sends you this,,1551470217.0
