aiicw1,https://www.reddit.com/r/opiates/comments/aiicw1/to_the_guy_posting_about_ny_having_trash_and/,0,https://redd.it/aiicw1,IVprincess,To the guy posting about ny having trash and copping off cl,"Every cl person I talked to was a straight scammer, how tf did u not get robbed? And be careful trying random stamps, there’s a ton of fent going around the city rn in random stamps that have never being around. Stick to your local guys, sooner or later your gana get a hot bag. A couple buddies of mine have fallen out just doing half bag testers from fandoms. Be careful bud. ",1548125817.0
aiiaiv,https://i.redd.it/3kej3fv12wb21.jpg,0,https://redd.it/aiiaiv,mycelium-magic,What I got rn. 7 Oxy 10mg k 56 and 5 Hydro 10’s M367... Pink + White like Frank Ocean,,1548125374.0
aii8yz,https://www.reddit.com/r/opiates/comments/aii8yz/warning/,2,https://redd.it/aii8yz,NotAllThoseWhoWand3r,WARNING,"Just wanted to give a heads up to everybody on here. There's a user that will send you a direct message claiming he/she is affiliated with a ""referral only"" delivery service and give you the details and how to contact them. They will ask for a bitcoin payment. This user makes it all sound really legit so don't respond to any messages that claim to be a reliable hook up!",1548125079.0
aii8ln,https://www.reddit.com/r/opiates/comments/aii8ln/replenishing_dopamine_advice/,0,https://redd.it/aii8ln,szCzs,Replenishing dopamine - advice?,"Do you guys and gals take any supplements or can give any advice how to replenish my dopamine quicker after opiate binges.

Many thanks!",1548125009.0
aii6fg,https://www.reddit.com/r/opiates/comments/aii6fg/hey_b_whats_wrong_with_this_picture/,0,https://redd.it/aii6fg,realcat67,Hey B - What's wrong with this Picture?,"So you say you're down for the nod. That you want to ride that black horse and dream the opiate dream.

Cause after all, we are having so much fun partying with other junkies not and driving into the hood, chasing that shit and spending all our money. My buddy tells me he is in love with heroin. Literally. He doesn't want a woman. He doesn't care about a house or a car. He just about that thing, and has been for 10 years.

And when you get locked down, which one way or another will totally happen at some point, you can say, shit, I didn't want that white bread life anyway! Bad America!!

Yeah, man, check out these bags of dope! And these pills - whoa, what a wet dream! You crave that shit and if you pull somebody else down with you, oops, my bad. Good thing there are no shortage of people cause I just messed that one up.

And just to be thorough let's mention abscesses, endocarditis, sex diseases, money we never pay back, the lies we tell, the hearts we break and everyone we totally destroy like Hindu war gods on a rampage. Talk about nightmares. We own it.

Sorry, guys. I happen to be in a bit of a dark mood. I'm already quit and these pictures from what I presume are young dudes disturb me. 

Every word on this page is my own bullshit and I apologize in advance if I offended anyone. 

&#x200B;

Peace!",1548124580.0
aii13p,https://i.redd.it/ildd7skqwvb21.jpg,9,https://redd.it/aii13p,cashingoutATM,Check the date¥ been running through scripts since 99😂😴,,1548123585.0
aihofr,https://www.reddit.com/r/opiates/comments/aihofr/its_about_time/,1,https://redd.it/aihofr,Monnie28,It’s about time,"Well, it’s about time for me to say goodbye to my lovely opiate filled dream. I had two years clean back in 2017 and decided to “use for a week” and two years later, using everyday, went from dilaudid to dope, spent countless amounts of money, and mostly, I’m sick and tired of being sick and tired (sorry for the cheesy cliche but it’s true). I’ve got subs, Xanax, weed, gabbas and flexeril so I should be okay. Wish me luck opi fam. It’s too scary out there for this addict and too many loved ones have died for me to keep going. I’ll keep y’all updated and wish everyone the best!",1548121211.0
aihnsd,https://www.reddit.com/r/opiates/comments/aihnsd/i_need_to_share_this_cuz_i_have_to_get_this_off/,14,https://redd.it/aihnsd,freedagoat2169,"I need to share this cuz I have to get this off my chest. My mom confronted me today after she found my pills. And everything she said was right, I feel so bad now I can’t stop crying I broke her heart. She gave me all this and this is how I repay her...","So I come inside and my moms doing some cleaning. I say hi, and have a seat. 

She sits down besides me and tells me “I just want to talk to you normally. I promise I won’t be mad I just want to talk to my son. Just be honest and don’t yell at me.

So I say, “what now mom?”

She confronts me about some oxy she found, and then breaks down and says all this 

“Why do you need these ? What’s happening with you?  I’m your mother I’m here to help please tell Me. Anything you’re going through/ feeling you can tell me. 

Meanwhile I just keep acting like a asshole and yelling and denying it

She says “you think I don’t notice you wasting your young life away in these four walls at home all day? You think I don’t notice you nodding off at the dinner table? You’re my son I’m supposed to notice these things. You really think I don’t notice you staying in bed all day everyday ??? You think I don’t notice money missing from my purse? I just don’t say a word because in my mind I refuse to believe that you really did these things. In my head you’re still my innocent son. Please just talk to me what are you going through that’s making you use these ?”

It seems she has a a very good understanding that a addict usually goes through a lot of problems like depression/anxiety that lead them to use. She kept focusing on WHY/ WHAT FEELINGS drive me to use? Instead of just putting me down for using. I never expected this but she totally understands 


But then she broke my heart when she said this 

“Do you know that I cry myself to sleep every night? You don’t see how you’re slowly destroying yourself but you are. No mother wants to live to see her son/ daughter get to this level. I can see you’re hurting son. You stay inside all day with your eyes glued to your phone while all your cousins and associates you grew up with are out and about and thriving. Do you know how much I suffer because of this? What is the meaning of ME living anymore? I raised you and tried to set you up for success and seeing you struggling in life is killing me. I might as well not be here. Go ask your dad how I cry myself to sleep every night.”

.
Point is this woman READ me like a book. She knew everything. She mentioned noticing when I’m on it and how I act and everything from my voice changing while on it, to nodding, to me stealing etc. 

And most important she didn’t judge me, she instead wanted to know what’s going on with me mentally that’s causing me to do all this?



And what do I do? all I did was deny and say I was just selling them... 

And now I’m in my room curled up crying. Crying because I’ve caused this woman who gave me everything I ever wanted in life so much pain 


I don’t want to regret this in the future. When my parents are gone and I’m visiting their grave I don’t wanna look down and say I disappointed them. And caused them to suffer. 


Her words keep echoing in my head. She told me “you’ll never know how this feels till you have a kid yourself and they do the things you did”


And that’s when I realized it would kill me if my son did these same things. I’d be worried every second. I love you mom I totally get you






This needs to stop. I can’t keep doing this

Gna take a small break from Reddit. Love you guys all. ",1548121085.0
aihm6o,https://i.redd.it/6shgcdmbovb21.jpg,8,https://redd.it/aihm6o,throwaway666718,"Heroin first time, can I snort this?",,1548120783.0
aihjv7,https://www.reddit.com/r/opiates/comments/aihjv7/i_think_its_time_again/,1,https://redd.it/aihjv7,drkravey,I think it’s time again.,"Sorry for the shit post. 

Just looking for some positive thoughts. I’ve been using blues for around 4 years and h for around 2. I can feel myself starting to slide off the deep end. I’ve been getting purple fenta dope for like 3 weeks. At this point a half g snorted won’t even make me nod or even really high anymore. Just well. I have one point left and a half a 30. I’m planning to use this tomorrow before band practice and then not buy anymore. 

I’m assuming this purple shit is a mix of nasty fentalouges and I’m going to want to die during w/ds I have lots of Kratom but I’m going to attempt to just use it at night so I can sleep. 

I want to be done with this shit. I make so much money that if I went without opiates for 2 months I would be able to pay off all my debts and in 4 months be able to buy entire studio setup. It makes me sick how much money I waste. It also doesn’t help that I’m being sued by a credit card company for an unpaid sum of money. I go to court for that next month. 

Anyways I don’t really need any info as this will be like my 20th time detoxing but any kind words of encouragement would be dope. As always while in w/d I’ll be checking this sub religiously to vicariously live through you guys. 

Happy nods guys. Hopefully this time I can make it stick for more than just 2 weeks. 

If I can’t I’m thinking I should look into methadone, I’ve never done that before but if I keep this shit up its all going to blow up in my face.",1548120339.0
aihgwv,https://www.reddit.com/r/opiates/comments/aihgwv/smoking_4/,2,https://redd.it/aihgwv,BlazedAF1718,Smoking #4,Any tips to smoking #4 ecp off foil? I usually just empty a bag onto the foil and apply heat but is there ways to make it last longer i tried running it on the foil but this shit dont like to run and it burns up quick.,1548119805.0
aihguy,https://www.reddit.com/r/opiates/comments/aihguy/about_to_go_into_withdrawal_in_arguably_the_worst/,3,https://redd.it/aihguy,cultmemberf,About to go into withdrawal in arguably the worst place possible.,No locations so I will just say it is known for dope and I have no more plug so the irony makes the coming sickness so much worse.  Sometimes this sub makes it worse seeing all the action and knowing I am on an unnecessary island.   Good times. ,1548119797.0
aihchb,https://www.reddit.com/r/opiates/comments/aihchb/how_to_flush_your_system_quick/,4,https://redd.it/aihchb,MagicJackalope666,How to flush your system quick?,"Vitamin, supplements, tea etc?",1548118997.0
aih99z,https://www.reddit.com/r/opiates/comments/aih99z/fuck_its_cold_out_here/,5,https://redd.it/aih99z,estunn883,Fuck it's cold out here..,.. it's cold out here for a junkie. Waiting and having my skin crawl so much harder in this sub- freezing weather bullshit. I swear the withdrawal is made 10x worse in the winter. This post is bullshit. But fucki it. Enjoy. Love you all xoxo,1548118389.0
aih2vn,https://i.redd.it/5643n7svdvb21.jpg,15,https://redd.it/aih2vn,BLUE-THIRTIES,"Once I find out that there’s fire going around town, I have to cop as much as I can !!",,1548117245.0
aih0h0,https://www.reddit.com/r/opiates/comments/aih0h0/general_wondering/,1,https://redd.it/aih0h0,mm4rie,General wondering...,"Do suboxone strips make you not necessarily want to smoke cigarettes less as well? I kind of felt that way earlier.

edit. ",1548116804.0
aigvgu,https://www.reddit.com/r/opiates/comments/aigvgu/do_you_belive_you_can_be_instantly_addicted_to_a/,8,https://redd.it/aigvgu,oneshotnicky,Do you belive you can be instantly addicted to a drug?,Or do you think mental addiction has to develop through a series of choices over time?,1548115927.0
aigv7h,https://www.reddit.com/r/opiates/comments/aigv7h/thank_u/,1,https://redd.it/aigv7h,6416jess,Thank u,Thank u to everyone that answered my question earlier. He actually ended up just doing sum cocaine and it helped along with taking a walk in this cold weather. Thanks again!!!,1548115883.0
aigilx,https://www.reddit.com/r/opiates/comments/aigilx/figured_it_was_time_to_share_this/,9,https://redd.it/aigilx,Lolmylifesshit07,Figured it was time to share this...,"	Just want to start off by saying thank you, to all of you. You have given this broken down hopeless junkie a place to finally feel at home. A place where i can share my failures and successes and not feel judged. A place where everyday i learn something about others and their struggles, this sub is amazing. SOO idk why but i feel it's time to share this.


	I have been a long time lurker, but have become more active after my most recent stay in rehab. This was my third try that year to get clean and i was determined. I was ready to all i had to,  I was desperate just be be normal again. I did my 90 in 90 at one of the best treatment facilities i have EVER stepped foot in. They truly cared, all the counselors and staff had themselves been in the life. It was nice. 


	Now fast forward too two weeks after i came home… now this is something im still dealing with trying to understand things happen and recovery isn't perfect. However i knew. I FUCKING KNEW all along i was going to do this, so why leave a safe place where i had finally managed to get 90 days under my belt because...im an addict and that's what i do reckless shit. So needless to say it wasn't too long after coming home i found myself with a needle in my arm, and ever so swiftly swept right back into the life. Sad fucking truth here i loved it. It was everything that i missed. Fuck me right? So my use continued for about another week or so. Three bundles all together. 


	Well around the start of the new week i had gone to grab my shit, hurried home and fixed my shot, if you check my post history you can see the one im talking about… Anyways something fucking happened. I did my shot went to relax and i couldnt. For some fucking reason all my shame and guilt decided to hit me right then and there. I fucking broke. I got up and went to the mirror and there he was my full fucking blow addict self, How did i let this happen? Why did i let such a good thing go for what?! 10 fucking minutes of relife. In that moment i fucking hated myself. Like nothing i have ever felt before. I had to do something.


	I told myself i was done. Honestly and truthfully done. So i Cold turkeyed it. It sucked i had the flu on top of some pretty shitty Wd’s. But guess what mother fuckers i made it! Im 32 days clean right now with no subs or anything besides a little bit of green in the beginning. I can't really explain what's happened, maybe it’s for the first time in my life it was ME who made this choice to stop. No one else’s. No interventions, No jail, Just me saying enough is a fucking nough. Today i am sober, Today i feel good. And that’s all i can ask for.

Ill keep you all posted on how things go from here on out.


",1548113679.0
aiggvw,https://www.reddit.com/r/opiates/comments/aiggvw/got_some_food_on_the_way/,2,https://redd.it/aiggvw,E36nick90,Got some food on the way!,"This is a total shitpost but my buddy was trying to trade some EBT for a little piece of heaven. I obliged and had him pick me up some papa Murphy's pizza 2 family size pies, little personal pizza for my girlfriends kiddo and a couple two liters. That little browser add-on ""Honey"" did it's thing and saved him some money too. It saved like $6 or something like that. Annddd it only cost me a point. I'm giving him two points to be nice but he only asked for one. He will be stoked, I'm stoked and my girlfriend better be stoked when she gets back and food is taken care of lmao. ANYWAYS I'm going to end this shitpost now, go turn the oven on to 425 and in about 5-10 mins I'll be cooking some 🍕",1548113388.0
aigf07,https://www.reddit.com/r/opiates/comments/aigf07/my_drug_history_my_life_for_6_months_in_a_youth/,4,https://redd.it/aigf07,Randomuser12345666,My drug history + my life for 6 months in a “Youth Wilderness Challenge” a.k.a. Legal Guantanamo for Minors+ my current situation,"Someone requested this (kinda) so here it is.


Drug abuse. Something that has followed me for most of my life. But this is all before my wreck at age 17 that made it to where I needed pain pills for real for real.



I’ve been using drugs since I was about 11ish. Took my first perc at age 10 for an injury. Then at 11 i was abusing my Focalin Script by doing 3 at a time. I didn’t really know what i was doing, I just knew it felt better than I usually felt. At 12 I hit my first joint. By 13 I was smoking weed everyday.



At 14 I was copping big 300 count bottles of .25 Xanax that my gma (who is now dead) used to get every 3 months from Hospice but she’d never use but like 50 a month so I’d take the remainder at the end of the 3 month period. I was eating them like candy and selling them. Also at 14 I took my first Lortab and smoked opium.


At 15 I was taking Tabs, xanax, and any other pain pill I could get my hands on. I also tried my first OC (the last year you could get them before the dreaded OP formula change). At this point, I was smoking weed and taking molly DAILY and didn’t give a fuck if my family knew or not. 



At 16, after using every hallucinogen possible including RCs I was ordering myself, my mom got to the mail before I did. She came home early from work.... in there was 4gs of 3-MeO-PCP and that was the final straw. The next week, She got me in the car about Noon (I had eaten Shrooms I had picked myself about 3 am so I was coming down), told me we’re going out to eat in a big town an hour away, we went on this back road and BOOM! Our car gets stormed by these people that worked for the Youth Boot Camp, mom had set me up, and they were yanking me out of the car, and dragged me onto this side dirt road that led straight into the Boot camp. 


I was there for 6 months. Psychological torture and manipulation was their main game, physical labor and constant exhaustion to weaken the spirit. I was constantly suicidal.


They would tell me my family didn’t love me, that my girlfriend at the time had sent me a break up letter telling me she hated being with a druggie (I knew that was a lie because she used weed and molly with me every day), that my dog had died, and just reminded me that I was a horrible person.


They took my letters, made sure I didn’t say anything like “this place is making me suicidal!” Or “please come get me. I don’t think I can make it.” Or anything that asked about the outside world or anything that they deemed to be “not up to standard”. They would redact my family’s letters to make sure I didn’t know anything that would bring me any type of joy.


I wasn’t going to make it.



I kept these poisonous berries that grow in my state in my pocket the whole time I was there. 1 to go to the hospital, 2 for death in a day, 4 is death in an hour. I never used them but you see how far they pushed kids from 12-18. Pure unadulterated torture masked in fake letters written to our parents of our “progress”. I have diagnosed PTSD, MPD, and MDD because of that place.... 


Finally, my mom came and picked me up after 6 months. Only thing that place gave me besides a ton of mental illnesses, was the ability to lie and hide with the absolute best con artists. 


So I was back home, age 17 now, using weed to mask my depression and suicidal thoughts. I stayed away from most drugs for a little while.


Well, then I had my car wreck. I had been back about 10 months. My buddy(driving) and I were going to pick up a friend from a party. I had taken a 5-MeO-DMT chocolate. We ran off the road. I wasn’t wearing a seatbelt. I ended up almost being ejected from the car. The doctor said the only reason I survived was that my body was like silly putty because I was tripping so hard. I was prescribed perc 10s. 


That was the beginning of my long road of opioid dependence.


After the script ran out, I was still in pain. I have 2 herniated discs and a pinched nerve in my neck, one HD in my back, and a broken rib that wasn’t healing as well as I’d have liked. I was 17, no doctor would treat me.


My buddy brought over a 30mg Roxy. He knew I was in terrible pain. I liked them, So he had told this kid that sold him this one that they were worth 3 a p and got the kid to steal his dad’s script. We bought 90 30s for $270. I had finally capture the relief I had been begging for.



Fast forward all these years later, the blue handcuffs are still on me. I’ve been treated here and there for my chronic pain but even now as a 24 year old, docs will treat me for 3 months, then drop me due to my age. 


I don’t know how to end this exactly but with this.



I pray that one day, I will be able to be treated as the patient in pain that I am rather than them see me as an overweight 24 year old that “just needs to exercise the pain away”.  Maybe one day. As I’m typing now, my neck won’t fucking stop stabbing and my lower back is tightening up. I was dope sick till about an hour ago. But it’ll soon return. Banks are closed today so no monies for me till in the AM.",1548113071.0
aig175,https://i.redd.it/jgnacznsuub21.jpg,8,https://redd.it/aig175,jlogic420,Just a lil sumn sumn. Can't snort but can pop 8 immediately lol,,1548110826.0
aifwqf,https://www.reddit.com/r/opiates/comments/aifwqf/are_morphine_60s_any_good/,12,https://redd.it/aifwqf,dustywalk,Are morphine 60s any good?,"I eat anywhere from 60-80 mg of oxy every few days or so and my guy just told me he has some morphine 60s ir, are they any good? I’ve never tried them. Thanks for any answers ",1548110109.0
aifdrq,https://www.reddit.com/r/opiates/comments/aifdrq/is_there_a_methadone_calculator_to_determine_how/,3,https://redd.it/aifdrq,RedditUser1512,Is there a methadone calculator to determine how much is in your system?,"Hi is there a methadone calculator to determine how much is in your system and how long it will take withdrawal to start? 

&#x200B;

On day 5 no methadone after doing a quick taper of  4 days after using h for 2 weeks and before that being on methadone for 3 days at 50mg a day and before that 1g a day habbit for a year. this first taper at 50mg a day didnt work. by day 4/5 i was in heavy withdrawal and i relapsed.

&#x200B;

this time arround i did  40mg the first day 20mg the second 20mg the thid and 5-10mg the last day

its the nigh of day 4 but pretty much day 5 and and i have no withdrawal symptoms.

&#x200B;

is there a way to calculate how much methadone is in my system if any. 

or has this double taper maybe helped somehow",1548107194.0
aif36r,https://www.reddit.com/r/opiates/comments/aif36r/back_when_i_was_at_my_worst/,5,https://redd.it/aif36r,firsttube207,Back when i was at my worst -,"I dont miss those days. But.  It was never enough

http://imgur.com/gallery/9wOHpNK",1548105637.0
aif1q8,https://www.reddit.com/r/opiates/comments/aif1q8/need_an_answer_asap_please_some_one/,16,https://redd.it/aif1q8,6416jess,Need an answer ASAP please. some one,Is it possible to give someone just a little narcan if they feel like they did a little too much and just don't wanna be as high as they are? I have a friend right now that is NOT od but is more high than he'd like to be. Is it possible to just give him a little to bring down with out putting him into withdrawal? He is an on and off again user and been back on for 3 weeks,1548105415.0
aif1a4,https://i.redd.it/05r42uuheub21.jpg,18,https://redd.it/aif1a4,OpiatedMinds,"Hood-Eaze, functional fashionable & ""smart"" urban junky-wear...",,1548105346.0
aiezem,https://www.reddit.com/r/opiates/comments/aiezem/thank_you_mlk_blvd/,18,https://redd.it/aiezem,MetroMaker,Thank You MLK Blvd,"Trying to cop in the neighborhood. Freezing my cojones off.  The only white man waiting on the bus. Winter is tough w/o a car. Finally dBoy comes threw. It's been ten minutes for the last hour, but he's my best friend right now. Get home. Fix. So warm in my opiate blanket. The world is a cold place and this is the life I live. Like Church Girl says, I must like it. ",1548105065.0
aiewmm,https://i.imgur.com/Gv63Lu8.jpg,8,https://redd.it/aiewmm,MEOWned,Let me see your stash kits and stash boxes - post your pics!!,,1548104688.0
aierni,https://www.reddit.com/r/opiates/comments/aierni/fuck_addiction_is_no_joke/,18,https://redd.it/aierni,EskomojoE,Fuck addiction is no joke,"Many of you have seen my recent posts so I'll try and keep this brief. 

I was 6 days off a fent/h/rc mix.  Even though i was 6 fucking days i still wasnt in WDs...Then i found out my best friend died. So i did what most of us would do, i went and copped to try as feel as normal as possible. 

Fast Forward to today,  i have been weaning off the rc mix by using low doses of fent free shit.

I picked today to stop because i had a ua for a dream job. I used someone else's clean pee and passed. 

I have enough of the weakest stuff i had to get me through the night. But all i want to do is cop more of that fent mix.

How tf can i be so close, but am so close to staying at square 1?",1548104081.0
aiegqn,https://www.reddit.com/r/opiates/comments/aiegqn/first_time/,10,https://redd.it/aiegqn,Kfclover1245,First Time,I recently got 1 5mg hydrocodone and 1 2mg diludad is this going to do anything and is there any way I can potentiate this ,1548102887.0
