8bjvv2,https://www.reddit.com/r/opiates/comments/8bjvv2/withdrawal_symptoms_after_two_weeks_of_percocet/,19,https://redd.it/8bjvv2,Clynnsays,Withdrawal symptoms after two weeks of Percocet use??,"This may be a really lame question but.......just stopped two weeks of post-op Percocet yesterday. I took every 4 hours or so and tapered the last two days. Woke up this morning feeling like a truck hit me , along with bad diarrhea. Could this be withdrawal symptoms?? I just wouldn't think two weeks would cause something like this. Just thought I'd ask. TIA

Edit: friggin grammar",1523475149.0
8bjnvr,https://www.reddit.com/r/opiates/comments/8bjnvr/is_morphin_sulfate_smokable/,4,https://redd.it/8bjnvr,LetsGetFloated,Is Morphin sulfate smokable?,,1523473495.0
8bjdf4,https://www.reddit.com/r/opiates/comments/8bjdf4/is_this_real/,12,https://redd.it/8bjdf4,Umadbro1024,Is this real,https://imgur.com/a/Wb40A the markings are dead on breaks In  half hard and sparkles when u shine a flashlight on it,1523471261.0
8bjcl5,https://www.reddit.com/r/opiates/comments/8bjcl5/dilaudid_and_oxy/,11,https://redd.it/8bjcl5,Zyloh420,Dilaudid and oxy,If you had like a 45-60 mg oxy tolerance and not willing to iv only snort and boof and had the choice between 5 8mg dilaudid or 5 30mg oxy what would you choose I’m already buying 10 dilaudid but I was thinking taking some oxy orally to boost the dilly or should I just go with dilly?,1523471085.0
8bjbmg,https://i.redd.it/nrqanobhnbr01.jpg,12,https://redd.it/8bjbmg,dyingsober,"Before I used, I would watch him use just like I do now. We’d pick up and pull over on the parkway to a service station",,1523470894.0
8bj9h3,https://imgur.com/a/dEPLb,6,https://redd.it/8bj9h3,Algoresdog,Last lines,,1523470469.0
8bj8m1,https://www.reddit.com/r/opiates/comments/8bj8m1/still_homeless_guys_detox_denied_me_twice_this/,38,https://redd.it/8bj8m1,SmokeFent780,"Still homeless guys. Detox denied me twice. This will be my last time talking to you guys. I am trading my phone for dope, as I am hurting .",Hey guys take care . I hope I make it thru this shit. I can’t believe it has come to this. Just a week ago I was living at home smoking a half a day and chillin.,1523470289.0
8biyf6,https://www.reddit.com/r/opiates/comments/8biyf6/anyone_ever_try_level_1_china_white/,14,https://redd.it/8biyf6,hailsatanordie666,Anyone ever try level 1 china white?,"Just ordered a 0.25g of his level 1, and since I’m a first timer hopefully I’ll get the extra 0.1g sampler added in. I actually saw a post here the other day talking about it and I was curious. 

I’ve quit taking my subs (16mg) a couple days ago so by the time it gets here next weekish, probably, I’ll be able to get a decent high. Been MONTHS since I’ve been able to IV some good dope. My skin is tingling and my mouth is watering for a nice good high! Just moved to CO so I don’t have a real life connection (not that I used to anyways)",1523468200.0
8biv4e,https://i.redd.it/s9krbw7kdbr01.jpg,31,https://redd.it/8biv4e,SixCylinder777,"A Little Rock, quite a bit of boy, some Valium, some 'done and some ambien... chilled night in 👌🏾",,1523467536.0
8biufo,https://www.reddit.com/r/opiates/comments/8biufo/goodbye_pills/,8,https://redd.it/8biufo,throwinitawayin87,"Goodbye, pills!!","I have finally found something to help me taper, and I have a close family friend to help me do it. He won't bend if I get a severe craving and ask him for one, either. I made him promise me he wouldn't (he has a soft spot for me).  
  
I was taking anything I could get my hands on. Lyrica, gabapentin, methadone, roxy 80s, oxy 30s, percocet 10s..  I became very sick recently when supply ran out. Had a very hard day. Went through a million suicidal thoughts, wanting to act on them so badly...just to make the suffering stop..  
  
After that day, though,  that god awful difficult fucking day....something in me changed. I feel it. I feel different already. My head is clearer. I'm not as depressed.  
  
I am seeing the light now, guys, and this community helped me through it. I know this account is young, but I've been a lurker on my main for a good while.  
  
Thank you,  everyone. Thank you for sharing experiences, giving advice, and being there for me and anyone else that needs it.  You're all life savers. Thank you.",1523467388.0
8bio0j,https://www.reddit.com/r/opiates/comments/8bio0j/2_ppl_in_2_days/,4,https://redd.it/8bio0j,Bmadd420,2 ppl in 2 days,I list a friend from high school yesterday 39 years old and got a message this morning another close friend only 32 years old died this morning both from heroin or possibly fent/heroin. ,1523466016.0
8bihg7,https://www.reddit.com/r/opiates/comments/8bihg7/75325_hydrocodone/,5,https://redd.it/8bihg7,deadbatterie,7.5-3.25 Hydrocodone,"So I have recently acquired some hydrocodone that's dosed 7.5-3.25. I know that means it contains APAP, so does this mean there are 3.25 g of APAP in it? I never take more than 30mg of hydrocodone, so if I was going to take three pills, would I need to do a cold water extraction? I don't want to ingest too much APAP, but I don't want to do the CWE unless it's necessary either. ",1523464649.0
8bih6a,https://www.reddit.com/r/opiates/comments/8bih6a/ran_throug_script_too_fast_but_ive_got_a_few/,6,https://redd.it/8bih6a,shantyslapcabin,Ran throug script too fast... but ive got a few grams of K..,"Anyone ever use K to substitute? Ween yourself down n out?

K just gives me cold sweats, will be tough using it at work also.. 

Thoughts?",1523464583.0
8bidik,https://i.redd.it/qy6aguvf2br01.jpg,9,https://redd.it/8bidik,jlogic420,Not a bad humpday,,1523463805.0
8bidf6,https://www.reddit.com/r/opiates/comments/8bidf6/day_3_no_dope/,18,https://redd.it/8bidf6,DOPExWONDERLAND,Day 3 no dope....,"Everything hurts :(....but soon sweet relief hopefully in the month

To those who want to try opiates

Let me tell you that this 
I wish i had never heard the word Heroin

Run away..,

For those who are wanting to quit 

I bielieve in YOU!!!!
if i can do it and endure this cold turkey with nothing but lope and hot showers then you can too!

And ill do my best to help you with each step you take, its not easy but its worth it

",1523463790.0
8bic1s,https://i.redd.it/g2qij8le1br01.jpg,3,https://redd.it/8bic1s,BloodySaint13,Them D8's for breakfast!,,1523463492.0
8biaks,https://www.reddit.com/r/opiates/comments/8biaks/dont_be_a_scumbag_if_you_shoot_up_in_a_public/,48,https://redd.it/8biaks,AnAssGoblin,"Don't be a scumbag. If you shoot up in a public bathroom, clean your shit please.","So I work in a chain drug store. The area around here is really rampant with heroin and other opiates since it's one of the more pure areas in the country and its pretty cheap.

I live in a bit smaller of a town, but I work in a pharmacy. We sell syringes to those who ask, and I don't have a problem because I am an ex-user or all different drugs so I know it's better to give them clean ones than to share or use old ones. THey are gonna do it one way or another, so I sell them.

Anyways, one night some undesirable looking people come back to the pharmacy, ask if there is a bathroom, and I tell them where it is. Immediately I know something is up, especially because at least 2 or more people came in for syringes right after another and that isn't a common occurence.

I go into the bathroom, I can't really do anything but a kid is in the stall, sitting, I hear a zipper and his pants aren't down.. so he clearly aint taking a shit lol. I leave and come back later to inspect the bathroom and I figured I would find some baggie, a syringe or cap or something.

I don't see anything, but then as I am about to leave I look at the toilet seat cover holder and THERES A FUCKING METAL SPOON IN IT!!

Seriously, what the fuck guys?! I've seen people leave cotton, caps, baggies, BUT A FUCKING SPOON? First of all the idiot is burning all of the fillers and bad shit into their solution and putting it in their veins.. but to leave a spoon man? Come on...

So I told my manager, the police were called and they inspected the videos and saw all of the people. They knew who the kids were ( small town), what car they were now in, who they were with and knew that they had drugs on them now. 

So basically, this kid not only disrespected society and other people by leaving his fucking drug spoon in a public bathroom, but ALSO made it that much easier to find him and his friends and bust them.

Good job!

Please... clean up your shit and be courteous to the rest of us, you're just making things worse and causing more trouble for yourself to get caught.

Thank you and be safe all.

Edit: I’m
Not understanding how it’s My fault that they left their shit there .
Somehow IM the bad person ? Seriously ?

Edit 2: man you guys are relentless . Maybe just don’t be stupid and be respectful and there wouldn’t be any problems to begin with ?
Edit 3: I want to make it clear that no one was arrested from this situation . They can’t prove who left it , they already were aware of who these kids were and all the info about them . This is basically a warning for everyone , yeah maybe i should have not mentioned the spoon but if I did this Then there are thousands of more examples just like this , I’m basically trying to tell you all to not do this shit or your running the risk of it happening to you and getting pinched

FINAL EDIT : ** You know what? It is my fault. You guys are right. I completely forgot that those in the middle of addiction don't take any responsibility for themselves and blame every one else for their problems and what happens to them. Never THEIR fault, they have an addiction! It's my fault he left anything there! It's my fault he shooting pills/dope in the bathroom and leaving a ton of residue of a random substance behind for some kid to find. It's my fault the police know who they are and what they are up to.

I completely forgot that addicts never taken personal responsibility and deflect blame onto every single person other than themselves.",1523463178.0
8bi9e9,https://www.reddit.com/r/opiates/comments/8bi9e9/about_to_take_a_drug_test/,8,https://redd.it/8bi9e9,red_hi_tec,About to take a drug test,"Well I'm about to take a drug test for IOP, ive just been smoking weed but i only post in this sub Reddit cuz im an opiate addict. Well here we go I got some old piss in ny waist band with a flip top and a handwarmer strapped to it. Here we go guys wish me luck! ",1523462914.0
8bi3zb,http://go.rutgers.edu/4cgtgy74,0,https://redd.it/8bi3zb,PattiAtRutgers,Rutgers Medical Experts on Surgeon General’s Naloxone Advisory,,1523461821.0
8bi3sj,https://www.reddit.com/r/opiates/comments/8bi3sj/hospital_pain_pump_machinesreminiscingshit_post/,18,https://redd.it/8bi3sj,Dooners83,Hospital pain pump machines...(reminiscing/shit post),"Has anyone else had the insane pleasure of being hooked up to one of these? I'm someone with a litany of chronic diseases, a great deal of which can sometimes flare and cause immense pain. I used to get hooked up to pain pumps all the time, since around 15 years old (I'm now 32). Well, I'm in the hospital right now with a colitis flare up and the main doc came in and told me he was going to hook me up to a pain pump, which I haven't had in about 6 years. I was SO STOKED...but then 15 minutes later the G.I. team comes in and says they cancelled the pain pump because there's all this new evidence and these new studies on how opiates can make colitis worse...Fuck, man, I almost cried. I was SO CLOSE to that magical amazing pain pump being hooked up to my IV. Fuck that G.I. team. Lol. Damn.",1523461771.0
8bhspx,https://i.redd.it/dqdtdr3eoar01.jpg,42,https://redd.it/8bhspx,KritAK47,More shit I found in my draws,,1523459447.0
8bhr9f,https://www.reddit.com/r/opiates/comments/8bhr9f/what_is_your_preferred_method_for_sneaking_hits/,22,https://redd.it/8bhr9f,b00fthatshit,What is your preferred method for sneaking hits at work (or when out and about in public)?,"I have two methods;

A - for pills I will get a straw, preferably from Starbucks or McDonalds, and take it and the pills into bathroom stall. Sit on toilet like I am doing my biz and put a pill (or two) into the straw and bite it until it is powder, then sniff away! Repeat for other nostril. 

B - for pills or H, if I have time at home to prep, I will make little foil envelopes of pre crushed goods. Portion out the doses and fold them up into perfect little packets. Put them in my pocket and head back to said bathroom, open up, and use a rolled up post it note as a tooter. 

Im curious if others use one of these methods, how can we make it better? Or what other methods do you use that work great?

Stay safe everyone!",1523459098.0
8bho2x,https://www.reddit.com/r/opiates/comments/8bho2x/choice_of_opiateopioid/,9,https://redd.it/8bho2x,Oxiconone,Choice of opiate/opioid,"If you had the choice of ONE of the following treatment options, which would you choose and why?

Morphine (Immediate & Extended release) - 60 x MST 60mg + 500ml 10mg/5ml solution - Every 28 days

Oxycodone (Immediate & Extended release) - 56 x Oxycontin 40mg + 500ml 5mg/5ml solution - Every 28 days

Fentanyl (Transdermal System) - 75 microgramm/hour x 10 patches
",1523458377.0
8bhn8h,https://www.reddit.com/r/opiates/comments/8bhn8h/dr_slashing_meds_in_half_what_do_i_do_expect/,14,https://redd.it/8bhn8h,itsacalamity,Dr slashing meds in half-- what do I do / expect?,"I have very bad chronic pain and have since I was 15 (I'm 33 now). For about 4 or 5 years now I've been on a daily dose of Morphine ER 30 mg twice a day, with up to five Norco 10s for breakthrough pain throughout the day. I have a very high med tolerance and after this long, they definitely do not work as well as they used to. 

My last pain doctor appointment, he handed me a script for 15 mg morphine and said ""Our practice has decided to do this to avoid scrutiny from the DEA."" I was able to get my normal script this month, but in a week and a half I'm going to be fucked. 

I'm barely getting by as it is, I wake up every three hours from pain. What do I have to expect going from 30 to 15? The amount of pain i envision is like a stormcloud that is perpetually overhead. Any advice or info would be greatly appreciated.",1523458192.0
8bhlkg,https://www.reddit.com/r/opiates/comments/8bhlkg/my_mom_knows_i_do_drugs_and_is_okay_with_it_how/,39,https://redd.it/8bhlkg,dyingsober,My mom knows I do drugs and is okay with it. How did your parents find out?,"I know she’s seen my bags before, things have been moved, touched, and even opened. 
I always joke about heroin like I’ll get upset and say “guess I’ll go shoot up some black tar heroin”. I did it today and she asked me “why are you getting the stamps called perfect 11? What happened to foxy? ?” And then laughed. She then mocked me, closed her eyes and dropped her jaw to look like she was passed out sleeping then said “this is what you look like after”.
I was stunned. She knows I smoke weed and is fine with that. But what the fuck. Maybe she doesn’t know it’s heroin. She asked what it was, and I said caffeine. But obviously not...I’m kind of upset she didn’t care. I need help to get off this. I’m considering coming clean and just asking for subs or methadone or something. This isn’t a life to live.

",1523457849.0
8bhbpp,https://i.redd.it/jp31j04mdar01.jpg,10,https://redd.it/8bhbpp,pm_me_that_fire,Something new they added 🤨,,1523455690.0
8bh8tw,https://www.reddit.com/r/opiates/comments/8bh8tw/almost_lost_a_friend_yesterday/,13,https://redd.it/8bh8tw,buffalotimes8,Almost lost a friend yesterday,"So yeah, this is the first time I have actually witnessed an OD.  My buddy and I were texting back and forth and he just stopped responding.  When I called him, he didn't answer.  I kept calling for about an hour since I was at work.  Something just didn't sit right with me so I finally decided to go by his house.  Found him splayed out on the floor, blue and with a weak pulse and only periodic respirations.  Fucking terrified man, terrified.  I called 911 and started rescue breathing and chest compressions.  His pulse came back after that but his breathing was still fucked.  That total hard snore when your body is trying it's damndest to stay alive.  When the EMS guys got there they hit him with narcan 5 times before he started to come back a little bit.  He's okay now, they let him come home from the hospital last night.  People, fucking be careful.  Test shots, start small, don't mix.  He had been drinking all morning and barely did a tiny line, but it was enough to almost kill him.  Had to be fent in the batch.  I knew it was strong and we had both definintely had the batch before, but throwing the alcohol in the mix definitely fucked him.  This was a big dude too, at least 220.  All I can say is that I'm glad I second guessed ignoring it and thinking he just went to bed.  Something told me things weren't right.  I know if I hadn't gone by there, he would be dead.  

Be

Fucking

Careful",1523455035.0
8bh84g,https://www.reddit.com/r/opiates/comments/8bh84g/crazy_copping_stories/,2,https://redd.it/8bh84g,corgisandcocaine,Crazy Copping Stories,"Tell me your craziest, sketchiest or scariest stories of times you copped!!",1523454840.0
8bgt42,https://i.imgur.com/pMkQHWN.jpg,100,https://redd.it/8bgt42,Oxiconone,It’s that time of the month again 😆🎉,,1523451098.0
8bgng7,https://www.reddit.com/r/opiates/comments/8bgng7/fuck_dope/,22,https://redd.it/8bgng7,danknugs6,Fuck dope!,My last dose was 7am on Monday 4-9-18 been so sick ever since.. I got 4 bags left but I haven't even touched them.. weed and hot showers are the only thing that's helping me haha.. I'm committed to quiting tho I'm so tired of having to use everyday just to feel normal.. after my detox is complete I'm flushing those fucking bags and never going back:) ,1523449569.0
8bgibn,https://www.reddit.com/r/opiates/comments/8bgibn/energy_control_international_new_subreddit/,18,https://redd.it/8bgibn,EC-International,Energy Control International new subreddit,"Energy Control (www.energycontrol.org) is a Spanish NGO offering harm reduction info and drug checking since 1999. In April 2014 we launched our International Website (https://energycontrol-international.org/) to spread our services worldwide, including an International Drug Checking Service. Our projected improvements include the launching of our own social media. If you are interested in our activity you can visit (or suscribe) to our subrredit. https://www.reddit.com/r/ECinternational/",1523448091.0
8bgf5z,https://www.reddit.com/r/opiates/comments/8bgf5z/question_from_a_guy_whos_never_tried_heroin/,4,https://redd.it/8bgf5z,corgisandcocaine,question from a guy who's never tried heroin,"I've never tried heroin but have a handful of experience with similar drugs including codeine, hydrocodone, oxycodone and hydromorphone. My question is which opiate do you guys think is most similar to heroin? ",1523447202.0
8bg00e,https://www.reddit.com/r/opiates/comments/8bg00e/these_fucking_birds_shitpost_deal_with_it/,17,https://redd.it/8bg00e,ZeddsDeadBB,These fucking birds 🐦 shitpost deal with it,"Are you kidding me??? Every fucking day 5am there's a fucking convention of goddamn birds RIGHT outside my bedroom window. FUCK I just wanna sleep in ONE fucking day. 

I'm so crabby rn fuck a duck literally ",1523442197.0
8bfy51,https://www.reddit.com/r/opiates/comments/8bfy51/those_who_switched_over_from_heroin_to_a/,8,https://redd.it/8bfy51,NoddieKitty,"Those who switched over from heroin to a methadone program, what dose made you most comfortable?","I'm admitting my defeat in three hours and enrolling in a methadone program. Getting clean a traditional way isn't for me. It's time to stop feeing the heroin demon daily with hundred dollar bills. Hm, I'm getting off track with my thoughts. Anyway, the point, I know it's different for everyone, but what dose made you feel most comfortable? I'm starting off on 30 Mgs tomorrow and I'm scared that won't be immediately enough for me. I smoke a gram of tar a day that is more pure than most heroin around the west coast.  
What would be the conversion in methadone for a gram of really good WC tar?

Oh, I'm really tired, I'm really tired but I'm actually asking for my kitty-cat He has been doing some shady shit in the neighborhood, gay-dog for pay, stealing all the Scooby snacks from neighborhood dogs/cats. Time to get that lad away from heroin. Hopefully Mr. Meows has a chance on methadone to clean up Mr. Meows act.


-____- 


",1523441528.0
8bfvtc,https://www.reddit.com/r/opiates/comments/8bfvtc/direct_deposit_instant_prepaid_card_i_can_get/,8,https://redd.it/8bfvtc,NoddieKitty,Direct Deposit Instant Prepaid card I can get from a store?,Someone mentioned here before that there was a prepaid debit card I could buy through a store that will immediately deposit a direct deposit instead of waiting for it to be release. Anyone remember the name of the debit card? Thank you. ,1523440732.0
8bfrbo,https://www.reddit.com/r/opiates/comments/8bfrbo/anyone_on_probation_ever_taken_a_taip_assessment/,20,https://redd.it/8bfrbo,I_Am_Happy_Lol,Anyone on probation ever taken a TAIP assessment?,"Will I be taking a urinalysis at my TAIP assessment, or will I take my urinalysis at my probation meeting prior?
Simply asking because I’m worried about my urine being sent to a lab.
Whenever I take my drug test at my regular probation department, they just dump my pee out and don’t send it to a lab. But I’m worried that if I take a piss test at my TAIP assessment that they will send it to a lab.
I have prescriptions for everything I would test positive for, but I’ve been using dope (which would pop for opiates) but I have a codeine cough syrup prescription which would explain why I tested positive for opiates. But I know for sure if they sent it to a lab that they would see that it was heroin I used instead of codeine. Unless heroin and codeine metabolites show up as the same thing in a lab test?
Can someone shed some light on this?",1523438976.0
8bfjmd,https://www.reddit.com/r/opiates/comments/8bfjmd/will_i_be_ok/,6,https://redd.it/8bfjmd,Umadbro1024,Will I be ok,I did 75 mg of dxm on top of 15 mg of a 30mg ir morphine its my first time doing morphine will I be okay it was a 56 262,1523435902.0
8bfhy4,https://www.reddit.com/r/opiates/comments/8bfhy4/substantia_gelatinosa_of_rolando/,5,https://redd.it/8bfhy4,scuoobs,Substantia gelatinosa of Rolando,"Slight back story I’ve been clean for over 5 years and recently I slipped up and I’ve been doing my best to not do it again.  Writing helps occupy my mind even if it’s about the thing I’m trying to not think about.  This is therapeutic to a degree and I know the  verbosity is slightly sickening but it helps me So please don’t rip me a new one.  If you read this thanks for being a friend.  You are a great person.  Without further ado,  (much of it truthfully about nothing) a vague retelling of why drugs are bad 'mmkay.  

     It’s 12:35 a.m. as I sit and think back on The thrilling destruction of my mind and body.  A feeling most certainly of the quality and honesty of a lost love.  In these silent hours of the night possibly my one true love.  
     
     I sit Starring at nothing and... but for a moment living the murky past.  The watercolor smudges of cumulative remembrance,  the eternal “rightness” of these life dreams.  Mothers milk warm vignettes of ice cream grinning love, eternal and fundamentally right.   When I Focus hard enough though a snake oil memory fraudulent and poisonous beckons.  Oh but Those blissful floating  hours of mirage nirvana....and yet....

     I know self sabotage.  I became a lie.  Like water I wove myself around every possible outcome making up each answer as the questions formed.  I taught myself to be a mirror.  I am what you want to see.  Blank slate freedom. 

     ...but this was a different freedom. A special kind of Straight jacket limiting.  I was fastened to a singular pivot point wavering only when the phone went unanswered or the money ran out or my lies grew too cancerous to hold back.  For in Shedding honesty, becoming the essential binary, on or off,  the weight of daily expectations was lifted.  I gave up everything that mattered and in return a phantom quickly replaced it, one purpose far more disruptive and consuming than the routine of living.  I became the singularity before the Big Bang.   
Potential energy and limitlessly compressed weight focused and concentrated on escaping itself.  Eventually the unbelievable explosion bright and white hot showed me my true face. And I could have been any stranger in any town.  I was a lie.  Whole and complete.  The amazing nothing.  

The reckless precision and blind devotion of living the same day over and over is something to never forget.  The sirens call is distant though her song will always be a part of me.  As some dead man said ""stare into the abyss and the abyss stares back.""  There is some truth to that but I guess I was able to turn away mostly intact.  My abyss is a self inflicted sickness that I hope to never forget.  


I just liked the name of this part of the body and it’s relation to opioid receptors so I used it.  Here’s part of what wiki has to say about it.

The substantia gelatinosa is one point (the nucleus proprius being the other) where first order neurons of the spinothalamic tract synapse.

Many μ and κ-opioid receptors, presynaptic and postsynaptic, are found on these nerve cells; they can be targeted to manage pain of distal origin.",1523435224.0
