8nxy2o,https://www.reddit.com/r/opiates/comments/8nxy2o/whats_the_point/,8,https://redd.it/8nxy2o,JedVicious,What's The Point,"Doing dope is supposed to be an escape, from any pain in your life, the daily stresses and just flat out bullshit that drags you down. But lately it's not an escape, it's just an invitation to deal with more bullshit that wouldn't be there if it wasn't for the dope. 
We've been together for a long time and we both have habits, and both of us have expressed interest in cleaning up and regaining our lives, or at least some semblance of normal lives. Had a chance at the first of the week, but just had to have another go around. 
But lately our 'escape ', our buzz, consists of me watching her nod out while sitting or standing,  and trying to keep her from hurting herself, or burning or breaking something. But in her eyes, I'm not doing that. Instead I'm hovering over her and bitching. And when she's in this shape it's obviously the perfect time to go wandering around outside or thru the building. We're essentially squatting at night, so lights and noises have to be kept to bare minimum,  absolute necessity. Unless you're on the nod, can't walk or maintain a grip on anything,  so you're constantly dropping everything, sounds like an excellent opportunity to explore doesn't it ? But other than that, you're good, why not go wandering around, except for the part where we have absolutely nowhere left to go. 

So yeah, that's what evidently is passing for a buzz and a good time right now. And we're paying thru the nose for the experience (No pun intended). Anybody else going thru that, or been thru it already? Sorry for the rant but it's killing us and had to let go of it. ",1527910469.0
8nxvvb,https://i.redd.it/48qq2knnai111.jpg,24,https://redd.it/8nxvvb,PandaBroads,Who is mouth watering vicariously,,1527909769.0
8nxvum,https://i.redd.it/mpe5bvzmai111.jpg,23,https://redd.it/8nxvum,Umadbro1024,Are these real???,,1527909763.0
8nxmow,https://i.redd.it/putv6r8m2i111.jpg,22,https://redd.it/8nxmow,Alaskaman89,Few bumps and a blunt of sum blueberry gushers should get me off to bed alright,,1527907057.0
8nxji7,https://www.reddit.com/r/opiates/comments/8nxji7/do_you_still_get_high_if_you_miss_ypur_shot/,13,https://redd.it/8nxji7,Ty_M_D95,Do you still get high if you miss ypur shot?,Title says it all. I know you want get as high obviously but you should still feel something right? Thank ya kindly,1527906141.0
8nxifd,https://www.reddit.com/r/opiates/comments/8nxifd/relapsing_tonigh_ama/,49,https://redd.it/8nxifd,Mxpwrx,Relapsing tonigh! AMA,"I've been off dope for about a year, after a ten year using career. Life is just routine and misery and honestly I can't take it anymore. Probably gonna end up with fent because I live in the midwest.",1527905817.0
8nxbbx,https://i.redd.it/jrs8trz0th111.jpg,2,https://redd.it/8nxbbx,Dr_Dabbles,Dog food close up,,1527903836.0
8nx7qe,https://www.reddit.com/r/opiates/comments/8nx7qe/i_swear_its_not_another_cat_post_kind_of/,11,https://redd.it/8nx7qe,FateStayFaded,I swear its not another cat post (kind of),"So I hope I'm not pushing buttons by making an animal post amidst all the flooding of animal pictures but something happened tonight I really thought you guys would enjoy hearing.

So my cat was at the vet all day and they had her on some buprenorphine, and today was the first day in a little bit she had some light in her face and actually wanted to be pet. So when we get home I started petting her, and she could not stop purring, like non stop wanted all the scratches. 

It took me a minute before I realized my cats had the itch like crazy, and we've all been there just itchy all over and wanting nothing more then to scratch it, only she couldnt scratch it because of her bandages. I can only imagine how terrible it would be to be on opiates and not be able to itch.

So the kind opi user in my heart decided I would give her the greatest scratches she could know, and I was truly jealous imagining how awesome it would feel if it happened to me. I feel like today I was the closest thing to being my cats JJ.",1527902831.0
8nx3bq,https://www.reddit.com/r/opiates/comments/8nx3bq/weird_marquis_reagent_test_heroin/,2,https://redd.it/8nx3bq,StayAnonymos,Weird Marquis reagent test. Heroin?,"Soooooo i got a white powder from a guy who got i from a guy whose guy sold it to him as a sedating drug (no further information). 
He snorted it and drank a little. He found it quit pleasent and also noticed some pupil constriction.
The powder is greyish white with a burning smell and also with a hint of vanilla.

It was brought to me to investigate which substance it is so I therefore tested it with a Marquis Reagent and at first it turned barely orange and stayed like that a few minutes. After that I left and came back in 3 hours to find it being completely violet (so maybe opioids eg. Heroin??)
Is it normal to take over 5 minutes to turn violet so late? What do you guys think?

 Answers are highly appreciated.",1527901634.0
8nx1t2,https://i.redd.it/9wewzuh9lh111.jpg,11,https://redd.it/8nx1t2,sludgefactoryy,Finally! I got some 😊,,1527901223.0
8nwydp,https://www.reddit.com/r/opiates/comments/8nwydp/yesterday_was_the_one_year_anniversary_of_utimbfs/,26,https://redd.it/8nwydp,FashionablyFake,Yesterday was the one year anniversary of /u/timbf's death.,"I was not in the right frame of mind yesterday to post this, so it's a day late. I wasn't sure if I even should, but I think he would want to be remembered.  It's a good reminder to everyone that no matter how safe you think you're being, no matter how long you've been using or how high your tolerance is,  you're still flirting with death every time you take a hit. Have narcan. Use with a friend. Do test shots. 

I love you all, and I really don't want to see any more RIP posts here. We've lost too many people, online and off. Tell your friends and family that you love them, and be good to yourself and others. 

(PS: I think everyone would be proud to know that this sub raised $350 last year for the care package fund, on tim's behalf/in his memory. So thank you all for that, too!)
",1527900278.0
8nwv0x,https://www.reddit.com/r/opiates/comments/8nwv0x/should_i_be_stressing_running_out_of_gabas/,26,https://redd.it/8nwv0x,CatharsisOfDisorder,Should I be stressing running out of gabas?,"Got two huge bottles from my neighbor and I plowed through em over a couple months. Usually dosing around 1200-1500 a night, I’d just take em for the somewhat relaxed effect they’d have. I ran out last night and I’ve never really fiended for em or anything but I just realized I’ve been taking them every day for at least a month. Thoughts?",1527899391.0
8nwqlq,https://i.redd.it/ondjxifgch111.jpg,3,https://redd.it/8nwqlq,RoxyPoppin,"Curious about these, someone’s tryna sell for $6 a piece on the whole script. Morphine 15 IR, what’s the best way to abuse these ?",,1527898257.0
8nwpbp,https://i.redd.it/9g64i9kfbh111.jpg,12,https://redd.it/8nwpbp,Dr_Dabbles,When the Dboy hands you his “last bag” and you find a little bonus inside,,1527897915.0
8nwfu3,https://www.reddit.com/r/opiates/comments/8nwfu3/new_finger_of_northeast_fuego/,11,https://redd.it/8nwfu3,viledenial,New Finger of Northeast fuego,[https://imgur.com/a/Nt0hYia](https://imgur.com/a/Nt0hYia),1527895481.0
8nwgpe,https://www.reddit.com/r/opiates/comments/8nwgpe/tol_break_complete_anyone_else_had_experience/,12,https://redd.it/8nwgpe,Throwawayforshitt,Tol break complete. Anyone else had experience with this?,"Notes: Aug-Oct, took maybe 4 or 5 blues a week. October, took 30-70mg of opana every day, with maybe a week of nothing. November, a bit less -- when i had it I'd take 5 (10mgs) in a day, but had it only for 2 weeks. December, connect ripped me off. Decided to take a tol break before finding a new connect. Found one last month but decided to hold off till jun 1. Kinda proud I've stuck to only kratom for this long.

Anyways; anyone else know how much this will reset my tolerance? Been taking 15-25g kratom a day, but pretty sure that isn't cross toleranc-ed

I'm planning on starting with 25mg oxy. Sound about right? More or less? 

Thanks guys! Idk if yall remember me but i posted and commented here and there over the past 2 years :)",1527895694.0
8nwgm1,https://www.reddit.com/r/opiates/comments/8nwgm1/what_is_everyone_doing_this_wonderful_friday/,22,https://redd.it/8nwgm1,SenorPoopyButtwhole,What is everyone doing this wonderful friday?,Im laying in bed snuggling my pup drinking a fruit punch and waiting to cop another bag. Watching the new planet of the apes. Went to probation this afternoon and made it home. So im in an alright mood. Hope everyone is having a fine friday.,1527895668.0
8nwb9g,https://i.redd.it/5bfdztgnyg111.jpg,24,https://redd.it/8nwb9g,elusivegremlin,"The last of my ""tar?"" and a little hydromorphone.",,1527894322.0
8nw75p,https://www.reddit.com/r/opiates/comments/8nw75p/let_that_dark_stuff_lay/,2,https://redd.it/8nw75p,This_is_a_rubbery,let that dark stuff lay,"The slow descent passes by  

Until one day I look up and cry  

I'm fine, I'm good, in fact, I'm great  

Someone like me, this is not my fate. 

Time tells time again  

That I am not my best of friend.

And with none other than myself to hate,  

I realize it is much too late  

What was within is now far gone  

And the journey ahead is far too long.  

I'm stuck, I'm trapped  

I'm fooled and wrapped.  

One more try to find the black  

One more try then I'll take life back  
",1527893287.0
8nw6s9,https://i.redd.it/phled0wdxg111.jpg,25,https://redd.it/8nw6s9,Dopemansdopeman,I think the dope hit you a little too hard bro.,,1527893193.0
8nw2gh,https://i.redd.it/temb1c88ug111.jpg,11,https://redd.it/8nw2gh,copolymers,Does this blurry 114 look like the right size to you? I remember them being much bigger than regular blues but it’s been so long I can’t remember,,1527892130.0
8nw2fa,https://i.redd.it/n5u8o0k7ug111.jpg,16,https://redd.it/8nw2fa,Darkpysche,Which way do I go ?,,1527892124.0
8nw1fx,https://www.reddit.com/r/opiates/comments/8nw1fx/xtampza_er_27/,2,https://redd.it/8nw1fx,Cocidius_666,xtampza er 27,Just picked up a few are they any good for anyhing other then oral use?,1527891899.0
8nw12i,https://www.reddit.com/r/opiates/comments/8nw12i/looking_on_dnm/,23,https://redd.it/8nw12i,ckoolbeans,Looking on DNM,Looking on dnm and everything seems to be expensive. Is that because its very pure? Or the risk?,1527891807.0
8nw127,https://www.reddit.com/r/opiates/comments/8nw127/anyone_know_how_to_get_narcan_in_belgium/,4,https://redd.it/8nw127,DetergentSecretion,Anyone know how to get Narcan in Belgium?,"Hi

I have been an infrequent user of opiates in the past but decided to cut them out completely once I felt myself to drawn to them. I have a friend however who started at the same time as me who unfortunately did not stop. 
I'm really worried about him. His use is aggravating and he just started injecting. I really think I might find him dead in his room one day. 
I tried to get him into a clinic but he's too stubborn. He says he's still got it together. Which he kinda does. He is still very productive. Maybe even more productive than he was before his habit.
My question is if someone has got any experience with getting naloxone injections from a doctor in Belgium. 
I'd like to have these just in case I might find him unconscious on the floor. ",1527891803.0
8nw0ym,https://www.reddit.com/r/opiates/comments/8nw0ym/what_to_do_with_these_embeda_100mg_morphine/,9,https://redd.it/8nw0ym,jtsn25,What to do with these embeda 100mg morphine?,What's the best thing to do with them? I don't want to take the whole 100mg. I've never fucked with the naloxone caps before so I'm not sure the best ROA. Any feedback helps.,1527891779.0
8nvc29,https://i.redd.it/jchhnwk9cg111.jpg,21,https://redd.it/8nvc29,iwanttomakesense,Does crushing these make them immediate release? (Oxycodone CR 10mg) [canada],,1527886090.0
8nvuq0,https://www.reddit.com/r/opiates/comments/8nvuq0/how_come_i_dont_feel_much_from_taking_oxy/,5,https://redd.it/8nvuq0,M00shyMushr00m,How come I don't feel much from taking oxy?,"A couple of years ago I fractured my elbow and the ED doc gave me 2 perc 5's to take home for pain. I remember taking both of them and I was on cloud nine for a couple of hours. I have literally never felt so good in my entire life. Fast forward to now my friend was prescribed 30mg oxys and asked me if I wanted to buy a couple, so I did. I ended up taking half and I felt nowhere near the level of euphoria I got from the percs a couple of years back. I felt a very slight sense of warmth and well being, but it also made me itch like crazy and was in a bad mood for most of the ""high.""

I decided to take a whole pill a few days later, but felt the exact same thing as the first time, except even more of a bad mood and more itching. For $30 a pop I determined that these things are definitely not worth it and ended up selling the rest. I guess it's a blessing in disguise because I have heard how addictive these things can be. Basically my question is that is it really possible that once you try them, the feeling you get from the first time will never be the same in the future once you try again? I figured since it has been years and I had no tolerance I would've felt something at least somewhat close to when I tried them the first time.   ",1527890306.0
8nvqho,https://www.reddit.com/r/opiates/comments/8nvqho/wishing_i_had_open_minded_friends/,17,https://redd.it/8nvqho,OPS_MOM_AMA,Wishing I had open minded friends.,"I sit here with plenty of friends, and none that I can really open up to about what's actually on my mind all the time. I only use every now and then, but you know how it is, I'm always thinking of the next time I'll get to use. 

I want to be able to nod off with my friends on nights when they're drinking or while we're smoking weed, but I have to hide shit because I don't want them to know that I'm still partially the same person I used to be. I don't want them to worry, I don't want them to judge, or leave. So I say nothing and scroll through a forum to get my fix of socialization with people who get it. 

",1527889315.0
8nvptz,https://i.redd.it/tcfxi43elg111.jpg,10,https://redd.it/8nvptz,lilbluething,"Me, circa 3 weeks ago",,1527889156.0
8nvnz4,https://www.reddit.com/r/opiates/comments/8nvnz4/friday_night_hangout_thread/,78,https://redd.it/8nvnz4,chasingd0pamine,Friday night hangout thread,"What up what up guys? Trying to be chatty to distract myself from my head this evening. been a minute since I made one of these threads, so let's shoot the shit

Random questions if you would like to answer... what have you taken today? What are your plans for the weekend if you have any? If you were a Crayola crayon what color would you be? Where are you at with your use?

Feel free to answer all, or some, or none of the above. Whatever you want. Talk to me about anything!

PS - you all should come to r/WNOD and join our playlist thread.",1527888736.0
8nvmca,https://www.reddit.com/r/opiates/comments/8nvmca/should_i_stop_taking_buprenorphine/,5,https://redd.it/8nvmca,Minuted,Should I stop taking buprenorphine?,"Hi all.

Used to lurk here a lot and post from time to time.

I got on subs Febuary last year, after a few attempts at getting on them and falling off the wagon. I started at 4mg and have very slowly reduced to the 0.8mg a day I'm taking now.

So being the incurable dickhead that I am I've been messing around with my daily dose. I quite often snort my dose. Once a week, but sometimes more often. Recently I've been craving stronger opiates, and I can't help but wonder if the buprenorphine has become something of an addiction in itself.

Buprenorphine has helped me tremendously and I'm 100% not against maintenance. But in truth I was in such a bad way when I hit my bottom when I was using that going cold turkey was not something I seriously considered. I was so depressed I was nearly suicidal so I figured it'd be best to get on subs and sort my life out. Slowly that has happened. I started taking an anti-depressant recently, and it's the first one I've tried that actually helps without causing me to feel it helps too much or has horrible side effects. Since then I've made strides towards getting my life back on track. I'm not quite there but I'm in better shape than I have been since before I even started using, so 5/6 years.

I'm not sure if it'd be best to stop taking the buprenorphine and go cold turkey to try to get over my need to take opiates to feel ok. Maybe I'm at such a low dose it's natural for my body to crave opiates somewhat.

My keyworker said that it's up to me, and if I did want to jump off the doctor could prescribe something to help with the withdrawal symptoms (I'm guessing something like Clonidine and maybe something to help me sleep?). I'm hesitant to mention that I've been abusing the buprenorphine I'm prescribed, I'm not sure if I'd get in trouble and have my support withdrawn. The past 4 months or so I've made numerous attempts to take less than the dose I'm prescribed and all of my attempts end at day 3 or 4 at the max. It's not even that the withdrawals are that bad but just having the buprenorphine there it's too tempting to just snort some for that measly but real ""high"". It's stupid.

Any advice? Has anyone here jumped from the 0.8mg/1mg range before? How was it? Anyone from the UK had much experience with CGL (https://www.changegrowlive.org (not sure if links are allowed but will delete if not))? I'm not sure if I should be honest with my keyworker about how I've been feeling and acting with the subs.

If I'm honest I want to be off them so I'm leaning towards stopping, even if the idea of living without any opiates for the first time in years is scary. But would be good to hear some opinions. 

Thanks.",1527888372.0
8nvjqb,https://i.redd.it/6aned2m3hg111.jpg,9,https://redd.it/8nvjqb,op80morphHead,Got em all,,1527887772.0
8nvcst,https://i.redd.it/umswrlvocg111.jpg,4,https://redd.it/8nvcst,veryquestionablelol,Hey how do i go about injecting there and can i use a cig filter ?,,1527886252.0
8nvbxq,https://www.reddit.com/r/opiates/comments/8nvbxq/morphine_sulphate_doseage/,3,https://redd.it/8nvbxq,Spooners_,Morphine Sulphate Doseage,"Ok, so i'm planning on boofing some liquid morphine but i dont know how much i should do. ive never touched opiates so i have no experience and no tolerance but i need to know how much to take",1527886060.0
8nv94e,https://www.reddit.com/r/opiates/comments/8nv94e/methadone_scare/,42,https://redd.it/8nv94e,iSweaterGodSeth,Methadone Scare,"Hi Friends,

2 days ago I started MMT, My starting dose was 30mg. About an hour and a half after my dose I blacked\-out while in my car, I was able to pull over just before it happened and didn't wreck. Someone found me in my car passed out and breathing very shallow and called am ambulance. They checked me out and my 02 levels and blood pressure and all were fine. I told my doctor at the clinic about this and the next day I went to dose \(scared af\) and they gave me 20mg. Well it fucking happened again, this time at work. And it seemed like it was so hard to catch my breath. I'm not sure if it's anxiety or the methadone, but I went back to the clinic today and refused my dose and talked to the Doc again. Tomorrow we are reducing my dose to 10mg, but honestly I don't even want to go. Has anyone experienced black\-outs, and i mean blacking out, not nodding off, from methadone?

Thanks

Edit: random fun fact \- the clinic is the same location where Elvis used to get his Methadone.",1527885434.0
8nv4c4,https://i.redd.it/pqs7vlz57g111.jpg,13,https://redd.it/8nv4c4,unitedstateofamanada,I was trying to make up a cool pun with the number 3 but I got nothing... Oh wait,,1527884376.0
8nuz9r,https://www.reddit.com/r/opiates/comments/8nuz9r/painkillers_for_broken_leg/,16,https://redd.it/8nuz9r,AngryChair007,Painkillers for broken leg?,"Is it normal to get painkillers for a broken leg? I broke my leg and all they gave me was a prescription for some ibuprofen that wasn’t even as strong as the 800’s I already had lol it’d probably help if you guys knew what state I was in but I guess that’d be sourcing 🙄. I just think it’s messed up that they gave me absolutely nothing for it, not even upset about not being able score some pills, I just feel like it’s fucked up to give someone aspirin for a broken leg when every little 16 year old who gets their wisdom teeth out gets fuckin percs or Vicodin. I’d like yalls opinion on this",1527883269.0
8nuyvf,https://www.reddit.com/r/opiates/comments/8nuyvf/stuff_is_too_good/,16,https://redd.it/8nuyvf,igottheblues1,stuff is too good,i know it's not really something to complain about but man I was just nodding so hard at my desk at work I know it was obvious. Need to take smaller lines in the bathroom at my job for this batch.,1527883193.0
8nuy9m,https://i.redd.it/wclh4q193g111.jpg,19,https://redd.it/8nuy9m,caco2521,problem iv morphine,,1527883061.0
8nuxam,https://www.reddit.com/r/opiates/comments/8nuxam/youre_not_clean_if_you/,61,https://redd.it/8nuxam,KPROTON,You’re not clean if you,"I’m sorry but unless I’m not understanding what methadone and subs truly are ( I only do opana and roxy), but I believe if you are on these other substances, you aren’t “clean” in my eyes. Unless someone here can maybe educate me? From what I understand it doesn’t “give you the euphoric high, but just helps symptoms? Would gabapentin be on the same class as that? Are they still acting on the receptors.

Not mud slinging, just saying currently in my eyes I don’t believe you’re clean doing that. Open for knowledge. Just like if you do to much don’t you nod ect feel sick and shit.  ",1527882860.0
8nuwpt,https://www.reddit.com/r/opiates/comments/8nuwpt/how_much_xanax_to_potentiate_75mg_perc/,3,https://redd.it/8nuwpt,madisonwm,How much Xanax to potentiate 7.5mg perc?,I have a fairly decent tolerance to Xanax. Usually I never mix but I have one 7.5 and don’t really want to waste it on it’s own. I have a very low opiate tolerance. Use maybe one every two months. I am thinking of starting at 1mg and 7.5. Any help for harm reduction would be great.  Thanks guys. ,1527882735.0
8nuvdp,https://i.redd.it/93zwe3ff1g111.jpg,9,https://redd.it/8nuvdp,frequent_flier69,Really? I’m confused both by the science and politcal motive behind a post like this...,,1527882443.0
8nutj0,https://www.reddit.com/r/opiates/comments/8nutj0/the_type_of_foil_3_smoking/,4,https://redd.it/8nutj0,opiatesaregood4you,The type of foil #3 smoking,"I dont get high off smoking #3 ibwas wondering if the type of foil makes a difference at all? As i have some pretty thick foil, amd sometimes end up with black on the bottom, even on the lowest flame.",1527882031.0
8nulmo,https://imgur.com/yWn2ogf,8,https://redd.it/8nulmo,phytop,"Never stopped by rain, snow, nor sleet, but spot some cops? Time to beat feet",,1527880336.0
8nuknm,https://i.redd.it/5akrto4juf111.jpg,3,https://redd.it/8nuknm,5thmeta_tarsal,Happy Friday 😁👍🏼 sweating my ass off in 90 degrees was worth it for these.,,1527880135.0
8nugd9,https://i.redd.it/hcyikmawrf111.jpg,6,https://redd.it/8nugd9,Benzocodone95,Got a script for 50 k 56’s and my buddy gave me 3 ozs of some tuss so imma be coolin it all night 😋 plus I’m still on my pack I posted a few days ago. Go look at my previous post to see what I mean... 😏,,1527879243.0
8nudv2,https://reason.com/reasontv/2018/06/01/how-the-government-made-the-opioid-crisi,3,https://redd.it/8nudv2,punkthesystem,The Government’s Cure for the Opioid Epidemic May Be Worse Than the Disease,,1527878725.0
8nudka,https://i.imgur.com/mt44gyI.jpg,4,https://redd.it/8nudka,BootL3gK1ng,Refill day. 30x name brand Pfizer with white on the back and just the 2. 30x generic Hulks. 30x Dilaudid 4mg.,,1527878660.0
8nubri,https://i.redd.it/bg05in51pf111.jpg,12,https://redd.it/8nubri,douoweme,I fit 6 blues (180mg) in this MAGNUM capsule. Who dares to pop this?,,1527878276.0
8nuaz1,https://www.reddit.com/r/opiates/comments/8nuaz1/how_can_i_iv_an_abg_30mg/,20,https://redd.it/8nuaz1,twistedladle,How can I IV an ABG 30mg,I've looked online and everyone says something different. Wondering what other people's way of doing it was.,1527878112.0
8nualr,https://www.reddit.com/r/opiates/comments/8nualr/promethzine_and_opioids/,7,https://redd.it/8nualr,bmille561,Promethzine and opioids?,Can you inject those tablets? Kinda need relief from throwing up and I thinking about just shooting up a promethzine?,1527878032.0
8nuace,https://i.redd.it/k0d4a1w3of111.jpg,15,https://redd.it/8nuace,bmille561,All alone and happy! Broke up with my boyfriend a month ago and never looked back. Off my subs finally and just chilling in my briefs in my bed with the fan on. I love my China white baby! More than I love big dick and Rick white boys,,1527877968.0
8nu4ff,https://www.reddit.com/r/opiates/comments/8nu4ff/50mcg_matrix_fent_patch/,2,https://redd.it/8nu4ff,medicatedwiz420,50mcg Matrix Fent Patch,"Have been looking and searching but still can’t seem to find a straight up answer. I take 120-150mg oxy a day or the equivalent, so I don’t really wanna just wear it. Can I gum these? If so, how much should I start with? Is there any other somewhat safe ways to abuse these?  The brand is Alvogen.",1527876735.0
8nu3x4,https://i.redd.it/54fr2o64kf111.jpg,3,https://redd.it/8nu3x4,getthefrontout,Took a longgg break... until my buddy said he had opanas ;),,1527876636.0
