d5l8rrj,https://www.reddit.com/r/opiates/comments/4txczf/just_did_my_first_shot_of_oxymorphone/,t3_4txczf,That's what a lot of drugs do. When the high wears off you feel worse than you did before taking them. Just part of the life. ,,1469123969.0
d5l13wi,https://www.reddit.com/r/opiates/comments/4txczf/just_did_my_first_shot_of_oxymorphone/,t3_4txczf,Shitty?,Deafcunt,1469114198.0
d5mi9he,https://www.reddit.com/r/opiates/comments/4txczf/just_did_my_first_shot_of_oxymorphone/,t3_4txczf,I feel like I come down alooot faster from Opana than h.,tennessee_jed615,1469204725.0
d5oexb2,https://www.reddit.com/r/opiates/comments/4txczf/just_did_my_first_shot_of_oxymorphone/,t3_4txczf,"What goes up must come down, my friend.",TheQ5,1469334490.0
d5l1cqy,https://www.reddit.com/r/opiates/comments/4txczf/just_did_my_first_shot_of_oxymorphone/,t1_d5l13wi,Like depression shitty.,Milqy,1469114528.0
d5p6v1a,https://www.reddit.com/r/opiates/comments/4txczf/just_did_my_first_shot_of_oxymorphone/,t1_d5mi9he,I've never shot h but maybe I'll try it.,Milqy,1469396967.0
d5p6tun,https://www.reddit.com/r/opiates/comments/4txczf/just_did_my_first_shot_of_oxymorphone/,t1_d5oexb2,Very true. Unfortunately I'm down rn :(,Milqy,1469396917.0
d5l2kpv,https://www.reddit.com/r/opiates/comments/4txczf/just_did_my_first_shot_of_oxymorphone/,t1_d5l1cqy,Might be from going up so high and then comin back down is a comedown in its self since the shit is so strong lol. Or you're just getting tired of your use and things you do to use idk broham. :{,OCD757,1469116121.0
d5p6tat,https://www.reddit.com/r/opiates/comments/4txczf/just_did_my_first_shot_of_oxymorphone/,t1_d5l2kpv,That's gotta be it. Fuck man. This is a vicious cycle.,Milqy,1469396895.0
