d19zwno,https://www.reddit.com/r/opiates/comments/4bk6ho/tinychat_guys_lets_get_it_goin/,t3_4bk6ho,hope u ok oxy,LLOYD_MOFUGGIN,1458700247.0
d1a87si,https://www.reddit.com/r/opiates/comments/4bk6ho/tinychat_guys_lets_get_it_goin/,t3_4bk6ho,you okay /u/oxymorphine ??,jelllly,1458717952.0
d1a8cna,https://www.reddit.com/r/opiates/comments/4bk6ho/tinychat_guys_lets_get_it_goin/,t3_4bk6ho,Chat is still poppin! ,AllTarEgo,1458718442.0
d19vr9m,https://www.reddit.com/r/opiates/comments/4bk6ho/tinychat_guys_lets_get_it_goin/,t3_4bk6ho,But WHAT IF UR CAMERA SHY 😭😭😭,,1458693930.0
d19whpm,https://www.reddit.com/r/opiates/comments/4bk6ho/tinychat_guys_lets_get_it_goin/,t3_4bk6ho,lol why do you care so much about people lurking? lmfao what do you think it's some cops trying to spy on y'all?,throwawayforevaaar,1458695056.0
d19zgl5,https://www.reddit.com/r/opiates/comments/4bk6ho/tinychat_guys_lets_get_it_goin/,t3_4bk6ho,I keep getting kicked out of the room because these ads are popping up. I don't know what the fucking deal it.,KickerS12X,1458699556.0
d1a88cs,https://www.reddit.com/r/opiates/comments/4bk6ho/tinychat_guys_lets_get_it_goin/,t3_4bk6ho,we out here,jelllly,1458718010.0
d1a8h1h,https://www.reddit.com/r/opiates/comments/4bk6ho/tinychat_guys_lets_get_it_goin/,t3_4bk6ho,Yooo,,1458718882.0
d1aa3ko,https://www.reddit.com/r/opiates/comments/4bk6ho/tinychat_guys_lets_get_it_goin/,t3_4bk6ho,rockin' in the chat 'til the sun comes up,methadoneinmybones,1458725231.0
d19ugzl,https://www.reddit.com/r/opiates/comments/4bk6ho/tinychat_guys_lets_get_it_goin/,t3_4bk6ho,From here or did you finally set up a mod in there?,timbf,1458691908.0
d19vvv3,https://www.reddit.com/r/opiates/comments/4bk6ho/tinychat_guys_lets_get_it_goin/,t3_4bk6ho,Fucking lurkers coming and leaving because i said i was shooting up. fuck outta here if your just gonna come to snoop on us,OxyMorphine,1458694130.0
d1ayedg,https://www.reddit.com/r/opiates/comments/4bk6ho/tinychat_guys_lets_get_it_goin/,t3_4bk6ho,Keeping you in my thoughts buds. ,6ixfool,1458765377.0
d1a0srn,https://www.reddit.com/r/opiates/comments/4bk6ho/tinychat_guys_lets_get_it_goin/,t1_d19zwno,Agreed.... hope we hear from him soon,SelfMedicator24,1458701672.0
d1a11y3,https://www.reddit.com/r/opiates/comments/4bk6ho/tinychat_guys_lets_get_it_goin/,t1_d19zwno,same,,1458702288.0
d1a9r1j,https://www.reddit.com/r/opiates/comments/4bk6ho/tinychat_guys_lets_get_it_goin/,t1_d1a8cna,movin' and a shakin',methadoneinmybones,1458723810.0
d19vspe,https://www.reddit.com/r/opiates/comments/4bk6ho/tinychat_guys_lets_get_it_goin/,t1_d19vr9m,don't get on cam? And be sure tht if you ever get on cam you make sure theirs no lurks. I'm on right now abut to do a shot,OxyMorphine,1458693992.0
d1a5swl,https://www.reddit.com/r/opiates/comments/4bk6ho/tinychat_guys_lets_get_it_goin/,t1_d19whpm,... you a cop?,Handlifethrowaway,1458711107.0
d1a11km,https://www.reddit.com/r/opiates/comments/4bk6ho/tinychat_guys_lets_get_it_goin/,t1_d19zgl5,oh that was u ,,1458702263.0
d19unyu,https://www.reddit.com/r/opiates/comments/4bk6ho/tinychat_guys_lets_get_it_goin/,t1_d19ugzl,"What? their is a mod in their who can kick
but the creator of the tinychat can appoint mods only so we need new ones although the current mod is frequently on",OxyMorphine,1458692210.0
d1a3kc5,https://www.reddit.com/r/opiates/comments/4bk6ho/tinychat_guys_lets_get_it_goin/,t1_d19ugzl,"I am the only active mod left, since the room's creator is M.I.A. at the moment. It seems like there has been a need to clean up the lurkers and trolls lately, so I'll be around if those kinds of issues pop up. When I was more active last year, there were a few chat regulars who would contact me via text if there was ever the need to kick a particularly annoying troll. I guess I don't really mind helping out again if I am needed. ",,1458706546.0
d19vxaw,https://www.reddit.com/r/opiates/comments/4bk6ho/tinychat_guys_lets_get_it_goin/,t1_d19vvv3,That was me just now lol,,1458694191.0
d1b3y9a,https://www.reddit.com/r/opiates/comments/4bk6ho/tinychat_guys_lets_get_it_goin/,t1_d19vvv3,retard,cfgld,1458773053.0
d19vwcd,https://www.reddit.com/r/opiates/comments/4bk6ho/tinychat_guys_lets_get_it_goin/,t1_d19vspe,Oh alright. Thought it was just exclusively camchat or sumn never used tinychat,,1458694151.0
d19urnr,https://www.reddit.com/r/opiates/comments/4bk6ho/tinychat_guys_lets_get_it_goin/,t1_d19unyu,Ya thats what I meant.Did you get new ones yet to keep it safe? One is not enough.,timbf,1458692375.0
d1a9cbs,https://www.reddit.com/r/opiates/comments/4bk6ho/tinychat_guys_lets_get_it_goin/,t1_d1a3kc5,Its a lot of work keeping these subs safe.I get it.If you got time do it.If not let them know so they can get another if needed.,timbf,1458722186.0
d19vy64,https://www.reddit.com/r/opiates/comments/4bk6ho/tinychat_guys_lets_get_it_goin/,t1_d19vxaw,"no it wasn't. You were on i knew it was you, then someone else joined lol. I said their was a lurk while you were in the chat ha",OxyMorphine,1458694228.0
d19vyjn,https://www.reddit.com/r/opiates/comments/4bk6ho/tinychat_guys_lets_get_it_goin/,t1_d19vwcd,"yea no need for cam, you can type",OxyMorphine,1458694244.0
d19uxji,https://www.reddit.com/r/opiates/comments/4bk6ho/tinychat_guys_lets_get_it_goin/,t1_d19urnr,"No we haven't got new ones because like i just said only the creator of the room can appoint new mods and she hasn't been on in forever. We are trying to work on it though. So far we have that one mod , we get a couple lurks here n their which is always creepy lol main reason why i got off cam a few times",OxyMorphine,1458692632.0
d1anndb,https://www.reddit.com/r/opiates/comments/4bk6ho/tinychat_guys_lets_get_it_goin/,t1_d1a9cbs,"I'm around, if I'm needed.",,1458751734.0
d19vys1,https://www.reddit.com/r/opiates/comments/4bk6ho/tinychat_guys_lets_get_it_goin/,t1_d19vy64,Oh shit haha,,1458694253.0
d1anx7u,https://www.reddit.com/r/opiates/comments/4bk6ho/tinychat_guys_lets_get_it_goin/,t1_d1anndb,Good to hear.I have nothing to do with that  place myself.,timbf,1458752072.0
d19w1qj,https://www.reddit.com/r/opiates/comments/4bk6ho/tinychat_guys_lets_get_it_goin/,t1_d19vys1,did you just join as newuser,OxyMorphine,1458694377.0
d19w3cf,https://www.reddit.com/r/opiates/comments/4bk6ho/tinychat_guys_lets_get_it_goin/,t1_d19w1qj,"L,mAo",,1458694446.0
