d4k52dn,https://www.reddit.com/r/opiates/comments/4pdnk0/cold_copping_pills/,t3_4pdnk0,Cold copping H > pills. ,MissMariJane,1466640683.0
d4k46bd,https://www.reddit.com/r/opiates/comments/4pdnk0/cold_copping_pills/,t3_4pdnk0,"No? 

Like depends where you live but generally this is how people often find their drugs. ",candopethrowaway2,1466639331.0
d4k7696,https://www.reddit.com/r/opiates/comments/4pdnk0/cold_copping_pills/,t3_4pdnk0,"Varies immensely by location but if you're in or near a large enough city, you may have success using Craigslist. Success requires good common sense (and again, availability) but in a few past pinches, it's worked well for me.",,1466643896.0
d4k8g9f,https://www.reddit.com/r/opiates/comments/4pdnk0/cold_copping_pills/,t3_4pdnk0,Maybe OP isn't sure what cold copping means? You have to use your own judgment whether or not it's a good idea. That's not something we can really tell you. It's never 100% safe to use drugs period. It's a risk you take which is a part of this lifestyle. So this question is kind of redundant. ,kara_t_chop,1466645896.0
d4k38ws,https://www.reddit.com/r/opiates/comments/4pdnk0/cold_copping_pills/,t3_4pdnk0,You mean like trying to cold cop in the hood?,spinderella69,1466637925.0
d4k5p4t,https://www.reddit.com/r/opiates/comments/4pdnk0/cold_copping_pills/,t1_d4k38ws,yes,imidazo,1466641625.0
d4k6m9l,https://www.reddit.com/r/opiates/comments/4pdnk0/cold_copping_pills/,t1_d4k5p4t,"I think it would be more difficult to find pills then H,but I think it may still be possible.",spinderella69,1466643040.0
