dty3zki,https://www.reddit.com/r/opiates/comments/7w700p/boofing_oxy_how_can_i_be_sure_my_poop_wont_absorb/,t3_7w700p,"I understand boofing dilly’s or morphine, but why oxy?? Oxy is the best oral drug there is, or you could sniff it without losing that much. Just curious why? ",doodoohead585,1518119287.0
dty13nr,https://www.reddit.com/r/opiates/comments/7w700p/boofing_oxy_how_can_i_be_sure_my_poop_wont_absorb/,t3_7w700p,"Also everyone will disagree with me, but since it’s oxy you can always just eat it and get full effects, or the classic eat half snort half.",yellow-spiders,1518116833.0
dty62lq,https://www.reddit.com/r/opiates/comments/7w700p/boofing_oxy_how_can_i_be_sure_my_poop_wont_absorb/,t3_7w700p,"That's just retarded. Just pop them, bioavailability will be practically the same and you don't run the risk of having the liquid leak out your butt or the poop absorbing it.",His_Dudeness_94,1518121076.0
dty8igw,https://www.reddit.com/r/opiates/comments/7w700p/boofing_oxy_how_can_i_be_sure_my_poop_wont_absorb/,t3_7w700p,Don’t boof oxy. It has a LOWER rectal bioavailability than orally if I’m not mistaken. ,JonnyAppleseedz,1518123241.0
dty0cm5,https://www.reddit.com/r/opiates/comments/7w700p/boofing_oxy_how_can_i_be_sure_my_poop_wont_absorb/,t3_7w700p,"If you wanna be 100% sure you could always buy an enema, and do what people do when they’re prepping for anal.",yellow-spiders,1518116204.0
dty67wy,https://www.reddit.com/r/opiates/comments/7w700p/boofing_oxy_how_can_i_be_sure_my_poop_wont_absorb/,t3_7w700p,"
If you’re not straight up constipated but wanna get your asshole clear before a dose, draw up a few syringefuls of warm water and shoot it up there. Hold it as long as you can, and eventually it should stimulate you to poop. Do another round if you wanna be totally sure. Then you’re golden",AAAAAAAAAAAAAAASs,1518121208.0
dtyhdz0,https://www.reddit.com/r/opiates/comments/7w700p/boofing_oxy_how_can_i_be_sure_my_poop_wont_absorb/,t3_7w700p,This guy asks the tough questions.,MissGyp,1518131782.0
dty8xlz,https://www.reddit.com/r/opiates/comments/7w700p/boofing_oxy_how_can_i_be_sure_my_poop_wont_absorb/,t1_dty3zki,He just likes sticking things up his ass. ,jessepinkmna,1518123613.0
dty1nfx,https://www.reddit.com/r/opiates/comments/7w700p/boofing_oxy_how_can_i_be_sure_my_poop_wont_absorb/,t1_dty13nr,"Been doing that for a while, mixing it up",HalfHeartedBootyCall,1518117294.0
dty8ii5,https://www.reddit.com/r/opiates/comments/7w700p/boofing_oxy_how_can_i_be_sure_my_poop_wont_absorb/,t1_dty8igw,"Generic we can't have any fun message!

*I am a bot, and this action was performed automatically. Please [contact the moderators of this subreddit](/message/compose/?to=/r/opiates) if you have any questions or concerns.*",AutoModerator,1518123242.0
dty0p5v,https://www.reddit.com/r/opiates/comments/7w700p/boofing_oxy_how_can_i_be_sure_my_poop_wont_absorb/,t1_dty0cm5,Is that really necessary?,HalfHeartedBootyCall,1518116496.0
dty0m38,https://www.reddit.com/r/opiates/comments/7w700p/boofing_oxy_how_can_i_be_sure_my_poop_wont_absorb/,t1_dty0cm5,How annoying/long/expensive is an enema?,HalfHeartedBootyCall,1518116425.0
dty3e39,https://www.reddit.com/r/opiates/comments/7w700p/boofing_oxy_how_can_i_be_sure_my_poop_wont_absorb/,t1_dty1nfx,"If you're set on sticking an opiate up your ass try hydromorphone or oxymorophone. Both of which are better suited to butt play or nasal insemination  unlike their -codone cousins. Eat your pills man. You really wanna go for Bronze, plugging H is efficient and endorsed by those whose veins are comparable to garden hoses. It's the next best thing..",FlipFlopSuicide,1518118778.0
dtybwf1,https://www.reddit.com/r/opiates/comments/7w700p/boofing_oxy_how_can_i_be_sure_my_poop_wont_absorb/,t1_dty8ii5,kek,HeroinWillKillMe,1518126336.0
dty0sbx,https://www.reddit.com/r/opiates/comments/7w700p/boofing_oxy_how_can_i_be_sure_my_poop_wont_absorb/,t1_dty0p5v,"I definitely don’t think so, usual rule of thumb around here is boof after you’ve had a solid bowel movement.",yellow-spiders,1518116571.0
dty0wxf,https://www.reddit.com/r/opiates/comments/7w700p/boofing_oxy_how_can_i_be_sure_my_poop_wont_absorb/,t1_dty0p5v,"Idk if bot deleted my reply, but no not necessary just wait till you have a solid bowel movement.",yellow-spiders,1518116681.0
dty0qce,https://www.reddit.com/r/opiates/comments/7w700p/boofing_oxy_how_can_i_be_sure_my_poop_wont_absorb/,t1_dty0m38,"I’ve never done it, in fact I’ve had anal with a couple girls and they’ve never done it, and unless you’re a heavy opiate user and constipated I don’t think it’s necessary, just boot after you take your morning dump or whenever you have a bowel movement. This is only if you’re kind of paranoid on wasting and wanna be 100% sure.",yellow-spiders,1518116524.0
dty3xpt,https://www.reddit.com/r/opiates/comments/7w700p/boofing_oxy_how_can_i_be_sure_my_poop_wont_absorb/,t1_dty0m38,Enemas are cheap as fck. And they aren’t reallly good for you unless you need it. As stated if our not constipated just shit and then boof. Otherwise you may be in for a shitty surprise for atleast 30min,chinorelli,1518119241.0
dtyoz0k,https://www.reddit.com/r/opiates/comments/7w700p/boofing_oxy_how_can_i_be_sure_my_poop_wont_absorb/,t1_dty0m38,"Drink a bottle of Gatorade, that'll clear ya out",addictedstylist,1518140129.0
dty8dvw,https://www.reddit.com/r/opiates/comments/7w700p/boofing_oxy_how_can_i_be_sure_my_poop_wont_absorb/,t1_dty3e39,Hydromorphone isn’t that well suited to butts despite the info ppl post here. Nose or vein. Morphine is for butts,Clvrusername808,1518123130.0
dty1269,https://www.reddit.com/r/opiates/comments/7w700p/boofing_oxy_how_can_i_be_sure_my_poop_wont_absorb/,t1_dty0sbx,Thanks,HalfHeartedBootyCall,1518116800.0
dty0sc9,https://www.reddit.com/r/opiates/comments/7w700p/boofing_oxy_how_can_i_be_sure_my_poop_wont_absorb/,t1_dty0sbx,"Generic we can't have any fun message!

*I am a bot, and this action was performed automatically. Please [contact the moderators of this subreddit](/message/compose/?to=/r/opiates) if you have any questions or concerns.*",AutoModerator,1518116572.0
dty3xq1,https://www.reddit.com/r/opiates/comments/7w700p/boofing_oxy_how_can_i_be_sure_my_poop_wont_absorb/,t1_dty3xpt,"Generic we can't have any fun message!

*I am a bot, and this action was performed automatically. Please [contact the moderators of this subreddit](/message/compose/?to=/r/opiates) if you have any questions or concerns.*",AutoModerator,1518119241.0
dty8lei,https://www.reddit.com/r/opiates/comments/7w700p/boofing_oxy_how_can_i_be_sure_my_poop_wont_absorb/,t1_dty8dvw,This is all true. Morphine is really the only drug besides H that’s worth boofing ,JonnyAppleseedz,1518123313.0
dtybor5,https://www.reddit.com/r/opiates/comments/7w700p/boofing_oxy_how_can_i_be_sure_my_poop_wont_absorb/,t1_dty8dvw,"While the BA for Hydro plugged is only slightly higher than oral, it's not all that lower than insufflation considering the dosage is usually very low to begin with.. so somebody taking a 5mg would feel the equivalent of taking 2.5mg vs 1.65mg's. not a huge difference. While IV is and always will be the ""best"", many people won't cross that line.",FlipFlopSuicide,1518126143.0
dty2xhc,https://www.reddit.com/r/opiates/comments/7w700p/boofing_oxy_how_can_i_be_sure_my_poop_wont_absorb/,t1_dty0sc9,stupid bot,Passthebobby,1518118385.0
dtybzv3,https://www.reddit.com/r/opiates/comments/7w700p/boofing_oxy_how_can_i_be_sure_my_poop_wont_absorb/,t1_dtybor5,"Insufflating hydromorphone is around 55% and rectal is more like 30-35% (higher end of that, while oral is the lower end of that). So it’s significant... I see what you’re saying, my point was just that morphine is better plugged than hydromorphone... ",Clvrusername808,1518126426.0
dtycgbm,https://www.reddit.com/r/opiates/comments/7w700p/boofing_oxy_how_can_i_be_sure_my_poop_wont_absorb/,t1_dtybzv3,"Agreed. For an actual opiate, intended to be consumed raw by nature, it has an abysmal oral BA. Absolutely must plug it short of IV.  Doesn't seem to be as common a prescription though as the big 4.. maybe it's that I tend to avoid ""pill porn"" threads but I hardly see it come up. Although, when taking in sufficient quantity, oral morphine feels absolutely wonderful and has long legs.. Heroin minus the cross trainers.",FlipFlopSuicide,1518126850.0
dtyp3b0,https://www.reddit.com/r/opiates/comments/7w700p/boofing_oxy_how_can_i_be_sure_my_poop_wont_absorb/,t1_dtycgbm,I still wanna know more about that movie lol,addictedstylist,1518140259.0
