eh3irtf,https://imageshack.com/a/img922/9070/CY04XN.jpg,t3_atuqhm,"A bit hard to see in the pic but there are small black speckles through the H that makes it look like cookie dough, just as tasty as well!",xpinsandneedlesx,1550922823.0
eh3jny9,https://imageshack.com/a/img922/9070/CY04XN.jpg,t3_atuqhm,what exactly does cookie dough part mean?,UnitGod,1550924116.0
eh3pbs8,https://imageshack.com/a/img922/9070/CY04XN.jpg,t3_atuqhm,Yum ,dzdvk,1550930813.0
eh3sxub,https://imageshack.com/a/img922/9070/CY04XN.jpg,t3_atuqhm,Any good,Disposable187,1550934327.0
eh46a8i,https://imageshack.com/a/img922/9070/CY04XN.jpg,t3_atuqhm,"The real chocolate chip (of old, haven't seen it in 20 years) has LARGE dark spots in it. Those dark spots are the goodies!",mivanqua,1550944748.0
eh48sz8,https://imageshack.com/a/img922/9070/CY04XN.jpg,t3_atuqhm,Like 3-4 points,Disposable187,1550946664.0
eh3k1j4,https://imageshack.com/a/img922/9070/CY04XN.jpg,t1_eh3jny9,It looks like cookie dough up close,xpinsandneedlesx,1550924614.0
eh47tgt,https://imageshack.com/a/img922/9070/CY04XN.jpg,t1_eh3sxub,Oh yeah real good,xpinsandneedlesx,1550945917.0
eh4dhuk,https://imageshack.com/a/img922/9070/CY04XN.jpg,t1_eh46a8i,I've seen pics of vendors selling that chocolate chip on dm. Looks like someone just crushed a cookie up lol,xpinsandneedlesx,1550950164.0
eh631b1,https://imageshack.com/a/img922/9070/CY04XN.jpg,t3_atuqhm,i feel like we have the same plug haha i just recently got some just like this,--sunshine-,1551009635.0
eh6r15b,https://imageshack.com/a/img922/9070/CY04XN.jpg,t1_eh631b1,Nice 😄,xpinsandneedlesx,1551031360.0
