dcctufr,https://i.reddituploads.com/820762328d104dd987739b2fd42cd91e?fit=max&h=1536&w=1536&s=556efe0e1b52eaefb7f464f623875974,t3_5nn8g1,Where you from? I'm in georgia and it looks IDENTICAL,ILOVETHEREFSBABY,1484268791.0
dcd3b28,https://i.reddituploads.com/820762328d104dd987739b2fd42cd91e?fit=max&h=1536&w=1536&s=556efe0e1b52eaefb7f464f623875974,t3_5nn8g1,I've Never seen this stuff before we get straight black obsidian glass-type tar almost see through ita amazingly bomb. How is the white powdered heroin generally? ,purplenugfish,1484281721.0
dcdaxou,https://i.reddituploads.com/820762328d104dd987739b2fd42cd91e?fit=max&h=1536&w=1536&s=556efe0e1b52eaefb7f464f623875974,t3_5nn8g1,"Man is it just me, have I been banging dope wrong all.these years? I never got why u would put the whole 1ml rig full.of water for a shot, I'm from down south too but getting way better shit in the MW go figure but I rarely use over 30 units and never go over 40-45 and that's even w/ a speedball drawing up twice once for dope.once for girl before the ole shake n' stake.... Though I prefer halfcc.5ml rigs bc I think.they pull up easier so I guess that could have something to.do w it

Don't get me wrong not trying to talk shit about how anyone likes to do their shot just never saw the point I want to push it in me fast as possible which means least amount of liquid I can.",Halfccnme,1484295644.0
dcdhgfo,https://i.reddituploads.com/820762328d104dd987739b2fd42cd91e?fit=max&h=1536&w=1536&s=556efe0e1b52eaefb7f464f623875974,t3_5nn8g1,Mind if I sit at this lunch table?,oxykitten80mg,1484313349.0
dccwcvy,https://i.reddituploads.com/820762328d104dd987739b2fd42cd91e?fit=max&h=1536&w=1536&s=556efe0e1b52eaefb7f464f623875974,t1_dcctufr,Dude same that's weird af.  Except I'm in MD.,,1484272221.0
dcd0fyi,https://i.reddituploads.com/820762328d104dd987739b2fd42cd91e?fit=max&h=1536&w=1536&s=556efe0e1b52eaefb7f464f623875974,t1_dcctufr,Also in Georgia and got something that looks just like this. Looking like we have the same lunch. Will also be my breakfast tomorrow. Yum my favorite. ,HighsandLows25342534,1484277656.0
dcd7mz7,https://i.reddituploads.com/820762328d104dd987739b2fd42cd91e?fit=max&h=1536&w=1536&s=556efe0e1b52eaefb7f464f623875974,t1_dcctufr,"Yeahhh boi this look like that good good southern dope. Leaves no trash in the spoon, it's a fucking nice rock, gets you fucked.",ButyrFentReviewaway,1484288391.0
dcddyte,https://i.reddituploads.com/820762328d104dd987739b2fd42cd91e?fit=max&h=1536&w=1536&s=556efe0e1b52eaefb7f464f623875974,t1_dcctufr,I'm in the frozen tundra. Minnesota. 😕,methadone-milkshakes,1484304533.0
dcd6pz9,https://i.reddituploads.com/820762328d104dd987739b2fd42cd91e?fit=max&h=1536&w=1536&s=556efe0e1b52eaefb7f464f623875974,t1_dcd3b28,Same here! You loyal to the foil?,,1484286831.0
dcde07i,https://i.reddituploads.com/820762328d104dd987739b2fd42cd91e?fit=max&h=1536&w=1536&s=556efe0e1b52eaefb7f464f623875974,t1_dcd3b28,We have that too. I used to perfer the black actually. Why exactly I'll never know. This stuff is pretty great. Great quality. ,methadone-milkshakes,1484304649.0
dcde41h,https://i.reddituploads.com/820762328d104dd987739b2fd42cd91e?fit=max&h=1536&w=1536&s=556efe0e1b52eaefb7f464f623875974,t1_dcdaxou,"I usually do it this way because I have tiny little veins. With the larger amount of water, I can register, slow push to make sure I don't through through the tiny little guy, re-register early and often during the process to make sure I'm still in there. My veins are impossible sometimes. 😒
",methadone-milkshakes,1484304976.0
dccyw7x,https://i.reddituploads.com/820762328d104dd987739b2fd42cd91e?fit=max&h=1536&w=1536&s=556efe0e1b52eaefb7f464f623875974,t1_dccwcvy,Pretty far apart. I mean I'm pretty sure it's the same shit.a half G will last me 3 or 4 days. I knock a chip off with a razor blade and catch nods all day,ILOVETHEREFSBABY,1484275588.0
dcddwcs,https://i.reddituploads.com/820762328d104dd987739b2fd42cd91e?fit=max&h=1536&w=1536&s=556efe0e1b52eaefb7f464f623875974,t1_dcd6pz9,Pretty loyal yeah. I'm about to quit. Just cant shit...,purplenugfish,1484304328.0
dcebbgj,https://i.reddituploads.com/820762328d104dd987739b2fd42cd91e?fit=max&h=1536&w=1536&s=556efe0e1b52eaefb7f464f623875974,t1_dcddwcs,"Best of luck, friend!
",,1484349941.0
dcemi0n,https://i.reddituploads.com/820762328d104dd987739b2fd42cd91e?fit=max&h=1536&w=1536&s=556efe0e1b52eaefb7f464f623875974,t1_dcebbgj,"I can quit, just literally can't shit.",purplenugfish,1484366983.0
