cpv0brc,https://www.reddit.com/r/opiates/comments/30q0po/junkie_jesus_shines_on_me/,t3_30q0po,"awesome man, he visited me today as well.
I got cotton fever, and my guy hits me up ""yo I got m-eslon 60s, 10$ ea."" I told him I had just gotten cotton fever and he delivered me three for $20. they're the best morphine pills for IV use with the least fucking around if you ask me. thank you junkie jesus!",DIElaudid,1427675697.0
cpv0m49,https://www.reddit.com/r/opiates/comments/30q0po/junkie_jesus_shines_on_me/,t3_30q0po,I have found .5 g of coke before on the ground during a run. Each point was individually bagged and they were all in a bag which was tied up drug style. Twas a good day,Opifienddd,1427676179.0
cpupsip,https://www.reddit.com/r/opiates/comments/30q0po/junkie_jesus_shines_on_me/,t3_30q0po,"I'm nearly two months sober minus maybe four uh uh slips.  Found a sub of coke in my backpack from NYC, must of lost it.  I got some coke and slammed it like three weeks ago but was benzoed up.",Gratefulstickers,1427656689.0
cpv1u8w,https://www.reddit.com/r/opiates/comments/30q0po/junkie_jesus_shines_on_me/,t3_30q0po,"This is exactly why I don't believe in your Junkie Jesus. I believe in the party gods rather.

Edit: The best part of the story was the quantity found. Nothing worse than having only enough coke to piss you off and hunt down your dealer.",slimbender,1427678263.0
cpup6io,https://www.reddit.com/r/opiates/comments/30q0po/junkie_jesus_shines_on_me/,t3_30q0po,"Hell yea man, bonus. That's good stuff. I had good luck today also:

Made the call and asked if she would do 8 for 60 and let me owe her 10, she says no problem. We meet and I pull in a parking lot to get right, lo and behold she had given me 9. Needless to say, I was pretty stoked.",thatBLACKDREADtho,1427655525.0
cpupuwl,https://www.reddit.com/r/opiates/comments/30q0po/junkie_jesus_shines_on_me/,t3_30q0po,Finally...a real JJ story ,DootDotDittyOtt,1427656813.0
cpv3tln,https://www.reddit.com/r/opiates/comments/30q0po/junkie_jesus_shines_on_me/,t1_cpupuwl,"""JJ bathed me in his holy dope loveliness today! My check came from work and when I hit up my dboy he said I could come thru! And then I only had to wait 30 minutes! Oh thank you Junkie Jesus!""",Trance_Forming,1427681531.0
