eg6kjnw,https://www.reddit.com/r/opiates/comments/ap919g/no_more_11mg/,t3_ap919g,"I don’t sell or buy, but until the supply goes up or demand goes down, this is what you have.  ",typhoidmarry,1549836476.0
eg6lek9,https://www.reddit.com/r/opiates/comments/ap919g/no_more_11mg/,t3_ap919g,Then good luck finding any oxy lol ,Alprazolama,1549837116.0
eg6u7or,https://www.reddit.com/r/opiates/comments/ap919g/no_more_11mg/,t3_ap919g,Why do you think we do heroin lmao,vulpes_inculta2281,1549844234.0
eg6o0nn,https://www.reddit.com/r/opiates/comments/ap919g/no_more_11mg/,t3_ap919g,"In my area a $1 a mg is pretty much the standard... 

some dude literally once offered me 7.5 hydros for $15 a piece......",Common_lozer007,1549839122.0
eg735n1,https://www.reddit.com/r/opiates/comments/ap919g/no_more_11mg/,t3_ap919g,"About 8 yrs ago a neighbor told me his buddy had vicodin 5mgs for 1.50 each and if I got  50 or more could I get them for 1 $each so we go and get 50 of them neighbor gets back in the car hands them to me and they are round yellow with 230 on the back I knee they were percocet 10s so I play it cool drive back and am like ""yeah if there are some more in the morning I'll prolly grab some more just so I have them"" next day went and got the other 70 greatest come up ever..",percs3forme1foru,1549851851.0
eg6mzdm,https://www.reddit.com/r/opiates/comments/ap919g/no_more_11mg/,t3_ap919g,That’s just how it is meng. If you want opiates for cheap u gonna have to buy h lol. If you want pills you gotta pay the piper,BnMStreetOfficial,1549838323.0
eg6p2x5,https://www.reddit.com/r/opiates/comments/ap919g/no_more_11mg/,t3_ap919g,I saw this forum where this dude said that back in the day he used to sell OC 80s for $8 bucks a pop!!!! Can you fuckin believe it lol,tkoextracts,1549839969.0
eg6te6f,https://www.reddit.com/r/opiates/comments/ap919g/no_more_11mg/,t3_ap919g,Bro I knew I wasent that addicted as bad as i thought when ppl say 60 for a 30.that's. What they. Get in Wyoming,mike117kiser,1549843525.0
eg6vnba,https://www.reddit.com/r/opiates/comments/ap919g/no_more_11mg/,t3_ap919g,When i did OCs it was 20 for a 40. ,CAP0NE666,1549845488.0
eg6z2ot,https://www.reddit.com/r/opiates/comments/ap919g/no_more_11mg/,t3_ap919g,I miss when it was .50 cent/mg,mdyguy,1549848447.0
eg70x6r,https://www.reddit.com/r/opiates/comments/ap919g/no_more_11mg/,t3_ap919g,It’s only going up my dude. You can always switch to the cheaper stuff! :),OpiCyde,1549849993.0
eg732gm,https://www.reddit.com/r/opiates/comments/ap919g/no_more_11mg/,t3_ap919g,Oxy 30’s are 45-50 here in small town Kentucky and have been at least 40/each since 2010. Opana is $3/mg. ,Sharimau,1549851776.0
eg6pmse,https://www.reddit.com/r/opiates/comments/ap919g/no_more_11mg/,t3_ap919g,YES. WE. CAN. This is change I can believe in. ,nomattawut,1549840416.0
eg6natp,https://www.reddit.com/r/opiates/comments/ap919g/no_more_11mg/,t3_ap919g,feel bad for you muricans man.  paying literally 10 times more than what i paid.,df118s,1549838571.0
eg6wrad,https://www.reddit.com/r/opiates/comments/ap919g/no_more_11mg/,t3_ap919g,Oxys $/mg in Australia lol only thing priced closely to the US,Blissy78,1549846447.0
eg74mg2,https://www.reddit.com/r/opiates/comments/ap919g/no_more_11mg/,t3_ap919g,Lol you just a broke bitch,MusicManGraham,1549853088.0
eg75clq,https://www.reddit.com/r/opiates/comments/ap919g/no_more_11mg/,t3_ap919g,"Lmao up here in a small town in Minnesota there’s nothing but shitty tar that doesn’t even get you feeling good. Cut with so much that 1/3 of it is aacutally tar all we have is a weed, xans, and adderall",opiaphoria,1549853688.0
eg75fgk,https://www.reddit.com/r/opiates/comments/ap919g/no_more_11mg/,t3_ap919g,Once everyone changes to  dope then  the price will drop. ,nicklarge,1549853754.0
eg75msx,https://www.reddit.com/r/opiates/comments/ap919g/no_more_11mg/,t3_ap919g,Oc80 used to be 5$ for me. Then the younger generation got em and couldn’t handle it and it fucked it up for everybody. Even the people that actually need it. ,nicklarge,1549853924.0
eg76cpy,https://www.reddit.com/r/opiates/comments/ap919g/no_more_11mg/,t3_ap919g,I had a plug that would sell me oxy 20s for $10 though that is rare and sadly at the time I didn’t realize just how good of a deal I was getting :( ,tinydicktussin,1549854518.0
eg76o0z,https://www.reddit.com/r/opiates/comments/ap919g/no_more_11mg/,t3_ap919g,"Quick question to people who gets hydromorphine recently. What's the going rate per MG, don't tell me what you used to get it for years ago",Barzsnotbraws,1549854773.0
eg77dmd,https://www.reddit.com/r/opiates/comments/ap919g/no_more_11mg/,t3_ap919g,The cost of being an addict is always too damn high!,Brentwood_Bro,1549855355.0
eg79ixc,https://www.reddit.com/r/opiates/comments/ap919g/no_more_11mg/,t3_ap919g,onions...not the ones that make you cry,THE6THSENSE,1549857141.0
eg7c1sd,https://www.reddit.com/r/opiates/comments/ap919g/no_more_11mg/,t3_ap919g,Nah. The people charging $1/mg for pressed fent pills and passing them off as the real thing are the fucking criminals in my book.,SupWitChoo,1549859286.0
eg6qefh,https://www.reddit.com/r/opiates/comments/ap919g/no_more_11mg/,t3_ap919g,Lmao if I get it cheap it'll be cheap and if I pay extra I still need to make my money,ChillStonerBro420,1549841038.0
eg6qy76,https://www.reddit.com/r/opiates/comments/ap919g/no_more_11mg/,t3_ap919g,I was born too late sigh ,tkoextracts,1549841492.0
eg6qfof,https://www.reddit.com/r/opiates/comments/ap919g/no_more_11mg/,t3_ap919g,"That's the market fucking price idiot

They charge what retards are willing to pay. It was cheaper when the supply was greater. Suck it up and start banging dope lol. ",CAPS_LOCK_USERNAME,1549841066.0
eg6llkq,https://www.reddit.com/r/opiates/comments/ap919g/no_more_11mg/,t1_eg6lek9,"Right as much as I agree w OP what can you do to change it besides stop buying and then some young kid will pay 1.50 a mg and just keep getting prices increased.

We all hate paying what we pay but it’s the world we live in.",Opis-N-H0ES,1549837263.0
eg6qst9,https://www.reddit.com/r/opiates/comments/ap919g/no_more_11mg/,t1_eg6o0nn,"the casual 100% markup 

when people paying retail price fancy themselves dealers I always laugh",CAPS_LOCK_USERNAME,1549841366.0
eg6sewv,https://www.reddit.com/r/opiates/comments/ap919g/no_more_11mg/,t1_eg6p2x5,I used to get the original stop sign 40mg Opanas for $8-$12 a pop,clickclvck,1549842700.0
eg6wdt3,https://www.reddit.com/r/opiates/comments/ap919g/no_more_11mg/,t1_eg6p2x5,"Yeah, there was a time where they just weren't known like that. So many people in their 30s now have stories about having dealt with pain pills on like a vicodin level, and laughed at the idea of ""only doing half a pill"". I don't think people realized their value relative to other pills for a while. There'd almost always be someone who knew what they were worth that would buy the whole script up every month though. ",valuum,1549846127.0
eg7451p,https://www.reddit.com/r/opiates/comments/ap919g/no_more_11mg/,t1_eg6p2x5,"I used to buy them for $5 ... sell them for whatever...that was in fla., back around 2000                                            of course the man died. I miss you Jimbo...R.I.P.",the60sdrummer,1549852682.0
eg6qn9n,https://www.reddit.com/r/opiates/comments/ap919g/no_more_11mg/,t1_eg6p2x5,100% we were getting them for 5 a piece ,BlazenHawaiian,1549841238.0
eg6qkw3,https://www.reddit.com/r/opiates/comments/ap919g/no_more_11mg/,t1_eg6p2x5,"Yes, everyone and their mother used to have a script. I wasn't paying more than $10. The fact that you idiots continue to buy oxy at $1+/mg doesn't surprise me at all when the same retards are 'smoking' a fucking pill.

Enjoy your fent pressed roxis lmao. ",CAPS_LOCK_USERNAME,1549841184.0
eg7568a,https://www.reddit.com/r/opiates/comments/ap919g/no_more_11mg/,t1_eg70x6r,Not my cup of tea unfortunately ,tkoextracts,1549853543.0
eg6zmu3,https://www.reddit.com/r/opiates/comments/ap919g/no_more_11mg/,t1_eg6pmse,Make America great again eh,87_Till_Infinity,1549848926.0
eg6q8ji,https://www.reddit.com/r/opiates/comments/ap919g/no_more_11mg/,t1_eg6natp,What country? Uk?,Throwawaydopeaway7,1549840906.0
eg75453,https://www.reddit.com/r/opiates/comments/ap919g/no_more_11mg/,t1_eg6wrad,I heard h is like 60 a tenth in Australia and come goes for like $3/400 us over there. A dude from Melbourne told me that.,MusicManGraham,1549853495.0
eg6mabe,https://www.reddit.com/r/opiates/comments/ap919g/no_more_11mg/,t1_eg6llkq,"Plus the people litteraly risking their freedom just to probably make 25-50 cent per mg lol 

I agree I hate the price, but like you said there are kids who are gonna over pay for them and fuck the prices even more. ",Alprazolama,1549837787.0
eg74x2n,https://www.reddit.com/r/opiates/comments/ap919g/no_more_11mg/,t1_eg6sewv,Man that’s awesome. They run 100-120 for a single pan 40 where I’m at. With my tolerance I can do a 80mgs of pan and only thing it would do is get me unsick.,MusicManGraham,1549853333.0
eg6ztav,https://www.reddit.com/r/opiates/comments/ap919g/no_more_11mg/,t1_eg6zmu3,Make 80s Cheap Again. MECA. Or M8CA,nomattawut,1549849076.0
eg6qn27,https://www.reddit.com/r/opiates/comments/ap919g/no_more_11mg/,t1_eg6q8ji,"yeah UK  on the DNM's.   usually get UK Toroxycon 40's for £4 an OC40. 

or EU OC80's  - used to be dutch ones but a lot of german ones now. about 10 euro an OC80.

Why are prices in the USA so high?  is it because everyone uses opiates over there?  nobody really uses them here.  people are more into their coke or weed, and the LGBT's use meth. ",df118s,1549841233.0
eg75sxw,https://www.reddit.com/r/opiates/comments/ap919g/no_more_11mg/,t1_eg75453,Yeah you can get it for 50/point with some discounts on bigger amts from the right people. I usually pay 50 for very nice strong China white #4 rocks and never came across fent AFAIK. Most of our h/meth comes from SE Asia due to the close proximity though a lot of meth is made locally ,Blissy78,1549854067.0
eg6n2an,https://www.reddit.com/r/opiates/comments/ap919g/no_more_11mg/,t1_eg6mabe,"When I have things if I’m not making double I’m not getting off my couch, the whole make 90.00 off 90 pills are long gone for me. The DNM is your friend lol",Opis-N-H0ES,1549838384.0
eg6tnfx,https://www.reddit.com/r/opiates/comments/ap919g/no_more_11mg/,t1_eg6qn27,"Damn, solid prices. I bet if they were that cheap over here less people would be dying using fent instead. I’ve never ordered pills of the dnm myself, only fentanyl which came from the UK till the guys got busted. Haven’t used the dnm in forever, but I bet our prices are waaaayyyy higher.

I obviously don’t know for sure, but I bet our prices are so high over here because we have sooooooo many people addicted (something like 1/20 I heard). Not to mention we have a crazy amount of police working to stop the supply (something like 1/55 people over here are in some form of law enforcement - not sure if that figure counts military or not). Higher demand - harder to supply in some sense = higher prices. Everyone switched to heroin and started dying when they shut-down pain patients meds. 

I think also, everyone is so afraid of heroin here, people buy pills until they are absolutely desperate, then switch to heroin, raising the prices above what most people can afford...

Here’s a question, why are they so damn cheap in the eu? What is customs like over there?",Throwawaydopeaway7,1549843746.0
eg7544e,https://www.reddit.com/r/opiates/comments/ap919g/no_more_11mg/,t1_eg6tnfx,"I live in the EU and I've been to the UK as well, they're easily double what he's saying. Online as well. Also Toroxycon are a shittier brand that hits worse IME, orally that is.

Cheaper than in the US yes, but you have to factor in dope is normally fent free, and goes for 30-40€/gram. Compare the prices and it's still way more worth than pills. (And better, but shhhh don't spoil it). Lmao

As to why they're cheaper, they usually get sourced/stolen from eastern europe. It's bound to happen that sooner or later the prices will be sky high over here.",xxzcuzxxme,1549853495.0
eg7fvj7,https://www.reddit.com/r/opiates/comments/ap919g/no_more_11mg/,t3_ap919g,"Back in AZ, I have a plug for 20mg oxy that charges me $14 each, and a 15mg plug that charges $12. Sometimes I would get em for $11, just depends how badly she needed cash at that moment. Moved to CA a few months ago but when I go visit AZ best believe I'm going to cop as much as I can before coming back lol",Caguevar,1549862969.0
eg7i25f,https://www.reddit.com/r/opiates/comments/ap919g/no_more_11mg/,t3_ap919g,"If u think $1 mg is bad, make sure never to get into dillaudid. I heard some people  on here pay $3.75 mg for that shit. I pay 1.50 and it still cheeses me",Dilly-dallier,1549865366.0
eg7jqon,https://www.reddit.com/r/opiates/comments/ap919g/no_more_11mg/,t3_ap919g,"Dollar per mg here in San Antonio, TX man. ",BenzoOpiateKindaGuy,1549867428.0
eg7m0x2,https://www.reddit.com/r/opiates/comments/ap919g/no_more_11mg/,t3_ap919g,Supply and demand dude. The price is only going to get higher and higher as the supply gets smaller and demand goes up.,Feern313,1549870555.0
eg7psg8,https://www.reddit.com/r/opiates/comments/ap919g/no_more_11mg/,t3_ap919g,"Why dont you become a dealer then and see how much money you lose out on charging 50 cents or less per mg. I'll be your first customer, I'll take 1000 30s.",Comfycodone,1549876735.0
eg8632j,https://www.reddit.com/r/opiates/comments/ap919g/no_more_11mg/,t3_ap919g,We get the crushable/snortable 80s for 70$ sometimes lol ,Pushoffslow,1549897161.0
eg86uz9,https://www.reddit.com/r/opiates/comments/ap919g/no_more_11mg/,t3_ap919g,"That they are so expensive is batshit insane. I've been out of the pharmacy scene for a few years but as recently as like 2010 oxy30s were like $0.75/each from the pharmacy (without insurance) and like $10 a piece on the street. 

When I hear what they cost now I can't imagine the cost of nursing a full on addiction at that price, makes me shudder. ",look_ma_nohands,1549897756.0
eg8grev,https://www.reddit.com/r/opiates/comments/ap919g/no_more_11mg/,t3_ap919g,Seriously!   My dealer had pressies and still charges a dollar a mg.   Ridiculous ,Thehorrorofraw,1549904291.0
eg97io4,https://www.reddit.com/r/opiates/comments/ap919g/no_more_11mg/,t3_ap919g,Its that price for a reason.  Its not like some dealer just decided they wanted more money.  Shits hard to get.,cozywarmedblanket,1549919487.0
egcuvvp,https://www.reddit.com/r/opiates/comments/ap919g/no_more_11mg/,t3_ap919g,Someone doesn't understand supply and demand....,jdutches13,1550027500.0
eg7oxry,https://www.reddit.com/r/opiates/comments/ap919g/no_more_11mg/,t1_eg6o0nn,"It's like that here but getting a hook up in Sydney is nearly impossible these days. I used to pay $350 a box, 12 a pill.",BA-12A,1549875232.0
eg7csj2,https://www.reddit.com/r/opiates/comments/ap919g/no_more_11mg/,t1_eg7c1sd,I agree with you but charging $1/1mg even for the real deal is still pretty ridiculous ,tkoextracts,1549859953.0
eg7npwp,https://www.reddit.com/r/opiates/comments/ap919g/no_more_11mg/,t1_eg6mzdm,"Where I live H is more expensive than oxy. If you want shit straight off the brick. Half that price if you want cut shit, but street heroin isn't worth fucking with. You pay $100 a point here, yet $350 for a box of 28 80mg oxy's. Although my government replaced all OC with OC OP so now it's impossible to get anyway. I need to find some dodgy indian pharma supplier online or something.",BA-12A,1549873146.0
eg7m7vp,https://www.reddit.com/r/opiates/comments/ap919g/no_more_11mg/,t1_eg6p2x5,Oxy 80s used to be 6-10 bucks each when I was younger. And we thought that was a rip off.,Feern313,1549870839.0
eg7f7e2,https://www.reddit.com/r/opiates/comments/ap919g/no_more_11mg/,t1_eg6z2ot,EU DNM Vendors sell oxy for less than that. My buddy bought 5x 80mg Oxys for $160 shipped. ,spinox,1549862278.0
eg7ms0j,https://www.reddit.com/r/opiates/comments/ap919g/no_more_11mg/,t1_eg735n1,"Holy shit I wonder how that came to be, someone possessing that many pills without knowing what they are. Couldn’t be his script, but couldn’t have bought that many and for so cheap in a deal casual enough to not know what they were either. Weird. ",BrentHatesLife,1549871662.0
eg7ipry,https://www.reddit.com/r/opiates/comments/ap919g/no_more_11mg/,t1_eg76o0z,"You mean hydromorphone (aka Dilaudid) or hydrocodone (aka Vicodin)?

Dilaudid I bought like 80 of the 4mg ones for like 250ish a few years ago, but haven't bought any since. All I ever see are the 8's and those are way too much powder to load 3 in a shot which is what I need. But the 8mg ones I see go for 15-20mg if the person knows what they've got.

Vicodin I don't buy and never will because it's weak AF and i get it for free every once in a while. I once took 25 10/325's and didn't even catch a buzz and that was back when I wasn't even shooting H",donedrone707,1549866145.0
eg7myj2,https://www.reddit.com/r/opiates/comments/ap919g/no_more_11mg/,t1_eg7i25f,It’s stronger though...that’s not really a good comparison ,BrentHatesLife,1549871942.0
eg93frt,https://www.reddit.com/r/opiates/comments/ap919g/no_more_11mg/,t1_eg86uz9,"That feels and sounds like it was only a moment ago, but we have to remind ourselves that that's very close to ten years ago. ",dopeless-hopehead,1549917215.0
eg7mt4r,https://www.reddit.com/r/opiates/comments/ap919g/no_more_11mg/,t1_eg74mg2,"Even if you have money, it’s an expensive ass rate what are you talking about ",BrentHatesLife,1549871709.0
eg7df5p,https://www.reddit.com/r/opiates/comments/ap919g/no_more_11mg/,t1_eg7csj2,"Sure, it’s ridiculously expensive, but that’s what people have been paying for the past couple years now. Frankly, with the decrease in supply, many dealers are charging even more than that lately so $1 is actually reasonable. No one is forcing anyone to buy them.",SupWitChoo,1549860532.0
eg7mjfs,https://www.reddit.com/r/opiates/comments/ap919g/no_more_11mg/,t1_eg6qkw3,"Sounds like you don’t understand addiction very well for someone with an IV habit. Roxies actually smoke really well, just as good as tar. I haven’t done one in over ten years because they got too expensive and I switched to h, but I don’t look down on people fo buying pills. Some areas have pills n no h, some have h n no pills, some people are afraid of making their habit worse by doing dope, and some people just really prefer oxy. Shooting is more efficient but it’s a pretty big change in a lot of other ways including greatly increased health risks, and it only works to get you way higher for a short time till your tolerance goes up and smoking or snorting is no longer an option. I’m not sure what you expect these people to do instead of pay $1/mg, just go without their fix? Cuz you don’t know if anything else is even an option for them. ",BrentHatesLife,1549871307.0
eg9xbu2,https://www.reddit.com/r/opiates/comments/ap919g/no_more_11mg/,t1_eg7ms0j,I'm thinking he thought the apap was the mgs I've had people tell me they had norco 3.25 when and I just roll with it,percs3forme1foru,1549936589.0
eg7mw4a,https://www.reddit.com/r/opiates/comments/ap919g/no_more_11mg/,t1_eg7ipry,Bro how did your liver not fail lmao ,BrentHatesLife,1549871838.0
eg7o178,https://www.reddit.com/r/opiates/comments/ap919g/no_more_11mg/,t1_eg7myj2,True but because its stronger tou build tolerance quicker.  Also its about the same strength  if u eat them and just  slightly  stronger  if u snort em. ,Dilly-dallier,1549873661.0
eg9qb7v,https://www.reddit.com/r/opiates/comments/ap919g/no_more_11mg/,t1_eg93frt,"I guess you're right. It just seems so outrageous. I mean, I understand prices going up some over time but FUCK it just seems so excessive in this case.",look_ma_nohands,1549931566.0
eg81w7f,https://www.reddit.com/r/opiates/comments/ap919g/no_more_11mg/,t1_eg6ztav,Lmaooo,iSweaterGodSeth,1549893591.0
eg8j8dc,https://www.reddit.com/r/opiates/comments/ap919g/no_more_11mg/,t1_eg6ztav,M8ca bro,87_Till_Infinity,1549905803.0
eg7m5ud,https://www.reddit.com/r/opiates/comments/ap919g/no_more_11mg/,t1_eg6n2an,The real crazy thing is how greedy heroin dealers have got after making 1000% profit off the fent analogs a few years ago. People used to be happy making double what they paid but those days are long gone.,Feern313,1549870758.0
eg7tnp7,https://www.reddit.com/r/opiates/comments/ap919g/no_more_11mg/,t1_eg6tnfx,"1st in europe there is no custom beause the Schengen area
2nd in Europe there is no such big pill scene bc opioids are not freely scripted like there in the us",zombilives,1549883623.0
eg7soma,https://www.reddit.com/r/opiates/comments/ap919g/no_more_11mg/,t1_eg7m5ud,"All dealers are greedy, I wouldn’t consider myself a dealer more of a middle and just have a set rate for doing things. It’s too damn hard to find light pharmy now a days to keep the supply n demand ratio in tact",Opis-N-H0ES,1549881926.0
eg7qifr,https://www.reddit.com/r/opiates/comments/ap919g/no_more_11mg/,t1_eg7544e,"well I got mine from the big market, those were the prices about 3 weeks ago. I'm trying to get clean so haven't checked but I doubt they have doubled in 3 weeks. My vendor was DrOxy if I can say that. (unfortunately he goes on vacation sometimes so he is not always on, but when he was on i'd order a lot)

Toroxycon does not work nasally due to the gel, but orally for me it worked just as well as Sandoz OC80's from NL (these OC80's don't have that gel). It is all about what you prefer - it won't give you a quick rush but for me I prefer the sustained high and don't mind waiting 45 minutes for it to kick in. I cut the pills up with scissors then crushed the residue. Then put it on my finger and took it orally with coca cola  to wash it down.  I think when this Toroxycon loophole/leak gets plugged, the prices will rise high then.

Never ordered gear from the streets or online, H isn't my thing, preferred oxy.",df118s,1549878019.0
eg7wkvy,https://www.reddit.com/r/opiates/comments/ap919g/no_more_11mg/,t1_eg7tnp7,yeah it's more cocaine or weed.   the bad drug addicts here went off H and got on SPICE instead,df118s,1549887860.0
eg7vvsa,https://www.reddit.com/r/opiates/comments/ap919g/no_more_11mg/,t1_eg7qifr,Gotchu man. I'm off opiates myself now those were the prices when I bought though. cheers,xxzcuzxxme,1549886953.0
eg7wcn8,https://www.reddit.com/r/opiates/comments/ap919g/no_more_11mg/,t1_eg7vvsa,"bitcoin fluctuates bad, I know a few years ago Oxy prices were absolutely insane even in the EU. I was buying dihydrocodeine instead as DHC was much cheaper and did the trick for me.  But about 6 months ago, maybe because of the US crackdown,  the DNM's were flooded with UK oxy.  2 years ago I don't think a single UK vendor sold OXY, if they did a single Oxycodone 20mg tablet cost £30.  

Now there are loads of them. Even cannabis vendors were selling Oxy.  For some reason the Dihydrocodeine all dried up, so I ended up buying oxycodone instead.  

How long you been off man?  good call getting clean. I am only day 17 clean.",df118s,1549887568.0
eg8fyum,https://www.reddit.com/r/opiates/comments/ap919g/no_more_11mg/,t1_eg7wcn8,"Only 4 weeks so far, so not much, we're like the same timewise. Congrats!

I was also copping a lot of dihydro a couple years back when it was mad cheap. You can still get it for the sameish price im sure.

After doing oxys it went downhill and me starting to fuck with dope made me rethink about the extent of my usage. I wish I had never moved from stuff like codeine and trams. Your body isnt supposed to be receiving so much pleasure for ""free"".

Just trying to enjoy life again can be difficult as hell. But well pull thru as many relapses as it takes.",xxzcuzxxme,1549903805.0
